"1907.07773","Matthias Yang He","Matthias Y. He, Eric B. Ford, and Darin Ragozzine","Architectures of Exoplanetary Systems. I: A Clustered Forward Model for
  Exoplanetary Systems around Kepler's FGK Stars","Published in MNRAS, 31 pages, 9 figures, plus supplemental online
  materials with 7 figures","Monthly Notices of the Royal Astronomical Society, 2019, 490,
  4575-4605","10.1093/mnras/stz2869",,"astro-ph.EP","http://arxiv.org/licenses/nonexclusive-distrib/1.0/","  Observations of exoplanetary systems provide clues about the intrinsic
distribution of planetary systems, their architectures, and how they formed. We
develop a forward modelling framework for generating populations of planetary
systems and ""observed"" catalogues by simulating the Kepler detection pipeline
(SysSim). We compare our simulated catalogues to the Kepler DR25 catalogue of
planet candidates, updated to include revised stellar radii from Gaia DR2. We
constrain our model based on the observed 1D marginal distributions of orbital
periods, period ratios, transit depths, transit depth ratios, transit
durations, transit duration ratios, and transit multiplicities. Models assuming
planets with independent periods and sizes do not adequately account for the
properties of the multiplanet systems. Instead, a clustered point process model
for exoplanet periods and sizes provides a significantly better description of
the Kepler population, particularly the observed multiplicity and period ratio
distributions. We find that $0.56^{+0.18}_{-0.15}$ of FGK stars have at least
one planet larger than $0.5 R_\oplus$ between 3 and 300 d. Most of these
planetary systems ($\sim 98\%$) consist of one or two clusters with a median of
three planets per cluster. We find that the Kepler dichotomy is evidence for a
population of highly inclined planetary systems and is unlikely to be solely
due to a population of intrinsically single planet systems. We provide a large
ensemble of simulated physical and observed catalogues of planetary systems
from our models, as well as publicly available code for generating similar
catalogues given user-defined parameters.
","[{""version"":""v1"",""created"":""Wed, 17 Jul 2019 21:08:45 GMT""},{""version"":""v2"",""created"":""Thu, 14 Nov 2019 23:03:52 GMT""}]","2019-11-18"
"1907.07776","Eduardo Olmedo Sanchez","Eduardo Olmedo Sanchez, Xian-He Sun","CADS: Core-Aware Dynamic Scheduler for Multicore Memory Controllers",,,,,"cs.AR cs.LG","http://arxiv.org/licenses/nonexclusive-distrib/1.0/","  Memory controller scheduling is crucial in multicore processors, where DRAM
bandwidth is shared. Since increased number of requests from multiple cores of
processors becomes a source of bottleneck, scheduling the requests efficiently
is necessary to utilize all the computing power these processors offer.
However, current multicore processors are using traditional memory controllers,
which are designed for single-core processors. They are unable to adapt to
changing characteristics of memory workloads that run simultaneously on
multiple cores. Existing schedulers may disrupt locality and bank parallelism
among data requests coming from different cores. Hence, novel memory
controllers that consider and adapt to the memory access characteristics, and
share memory resources efficiently and fairly are necessary. We introduce
Core-Aware Dynamic Scheduler (CADS) for multicore memory controller. CADS uses
Reinforcement Learning (RL) to alter its scheduling strategy dynamically at
runtime. Our scheduler utilizes locality among data requests from multiple
cores and exploits parallelism in accessing multiple banks of DRAM. CADS is
also able to share the DRAM while guaranteeing fairness to all cores accessing
memory. Using CADS policy, we achieve 20% better cycles per instruction (CPI)
in running memory intensive and compute intensive PARSEC parallel benchmarks
simultaneously, and 16% better CPI with SPEC 2006 benchmarks.
","[{""version"":""v1"",""created"":""Wed, 17 Jul 2019 21:14:24 GMT""}]","2019-07-19"
"1907.07777","Daniel Thorngren","Daniel P. Thorngren, Peter Gao, Jonathan J. Fortney","The Intrinsic Temperature and Radiative-Convective Boundary Depth in the
  Atmospheres of Hot Jupiters","6 pages, 4 figures, accepted to ApJ Letters. This version corrects
  the constants in equation 3; our calculations used the form in equation 2, so
  none of our other results are changed. An corresponding erratum has been
  submitted to ApJ Letters",,"10.3847/2041-8213/ab43d0",,"astro-ph.EP","http://arxiv.org/licenses/nonexclusive-distrib/1.0/","  In giant planet atmosphere modelling, the intrinsic temperature
$T_\mathrm{int}$ and radiative-convective boundary (RCB) are important lower
boundary conditions. Often in one-dimensional radiative-convective models and
in three-dimensional general circulation models it is assumed that
$T_\mathrm{int}$ is similar to that of Jupiter itself, around 100 K, which
yields a RCB around 1 kbar for hot Jupiters. In this work, we show that the
inflated radii, and hence high specific entropy interiors, of hot Jupiters
suggest much higher $T_\mathrm{int}$ values. Assuming the effect is primarily
due to current heating (rather than delayed cooling), we derive an equilibrium
relation between $T_\mathrm{eq}$ and $T_\mathrm{int}$, showing that the latter
can take values as high as 700 K. In response, the RCB moves upward in the
atmosphere. Using one-dimensional radiative-convective atmosphere models, we
find RCBs of only a few bars, rather than the kilobar typically supposed. This
much shallower RCB has important implications for the atmospheric structure,
vertical and horizontal circulation, interpretations of phase curves, and the
effect of deep cold traps on cloud formation.
","[{""version"":""v1"",""created"":""Wed, 17 Jul 2019 21:19:30 GMT""},{""version"":""v2"",""created"":""Wed, 11 Sep 2019 19:44:25 GMT""},{""version"":""v3"",""created"":""Wed, 15 Jan 2020 18:52:09 GMT""}]","2020-01-16"
"1907.07778","Eisa Alanazi","Abdulaziz Alashaikh, Eisa Alanazi and Ala Al-Fuqaha","A Survey on the Use of Preferences for Virtual Machine Placement in
  Cloud Data Centers","40 pages, 5 figures, 6 tables",,,,"cs.DC cs.AI cs.NI","http://creativecommons.org/licenses/by/4.0/","  With the rapid development of virtualization techniques, cloud data centers
allow for cost effective, flexible, and customizable deployments of
applications on virtualized infrastructure. Virtual machine (VM) placement aims
to assign each virtual machine to a server in the cloud environment. VM
Placement is of paramount importance to the design of cloud data centers.
Typically, VM placement involves complex relations and multiple design factors
as well as local policies that govern the assignment decisions. It also
involves different constituents including cloud administrators and customers
that might have disparate preferences while opting for a placement solution.
Thus, it is often valuable to not only return an optimized solution to the VM
placement problem but also a solution that reflects the given preferences of
the constituents. In this paper, we provide a detailed review on the role of
preferences in the recent literature on VM placement. We further discuss key
challenges and identify possible research opportunities to better incorporate
preferences within the context of VM placement.
","[{""version"":""v1"",""created"":""Wed, 17 Jul 2019 21:22:27 GMT""},{""version"":""v2"",""created"":""Sat, 20 Jul 2019 11:23:33 GMT""},{""version"":""v3"",""created"":""Thu, 16 Jan 2020 23:11:29 GMT""}]","2020-01-22"
"1907.07779","Jungsoo Kang","Alberto Abbondandolo, Jungsoo Kang","Symplectic homology of convex domains and Clarke's duality","80 pages, v2: corrections in the proof of Lemma A.3, Appendix B added",,,,"math.SG","http://arxiv.org/licenses/nonexclusive-distrib/1.0/","  We prove that the Floer complex that is associated with a convex Hamiltonian
function on $\mathbb{R}^{2n}$ is isomorphic to the Morse complex of Clarke's
dual action functional that is associated with the Fenchel-dual Hamiltonian.
This isomorphism preserves the action filtrations. As a corollary, we obtain
that the symplectic capacity from the symplectic homology of a convex domain
with smooth boundary coincides with the minimal action of closed
characteristics on its boundary.
","[{""version"":""v1"",""created"":""Wed, 17 Jul 2019 21:27:22 GMT""},{""version"":""v2"",""created"":""Sat, 20 Mar 2021 05:14:31 GMT""}]","2021-03-23"
"1907.07780","Mohsen Falamarzi Askarani","Mohsen Falamarzi Askarani, Thomas Lutz, Marcelli Grimau Puigibert,
  Neil Sinclair, Daniel Oblak, Wolfgang Tittel","Persistent atomic frequency comb based on Zeeman sub-levels of an
  erbium-doped crystal waveguide","7 pages, 5 figures","JOSA B 37.2 (2020): 352-358","10.1364/JOSAB.373100",,"quant-ph","http://arxiv.org/licenses/nonexclusive-distrib/1.0/","  Long-lived sub-levels of the electronic ground-state manifold of rare-earth
ions in crystals can be used as atomic population reservoirs for photon
echo-based quantum memories. We measure the dynamics of the Zeeman sub-levels
of erbium ions that are doped into a lithium niobate waveguide, finding
population lifetimes at cryogenic temperatures as long as seconds. Then, using
these levels, we prepare and characterize atomic frequency combs, which can
serve as a memory for quantum light at 1532 nm wavelength. The results allow
predicting a 0.1\% memory efficiency, mainly limited by unwanted background
absorption that we conjecture to be caused by the coupling between two-level
systems (TLS) and erbium spins. Hence, while it should be possible to create an
AFC-based quantum memory in Er$^{3+}$:Ti$^{3+}$:LiNbO$_3$, improved crystal
growth together with optimized AFC preparation will be required to make it
suitable for applications in quantum communication.
","[{""version"":""v1"",""created"":""Wed, 17 Jul 2019 21:29:58 GMT""},{""version"":""v2"",""created"":""Fri, 19 Jul 2019 15:47:38 GMT""}]","2020-05-08"
"1907.07781","Matti Dorsch","Matti Dorsch, Marilyn Latour, Ulrich Heber","Heavy metals in intermediate He-rich hot subdwarfs: The chemical
  composition of HZ44 and HD127493","Accepted for publication in Astronomy & Astrophysics","A&A 630, A130 (2019)","10.1051/0004-6361/201935724",,"astro-ph.SR","http://arxiv.org/licenses/nonexclusive-distrib/1.0/","  Hot subluminous stars can be spectroscopically classified as subdwarf B (sdB)
and O (sdO) stars. While the latter are predominantly hydrogen deficient, the
former are mostly helium deficient. The atmospheres of most sdOs are almost
devoid of hydrogen, whereas a small group of hot subdwarf stars of mixed H/He
composition exists, showing extreme metal abundance anomalies. Whether such
intermediate helium-rich (iHe) subdwarf stars provide an evolutionary link
between the dominant classes is an open question. The presence of strong Ge,
Sn, and Pb lines in the UV spectrum of HZ$\,$44 suggests a strong enrichment of
heavy elements in this iHe-sdO star and calls for a detailed quantitative
spectral analysis focusing on trans-iron elements. Non-LTE model atmospheres
calculated with TLUSTY are combined with high-quality optical, UV and FUV
spectra of HZ$\,$44 and its hotter sibling HD$\,$127493 to determine their
atmospheric parameters and metal abundance patterns. By collecting atomic data
from literature we succeeded to determine abundances of 29 metals in HZ$\,$44,
including the trans-iron elements Ga, Ge, As, Se, Zr, Sn, and Pb and provide
upper limits for 10 other metals. This makes it the best described hot subdwarf
in terms of chemical composition. For HD$\,$127493 the abundance of 15 metals,
including Ga, Ge, and Pb and upper limits for another 16 metals were derived.
Heavy elements turn out to be overabundant by one to four orders of magnitude
with respect to the Sun. Zr and Pb are among the most enriched elements. The C,
N, and O abundance for both stars can be explained by nucleosynthesis of
hydrogen burning in the CNO cycle along with their helium enrichment. On the
other hand, the heavy-element anomalies are unlikely to be caused by
nucleosynthesis. Instead diffusion processes are evoked with radiative
levitation overcoming gravitational settlement of the heavy elements.
","[{""version"":""v1"",""created"":""Wed, 17 Jul 2019 21:32:57 GMT""}]","2019-10-09"
"1907.07782","Alexander Kupers","Jeffrey Giansiracusa, Alexander Kupers, Bena Tshishiku","Characteristic classes of bundles of K3 manifolds and the Nielsen
  realization problem","12 pages","Tunisian J. Math. 3 (2021) 75-92","10.2140/tunis.2021.3.75",,"math.AT math.GT math.KT","http://arxiv.org/licenses/nonexclusive-distrib/1.0/","  Let $K$ be the K3 manifold. In this note, we discuss two methods to prove
that certain generalized Miller--Morita--Mumford classes for smooth bundles
with fiber $K$ are non-zero. As a consequence, we fill a gap in a paper of the
first author, and prove that the homomorphism $Diff(K)\to \pi_0 Diff(K)$ does
not split. One of the two methods of proof uses a result of Franke on the
stable cohomology of arithmetic groups that strengthens work of Borel, and may
be of independent interest.
","[{""version"":""v1"",""created"":""Wed, 17 Jul 2019 21:36:56 GMT""},{""version"":""v2"",""created"":""Fri, 13 Dec 2019 02:50:13 GMT""}]","2020-06-03"
"1907.07783","Bernhard Egger","Bernhard Egger, Markus D. Schirmer, Florian Dubost, Marco J. Nardin,
  Natalia S. Rost, Polina Golland","Patient-specific Conditional Joint Models of Shape, Image Features and
  Clinical Indicators","Supplementary material: https://www.youtube.com/watch?v=gPoHP_iFQIA","MICCAI 2019, the 22nd International Conference on Medical Image
  Computing and Computer Assisted Intervention, in Shenzhen, China",,,"eess.IV cs.CG cs.CV cs.LG","http://creativecommons.org/licenses/by-nc-sa/4.0/","  We propose and demonstrate a joint model of anatomical shapes, image features
and clinical indicators for statistical shape modeling and medical image
analysis. The key idea is to employ a copula model to separate the joint
dependency structure from the marginal distributions of variables of interest.
This separation provides flexibility on the assumptions made during the
modeling process. The proposed method can handle binary, discrete, ordinal and
continuous variables. We demonstrate a simple and efficient way to include
binary, discrete and ordinal variables into the modeling. We build Bayesian
conditional models based on observed partial clinical indicators, features or
shape based on Gaussian processes capturing the dependency structure. We apply
the proposed method on a stroke dataset to jointly model the shape of the
lateral ventricles, the spatial distribution of the white matter hyperintensity
associated with periventricular white matter disease, and clinical indicators.
The proposed method yields interpretable joint models for data exploration and
patient-specific statistical shape models for medical image analysis.
","[{""version"":""v1"",""created"":""Wed, 17 Jul 2019 21:49:29 GMT""}]","2019-09-10"
"1907.07784","Bo Yuan","Bo Yuan, Nicholas P. Butch, Guangyong Xu, Barry Winn, J. P. Clancy and
  Young-June Kim","Neutron Scattering Study of Magnetic Anisotropy in a Tetragonal
  Antiferromagnet Bi$_2$CuO$_4$","This version differs significantly from our previous submission
  (ArXiv: 1907.07784). It includes new thermal neutron measurement and
  additional spin-wave calculations. The paper has been accepted by PRB",,,,"cond-mat.str-el","http://arxiv.org/licenses/nonexclusive-distrib/1.0/","  We present a comprehensive study of magnon excitations in the tetragonal
easy-plane anti-ferromagnet Bi$_2$CuO$_4$ using inelastic neutron scattering
and spin wave analyses. The nature of low energy magnons, and hence the
anisotropy in this material, has been controversial. We show unambiguously that
the low energy magnon spectrum consists of a gapped and a gapless mode, which
we attribute to out-of-plane and in-plane spin fluctuations, respectively. We
modelled the observed magnon spectrum using linear spin wave analysis of a
minimal anisotropic spin model motivated by the lattice symmetry. By studying
the magnetic field dependence of the (1, 0, 0) Bragg peak intensity and the
in-plane magnon intensity, we observed a spin-flop transition in the $ab$ plane
at $\sim0.4$~T which directly indicates the existence of a small in-plane
anisotropy that is classically forbidden. It is only by taking into account
magnon zero-point fluctuations beyond the linear spin wave approximation, we
could explain this in-plane anisotropy and its magnitude, the latter of which
is deduced from critical field of the spin-flop transition. The microscopic
origins of the observed anisotropic interactions are also discussed. We found
that our data is inconsistent with a large Dzyaloshinskii-Moriya interaction,
which suggests a potential departure of Bi$_2$CuO$_4$ from the conventional
theories of magnetic anisotropy for other cuprates.
","[{""version"":""v1"",""created"":""Wed, 17 Jul 2019 21:54:30 GMT""},{""version"":""v2"",""created"":""Mon, 12 Apr 2021 19:15:50 GMT""}]","2021-04-14"
"1907.07785","Denis Vasiukov M.","Denis M. Vasiukov, Mikhail Kareev, Fangdi Wen, Liang Wu, Padraic
  Shafer, Elke Arenholz, Xiaoran Liu and Jak Chakhalian","Epitaxial stabilization of thin films of the frustrated Ge-based spinels",,,"10.1103/PhysRevMaterials.5.064419",,"cond-mat.str-el","http://arxiv.org/licenses/nonexclusive-distrib/1.0/","  Frustrated magnets can host numerous exotic many-body quantum and topological
phenomena. GeNi$_2$O$_4$ is a three dimensional $S=1$ frustrated magnet with an
unusual two-stage transition to the two-dimensional antiferromagnetic ground
state, while GeCu$_2$O$_4$ is a high-pressure phase with a strongly
tetragonally elongated spinel structure and magnetic lattice formed by $S=1/2$
CuO$_2$ linear chains with frustrated exchange interactions and exotic magnetic
behavior. Here we report on the first thin-film epitaxial stabilization of
these two compounds. Developed growth mode, surface morphology, crystal
structure and copper valence state were characterized by in-situ reflection
high-energy electron diffraction, atomic force microscopy, X-ray reflectivity,
X-ray diffraction, X-ray photoelectron spectroscopy and resonant X-ray
absorption spectroscopy. Our results pave an alternative route to the
comprehensive investigation of the puzzling magnetic properties of these
compounds and exploration of novel emergent features driven by strain.
","[{""version"":""v1"",""created"":""Wed, 17 Jul 2019 21:55:16 GMT""},{""version"":""v2"",""created"":""Fri, 20 Nov 2020 20:51:54 GMT""},{""version"":""v3"",""created"":""Tue, 22 Jun 2021 13:28:02 GMT""}]","2021-06-30"
"1907.07786","Alex Burnap","Alex Burnap, John R. Hauser, Artem Timoshenko","Product Aesthetic Design: A Machine Learning Augmentation",,,,,"cs.LG cs.CV econ.EM stat.ML","http://creativecommons.org/licenses/by/4.0/","  Aesthetics are critically important to market acceptance. In the automotive
industry, an improved aesthetic design can boost sales by 30% or more. Firms
invest heavily in designing and testing aesthetics. A single automotive ""theme
clinic"" can cost over $100,000, and hundreds are conducted annually. We propose
a model to augment the commonly-used aesthetic design process by predicting
aesthetic scores and automatically generating innovative and appealing product
designs. The model combines a probabilistic variational autoencoder (VAE) with
adversarial components from generative adversarial networks (GAN) and a
supervised learning component. We train and evaluate the model with data from
an automotive partner-images of 203 SUVs evaluated by targeted consumers and
180,000 high-quality unrated images. Our model predicts well the appeal of new
aesthetic designs-43.5% improvement relative to a uniform baseline and
substantial improvement over conventional machine learning models and
pretrained deep neural networks. New automotive designs are generated in a
controllable manner for use by design teams. We empirically verify that
automatically generated designs are (1) appealing to consumers and (2) resemble
designs which were introduced to the market five years after our data were
collected. We provide an additional proof-of-concept application using
opensource images of dining room chairs.
","[{""version"":""v1"",""created"":""Wed, 17 Jul 2019 21:56:55 GMT""},{""version"":""v2"",""created"":""Tue, 15 Nov 2022 05:00:09 GMT""}]","2022-11-16"
"1907.07787","Sultan Hassan","Sultan Hassan (NMSU/UWC), Sambatra Andrianomena (SARAO/UWC), Caitlin
  Doughty (NMSU)","Constraining the astrophysics and cosmology from 21cm tomography using
  deep learning with the SKA","Accepted for publication in MNRAS",,"10.1093/mnras/staa1151",,"astro-ph.CO astro-ph.GA astro-ph.IM","http://arxiv.org/licenses/nonexclusive-distrib/1.0/","  Future Square Kilometre Array (SKA) surveys are expected to generate huge
datasets of 21cm maps on cosmological scales from the Epoch of Reionization
(EoR). We assess the viability of exploiting machine learning techniques,
namely, convolutional neural networks (CNN), to simultaneously estimate the
astrophysical and cosmological parameters from 21cm maps from semi-numerical
simulations. We further convert the simulated 21cm maps into SKA-like mock maps
using the detailed SKA antennae distribution, thermal noise and a recipe for
foreground cleaning. We successfully design two CNN architectures (VGGNet-like
and ResNet-like) that are both efficiently able to extract simultaneously three
astrophysical parameters, namely the photon escape fraction (f$_{\rm esc}$),
the ionizing emissivity power dependence on halo mass ($C_{\rm ion}$) and the
ionizing emissivity redshift evolution index ($D_{\rm ion}$), and three
cosmological parameters, namely the matter density parameter ($\Omega_{m}$),
the dimensionless Hubble constant ($h$), and the matter fluctuation amplitude
($\sigma_{8}$), from 21cm maps at several redshifts. With the presence of noise
from SKA, our designed CNNs are still able to recover these astrophysical and
cosmological parameters with great accuracy ($R^{2} > 92\%$), improving to
$R^{2} > 99\%$ towards low redshift and low neutral fraction values. Our
results show that future 21cm observations can play a key role to break
degeneracy between models and tightly constrain the astrophysical and
cosmological parameters, using only few frequency channels.
","[{""version"":""v1"",""created"":""Wed, 17 Jul 2019 21:59:04 GMT""},{""version"":""v2"",""created"":""Tue, 21 Apr 2020 14:20:41 GMT""}]","2020-05-13"
"1907.07788","Sheng Zhang","Sheng Zhang, Guang Lin","SubTSBR to tackle high noise and outliers for data-driven discovery of
  differential equations",,,,,"stat.ML cs.LG","http://arxiv.org/licenses/nonexclusive-distrib/1.0/","  Data-driven discovery of differential equations has been an emerging research
topic. We propose a novel algorithm subsampling-based threshold sparse Bayesian
regression (SubTSBR) to tackle high noise and outliers. The subsampling
technique is used for improving the accuracy of the Bayesian learning
algorithm. It has two parameters: subsampling size and the number of
subsamples. When the subsampling size increases with fixed total sample size,
the accuracy of our algorithm goes up and then down. When the number of
subsamples increases, the accuracy of our algorithm keeps going up. We
demonstrate how to use our algorithm step by step and compare our algorithm
with threshold sparse Bayesian regression (TSBR) for the discovery of
differential equations. We show that our algorithm produces better results. We
also discuss the merits of discovering differential equations from data and
demonstrate how to discover models with random initial and boundary condition
as well as models with bifurcations. The numerical examples are: (1)
predator-prey model with noise, (2) shallow water equations with outliers, (3)
heat diffusion with random initial and boundary condition, and (4)
fish-harvesting problem with bifurcations.
","[{""version"":""v1"",""created"":""Wed, 17 Jul 2019 22:00:48 GMT""},{""version"":""v2"",""created"":""Tue, 23 Jul 2019 00:40:37 GMT""},{""version"":""v3"",""created"":""Mon, 11 May 2020 01:52:33 GMT""},{""version"":""v4"",""created"":""Tue, 27 Oct 2020 16:35:16 GMT""}]","2020-10-28"
