"1907.07893","Zhuojun Li Dr.","Yekai Song, Zhuojun Li, Hui Li, Shujie Tang, Gang Mu, Lixuan Xu, Wei
  Peng, Dawei Shen, Yulin Chen, Xiaoming Xie, and Mianheng Jiang","Epitaxial growth and characterization of high quality Bi2O2Se thin films
  on SrTiO3 substrates by pulsed laser deposition","18 pages, 5 figures, 1 table, supplementary information",,"10.1088/1361-6528/ab6686",,"cond-mat.mtrl-sci","http://arxiv.org/licenses/nonexclusive-distrib/1.0/","  Recently, Bi2O2Se is discovered as a promising two-dimensional (2D)
semiconductor for next generation electronics, due to its moderate bandgap
size, high electron mobility and pronounced ambient stability. Meanwhile, it
has been predicted that high quality Bi2O2Se-related heterostructures may
possess exotic physical phenomena, such as piezoelectricity and topological
superconductivity. Herein, we report the first successful heteroepitaxial
growth of Bi2O2Se films on SrTiO3 substrates via pulsed laser deposition (PLD)
method. Films obtained under optimal conditions show an epitaxial growth with
the c axis perpendicular to the film surface and the a and b axes parallel to
the substrate. The growth mode transition to three dimensional (3D) island from
quasi-2D layer of the heteroepitaxial Bi2O2Se films on SrTiO3 (001) substrates
is observed as prolonging deposition time of films. The maximum value of
electron mobility reaches 160 cm2/V-1s-1 at room temperature in a 70nm-thick
film. The thickness dependent mobility provides evidence that
interface-scattering is likely to be the limiting factor for the relatively low
electron mobility at low temperature, implying that the interface engineering
as an effective method to tune the low temperature electron mobility. Our work
suggests the epitaxial Bi2O2Se films grown by PLD are promising for both
fundamental study and practical applications.
","[{""version"":""v1"",""created"":""Thu, 18 Jul 2019 06:35:25 GMT""},{""version"":""v2"",""created"":""Sun, 21 Jul 2019 13:49:07 GMT""}]","2020-02-19"
"1907.07894","Marc Schiffer","Senarath de Alwis, Astrid Eichhorn, Aaron Held, Jan M. Pawlowski, Marc
  Schiffer and Fleur Versteegen","Asymptotic safety, string theory and the weak gravity conjecture","10 pages, 4 figures","Phys.Lett. B798 (2019) 134991","10.1016/j.physletb.2019.134991",,"hep-th gr-qc hep-ph","http://arxiv.org/licenses/nonexclusive-distrib/1.0/","  We propose a scenario with string theory in the deep ultraviolet, an
intermediate asymptotically safe scaling regime for gravity and matter, and the
Standard Model in the infrared. This could provide a new perspective to tackle
challenges of the two models: For instance, the gravitational Renormalization
Group flow could connect a negative microscopic to a positive macroscopic
cosmological constant, potentially rendering string theory on an anti-de Sitter
background observationally viable. Further, the unitarity of a string-theoretic
ultraviolet completion could be inherited by an asymptotically safe fixed
point, despite the presence of higher-order interactions. We discuss necessary
conditions on the scale of asymptotic safety and the string scale for our
scenario to be viable. As a first test, we explore the weak-gravity conjecture
in the context of asymptotically safe gravity.
","[{""version"":""v1"",""created"":""Thu, 18 Jul 2019 06:36:47 GMT""},{""version"":""v2"",""created"":""Fri, 15 Nov 2019 13:40:58 GMT""}]","2019-11-18"
"1907.07895","Eduardo Henrique Colombo","E.H. Colombo","Connecting metapopulation heterogeneity to aggregated lifetime
  statistics",,,"10.1016/j.ecocom.2019.100777",,"q-bio.PE cond-mat.stat-mech","http://creativecommons.org/licenses/by-nc-sa/4.0/","  Aggregated metapopulation lifetime statistics has been used to access
stylized facts that might help identify the underlying patch-level dynamics.
For instance, the emergence of scaling laws in the aggregated probability
distribution of patch lifetimes can be associated to critical phenomena, in
which the correlation length among system units tends to diverge. Nevertheless,
an aggregated approach is biased by patch-level variability, a fact that can
blur the interpretation of the data. Here, I propose a weakly-coupled
metapopulation model to show how patch variability can solely trigger
qualitatively different lifetime probability distribution at the aggregated
level. In a generalized approach, I obtain a two-way connection between the
variability of a certain patch property (e.g. carrying capacity, environment
condition or connectivity) and the aggregated lifetime probability
distribution. Furthermore, for a particular case, assuming that scaling laws
are observed at the aggregated-level, I speculate the heterogeneity that could
be behind it, relating the qualitative features the variability (mean, variance
and concentration) to the scaling exponents. In this perspective, the
application points to the possibility of equivalence between heterogeneous
weakly-coupled metapopulations and homogeneous ones that exhibit critical
behavior.
","[{""version"":""v1"",""created"":""Thu, 18 Jul 2019 06:42:26 GMT""}]","2019-09-10"
"1907.07896","Shuyang Tang","Shuyang Tang, Jilai Zheng, Yao Deng, Ziyu Wang, Zhiqiang Liu, Dawu Gu","Towards a Multi-Chain Future of Proof-of-Space","This paper is accepted by 15th EAI International Conference on
  Security and Privacy in Communication Networks (SecureComm 2019)",,,,"cs.CR","http://creativecommons.org/licenses/by/4.0/","  Proof-of-Space provides an intriguing alternative for consensus protocol of
permissionless blockchains due to its recyclable nature and the potential to
support multiple chains simultaneously. However, a direct shared proof of the
same storage, which was adopted in the existing multi-chain schemes based on
Proof-of-Space, could give rise to newborn attack on new chain launching. To
fix this gap, we propose an innovative framework of single-chain Proof-of-Space
and further present a novel multi-chain scheme which can resist newborn attack
effectively by elaborately combining shared proof and chain-specific proof of
storage. Moreover, we analyze the security of the multi-chain scheme and prove
that it is incentive-compatible. This means that participants in such
multi-chain system can achieve their greatest utility with our proposed
strategy of storage resource partition.
","[{""version"":""v1"",""created"":""Thu, 18 Jul 2019 06:44:47 GMT""}]","2019-07-19"
"1907.07897","Karlis Freivalds","K\=arlis Freivalds, Em\=ils Ozoli\c{n}\v{s}, Agris \v{S}ostaks","Neural Shuffle-Exchange Networks -- Sequence Processing in O(n log n)
  Time","33rd Conference on Neural Information Processing Systems (NeurIPS
  2019), Vancouver, Canada",,,,"cs.LG cs.NE","http://arxiv.org/licenses/nonexclusive-distrib/1.0/","  A key requirement in sequence to sequence processing is the modeling of long
range dependencies. To this end, a vast majority of the state-of-the-art models
use attention mechanism which is of O($n^2$) complexity that leads to slow
execution for long sequences. We introduce a new Shuffle-Exchange neural
network model for sequence to sequence tasks which have O(log n) depth and O(n
log n) total complexity. We show that this model is powerful enough to infer
efficient algorithms for common algorithmic benchmarks including sorting,
addition and multiplication. We evaluate our architecture on the challenging
LAMBADA question answering dataset and compare it with the state-of-the-art
models which use attention. Our model achieves competitive accuracy and scales
to sequences with more than a hundred thousand of elements. We are confident
that the proposed model has the potential for building more efficient
architectures for processing large interrelated data in language modeling,
music generation and other application domains.
","[{""version"":""v1"",""created"":""Thu, 18 Jul 2019 06:47:48 GMT""},{""version"":""v2"",""created"":""Tue, 23 Jul 2019 10:38:03 GMT""},{""version"":""v3"",""created"":""Mon, 28 Oct 2019 10:02:27 GMT""}]","2019-10-29"
"1907.07898","Jintao Yu","Jintao Yu, Hoang Anh Du Nguyen, Lei Xie, Mottaqiallah Taouil, Said
  Hamdioui","Memristive Devices for Computation-In-Memory",,"Proceedings of the 2018 Design, Automation & Test in Europe
  Conference & Exhibition (DATE): Proceedings. IEEE, p. 1646-1651 (2018)","10.23919/DATE.2018.8342278",,"cs.ET","http://arxiv.org/licenses/nonexclusive-distrib/1.0/","  CMOS technology and its continuous scaling have made electronics and
computers accessible and affordable for almost everyone on the globe; in
addition, they have enabled the solutions of a wide range of societal problems
and applications. Today, however, both the technology and the computer
architectures are facing severe challenges/walls making them incapable of
providing the demanded computing power with tight constraints. This motivates
the need for the exploration of novel architectures based on new device
technologies; not only to sustain the financial benefit of technology scaling,
but also to develop solutions for extremely demanding emerging applications.
This paper presents two computation-in-memory based accelerators making use of
emerging memristive devices; they are Memristive Vector Processor and RRAM
Automata Processor. The preliminary results of these two accelerators show
significant improvement in terms of latency, energy and area as compared to
today's architectures and design.
","[{""version"":""v1"",""created"":""Thu, 18 Jul 2019 06:48:43 GMT""}]","2019-07-19"
"1907.07899","Yueming Jin","Yueming Jin, Keyun Cheng, Qi Dou, Pheng-Ann Heng","Incorporating Temporal Prior from Motion Flow for Instrument
  Segmentation in Minimally Invasive Surgery Video","Accepted by MICCAI 2019; Code is available in
  https://github.com/keyuncheng/MF-TAPNet",,,,"cs.CV","http://arxiv.org/licenses/nonexclusive-distrib/1.0/","  Automatic instrument segmentation in video is an essentially fundamental yet
challenging problem for robot-assisted minimally invasive surgery. In this
paper, we propose a novel framework to leverage instrument motion information,
by incorporating a derived temporal prior to an attention pyramid network for
accurate segmentation. Our inferred prior can provide reliable indication of
the instrument location and shape, which is propagated from the previous frame
to the current frame according to inter-frame motion flow. This prior is
injected to the middle of an encoder-decoder segmentation network as an
initialization of a pyramid of attention modules, to explicitly guide
segmentation output from coarse to fine. In this way, the temporal dynamics and
the attention network can effectively complement and benefit each other. As
additional usage, our temporal prior enables semi-supervised learning with
periodically unlabeled video frames, simply by reverse execution. We
extensively validate our method on the public 2017 MICCAI EndoVis Robotic
Instrument Segmentation Challenge dataset with three different tasks. Our
method consistently exceeds the state-of-the-art results across all three tasks
by a large margin. Our semi-supervised variant also demonstrates a promising
potential for reducing annotation cost in the clinical practice.
","[{""version"":""v1"",""created"":""Thu, 18 Jul 2019 06:51:05 GMT""}]","2019-07-19"
"1907.07900","Tapio Rajala","Augusto Gerolin, Anna Kausamo and Tapio Rajala","Multi-marginal Entropy-Transport with repulsive cost","20 pages, 1 figure",,,,"math.AP math-ph math.MP math.OC","http://arxiv.org/licenses/nonexclusive-distrib/1.0/","  In this paper we study theoretical properties of the entropy-transport
functional with repulsive cost functions. We provide sufficient conditions for
the existence of a minimizer in a class of metric spaces and prove the
$\Gamma$-convergence of the entropy-transport functional to a multi-marginal
optimal transport problem with a repulsive cost. We also prove the
entropy-regularized version of the Kantorovich duality.
","[{""version"":""v1"",""created"":""Thu, 18 Jul 2019 06:51:06 GMT""}]","2019-07-19"
"1907.07901","Jacob Spoelstra","Tingting Zhao, Hang Zhang, Jacob Spoelstra","A Computer Vision Application for Assessing Facial Acne Severity from
  Selfie Images","4 pages, 6 figures. To be presented at the 2019 KDD workshop on
  Applied data science in Healthcare: bridging the gap between data and
  knowledge",,,,"cs.CV","http://arxiv.org/licenses/nonexclusive-distrib/1.0/","  We worked with Nestle SHIELD (Skin Health, Innovation, Education, and
Longevity Development, NSH) to develop a deep learning model that is able to
assess acne severity from selfie images as accurate as dermatologists. The
model was deployed as a mobile application, providing patients an easy way to
assess and track the progress of their acne treatment. NSH acquired 4,700
selfie images for this study and recruited 11 internal dermatologists to label
them in five categories: 1-Clear, 2- Almost Clear, 3-Mild, 4-Moderate,
5-Severe. Using OpenCV to detect facial landmarks we cut specific skin patches
from the selfie images in order to minimize irrelevant background. We then
applied a transfer learning approach by extracting features from the patches
using a ResNet 152 pre-trained model, followed by a fully connected layer
trained to approximate the desired severity rating. To address the problem of
spatial sensitivity of CNN models, we introduce a new image rolling data
augmentation approach, effectively causing acne lesions appeared in more
locations in the training images. Our results demonstrate that this approach
improved the generalization of the CNN model, outperforming more than half of
the panel of human dermatologists on test images. To our knowledge, this is the
first deep learning-based solution for acne assessment using selfie images.
","[{""version"":""v1"",""created"":""Thu, 18 Jul 2019 06:51:33 GMT""},{""version"":""v2"",""created"":""Fri, 19 Jul 2019 06:24:24 GMT""},{""version"":""v3"",""created"":""Wed, 31 Jul 2019 16:34:46 GMT""}]","2019-08-01"
"1907.07902","Isao Tanihata","I. Tanihata, H. Toki, S. Terashima, and H. -J. Ong","Understanding Magic Numbers in Neutron-Rich Nuclei by Tensor Blocking
  Mechanism","8 pages, 2 figures, 1 table",,,,"nucl-th","http://arxiv.org/licenses/nonexclusive-distrib/1.0/","  A new paradigm for nuclear structure that includes blocking effects of tensor
interactions is proposed. All of the recently discovered magic numbers (N=6,
14, 16, 32 and 34) in neutron-rich nuclei can be explained by the blocking
effects. A large amount of binding energy is gained by high-momentum correlated
pairs of nucleons produced by the tensor interaction. Such tensor correlations
strongly depend on the configuration space available for exciting nucleons to
2p-2h states. When additional neutrons occupy a new orbital, the previously
available configuration may be lost, resulting in a sudden loss of binding
energy otherwise gained by the 2p-2h excitations. Such tensor blocking effects
enlarge the energy gaps at all observed new magic numbers. Tensor blocking also
explains consistently the observed peculiar configurations of neutron-rich
nuclei at the borders of shells.
","[{""version"":""v1"",""created"":""Thu, 18 Jul 2019 06:51:39 GMT""}]","2019-07-19"
"1907.07903","Lvzhou Chen","Danny Calegari and Lvzhou Chen","Big mapping class groups and rigidity of the simple circle","v3: final version, minor edits according to referee's suggestions. To
  appear in ETDS. 28 pages, 14 figures","Ergod. Th. Dynam. Sys. 41 (2021) 1961-1987","10.1017/etds.2020.43",,"math.DS math.GR math.GT","http://arxiv.org/licenses/nonexclusive-distrib/1.0/","  Let $\Gamma$ denote the mapping class group of the plane minus a Cantor set.
We show that every action of $\Gamma$ on the circle is either trivial or
semi-conjugate to a unique minimal action on the so-called simple circle.
","[{""version"":""v1"",""created"":""Thu, 18 Jul 2019 06:51:52 GMT""},{""version"":""v2"",""created"":""Mon, 29 Jul 2019 19:00:39 GMT""},{""version"":""v3"",""created"":""Tue, 28 Jul 2020 20:51:56 GMT""}]","2021-07-01"
"1907.07904","Giuseppe Marra","Francesco Giannini and Giuseppe Marra and Michelangelo Diligenti and
  Marco Maggini and Marco Gori","On the relation between Loss Functions and T-Norms",,,,,"cs.LG stat.ML","http://arxiv.org/licenses/nonexclusive-distrib/1.0/","  Deep learning has been shown to achieve impressive results in several domains
like computer vision and natural language processing. A key element of this
success has been the development of new loss functions, like the popular
cross-entropy loss, which has been shown to provide faster convergence and to
reduce the vanishing gradient problem in very deep structures. While the
cross-entropy loss is usually justified from a probabilistic perspective, this
paper shows an alternative and more direct interpretation of this loss in terms
of t-norms and their associated generator functions, and derives a general
relation between loss functions and t-norms. In particular, the presented work
shows intriguing results leading to the development of a novel class of loss
functions. These losses can be exploited in any supervised learning task and
which could lead to faster convergence rates that the commonly employed
cross-entropy loss.
","[{""version"":""v1"",""created"":""Thu, 18 Jul 2019 06:58:36 GMT""}]","2019-07-19"
"1907.07905","Katrin F\""ursich","K. F\""ursich and J. Bertinshaw and P. Butler and M. Krautloher and M.
  Minola and B. Keimer","Raman scattering from current-stabilized nonequilibrium phases in
  Ca$_2$RuO$_4$","accepted for publication as a Rapid Communication in Physical Review
  B","Phys. Rev. B 100, 081101(R), 2019","10.1103/PhysRevB.100.081101",,"cond-mat.str-el","http://arxiv.org/licenses/nonexclusive-distrib/1.0/","  We used Raman light scattering to study the current-stabilized nonequilibrium
semimetallic and metallic phases in Ca$_2$RuO$_4$. By determining the local
temperature through careful analysis of the Stokes and anti-Stokes intensities,
we find that Joule heating can be completely avoided by supplying sufficient
cooling power in a helium-flow cryostat, and that the current induces the
semimetallic state without inducing any significant heating. We further
investigate the current-induced semimetallic state as a function of temperature
and current. We confirm the absence of long-range antiferromagnetic order and
identify a substantial Fano broadening of several phonons, which suggests
coupling to charge and orbital fluctuations. Our results demonstrate that the
semimetallic state is a genuine effect of the applied electrical current and
that the current-induced phases have characteristics distinct from the
equilibrium ones.
","[{""version"":""v1"",""created"":""Thu, 18 Jul 2019 07:08:14 GMT""},{""version"":""v2"",""created"":""Mon, 22 Jul 2019 07:45:13 GMT""}]","2019-08-08"
"1907.07906","Val\'erie Vallet","El\'eonor Acher and Michel Masella and Val\'erie Vallet and Florent
  R\'eal","Properties of the tetravalent actinide series in aqueous phase from a
  microscopic simulation automated engine","7 pages, 4 figures","Physical Chemistry Chemical Physics, 22, 2343-2350 (2020)","10.1039/C9CP04912F",,"physics.chem-ph","http://creativecommons.org/licenses/by/4.0/","  In the context of nuclear fuel recycling and environmental issues, the
understanding of the properties of radio-elements with various approaches
remains a challenge regarding their dangerousness. Moreover, experimentally, it
is imperative to work at sufficiently high concentrations to reach the
sensitivities of the analysis tools, which often leads to precipitation for
some of them, and stabilizing of specific oxidation states of some actinides
remains a challenge, thus making it difficult to extract general trends across
the actinide series. Complementary to experiments, modelling can be used to
unbiasedly probe the actinide's properties in aquatic environment and offers a
predictive tool. We report the first molecular dynamics simulations based on
homogeneously built force fields for the whole series of the tetravalent
actinides in aqueous phase from $\mathrm{Th^{IV}}$ to $\mathrm{Bk^{IV}}$ and
including $\mathrm{Pu^{IV}}$. The force fields used to model the interactions
among the constituents include polarization and charge donation microscopic
effects. They are built from an automated iterative \textit{ab initio} based
engine, the core element of a future machine learning procedure devoted to
generate accurate force fields. The comparison of our simulated hydrated
actinide properties to available experimental data show the model robustness
and the relevance of our parameter assignment engine. Moreover our simulated
structural, dynamical and hydration free energy data show that, apart from
$\mathrm{Am^{IV}}$ and $\mathrm{Cm^{IV}}$, the actinides properties change
progressively along the series.
","[{""version"":""v1"",""created"":""Thu, 18 Jul 2019 07:08:39 GMT""},{""version"":""v2"",""created"":""Thu, 25 Jul 2019 10:22:56 GMT""},{""version"":""v3"",""created"":""Tue, 7 Jan 2020 17:29:27 GMT""}]","2020-05-20"
"1907.07907","Ilan Newman","Rogers Mathew, Ilan Newman, Yuri Rabinovich and Deepak Rajendraprasad","Hamiltonian and Pseudo-Hamiltonian Cycles and Fillings In Simplicial
  Complexes",,,,,"math.CO","http://arxiv.org/licenses/nonexclusive-distrib/1.0/","  We introduce and study a $d$-dimensional generalization of Hamiltonian cycles
in graphs - the Hamiltonian $d$-cycles in $K_n^d$ (the complete simplicial
$d$-complex over a vertex set of size $n$). Those are the simple $d$-cycles of
a complete rank, or, equivalently, of size $1 + {{n-1} \choose d}$.
  The discussion is restricted to the fields $F_2$ and $Q$. For $d=2$, we
characterize the $n$'s for which Hamiltonian $2$-cycles exist. For $d=3$ it is
shown that Hamiltonian $3$-cycles exist for infinitely many $n$'s. In general,
it is shown that there always exist simple $d$-cycles of size ${{n-1} \choose
d} - O(n^{d-3})$. All the above results are constructive.
  Our approach naturally extends to (and in fact, involves) $d$-fillings,
generalizing the notion of $T$-joins in graphs. Given a $(d-1)$-cycle $Z^{d-1}
\in K_n^d$, ~$F$ is its $d$-filling if $\partial F = Z^{d-1}$. We call a
$d$-filling Hamiltonian if it is acyclic and of a complete rank, or,
equivalently, is of size ${{n-1} \choose d}$. If a Hamiltonian $d$-cycle $Z$
over $F_2$ contains a $d$-simplex $\sigma$, then $Z\setminus \sigma$ is a a
Hamiltonian $d$-filling of $\partial \sigma$ (a closely related fact is also
true for cycles over $Q$). Thus, the two notions are closely related.
  Most of the above results about Hamiltonian $d$-cycles hold for Hamiltonian
$d$-fillings as well.
","[{""version"":""v1"",""created"":""Thu, 18 Jul 2019 07:15:10 GMT""}]","2019-07-19"
"1907.07908","Rosanna Grassi","Paolo Bartesaghi, Michele Benzi, Gian Paolo Clemente, Rosanna Grassi
  and Ernesto Estrada","Risk-dependent centrality in economic and financial networks","This version is accepted on SIAM journal on Financial Mathematics","SIAM J. FINANCIAL MATH. 2020","10.1137/19M13020411",,"q-fin.MF q-fin.GN","http://arxiv.org/licenses/nonexclusive-distrib/1.0/","  Node centrality is one of the most important and widely used concepts in the
study of complex networks. Here, we extend the paradigm of node centrality in
financial and economic networks to consider the changes of node ""importance""
produced not only by the variation of the topology of the system but also as a
consequence of the external levels of risk to which the network as a whole is
submitted. Starting from the ""Susceptible-Infected"" (SI) model of epidemics and
its relation to the communicability functions of networks we develop a series
of risk-dependent centralities for nodes in (financial and economic) networks.
We analyze here some of the most important mathematical properties of these
risk-dependent centrality measures. In particular, we study the newly observed
phenomenon of ranking interlacement, by means of which two entities may
interlace their ranking positions in terms of risk in the network as a
consequence of the change in the external conditions only, i.e., without any
change in the topology. We test the risk-dependent centralities by studying two
real-world systems: the network generated by collecting assets of the S\&P 100
and the corporate board network of the US top companies, according to Forbes in
1999. We found that a high position in the ranking of the analyzed financial
companies according to their risk-dependent centrality corresponds to companies
more sensitive to the external market variations during the periods of crisis.
","[{""version"":""v1"",""created"":""Thu, 18 Jul 2019 07:18:33 GMT""},{""version"":""v2"",""created"":""Thu, 25 Jul 2019 07:56:21 GMT""},{""version"":""v3"",""created"":""Mon, 25 Nov 2019 15:06:49 GMT""},{""version"":""v4"",""created"":""Tue, 14 Apr 2020 17:47:02 GMT""}]","2020-06-05"
