"1907.08010","Sunny Vagnozzi","Sunny Vagnozzi","Cosmological searches for the neutrino mass scale and mass ordering","Stockholm University PhD thesis, defended on June 10, 2019. Chapter 4
  is a textbook-level review on neutrino cosmology, particularly suited for
  newcomers in the field. Advisor: Prof. Katherine Freese. Opponent: Prof.
  Alessandra Silvestri. ISBN: 978-91-7797-729-2. For full text on SU's website
  see http://urn.kb.se/resolve?urn=urn:nbn:se:su:diva-167815. Abstract severely
  abridged",,,,"astro-ph.CO gr-qc hep-ph","http://arxiv.org/licenses/nonexclusive-distrib/1.0/","  In this thesis, I describe a number of recent important developments in
neutrino cosmology on three fronts. Firstly, focusing on Large-Scale Structure
(LSS) data, I will show that current cosmological probes contain a wealth of
information on the sum of the neutrino masses. I report on the analysis leading
to the currently best upper limit on the sum of the neutrino masses of
$0.12\,{\rm eV}$. I show how cosmological data exhibits a weak preference for
the normal neutrino mass ordering because of parameter space volume effects,
and propose a simple method to quantify this preference. Secondly, I will
discuss how galaxy bias represents a severe limitation towards fully
capitalizing on the neutrino information hidden in LSS data. I propose a method
for calibrating the scale-dependent galaxy bias using CMB lensing-galaxy
cross-correlations. Moreover, in the presence of massive neutrinos, the usual
definition of bias becomes inadequate, as it leads to a scale-dependence on
large scales which has never been accounted for. I show that failure to define
the bias appropriately will be a problem for future LSS surveys, and propose a
simple recipe to account for the effect of massive neutrinos on galaxy bias.
Finally, I discuss implications of correlations between neutrino parameters and
other cosmological parameters. In non-phantom dynamical dark energy models, the
upper limit on the sum of the neutrino masses becomes tighter than the
$\Lambda$CDM limit. Therefore, such models exhibit an even stronger preference
for the normal ordering, and their viability could be jeopardized should
near-future laboratory experiments determine that the mass ordering is
inverted. I then discuss correlations between neutrino and inflationary
parameters. I find that our determination of inflationary parameters is stable
against assumptions about the neutrino sector. (abridged)
","[{""version"":""v1"",""created"":""Thu, 18 Jul 2019 12:03:32 GMT""}]","2019-07-19"
"1907.08011","Sofia Feltzing","Sofia Feltzing, J. Bradley Bowers, Oscar Agertz (Lund Observatory,
  Department of Astronomy and Theoretical Physics, Lund, Sweden)","Constraining churning and blurring in the Milky Way using large
  spectroscopic surveys -- an exploratory study","Paper submitted to MNRAS. Comments are welcome",,"10.1093/mnras/staa340",,"astro-ph.GA","http://arxiv.org/licenses/nonexclusive-distrib/1.0/","  We have investigated the possibilities to quantify how much stars move in the
Milky Way stellar disk due to diffuse processes (i.e. so called blurring) and
due to influences from spiral arms and the bar (i.e. so called churning). To
this end we assume that it is possible to infer the formation radius of a star
if we know their elemental abundances and age as well as the metallicity
profile of the interstellar medium at the time of the formation of the star.
Using this information, coupled with orbital information derived from Gaia DR2
data and radial velocities from large spectroscopic surveys, we show that it is
possible to isolate stellar samples such that we can start to quantify how
important the role of churning is. We use data from APOGEE DR14, parallaxes
from Gaia and stellar ages based on C and N elemental abundances in the stars.
In our sample, we find that about half of the stars have experienced some sort
of radial migration (based solely on their orbital properties), 10 % have
likely have suffered only from churning, whilst a modest 5-7 % of stars have
never experienced either churning or blurring making them ideal tracers of the
original properties of the cool stellar disk. Our investigation shows that it
is possible to put up a framework where we can begin to quantify churning and
blurring an important. Important aspects for future work would include to
investigate how selection effects should be accounted for.
","[{""version"":""v1"",""created"":""Thu, 18 Jul 2019 12:04:02 GMT""}]","2020-02-19"
"1907.08012","Kevin Garello Dr.","K. Garello, F. Yasin, H. Hody, S. Couet, L. Souriau, S. H. Sharifi, J.
  Swerts, R. Carpenter, S. Rao, W. Kim, J. Wu, K. K. V. Sethu, M. Pak, N.
  Jossart, D. Crotti, A. Furn\'emont, G. S. Kar","Manufacturable 300mm platform solution for Field-Free Switching SOT-MRAM","Presented at VLSI 2019 Circuit and Technology Symposium, JFS4p5","2019 Symposium on VLSI Technology","10.23919/VLSIT.2019.8776537",,"physics.app-ph","http://arxiv.org/licenses/nonexclusive-distrib/1.0/","  We propose a field-free switching SOT-MRAM concept that is integration
friendly and allows for separate optimization of the field component and
SOT/MTJ stack properties. We demonstrate it on a 300 mm wafer, using
CMOS-compatible processes, and we show that device performances are similar to
our standard SOT-MTJ cells: reliable sub-ns switching with low writing power
across the 300mm wafer. Our concept/design opens a new area for MRAM (SOT, STT
and VCMA) technology development.
","[{""version"":""v1"",""created"":""Thu, 18 Jul 2019 12:07:49 GMT""},{""version"":""v2"",""created"":""Fri, 30 Aug 2019 12:56:36 GMT""}]","2019-09-02"
"1907.08013","Mingzhe Guo","Mingzhe Guo, Tom Van Doorsselaere, Konstantinos Karampelas, Bo Li","Wave heating in simulated multi-stranded coronal loops","8 figures, accepted for publication in ApJ",,"10.3847/1538-4357/ab338e",,"astro-ph.SR","http://arxiv.org/licenses/nonexclusive-distrib/1.0/","  It has been found that the Kelvin-Helmholtz instability (KHI) induced by both
transverse and torsional oscillations in coronal loops can reinforce the
effects of wave heating. In this study, we model a coronal loop as a system of
individual strands, and we study wave heating effects by considering a combined
transverse and torsional driver at the loop footpoint. We deposit the same
energy into the multi-stranded loop and an equivalent monolithic loop, and then
observe a faster increase in the internal energy and temperature in the
multi-stranded model. Therefore, the multi-stranded model is more efficient in
starting the heating process. Moreover, higher temperature is observed near the
footpoint in the multi-stranded loop and near the apex in the monolithic loop.
The apparent heating location in the multi-stranded loop agrees with the
previous predictions and observations. Given the differences in the results
from our multi-stranded loop and monolithic loop simulations, and given that
coronal loops are suggested to be multi-stranded on both theoretical and
observational grounds, our results suggest that the multi-strandedness of
coronal loops needs to be incorporated in future wave-based heating mechanisms.
","[{""version"":""v1"",""created"":""Thu, 18 Jul 2019 12:24:33 GMT""}]","2019-09-25"
"1907.08014","Jorge Lauret","Jorge Lauret, Cynthia E. Will","The Ricci pinching functional on solvmanifolds II","6 pages. Final version accepted in Proc. AMS",,,,"math.DG","http://arxiv.org/licenses/nonexclusive-distrib/1.0/","  It is natural to ask whether solvsolitons are global maxima for the Ricci
pinching functional F:=scal^2/|Ric|^2 on the set of all left-invariant metrics
on a given solvable Lie group S, as it is to ask whether they are the only
global maxima. A positive answer to both questions was given in a recent paper
by the same authors when the Lie algebra s of S is either unimodular or has a
codimension-one abelian ideal. In the present paper, we prove that this also
holds in the following two more general cases: 1) s has a nilradical of
codimension-one; 2) the nilradical n of s is abelian and the functional F is
restricted to the set of metrics such that a is orthogonal to n, where a is the
orthogonal complement of n with respect to the solvsoliton.
","[{""version"":""v1"",""created"":""Thu, 18 Jul 2019 12:31:39 GMT""},{""version"":""v2"",""created"":""Wed, 27 Nov 2019 13:20:08 GMT""}]","2019-11-28"
"1907.08015","Zhongyang Li","Xiao Ding, Zhongyang Li, Ting Liu and Kuo Liao","ELG: An Event Logic Graph","arXiv admin note: text overlap with arXiv:1805.05081",,,,"cs.AI cs.CL","http://arxiv.org/licenses/nonexclusive-distrib/1.0/","  The evolution and development of events have their own basic principles,
which make events happen sequentially. Therefore, the discovery of such
evolutionary patterns among events are of great value for event prediction,
decision-making and scenario design of dialog systems. However, conventional
knowledge graph mainly focuses on the entities and their relations, which
neglects the real world events. In this paper, we present a novel type of
knowledge base - Event Logic Graph (ELG), which can reveal evolutionary
patterns and development logics of real world events. Specifically, ELG is a
directed cyclic graph, whose nodes are events, and edges stand for the
sequential, causal, conditional or hypernym-hyponym (is-a) relations between
events. We constructed two domain ELG: financial domain ELG, which consists of
more than 1.5 million of event nodes and more than 1.8 million of directed
edges, and travel domain ELG, which consists of about 30 thousand of event
nodes and more than 234 thousand of directed edges. Experimental results show
that ELG is effective for the task of script event prediction.
","[{""version"":""v1"",""created"":""Thu, 18 Jul 2019 12:39:12 GMT""},{""version"":""v2"",""created"":""Wed, 7 Aug 2019 17:44:58 GMT""}]","2019-08-09"
"1907.08016","Tomohiro Ooto","Khalil Ayadi, Tomohiro Ooto","On quadratic approximation for hyperquadratic continued fractions","11 pages",,"10.1016/j.jnt.2020.02.008",,"math.NT","http://arxiv.org/licenses/nonexclusive-distrib/1.0/","  We study quadratic approximations for two families of hyperquadratic
continued fractions in the field of Laurent series over a finite field. As the
first application, we give the answer to a question of the second author
concerning Diophantine exponents for algebraic Laurent series. As the second
application, we determine the degrees of these families in particular case.
","[{""version"":""v1"",""created"":""Thu, 18 Jul 2019 12:41:05 GMT""},{""version"":""v2"",""created"":""Thu, 6 Feb 2020 14:00:54 GMT""}]","2020-03-23"
"1907.08017","Takhmasib Aliev","T. M. Aliev, T. Barakat, K. Simsek","$N^*(1535) \rightarrow N $ transition form-factors due to the axial
  current",,"Phys. Rev. D 100, 054030 (2019)","10.1103/PhysRevD.100.054030",,"hep-ph","http://arxiv.org/licenses/nonexclusive-distrib/1.0/","  The form-factors for the transition $ N^*(1535)\to N $ induced by isovector
and isoscalar axial currents within the framework of light-cone QCD sum rules
by using the most general form of the interpolating current are calculated. In
numerical calculations, we use two sets of values of input parameters. It is
observed that the $ Q^2 $ dependence of the form-factor $ G_A $ can be
described by the dipole form. Moreover, the form-factors $ G_P^{(S)} $ are
found to be highly sensitive to the variations in the auxiliary parameter $
\beta $.
","[{""version"":""v1"",""created"":""Thu, 18 Jul 2019 12:43:49 GMT""}]","2019-10-02"
"1907.08018","Valentina Fioretti","Valentina Fioretti, Deivid Ribeiro, Thomas B. Humensky, Andrea
  Bulgarelli, Gernot Maier, Abelardo Moralejo, Cosimo Nigro (for the CTA
  Consortium)","The Cherenkov Telescope Array sensitivity to the transient sky","Proceedings of the 36th International Cosmic Ray Conference -
  Madison, WI, USA (PoS(ICRC2019)673)",,,,"astro-ph.IM astro-ph.HE","http://arxiv.org/licenses/nonexclusive-distrib/1.0/","  The Cherenkov Telescope Array (CTA) will be able to perform unprecedented
observations of the transient very high-energy sky. An on-line science alert
generation (SAG) pipeline, with a required 30 second latency, will allow the
discovery or follow-up of gamma ray bursts (GRBs) and flaring emission from
active galactic nuclei, galactic compact objects and electromagnetic
counterparts of gravitational waves or neutrino messengers. The CTA sensitivity
for very short exposures does not only depend on the technological performance
of the array (e.g. effective area, background discrimination efficiency). The
algorithms to evaluate the significance of the detection also define the
sensitivity, together with their computational efficiency in order to satisfy
the SAG latency requirements. We explore the aperture photometry and likelihood
analysis techniques, and the associated parameters (e.g. on-source to
off-source exposure ratio, minimum number of required signal events), defining
the CTA ability to detect a significant signal at short exposures. The
resulting CTA differential flux sensitivity as a function of the observing
time, obtained using the latest Monte Carlo simulations, is compared to the
sensitivities of Fermi-LAT and current-generation IACTs obtained in the
overlapping energy ranges.
","[{""version"":""v1"",""created"":""Thu, 18 Jul 2019 12:46:29 GMT""}]","2019-07-19"
"1907.08019","Axel Dahlberg","Axel Dahlberg, Jonas Helsen, Stephanie Wehner","Transforming graph states to Bell-pairs is NP-Complete","21 pages, 8 figures","Quantum 4, 348 (2020)","10.22331/q-2020-10-22-348",,"quant-ph cs.CC math.CO","http://creativecommons.org/licenses/by/4.0/","  Critical to the construction of large scale quantum networks, i.e. a quantum
internet, is the development of fast algorithms for managing entanglement
present in the network. One fundamental building block for a quantum internet
is the distribution of Bell pairs between distant nodes in the network. Here we
focus on the problem of transforming multipartite entangled states into the
tensor product of bipartite Bell pairs between specific nodes using only a
certain class of local operations and classical communication. In particular we
study the problem of deciding whether a given graph state, and in general a
stabilizer state, can be transformed into a set of Bell pairs on specific
vertices using only single-qubit Clifford operations, single-qubit Pauli
measurements and classical communication. We prove that this problem is
NP-Complete.
","[{""version"":""v1"",""created"":""Thu, 18 Jul 2019 12:47:56 GMT""},{""version"":""v2"",""created"":""Mon, 19 Oct 2020 12:20:14 GMT""}]","2020-10-28"
"1907.08020","Aleksei Tiulpin","Aleksei Tiulpin and Simo Saarakkala","Automatic Grading of Individual Knee Osteoarthritis Features in Plain
  Radiographs using Deep Convolutional Neural Networks",,,,,"eess.IV cs.CV cs.LG","http://arxiv.org/licenses/nonexclusive-distrib/1.0/","  Knee osteoarthritis (OA) is the most common musculoskeletal disease in the
world. In primary healthcare, knee OA is diagnosed using clinical examination
and radiographic assessment. Osteoarthritis Research Society International
(OARSI) atlas of OA radiographic features allows to perform independent
assessment of knee osteophytes, joint space narrowing and other knee features.
This provides a fine-grained OA severity assessment of the knee, compared to
the gold standard and most commonly used Kellgren-Lawrence (KL) composite
score. However, both OARSI and KL grading systems suffer from moderate
inter-rater agreement, and therefore, the use of computer-aided methods could
help to improve the reliability of the process. In this study, we developed a
robust, automatic method to simultaneously predict KL and OARSI grades in knee
radiographs. Our method is based on Deep Learning and leverages an ensemble of
deep residual networks with 50 layers, squeeze-excitation and ResNeXt blocks.
Here, we used transfer learning from ImageNet with a fine-tuning on the whole
Osteoarthritis Initiative (OAI) dataset. An independent testing of our model
was performed on the whole Multicenter Osteoarthritis Study (MOST) dataset. Our
multi-task method yielded Cohen's kappa coefficients of 0.82 for KL-grade and
0.79, 0.84, 0.94, 0.83, 0.84, 0.90 for femoral osteophytes, tibial osteophytes
and joint space narrowing for lateral and medial compartments respectively.
Furthermore, our method yielded area under the ROC curve of 0.98 and average
precision of 0.98 for detecting the presence of radiographic OA (KL $\geq 2$),
which is better than the current state-of-the-art.
","[{""version"":""v1"",""created"":""Thu, 18 Jul 2019 12:52:32 GMT""}]","2019-07-19"
"1907.08021","Juan Pedraza","Elena Caceres, Anderson Seigo Misobuchi, Juan F. Pedraza","Constraining higher order gravities with subregion duality","21 pages, multiple figures. v3: matches published version","JHEP 1911 (2019) 175","10.1007/JHEP11(2019)175","UTTG-07-19","hep-th gr-qc","http://arxiv.org/licenses/nonexclusive-distrib/1.0/","  In higher derivative theories, gravity can travel slower or faster than
light. With this feature in mind, we revisit the construction of the causal and
entanglement wedges in this type of theories, and argue that they must be
constructed using the fastest mode instead of null rays. We show that the
property of causal wedge inclusion, i.e., the fact that the causal wedge must
be contained in the entanglement wedge, leads to more stringent constraints on
the couplings than those imposed by hyperbolicity and boundary causality. Our
results imply that the full power of subregion-subregion duality could lead to
the same conclusions previously obtained based on high energy graviton
scattering. We illustrate our findings with a systematic analysis in
Gauss-Bonnet gravity.
","[{""version"":""v1"",""created"":""Thu, 18 Jul 2019 12:54:18 GMT""},{""version"":""v2"",""created"":""Thu, 15 Aug 2019 09:12:49 GMT""},{""version"":""v3"",""created"":""Thu, 14 May 2020 00:18:15 GMT""}]","2020-05-15"
"1907.08022","Robert Brandenberger","Samuel Laliberte and Robert Brandenberger (McGill University)","Ionization from Cosmic Strings at Cosmic Dawn","8 pages, 4 figures","Phys. Rev. D 101, 023528 (2020)","10.1103/PhysRevD.101.023528",,"astro-ph.CO gr-qc hep-ph hep-th","http://arxiv.org/licenses/nonexclusive-distrib/1.0/","  Cosmic strings produce charged particles which, by emitting electromagnetic
radiation, partially ionize neutral hydrogen during the dark ages. Corrections
to the ionization fraction of neutral hydrogen induced by cosmic strings could
lead to new observational effects and/or new constraints on the string tension
around $G\mu \sim 10^{-16} - 10^{-22}$ for values of the primordial magnetic
field in the range $B_0 \sim 10^{-11}-10^{-9}$ Gauss.
","[{""version"":""v1"",""created"":""Thu, 18 Jul 2019 12:55:48 GMT""}]","2020-02-05"
"1907.08023","Akram Youssry","Akram Youssry, Robert J. Chapman, Alberto Peruzzo, Christopher Ferrie,
  Marco Tomamichel","Modeling and Control of a Reconfigurable Photonic Circuit using Deep
  Learning","Added some references, corrected some typos, enhanced presentation","Quantum Science and Technology 5 (2), 025001 (2020)","10.1088/2058-9565/ab60de",,"quant-ph","http://arxiv.org/licenses/nonexclusive-distrib/1.0/","  The complexity of experimental quantum information processing devices is
increasing rapidly, requiring new approaches to control them. In this paper, we
address the problems of practically modeling and controlling an integrated
optical waveguide array chip, a technology expected to have many applications
in telecommunications and optical quantum information processing. This photonic
circuit can be electrically reconfigured, but only the output optical signal
can be monitored. As a result, the conventional control methods cannot be
naively applied. Characterizing such a chip is challenging for three reasons.
First, there are uncertainties associated with the Hamiltonian describing the
chip. Second, we expect distortions of the control voltages caused by the
chip's electrical response, which cannot be directly observed. Finally, there
are imperfections in the measurements caused by losses from coupling the chip
externally to optical fibers. We developed a deep neural network approach to
solve these problems. The architecture is designed specifically to overcome the
aforementioned challenges using a Gated Recurrent Unit (GRU)-based network as
the central component. The Hamiltonian is estimated as a blackbox, while the
rules of quantum mechanics such as state evolution is embedded in the structure
as a whitebox. The resulting overall graybox model of the chip shows good
performance both quantitatively in terms of the mean square error and
qualitatively in terms of the predicted waveforms. We use this neural network
to solve a classical and a quantum control problem. In the classical
application we find a control sequence to approximately realize a
time-dependent output power distribution. For the quantum application we obtain
the control voltages to realize a target set of quantum gates. The proposed
method is generic and can be applied to other systems that can only be probed
indirectly.
","[{""version"":""v1"",""created"":""Thu, 18 Jul 2019 12:56:06 GMT""},{""version"":""v2"",""created"":""Sat, 30 Nov 2019 03:33:38 GMT""}]","2020-02-19"
"1907.08024","Axel Dahlberg","Axel Dahlberg, Jonas Helsen, Stephanie Wehner","Counting single-qubit Clifford equivalent graph states is #P-Complete","10 pages, no figures","Journal of Mathematical Physics 61, 022202 (2020)","10.1063/1.5120591",,"quant-ph cs.CC math.CO","http://arxiv.org/licenses/nonexclusive-distrib/1.0/","  Graph states, which include for example Bell states, GHZ states and cluster
states, form a well-known class of quantum states with applications ranging
from quantum networks to error-correction. Deciding whether two graph states
are equivalent up to single-qubit Clifford operations is known to be decidable
in polynomial time and have been studied both in the context of producing
certain required states in a quantum network but also in relation to stabilizer
codes. The reason for the latter this is that single-qubit Clifford equivalent
graph states exactly corresponds to equivalent stabilizer codes. We here
consider the computational complexity of, given a graph state |G>, counting the
number of graph states, single-qubit Clifford equivalent to |G>. We show that
this problem is #P-Complete. To prove our main result we make use of the notion
of isotropic systems in graph theory. We review the definition of isotropic
systems and point out their strong relation to graph states. We believe that
these isotropic systems can be useful beyond the results presented in this
paper.
","[{""version"":""v1"",""created"":""Thu, 18 Jul 2019 12:58:45 GMT""}]","2020-08-05"
"1907.08025","Jonas Sommerfeldt","J. Sommerfeldt, R. A. M\""uller, A. N. Artemyev, A. Surzhykov","Polarization effects in bound-free pair production",,"Phys. Rev. A 100, 042511 (2019)","10.1103/PhysRevA.100.042511",,"physics.atom-ph","http://arxiv.org/licenses/nonexclusive-distrib/1.0/","  We present a theoretical study of bound-free electron-positron pair
production in the interaction of $\gamma$-rays with bare ions. Special
attention is paid to the longitudinal polarization of both the emitted
positrons and the produced hydrogen-like ions. To evaluate this polarization we
employed exact solutions of the relativistic Dirac equation and treat the
electron-photon coupling within the framework of first-order perturbation
theory. Detailed calculations have been performed for both, low- and high-Z
ions and for a wide range of photon energies. The results of these calculations
suggest that bound-free pair production can be a source of strongly polarized
positrons and ions.
","[{""version"":""v1"",""created"":""Thu, 18 Jul 2019 12:59:19 GMT""}]","2019-10-30"
"1907.08026","Nicholas Michael Ercolani","Nicholas M. Ercolani and Patrick Waters","Relating random matrix map enumeration to a universal symbol calculus
  for recurrence operators in terms of Bessel-Appell polynomials",,,,,"math-ph math.MP nlin.SI","http://arxiv.org/licenses/nonexclusive-distrib/1.0/","  Maps are polygonal cellular networks on Riemann surfaces. This paper analyzes
the construction of closed form general representations for the enumerative
generating functions associated to maps of fixed but arbitrary genus. The
method of construction developed here involves a novel asymptotic symbol
calculus for difference operators based on the relation between spectral
asymptotics for Hermitian random matrices and asymptotics of orthogonal
polynomials with exponential weights. These closed form expressions have a
universal character in the sense that they are independent of the explicit
valence distribution of the cellular networks within a broad class.
Nevertheless the valence distributions may be recovered from the closed form
generating functions by a remarkable unwinding identity in terms of Appell
polynomials generated by Bessel functions. Our treatment reveals the generating
functions to be solutions of nonlinear conservation laws and their
prolongations. This characterization enables one to gain insights that go
beyond more traditional methods that are purely combinatorial. Universality
results are connected to stability results for characteristic singularities of
conservation laws that were studied by Caflisch, Ercolani, Hou and Landis as
well as directly related to universality results for random matrix spectra.
","[{""version"":""v1"",""created"":""Thu, 18 Jul 2019 13:00:31 GMT""},{""version"":""v2"",""created"":""Tue, 24 Aug 2021 19:17:05 GMT""},{""version"":""v3"",""created"":""Mon, 14 Mar 2022 05:37:16 GMT""},{""version"":""v4"",""created"":""Thu, 26 May 2022 03:50:42 GMT""}]","2022-05-27"
