"1907.12065","Thomas Peron","Thomas Peron, Deniz Eroglu, Francisco A. Rodrigues, Yamir Moreno","Collective dynamics of random Janus oscillator networks",,"Phys. Rev. Research 2, 013255 (2020)","10.1103/PhysRevResearch.2.013255",,"nlin.AO cond-mat.dis-nn nlin.CD","http://arxiv.org/licenses/nonexclusive-distrib/1.0/","  Janus oscillators have been recently introduced as a remarkably simple phase
oscillator model that exhibits non-trivial dynamical patterns -- such as
chimeras, explosive transitions, and asymmetry-induced synchronization -- that
once were only observed in specifically tailored models. Here we study
ensembles of Janus oscillators coupled on large homogeneous and heterogeneous
networks. By virtue of the Ott-Antonsen reduction scheme, we find that the rich
dynamics of Janus oscillators persists in the thermodynamic limit of random
regular, Erd\H{o}s-R\'enyi and scale-free random networks. We uncover for all
these networks the coexistence between partially synchronized state and a
multitude of states displaying global oscillations. Furthermore, abrupt
transitions of the global and local order parameters are observed for all
topologies considered. Interestingly, only for scale-free networks, it is found
that states displaying global oscillations vanish in the thermodynamic limit.
","[{""version"":""v1"",""created"":""Sun, 28 Jul 2019 10:35:25 GMT""}]","2020-03-11"
"1907.12066","Marcin Pikus","Marcin Pikus, Wen Xu, Gerhard Kramer","Finite-Precision Implementation of Arithmetic Coding Based Distribution
  Matchers",,,,,"cs.IT math.IT","http://arxiv.org/licenses/nonexclusive-distrib/1.0/","  A distribution matcher (DM) encodes a binary input data sequence into a
sequence of symbols with a desired target probability distribution. Several
DMs, including shell mapping and constant-composition distribution matcher
(CCDM), have been successfully employed for signal shaping, e.g., in
optical-fiber or 5G. The CCDM, like many other DMs, is typically implemented by
arithmetic coding (AC). In this work we implement AC based DMs using
finite-precision arithmetic (FPA). An analysis of the implementation shows that
FPA results in a rate-loss that shrinks exponentially with the number of
precision bits. Moreover, a relationship between the CCDM rate and the number
of precision bits is derived.
","[{""version"":""v1"",""created"":""Sun, 28 Jul 2019 10:47:18 GMT""}]","2019-07-30"
"1907.12067","Thomas Mohaupt","Vicente Cort\'es, Louis Gall, Thomas Mohaupt","Four-dimensional vector multiplets in arbitrary signature","99 pages including appendices, 21 tables",,"10.1142/S0219887820501509","LTH 1210","hep-th","http://arxiv.org/licenses/nonexclusive-distrib/1.0/","  We derive a necessary and sufficient condition for Poincar\'e Lie
superalgebras in any dimension and signature to be isomorphic. This reduces the
classification problem, up to certain discrete operations, to classifying the
orbits of the Schur group on the vector space of superbrackets. We then
classify four-dimensional ${\cal N}=2$ supersymmetry algebras, which are found
to be unique in Euclidean and in neutral signature, while in Lorentz signature
there exist two algebras with R-symmetry groups $\mathrm{U}(2)$ and
$\mathrm{U(}1,1)$, respectively. By dimensional reduction we construct two off
shell vector multiplet representations for each possible signature, and find
that the corresponding Lagrangians always have a different relative sign
between the scalar and the Maxwell term. In Lorentzian signature this is
related to the existence of two non-isomorphic algebras, while in Euclidean and
neutral signature the two theories are related by a local field redefinition
which implements an isomorphism between the underlying supersymmetry algebras.
","[{""version"":""v1"",""created"":""Sun, 28 Jul 2019 10:52:47 GMT""}]","2020-10-28"
"1907.12068","Nguyen Quang Hung","Nguyen Ngoc Anh, Nguyen Quang Hung, Nguyen Xuan Hai, Pham Dinh Khang,
  A. M. Sukhovoj, L. V. Mitsyna, Ho Huu Thang, and Le Hong Khiem","Level scheme of $^{153}$Sm obtained from $^{152}$Sm($n_{th}$,$\gamma$)
  reaction using $\gamma-\gamma$ coincidence spectrometer","39 pages, 8 figures, and 3 tables. Accepted in Phys. Rev. C",,,,"nucl-ex nucl-th","http://arxiv.org/licenses/nonexclusive-distrib/1.0/","  The level scheme of the compound $^{153}$Sm nucleus formed via the
$^{152}$Sm($n_{th}$,$\gamma$) reaction is studied by using the $\gamma-\gamma$
coincidence spectrometer at Dalat Nuclear Research Institute, Vietnam. All the
gamma cascades, which correspond to the decays from the compound state to 12
final levels of 0 ($\frac{3}{2}^+$), 7.535 ($\frac{5}{2}^+$), 35.844
($\frac{3}{2}^-$), 90.875 ($\frac{5}{2}^-$), 126.412 ($\frac{1}{2}^-$), 127.298
($\frac{3}{2}^-$), 182.902 ($\frac{5}{2}^-$), 321.113 ($\frac{3}{2}^+$),
404.129 ($\frac{1}{2}^-$), 405.470 ($\frac{3}{2}^-$), 414.924
($\frac{1}{2}^+$), and 481.088 ($\frac{3}{2}^+$) keV, have been measured. A
total number of 386 cascades corresponding to 576 gamma transitions has been
detected. Among these cascades, 103 primary gamma transitions together with
their corresponding intermediate levels and 299 secondary transitions have been
determined. In addition, 29 primary gamma transitions, 42 intermediate levels,
and 8 secondary transitions have been found to be the same as those extracted
from the ENSDF data. The remain 74 primary gamma transitions, 61 intermediate
levels, and 291 secondary transitions are therefore considered as the new data.
In particular, based on an assumption that most of the transitions are dipole,
we have tentatively assigned the unique spin value of $\frac{3}{2}\hbar$ for 53
observed intermediate levels corresponding to the cascades from the compound
state to the final ones of 7.535 ($\frac{5}{2}^+$), 90.875 ($\frac{5}{2}^-$),
and 182.902 ($\frac{5}{2}^-$) keV, whereas the remain levels are assigned with
the spin values in the range of $[\frac{1}{2},\frac{3}{2}]\hbar$...
","[{""version"":""v1"",""created"":""Sun, 28 Jul 2019 10:55:02 GMT""}]","2019-07-30"
"1907.12069","Mael Guennou","Cosme Milesi-Brault, Constance Toulouse, Evan Constable, Hugo
  Aramberri, Virginie Simonet, Sophie de Brion, Helmuth Berger, Luigi
  Paolasini, Alexei Bosak, Jorge \'I\~niguez, and Mael Guennou","Archetypal soft-mode driven antipolar transition in francisite
  Cu3Bi(SeO3)2O2Cl","6 pages, 5 Figures, supplemental material included","Phys. Rev. Lett. 124, 097603 (2020)","10.1103/PhysRevLett.124.097603",,"cond-mat.mtrl-sci","http://arxiv.org/licenses/nonexclusive-distrib/1.0/","  Model materials are precious test cases for elementary theories and provide
building blocks for the understanding of more complex cases. Here, we describe
the lattice dynamics of the structural phase transition in francisite
Cu3Bi(SeO3)2O2Cl at 115 K and show that it provides a rare archetype of a
transition driven by a soft antipolar phonon mode. In the high-symmetry phase
at hightemperatures, the soft mode is found at (0,0,0.5) at the Brillouin zone
boundary and is measured by inelastic X-ray scattering and thermal diffuse
scattering. In the low-symmetry phase, this softmode is folded back onto the
center of the Brillouin zone as a result of the doubling of the unit cell, and
appears as a fully symmetric mode that can be tracked by Raman spectroscopy. On
both sides of the transition, the mode energy squared follows a linear
behaviour over a large temperature range. First-principles calculations reveal
that, surprisingly, the flat phonon band calculated for the high-symmetry phase
seems incompatible with the displacive character found experimentally. We
discuss this unusual behavior in the context of an ideal Kittel model of an
antiferroelectric transition.
","[{""version"":""v1"",""created"":""Sun, 28 Jul 2019 11:00:04 GMT""},{""version"":""v2"",""created"":""Mon, 14 Oct 2019 13:36:44 GMT""},{""version"":""v3"",""created"":""Thu, 19 Dec 2019 09:57:05 GMT""}]","2020-03-11"
"1907.12070","Lingling Zhu","Feng Shu, Lingling Zhu, Wenlong Cai, Tong Shen, Jinyong Lin, Shuo
  Zhang, and Jiangzhou Wang","Two Efficient Beamformers for Secure Precise Jamming and Communication
  with Phase Alignment",,,,,"eess.SP cs.IT math.IT","http://arxiv.org/licenses/nonexclusive-distrib/1.0/","  To achieve a better effect of interference on eavesdropper with an enhanced
security, a secure precise jamming (PJ) and communication (SPJC) is proposed
and its basic idea is to force the transmit energy of artificial noise (AN) and
confidential message into the neighborhoods of Eve and Bob by using random
subcarrier selection (RSS), directional modulation, and beamforming under phase
alignment (PA) constraint (PAC). Here, we propose two high-performance
beamforming schemes: minimum transmit power (Min-TP) and minimum regularized
transmit power (Min-RTP) to achieve SPJC under PAC and orthogonal constraint
(OC), where OC means that AN and CM are projected onto the null-spaces of the
desired and eavesdropping channels, respectively. Simulation results show that
the proposed Min-TP and Min-RTP methods perform much better than existing equal
amplitude (EA) method in terms of both bit-error-rate (BER) and secrecy rate
(SR) at medium and high signal-to-noise ratio regions. The SR performance
difference between the proposed two methods becomes trivial as the number of
transmit antennas approaches large-scale. More importantly, we also find the
fact that all three schemes including EA, Min-TP, and Min-RTP can form two main
peaks of AN and CM around Eve and Bob, respectively. This achieves both PJ and
secure precise wireless transmission (SPWT), called SPJC.
","[{""version"":""v1"",""created"":""Sun, 28 Jul 2019 11:02:18 GMT""},{""version"":""v2"",""created"":""Wed, 31 Jul 2019 07:43:02 GMT""}]","2019-08-01"
"1907.12071","Xiaohan Lin","Yuanyuan Mi, Xiaohan Lin, Xiaolong Zou, Zilong Ji, Tiejun Huang, Si Wu","Spatiotemporal Information Processing with a Reservoir Decision-making
  Network","9 pages, 6 figures",,,,"q-bio.NC cs.LG cs.NE","http://arxiv.org/licenses/nonexclusive-distrib/1.0/","  Spatiotemporal information processing is fundamental to brain functions. The
present study investigates a canonic neural network model for spatiotemporal
pattern recognition. Specifically, the model consists of two modules, a
reservoir subnetwork and a decision-making subnetwork. The former projects
complex spatiotemporal patterns into spatially separated neural
representations, and the latter reads out these neural representations via
integrating information over time; the two modules are combined together via
supervised-learning using known examples. We elucidate the working mechanism of
the model and demonstrate its feasibility for discriminating complex
spatiotemporal patterns. Our model reproduces the phenomenon of recognizing
looming patterns in the neural system, and can learn to discriminate gait with
very few training examples. We hope this study gives us insight into
understanding how spatiotemporal information is processed in the brain and
helps us to develop brain-inspired application algorithms.
","[{""version"":""v1"",""created"":""Sun, 28 Jul 2019 11:04:34 GMT""}]","2019-07-30"
"1907.12072","Jin-Fu Chen","Jin-Fu Chen, Yu-Han Ma, Chang-Pu Sun","Directional quantum random walk induced by coherence","14 pages, 7 figures",,"10.1007/s11467-019-0944-x",,"quant-ph","http://arxiv.org/licenses/nonexclusive-distrib/1.0/","  Quantum walk (QW), which is considered as the quantum counterpart of the
classical random walk (CRW), is actually the quantum extension of CRW from the
single-coin interpretation. The sequential unitary evolution engenders
correlation between different steps in QW and leads to a ballistic position
distribution. In this paper, we propose an alternative quantum extension of CRW
from the ensemble interpretation, named quantum random walk (QRW), where the
walker has many unrelated coins, modeled as two-level systems, initially
prepared in the same state. We calculate the walker's position distribution in
QRW for different initial coin states with the coin operator chosen as Hadamard
matrix. In one-dimensional case, the walker's position is the asymmetric
binomial distribution. We further demonstrate that in QRW, coherence leads the
walker to perform directional movement. For an initially decoherenced coin
state, the walker's position distribution is exactly the same as that of CRW.
Moreover, we study QRW in 2D lattice, where the coherence plays a more
diversified role in the walker's position distribution.
","[{""version"":""v1"",""created"":""Sun, 28 Jul 2019 11:05:22 GMT""}]","2020-03-11"
"1907.12073","Alexander Lyapin","Alexander P. Lyapin, Sreelatha Chandragiri","Generating functions for vector partition functions and a basic
  recurrence relation","10 pages. The article will appear in JDEA - Journal of Difference
  Equations and Applications (GDEA 1649396)","Journal of Difference Equations and Applications, 25:7, 1052-1061
  (2019)","10.1080/10236198.2019.1649396",,"math.CV math.CO math.DS","http://arxiv.org/licenses/nonexclusive-distrib/1.0/","  We define a generalized vector partition function and derive an identity for
generating series of such functions associated with solutions of basic
recurrence relation of combinatorial analysis. As a consequence, we obtain the
generating function of the number of generalized lattice paths and a new
version of Chaundy-Bullard identity for the vector partition function.
","[{""version"":""v1"",""created"":""Sun, 28 Jul 2019 11:11:48 GMT""}]","2019-09-05"
"1907.12074","Oliver Matheau-Raven Mr","Michael E. Bate, Stephen B. Connor, Oliver Matheau-Raven","Cutoff for a One-sided Transposition Shuffle","24 pages. In this revised paper we prove the existence of a total
  variation cutoff for the biased one-sided transposition shuffles with bias
  $\alpha \geq 1$. This completes the proof of the existence of a cutoff for
  any biased one-sided transposition shuffle with bias $\alpha \in \mathbb{R}$",,,,"math.PR math.RT","http://arxiv.org/licenses/nonexclusive-distrib/1.0/","  We introduce a new type of card shuffle called one-sided transpositions. At
each step a card is chosen uniformly from the pack and then transposed with
another card chosen uniformly from below it. This defines a random walk on the
symmetric group generated by a distribution which is non-constant on the
conjugacy class of transpositions. Nevertheless, we provide an explicit formula
for all eigenvalues of the shuffle by demonstrating a useful correspondence
between eigenvalues and standard Young tableaux. This allows us to prove the
existence of a total-variation cutoff for the one-sided transposition shuffle
at time $n\log n$. We also study a weighted generalisation of the shuffle
which, in particular, allows us to recover the well known mixing time of the
classical random transposition shuffle.
","[{""version"":""v1"",""created"":""Sun, 28 Jul 2019 11:16:29 GMT""},{""version"":""v2"",""created"":""Mon, 22 Jun 2020 10:15:20 GMT""}]","2020-06-23"
"1907.12075","Zheming Wang","Zheming Wang and Rapha\""el M. Jungers","Data-driven computation of invariant sets of discrete time-invariant
  black-box systems","A shorter version with the title ""Scenario-based set invariance
  verification for black-box nonlinear systems"" is published in the IEEE
  Control Systems Letters (L-CSS)",,"10.1109/LCSYS.2020.3001882",,"eess.SY cs.SY math.DS","http://arxiv.org/licenses/nonexclusive-distrib/1.0/","  We consider the problem of computing the maximal invariant set of
discrete-time black-box nonlinear systems without analytic dynamical models.
Under the assumption that the system is asymptotically stable, the maximal
invariant set coincides with the domain of attraction. A data-driven framework
relying on the observation of trajectories is proposed to compute
almost-invariant sets, which are invariant almost everywhere except a small
subset. Based on these observations, scenario optimization problems are
formulated and solved. We show that probabilistic invariance guarantees on the
almost-invariant sets can be established. To get explicit expressions of such
sets, a set identification procedure is designed with a verification step that
provides inner and outer approximations in a probabilistic sense. The proposed
data-driven framework is illustrated by several numerical examples.
","[{""version"":""v1"",""created"":""Sun, 28 Jul 2019 11:43:52 GMT""},{""version"":""v2"",""created"":""Fri, 13 Dec 2019 10:53:08 GMT""},{""version"":""v3"",""created"":""Sat, 16 May 2020 09:01:01 GMT""},{""version"":""v4"",""created"":""Tue, 16 Jun 2020 14:47:05 GMT""},{""version"":""v5"",""created"":""Fri, 28 May 2021 13:54:44 GMT""}]","2021-05-31"
"1907.12076","David Collins","David M. Collins, Angus J. Wilkinson, Richard I. Todd","Warren-Averbach line broadening analysis from a time of flight neutron
  diffractometer","Preprint under review",,,,"cond-mat.mtrl-sci","http://arxiv.org/licenses/nonexclusive-distrib/1.0/","  The well known Warren-Averbach theory of diffraction line profile broadening
is shown to be applicable to time of flight data obtained from a neutron
spallation source. Without modification, the method is applied to two very
different examples; a cold worked ferritic steel and a thermally stressed
alumina-30% SiC composite. Values of root mean square strains averaged over a
range of lengths for the ferritic steel were used to estimate dislocation
densities; values were found to be in good agreement with geometrically
necessary dislocation densities independently measured from similarly
orientated grains measured from electron backscatter diffraction analysis. An
analytical model for the ceramic is described to validate the estimate of root
mean square strain.
","[{""version"":""v1"",""created"":""Sun, 28 Jul 2019 12:08:03 GMT""}]","2019-07-30"
"1907.12077","Sanjeev S. Seahra","Sanjeev S. Seahra","The initial value problem for gravitational waves in conformal gravity","Exposition added, minor edits. Matches version accepted in CQG. 14+1
  pages, 1 figure",,"10.1088/1361-6382/ab6be1",,"gr-qc","http://arxiv.org/licenses/nonexclusive-distrib/1.0/","  In certain models of conformal gravity, the propagation of gravitational
waves is governed by a fourth order scalar partial differential equation. We
study the initial value problem for a generalization of this equation, and
derive a Kirchhoff-like explicit solution in terms of the field and its first
three time derivatives evaluated on an initial hypersurface, as well as second
order spatial derivatives of the initial data. In the conformal gravity case,
we establish that if the initial data is featureless on scales smaller than the
length scale of conformal symmetry breaking, then we recover the ordinary
behaviour of gravitational waves in general relativity. We also confirm that
effective weak field gravitational force exerted by a static spherical body in
such models becomes constant on small scales; i.e. conformal gravity is
effectively 2-dimensional at high energies.
","[{""version"":""v1"",""created"":""Sun, 28 Jul 2019 12:15:10 GMT""},{""version"":""v2"",""created"":""Wed, 15 Jan 2020 12:51:03 GMT""}]","2020-04-08"
"1907.12078","Jesse Beisegel","Jesse Beisegel and Maria Chudnovsky and Vladimir Gurvich and Martin
  Milani\v{c} and Mary Servatius","Avoidable Vertices and Edges in Graphs",,,,,"math.CO cs.DM","http://arxiv.org/licenses/nonexclusive-distrib/1.0/","  A vertex in a graph is simplicial if its neighborhood forms a clique. We
consider three generalizations of the concept of simplicial vertices: avoidable
vertices (also known as \textit{OCF}-vertices), simplicial paths, and their
common generalization avoidable paths, introduced here. We present a general
conjecture on the existence of avoidable paths. If true, the conjecture would
imply a result due to Ohtsuki, Cheung, and Fujisawa from 1976 on the existence
of avoidable vertices, and a result due to Chv\'atal, Sritharan, and Rusu from
2002 the existence of simplicial paths. In turn, both of these results
generalize Dirac's classical result on the existence of simplicial vertices in
chordal graphs.
  We prove that every graph with an edge has an avoidable edge, which settles
the first open case of the conjecture. We point out a close relationship
between avoidable vertices in a graph and its minimal triangulations, and
identify new algorithmic uses of avoidable vertices, leading to new
polynomially solvable cases of the maximum weight clique problem in classes of
graphs simultaneously generalizing chordal graphs and circular-arc graphs.
Finally, we observe that the proved cases of the conjecture have interesting
consequences for highly symmetric graphs: in a vertex-transitive graph every
induced two-edge path closes to an induced cycle, while in an edge-transitive
graph every three-edge path closes to a cycle and every induced three-edge path
closes to an induced cycle.
","[{""version"":""v1"",""created"":""Sun, 28 Jul 2019 12:41:11 GMT""}]","2019-07-30"
"1907.12079","Hannah Kim","Hannah Kim, Dongjin Choi, Barry Drake, Alex Endert, Haesun Park","TopicSifter: Interactive Search Space Reduction Through Targeted Topic
  Modeling",,,,,"cs.IR cs.HC","http://arxiv.org/licenses/nonexclusive-distrib/1.0/","  Topic modeling is commonly used to analyze and understand large document
collections. However, in practice, users want to focus on specific aspects or
""targets"" rather than the entire corpus. For example, given a large collection
of documents, users may want only a smaller subset which more closely aligns
with their interests, tasks, and domains. In particular, our paper focuses on
large-scale document retrieval with high recall where any missed relevant
documents can be critical. A simple keyword matching search is generally not
effective nor efficient as 1) it is difficult to find a list of keyword queries
that can cover the documents of interest before exploring the dataset, 2) some
documents may not contain the exact keywords of interest but may still be
highly relevant, and 3) some words have multiple meanings, which would result
in irrelevant documents included in the retrieved subset. In this paper, we
present TopicSifter, a visual analytics system for interactive search space
reduction. Our system utilizes targeted topic modeling based on nonnegative
matrix factorization and allows users to give relevance feedback in order to
refine their target and guide the topic modeling to the most relevant results.
","[{""version"":""v1"",""created"":""Sun, 28 Jul 2019 13:27:18 GMT""}]","2019-07-30"
"1907.12080","Wei Liu","Junhao Hu, Wei Liu, Feiqi Deng, Xuerong Mao","Advances in Stabilisation of Hybrid Stochastic Differential Equations by
  Delay Feedback Control",,,,,"math.OC math.PR","http://arxiv.org/licenses/nonexclusive-distrib/1.0/","  A novel approach to design the feedback control based on past states is
proposed for hybrid stochastic differential equations (HSDEs). This new theorem
builds up the connection between the delay feedback control and the control
function without delay terms, which enables one to construct the delay feedback
control using the existing results on stabilities of HSDEs. Methods to find the
upper bound of the length of the time delay are also investigated. Numerical
simulations are presented to demonstrate the new theorem.
","[{""version"":""v1"",""created"":""Sun, 28 Jul 2019 13:45:54 GMT""}]","2019-07-30"
"1907.12081","Igor Mencattini","Igor Mencattini, Alexandre Quesney, Pryscilla Silva","Post-symmetric braces and integration of post-Lie algebras","This is published version of the paper previously titled ""On the
  post-symmetric brace algebras"". The last section of the older version was
  removed from the new one and it will be part of a new preprint. 25 pages, 20
  figures","Journal of Algebra, Vol. 556, 2020, page. 547--580","10.1016/j.jalgebra.2020.03.018",,"math.RA","http://arxiv.org/licenses/nonexclusive-distrib/1.0/","  In this paper we identify the post-Lie analogue of the symmetric brace
algebras, advocate their role in the theory of the associated D-algebras and
present some relations with the so-called post-Lie Magnus expansion.
","[{""version"":""v1"",""created"":""Sun, 28 Jul 2019 13:46:59 GMT""},{""version"":""v2"",""created"":""Wed, 17 Jun 2020 19:02:59 GMT""}]","2020-06-19"
"1907.12082","Sergei Koniakhin","Sergei V. Koniakhin","Effects of resource competition on evolution and adaptive radiation","13 pages, 12 figures",,,,"q-bio.PE","http://arxiv.org/licenses/nonexclusive-distrib/1.0/","  The entanglement of population dynamics, evolution and adaptive radiation for
the species sharing common resources is studied. For the population dynamics we
modify the competitive Lotka-Volterra equations introducing a new resource
contest principles. The functional response of the model differs from linear
and ratio-dependent functional response. We implement realistically the effects
of beneficial and deleterious mutations on the coefficients in the equations
governing the population dynamics and consider the spontaneously occurring
reproductive isolation. To trace the phylogeny relations in the evolving
ecosystems, we use the effective digital genomes and then use the flexible
molecular clock technique. The proposed model is in agreement with the
competition exclusion principle and no vacant niche axiom. We demonstrate the
mechanism that contributes to prevention of the genomic decay: the competition
and selection between the recently diverged species/populations. We demonstrate
that the large resource influx and fast speciation are favorable conditions
against the genomic decay. The model predicts that in the case of several
constant in time resources one observes very rapid specialization and in the
unstable environment the omnivory strategy was preferable.
","[{""version"":""v1"",""created"":""Sun, 28 Jul 2019 13:58:43 GMT""}]","2019-07-30"
