"1907.11976","Adam Anderson","A. J. Anderson, P. A. R. Ade, Z. Ahmed, J. S. Avva, P. S. Barry, R.
  Basu Thakur, A. N. Bender, B. A. Benson, L. Bryant, K. Byrum, J. E.
  Carlstrom, F. W. Carter, T. W. Cecil, C. L. Chang, H.-M. Cho, J. F. Cliche,
  A. Cukierman, T. de Haan, E. V. Denison, J. Ding, M. A. Dobbs, D. Dutcher, W.
  Everett, K. R. Ferguson, A. Foster, J. Fu, J. Gallicchio, A. E. Gambrel, R.
  W. Gardner, A. Gilbert, J. C. Groh, S. Guns, R. Guyser, N. W. Halverson, A.
  H. Harke-Hosemann, N. L. Harrington, J. W. Henning, G. C. Hilton, W. L.
  Holzapfel, D. Howe, N. Huang, K. D. Irwin, O. B. Jeong, M. Jonas, A. Jones,
  T. S. Khaire, A. M. Kofman, M. Korman, D. L. Kubik, S. Kuhlmann, C.-L. Kuo,
  A. T. Lee, E. M. Leitch, A. E. Lowitz, S. S. Meyer, D. Michalik, J.
  Montgomery, A. Nadolski, T. Natoli, H. Nguyen, G. I. Noble, V. Novosad, S.
  Padin, Z. Pan, P. Paschos, J. Pearson, C. M. Posada, W. Quan, A. Rahlin, D.
  Riebel, J. E. Ruhl, J.T. Sayre, E. Shirokoff, G. Smecher, J. A. Sobrin, A. A.
  Stark, J. Stephen, K. T. Story, A. Suzuki, K. L. Thompson, C. Tucker, L. R.
  Vale, K. Vanderlinde, J. D. Vieira, G. Wang, N. Whitehorn, V. Yefremenko, K.
  W. Yoon, M. R. Young","Performance of Al-Mn Transition-Edge Sensor Bolometers in SPT-3G","9 pages, 5 figures, submitted to the Journal of Low Temperature
  Physics: LTD18 Special Edition",,"10.1007/s10909-019-02259-7","FERMILAB-PUB-19-359-AE","astro-ph.IM physics.ins-det","http://arxiv.org/licenses/nonexclusive-distrib/1.0/","  SPT-3G is a polarization-sensitive receiver, installed on the South Pole
Telescope, that measures the anisotropy of the cosmic microwave background
(CMB) from degree to arcminute scales. The receiver consists of ten
150~mm-diameter detector wafers, containing a total of 16,000 transition-edge
sensor (TES) bolometers observing at 95, 150, and 220 GHz. During the 2018-2019
austral summer, one of these detector wafers was replaced by a new wafer
fabricated with Al-Mn TESs instead of the Ti/Au design originally deployed for
SPT-3G. We present the results of in-lab characterization and on-sky
performance of this Al-Mn wafer, including electrical and thermal properties,
optical efficiency measurements, and noise-equivalent temperature. In addition,
we discuss and account for several calibration-related systematic errors that
affect measurements made using frequency-domain multiplexing readout
electronics.
","[{""version"":""v1"",""created"":""Sat, 27 Jul 2019 20:45:59 GMT""}]","2020-01-08"
"1907.11977","Mahmoud Payami","Mohammad-Reza Basaadat and Mahmoud Payami","Elastic stiffness tensors of Zr-$x$Nb alloy in presence of defects: A
  molecular dynamics study","23 pages, 8 figures, 4 tables","Int. J. Mod. Phys. C, Vol. 31, No. 2 (2020) 2050028 (19 pages),
  World Scientific","10.1142/S012918312050028X",,"cond-mat.mtrl-sci","http://arxiv.org/licenses/nonexclusive-distrib/1.0/","  In a nuclear reactor, the Zr-$x$Nb alloy, which is used as a structural
material in the core region, is irradiated by energetic particles that cause
the atoms to be displaced from their lattice sites and giving rise to crystal
defects. The local changes in the atomic arrangements lead to local
deformations of the solid and thereby changes of its local mechanical
properties. Understanding the mechanisms behind this evolution in the core
region of a reactor, and its monitoring or controlling is a critical task in
nuclear industry. In this work, using extensive molecular dynamics simulations,
we have studied the effects of radiation damage on the local mechanical
properties of Zr-$x$Nb alloy. In the first step, the effect of Nb-concentration
on the mechanical stability of homogeneous Zr-$x$Nb alloy is investigated. In
the second step, we have studied the local changes of the elastic constants due
to local changes of the microstructure. These local changes include presence
and accumulation of vacancies in the form of dislocation loops or voids,
accumulation of Nb atoms in the form of clusters of different morphologies.
This study covers both cases of $T=0^\circ$K and finite temperatures up to
$T=600^\circ$K.
","[{""version"":""v1"",""created"":""Sat, 27 Jul 2019 21:02:32 GMT""},{""version"":""v2"",""created"":""Wed, 4 Dec 2019 15:10:44 GMT""}]","2020-04-28"
"1907.11978","Robin Wilson","Emille Davie Lawrence and Robin T. Wilson","The Structure of the Heawood Graph","8 pages, 7 figures",,,,"math.CO","http://arxiv.org/licenses/nonexclusive-distrib/1.0/","  We give a description of the cycle structure of the Heawood graph, $C_{14}$.
In particular, we prove that the automorphism group of $C_{14}$ acts
transitively on the set of $12$-cycles, Hamiltonian cycles, and disjoint pairs
of $6$-cycles. We also enumerate $12$-, $10$-, and $8$-cycles in $C_{14}$, as
well as pairs of disjoint $6$-cycles.
","[{""version"":""v1"",""created"":""Sat, 27 Jul 2019 21:02:54 GMT""}]","2019-07-30"
"1907.11979","Hrishit Banerjee","Hrishit Banerjee, Oleg Janson, Karsten Held, and Tanusri Saha-Dasgupta","Electronic and Magnetic State of LaMnO$_3$ Epitaxially Strained on
  SrTiO$_3$: Effect of Local Correlation and Non-local Exchange","10 pages, 7 figures","Phys. Rev. B 100, 115143 (2019)","10.1103/PhysRevB.100.115143",,"cond-mat.mtrl-sci cond-mat.str-el","http://arxiv.org/licenses/nonexclusive-distrib/1.0/","  Motivated by the puzzling report of the observation of a ferromagnetic
insulating state in LaMnO$_3$/SrTiO$_3$ heterostructures, we calculate the
electronic and magnetic state of LaMnO$_3$, coherently matched to a SrTiO$_3$
square substrate within a ""strained-bulk"" geometry. We employ three different
density functional theory based computational approaches: (a) density
functional theory (DFT) supplemented with Hubbard U (DFT+U), (b) DFT +
dynamical mean field theory (DMFT), and (c) a hybrid functional treatment of
the exchange-correlation functional. While the first two approaches include
local correlations and exchange at Mn sites, treated in a static and dynamic
manner, respectively, the last one takes into account the effect of non-local
exchange at all sites. We find in all three approaches that the compressive
strain induced by the square substrate of SrTiO$_3$ turns LaMnO$_3$ from an
antiferromagnet with sizable orbital polarization to a ferromagnet with
suppressed Jahn-Teller distortion in agreement with experiment. However, while
both DFT+U and DFT+DMFT provide a metallic solution, only the hybrid
calculations result in an insulating solution, as observed in experiment. This
insulating behavior is found to originate from an electronic charge
disproportionation. Our conclusions remain valid when we investigate
LaMnO$_3$/SrTiO$_3$ within the experimental set-up of a superlattice geometry
using DFT+U and hybrid calculations.
","[{""version"":""v1"",""created"":""Sat, 27 Jul 2019 21:09:22 GMT""}]","2019-09-25"
"1907.11980","Seyed Mehdi Iranmanesh","Seyed Mehdi Iranmanesh, Nasser M. Nasrabadi","Attribute-Guided Deep Polarimetric Thermal-to-visible Face Recognition",,,,,"cs.CV","http://arxiv.org/licenses/nonexclusive-distrib/1.0/","  In this paper, we present an attribute-guided deep coupled learning framework
to address the problem of matching polarimetric thermal face photos against a
gallery of visible faces. The coupled framework contains two sub-networks, one
dedicated to the visible spectrum and the second sub-network dedicated to the
polarimetric thermal spectrum. Each sub-network is made of a generative
adversarial network (GAN) architecture. We propose a novel Attribute-Guided
Coupled Generative Adversarial Network (AGC-GAN) architecture which utilizes
facial attributes to improve the thermal-to-visible face recognition
performance. The proposed AGC-GAN exploits the facial attributes and leverages
multiple loss functions in order to learn rich discriminative features in a
common embedding subspace. To achieve a realistic photo reconstruction while
preserving the discriminative information, we also add a perceptual loss term
to the coupling loss function. An ablation study is performed to show the
effectiveness of different loss functions for optimizing the proposed method.
Moreover, the superiority of the model compared to the state-of-the-art models
is demonstrated using polarimetric dataset.
","[{""version"":""v1"",""created"":""Sat, 27 Jul 2019 21:14:30 GMT""}]","2019-07-30"
"1907.11981","Curtis Bright","Curtis Bright, Ilias Kotsireas, Albert Heinle, Vijay Ganesh","Complex Golay Pairs up to Length 28: A Search via Computer Algebra and
  Programmatic SAT","Extended version of arXiv:1805.05488, to appear in the Journal of
  Symbolic Computation",,"10.1016/j.jsc.2019.10.013",,"cs.SC cs.LO math.CO","http://arxiv.org/licenses/nonexclusive-distrib/1.0/","  We use techniques from the fields of computer algebra and satisfiability
checking to develop a new algorithm to search for complex Golay pairs. We
implement this algorithm and use it to perform a complete search for complex
Golay pairs of lengths up to 28. In doing so, we find that complex Golay pairs
exist in the lengths 24 and 26 but do not exist in the lengths 23, 25, 27, and
28. This independently verifies work done by F. Fiedler in 2013 and confirms
the 2002 conjecture of Craigen, Holzmann, and Kharaghani that complex Golay
pairs of length 23 don't exist. Our algorithm is based on the recently proposed
SAT+CAS paradigm of combining SAT solvers with computer algebra systems to
efficiently search large spaces specified by both algebraic and logical
constraints. The algorithm has two stages: first, a fine-tuned computer program
uses functionality from computer algebra systems and numerical libraries to
construct a list containing every sequence which could appear as the first
sequence in a complex Golay pair up to equivalence. Second, a programmatic SAT
solver constructs every sequence (if any) that pair off with the sequences
constructed in the first stage to form a complex Golay pair. This extends work
originally presented at the International Symposium on Symbolic and Algebraic
Computation (ISSAC) in 2018; we discuss and implement several improvements to
our algorithm that enabled us to improve the efficiency of the search and
increase the maximum length we search from length 25 to 28.
","[{""version"":""v1"",""created"":""Sat, 27 Jul 2019 21:21:34 GMT""}]","2019-11-15"
"1907.11982","Alexander Veretennikov","Alexander Veretennikov","On polynomial recurrence for reliability system with a warm reserve","20 pages, 15 references; some errors corrected in comparison with the
  version v1","Markov Processes and Related Fields. 2019. Vol. 25. P. 745-761","10.1007/s11134-019-09626-x",,"math.PR","http://arxiv.org/licenses/nonexclusive-distrib/1.0/","  Conditions for positive and polynomial recurrence have been proposed for a
class of reliability models of two elements with transitions from working state
to failure and back. As a consequence, uniqueness of stationary distribution of
the model is proved; the rate of convergence towards this distribution may be
theoretically evaluated on the basis of the established recurrence.
","[{""version"":""v1"",""created"":""Sat, 27 Jul 2019 21:37:59 GMT""},{""version"":""v2"",""created"":""Mon, 30 Sep 2019 13:43:03 GMT""},{""version"":""v3"",""created"":""Wed, 27 May 2020 19:21:41 GMT""}]","2020-05-29"
"1907.11983","Xiaodong Liu","Pengcheng He, Xiaodong Liu, Weizhu Chen and Jianfeng Gao","A Hybrid Neural Network Model for Commonsense Reasoning","9 pages, 3 figures, 6 tables",,,,"cs.CL","http://arxiv.org/licenses/nonexclusive-distrib/1.0/","  This paper proposes a hybrid neural network (HNN) model for commonsense
reasoning. An HNN consists of two component models, a masked language model and
a semantic similarity model, which share a BERT-based contextual encoder but
use different model-specific input and output layers. HNN obtains new
state-of-the-art results on three classic commonsense reasoning tasks, pushing
the WNLI benchmark to 89%, the Winograd Schema Challenge (WSC) benchmark to
75.1%, and the PDP60 benchmark to 90.0%. An ablation study shows that language
models and semantic similarity models are complementary approaches to
commonsense reasoning, and HNN effectively combines the strengths of both. The
code and pre-trained models will be publicly available at
https://github.com/namisan/mt-dnn.
","[{""version"":""v1"",""created"":""Sat, 27 Jul 2019 21:51:52 GMT""}]","2019-07-30"
"1907.11984","Tarik A. Rashid","Naser Rostamni and Tarik A. Rashid","Investigating the effect of competitiveness power in estimating the
  average weighted price in electricity market","11 pages","The Electricity Journal, 2019","10.1016/j.tej.2019.106628",,"q-fin.ST cs.LG","http://creativecommons.org/licenses/by-sa/4.0/","  This paper evaluates the impact of the power extent on price in the
electricity market. The competitiveness extent of the electricity market during
specific times in a day is considered to achieve this. Then, the effect of
competitiveness extent on the forecasting precision of the daily power price is
assessed. A price forecasting model based on multi-layer perception via back
propagation with the Levenberg-Marquardt mechanism is used. The Residual Supply
Index (RSI) and other variables that affect prices are used as inputs to the
model to evaluate the market competitiveness. The results show that using
market power indices as inputs helps to increase forecasting accuracy. Thus,
the competitiveness extent of the market power in different daily time periods
is a notable variable in price formation. Moreover, market players cannot
ignore the explanatory power of market power in price forecasting. In this
research, the real data of the electricity market from 2013 is used and the
main source of data is the Grid Management Company in Iran.
","[{""version"":""v1"",""created"":""Sat, 27 Jul 2019 22:13:38 GMT""}]","2019-07-30"
"1907.11985","Chenguang Dai","Chenguang Dai and Jun S. Liu","The Wang-Landau Algorithm as Stochastic Optimization and Its
  Acceleration","10 pages, 3 figures","Phys. Rev. E 101, 033301 (2020)","10.1103/PhysRevE.101.033301",,"stat.CO cs.LG math.OC","http://arxiv.org/licenses/nonexclusive-distrib/1.0/","  We show that the Wang-Landau algorithm can be formulated as a stochastic
gradient descent algorithm minimizing a smooth and convex objective function,
of which the gradient is estimated using Markov chain Monte Carlo iterations.
The optimization formulation provides us a new way to establish the convergence
rate of the Wang-Landau algorithm, by exploiting the fact that almost surely,
the density estimates (on the logarithmic scale) remain in a compact set, upon
which the objective function is strongly convex. The optimization viewpoint
motivates us to improve the efficiency of the Wang-Landau algorithm using
popular tools including the momentum method and the adaptive learning rate
method. We demonstrate the accelerated Wang-Landau algorithm on a
two-dimensional Ising model and a two-dimensional ten-state Potts model.
","[{""version"":""v1"",""created"":""Sat, 27 Jul 2019 22:31:08 GMT""},{""version"":""v2"",""created"":""Sun, 2 Feb 2020 20:45:57 GMT""}]","2020-03-11"
"1907.11986","Kevin O'Neill","Kevin O'Neill","A Quantitative Stability Theorem for Convolution on the Heisenberg Group","22 pages",,,,"math.CA","http://arxiv.org/licenses/nonexclusive-distrib/1.0/","  Although convolution on Euclidean space and the Heisenberg group satisfy the
same $L^p$ bounds with the same optimal constants, the former has maximizers
while the latter does not. However, as work of Christ has shown, it is still
possible to characterize near-maximizers. Specifically, any near-maximizing
triple of the trilinear form for convolution on the Heisenberg group must be
close to a particular type of triple of ordered Gaussians after adjusting by
symmetry. In this paper, we use the expansion method to prove a quantitative
version of this characterization.
","[{""version"":""v1"",""created"":""Sat, 27 Jul 2019 22:37:41 GMT""}]","2019-07-30"
"1907.11987","Hiroshi Yanagihara","H. Yanagihara","Lowener Theory on Analytic Universal Covering Maps","65 pages",,,,"math.CV","http://arxiv.org/licenses/nonexclusive-distrib/1.0/","  Let $\mathcal{H}_0(\mathbb{D})$ be the class of all analytic functions $f$ in
the unit disc $\mathbb{D} = \{z \in \mathbb{C} : |z| < 1 \}$ with $f(0)=0
\text{ and } f_t'(0) > 0$. Let $\mathfrak{B} = \{ \omega \in
\mathcal{H}_0(\mathbb{D}) : \omega(\mathbb{D}) \subset \mathbb{D}\}$. We say
that a one parameter family of analytic functions $\{ f_t \}_{t \in I}$ in
$\mathcal{H}_0(\mathbb{D})$ on an interval $I \subset [-\infty, \infty]$, is a
Loewner chain if $f_s$ is subordinate to $f_t$ whenever $s,t \in I$ with $s<t$,
i.e., there exists $\omega_{s,t} \in \mathfrak{B}$ with $f_s = f_t \circ
\omega_{s,t}$. Notice that we omit the univalence assumption on each $f_t$. We
shall show that if $f_t'(0)$ is continuous and strictly increasing in $t$, then
$f(z,t) := f_t(z)$ satisfies a partial differential equation which is a
generalization of Loewner-Kufarev equation, and $\{ f_t \}_{t \in I}$ can be
expressed as $f_t = F \circ g_t $, $t \in I$, where $F$ is an analytic function
on a disc $\mathbb{D}(0,r) = \{ z \in \mathbb{C} : |z| < r \}$ with $r =
\lim_{t \uparrow \sup I}f_t'(0) \in (0, \infty ]$ and $F(0)= F'(0)-1=0$, and
$\{ g_t \}_{t \in I}$ is a Loewner chain consists of univalent functions. In
the second half we deals with Loewner chains $\{ f_t \}_{t \in I}$ consists of
universal covering maps which may be the most geometrically natural
generalization of Loewner chains of univalent functions. For each $t \in I$ let
$C(f_t(\mathbb{D}))$ be the connectivity of image domain of $f_t(\mathbb{D})$.
We shall show that if $\{ f_t \}_{t\in I}$ is continuous, then the function
$C(f_t(\mathbb{D}))$ is nondecreasing and left continuous. Then we develop a
Loewner theory on Fuchsian groups.
","[{""version"":""v1"",""created"":""Sat, 27 Jul 2019 22:52:52 GMT""}]","2019-07-30"
"1907.11988","Jonathan Brundan","Jonathan Brundan, Alistair Savage and Ben Webster","Heisenberg and Kac-Moody categorification","52 pages","Sel. Math. New Ser. 26, 74 (2020)","10.1007/s00029-020-00602-5",,"math.RT","http://arxiv.org/licenses/nonexclusive-distrib/1.0/","  We show that any Abelian module category over the (degenerate or quantum)
Heisenberg category satisfying suitable finiteness conditions may be viewed as
a 2-representation over a corresponding Kac-Moody 2-category (and vice versa).
This gives a way to construct Kac-Moody actions in many
representation-theoretic examples which is independent of Rouquier's original
approach via `control by K_0.' As an application, we prove an isomorphism
theorem for generalized cyclotomic quotients of these categories, extending the
known isomorphism between cyclotomic quotients of type A affine Hecke algebras
and quiver Hecke algebras.
","[{""version"":""v1"",""created"":""Sat, 27 Jul 2019 22:55:00 GMT""},{""version"":""v2"",""created"":""Fri, 19 Jun 2020 19:52:37 GMT""}]","2020-11-03"
"1907.11989","Delaram Amiri","Delaram Amiri, Arman Anzanpour, Iman Azimi, Amir M. Rahmani, Pasi
  Liljeberg, Nikil Dutt, Marco Levorato","Optimizing Energy Efficiency of Wearable Sensors Using Fog-assisted
  Control",,,,,"eess.SP cs.HC","http://arxiv.org/licenses/nonexclusive-distrib/1.0/","  Recent advances in the Internet of Things (IoT) technologies have enabled the
use of wearables for remote patient monitoring. Wearable sensors capture the
patient's vital signs, and provide alerts or diagnosis based on the collected
data. Unfortunately, wearables typically have limited energy and computational
capacity, making their use challenging for healthcare applications where
monitoring must continue uninterrupted long time, without the need to charge or
change the battery. Fog computing can alleviate this problem by offloading
computationally intensive tasks from the sensor layer to higher layers, thereby
not only meeting the sensors' limited computational capacity but also enabling
the use of local closed-loop energy optimization algorithms to increase the
battery life.
","[{""version"":""v1"",""created"":""Sat, 27 Jul 2019 23:18:48 GMT""}]","2019-08-14"
"1907.11990","Tohid Sardarmehni","Tohid Sardarmehni and Xingyong Song","Sub-optimal Tracking in Switched Systems with Controlled Subsystems and
  Fixed-mode Sequence using Approximate Dynamic Programming","6 pages, 2 figures, This article has been accepted for oral
  presentation at 2019 Dynamic System and Control Conference. The content is
  the same as the final edition of the accepted paper. However, the
  presentation might be different",,,,"eess.SY cs.SY","http://arxiv.org/licenses/nonexclusive-distrib/1.0/","  Optimal tracking in switched systems with controlled subsystem and
Discrete-time (DT) dynamics is investigated. A feedback control policy is
generated such that a) the system tracks the desired reference signal, and b)
the optimal switching time instants are sought. For finding the optimal
solution, approximate dynamic programming is used. Simulation results are
provided to illustrate the effectiveness of the solution.
","[{""version"":""v1"",""created"":""Sat, 27 Jul 2019 23:35:50 GMT""}]","2019-07-30"
"1907.11991","Vladimir Lazi\'c","Vladimir Lazi\'c, Fanjun Meng","On Nonvanishing for uniruled log canonical pairs","v2: this paper supersedes arXiv:1906.11451; minor changes; to appear
  in Electron. Res. Arch","Electron. Res. Arch. 29 (2021), no. 5, 3297-3308","10.3934/era.2021039",,"math.AG","http://arxiv.org/licenses/nonexclusive-distrib/1.0/","  We prove the Nonvanishing conjecture for uniruled projective log canonical
pairs of dimension $n$, assuming the Nonvanishing conjecture for smooth
projective varieties in dimension $n-1$. We also show that the existence of
good minimal models for non-uniruled projective klt pairs in dimension $n$
implies the existence of good minimal models for projective log canonical pairs
in dimension $n$.
","[{""version"":""v1"",""created"":""Sat, 27 Jul 2019 23:53:35 GMT""},{""version"":""v2"",""created"":""Mon, 26 Apr 2021 10:12:10 GMT""}]","2022-05-23"
"1907.11992","Mukul Bhattacharya","Mukul Bhattacharya","Constraining FRB progenitors from flux distribution","5 pages, 4 figures, 2 tables; submitted to MNRAS Letters; comments
  welcome",,,,"astro-ph.HE","http://arxiv.org/licenses/nonexclusive-distrib/1.0/","  We present a generic formalism to constrain the cosmic rate density history
and the source luminosity function of FRB progenitors from the statistical
properties of the apparent flux density of non-repeating FRBs detected with
Parkes. We include the pulse multipath propagation effects to evaluate the flux
density distribution for a generalised spatial density model and luminosity
function. We perform simulations to investigate the effects of the telescope
beam pattern and temporal resolution on the observed flux density. We find that
the FRB progenitors are likely to be younger stars with a relatively flat
energy spectrum and host galaxy DM contribution similar to the MW. Our analysis
can be extended to larger FRB samples detected with multiple surveys to place
stronger constraints on the FRB progenitor properties.
","[{""version"":""v1"",""created"":""Sun, 28 Jul 2019 00:01:15 GMT""}]","2019-07-30"
"1907.11993","Tohid Sardarmehni","Tohid Sardarmehni, Xingyong Song","Sub-optimal Control of Autonomous Wheel loader with Approximate Dynamic
  Programming","This article has been accepted for oral presentation at 2019 Dynamic
  System and Control Conference. The content might NOT be the same as the final
  edition of the accepted paper for the DSCC",,,,"eess.SY cs.SY","http://arxiv.org/licenses/nonexclusive-distrib/1.0/","  Optimal control of wheel loaders in short loading cycles is studied in this
paper. For modeling the wheel loader, the data from a validated diesel engine
model is used to find a control oriented mean value engine model. The driveline
is modeled as a switched system with three constant gear ratios (modes) of
$-60$ for backwarding, $60$ for forwarding, and zero for stopping. With these
three modes, the sequence of active modes in a short loading cycle is fixed as
backwarding, stopping, forwarding, and stopping. For the control part, it is
assumed that the optimal path is known a priori. Given the mode sequence, the
control objective is finding the optimal switching time instants between the
modes while the wheel loader tracks the optimal path. To solve the optimal
control problem, approximate dynamic programming is used. Simulation results
are provided to show the effectiveness of the solution.
","[{""version"":""v1"",""created"":""Sun, 28 Jul 2019 00:02:36 GMT""}]","2019-07-30"
"1907.11994","Kevin Ford","Kevin Ford","Large prime gaps and progressions with few primes","re-organized the description of the corollaries; typos corrected","Rivista di Matematica della Universita di Parma , vol. 12, no. 1,
  (2021), 41-47. Proceedings of Second Symposium on Analytic Number Theory
  Cetraro, Italy, July 8-12, 2019",,,"math.NT","http://arxiv.org/licenses/nonexclusive-distrib/1.0/","  We show that the existence of arithmetic progressions with few primes, with a
quantitative bound on ""few"", implies the existence of larger gaps between
primes less than x than is currently known unconditionally. In particular, we
derive this conclusion if there are certain types of exceptional zeros of
Dirichlet L-functions.
","[{""version"":""v1"",""created"":""Sun, 28 Jul 2019 00:26:37 GMT""},{""version"":""v2"",""created"":""Tue, 30 Jul 2019 17:58:51 GMT""},{""version"":""v3"",""created"":""Thu, 1 Aug 2019 13:21:06 GMT""},{""version"":""v4"",""created"":""Fri, 27 Sep 2019 13:23:06 GMT""}]","2022-07-05"
