"1907.12014","Takahiro Hirofuchi","Takahiro Hirofuchi and Ryousei Takano","The Preliminary Evaluation of a Hypervisor-based Virtualization
  Mechanism for Intel Optane DC Persistent Memory Module",,,,,"cs.OS cs.AR cs.PF","http://arxiv.org/licenses/nonexclusive-distrib/1.0/","  Non-volatile memory (NVM) technologies, being accessible in the same manner
as DRAM, are considered indispensable for expanding main memory capacities.
Intel Optane DCPMM is a long-awaited product that drastically increases main
memory capacities. However, a substantial performance gap exists between DRAM
and DCPMM. In our experiments, the read/write latencies of DCPMM were 400% and
407% higher than those of DRAM, respectively. The read/write bandwidths were
37% and 8% of those of DRAM. This performance gap in main memory presents a new
challenge to researchers; we need a new system software technology supporting
emerging hybrid memory architecture. In this paper, we present RAMinate, a
hypervisor-based virtualization mechanism for hybrid memory systems, and a key
technology to address the performance gap in main memory systems. It provides
great flexibility in memory management and maximizes the performance of virtual
machines (VMs) by dynamically optimizing memory mappings. Through experiments,
we confirmed that even though a VM has only 1% of DRAM in its RAM, the
performance degradation of the VM was drastically alleviated by memory mapping
optimization. The elapsed time to finish the build of Linux Kernel in the VM
was 557 seconds, which was only 13% increase from the 100% DRAM case (i.e., 495
seconds). When the optimization mechanism was disabled, the elapsed time
increased to 624 seconds (i.e. 26% increase from the 100% DRAM case).
","[{""version"":""v1"",""created"":""Sun, 28 Jul 2019 05:06:24 GMT""}]","2019-07-30"
"1907.12015","Yong Wang","Yong Wang, Daniel Archambault, Hammad Haleem, Torsten Moeller, Yanhong
  Wu, Huamin Qu","Nonuniform Timeslicing of Dynamic Graphs Based on Visual Complexity","5 pages, 4 figures, IEEE VIS short paper",,,,"cs.SI","http://arxiv.org/licenses/nonexclusive-distrib/1.0/","  Uniform timeslicing of dynamic graphs has been used due to its convenience
and uniformity across the time dimension. However, uniform timeslicing does not
take the data set into account, which can generate cluttered timeslices with
edge bursts and empty timeslices with few interactions. The graph mining filed
has explored nonuniform timeslicing methods specifically designed to preserve
graph features for mining tasks. In this paper, we propose a nonuniform
timeslicing approach for dynamic graph visualization. Our goal is to create
timeslices of equal visual complexity. To this end, we adapt histogram
equalization to create timeslices with a similar number of events, balancing
the visual complexity across timeslices and conveying more important details of
timeslices with bursting edges. A case study has been conducted, in comparison
with uniform timeslicing, to demonstrate the effectiveness of our approach.
","[{""version"":""v1"",""created"":""Sun, 28 Jul 2019 05:17:37 GMT""}]","2019-07-30"
"1907.12016","Devinder Kumar","Devinder Kumar, Parthipan Siva, Paul Marchwica, Alexander Wong","Fairest of Them All: Establishing a Strong Baseline for Cross-Domain
  Person ReID",,,,,"cs.CV cs.IR","http://arxiv.org/licenses/nonexclusive-distrib/1.0/","  Person re-identification (ReID) remains a very difficult challenge in
computer vision, and critical for large-scale video surveillance scenarios
where an individual could appear in different camera views at different times.
There has been recent interest in tackling this challenge using cross-domain
approaches, which leverages data from source domains that are different than
the target domain. Such approaches are more practical for real-world widespread
deployment given that they don't require on-site training (as with unsupervised
or domain transfer approaches) or on-site manual annotation and training (as
with supervised approaches). In this study, we take a systematic approach to
establishing a large baseline source domain and target domain for cross-domain
person ReID. We accomplish this by conducting a comprehensive analysis to study
the similarities between source domains proposed in literature, and studying
the effects of incrementally increasing the size of the source domain. This
allows us to establish a balanced source domain and target domain split that
promotes variety in both source and target domains. Furthermore, using lessons
learned from the state-of-the-art supervised person re-identification methods,
we establish a strong baseline method for cross-domain person ReID. Experiments
show that a source domain composed of two of the largest person ReID domains
(SYSU and MSMT) performs well across six commonly-used target domains.
Furthermore, we show that, surprisingly, two of the recent commonly-used
domains (PRID and GRID) have too few query images to provide meaningful
insights. As such, based on our findings, we propose the following balanced
baseline for cross-domain person ReID consisting of: i) a fixed multi-source
domain consisting of SYSU, MSMT, Airport and 3DPeS, and ii) a multi-target
domain consisting of Market-1501, DukeMTMC-reID, CUHK03, PRID, GRID and VIPeR.
","[{""version"":""v1"",""created"":""Sun, 28 Jul 2019 05:20:34 GMT""},{""version"":""v2"",""created"":""Fri, 27 Dec 2019 18:25:34 GMT""}]","2019-12-30"
"1907.12017","Kanupriya Sinha","Kanupriya Sinha, Pierre Meystre, Elizabeth A. Goldschmidt, Fredrik K.
  Fatemi, Steven L. Rolston, Pablo Solano","Non-Markovian collective emission from macroscopically separated
  emitters",,"Phys. Rev. Lett. 124, 043603 (2020)","10.1103/PhysRevLett.124.043603",,"quant-ph","http://arxiv.org/licenses/nonexclusive-distrib/1.0/","  We study the collective radiative decay of a system of two two-level emitters
coupled to a one-dimensional waveguide in a regime where their separation is
comparable to the coherence length of a spontaneously emitted photon. The
electromagnetic field propagating in the cavity-like geometry formed by the
emitters exerts a retarded backaction on the system leading to strongly
non-Markovian dynamics. The collective spontaneous emission rate of the
emitters exhibits an enhancement or inhibition beyond the usual Dicke super-
and sub-radiance due to a self-consistent coherent time-delayed feedback.
","[{""version"":""v1"",""created"":""Sun, 28 Jul 2019 05:26:15 GMT""},{""version"":""v2"",""created"":""Sun, 2 Feb 2020 20:07:36 GMT""}]","2020-02-04"
"1907.12018","Jeff Tallon","Jeffery L. Tallon, James G. Storey, John R. Cooper and John W. Loram","Locating the pseudogap closing point in cuprate superconductors: absence
  of entrant or reentrant behavior","20 Pages, 9 Figures, in press Phys. Rev. B","Phys. Rev. B 101, 174512 (2020)","10.1103/PhysRevB.101.174512",,"cond-mat.supr-con cond-mat.str-el","http://arxiv.org/licenses/nonexclusive-distrib/1.0/","  Current descriptions of the pseudogap in underdoped cuprates envision a
doping-dependent transition line $T^*(p)$ which descends monotonically towards
zero just beyond optimal doping. There is much debate as to the location of the
terminal point $p^*$ where $T^*(p)$ vanishes, whether or not there is a phase
transition at $T^*$ and exactly how $T^*(p)$ behaves below $T_c$ within the
superconducting dome. One perspective sees $T^*(p)$ cutting the dome and
continuing to descend monotonically to zero at $p_{crit} \approx 0.19$ holes/Cu
$-$ referred to here as `entrant behavior'. Another perspective derived from
photoemission studies is that $T^*(p)$ intersects the dome near $p_{crit}
\approx 0.23$ holes/Cu then turns back below $T_c$, falling to zero again
around $p_{crit} \approx 0.19$ $-$ referred to here as `reentrant behavior'. By
examining thermodynamic data for Bi$_2$Sr$_2$CaCu$_2$O$_{8+\delta}$ we show
that neither entrant nor reentrant behavior is experimentally supported.
Rather, $p_{crit} \approx 0.19$ sharply delimits the pseudogap regime and for
$p < 0.19$ the pseudogap is always present, independent of temperature. Similar
results are found for Y$_{0.8}$Ca$_{0.2}$Ba$_2$Cu$_3$O$_{7-\delta}$. For both
materials $T^*(p)$ is not a temperature but a crossover scale, $\approx
E^*(p)/2k_B$, reflecting instead the underlying pseudogap energy $E^*(p)$ which
vanishes as $p \rightarrow 0.19$.
","[{""version"":""v1"",""created"":""Sun, 28 Jul 2019 05:38:33 GMT""},{""version"":""v2"",""created"":""Tue, 30 Jul 2019 00:27:54 GMT""},{""version"":""v3"",""created"":""Thu, 30 Apr 2020 08:38:09 GMT""}]","2020-05-27"
"1907.12019","Nikolai Beluhov","Nikolai Beluhov","The Flexibility and Rigidity of Leaper Frameworks","62 pages, 15 figures",,,,"math.CO","http://arxiv.org/licenses/nonexclusive-distrib/1.0/","  A leaper framework is a bar-and-joint framework whose joints are integer
points forming a rectangular grid and whose bars correspond to all moves of a
given leaper within that grid. We study the flexibility and rigidity of leaper
frameworks. Let $p$ and $q$ be positive integers such that the $(p, q)$-leaper
$L$ is free. J\'{o}zsef Solymosi and Ethan White conjectured in 2018 that the
leaper framework of $L$ on the square grid of side $2(p + q) - 1$, and so on
all larger grids, is rigid. We prove this conjecture. We also prove that
Solymosi and White's conjecture is, in a sense, sharp. Namely, the leaper
framework of $L$ on the rectangular grid of sides $2(p + q) - 2$ and $2(p + q)
- 1$, and so on all smaller grids (except for, trivially, the $1 \times 1$
grid), is flexible. In particular, we completely resolve the flexibility and
rigidity question for leaper frameworks on square grids. We establish a number
of related results as well.
","[{""version"":""v1"",""created"":""Sun, 28 Jul 2019 06:03:48 GMT""},{""version"":""v2"",""created"":""Sun, 10 Nov 2019 08:51:26 GMT""}]","2019-11-12"
"1907.12020","Ali Ahanj Dr","Zeynab Faroughi, Ali Ahanj, Samira Nazifkar, Kurosh Javidan","Three-Spin Systems and the Pusey-Barrett- Rudolph Theorem","7 pages, 3 figures",,,,"quant-ph","http://arxiv.org/licenses/nonexclusive-distrib/1.0/","  The fundamental nature of quantum wave function has been the topic of many
discussions since the beginning of the quantum theory. It either corresponds to
an element of reality $(\Psi-ontic)$ or it is a subjective state of knowledge
about the underlying reality $(\Psi-epistemic)$. Pusey, Barrett, and Rudolph
(PBR) have shown that epistemic interpretations of the quantum wave function
are in contradiction with the predictions of quantum under some assumptions. In
this paper, a laboratory protocol with a triple quantum dot will be introduced
as a three-spin interaction system to study the PBR no-go theorem. By this
experimental model, we show that the epistemic interpretation of the quantum
state is in contradiction with quantum theory, based only on the assumption
that measurement settings can be prepared freely and independently from each
other.
","[{""version"":""v1"",""created"":""Sun, 28 Jul 2019 06:14:04 GMT""},{""version"":""v2"",""created"":""Sat, 9 Nov 2019 12:05:59 GMT""},{""version"":""v3"",""created"":""Sat, 15 Feb 2020 05:37:47 GMT""}]","2020-02-18"
"1907.12021","William Yang Wang","Pushkar Shukla, Carlos Elmadjian, Richika Sharan, Vivek Kulkarni,
  Matthew Turk, William Yang Wang","What Should I Ask? Using Conversationally Informative Rewards for
  Goal-Oriented Visual Dialog","Accepted to ACL 2019",,,,"cs.CL cs.AI cs.CV cs.MM","http://arxiv.org/licenses/nonexclusive-distrib/1.0/","  The ability to engage in goal-oriented conversations has allowed humans to
gain knowledge, reduce uncertainty, and perform tasks more efficiently.
Artificial agents, however, are still far behind humans in having goal-driven
conversations. In this work, we focus on the task of goal-oriented visual
dialogue, aiming to automatically generate a series of questions about an image
with a single objective. This task is challenging since these questions must
not only be consistent with a strategy to achieve a goal, but also consider the
contextual information in the image. We propose an end-to-end goal-oriented
visual dialogue system, that combines reinforcement learning with regularized
information gain. Unlike previous approaches that have been proposed for the
task, our work is motivated by the Rational Speech Act framework, which models
the process of human inquiry to reach a goal. We test the two versions of our
model on the GuessWhat?! dataset, obtaining significant results that outperform
the current state-of-the-art models in the task of generating questions to find
an undisclosed object in an image.
","[{""version"":""v1"",""created"":""Sun, 28 Jul 2019 06:15:35 GMT""}]","2019-07-30"
"1907.12022","Zongyue Zhao","Zongyue Zhao, Min Liu, Karthik Ramani","DAR-Net: Dynamic Aggregation Network for Semantic Scene Segmentation",,,,,"cs.CV cs.LG","http://arxiv.org/licenses/nonexclusive-distrib/1.0/","  Traditional grid/neighbor-based static pooling has become a constraint for
point cloud geometry analysis. In this paper, we propose DAR-Net, a novel
network architecture that focuses on dynamic feature aggregation. The central
idea of DAR-Net is generating a self-adaptive pooling skeleton that considers
both scene complexity and local geometry features. Providing variable
semi-local receptive fields and weights, the skeleton serves as a bridge that
connect local convolutional feature extractors and a global recurrent feature
integrator. Experimental results on indoor scene datasets show advantages of
the proposed approach compared to state-of-the-art architectures that adopt
static pooling methods.
","[{""version"":""v1"",""created"":""Sun, 28 Jul 2019 06:23:19 GMT""},{""version"":""v2"",""created"":""Thu, 26 Dec 2019 03:13:59 GMT""}]","2019-12-30"
"1907.12023","Weisen Wang","Weisen Wang, Zhiyan Xu, Weihong Yu, Jianchun Zhao, Jingyuan Yang, Feng
  He, Zhikun Yang, Di Chen, Dayong Ding, Youxin Chen, Xirong Li","Two-Stream CNN with Loose Pair Training for Multi-modal AMD
  Categorization","accepted by MICCAI 2019",,,,"eess.IV cs.CV","http://arxiv.org/licenses/nonexclusive-distrib/1.0/","  This paper studies automated categorization of age-related macular
degeneration (AMD) given a multi-modal input, which consists of a color fundus
image and an optical coherence tomography (OCT) image from a specific eye.
Previous work uses a traditional method, comprised of feature extraction and
classifier training that cannot be optimized jointly. By contrast, we propose a
two-stream convolutional neural network (CNN) that is end-to-end. The CNN's
fusion layer is tailored to the need of fusing information from the fundus and
OCT streams. For generating more multi-modal training instances, we introduce
Loose Pair training, where a fundus image and an OCT image are paired based on
class labels rather than eyes. Moreover, for a visual interpretation of how the
individual modalities make contributions, we extend the class activation
mapping technique to the multi-modal scenario. Experiments on a real-world
dataset collected from an outpatient clinic justify the viability of our
proposal for multi-modal AMD categorization.
","[{""version"":""v1"",""created"":""Sun, 28 Jul 2019 06:27:01 GMT""}]","2019-07-30"
"1907.12024","Yuta Kusakabe","Yuta Kusakabe","Oka complements of countable sets and non-elliptic Oka manifolds","7 pages","Proc. Amer. Math. Soc., 148(3):1233-1238, 2020","10.1090/proc/14832",,"math.CV","http://arxiv.org/licenses/nonexclusive-distrib/1.0/","  We study the Oka properties of complements of closed countable sets in
$\mathbb{C}^{n}\ (n>1)$ which are not necessarily discrete. Our main result
states that every tame closed countable set in $\mathbb{C}^{n}\ (n>1)$ with a
discrete derived set has an Oka complement. As an application, we obtain
non-elliptic Oka manifolds which negatively answer a long-standing question of
Gromov. Moreover, we show that these examples are not even weakly subelliptic.
It is also proved that every finite set in a Hopf manifold has an Oka
complement and an Oka blowup.
","[{""version"":""v1"",""created"":""Sun, 28 Jul 2019 06:30:22 GMT""}]","2022-12-13"
"1907.12025","Kyungsub Lee","Kyungsub Lee, Byoung Ki Seo","Marked Hawkes process modeling of price dynamics and volatility
  estimation",,"40, pp.174-220, Journal of Empirical Finance, 2017","10.1016/j.jempfin.2016.08.004",,"q-fin.ST q-fin.TR","http://arxiv.org/licenses/nonexclusive-distrib/1.0/","  A simple Hawkes model have been developed for the price tick structure
dynamics incorporating market microstructure noise and trade clustering. In
this paper, the model is extended with random mark to deal with more realistic
price tick structures of equities. We examine the impact of jump in price
dynamics to the future movements and dependency between the jump sizes and
ground intensities. We also derive the volatility formula based on stochastic
and statistical methods and compare with realized volatility in simulation and
empirical studies. The marked Hawkes model is useful to estimate the intraday
volatility similarly in the case of simple Hawkes model.
","[{""version"":""v1"",""created"":""Sun, 28 Jul 2019 06:33:18 GMT""}]","2019-07-30"
"1907.12026","Somphong Jitman","Satanan Thipworawimon and Somphong Jitman","Hulls of Linear Codes Revisited with Applications",,,,,"cs.IT math.IT","http://arxiv.org/licenses/nonexclusive-distrib/1.0/","  Hulls of linear codes have been of interest and extensively studied due to
their rich algebraic structures and wide applications. In this paper,
alternative characterizations of hulls of linear codes are given as well as
their applications. Properties of hulls of linear codes are given in terms of
their Gramians of their generator and parity-check matrices. Moreover, it is
show that the Gramian of a generator matrix of every linear code over a finite
field of odd characteristic is diagonalizable. Subsequently, it is shown that a
linear code over a finite field of odd characteristic is complementary dual if
and only if it has an orthogonal basis. Based on this characterization,
constructions of good entanglement-assisted quantum error-correcting codes are
provided.
","[{""version"":""v1"",""created"":""Sun, 28 Jul 2019 06:41:21 GMT""},{""version"":""v2"",""created"":""Fri, 2 Aug 2019 04:42:27 GMT""},{""version"":""v3"",""created"":""Tue, 10 Sep 2019 08:54:18 GMT""}]","2019-09-11"
"1907.12027","Ning Li","Ning Li, Martin Shepperd, Yuchen Guo","A Systematic Review of Unsupervised Learning Techniques for Software
  Defect Prediction","18 pages, 8 figures",,,,"cs.SE","http://arxiv.org/licenses/nonexclusive-distrib/1.0/","  Background: Unsupervised machine learners have been increasingly applied to
software defect prediction. It is an approach that may be valuable for software
practitioners because it reduces the need for labeled training data. Objective:
Investigate the use and performance of unsupervised learning techniques in
software defect prediction. Method: We conducted a systematic literature review
that identified 49 studies containing 2456 individual experimental results,
which satisfied our inclusion criteria published between January 2000 and March
2018. In order to compare prediction performance across these studies in a
consistent way, we (re-)computed the confusion matrices and employed the
Matthews Correlation Coefficient (MCC) as our main performance measure.
Results: Our meta-analysis shows that unsupervised models are comparable with
supervised models for both within-project and cross-project prediction. Among
the 14 families of unsupervised model, Fuzzy CMeans (FCM) and Fuzzy SOMs
(FSOMs) perform best. In addition, where we were able to check, we found that
almost 11% (262/2456) of published results (contained in 16 papers) were
internally inconsistent and a further 33% (823/2456) provided insufficient
details for us to check. Conclusion: Although many factors impact the
performance of a classifier, e.g., dataset characteristics, broadly speaking,
unsupervised classifiers do not seem to perform worse than the supervised
classifiers in our review. However, we note a worrying prevalence of (i)
demonstrably erroneous experimental results, (ii) undemanding benchmarks and
(iii) incomplete reporting. We therefore encourage researchers to be
comprehensive in their reporting.
","[{""version"":""v1"",""created"":""Sun, 28 Jul 2019 06:47:15 GMT""},{""version"":""v2"",""created"":""Fri, 18 Oct 2019 03:10:04 GMT""},{""version"":""v3"",""created"":""Mon, 10 Feb 2020 14:50:48 GMT""},{""version"":""v4"",""created"":""Wed, 19 Feb 2020 08:18:20 GMT""}]","2020-02-20"
"1907.12028","Sumathi Sivasubramaniam","John Augustine and Sumathi Sivasubramaniam","Spartan: Sparse Robust Addressable Networks","25 pages, 10 figures. A preliminary version of this paper appeared in
  the Proceedings of the IEEE International Parallel and Distributed Processing
  Symposium (IPDPS) 2018",,,,"cs.DC cs.DS","http://arxiv.org/licenses/nonexclusive-distrib/1.0/","  A Peer-to-Peer (P2P) network is a dynamic collection of nodes that connect
with each other via virtual overlay links built upon an underlying network
(usually, the Internet). P2P networks are highly dynamic and can experience
very heavy churn, i.e., a large number of nodes join/leave the network
continuously. Thus, building and maintaining a stable overlay network is an
important problem that has been studied extensively for two decades.
  In this paper, we present our \Pe overlay network called Sparse Robust
Addressable Network (Spartan). Spartan can be quickly and efficiently built in
a fully distributed fashion within $O(\log n)$ rounds. Furthermore, the Spartan
overlay structure can be maintained, again, in a fully distributed manner
despite adversarially controlled churn (i.e., nodes joining and leaving) and
significant variation in the number of nodes. Moreover, new nodes can join a
committee within $O(1)$ rounds and leaving nodes can leave without any notice.
  The number of nodes in the network lies in $[n, fn]$ for any fixed $f\ge 1$.
Up to $\epsilon n$ nodes (for some small but fixed $\epsilon > 0$) can be
adversarially added/deleted within {\em any} period of $P$ rounds for some $P
\in O(\log \log n)$. Despite such uncertainty in the network, Spartan maintains
$\Theta(n/\log n)$ committees that are stable and addressable collections of
$\Theta(\log n)$ nodes each for $O(polylog(n))$ rounds with high probability.
  Spartan's committees are also capable of performing sustained computation and
passing messages between each other. Thus, any protocol designed for static
networks can be simulated on Spartan with minimal overhead. This makes Spartan
an ideal platform for developing applications. We experimentally show that
Spartan will remain robust as long as each committee, on average, contains 24
nodes for networks of size up to $10240$.
","[{""version"":""v1"",""created"":""Sun, 28 Jul 2019 06:58:43 GMT""},{""version"":""v2"",""created"":""Fri, 18 Dec 2020 07:54:30 GMT""}]","2020-12-21"
"1907.12029","Hamidreza Moshfegh","S. Khanmohamadi, H.R. Moshfegh and S.Atashbar Tehrani","Hybrid star within the framework of a lowest-order constraint
  variational method","25 pages, 9 figures, 8 Tables","Phys. Rev. D 101, 023004 (2020)","10.1103/PhysRevD.101.023004",,"nucl-th astro-ph.HE hep-ph","http://arxiv.org/licenses/nonexclusive-distrib/1.0/","  The hadron-quark phase transition in the core of heavy neutron star (NS) has
been studied. For the hadronic sector, we have used the lowest-order constraint
variational method by employing $ AV_{18} $, $ AV_{14}$, $ UV_{14}$, and Reid $
68 $ two-body nucleon-nucleon forces supplemented by the phenomenological
Urbana-type three-body force. We have adopted the MIT bag model as well as
three-flavor version of the Nambu- Jona-Lasinio (NJL) model to describe the
quark phase. The equation of state (EOS) of a hybrid star (HS) is presented by
combining two EOS of the hadronic sector and quark sector of a star, which are
derived from independent models or theories. The hadron-quark transition is
constructed by considering a sharp phase transition, i.e., Maxwell
construction. The structure of the HS is calculated and reported by solving
Tolman-Oppenheimer-Volkoff equations. Finally the radii and tidal deformability
of purely NS and HS for the mass of $ 1.4M_{\odot} $ is computed and new
constraints on these quantities are checked. The maximum mass of HS is found
more than $ 2 M_{\odot} $ for both the NJL and MIT bag models. However, the
maximum mass of $ 1.796 M_{\odot} $ ($ 1.896 M_{\odot} $) was the best result
that would be calculated for a stable HS with the pure quark core within the
MIT (NJL) model. All the hybrid EOS fulfill the constraints on radii and tidal
deformability extracted from the binary GW170817 for HSs. A comprehensive
analysis on the structure of purely NS and HS and also compactness, tidal Love
number, and tidal deformability for the star with the mass of 1.4 $ M_{\odot} $
has been conducted for various EOS of the hadron sector and several parameter
sets of the quark EOS. The results achieved in this study are in good
concurrence with the other calculations reported on this subject.
","[{""version"":""v1"",""created"":""Sun, 28 Jul 2019 07:02:35 GMT""},{""version"":""v2"",""created"":""Thu, 9 Jan 2020 09:51:49 GMT""}]","2020-01-10"
