"1902.00837","Xiaoheng Deng","Yajun Liu, Congxu Zhu, Xiaoheng Deng, Peiyuan Guan, Zhiwen Wan, Jie
  Luo, Enlu Liu and Honggang Zhang","UAV-aided urban target tracking system based on edge computing",,,,,"eess.SP cs.DC","http://arxiv.org/licenses/nonexclusive-distrib/1.0/","  Target tracking is an important issue of social security. In order to track a
target, traditionally a large amount of surveillance video data need to be
uploaded into the cloud for processing and analysis, which put stremendous
bandwidth pressure on communication links in access networks and core networks.
At the same time, the long delay in wide area network is very likely to cause a
tracking system to lose its target. Often, unmanned aerial vehicle (UAV) has
been adopted for target tracking due to its flexibility, but its limited flight
time due to battery constraint and the blocking by various obstacles in the
field pose two major challenges to its target tracking task, which also very
likely results in the loss of target. A novel target tracking model that
coordinates the tracking by UAV and ground nodes in an edge computing
environment is proposed in this study. The model can effectively reduce the
communication cost and the long delay of the traditional surveillance camera
system that relies on cloud computing, and it can improve the probability of
finding a target again after an UAV loses the tracing of that target. It has
been demonstrated that the proposed system achieved a significantly better
performance in terms of low latency, high reliability, and optimal quality of
experience (QoE).
","[{""version"":""v1"",""created"":""Sun, 3 Feb 2019 03:35:36 GMT""}]","2019-02-05"
"1902.00838","Mehdi Ganji","Mehdi Ganji, Hongbing Cheng, Qi Zhan, Kee-Bong Song","A New Codebook Design for Analog Beamforming in Millimeter-wave
  Communication",,,,,"cs.IT math.IT","http://arxiv.org/licenses/nonexclusive-distrib/1.0/","  In this study, we analyze the codebook design used for analog beamforming.
Analog beamforming and combining suffer from a subspace sampling limitation,
that is, the receiver cannot directly observe the channel coefficients;
instead, the receiver observes a noisy version of their weighted combination.
To resolve this, the transmitter and the receiver usually collaborate to
determine the best beamformer combiner pair during the beam-sweeping process.
This is done by evaluating a limited number of codewords chosen from a
pre-defined codebook. In this study, we propose a new framework inspired by the
generalized Lloyd algorithm to design analog beamforming codebooks that
optimize various performance metrics including the average beamforming gain,
the outage, and the average data rate. The flexibility of our framework enables
us to design beamforming codebooks for any array shapes including uniform
linear and planar arrays. The other practical complexity in analog beamforming
is the low resolution of the phase shifters. Therefore, we have extended our
algorithm to create quantized codebooks that outperform the existing codebooks
in literature. We have also provided extensive simulations to verify the
superiority of our proposed codebook as compared with the existing codebooks.
","[{""version"":""v1"",""created"":""Sun, 3 Feb 2019 03:43:03 GMT""},{""version"":""v2"",""created"":""Mon, 10 Feb 2020 21:57:33 GMT""}]","2020-02-12"
"1902.00839","Maria Cristina or Cristina Pereyra","Yongsheng Han, Ji Li, Cristina Pereyra and Brett D. Wick","A note on weak factorization of Meyer-type Hardy space via Cauchy
  integral operator","20 pages",,,,"math.CA","http://arxiv.org/licenses/nonexclusive-distrib/1.0/","  This paper provides a weak factorization for the Meyer-type Hardy space
$H^1_b(\mathbb{R})$, and characterizations of its dual ${\rm
BMO}_b(\mathbb{R})$ and its predual ${\rm VMO}_b(\mathbb{R})$ via boundedness
and compactness of a suitable commutator with the Cauchy integral
$\mathscr{C}_{\Gamma}$, respectively. Here $b(x)=1+iA'(x)$ where $A'\in
L^{\infty}(\mathbb{R})$, and the Cauchy integral $\mathscr{C}_{\Gamma}$ is
associated to the Lipschitz curve $\Gamma=\{x+iA(x)\, : \, x\in \mathbb{R}\}$.
","[{""version"":""v1"",""created"":""Sun, 3 Feb 2019 03:57:52 GMT""}]","2019-02-05"
"1902.00840","Dmitri Shakhmatov","Dmitri Shakhmatov, V\'ictor Hugo Ya\~nez","SSGP topologies on free groups of infinite rank",,,,,"math.GN math.FA math.GR","http://arxiv.org/licenses/nonexclusive-distrib/1.0/","  We prove that every free group G with infinitely many generators admits a
Hausdorff group topology T with the following property: for every T-open
neighbourhood U of the identity of G, each element g in G can be represented as
a product g=g_1 g_2 ... g_k such that the cyclic group generated by each g_i is
contained in U. In particular, G admits a Hausdorff group topology with the
small subgroup generating property of Gould. This provides a positive answer to
a question of Comfort and Gould in the case of free groups with infinitely many
generators. The case of free groups with finitely many generators remains open.
","[{""version"":""v1"",""created"":""Sun, 3 Feb 2019 03:59:54 GMT""}]","2019-02-05"
"1902.00841","Liguo He","Liguo He and Xianyu Hu","Group-theoretic remarks on Goldbach's conjecture",,,,,"math.GR","http://arxiv.org/licenses/nonexclusive-distrib/1.0/","  The famous strongly binary Goldbach's conjecture asserts that every even
number $2n \geq 8$ can always be expressible as the sum of two distinct odd
prime numbers. We use a new approach to dealing with this conjecture.
Specifically, we apply the element order prime graphs of alternating groups of
degrees $2n$ and $2n-1$ to characterize this conjecture, and present its six
group-theoretic versions; and further prove that this conjecture is true for
$p+1$ and $p-1$ whenever $p \geq 11$ is a prime number.
","[{""version"":""v1"",""created"":""Sun, 3 Feb 2019 04:40:34 GMT""}]","2019-02-05"
"1902.00842","Anish Singhani","Anish Singhani","Real-Time Freespace Segmentation on Autonomous Robots for Detection of
  Obstacles and Drop-Offs",,,,,"cs.CV cs.RO","http://arxiv.org/licenses/nonexclusive-distrib/1.0/","  Mobile robots navigating in indoor and outdoor environments must be able to
identify and avoid unsafe terrain. Although a significant amount of work has
been done on the detection of standing obstacles (solid obstructions), not much
work has been done on the detection of negative obstacles (e.g. dropoffs,
ledges, downward stairs). We propose a method of terrain safety segmentation
using deep convolutional networks. Our custom semantic segmentation
architecture uses a single camera as input and creates a freespace map
distinguishing safe terrain and obstacles. We then show how this freespace map
can be used for real-time navigation on an indoor robot. The results show that
our system generalizes well, is suitable for real-time operation, and runs at
around 55 fps on a small indoor robot powered by a low-power embedded GPU.
","[{""version"":""v1"",""created"":""Sun, 3 Feb 2019 04:42:13 GMT""}]","2019-02-05"
"1902.00843","Francisco Garcia","Francisco M. Garcia and Philip S. Thomas","A Meta-MDP Approach to Exploration for Lifelong Reinforcement Learning","Accepted as Extended Abstract, AAMAS, 2019",,,,"cs.LG stat.ML","http://arxiv.org/licenses/nonexclusive-distrib/1.0/","  In this paper we consider the problem of how a reinforcement learning agent
that is tasked with solving a sequence of reinforcement learning problems (a
sequence of Markov decision processes) can use knowledge acquired early in its
lifetime to improve its ability to solve new problems. We argue that previous
experience with similar problems can provide an agent with information about
how it should explore when facing a new but related problem. We show that the
search for an optimal exploration strategy can be formulated as a reinforcement
learning problem itself and demonstrate that such strategy can leverage
patterns found in the structure of related problems. We conclude with
experiments that show the benefits of optimizing an exploration strategy using
our proposed approach.
","[{""version"":""v1"",""created"":""Sun, 3 Feb 2019 04:44:11 GMT""}]","2019-02-05"
"1902.00844","Abhishek Dubey","Aron Laszka, Scott Eisele, Abhishek Dubey, Gabor Karsai, Karla
  Kvaternik","TRANSAX: A Blockchain-based Decentralized Forward-Trading Energy
  Exchange for Transactive Microgrids","Published in the proceedings of the 24th IEEE International
  Conference on Parallel and Distributed Systems (IEEE ICPADS 2018)",,,,"cs.SY","http://arxiv.org/licenses/nonexclusive-distrib/1.0/","  Power grids are undergoing major changes due to rapid growth in renewable
energy and improvements in battery technology. Prompted by the increasing
complexity of power systems, decentralized IoT solutions are emerging, which
arrange local communities into transactive microgrids. The core functionality
of these solutions is to provide mechanisms for matching producers with
consumers while ensuring system safety. However, there are multiple challenges
that these solutions still face: privacy, trust, and resilience. The privacy
challenge arises because the time series of production and consumption data for
each participant is sensitive and may be used to infer personal information.
Trust is an issue because a producer or consumer can renege on the promised
energy transfer. Providing resilience is challenging due to the possibility of
failures in the infrastructure that is required to support these market based
solutions. In this paper, we develop a rigorous solution for transactive
microgrids that addresses all three challenges by providing an innovative
combination of MILP solvers, smart contracts, and publish-subscribe middleware
within a framework of a novel distributed application platform, called
Resilient Information Architecture Platform for Smart Grid. Towards this
purpose, we describe the key architectural concepts, including fault tolerance,
and show the trade-off between market efficiency and resource requirements.
","[{""version"":""v1"",""created"":""Sun, 3 Feb 2019 04:44:43 GMT""}]","2019-02-05"
"1902.00845","Samantha Azari","Samaneh Azari, Bing Xue, Mengjie Zhang, Lifeng Peng","GA-Novo: De Novo Peptide Sequencing via Tandem Mass Spectrometry using
  Genetic Algorithm",,,,,"cs.CE q-bio.BM q-bio.QM","http://arxiv.org/licenses/nonexclusive-distrib/1.0/","  Proteomics is the large-scale analysis of the proteins. The common method for
identifying proteins and characterising their amino acid sequences is to digest
the proteins into peptides, analyse the peptides using mass spectrometry and
assign the resulting tandem mass spectra (MS/MS) to peptides using database
search tools. However, database search algorithms are highly dependent on a
reference protein database and they cannot identify peptides and proteins not
included in the database. Therefore, de novo sequencing algorithms are
developed to overcome the problem by directly reconstructing the peptide
sequence of an MS/MS spectrum without using any protein database. Current de
novo sequencing algorithms often fail to construct the completely matched
sequences, and produce partial matches. In this study, we propose a genetic
algorithm based method, GA-Novo, to solve the complex optimisation task of de
novo peptide sequencing, aiming at constructing full length sequences. Given an
MS/MS spectrum, GA-Novo optimises the amino acid sequences to best fit the
input spectrum. On the testing dataset, GA-Novo outperforms PEAKS, the most
commonly used software for this task, by constructing 8% higher number of fully
matched peptide sequences, and 4% higher recall at partially matched sequences.
","[{""version"":""v1"",""created"":""Sun, 3 Feb 2019 04:51:36 GMT""}]","2019-02-05"
"1902.00846","Jeremy Kepner","Jeremy Kepner, Vijay Gadepally, Lauren Milechin, Siddharth Samsi,
  William Arcand, David Bestor, William Bergeron, Chansup Byun, Matthew
  Hubbell, Micheal Houle, Micheal Jones, Anne Klein, Peter Michaleas, Julie
  Mullen, Andrew Prout, Antonio Rosa, Charles Yee, Albert Reuther","A Billion Updates per Second Using 30,000 Hierarchical In-Memory D4M
  Databases","Northeast Database Data 2019 (MIT)",,,,"cs.DB cs.DC cs.DS cs.NI","http://arxiv.org/licenses/nonexclusive-distrib/1.0/","  Analyzing large scale networks requires high performance streaming updates of
graph representations of these data. Associative arrays are mathematical
objects combining properties of spreadsheets, databases, matrices, and graphs,
and are well-suited for representing and analyzing streaming network data. The
Dynamic Distributed Dimensional Data Model (D4M) library implements associative
arrays in a variety of languages (Python, Julia, and Matlab/Octave) and
provides a lightweight in-memory database. Associative arrays are designed for
block updates. Streaming updates to a large associative array requires a
hierarchical implementation to optimize the performance of the memory
hierarchy. Running 34,000 instances of a hierarchical D4M associative arrays on
1,100 server nodes on the MIT SuperCloud achieved a sustained update rate of
1,900,000,000 updates per second. This capability allows the MIT SuperCloud to
analyze extremely large streaming network data sets.
","[{""version"":""v1"",""created"":""Sun, 3 Feb 2019 04:58:07 GMT""}]","2019-02-05"
"1902.00847","Pavel Naumov","Sanaz Azimipour and Pavel Naumov","Axiomatic Theory of Betweenness",,,,,"math.LO","http://arxiv.org/licenses/nonexclusive-distrib/1.0/","  Betweenness as a relation between three individual points has been widely
studied in geometry and axiomatized by several authors in different contexts.
The article proposes a more general notion of betweenness as a relation between
three sets of points. The main technical result is a sound and complete logical
system describing universal properties of this relation between sets of
vertices of a graph.
","[{""version"":""v1"",""created"":""Sun, 3 Feb 2019 05:10:27 GMT""},{""version"":""v2"",""created"":""Mon, 15 Jun 2020 14:26:14 GMT""}]","2020-06-16"
"1902.00848","Youshan Tao","Youshan Tao, Michael Winkler","Analysis of a one-dimensional forager-exploiter model","29 pages",,,,"math.AP","http://arxiv.org/licenses/nonexclusive-distrib/1.0/","  \begin{abstract} \noindent % We consider the one-dimensional parabolic system
  The system
  \bas
  \left\{ \begin{array}{l}
  u_t= u_{xx} - \chi_1 (uw_x)_x, \\[1mm]
  v_t = v_{xx} - \chi_2 (vu_x)_x, \\[1mm]
  w_t = dw_{xx} - \lambda (u+v)w - \mu w + r,
  \end{array} \right.
  \eas % that has been proposed as a model to describe social interactions
within mixed forager-exploiter groups. is considered in a bounded real
interval, with positive parameters $\chi_1,\chi_2,d,\lambda$ and $\mu$, and
with $r \ge 0$. Proposed to describe social interactions within mixed
forager-exploiter groups, this model extends classical one-species
chemotaxis-consumption systems by additionally accounting for a second axis
mechanism coupled to the first in a consecutive manner. \abs % It is firstly
shown that for all suitably regular initial data $(u_0, v_0, w_0)$, an
associated Neumann-type initial-boundary value problem possesses a globally
defined bounded classical solution. Moreover, it is asserted that this solution
stabilizes to a spatially homogeneous equilibrium at an exponential rate under
a smallness condition on $\min\{\io u_0, \io v_0\}$ that appears to be
consistent with predictions obtained from formal stability analysis.\abs
","[{""version"":""v1"",""created"":""Sun, 3 Feb 2019 05:16:22 GMT""}]","2019-02-05"
"1902.00849","Kuo-Feng Hsu","Kuo-Feng Hsu (1), Ryan Beckett (2), Ang Chen (1), Jennifer Rexford
  (3), Praveen Tammana (3), David Walker (3) ((1) Rice University, (2)
  Microsoft Research, (3) Princeton University)","Contra: A Programmable System for Performance-aware Routing",,,,,"cs.NI","http://arxiv.org/licenses/nonexclusive-distrib/1.0/","  We present Contra, a system for performance-aware routing that can adapt to
traffic changes at hardware speeds. While existing work has developed point
solutions for performance-aware routing on a fixed topology (e.g., a Fattree)
with a fixed routing policy (e.g., use least utilized paths), Contra can be
configured to operate seamlessly over any network topology and a wide variety
of sophisticated routing policies. Users of Contra write network-wide policies
that rank network paths given their current performance. A compiler then
analyzes such policies in conjunction with the network topology and decomposes
them into switch-local P4 programs, which collectively implement a new,
specialized distance-vector protocol. This protocol generates compact probes
that traverse the network, gathering path metrics to optimize for the user
policy dynamically. Switches respond to changing network conditions at hardware
speeds by routing flowlets along the best policy-compliant paths. Our
experiments show that Contra scales to large networks, and that in terms of
flow completion times, it is competitive with hand-crafted systems that have
been customized for specific topologies and policies.
","[{""version"":""v1"",""created"":""Sun, 3 Feb 2019 05:30:08 GMT""}]","2019-02-05"
"1902.00850","William McLean","William McLean and Kassem Mustapha and Raed Ali and Omar M. Knio","Regularity theory for time-fractional advection-diffusion-reaction
  equations","22 pages, no figures. arXiv admin note: substantial text overlap with
  arXiv:1810.04836","Comput. Math. with Appl. 79(4), 947-961, 2020","10.1016/j.camwa.2019.08.008",,"math.AP","http://arxiv.org/licenses/nonexclusive-distrib/1.0/","  We investigate the behavior of the time derivatives of the solution to a
linear time-fractional, advection-diffusion-reaction equation, allowing space-
and time-dependent coefficients as well as initial data that may have low
regularity. Our focus is on proving estimates that are needed for the error
analysis of numerical methods. The nonlocal nature of the fractional derivative
creates substantial difficulties compared with the case of a classical
parabolic PDE. In our analysis, we rely on novel energy methods in combination
with a fractional Gronwall inequality and certain properties of fractional
integrals.
","[{""version"":""v1"",""created"":""Sun, 3 Feb 2019 05:31:05 GMT""}]","2020-03-24"
"1902.00851","Changhua Pei","Changhua Pei, Xinru Yang, Qing Cui, Xiao Lin, Fei Sun, Peng Jiang,
  Wenwu Ou and Yongfeng Zhang","Value-aware Recommendation based on Reinforced Profit Maximization in
  E-commerce Systems","to appear at the webconf 2019",,,,"cs.IR cs.LG","http://arxiv.org/licenses/nonexclusive-distrib/1.0/","  Existing recommendation algorithms mostly focus on optimizing traditional
recommendation measures, such as the accuracy of rating prediction in terms of
RMSE or the quality of top-$k$ recommendation lists in terms of precision,
recall, MAP, etc. However, an important expectation for commercial
recommendation systems is to improve the final revenue/profit of the system.
Traditional recommendation targets such as rating prediction and top-$k$
recommendation are not directly related to this goal. In this work, we blend
the fundamental concepts in online advertising and micro-economics into
personalized recommendation for profit maximization. Specifically, we propose
value-aware recommendation based on reinforcement learning, which directly
optimizes the economic value of candidate items to generate the recommendation
list. In particular, we generalize the basic concept of click conversion rate
(CVR) in computational advertising into the conversation rate of an arbitrary
user action (XVR) in E-commerce, where the user actions can be clicking, adding
to cart, adding to wishlist, etc. In this way, each type of user action is
mapped to its monetized economic value. Economic values of different user
actions are further integrated as the reward of a ranking list, and
reinforcement learning is used to optimize the recommendation list for the
maximum total value. Experimental results in both offline benchmarks and online
commercial systems verified the improved performance of our framework, in terms
of both traditional top-$k$ ranking tasks and the economic profits of the
system.
","[{""version"":""v1"",""created"":""Sun, 3 Feb 2019 05:34:36 GMT""}]","2019-02-05"
"1902.00852","Hao Tran","K. Mizuyama, N. Nhu Le, T. Dieu Thuy, T. V. Nhan Hao","Jost function based on the Hartree-Fock-Bogoliubov formalism","Submitted to Physical Review C","Phys. Rev. C 99, 054607 (2019)","10.1103/PhysRevC.99.054607",,"nucl-th","http://creativecommons.org/licenses/by/4.0/","  We formulate the Jost function formalism based on the Hartree-Fock-Bogoliubov
(HFB) theory which has been used to represent the nature of the superfluidity
of nucleus. The Jost function based on the HFB can give the analytic
representation of the S-matrix for the nucleon elastic scattering targeting on
the open-shell nucleus taking into account the pairing effect. By adopting the
Woods-Saxon potential, we show the numerical results of S-matrix poles and
their trajectories with varying the pairing strength in two cases of Fermi
energies. The total cross sections in each cases for neutron elastic scattering
are also analyzed, and we confirmed some staggering shapes or sharp resonances
originated from the effect of pairing can be seen in the cross section.
","[{""version"":""v1"",""created"":""Sun, 3 Feb 2019 05:46:18 GMT""}]","2019-05-15"
"1902.00853","Milton Slaughter","Milton Dean Slaughter","Radiative decays and the $\mathbf {SU(6)}$ Lie Algebra","v1 file accidentally uploaded. v2 corrected abstract. V3 Improved Fig
  1. Commented that intermultiplet mixing with $K^{*}(1410)$ in Eqs 56a and 56b
  in deriving Eq. 57. Sec IV. name change Summary to Summary and Conclusions.
  V4: Added references, typos corrected. V5: corrected more typos, 39 pages.
  International Journal of Modern Physics A, Vol. 34, No. 21, 1950108 (2019)
  (51 pages) published","International Journal of Modern Physics A, Vol. 34, No. 21,
  1950108 (2019) (51 pages)","10.1142/S0217751X19501082",,"hep-ph","http://arxiv.org/licenses/nonexclusive-distrib/1.0/","  We present research on radiative decays of vector ($J^{PC}=1^{--}$) to
pseudoscalar ($J^{PC}=0^{-+}$) particles ($u$, $d$, $s$, $c$, $b$, $t$ quark
system) using broken symmetry techniques in the infinite momentum frame and
equal time commutation relations and the $SU(6)$ Lie algebra and conducted
without ascribing any specific form to meson quark structure or intra-quark
interactions. We utilize the physical electromagnetic current $j_{em}^{\mu}(0)$
including its singlet $U(1)$ term and focus on the $SU(6)$ $35$-plet. We derive
new relations involving the electromagnetic current (including its
singlet--proportional to the $SU(6)$ singlet). Remarkably, we find that the
electromagnetic current singlet plays an intrinsic role in understanding the
physics of radiative decays and that the charged and neutral $\rho$ meson
radiative decays into $\pi \, \gamma$ are due entirely to the singlet term in
$j_{em}^{\mu}(0)$. Although there is insufficient radiative decay experimental
data available at this time, parametrization of possible predicted values of
$\Gamma({{{D}}^{*}}^{0}\rightarrow D^{0}\,\gamma)$ is made. For conciseness and
self-containment, we compute all $SU(6)$ Lie algebra simple roots, positive
roots, weights and fundamental weights which allow the construction of all
$SU(6)$ representations. We also derive all non-zero $SU(6)$ generator
commutators and anti-commutators---useful for further research on grand unified
theories.
","[{""version"":""v1"",""created"":""Sun, 3 Feb 2019 05:46:25 GMT""},{""version"":""v2"",""created"":""Fri, 3 May 2019 06:35:55 GMT""},{""version"":""v3"",""created"":""Sat, 8 Jun 2019 04:46:10 GMT""},{""version"":""v4"",""created"":""Fri, 21 Jun 2019 20:06:29 GMT""},{""version"":""v5"",""created"":""Wed, 11 Sep 2019 18:13:35 GMT""}]","2019-09-13"
"1902.00854","Parthajit Biswas","Sayantani Bhattacharyya, Parthajit Biswas, Anirban Dinda and Milan
  Patra","Fluid-gravity and membrane-gravity dualities - Comparison at subleading
  orders",,,"10.1007/JHEP05(2019)054",,"hep-th","http://arxiv.org/licenses/nonexclusive-distrib/1.0/","  In this note we have compared two different perturbation techniques that
could be used to generate solutions of Einstein's equations in presence of
negative cosmological constant. One of these two methods is derivative
expansion and the other is an expansion in inverse powers of dimension. Both
the techniques generate space-time with a singularity shielded by a dynamical
event horizon. We have shown that in the appropriate regime of parameter space
and with appropriate choice of coordinates, the metrics and corresponding
horizon dynamics, generated by these two different techniques, are exactly
equal to the order the solutions are known both sides. This work is essentially
extension of \cite{prevwork} where the authors have shown the equivalence of
the two techniques up to the first non-trivial order.
","[{""version"":""v1"",""created"":""Sun, 3 Feb 2019 06:21:18 GMT""}]","2019-06-05"
