"1902.00888","Jinfeng Li","Jinfeng Li, Liwei Chen, Qizhen Xu, Linan Tian, Gang Shi, Kai Chen, Dan
  Meng","Zipper Stack: Shadow Stacks Without Shadow","to be published in ESORICS 2020",,,,"cs.CR","http://arxiv.org/licenses/nonexclusive-distrib/1.0/","  Return-Oriented Programming (ROP) is a typical attack technique that exploits
return addresses to abuse existing code repeatedly. Most of the current return
address protecting mechanisms (also known as the Backward-Edge Control-Flow
Integrity) work only in limited threat models. For example, the attacker cannot
break memory isolation, or the attacker has no knowledge of a secret key or
random values.
  This paper presents a novel, lightweight mechanism protecting return
addresses, Zipper Stack, which authenticates all return addresses by a chain
structure using cryptographic message authentication codes (MACs). This
innovative design can defend against the most powerful attackers who have full
control over the program's memory and even know the secret key of the MAC
function. This threat model is stronger than the one used in related work. At
the same time, it produces low-performance overhead. We implemented Zipper
Stack by extending the RISC-V instruction set architecture, and the evaluation
on FPGA shows that the performance overhead of Zipper Stack is only 1.86%.
Thus, we think Zipper Stack is suitable for actual deployment.
","[{""version"":""v1"",""created"":""Sun, 3 Feb 2019 13:17:21 GMT""},{""version"":""v2"",""created"":""Wed, 13 Feb 2019 04:08:16 GMT""},{""version"":""v3"",""created"":""Wed, 15 Jul 2020 06:47:54 GMT""}]","2020-07-16"
"1902.00889","Zhongxin Bai","Zhongxin Bai, Xiao-Lei Zhang, Jingdong Chen","Speaker Verification By Partial AUC Optimization With Mahalanobis
  Distance Metric Learning",,,,,"eess.AS","http://arxiv.org/licenses/nonexclusive-distrib/1.0/","  Receiver operating characteristic (ROC) and detection error tradeoff (DET)
curves are two widely used evaluation metrics for speaker verification. They
are equivalent since the latter can be obtained by transforming the former's
true positive y-axis to false negative y-axis and then re-scaling both axes by
a probit operator. Real-world speaker verification systems, however, usually
work on part of the ROC curve instead of the entire ROC curve given an
application. Therefore, we propose in this paper to use the area under part of
the ROC curve (pAUC) as a more efficient evaluation metric for speaker
verification. A Mahalanobis distance metric learning based back-end is applied
to optimize pAUC, where the Mahalanobis distance metric learning guarantees
that the optimization objective of the back-end is a convex one so that the
global optimum solution is achievable. To improve the performance of the
state-of-the-art speaker verification systems by the proposed back-end, we
further propose two feature preprocessing techniques based on
length-normalization and probabilistic linear discriminant analysis
respectively. We evaluate the proposed systems on the major languages of NIST
SRE16 and the core tasks of SITW. Experimental results show that the proposed
back-end outperforms the state-of-the-art speaker verification back-ends in
terms of seven evaluation metrics.
","[{""version"":""v1"",""created"":""Sun, 3 Feb 2019 13:19:15 GMT""},{""version"":""v2"",""created"":""Thu, 11 Jul 2019 12:52:45 GMT""},{""version"":""v3"",""created"":""Thu, 19 Sep 2019 13:22:28 GMT""},{""version"":""v4"",""created"":""Tue, 21 Apr 2020 16:01:22 GMT""}]","2020-04-22"
"1902.00890","Mark Stockett","James N. Bull, Jack T. Buntine, Michael S. Scholz, Eduardo Carrascosa,
  Linda Giacomozzi, Mark H. Stockett, and Evan J. Bieske","Photodetachment and Photoreactions of Substituted Naphthalene Anions in
  a Tandem Ion Mobility Spectrometer",,,"10.1039/C8FD00217G",,"astro-ph.IM physics.chem-ph","http://arxiv.org/licenses/nonexclusive-distrib/1.0/","  Substituted naphthalene anions (deprotonated 2-naphthol and
6-hydroxy-2-naphthoic acid) are spectroscopically probed in a tandem drift tube
ion mobility spectrometer (IMS). Target anions are selected according to their
drift speed through nitrogen buffer gas in the first IMS stage before being
exposed to a pulse of tunable light that induces either photodissociation or
electron photodetachment, which is conveniently monitored by scavenging the
detached electrons with trace \ce{SF6} in the buffer gas. The photodetachment
action spectrum of the 2-naphtholate anion exhibits a band system spanning
380-460\,nm~with a prominent series of peaks spaced by 440\,\cme, commencing at
458.5\,nm, and a set of weaker peaks near the electron detachment threshold
corresponding to transitions to dipole-bound states. The two deprotomers of
6-hydroxy-2-naphthoic acid are separated and spectroscopically probed
independently. The molecular anion formed from deprotonation of the hydroxy
group possesses a photodetachment action spectrum similar to that of the
2-naphtholate anion with an onset at 470\,nm and a maximum at 420\,nm. Near
threshold, photoreaction with \ce{SF6} is observed with displacement of an OH
group by an F atom. In contrast, the anion formed from deprotonation of the
carboxylic acid group features a photodissociation action spectrum, recorded on
the \ce{CO2} loss channel, lying to much shorter wavelength with an onset at
360\,nm and maximum photoresponse at 325\,nm.
","[{""version"":""v1"",""created"":""Sun, 3 Feb 2019 13:20:28 GMT""}]","2019-02-05"
"1902.00891","Christopher Borger","Gennadiy Averkov, Christopher Borger, Ivan Soprunov","Classification of triples of lattice polytopes with a given mixed volume","26 pages, additional appendix of 34 pages",,"10.1007/s00454-020-00246-4",,"math.CO math.AG","http://arxiv.org/licenses/nonexclusive-distrib/1.0/","  We present an algorithm for the classification of triples of lattice
polytopes with a given mixed volume $m$ in dimension 3. It is known that the
classification can be reduced to the enumeration of so-called irreducible
triples, the number of which is finite for fixed $m$. Following this algorithm,
we enumerate all irreducible triples of normalized mixed volume up to 4 that
are inclusion-maximal. This produces a classification of generic trivariate
sparse polynomial systems with up to 4 solutions in the complex torus, up to
monomial changes of variables. By a recent result of Esterov, this leads to a
description of all generic trivariate sparse polynomial systems that are
solvable by radicals.
","[{""version"":""v1"",""created"":""Sun, 3 Feb 2019 13:22:38 GMT""},{""version"":""v2"",""created"":""Wed, 21 Oct 2020 11:28:01 GMT""}]","2020-12-22"
"1902.00892","Ruth Heller","Ruth Heller and Saharon Rosset","Optimal control of false discovery criteria in the two-group model",,"J R Stat Soc Series B (2020)","10.1111/rssb.12403",,"stat.ME math.ST stat.TH","http://arxiv.org/licenses/nonexclusive-distrib/1.0/","  The highly influential two-group model in testing a large number of
statistical hypotheses assumes that the test statistics are drawn independently
from a mixture of a high probability null distribution and a low probability
alternative. Optimal control of the marginal false discovery rate (mFDR), in
the sense that it provides maximal power (expected true discoveries) subject to
mFDR control, is known to be achieved by thresholding the local false discovery
rate (locFDR), i.e., the probability of the hypothesis being null given the set
of test statistics, with a fixed threshold. We address the challenge of
controlling optimally the popular false discovery rate (FDR) or positive FDR
(pFDR) rather than mFDR in the general two-group model, which also allows for
dependence between the test statistics. These criteria are less conservative
than the mFDR criterion, so they make more rejections in expectation. We derive
their optimal multiple testing (OMT) policies, which turn out to be
thresholding the locFDR with a threshold that is a function of the entire set
of statistics. We develop an efficient algorithm for finding these policies,
and use it for problems with thousands of hypotheses. We illustrate these
procedures on gene expression studies.
","[{""version"":""v1"",""created"":""Sun, 3 Feb 2019 13:32:12 GMT""},{""version"":""v2"",""created"":""Thu, 25 Jul 2019 13:30:21 GMT""},{""version"":""v3"",""created"":""Wed, 27 May 2020 17:10:51 GMT""}]","2020-12-08"
"1902.00893","Abhishek Iyer M","G. D'Ambrosio, A. M. Iyer, F. Piccinini and A.D. Polosa","Confronting $B$ anomalies with low energy parity violation","8 pages, 7 Figures. Title modified, improved plots and discussion.
  Added analysis with the inclusion of the muon. Added references and
  acknowledgement. Matches version to appear in PRD","Phys. Rev. D 101, 035025 (2020)","10.1103/PhysRevD.101.035025",,"hep-ph","http://arxiv.org/licenses/nonexclusive-distrib/1.0/","  Indirect searches have the potential to probe scales beyond the realm of
direct searches. In this letter we consider the implications of two parity
violating experiments: weak charge of proton $Q_W^p$ and the Caesium atom
$Q_W^{Cs}$ on the solutions to lepton flavour non-universality violations
(LFUV) in the decay of $B$ mesons. Working in a generic implementation of a
minimal $Z^\prime$ model, we assume the primary contribution being due to the
electron to facilitate comparison with the low $q^2$ parity violating
experiments. We demonstrate that the conclusion is characterized by different
limiting behavior depending on the chirality of the lepton current. The
correlation developed in this study demonstrates the effectiveness in studying
the synergy between different experiments leading to a deeper understanding of
the interpretation of the existing data. It is shown that a possible future
improvement in the parity violating experiments can have far reaching
implications in the context of direct searches. We also comment on the prospect
of addition of the muon to the fits and the role it plays in ameliorating the
constraints on models of $Z'$. This offers a complimentary understanding of the
pattern of the coupling of the NP to the leptons, strongly suggesting either a
muon only or a combination of solutions to the anomalies.
","[{""version"":""v1"",""created"":""Sun, 3 Feb 2019 13:36:07 GMT""},{""version"":""v2"",""created"":""Tue, 18 Feb 2020 11:02:07 GMT""}]","2020-02-26"
"1902.00894","Botao Fu","Hongbo Wu, Da-Shuai Ma, Botao Fu, Wei Guo, Yugui Yao","Weyl nodal point-line Fermion in ferromagnetic Eu$_5$Bi$_3$","19 pages, 4 figures","J. Phys. Chem. Lett. 2019, 10, 2508","10.1021/acs.jpclett.9b00752",,"cond-mat.mtrl-sci","http://arxiv.org/licenses/nonexclusive-distrib/1.0/","  Based on $ab$ $initio$ calculations and low-energy effective $k{\cdot}p$
model, we propose a type of Weyl nodal point-line fermion, composed of 0D Weyl
points and 1D Weyl nodal line, in ferromagnetic material Eu$_5$Bi$_3$. In the
absence of spin-orbital coupling (SOC), the spin-up bands host a pair of triply
degenerate points together with a unique bird-cage like node structure. In the
presence of SOC with (001) magnetization, each triplet point splits into a
double Weyl point and a single Weyl point accompanied by two nodal rings,
forming two sets of Weyl nodal point-line fermions near the Fermi level. The
novel properties of Weyl nodal point-line fermion are explored by revealing the
unusual Berry curvature field and demonstrating the pinned chiral surface
states with exotic Fermi arcs at different planes. Moreover, a large anomalous
Hall conductivity of -260 ($\hbar$/$e$)($\Omega$cm)$^{-1}$ parallel to [001]
direction is predicted. Our work offers a new perspective for exploring novel
topological semimetal states with diverse band-crossing dimensions, and
provides an ideal material candidate for future experimental realiztion.
","[{""version"":""v1"",""created"":""Sun, 3 Feb 2019 13:54:45 GMT""}]","2019-09-13"
"1902.00895","Taishi Kurahashi","Taishi Kurahashi","A note on derivability conditions","36 pages","J. symb. log. 85 (2020) 1224-1253","10.1017/jsl.2020.33",,"math.LO","http://arxiv.org/licenses/nonexclusive-distrib/1.0/","  We investigate relationships between versions of derivability conditions for
provability predicates. We show several implications and non-implications
between the conditions, and we discuss unprovability of consistency statements
induced by derivability conditions. First, we classify already known versions
of the second incompleteness theorem, and exhibit some new sets of conditions
which are sufficient for unprovability of Hilbert--Bernays' consistency
statement. Secondly, we improve Buchholz's schematic proof of provable
$\Sigma_1$-completeness. Then among other things, we show that
Hilbert--Bernays' conditions and L\""ob's conditions are mutually incomparable.
We also show that neither Hilbert--Bernays' conditions nor L\""ob's conditions
accomplish G\""odel's original statement of the second incompleteness theorem.
","[{""version"":""v1"",""created"":""Sun, 3 Feb 2019 13:54:53 GMT""},{""version"":""v2"",""created"":""Sun, 30 Jun 2019 02:24:29 GMT""},{""version"":""v3"",""created"":""Thu, 30 Apr 2020 14:05:47 GMT""}]","2021-07-01"
"1902.00896","Filippo Radicchi","Krishna C. Bathina, Filippo Radicchi","Error-Correcting Decoders for Communities in Networks","8 pages, 5 figures, 2 tables",,,,"physics.soc-ph cs.SI","http://arxiv.org/licenses/nonexclusive-distrib/1.0/","  As recent work demonstrated, the task of identifying communities in networks
can be considered analogous to the classical problem of decoding messages
transmitted along a noisy channel. We leverage this analogy to develop a
community detection method directly inspired by a standard and widely-used
decoding technique. We further simplify the algorithm to reduce the time
complexity from quadratic to linear. We test the performance of the original
and reduced versions of the algorithm on artificial benchmarks with pre-imposed
community structure, and on real networks with annotated community structure.
Results of our systematic analysis indicate that the proposed techniques are
able to provide satisfactory results.
","[{""version"":""v1"",""created"":""Sun, 3 Feb 2019 13:59:23 GMT""}]","2019-02-05"
"1902.00897","Yaroslav Shitov","Yaroslav Shitov","One more counterexample on sign patterns","note, 1 page",,,,"math.CO","http://arxiv.org/licenses/nonexclusive-distrib/1.0/","  The \textit{sepr-sequence} of an $n\times n$ real matrix $A$ is
$(s_1,\ldots,s_n)$, where $s_k$ is the subset of those signs of $+,-,0$ that
appear in the values of the $k\times k$ principal minors of $A$. The $12\times
12$ matrix $$\left(\begin{array}{cccccc|ccc|ccc} 0&0&0&0&0&0&0&0&0&a_1&0&0\\
0&0&0&0&0&0&0&0&0&0&a_2&0\\ 0&0&0&0&0&0&0&0&0&0&0&a_3\\
0&0&0&0&0&0&0&0&0&0&0&a_4\\ 0&0&0&0&0&0&0&0&0&0&0&a_5\\
0&0&0&0&0&0&0&0&0&0&0&a_6\\\hline b_1&b_2&0&0&0&0&0&0&0&0&0&0\\
b_3&b_4&0&0&b_5&-b_6&0&0&0&0&0&0\\
0&b_7&b_8&-b_9&b_{10}&b_{11}&0&0&0&0&0&0\\\hline 0&0&0&0&0&0&c_1&0&0&0&0&0\\
0&0&0&0&0&0&0&c_2&0&0&0&0\\ 0&0&0&0&0&0&0&0&c_3&0&0&0 \end{array}\right)$$ does
always have $s_k=\{0,+,-\}$ if $k=3,6,9$ and $s_k=\{0\}$ otherwise, provided
that the variables are positive. However, every principal $9\times 9$ minor
that is not identically zero can take values of both signs.
","[{""version"":""v1"",""created"":""Sun, 3 Feb 2019 14:08:47 GMT""}]","2019-02-05"
"1902.00898","Yanjie Wang","Yanjie Wang, Samuel Broscheit, Rainer Gemulla","A Relational Tucker Decomposition for Multi-Relational Link Prediction",,,,,"cs.LG stat.ML","http://arxiv.org/licenses/nonexclusive-distrib/1.0/","  We propose the Relational Tucker3 (RT) decomposition for multi-relational
link prediction in knowledge graphs. We show that many existing knowledge graph
embedding models are special cases of the RT decomposition with certain
predefined sparsity patterns in its components. In contrast to these prior
models, RT decouples the sizes of entity and relation embeddings, allows
parameter sharing across relations, and does not make use of a predefined
sparsity pattern. We use the RT decomposition as a tool to explore whether it
is possible and beneficial to automatically learn sparsity patterns, and
whether dense models can outperform sparse models (using the same number of
parameters). Our experiments indicate that---depending on the dataset--both
questions can be answered affirmatively.
","[{""version"":""v1"",""created"":""Sun, 3 Feb 2019 14:09:39 GMT""}]","2019-02-05"
"1902.00899","Konstantinos Tzirakis","Konstantinos Tzirakis","Series expansion of weighted Finsler-Kato-Hardy inequalities","23 pages",,,,"math.AP","http://arxiv.org/licenses/nonexclusive-distrib/1.0/","  In this work, we consider weighted anisotropic Hardy inequalities and trace
Hardy inequalities involving a general Finsler metric. We follow a unifying
approach, by establishing first a sharp interpolation between them, extending
the corresponding nonweighted version, being established recently by a
different approach. Then, passing to bounded domains, we obtain successive
sharp improvements by adding remainder terms involving sharp weights and
optimal constants, resulting in an infinite series-type improvement. The
results extend, into the Finsler context, the earlier known ones within the
Euclidean setting. The generalization of our results to cones is also
discussed.
","[{""version"":""v1"",""created"":""Sun, 3 Feb 2019 14:10:38 GMT""}]","2019-02-05"
"1902.00900","James Jackman","James A. G. Jackman, Peter J. Wheatley, Daniel Bayliss, Matthew R.
  Burleigh, Sarah L. Casewell, Philipp Eigm\""uller, Mike R. Goad, Don Pollacco,
  Liam Raynard, Christopher A. Watson, Richard G. West","Detection of a giant white-light flare on an L2.5 dwarf with the Next
  Generation Transit Survey","5 pages, 2 figures, Accepted for Publication in the Monthly Notices
  of the Royal Astronomical Society",,"10.1093/mnrasl/slz039",,"astro-ph.SR","http://arxiv.org/licenses/nonexclusive-distrib/1.0/","  We present the detection of a $\Delta V\sim$ -10 flare from the ultracool
L2.5 dwarf ULAS J224940.13-011236.9 with the Next Generation Transit Survey
(NGTS). The flare was detected in a targeted search of late-type stars in NGTS
full-frame images and represents one of the largest flares ever observed from
an ultracool dwarf. This flare also extends the detection of white-light flares
to stars with temperatures below 2000 K. We calculate the energy of the flare
to be $3.4^{+0.9}_{-0.7}\times10^{33}$erg, making it an order of magnitude more
energetic than the Carrington event on the Sun. Our data show how the
high-cadence NGTS full-frame images can be used to probe white-light flaring
behaviour in the latest spectral types.
","[{""version"":""v1"",""created"":""Sun, 3 Feb 2019 14:18:46 GMT""},{""version"":""v2"",""created"":""Thu, 14 Mar 2019 16:02:40 GMT""}]","2019-03-27"
"1902.00901","Maojiao Ye","Maojiao Ye","Distributed robust seeking of Nash equilibrium for networked games: an
  extended-state observer based approach",,,,,"math.OC","http://arxiv.org/licenses/nonexclusive-distrib/1.0/","  This paper aims to accommodate games in which the players' dynamics are
subject to un-modeled and disturbance terms. The un-modeled and disturbance
terms are regarded as extended states for which observers are designed to
estimate them. Compensating the players' dynamics with the observed values, the
control laws are designed to achieve the robust seeking of the Nash equilibrium
for networked games. Firstly, we consider the case in which the players'
dynamics are subject to bounded disturbances only. In this case, the seeking
strategy is developed by employing a smooth observer based on the
Proportional-Integral (PI) control. By utilizing the designed strategy, we show
that the players' actions would converge to a small neighborhood of the Nash
equilibrium. Moreover, the ultimate bound can be adjusted to be arbitrarily
small by tuning the control gains. Then, we further consider the case in which
both an un-modeled term and a disturbance term coexist in the players'
dynamics. In this case, we adapt the idea from the Robust Integral of the Sign
of the Error (RISE) method in the strategy design to achieve the asymptotic
seeking of the Nash equilibrium. Both strategies are analytically investigated
via the Lyapunov stability analysis. The applications of the proposed methods
for a network of velocity-actuated vehicles are discussed. Finally, the
effectiveness of the proposed methods is verified via conducting numerical
simulations.
","[{""version"":""v1"",""created"":""Sun, 3 Feb 2019 14:24:31 GMT""},{""version"":""v2"",""created"":""Tue, 21 Apr 2020 14:31:28 GMT""}]","2020-04-22"
"1902.00902","Jasson Vindas","Lenny Neyt and Jasson Vindas","A multidimensional Tauberian theorem for Laplace transforms of
  ultradistributions","16 pages","Integral Transforms Spec. Funct. 31 (2020), 395-411","10.1080/10652469.2019.1699556",,"math.FA","http://arxiv.org/licenses/nonexclusive-distrib/1.0/","  We obtain a multidimensional Tauberian theorem for Laplace transforms of
Gelfand-Shilov ultradistributions. The result is derived from a Laplace
transform characterization of bounded sets in spaces of ultradistributions with
supports in a convex acute cone of $\mathbb{R}^{n}$, also established here.
","[{""version"":""v1"",""created"":""Sun, 3 Feb 2019 14:26:52 GMT""},{""version"":""v2"",""created"":""Sun, 8 Dec 2019 18:17:02 GMT""}]","2020-10-16"
"1902.00903","Sajjad Marri","Sajjad Marri and Jafar Esmaili","Three- and four-body kaonic nuclear states: Binding energies and widths","17 pages, 3 figures, Eur. Phys. J. A (2019) 55: 43","Eur. Phys. J. A, 55, 43 (2019)","10.1140/epja/i2019-12717-3",,"nucl-th","http://arxiv.org/licenses/nonexclusive-distrib/1.0/","  Using separable potentials for $\bar{K}N-\pi\Sigma$ interaction, we
investigated four-body kaonic nuclear systems such as $K^{-}ppn$ and
$K^{-}K^{-}pp$, with the Faddeev AGS method in the momentum representation. The
Faddeev calculations are based on the quasi-particle method and the method of
the energy dependent pole expansion was used to obtain the separable
representation for the integral kernels in the three- and four-body equations.
Different types of $\bar{K}N-\pi\Sigma$ potentials based on phenomenological
and chiral SU(3) approach are used and it was shown that the kaonic nuclear
systems under consideration are tightly bound.
","[{""version"":""v1"",""created"":""Sun, 3 Feb 2019 14:32:40 GMT""},{""version"":""v2"",""created"":""Mon, 1 Apr 2019 16:28:02 GMT""}]","2019-04-15"
"1902.00904","Yu-Zhao Wang","Yu-Zhao Wang and Xinxin Zhang","The concavity of $p$-entropy power and applications in functional
  inequalities","16 pages","Nonlinear Analysis Volume 179, February 2019",,,"math.AP math.DG","http://arxiv.org/licenses/nonexclusive-distrib/1.0/","  In this paper, we prove the concavity of $p$-entropy power of probability
densities solving the $p$-heat equation on closed Riemannian manifold with
nonnegative Ricci curvature. As applications, we give new proofs of
$L^p$-Euclidean Nash inequality and $L^p$-Euclidean Logarithmic Sobolev
inequality, moreover, an improvement of $L^p$-Logarithmic Sobolev inequality is
derived.
","[{""version"":""v1"",""created"":""Sun, 3 Feb 2019 14:42:27 GMT""}]","2019-02-05"
"1902.00905","Jean-Francois Le Borgne","J.F. Le Borgne, A. Klotz","Observations of the RRc variable LINEAR 1169665 with the robotic
  telescope TAROT","10 pages, 7 figures, Published in the GEOS circulars (Groupe Europeen
  d'Observations Stellaires, http://geos.upv.es/ )","GEOS RR 60 (2019)",,,"astro-ph.SR","http://arxiv.org/licenses/nonexclusive-distrib/1.0/","  LINEAR 1169665 is a RR Lyrae of sub-type c discovered by the asteroid survey
LINEAR. The robotic telescope TAROT at Calern Observatory has observed it
between the years 2006 and 2015. The present study of TAROT data as well as
those from the surveys ASAS-SN (2012-2019) and LINEAR (2002-2008) shows that
this star presents a period modulation with a period of 1800.1 days (4.9 years)
but with no significant variation of magnitude at maximum. This phenomenon is
similar to the one found in KEPLER data for the RRc KIC 2831097 (Sodor et al.,
2017) which was suspected to be the result of a light time effect in a double
stellar system. The large modulation period and the lack of amplitude
modulation exclude it to be attributed to a Blazhko effect. But alternatively
to the light time effect this phenomenon might be due to a new modulation
phenomenon with long period affecting at least RRc stars.
","[{""version"":""v1"",""created"":""Sun, 3 Feb 2019 14:44:23 GMT""}]","2019-02-05"
"1902.00906","Vinayak Jagadish","Vinayak Jagadish, R. Srikanth and Francesco Petruccione","Measure of positive and not completely positive single-qubit Pauli maps","10 pages, Accepted in Phys. Rev. A for publication","Phys. Rev. A 99, 022321 (2019)","10.1103/PhysRevA.99.022321",,"quant-ph","http://creativecommons.org/licenses/by/4.0/","  The time evolution of an initially uncorrelated system is governed by a
completely positive (CP) map. More generally, the system may contain initial
(quantum) correlations with an environment, in which case the system evolves
according to a not-completely positive (NCP) map. It is an interesting question
what the relative measure is for these two types of maps within the set of
positive maps. After indicating the scope of the full problem of computing the
true volume for generic maps acting on a qubit, we study the case of Pauli
channels in an abstract space whose elements represent an equivalence class of
maps that are identical up to a non-Pauli unitary. In this space, we show that
the volume of NCP maps is twice that of CP maps.
","[{""version"":""v1"",""created"":""Sun, 3 Feb 2019 15:04:19 GMT""}]","2019-02-22"
