"1902.00742","Alaa Ali","A. Ali and M.A. Dopita","IFU spectroscopy of Southern PNe: VII Photo-ionization modelling of
  intermediate excitation class objects","19 pages, 9 figures, 9 tables","Monthly Notices of the Royal Astronomical Society (2019)","10.1093/mnras/stz201",,"astro-ph.SR astro-ph.GA","http://arxiv.org/licenses/nonexclusive-distrib/1.0/","  We present integral field unit spectroscopic observations of southern
Galactic planetary nebulae (PNe), IC 2501, Hen 2-7, and PB4. The goal of
studying these objects together is that, although they have roughly similar
intermediate excitation and evolution of central stars (CSs), they display very
different evolution in their nebular structure which needs to be understood.
The morphologies and ionisation structures of the objects are investigated
using a set of emission-line maps representative of the different ionisation
zones. We use those in order to construct two-zone self-consistent
photoionisation models for each nebula to determine new model-dependent
distances, progenitor luminosities, effective temperatures and CS masses. The
physical conditions, chemical compositions, and expansion velocities and ages
of these nebulae are derived. In Hen 2-7 we discover a strong poleward-directed
jet from the presumed binary CS. Oxygen and nitrogen abundances derived from
both collisionally excited and recombination lines reveal that PB4 displays an
extreme abundance discrepancy factor, and we present evidence that this is
caused by uorescent pumping of the OII ion by the EUV continuum of an
interacting binary CS, rather than by recombination of the OIII ion. Both IC
2501 and PB4 were classified by others as Weak Emission Line Stars (WELS).
However, our emission line maps show that their recombination lines are
spatially extended in both objects, and are therefore of nebular rather than CS
origin. Given that we have found this result in a number of other PNe, this
result casts further doubt on the reliability, or even the reality, of the WELS
classification.
","[{""version"":""v1"",""created"":""Sat, 2 Feb 2019 16:10:40 GMT""}]","2019-02-05"
"1902.00743","Linghao Song","Linghao Song, Fan Chen, Steven R. Young, Catherine D. Schuman, Gabriel
  Perdue, Thomas E. Potok","Deep Learning for Vertex Reconstruction of Neutrino-Nucleus Interaction
  Events with Combined Energy and Time Data","To appear in 2019 International Conference on Acoustics, Speech, and
  Signal Processing (ICASSP 2019)",,,,"cs.LG eess.SP physics.data-an stat.ML","http://arxiv.org/licenses/nonexclusive-distrib/1.0/","  We present a deep learning approach for vertex reconstruction of
neutrino-nucleus interaction events, a problem in the domain of high energy
physics. In this approach, we combine both energy and timing data that are
collected in the MINERvA detector to perform classification and regression
tasks. We show that the resulting network achieves higher accuracy than
previous results while requiring a smaller model size and less training time.
In particular, the proposed model outperforms the state-of-the-art by 4.00% on
classification accuracy. For the regression task, our model achieves 0.9919 on
the coefficient of determination, higher than the previous work (0.96).
","[{""version"":""v1"",""created"":""Sat, 2 Feb 2019 16:13:37 GMT""}]","2019-02-05"
"1902.00744","Haowei He","Haowei He, Gao Huang and Yang Yuan","Asymmetric Valleys: Beyond Sharp and Flat Local Minima","submitted to ICML 2019",,,,"cs.LG stat.ML","http://arxiv.org/licenses/nonexclusive-distrib/1.0/","  Despite the non-convex nature of their loss functions, deep neural networks
are known to generalize well when optimized with stochastic gradient descent
(SGD). Recent work conjectures that SGD with proper configuration is able to
find wide and flat local minima, which have been proposed to be associated with
good generalization performance. In this paper, we observe that local minima of
modern deep networks are more than being flat or sharp. Specifically, at a
local minimum there exist many asymmetric directions such that the loss
increases abruptly along one side, and slowly along the opposite side--we
formally define such minima as asymmetric valleys. Under mild assumptions, we
prove that for asymmetric valleys, a solution biased towards the flat side
generalizes better than the exact minimizer. Further, we show that simply
averaging the weights along the SGD trajectory gives rise to such biased
solutions implicitly. This provides a theoretical explanation for the
intriguing phenomenon observed by Izmailov et al. (2018). In addition, we
empirically find that batch normalization (BN) appears to be a major cause for
asymmetric valleys.
","[{""version"":""v1"",""created"":""Sat, 2 Feb 2019 16:14:52 GMT""},{""version"":""v2"",""created"":""Sun, 7 Apr 2019 01:58:12 GMT""}]","2019-04-09"
"1902.00745","Mircea Cimpoea\c{s}","Mircea Cimpoeas","On the restricted partition function via determinants with Bernoulli
  polynomials. II","9 pages, minor changes",,,,"math.NT","http://arxiv.org/licenses/nonexclusive-distrib/1.0/","  Let $r\geq 1$ be an integer, $\mathbf a=(a_1,\ldots,a_r)$ a vector of
positive integers and let $D\geq 1$ be a common multiple of $a_1,\ldots,a_r$.
In a continuation of a previous paper we prove that, if $D=1$ or $D$ is a prime
number, the restricted partition function $p_{\mathbf a}(n): = $ the number of
integer solutions $(x_1,\dots,x_r)$ to $\sum_{j=1}^r a_jx_j=n$ with $x_1\geq 0,
\ldots, x_r\geq 0$ can be computed by solving a system of linear equations with
coefficients which are values of Bernoulli polynomials and Bernoulli Barnes
numbers.
","[{""version"":""v1"",""created"":""Sat, 2 Feb 2019 16:20:32 GMT""},{""version"":""v2"",""created"":""Fri, 15 Feb 2019 13:00:27 GMT""}]","2019-02-18"
"1902.00746","Jaehyeok Shin","Jaehyeok Shin, Aaditya Ramdas, Alessandro Rinaldo","On the bias, risk and consistency of sample means in multi-armed bandits","48 pages",,,,"math.ST cs.LG stat.ML stat.TH","http://arxiv.org/licenses/nonexclusive-distrib/1.0/","  The sample mean is among the most well studied estimators in statistics,
having many desirable properties such as unbiasedness and consistency. However,
when analyzing data collected using a multi-armed bandit (MAB) experiment, the
sample mean is biased and much remains to be understood about its properties.
For example, when is it consistent, how large is its bias, and can we bound its
mean squared error? This paper delivers a thorough and systematic treatment of
the bias, risk and consistency of MAB sample means. Specifically, we identify
four distinct sources of selection bias (sampling, stopping, choosing and
rewinding) and analyze them both separately and together. We further
demonstrate that a new notion of \emph{effective sample size} can be used to
bound the risk of the sample mean under suitable loss functions. We present
several carefully designed examples to provide intuition on the different
sources of selection bias we study. Our treatment is nonparametric and
algorithm-agnostic, meaning that it is not tied to a specific algorithm or
goal. In a nutshell, our proofs combine variational representations of
information-theoretic divergences with new martingale concentration
inequalities.
","[{""version"":""v1"",""created"":""Sat, 2 Feb 2019 16:23:08 GMT""},{""version"":""v2"",""created"":""Fri, 11 Oct 2019 07:11:31 GMT""},{""version"":""v3"",""created"":""Fri, 30 Apr 2021 03:41:45 GMT""}]","2021-05-03"
"1902.00747","Farideh Heydari","M. Souri, F. Heydari, M. Maghasedi","On the eigenvalues of some signed graphs",,,,,"math.CO","http://arxiv.org/licenses/nonexclusive-distrib/1.0/","  Let $G$ be a simple graph and $A(G)$ be the adjacency matrix of $G$. The
matrix $S(G) = J -I -2A(G)$ is called the Seidel matrix of $G$, where $I$ is an
identity matrix and $J$ is a square matrix all of whose entries are equal to 1.
Clearly, if $G$ is a graph of order $n$ with no isolated vertex, then the
Seidel matrix of $G$ is also the adjacency matrix of a signed complete graph
$K_n$ whose negative edges induce $G$. In this paper, we study the Seidel
eigenvalues of the complete multipartite graph $K_{n_1,\ldots,n_k}$ and
investigate its Seidel characteristic polynomial. We show that if there are at
least three parts of size $n_i$, for some $i=1,\ldots,k$, then
$K_{n_1,\ldots,n_k}$ is determined, up to switching, by its Seidel spectrum.
","[{""version"":""v1"",""created"":""Sat, 2 Feb 2019 16:23:57 GMT""}]","2019-02-05"
"1902.00748","Joshua Steier","Joshua Steier and Luis Monterroso","A Characterization of Distance Matrices of Positive Weighted Kneser
  Graphs and Generalized Petersen Graphs","6 pages, 2 figures",,,,"math.CO","http://arxiv.org/licenses/nonexclusive-distrib/1.0/","  Rubei et. al., established results for the distance matrix of positive
weighted Petersen graphs. Focusing on the properties of the distance matrix, we
generalized positive weighted Petersen graphs results to Kneser graphs. We
analyzed theorems established by Rubei et al. and used girth of the generalized
Petersen graphs and Kneser graphs to conclude generalizations. Further, we
examined the properties of positive weighted generalized Petersen graphs. We
generalized the properties of distance matrices of positive weighted Petersen
graphs to positive weighted generalized Petersen graphs.
","[{""version"":""v1"",""created"":""Sat, 2 Feb 2019 16:24:33 GMT""}]","2019-02-05"
"1902.00749","Ji Zhu","Ji Zhu, Hua Yang, Nian Liu, Minyoung Kim, Wenjun Zhang, Ming-Hsuan
  Yang","Online Multi-Object Tracking with Dual Matching Attention Networks","Accepted by ECCV 2018",,,,"cs.CV","http://arxiv.org/licenses/nonexclusive-distrib/1.0/","  In this paper, we propose an online Multi-Object Tracking (MOT) approach
which integrates the merits of single object tracking and data association
methods in a unified framework to handle noisy detections and frequent
interactions between targets. Specifically, for applying single object tracking
in MOT, we introduce a cost-sensitive tracking loss based on the
state-of-the-art visual tracker, which encourages the model to focus on hard
negative distractors during online learning. For data association, we propose
Dual Matching Attention Networks (DMAN) with both spatial and temporal
attention mechanisms. The spatial attention module generates dual attention
maps which enable the network to focus on the matching patterns of the input
image pair, while the temporal attention module adaptively allocates different
levels of attention to different samples in the tracklet to suppress noisy
observations. Experimental results on the MOT benchmark datasets show that the
proposed algorithm performs favorably against both online and offline trackers
in terms of identity-preserving metrics.
","[{""version"":""v1"",""created"":""Sat, 2 Feb 2019 16:25:46 GMT""}]","2019-02-05"
"1902.00750","Yuting Yang","Yuting Yang, Juan Cao, Mingyan Lu, Jintao Li and Chia-Wen Lin","How to Write High-quality News on Social Network? Predicting News
  Quality by Mining Writing Style","7 pages, 6 figures",,,,"cs.CL cs.SI","http://arxiv.org/licenses/nonexclusive-distrib/1.0/","  Rapid development of Internet technologies promotes traditional newspapers to
report news on social networks. However, people on social networks may have
different needs which naturally arises the question: whether can we analyze the
influence of writing style on news quality automatically and assist writers in
improving news quality? It's challenging due to writing style and 'quality' are
hard to measure. First, we use 'popularity' as the measure of 'quality'. It is
natural on social networks but brings new problems: popularity are also
influenced by event and publisher. So we design two methods to alleviate their
influence. Then, we proposed eight types of linguistic features (53 features in
all) according eight writing guidelines and analyze their relationship with
news quality. The experimental results show these linguistic features influence
greatly on news quality. Based on it, we design a news quality assessment model
on social network (SNQAM). SNQAM performs excellently on predicting quality,
presenting interpretable quality score and giving accessible suggestions on how
to improve it according to writing guidelines we referred to.
","[{""version"":""v1"",""created"":""Sat, 2 Feb 2019 16:29:12 GMT""},{""version"":""v2"",""created"":""Wed, 21 Apr 2021 03:18:17 GMT""}]","2021-04-22"
"1902.00751","Neil Houlsby","Neil Houlsby, Andrei Giurgiu, Stanislaw Jastrzebski, Bruna Morrone,
  Quentin de Laroussilhe, Andrea Gesmundo, Mona Attariyan, Sylvain Gelly","Parameter-Efficient Transfer Learning for NLP",,,,,"cs.LG cs.CL stat.ML","http://arxiv.org/licenses/nonexclusive-distrib/1.0/","  Fine-tuning large pre-trained models is an effective transfer mechanism in
NLP. However, in the presence of many downstream tasks, fine-tuning is
parameter inefficient: an entire new model is required for every task. As an
alternative, we propose transfer with adapter modules. Adapter modules yield a
compact and extensible model; they add only a few trainable parameters per
task, and new tasks can be added without revisiting previous ones. The
parameters of the original network remain fixed, yielding a high degree of
parameter sharing. To demonstrate adapter's effectiveness, we transfer the
recently proposed BERT Transformer model to 26 diverse text classification
tasks, including the GLUE benchmark. Adapters attain near state-of-the-art
performance, whilst adding only a few parameters per task. On GLUE, we attain
within 0.4% of the performance of full fine-tuning, adding only 3.6% parameters
per task. By contrast, fine-tuning trains 100% of the parameters per task.
","[{""version"":""v1"",""created"":""Sat, 2 Feb 2019 16:29:47 GMT""},{""version"":""v2"",""created"":""Thu, 13 Jun 2019 17:48:30 GMT""}]","2019-06-14"
"1902.00752","Quentin Richard","Antoine Perasso, Quentin Richard, Irene Azzali and Ezio Venturino","Well-posedness and positivity property for a reaction-diffusion model of
  plankton communities, involving a rational nonlinearity with singularity","20 pages",,,,"math.AP","http://arxiv.org/licenses/nonexclusive-distrib/1.0/","  In this work, we consider a reaction-diffusion system, modeling the
interaction between nutrients, phytoplanktons and zooplanktons. Using a
semigroup approach in $L^2$, we prove global existence, uniqueness and
positivity of the solutions. The Holling type 2 nonlinearities, i.e of rational
type with singularity, are handled by providing estimates in $L^\infty$. The
article finally exhibits some time asymptotics properties of the solutions.
","[{""version"":""v1"",""created"":""Sat, 2 Feb 2019 16:36:04 GMT""},{""version"":""v2"",""created"":""Fri, 11 Sep 2020 16:04:58 GMT""}]","2020-09-14"
"1902.00753","Erion \c{C}ano","Erion \c{C}ano and Maurizio Morisio","Word Embeddings for Sentiment Analysis: A Comprehensive Empirical Survey","20 pages, 16 figures, 15 tables",,,,"cs.CL cs.IR","http://creativecommons.org/licenses/by-nc-sa/4.0/","  This work investigates the role of factors like training method, training
corpus size and thematic relevance of texts in the performance of word
embedding features on sentiment analysis of tweets, song lyrics, movie reviews
and item reviews. We also explore specific training or post-processing methods
that can be used to enhance the performance of word embeddings in certain tasks
or domains. Our empirical observations indicate that models trained with
multithematic texts that are large and rich in vocabulary are the best in
answering syntactic and semantic word analogy questions. We further observe
that influence of thematic relevance is stronger on movie and phone reviews,
but weaker on tweets and lyrics. These two later domains are more sensitive to
corpus size and training method, with Glove outperforming Word2vec. ""Injecting""
extra intelligence from lexicons or generating sentiment specific word
embeddings are two prominent alternatives for increasing performance of word
embedding features.
","[{""version"":""v1"",""created"":""Sat, 2 Feb 2019 17:04:14 GMT""}]","2019-02-05"
"1902.00754","Mauricio Matamoros","Mauricio Matamoros and Karin Harbusch and Dietrich Paulus","From Commands to Goal-based Dialogs: A Roadmap to Achieve Natural
  Language Interaction in RoboCup@Home","12 pages, 2 tables, 1 figure. Accepted and presented (poster) in the
  RoboCup 2018 Symposium. In press",,,,"cs.RO","http://arxiv.org/licenses/nonexclusive-distrib/1.0/","  On the one hand, speech is a key aspect to people's communication. On the
other, it is widely acknowledged that language proficiency is related to
intelligence. Therefore, intelligent robots should be able to understand, at
least, people's orders within their application domain. These insights are not
new in RoboCup@Home, but we lack of a long-term plan to evaluate this approach.
In this paper we conduct a brief review of the achievements on automated speech
recognition and natural language understanding in RoboCup@Home. Furthermore, we
discuss main challenges to tackle in spoken human-robot interaction within the
scope of this competition. Finally, we contribute by presenting a pipelined
road map to engender research in the area of natural language understanding
applied to domestic service robotics.
","[{""version"":""v1"",""created"":""Sat, 2 Feb 2019 17:09:49 GMT""}]","2019-02-05"
"1902.00755","Nodoka Yamanaka","Nodoka Yamanaka","Nuclear electric dipole moment as a good probe of CP violation","4 pages, 1 figure, proceedings of the 8th International Conference on
  Quarks and Nuclear Physics (QNP2018), November 13-17, 2018",,"10.7566/JPSCP.26.031033",,"nucl-th hep-ex hep-ph nucl-ex","http://arxiv.org/licenses/nonexclusive-distrib/1.0/","  The electric dipole moment (EDM) is an excellent probe of new physics beyond
the standard model of particle physics. The EDM of light nuclei is particularly
interesting due to the high sensitivity to the hadron level CP violation. In
this proceedings contribution, we investigate the mechanism of the generation
of the EDM for several light nuclei and the prospect for the discovery of new
physics.
","[{""version"":""v1"",""created"":""Sat, 2 Feb 2019 17:22:39 GMT""}]","2020-01-08"
"1902.00756","Hao Zhu","Hao Zhu, Yankai Lin, Zhiyuan Liu, Jie Fu, Tat-seng Chua, Maosong Sun","Graph Neural Networks with Generated Parameters for Relation Extraction",,,,,"cs.CL","http://creativecommons.org/licenses/by-sa/4.0/","  Recently, progress has been made towards improving relational reasoning in
machine learning field. Among existing models, graph neural networks (GNNs) is
one of the most effective approaches for multi-hop relational reasoning. In
fact, multi-hop relational reasoning is indispensable in many natural language
processing tasks such as relation extraction. In this paper, we propose to
generate the parameters of graph neural networks (GP-GNNs) according to natural
language sentences, which enables GNNs to process relational reasoning on
unstructured text inputs. We verify GP-GNNs in relation extraction from text.
Experimental results on a human-annotated dataset and two distantly supervised
datasets show that our model achieves significant improvements compared to
baselines. We also perform a qualitative analysis to demonstrate that our model
could discover more accurate relations by multi-hop relational reasoning.
","[{""version"":""v1"",""created"":""Sat, 2 Feb 2019 17:34:19 GMT""}]","2019-02-05"
"1902.00757","Cass Dykeman","Stephen Wong and Cass Dykeman","East Asians with Internet Addiction: Prevalence Rates and Support Use
  Patterns","26 pages, 3 Tables",,,,"cs.HC cs.CY","http://creativecommons.org/licenses/by/4.0/","  The issue of Internet addiction has become a serious social and health issue
in East Asian countries. There are only a few treatment programs for Internet
addiction, and their effectiveness with people from East Asian remains unclear.
As support and treatment develop, it is necessary to understand cultural
preferences for dealing with this concern. Using data from the East Asian
Social Survey (EASS), this study examined preferred sources of assistance for
help with internet use problems in four countries - China, Japan, South Korea,
and Taiwan. Preferences for kin versus non-kin support, use of alternative
medicine, and professional mental health assistance were examined, as were
between-country differences in support preferences. The results indicate a
strong preference for seeking assistance from close relatives, followed by
non-kin support (i.e., close friends and co-participants in religious
institutions), alternative medicine, and professional mental health services,
respectively. While there is a strong preference for family support, over 80%
of survey respondents were open to seeking formal or informal mental health
support outside the family. There were some significant differences between
countries, with South Koreans being more likely to seek non-kin support and
professional support for internet addiction concerns compared to Chinese. These
differences are discussed in the context of cultural and policy developments in
East Asian countries. Findings suggest the need for a more holistic approach to
treating low mental health concerns.
","[{""version"":""v1"",""created"":""Sat, 2 Feb 2019 17:34:54 GMT""}]","2019-02-05"
"1902.00758","Mauricio Matamoros","Mauricio Matamoros and Viktor Seib and Raphael Memmesheimer and
  Dietrich Paulus","RoboCup@Home: Summarizing achievements in over eleven years of
  competition","6 pages, 4 images, 3 tables Published in: 2018 IEEE International
  Conference on Autonomous Robot Systems and Competitions (ICARSC)","2018 IEEE International Conference on Autonomous Robot Systems and
  Competitions (ICARSC)","10.1109/ICARSC.2018.8374181",,"cs.RO","http://arxiv.org/licenses/nonexclusive-distrib/1.0/","  Scientific competitions are important in robotics because they foster
knowledge exchange and allow teams to test their research in unstandardized
scenarios and compare result. In the field of service robotics its role becomes
crucial. Competitions like RoboCup@Home bring robots to people, a fundamental
step to integrate them into society.
  In this paper we summarize and discuss the differences between the
achievements claimed by teams in their team description papers, and the results
observed during the competition^1 from a qualitative perspective.
  We conclude with a set of important challenges to be conquered first in order
to take robots to people's homes. We believe that competitions are also an
excellent opportunity to collect data of direct and unbiased interactions for
further research.
  ^1 The authors belong to several teams who have participated in RoboCup@Home
as early as 2007
","[{""version"":""v1"",""created"":""Sat, 2 Feb 2019 17:54:06 GMT""}]","2019-02-05"
"1902.00759","Vladimir Chilin","Aziz Azizov, Vladimir Chilin, Semyon Litvinov","Ergodic theorems in Banach ideals of compact operators",,,,,"math.FA","http://arxiv.org/licenses/nonexclusive-distrib/1.0/","  Let $\mathcal H$ be an infinite-dimensional Hilbert space, and let $\mathcal
B(\mathcal H)$ ($\mathcal K(\mathcal H)$) be the $C^*$-algebra of bounded
(respectively, compact) linear operators in $\mathcal H$. Let $(E,\|\cdot\|_E)$
be a fully symmetric sequence space. If $\{s_n(x)\}_{n=1}^\infty$ are the
singular values of $x\in\mathcal K(\mathcal H)$, let $\mathcal
C_E=\{x\in\mathcal K(\mathcal H): \{s_n(x)\}\in E\}$ with $\|x\|_{\mathcal
C_E}=\|\{s_n(x)\}\|_E$, $x\in\mathcal C_E$, be the Banach ideal of compact
operators generated by $E$. We show that the averages
$A_n(T)(x)=\frac1{n+1}\sum\limits_{k = 0}^n T^k(x)$ converge uniformly in
$\mathcal C_E$ for any positive Dunford-Schwartz operator $T$ and $x\in\mathcal
C_E$. Besides, if $x\in\mathcal B(\mathcal H)\setminus\mathcal K(\mathcal H)$,
there exists a Dunford-Schwartz operator $T$ such that the sequence
$\{A_n(T)(x)\}$ does not converge uniformly. We also show that the averages
$A_n(T)$ converge strongly in $(\mathcal C_E,\|\cdot\|_{\mathcal C_E})$ if and
only if $E$ is separable and $E\neq l^1$, as sets.
","[{""version"":""v1"",""created"":""Sat, 2 Feb 2019 18:13:34 GMT""},{""version"":""v2"",""created"":""Sun, 3 Mar 2019 17:12:32 GMT""}]","2019-03-05"
"1902.00760","Alessio Tonioni","Alessio Tonioni and Luigi Di Stefano","Domain invariant hierarchical embedding for grocery products recognition",,,,,"cs.CV","http://arxiv.org/licenses/nonexclusive-distrib/1.0/","  Recognizing packaged grocery products based solely on appearance is still an
open issue for modern computer vision systems due to peculiar challenges.
Firstly, the number of different items to be recognized is huge (i.e., in the
order of thousands) and rapidly changing over time. Moreover, there exist a
significant domain shift between the images that should be recognized at test
time, taken in stores by cheap cameras, and those available for training,
usually just one or a few studio-quality images per product. We propose an
end-to-end architecture comprising a GAN to address the domain shift at
training time and a deep CNN trained on the samples generated by the GAN to
learn an embedding of product images that enforces a hierarchy between product
categories. At test time, we perform recognition by means of K-NN search
against a database consisting of just one reference image per product.
Experiments addressing recognition of products present in the training datasets
as well as different ones unseen at training time show that our approach
compares favourably to state-of-the-art methods on the grocery recognition task
and generalize fairly well to similar ones.
","[{""version"":""v1"",""created"":""Sat, 2 Feb 2019 18:19:41 GMT""}]","2019-02-05"
