"1902.00778","Hosein Hasanbeig","Hosein Hasanbeig, Daniel Kroening, Alessandro Abate","Certified Reinforcement Learning with Logic Guidance",,,,,"cs.LG stat.ML","http://arxiv.org/licenses/nonexclusive-distrib/1.0/","  Reinforcement Learning (RL) is a widely employed machine learning
architecture that has been applied to a variety of control problems. However,
applications in safety-critical domains require a systematic and formal
approach to specifying requirements as tasks or goals. We propose a model-free
RL algorithm that enables the use of Linear Temporal Logic (LTL) to formulate a
goal for unknown continuous-state/action Markov Decision Processes (MDPs). The
given LTL property is translated into a Limit-Deterministic Generalised Buchi
Automaton (LDGBA), which is then used to shape a synchronous reward function
on-the-fly. Under certain assumptions, the algorithm is guaranteed to
synthesise a control policy whose traces satisfy the LTL specification with
maximal probability.
","[{""version"":""v1"",""created"":""Sat, 2 Feb 2019 20:09:32 GMT""},{""version"":""v2"",""created"":""Wed, 11 Dec 2019 00:13:32 GMT""},{""version"":""v3"",""created"":""Mon, 10 Feb 2020 11:09:18 GMT""},{""version"":""v4"",""created"":""Tue, 6 Jun 2023 15:52:30 GMT""}]","2023-06-07"
"1902.00779","Richard Remsing","Richard C. Remsing and John D. Weeks","The Influence of Distant Boundaries on the Solvation of Charged
  Particles","13 pages, 4 figures",,"10.1007/s10955-019-02274-8",,"cond-mat.stat-mech cond-mat.soft physics.chem-ph","http://arxiv.org/licenses/nonexclusive-distrib/1.0/","  The long-ranged nature of the Coulomb potential requires a proper accounting
for the influence of even distant electrostatic boundaries in the determination
of the solvation free energy of a charged solute. We introduce an exact
rewriting of the free energy change upon charging a solute that explicitly
isolates the contribution from these boundaries and quantifies the impact of
the different boundaries on the free energy. We demonstrate the importance and
advantages of appropriately referencing the electrostatic potential to that of
the vacuum through the study of several simple model charge distributions, for
which we can isolate an analytic contribution from the boundaries that can be
readily evaluated in computer simulations of molecular systems. Finally, we
highlight that the constant potential of the bulk dielectric phase - the Bethe
potential - cannot contribute to the solvation thermodynamics of a single
charged solute when the charge distributions of the solvent and solute do not
overlap in relevant configurations. But when the charge distribution of a
single solute can overlap with the intramolecular charge distribution of
solvent molecules, as is the case in electron holography, for example, the
Bethe potential is needed when comparing to experiment. Our work may also
provide insight into the validity of ""extra thermodynamic assumptions""
traditionally made during the experimental determination of single ion
solvation free energies.
","[{""version"":""v1"",""created"":""Sat, 2 Feb 2019 20:10:27 GMT""},{""version"":""v2"",""created"":""Fri, 15 Mar 2019 14:15:05 GMT""}]","2019-05-01"
"1902.00780","Marc Vila Tusell","Marc Vila, Nguyen Tuan Hung, Stephan Roche, Riichiro Saito","Tunable Circular Dichroism and Valley Polarization in the Modified
  Haldane Model","Published in Phys. Rev. B 99, 161404(R)","Phys. Rev. B 99, 161404 (2019)","10.1103/PhysRevB.99.161404",,"cond-mat.mes-hall","http://arxiv.org/licenses/nonexclusive-distrib/1.0/","  We study the polarization dependence of optical absorption for the modified
Haldane model, which exhibits antichiral edge modes in presence of sample
boundaries and has been argued to be realizable in transition metal
dichalcogenides or Weyl semimetals. A rich optical phase diagram is unveiled,
in which the correlations between perfect circular dichroism, pseudospin and
valley polarization can be tuned independently upon varying the Fermi energy.
Importantly, perfect circular dichroism and valley polarization are achieved
simultaneously. This unprecedented combination of optical properties suggests
some interesting novel photonic device functionality (e.g. light polarizer)
which could be combined with valleytronics applications (e.g. generation of
valley currents).
","[{""version"":""v1"",""created"":""Sat, 2 Feb 2019 20:12:43 GMT""},{""version"":""v2"",""created"":""Thu, 18 Apr 2019 08:43:39 GMT""}]","2019-04-24"
"1902.00781","Giulia Sacc\`a","Klaus Hulek and Radu Laza and Giulia Sacc\`a","The Euler number of hyper-K\""ahler manifolds of OG10 type","10 pages; To appear in the Proceedings of the ICM 2018 Satellite
  conference ""Moduli Spaces in Algebraic Geometry and Applications"", Campinas",,,,"math.AG","http://arxiv.org/licenses/nonexclusive-distrib/1.0/","  Using the Laza-Sacc\`a-Voisin construction, we give a simple proof for the
fact that the Euler characteristic of a hyper-K\""ahler manifold of OG10 type is
176,904, a result previously established by Mozgovoy.
","[{""version"":""v1"",""created"":""Sat, 2 Feb 2019 20:14:09 GMT""},{""version"":""v2"",""created"":""Tue, 5 Nov 2019 08:29:00 GMT""}]","2019-11-06"
"1902.00782","Gustavo Lara","Gustavo Lara, Gabriel \'Alvarez, Gabriel Gonz\'alez, Juan Gonz\'alez,
  Rafael Ar\'anguiz and Patricio Catal\'an","Topography effect on the seismogenic deformation of the earth's surface",,,,,"physics.geo-ph","http://arxiv.org/licenses/nonexclusive-distrib/1.0/","  A comparison of the displacements of the earth's surface after an earthquake
was made, calculating with the analytical expressions coming from an infinite
flat slab approximation and compared with these numerically considering the
topography of the Earth. One conclusion of this work is that the flat Earth
approximation, has a greater error in the lateral displacement than in the
vertical one. It can also be noted that the error in the magnitude of the
displacement is less or of the order of ten percent of the maximum displacement
of the earth's surface.
","[{""version"":""v1"",""created"":""Sat, 2 Feb 2019 20:26:36 GMT""}]","2019-02-05"
"1902.00783","Nidal Chamoun","A. Ashour (Damascus Univ.), M. Alcheikh (Damascus Univ.) and N.
  Chamoun (HIAST)","General Modified Friedmann Equations in Rainbow Flat Universe, by
  Thermodynamics","7 pages, to appear in EPJC",,"10.1140/epjc/s10052-019-6640-8",,"gr-qc hep-ph","http://arxiv.org/licenses/nonexclusive-distrib/1.0/","  We investigate the derivation of Friedmann equations in Rainbow gravity
following Jacobson thermodynamic approach. We do not restrict the rainbow
functions to be constant as is customarily used, and show that the first law of
thermodynamics with a corresponding `classical' proportionality between entropy
and surface area, supplemented eventually by a `quantum' logarithmic
correction, are not in general sufficient to obtain the equations in flat FRW
metrics.
","[{""version"":""v1"",""created"":""Sat, 2 Feb 2019 20:37:37 GMT""}]","2020-05-28"
"1902.00784","Alathea Jensen PhD","Alathea Jensen","Self-Polar Polytopes",,,,,"math.CO","http://arxiv.org/licenses/nonexclusive-distrib/1.0/","  Self-polar polytopes are convex polytopes that are equal to an orthogonal
transformation of their polar sets. These polytopes were first studied by
Lov\'{a}sz as a means of establishing the chromatic number of distance graphs
on spheres, and they can also be used to construct triangle-free graphs with
arbitrarily high chromatic number. We investigate the existence, construction,
facial structure, and practical applications of self-polar polytopes, as well
as the place of these polytopes within the broader set of self-dual polytopes.
","[{""version"":""v1"",""created"":""Sat, 2 Feb 2019 20:37:44 GMT""}]","2019-02-05"
"1902.00785","Chris Fields","Chris Fields","Some Consequences of the Thermodynamic Cost of System Identification","22 pgs, 3 figures. Published version","Entropy 20, 797 (2018)","10.3390/e20100797",,"quant-ph","http://arxiv.org/licenses/nonexclusive-distrib/1.0/","  The concept of a ``system'' is foundational to physics, but the question of
how observers identify systems is seldom addressed. Classical thermodynamics
restricts observers to finite, finite-resolution observations with which to
identify the systems on which ``pointer state'' measurements are to be made. It
is shown that system identification is at best approximate, even in a finite
world, and that violations of the Leggett--Garg and Bell/CHSH
(Clauser-Horne-Shimony-Holt) inequalities emerge naturally as requirements for
successful system identification.
","[{""version"":""v1"",""created"":""Sat, 2 Feb 2019 20:39:40 GMT""}]","2019-02-05"
"1902.00786","Joseph Attia","Joseph Attia","The Applications of Graph Theory to Investing","53 Pages",,,,"q-fin.ST cs.DM q-fin.MF","http://creativecommons.org/licenses/by/4.0/","  How can graph theory be applied to investing in the stock market? The answer
may help investors realize the true risks of their investments, help prevent
recessions like that of 2008, and increase financial literacy amongst students.
Using several original Python programs, we take a correlation matrix with
correlations between the stock prices and then transform that into a graphable
binary adjacency matrix. From this graph, we take a graph in which each edge
represents weak correlations between two stocks. Finding the largest complete
graph will produce a diversified portfolio. Numerous trials have shown that
diversified portfolios consistently outperform the market during times of
economic stability, but undiversified portfolios prove to be riskier and more
unpredictable, either producing huge profits or even larger losses.
Furthermore, once deciding among which stocks our portfolio would consist of,
how do we know when to invest in each stock to maximize profits? Can taking
stock price data and shifting values help predict how a stock will perform
today if another stock performs a certain way n days prior? It was found that
this method of predicting the optimal time to investment failed to improve
returns when based solely on correlations. Although a trial with random stocks
with varied correlations produced more profits than continuously investing.
","[{""version"":""v1"",""created"":""Sat, 2 Feb 2019 20:39:54 GMT""}]","2019-02-05"
"1902.00787","Estanislao Herscovich","David Fern\'andez and Estanislao Herscovich","Cyclic $A_{\infty}$-algebras and double Poisson algebras","27 pages. All comments are welcome!",,,,"math.KT math.RT","http://arxiv.org/licenses/nonexclusive-distrib/1.0/","  In this article we prove that there exists an explicit bijection between nice
$d$-pre-Calabi-Yau algebras and $d$-double Poisson differential graded
algebras, where $d \in \mathbb{Z}$, extending a result proved by N. Iyudu and
M. Kontsevich. We also show that this correspondence is functorial in a quite
satisfactory way, giving rise to a (partial) functor from the category of
$d$-double Poisson dg algebras to the partial category of $d$-pre-Calabi-Yau
algebras. Finally, we further generalize it to include double
$P_{\infty}$-algebras, as introduced by T. Schedler.
","[{""version"":""v1"",""created"":""Sat, 2 Feb 2019 20:46:06 GMT""}]","2019-02-05"
"1902.00788","Chris Fields","Chris Fields","Decoherence as a sequence of entanglement swaps","13 pgs, 3 figures. Accepted by Results in Physics",,,,"quant-ph","http://arxiv.org/licenses/nonexclusive-distrib/1.0/","  Standard semi-classical models of decoherence do not take explicit account of
the classical information required to specify the system - environment
boundary. I show that this information can be represented as a finite set of
reference eigenvalues that must be encoded by any observer, including any
apparatus, able to distinguish the system from its environment. When the
information required for system identification is accounted for in this way,
decoherence can be described as a sequence of entanglement swaps between
reference and pointer components of the system and their respective
environments. Doing so removes the need for the a priori assumptions of ontic
boundaries required by semi-classical models.
","[{""version"":""v1"",""created"":""Sat, 2 Feb 2019 20:46:40 GMT""}]","2019-02-05"
"1902.00789","Charles Marcus","Davydas Razmadze, Deividas Sabonis, Filip K. Malinowski, Gerbold C.
  Menard, Sebastian Pauka, Hung Nguyen, David M. T. van Zanten, Eoin C. T.
  O'Farrell, Judith Suter, Peter Krogstrup, Ferdinand Kuemmeth, Charles M.
  Marcus","Radio-frequency methods for Majorana-based quantum devices: fast charge
  sensing and phase diagram mapping",,"Phys. Rev. Applied 11, 064011 (2019)","10.1103/PhysRevApplied.11.064011","NBI QDEV 2019","cond-mat.mes-hall cond-mat.supr-con","http://arxiv.org/licenses/nonexclusive-distrib/1.0/","  Radio-frequency (RF) reflectometry is implemented in hybrid
semiconductor-superconductor nanowire systems designed to probe Majorana zero
modes. Two approaches are presented. In the first, hybrid nanowire-based
devices are part of a resonant circuit, allowing conductance to be measured as
a function of several gate voltages ~40 times faster than using conventional
low-frequency lock-in methods. In the second, nanowire devices are capacitively
coupled to a nearby RF single-electron transistor made from a separate
nanowire, allowing RF detection of charge, including charge-only measurement of
the crossover from 2e inter-island charge transitions at zero magnetic field to
1e transitions at axial magnetic fields above 0.6 T, where a topological state
is expected. Single-electron sensing yields signal-to-noise exceeding 3 and
visibility 99.8% for a measurement time of 1 {\mu}s.
","[{""version"":""v1"",""created"":""Sat, 2 Feb 2019 20:49:21 GMT""}]","2019-10-31"
"1902.00790","Shashank Kanade","Shashank Kanade, Debajyoti Nandi, Matthew C. Russell","A variant of ${\texttt{IdentityFinder}}$ and some new identities of
  Rogers-Ramanujan-MacMahon type","subsumes arXiv:1703.04715",,,,"math.CO math.NT","http://arxiv.org/licenses/nonexclusive-distrib/1.0/","  We report on findings of a variant of ${\texttt{IdentityFinder}}$ - a Maple
program that was used by two of the authors to conjecture several new
identities of Rogers-Ramanujan kind. In the present search, we modify the
parametrization of the search space by taking into consideration several
aspects of Lepowsky and Wilson's $Z$-algebraic mechanism and its variant by
Meurman and Primc. We search for identities based on forbidding the appearance
of ""flat"" partitions as sub-partitions. Several new identities of
Rogers-Ramanujan-MacMahon type are found and proved.
","[{""version"":""v1"",""created"":""Sat, 2 Feb 2019 20:55:14 GMT""}]","2019-02-05"
"1902.00791","Marta Crispino","Julyan Arbel, Marta Crispino and St\'ephane Girard","Dependence properties and Bayesian inference for asymmetric multivariate
  copulas",,"Journal of Multivariate Analysis, 2019",,,"math.ST stat.ME stat.TH","http://arxiv.org/licenses/nonexclusive-distrib/1.0/","  We study a broad class of asymmetric copulas introduced by Liebscher (2008)
as a combination of multiple - usually symmetric - copulas. The main thrust of
the paper is to provide new theoretical properties including exact tail
dependence expressions and stability properties. A subclass of Liebscher
copulas obtained by combining Fr\'echet copulas is studied in more details. We
establish further dependence properties for copulas of this class and show that
they are characterized by an arbitrary number of singular components.
Furthermore, we introduce a novel iterative representation for general
Liebscher copulas which de facto insures uniform margins, thus relaxing a
constraint of Liebscher's original construction. Besides, we show that this
iterative construction proves useful for inference by developing an Approximate
Bayesian computation sampling scheme. This inferential procedure is
demonstrated on simulated data.
","[{""version"":""v1"",""created"":""Sat, 2 Feb 2019 20:56:31 GMT""},{""version"":""v2"",""created"":""Wed, 26 Jun 2019 07:36:08 GMT""}]","2019-07-16"
"1902.00792","Tomasz Ku\'smierczyk","Tomasz Ku\'smierczyk, Joseph Sakaya, Arto Klami","Variational Bayesian Decision-making for Continuous Utilities","Appearing at Neural Information Processing Systems 32 (NeurIPS 2019)",,,,"stat.ML cs.LG","http://arxiv.org/licenses/nonexclusive-distrib/1.0/","  Bayesian decision theory outlines a rigorous framework for making optimal
decisions based on maximizing expected utility over a model posterior. However,
practitioners often do not have access to the full posterior and resort to
approximate inference strategies. In such cases, taking the eventual
decision-making task into account while performing the inference allows for
calibrating the posterior approximation to maximize the utility. We present an
automatic pipeline that co-opts continuous utilities into variational inference
algorithms to account for decision-making. We provide practical strategies for
approximating and maximizing the gain, and empirically demonstrate consistent
improvement when calibrating approximations for specific utilities.
","[{""version"":""v1"",""created"":""Sat, 2 Feb 2019 20:59:36 GMT""},{""version"":""v2"",""created"":""Fri, 24 May 2019 15:58:52 GMT""},{""version"":""v3"",""created"":""Sun, 27 Oct 2019 16:21:22 GMT""}]","2019-10-29"
"1902.00793","Hicham Zoubeir","Hicham Zoubeir","About a conjecture on difference equations in quasianalytic Carleman
  classes","6 pages","PUBLICATIONS DE L'INSTITUT MATHEMATIQUE NOUVELLE SERIE,ISSN:
  0350-1302, volume 100, Issue 114, year 2016",,,"math.CA math.CV math.FA","http://arxiv.org/licenses/nonexclusive-distrib/1.0/","  In this paper we obtain a partial answer to a conjecture on the solvabilty of
linear difference equations in quasianalytic Carleman classes.
","[{""version"":""v1"",""created"":""Sat, 2 Feb 2019 21:00:13 GMT""}]","2019-02-05"
"1902.00794","Liljana Babinkostova","L. Babinkostova, D. Fillmore, P. Lamkin, A. Lin and C. L. Yost-Wolff","Strongly Non-zero Points and Elliptic Pseudoprimes","17 pages","Involve 14 (2021) 65-88","10.2140/involve.2021.14.65",,"math.NT","http://arxiv.org/licenses/nonexclusive-distrib/1.0/","  We examine the notion of strongly non-zero points and use it as a tool in the
study of several types of elliptic pseudoprimes. Moreover, we give give some
probabilistic results about the existence of strong elliptic pseudoprimes for a
randomly chosen point on a randomly chosen elliptic curve.
","[{""version"":""v1"",""created"":""Sat, 2 Feb 2019 21:05:56 GMT""}]","2021-03-10"
"1902.00795","Jinoh Kim","Jinhwan Choi, Yu Gu, Jinoh Kim","Learning-based Dynamic Cache Management in a Cloud",,,,,"cs.DC","http://arxiv.org/licenses/nonexclusive-distrib/1.0/","  Caches are an important component of modern computing systems given their
significant impact on performance. In particular, caches play a key role in the
cloud due to the nature of large-scale, data-intensive processing. One of the
key challenges for the cloud providers is how to share the caching capacity
among tenants, under the circumstance that each often requires a different
degree of quality of service (QoS) with respect to data access performance. The
invariant is that the individual tenants' QoS requirements should be satisfied
while the cache usage is optimized in a system-wide manner. In this paper, we
introduce a learning-based approach for dynamic cache management in a cloud,
which is based on the estimation of data access pattern of a tenant and the
prediction of cache performance for the access pattern in question. We consider
a variety of probability distributions to estimate the data access pattern, and
examine a set of learning-based regression techniques to predict the cache hit
rate for the access pattern. The predicted cache hit rate is then used to make
a decision whether reallocating cache space is needed to meet the QoS
requirement for the tenant. Our experimental results with an extensive set of
synthetic traces and the YCSB benchmark show that the proposed method
consistently optimizes the cache space while satisfying the QoS requirement.
","[{""version"":""v1"",""created"":""Sat, 2 Feb 2019 21:08:18 GMT""}]","2019-02-05"
"1902.00796","Patrick Peter","Patrick Peter (IAP & DAMTP)","Using Trajectories in Quantum Cosmology","6 pages, 6 figures, conference ""Estate Quantistica"" report","Universe 4, 89 (2018)","10.3390/universe4080089",,"gr-qc","http://arxiv.org/licenses/nonexclusive-distrib/1.0/","  Quantum cosmology based on the Wheeler De Witt equation represents a simple
way to implement plausible quantum effects in a gravitational setup. In its
minisuperspace version wherein one restricts attention to FLRW metrics with a
single scale factor and only a few degrees of freedom describing matter, one
can obtain exact solutions and thus acquire full knowledge of the wave
function. Although this is the usual way to treat a quantum mechanical system,
it turns out however to be essentially meaningless in a cosmological framework.
Turning to a trajectory approach then provides an effective means of deriving
physical consequences.
","[{""version"":""v1"",""created"":""Sat, 2 Feb 2019 21:15:33 GMT""}]","2019-02-05"
"1902.00797","Charles Marcus","David M.T. van Zanten, Deividas Sabonis, Judith Suter, Jukka I.
  V\""ayrynen, Torsten Karzig, Dmitry I. Pikulin, Eoin C. T. O'Farrell, Davydas
  Razmadze, Karl D. Petersson, Peter Krogstrup, Charles M. Marcus","Photon Assisted Tunneling of Zero Modes in a Majorana Wire",,"Nature Physics (2020)","10.1038/s41567-020-0858-0","NBI QDEV 2019","cond-mat.mes-hall cond-mat.supr-con","http://arxiv.org/licenses/nonexclusive-distrib/1.0/","  Hybrid nanowires with proximity-induced superconductivity in the topological
regime host Majorana zero modes (MZMs) at their ends, and networks of such
structures can produce topologically protected qubits. In a double-island
geometry where each segment hosts a pair of MZMs, inter-pair coupling mixes the
charge parity of the islands and opens an energy gap between the even and odd
charge states at the inter-island charge degeneracy. Here, we report on the
spectroscopic measurement of such an energy gap in an InAs/Al double-island
device by tracking the position of the microwave-induced quasiparticle (qp)
transitions using a radio-frequency (rf) charge sensor. In zero magnetic field,
photon assisted tunneling (PAT) of Cooper pairs gives rise to resonant lines in
the 2e-2e periodic charge stability diagram. In the presence of a magnetic
field aligned along the nanowire, resonance lines are observed parallel to the
inter-island charge degeneracy of the 1e-1e periodic charge stability diagram,
where the 1e periodicity results from a zero-energy sub-gap state that emerges
in magnetic field. Resonant lines in the charge stability diagram indicate
coherent photon assisted tunneling of single-electron states, changing the
parity of the two islands. The dependence of resonant frequency on detuning
indicates a sizable (GHz-scale) hybridization of zero modes across the junction
separating islands.
","[{""version"":""v1"",""created"":""Sat, 2 Feb 2019 21:21:53 GMT""}]","2020-04-27"
"1902.00798","Hennebelle","Patrick Hennebelle and Shu-ichiro Inutsuka","The role of magnetic field in molecular cloud formation and evolution","accepted for publication in Frontiers in Astronomy and Space
  Sciences, section Stellar and Solar Physics Article type: Review edited by
  Christopher F. McKee",,,,"astro-ph.GA","http://arxiv.org/licenses/nonexclusive-distrib/1.0/","  We review the role that magnetic field may have on the formation and
evolution of molecular clouds. After a brief presentation and main assumptions
leading to ideal MHD equations, their most important correction, namely the
ion-neutral drift is described. The nature of the multi-phase interstellar
medium (ISM) and the thermal processes that allows this gas to become denser
are presented. Then we discuss our current knowledge of compressible magnetized
turbulence, thought to play a fundamental role in the ISM. We also describe
what is known regarding the correlation between the magnetic and the density
fields. Then the influence that magnetic field may have on the interstellar
filaments and the molecular clouds is discussed, notably the role it may have
on the prestellar dense cores as well as regarding the formation of stellar
clusters. Finally we briefly review its possible effects on the formation of
molecular clouds themselves. We argue that given the magnetic intensities that
have been measured, it is likely that magnetic field is i) responsible of
reducing the star formation rate in dense molecular cloud gas by a factor of a
few, ii) strongly shaping the interstellar gas by generating a lot of filaments
and reducing the numbers of clumps, cores and stars, although its exact
influence remains to be better understood. % by a factor on the order of at
least 2. Moreover at small scales, magnetic braking is likely a dominant
process that strongly modifies the outcome of the star formation process.
Finally, we stress that by inducing the formation of more massive stars,
magnetic field could possibly enhance the impact of stellar feedback.
","[{""version"":""v1"",""created"":""Sat, 2 Feb 2019 21:29:23 GMT""}]","2019-02-05"
