"1904.04890","Francis Williams","Francis Williams, Alexander Bock, Harish Doraiswamy, Cassandra
  Donatelli, Kayla Hall, Adam Summers, Daniele Panozzo, Cl\'audio T. Silva","Unwind: Interactive Fish Straightening",,,"10.1145/3313831.3376846",,"cs.GR cs.HC","http://arxiv.org/licenses/nonexclusive-distrib/1.0/","  The ScanAllFish project is a large-scale effort to scan all the world's
33,100 known species of fishes. It has already generated thousands of
volumetric CT scans of fish species which are available on open access
platforms such as the Open Science Framework. To achieve a scanning rate
required for a project of this magnitude, many specimens are grouped together
into a single tube and scanned all at once. The resulting data contain many
fish which are often bent and twisted to fit into the scanner. Our system,
Unwind, is a novel interactive visualization and processing tool which
extracts, unbends, and untwists volumetric images of fish with minimal user
interaction. Our approach enables scientists to interactively unwarp these
volumes to remove the undesired torque and bending using a piecewise-linear
skeleton extracted by averaging isosurfaces of a harmonic function connecting
the head and tail of each fish. The result is a volumetric dataset of a
individual, straight fish in a canonical pose defined by the marine biologist
expert user. We have developed Unwind in collaboration with a team of marine
biologists: Our system has been deployed in their labs, and is presently being
used for dataset construction, biomechanical analysis, and the generation of
figures for scientific publication.
","[{""version"":""v1"",""created"":""Tue, 9 Apr 2019 20:07:24 GMT""},{""version"":""v2"",""created"":""Wed, 5 Feb 2020 18:55:13 GMT""}]","2020-02-06"
"1904.04891","Tanya Zelevinsky","S. S. Kondov, C.-H. Lee, K. H. Leung, C. Liedl, I. Majewska, R.
  Moszynski, T. Zelevinsky","Molecular lattice clock with long vibrational coherence",,"Nat. Phys. 15, 1118 (2019)","10.1038/s41567-019-0632-3",,"physics.atom-ph quant-ph","http://arxiv.org/licenses/nonexclusive-distrib/1.0/","  Atomic lattice clocks have spurred numerous ideas for tests of fundamental
physics, detection of general relativistic effects, and studies of interacting
many-body systems. On the other hand, molecular structure and dynamics offer
rich energy scales that are at the heart of new protocols in precision
measurement and quantum information science. Here we demonstrate a
fundamentally distinct type of lattice clock that is based on vibrations in
diatomic molecules, and present coherent Rabi oscillations between weakly and
deeply bound molecules that persist for 10's of milliseconds. This control is
made possible by a state-insensitive magic lattice trap that weakly couples to
molecular vibronic resonances and enhances the coherence time between molecules
and light by several orders of magnitude. The achieved quality factor
$Q=8\times10^{11}$ results from 30-Hz narrow resonances for a 25-THz clock
transition in Sr$_2$. Our technique of extended coherent manipulation is
applicable to long-term storage of quantum information in qubits based on
ultracold polar molecules, while the vibrational clock enables precise probes
of interatomic forces, tests of Newtonian gravitation at ultrashort range, and
model-independent searches for electron-to-proton mass ratio variations.
","[{""version"":""v1"",""created"":""Tue, 9 Apr 2019 20:09:46 GMT""}]","2019-11-12"
"1904.04892","David Aguado","David S. Aguado, Jonay I. Gonz\'alez Hern\'andez, Carlos Allende
  Prieto and Rafael Rebolo","Back to the Lithium Plateau with J0023+0307 with [Fe/H]<-6","6 pages 2 figures","Published in ApJL april 2019","10.3847/2041-8213/ab1076",,"astro-ph.SR astro-ph.CO astro-ph.GA","http://arxiv.org/licenses/nonexclusive-distrib/1.0/","  We present an analysis of the UVES high-resolution spectroscopic observations
at the 8.2m VLT of J0023+0307, a main-sequence extremely iron-poor dwarf star.
We are unable to detect iron lines in the spectrum but derive [Fe/H]<-6.1 from
the Ca II resonance lines assuming [Ca/Fe]>0.40. The chemical abundance pattern
of J0023+0307, with very low [Fe/Mg] and [Ca/Mg] abundance ratios, but
relatively high absolute Mg and Si abundances, suggests J0023+0307 is a second
generation star formed from a molecular cloud polluted by only one supernova in
which the fall-back mechanism played a role. We measure a carbon abundance of
A(C)=6.2 that places J0023+0307 on the low band in the A(C)-[Fe/H] diagram,
suggesting no contamination from a binary companion. This star is also unique
having a lithium abundance (A(Li)=2.02+-0.08) close to the level of the Lithium
Plateau, in contrast with lower Li determinations or upper limits in all other
extremely iron-poor stars. The upper envelope of the lithium abundances in
unevolved stars spanning more than three orders of magnitude in metallicity
(-6<[Fe/H]<-2.5) defines a nearly constant value. We argue that it is unlikely
that such uniformity is the result of depletion processes in stars from a
significantly higher initial Li abundance, but suggests instead a lower
primordial production, pointing to new physics such as decaying massive
particles, varying fundamental constants, or nuclear resonances, that could
have affected the primordial 7Li production.
","[{""version"":""v1"",""created"":""Tue, 9 Apr 2019 20:12:40 GMT""}]","2019-04-17"
"1904.04893","Luca Volpe","S. Malko, X.Vaisseau, F.Perez, D. Batani, A. Curcio, M. Ehret, J.J.
  Honrubia, K. Jakubowska, A. Morace, J.J. Santos, and L.Volpe","Enhanced relativistic-electron beam collimation using two consecutive
  laser pulses",,,"10.1038/s41598-019-50401-y",,"physics.plasm-ph","http://arxiv.org/licenses/nonexclusive-distrib/1.0/","  The double laser pulse approach to relativistic electron beam (REB)
collimation has been investigated at the LULI-ELFIE facility. In this scheme,
the magnetic field generated by the first laser-driven REB is used to guide a
second delayed REB. We show how electron beam collimation can be controlled by
properly adjusting laser parameters. By changing the ratio of focus size and
the delay time between the two pulses we found a maximum of electron beam
collimation clearly dependent on the focal spot size ratio of the two laser
pulses and related to the magnetic field dynamics. Cu-K alpha and CTR imaging
diagnostics were implemented to evaluate the collimation effects on the
respectively low energy (< 100 keV) and high energy (> MeV) components of the
REB.
","[{""version"":""v1"",""created"":""Tue, 9 Apr 2019 20:26:42 GMT""}]","2022-11-22"
"1904.04894","Yasutada Oohama","Yasutada Oohama","New Converse Bounds for Discrete Memoryless Channels in the Finite
  Blocklength Regime","10 pages, no figures, the short version was submitted to ITW2019",,,,"cs.IT math.IT","http://arxiv.org/licenses/nonexclusive-distrib/1.0/","  We study the determination problem of the channel capacity for the discrete
memoryless channels in the finite blocklength regime. We derive explicit lower
and upper bounds of the capacity. We shall demonstrate that the information
spectrum approach is quite useful for investigating this problem.
","[{""version"":""v1"",""created"":""Tue, 9 Apr 2019 20:32:19 GMT""}]","2019-04-11"
"1904.04895","Brian Powell","Brian A. Powell","Malicious Overtones: hunting data theft in the frequency domain with
  one-class learning","34 pages, 15 figures. Version submitted to ACM TOPS","ACM Transactions on Privacy and Security (TOPS) Volume 22 Issue 4,
  October 2019","10.1145/3360469",,"cs.CR","http://arxiv.org/licenses/nonexclusive-distrib/1.0/","  A method for detecting electronic data theft from computer networks is
described, capable of recognizing patterns of remote exfiltration occurring
over days to weeks. Normal traffic flow data, in the form of a host's ingress
and egress bytes over time, is used to train an ensemble of one-class learners.
The detection ensemble is modular, with individual classifiers trained on
different traffic features thought to characterize malicious data transfers. We
select features that model the egress to ingress byte balance over time,
periodicity, short time-scale irregularity, and density of the traffic. The
features are most efficiently modeled in the frequency domain, which has the
added benefit that variable duration flows are transformed to a fixed-size
feature vector, and by sampling the frequency space appropriately,
long-duration flows can be tested. When trained on days- or weeks-worth of
traffic from individual hosts, our ensemble achieves a low false positive rate
(<2%) on a range of different system types. Simulated exfiltration samples with
a variety of different timing and data characteristics were generated and used
to test ensemble performance on different kinds of systems: when trained on a
client workstation's external traffic, the ensemble was generally successful at
detecting exfiltration that is not simultaneously ingress-heavy,
connection-sparse, and of short duration---a combination that is not optimal
for attackers seeking to transfer large amounts of data. Remote exfiltration is
more difficult to detect from egress-heavy systems, like web servers, with
normal traffic exhibiting timing characteristics similar to a wide range of
exfiltration types.
","[{""version"":""v1"",""created"":""Tue, 9 Apr 2019 20:33:38 GMT""}]","2019-11-15"
"1904.04896","Ruizhi Li","Ruizhi Li, Gregory Sell, Hynek Hermansky","Performance Monitoring for End-to-End Speech Recognition","Submitted to Interspeech 2019",,,,"cs.CL","http://arxiv.org/licenses/nonexclusive-distrib/1.0/","  Measuring performance of an automatic speech recognition (ASR) system without
ground-truth could be beneficial in many scenarios, especially with data from
unseen domains, where performance can be highly inconsistent. In conventional
ASR systems, several performance monitoring (PM) techniques have been
well-developed to monitor performance by looking at tri-phone posteriors or
pre-softmax activations from neural network acoustic modeling. However,
strategies for monitoring more recently developed end-to-end ASR systems have
not yet been explored, and so that is the focus of this paper. We adapt
previous PM measures (Entropy, M-measure and Auto-encoder) and apply our
proposed RNN predictor in the end-to-end setting. These measures utilize the
decoder output layer and attention probability vectors, and their predictive
power is measured with simple linear models. Our findings suggest that
decoder-level features are more feasible and informative than attention-level
probabilities for PM measures, and that M-measure on the decoder posteriors
achieves the best overall predictive performance with an average prediction
error 8.8%. Entropy measures and RNN-based prediction also show competitive
predictability, especially for unseen conditions.
","[{""version"":""v1"",""created"":""Tue, 9 Apr 2019 20:35:25 GMT""}]","2019-04-11"
"1904.04897","Cleber F. Colle","Cleber F. Colle and Eduardo Garibaldi","An Alphabetical Approach to Nivat's Conjecture",,,"10.1088/1361-6544/ab7638",,"math.DS","http://arxiv.org/licenses/nonexclusive-distrib/1.0/","  Since techniques used to address the Nivat's conjecture usually relies on
Morse-Hedlund Theorem, an improved version of this classical result may mean a
new step towards a proof for the conjecture. In this paper, considering an
alphabetical version of the Morse-Hedlund Theorem, we show that, for a
configuration $\eta \in A^{\mathbb{Z}^2}$ that contains all letters of a given
finite alphabet $A$, if its complexity with respect to a quasi-regular set
$\mathcal{S} \subset \mathbb{Z}^2$ (a finite set whose convex hull on
$\mathbb{R}^2$ is described by pairs of edges with identical size) is bounded
from above by $\frac{1}{2}|\mathcal{S}|+|A|-1$, then $\eta$ is periodic.
","[{""version"":""v1"",""created"":""Tue, 9 Apr 2019 20:36:54 GMT""}]","2020-06-24"
"1904.04898","Martin Lanzend\""orfer","M. Lanzend\""orfer and J. Hron","On multiple solutions to the steady flow of incompressible fluids
  subject to do-nothing or constant traction boundary conditions on artificial
  boundaries","15 pages","Journal of Mathematical Fluid Mechanics 22(11), 2020","10.1007/s00021-019-0472-z",,"physics.flu-dyn cs.NA math.NA","http://arxiv.org/licenses/nonexclusive-distrib/1.0/","  The boundary conditions prescribing the constant traction or the so-called
do-nothing conditions are frequently taken on artificial boundaries in the
numerical simulations of steady flow of incompressible fluids, despite the fact
that they do not facilitate a well-posed problem, not allowing to establish the
standard energy estimates. In a pursuit to understand better the possible
consequences of using these conditions, we present a particular set of examples
of flow problems, where we find none or two analytical or numerical solutions.
Namely, we consider problems where the flow connects two such artificial
boundaries. In the simple case of the isotropic radial flows where both steady
and unsteady analytical solutions are derived easily, we demonstrate that while
for some (large) boundary data all unsteady solutions blow up in finite time,
for other data (including small or trivial) the unsteady flows either converge
asymptotically to one of two steady solutions, or blow up in finite time,
depending on the initial state. We then document the very same behavior of the
numerical solutions for planar flow in a diverging channel. Finally, we provide
an illustrative example of two steady numerical solutions to the flow in a
three-dimensional bifurcating tube, where the inflow velocity is prescribed at
the inlet, while the two outlets are treated by the do-nothing boundary
condition.
","[{""version"":""v1"",""created"":""Tue, 9 Apr 2019 20:37:53 GMT""},{""version"":""v2"",""created"":""Mon, 24 Feb 2020 11:45:25 GMT""}]","2020-02-25"
"1904.04899","Sean Bearden","Sean R. B. Bearden, Forrest C. Sheldon, Massimiliano Di Ventra","Critical branching processes in digital memcomputing machines","5 pages, 3 figures","EPL (Europhysics Letters), Volume 127, Number 3 2019","10.1209/0295-5075/127/30005",,"cond-mat.stat-mech cs.ET","http://arxiv.org/licenses/nonexclusive-distrib/1.0/","  Memcomputing is a novel computing paradigm that employs time non-locality
(memory) to solve combinatorial optimization problems. It can be realized in
practice by means of non-linear dynamical systems whose point attractors
represent the solutions of the original problem. It has been previously shown
that during the solution search digital memcomputing machines go through a
transient phase of avalanches (instantons) that promote dynamical long-range
order. By employing mean-field arguments we predict that the distribution of
the avalanche sizes follows a Borel distribution typical of critical branching
processes with exponent $\tau= 3/2$. We corroborate this analysis by solving
various random 3-SAT instances of the Boolean satisfiability problem. The
numerical results indicate a power-law distribution with exponent $\tau = 1.51
\pm 0.02$, in very good agreement with the mean-field analysis. This indicates
that memcomputing machines self-tune to a critical state in which avalanches
are characterized by a branching process, and that this state persists across
the majority of their evolution.
","[{""version"":""v1"",""created"":""Tue, 9 Apr 2019 20:38:32 GMT""},{""version"":""v2"",""created"":""Tue, 22 Oct 2019 19:54:17 GMT""}]","2020-01-08"
"1904.04900","Lucia Santamaria","Luc\'ia Santamar\'ia, Amittai Axelrod","Data Selection with Cluster-Based Language Difference Models and Cynical
  Selection","9 pages, 7 figures, IWSLT 2017","Proceedings of the International Workshop on Spoken Language
  Translation (IWSLT) 2017",,,"cs.CL","http://arxiv.org/licenses/nonexclusive-distrib/1.0/","  We present and apply two methods for addressing the problem of selecting
relevant training data out of a general pool for use in tasks such as machine
translation. Building on existing work on class-based language difference
models, we first introduce a cluster-based method that uses Brown clusters to
condense the vocabulary of the corpora. Secondly, we implement the cynical data
selection method, which incrementally constructs a training corpus to
efficiently model the task corpus. Both the cluster-based and the cynical data
selection approaches are used for the first time within a machine translation
system, and we perform a head-to-head comparison. Our intrinsic evaluations
show that both new methods outperform the standard Moore-Lewis approach
(cross-entropy difference), in terms of better perplexity and OOV rates on
in-domain data. The cynical approach converges much quicker, covering nearly
all of the in-domain vocabulary with 84% less data than the other methods.
Furthermore, the new approaches can be used to select machine translation
training data for training better systems. Our results confirm that class-based
selection using Brown clusters is a viable alternative to POS-based class-based
methods, and removes the reliance on a part-of-speech tagger. Additionally, we
are able to validate the recently proposed cynical data selection method,
showing that its performance in SMT models surpasses that of traditional
cross-entropy difference methods and more closely matches the sentence length
of the task corpus.
","[{""version"":""v1"",""created"":""Tue, 9 Apr 2019 20:39:07 GMT""}]","2019-04-11"
"1904.04902","Bena Tshishiku","Bena Tshishiku","Borel's stable range for the cohomology of arithmetic groups","Comments welcome",,,,"math.GR math.NT","http://arxiv.org/licenses/nonexclusive-distrib/1.0/","  In this note, we remark on the range in Borel's theorem on the stable
cohomology of the arithmetic groups Sp(2n,Z) and SO(n,n;Z). This improves the
range stated in Borel's original papers, an improvement that was known to
Borel. Our main task is a technical computation involving the Weyl group action
on roots and weights. This note originally appeared as the appendix to
arXiv:1711.03139.
","[{""version"":""v1"",""created"":""Tue, 9 Apr 2019 20:45:08 GMT""}]","2019-04-11"
"1904.04903","Olivia Dumitrescu","Olivia Dumitrescu and Motohico Mulase","Mirror curve of orbifold Hurwitz numbers","This preprint has 16 pages and 20 figures. This preprint together
  with arxiv: 1508.05922v3 (Journal of Algebra, vol. 494, January 2018)
  replaces arxiv:1508.05922v2. Grant acknowledgement added",,,,"math.AG math.CO","http://arxiv.org/licenses/nonexclusive-distrib/1.0/","  Edge-contraction operations form an effective tool in various graph
enumeration problems, such as counting Grothendieck's dessins d'enfants and
simple and double Hurwitz numbers. These counting problems can be solved by a
mechanism known as topological recursion, which is a mirror B-model
corresponding to these counting problems. We show that for the case of orbifold
Hurwitz numbers, the mirror objects, i.e., the spectral curve and the
differential forms on it, are constructed solely from the edge-contraction
operations of the counting problem in genus $0$ and one marked point. This
forms a parallelism with Gromov-Witten theory, where genus 0 Gromov-Witten
invariants correspond to mirror B-model holomorphic geometry.
","[{""version"":""v1"",""created"":""Tue, 9 Apr 2019 20:46:09 GMT""},{""version"":""v2"",""created"":""Wed, 14 Aug 2019 18:53:42 GMT""}]","2019-08-16"
"1904.04904","Miruna-Stefana Sorea","Miruna-Stefana Sorea","Constructing Separable Arnold Snakes of Morse Polynomials","35 pages, 32 figures","Portugaliae Mathematica Volume 77, Issue 2, 2020, pp. 219-260","10.4171/PM/2050",,"math.AG math.CO","http://arxiv.org/licenses/nonexclusive-distrib/1.0/","  We give a new and constructive proof of the existence of a special class of
univariate polynomials whose graphs have preassigned shapes. By definition, all
the critical points of a Morse polynomial function are real and distinct and
all its critical values are distinct. Thus we can associate to it an
alternating permutation: the so-called Arnold snake, given by the relative
positions of its critical values. We realise any separable alternating
permutation as the Arnold snake of a Morse polynomial.
","[{""version"":""v1"",""created"":""Tue, 9 Apr 2019 20:51:40 GMT""}]","2021-04-06"
"1904.04905","Kirill Atapin","K. Atapin, S. Fabrika and M. D. Caballero-Garcia","Ultraluminous X-ray sources with flat-topped noise and QPO","15 pages, 7 figures, accepted for publication in MNRAS",,"10.1093/mnras/stz1027",,"astro-ph.HE","http://arxiv.org/licenses/nonexclusive-distrib/1.0/","  We analyzed the X-ray power density spectra of five ultraluminous X-ray
sources (ULXs) NGC5408 X-1, NGC6946 X-1, M82 X-1, NGC1313 X-1 and IC342 X-1
that are the only ULXs which display both flat-topped noise (FTN) and
quasi-periodic oscillations (QPO). We studied the QPO frequencies, fractional
root-mean-square (rms) variability, X-ray luminosity and spectral hardness. We
found that the level of FTN is anti-correlated with the QPO frequency. As the
frequency of the QPO and brightness of the sources increase, their fractional
variability decreases. We propose a simple interpretation using the
spherizarion radius, viscosity time and $\alpha$-parameter as basic properties
of these systems. The main physical driver of the observed variability is the
mass accretion rate which varies >3 between different observations of the same
source. As the accretion rate decreases the spherization radius reduces and the
FTN plus the QPO move toward higher frequencies resulting in a decrease of the
fractional rms variability. We also propose that in all ULXs when the accretion
rate is low enough (but still super-Eddington) the QPO and FTN disappear.
Assuming that the maximum X-ray luminosity depends only on the black hole (BH)
mass and not on the accretion rate (not considering the effects of either the
inclination of the super-Eddington disc nor geometrical beaming of radiation)
we estimate that all the ULXs have about similar BH masses, with the exception
of M82 X-1, which might be 10 times more massive.
","[{""version"":""v1"",""created"":""Tue, 9 Apr 2019 20:52:10 GMT""}]","2019-04-24"
"1904.04906","Rodrigo Hern\'andez Guti\'errez","Rodrigo Hern\'andez-Guti\'errez","Countable dense homogeneity of function spaces",,"Top. Proc. 56 (2020) pp. 125-146",,,"math.GN","http://arxiv.org/licenses/nonexclusive-distrib/1.0/","  In this paper we consider the question of when the space $C_p(X)$ of
continuous real-valued functions on $X$ with the pointwise convergence topology
is countable dense homogeneous. In particular, we focus on the case when $X$ is
countable with a unique non-isolated point $\infty$. In this case, $C_p(X)$ is
countable dense homogeneous if and only if the filter of open neighborhoods of
$\infty$ is a non-meager $P$-filter.
","[{""version"":""v1"",""created"":""Tue, 9 Apr 2019 20:52:32 GMT""},{""version"":""v2"",""created"":""Tue, 14 Jul 2020 16:09:24 GMT""}]","2022-01-19"
