"1904.04752","Marcus Scheele","Krishan Kumar, Quan Liu, Jonas Hiller, Christine Schedel, Alfred
  Meixner, Kai Braun, Jannika Lauth and Marcus Scheele","A Dye-Sensitized CdSe Nanocrystal Optical Transistor with High ON/OFF
  Ratio in the First Telecom Window with 74 ns Rise Time","40 pages, 11 Figures",,,,"cond-mat.mtrl-sci","http://arxiv.org/licenses/nonexclusive-distrib/1.0/","  We report an optically gated transistor composed of CdSe nanocrystals (NCs),
sensitized with the dye Zinc beta-tetraaminophthalocyanine for operation in the
first telecom window. This device shows a high ON/OFF ratio of six orders of
magnitude in the red spectral region and an unprecedented 4.5 orders of
magnitude at 847 nm. By transient absorption spectroscopy, we reveal that this
unexpected infrared sensitivity is due to electron transfer from the dye to the
CdSe NCs within 5 ps. We show by time-resolved photocurrent measurements that
this enables fast rise times during near-infrared optical gating of 74 ns.
Electronic coupling and accelerated non-radiative recombination of charge
carriers at the interface between the dye and the CdSe NCs are further
corroborated by steady-state and time-resolved photoluminescence measurements.
Field-effect transistor measurements indicate that the increase in photocurrent
upon laser illumination is mainly due to the increase in carrier concentration
while the mobility remains unchanged. Our results illustrate that organic dyes
as ligands for NCs invoke new optoelectronic functionalities, such as fast
optical gating at sub-bandgap optical excitation energies.
","[{""version"":""v1"",""created"":""Tue, 9 Apr 2019 16:01:33 GMT""},{""version"":""v2"",""created"":""Fri, 30 Aug 2019 11:46:27 GMT""}]","2019-09-02"
"1904.04753","Lakshmi Natarajan Dr","Smiju Kodamthuruthil Joy and Lakshmi Natarajan","Index Codes with Minimum Locality for Three Receiver Unicast Problems","Keywords: index coding, locality, unicast. 7 pages, 5 figures",,,,"cs.IT math.IT","http://arxiv.org/licenses/nonexclusive-distrib/1.0/","  An index code for a broadcast channel with receiver side information is
'locally decodable' if every receiver can decode its demand using only a subset
of the codeword symbols transmitted by the sender instead of observing the
entire codeword. Local decodability in index coding improves the error
performance when used in wireless broadcast channels, reduces the receiver
complexity and improves privacy in index coding. The 'locality' of an index
code is the ratio of the number of codeword symbols used by each receiver to
the number message symbols demanded by the receiver. Prior work on locality in
index coding have considered only single unicast and single-uniprior problems,
and the optimal trade-off between broadcast rate and locality is known only for
a few cases. In this paper we identify the optimal broadcast rate (including
among non-linear codes) for all three receiver unicast problems when the
locality is equal to the minimum possible value, i.e., equal to one. The index
code that achieves this optimal rate is based on a clique covering technique
and is well known. The main contribution of this paper is in providing tight
converse results by relating locality to broadcast rate, and showing that this
known index coding scheme is optimal when locality is equal to one. Towards
this we derive several structural properties of the side information graphs of
three receiver unicast problems, and combine them with information theoretic
arguments to arrive at a converse.
","[{""version"":""v1"",""created"":""Tue, 9 Apr 2019 16:03:09 GMT""}]","2019-04-10"
"1904.04754","Enrique Fernandez-Blanco","Enrique Fernandez-Blanco, Daniel Rivero, Marcos Gestal, Carlos
  Fernandez-Lozano, Norberto Ezquerra, Cristian R. Munteanu, Julian Dorado","A Hybrid Evolutionary System for Automated Artificial Neural Networks
  Generation and Simplification in Biomedical Applications","48 pages, 9 figures, 17 tables","Current Bioinformatics, Volume 10, Number 5, 2015, pp. 672-691(20)","10.2174/1574893610666151008012923",,"cs.LG cs.NE","http://arxiv.org/licenses/nonexclusive-distrib/1.0/","  Data mining and data classification over biomedical data are two of the most
important research fields in computer science. Among the great diversity of
techniques that can be used for this purpose, Artifical Neural Networks (ANNs)
is one of the most suited. One of the main problems in the development of this
technique is the slow performance of the full process. Traditionally, in this
development process, human experts are needed to experiment with different
architectural procedures until they find the one that presents the correct
results for solving a specific problem. However, many studies have emerged in
which different ANN developmental techniques, more or less automated, are
described. In this paper, the authors have focused on developing a new
technique to perform this process over biomedical data. The new technique is
described in which two Evolutionary Computation (EC) techniques are mixed to
automatically develop ANNs. These techniques are Genetic Algorithms and Genetic
Programming. The work goes further, and the system described here allows to
obtain simplified networks with a low number of neurons to resolve the
problems. The system is compared with the already existent system which also
uses EC over a set of well-known problems. The conclusions reached from these
comparisons indicate that this new system produces very good results, which in
the worst case are at least comparable to existing techniques and in many cases
are substantially better.
","[{""version"":""v1"",""created"":""Tue, 9 Apr 2019 16:07:48 GMT""}]","2019-04-10"
"1904.04755","Satyen Kale","Dylan J. Foster and Spencer Greenberg and Satyen Kale and Haipeng Luo
  and Mehryar Mohri and Karthik Sridharan","Hypothesis Set Stability and Generalization","Published in NeurIPS 2019. This version is equivalent to the
  camera-ready version but also includes the supplementary material",,,,"cs.LG stat.ML","http://arxiv.org/licenses/nonexclusive-distrib/1.0/","  We present a study of generalization for data-dependent hypothesis sets. We
give a general learning guarantee for data-dependent hypothesis sets based on a
notion of transductive Rademacher complexity. Our main result is a
generalization bound for data-dependent hypothesis sets expressed in terms of a
notion of hypothesis set stability and a notion of Rademacher complexity for
data-dependent hypothesis sets that we introduce. This bound admits as special
cases both standard Rademacher complexity bounds and algorithm-dependent
uniform stability bounds. We also illustrate the use of these learning bounds
in the analysis of several scenarios.
","[{""version"":""v1"",""created"":""Tue, 9 Apr 2019 16:08:25 GMT""},{""version"":""v2"",""created"":""Wed, 17 Apr 2019 02:46:07 GMT""},{""version"":""v3"",""created"":""Mon, 5 Oct 2020 14:38:37 GMT""}]","2020-10-06"
"1904.04756","Marco Rehmeier","Marco Rehmeier","Existence of flows for linear Fokker-Planck-Kolmogorov equations and its
  connection to well-posedness",,,,,"math.PR","http://arxiv.org/licenses/nonexclusive-distrib/1.0/","  Let the coefficients $a_{ij}$ and $b_i$, $i,j \leq d$, of the linear
Fokker-Planck-Kolmogorov equation (FPK-eq.)
  $$\partial_t\mu_t = \partial_i\partial_j(a_{ij}\mu_t)-\partial_i(b_i\mu_t)$$
be Borel measurable, bounded and continuous in space. Assume that for every $s
\in [0,T]$ and every Borel probability measure $\nu$ on $\mathbb{R}^d$ there is
at least one solution $\mu = (\mu_t)_{t \in [s,T]}$ to the FPK-eq. such that
$\mu_s = \nu$ and $t \mapsto \mu_t$ is continuous w.r.t. the topology of weak
convergence of measures. We prove that in this situation, one can always select
one solution $\mu^{s,\nu}$ for each pair $(s,\nu)$ such that this family of
solutions fulfills
  $$\mu^{s,\nu}_t = \mu^{r,\mu^{s,\nu}_r}_t \text{ for all }0 \leq s \leq r
\leq t \leq T,$$which one interprets as a flow property of this solution
family. Moreover, we prove that such a flow of solutions is unqiue if and only
if the FPK-eq. is well-posed.
","[{""version"":""v1"",""created"":""Tue, 9 Apr 2019 16:09:03 GMT""}]","2019-04-10"
"1904.04757","Sne\v{z}ana \v{Z}ivkovi\'c-Zlatanovi\'c \v{C}","Sne\v{z}ana \v{C}. \v{Z}ivkovi\'c-Zlatanovi\'c, Bhagwati P. Duggal","Generalized Drazin-meromorphic invertible operators and generalized
  Kato-meromorphic decomposition",,,,,"math.SP math.FA","http://arxiv.org/licenses/nonexclusive-distrib/1.0/","  A bounded linear operator $T$ on a Banach space $X$ is said to be generalized
Drazin-meromorphic invertible if there exists a bounded linear operator $S$
acting on $X$ such that $TS=ST$, $STS=S$, $ TST-T$ is meromorphic. We shall say
that $T$ admits a generalized Kato-meromorphic decomposition if there exists a
pair of $T$-invariant closed subspaces $(M,N)$ such that $X=M\oplus N$, the
reduction $T_M$ is Kato and the reduction $T_N$ is meromorphic. In this paper
we shall investigate such kind of operators and corresponding spectra, the
generalized Drazin-meromorphic spectrum and the generalized Kato-meromorphic
spectrum, and prove that these spectra are empty if and only if the operator
$T$ is polynomially meromorphic. Also we obtain that the generalized
Kato-meromorphic spectrum differs from the Kato type spectrum on at most
countably many points. Among others, bounded linear operators which can be
expressed as a direct sum of a meromorphic operator and a bounded below (resp.
surjective, upper (lower) semi-Fredholm, Fredholm, upper (lower) semi-Weyl,
Weyl) operator are studied. In particular, we shall characterize the
single-valued extension property at a point $\lambda_0\in\mathbb{C}$ in the
case that $\lambda_0-T$ admits a generalized Kato-meromorphic decomposition. As
a consequence we get several results on cluster points of some distinguished
parts of the spectrum.
","[{""version"":""v1"",""created"":""Tue, 9 Apr 2019 16:10:16 GMT""}]","2019-04-10"
"1904.04758","Michael Sammon","M. Sammon, Mitali Banerjee, B. I. Shklovskii","Giant violation of Wiedemann-Franz law in doping layers of modern AlGaAs
  heterostructures",,,,,"cond-mat.mes-hall","http://arxiv.org/licenses/nonexclusive-distrib/1.0/","  We analyze the data of the recent paper Nature 559, 205 (2018) and show that
it contains an observation of thermal and electric conductivities of the doping
layers in GaAs/AlGaAs heterostructures which violates the Wiedemann-Franz law.
Namely, the measured thermal conductivity of the doping layers is similar to
that of a metal while the electrical conductivity is exponentially small. We
find that these results may be related to the exciton contribution to thermal
conductivity calculated in several recent theoretical works for metallic
samples.
","[{""version"":""v1"",""created"":""Tue, 9 Apr 2019 16:11:34 GMT""},{""version"":""v2"",""created"":""Fri, 26 Apr 2019 15:25:12 GMT""}]","2019-04-29"
"1904.04759","Mikhail Hlushchanka","Mikhail Hlushchanka","Tischler graphs of critically fixed rational maps and their applications",,,,,"math.DS","http://arxiv.org/licenses/nonexclusive-distrib/1.0/","  A rational map $f:\widehat{\mathbb{C}}\to\widehat{\mathbb{C}}$ on the Riemann
sphere $\widehat{\mathbb{C}}$ is called critically fixed if each critical point
of $f$ is fixed under $f$. In this article we study properties of a
combinatorial invariant, called Tischler graph, associated with such a map.
More precisely, we show that the Tischler graph of a critically fixed rational
map is always connected, establishing a conjecture made by Kevin Pilgrim. We
also discuss the relevance of this result for classical open problems in
holomorphic dynamics, such as combinatorial classification problem and global
curve attractor problem.
","[{""version"":""v1"",""created"":""Tue, 9 Apr 2019 16:15:12 GMT""}]","2019-04-10"
"1904.04760","Hongliang Jiang","Hongliang Jiang, Alessandro Sfondrini and Gabriele
  Tartaglino-Mazzucchelli","$T\bar{T}$ deformations with $\mathcal{N}=(0,2)$ supersymmetry",,"Phys. Rev. D 100, 046017 (2019)","10.1103/PhysRevD.100.046017",,"hep-th","http://arxiv.org/licenses/nonexclusive-distrib/1.0/","  We investigate the behaviour of two-dimensional quantum field theories with
$\mathcal{N}=(0,2)$ supersymmetry under a deformation induced by the
`$T\bar{T}$' composite operator. We show that the deforming operator can be
defined by a point-splitting regularisation in such a way as to preserve
$\mathcal{N}=(0,2)$ supersymmetry. As an example of this construction, we work
out the deformation of a free $\mathcal{N}=(0,2)$ theory and compare to that
induced by the Noether stress-energy tensor. Finally, we show that the
$\mathcal{N}=(0,2)$ supersymmetric deformed action actually possesses
$\mathcal{N}=(2,2)$ symmetry, half of which is non-linearly realised.
","[{""version"":""v1"",""created"":""Tue, 9 Apr 2019 16:15:26 GMT""},{""version"":""v2"",""created"":""Thu, 9 May 2019 16:41:00 GMT""},{""version"":""v3"",""created"":""Sat, 14 Dec 2019 13:14:23 GMT""}]","2019-12-17"
"1904.04761","Alexander Jordan","Alexander I. Jordan, Anja M\""uhlemann, Johanna F. Ziegel","Optimal solutions to the isotonic regression problem",,,,,"math.ST stat.TH","http://arxiv.org/licenses/nonexclusive-distrib/1.0/","  In general, the solution to a regression problem is the minimizer of a given
loss criterion, and depends on the specified loss function. The nonparametric
isotonic regression problem is special, in that optimal solutions can be found
by solely specifying a functional. These solutions will then be minimizers
under all loss functions simultaneously as long as the loss functions have the
requested functional as the Bayes act. For the functional, the only requirement
is that it can be defined via an identification function, with examples
including the expectation, quantile, and expectile functionals. Generalizing
classical results, we characterize the optimal solutions to the isotonic
regression problem for such functionals, and extend the results from the case
of totally ordered explanatory variables to partial orders. For total orders,
we show that any solution resulting from the pool-adjacent-violators algorithm
is optimal. It is noteworthy, that simultaneous optimality is unattainable in
the unimodal regression problem, despite its close connection.
","[{""version"":""v1"",""created"":""Tue, 9 Apr 2019 16:15:26 GMT""},{""version"":""v2"",""created"":""Tue, 5 May 2020 14:02:14 GMT""}]","2020-05-06"
"1904.04762","Bhairav Mehta","Bhairav Mehta, Manfred Diaz, Florian Golemo, Christopher J. Pal, Liam
  Paull","Active Domain Randomization","Code available at
  https://github.com/montrealrobotics/active-domainrand",,,,"cs.LG cs.AI cs.RO","http://arxiv.org/licenses/nonexclusive-distrib/1.0/","  Domain randomization is a popular technique for improving domain transfer,
often used in a zero-shot setting when the target domain is unknown or cannot
easily be used for training. In this work, we empirically examine the effects
of domain randomization on agent generalization. Our experiments show that
domain randomization may lead to suboptimal, high-variance policies, which we
attribute to the uniform sampling of environment parameters. We propose Active
Domain Randomization, a novel algorithm that learns a parameter sampling
strategy. Our method looks for the most informative environment variations
within the given randomization ranges by leveraging the discrepancies of policy
rollouts in randomized and reference environment instances. We find that
training more frequently on these instances leads to better overall agent
generalization. Our experiments across various physics-based simulated and
real-robot tasks show that this enhancement leads to more robust, consistent
policies.
","[{""version"":""v1"",""created"":""Tue, 9 Apr 2019 16:15:39 GMT""},{""version"":""v2"",""created"":""Wed, 10 Jul 2019 20:20:10 GMT""}]","2019-07-12"
"1904.04763","Benjamin Audoux","Benjamin Audoux and Jean-Baptiste Meilhan","Characterization of the reduced peripheral system of links","12 pages ; v2:names and surnames of the authors have been put in the
  right order, v3:an alternative proof for Lemma 1.16 has been given, v4:minor
  stylistic changes",,,,"math.GT","http://arxiv.org/licenses/nonexclusive-distrib/1.0/","  The reduced peripheral system was introduced by Milnor in the fifties for the
study of links up to link-homotopy, i.e. up to isotopies and crossing changes
within each link component. However, for four or more components, this
invariant does not yield a complete link-homotopy invariant. This paper
provides two characterizations of links having the same reduced peripheral
system: a diagrammatical one, in terms of link diagrams, seen as welded
diagrams up to self-virtualization, and a topological one, in terms of ribbon
solid tori in 4--space up to ribbon link-homotopy.
","[{""version"":""v1"",""created"":""Tue, 9 Apr 2019 16:20:03 GMT""},{""version"":""v2"",""created"":""Wed, 10 Apr 2019 05:54:31 GMT""},{""version"":""v3"",""created"":""Mon, 27 May 2019 14:04:03 GMT""},{""version"":""v4"",""created"":""Wed, 5 Feb 2020 10:46:22 GMT""}]","2020-02-06"
"1904.04764","Haohan Guo","Haohan Guo, Frank K. Soong, Lei He, Lei Xie","Exploiting Syntactic Features in a Parsed Tree to Improve End-to-End TTS","Submitted to Interspeech 2019, Graz, Austria",,,,"cs.CL cs.AI cs.LG cs.SD","http://arxiv.org/licenses/nonexclusive-distrib/1.0/","  The end-to-end TTS, which can predict speech directly from a given sequence
of graphemes or phonemes, has shown improved performance over the conventional
TTS. However, its predicting capability is still limited by the
acoustic/phonetic coverage of the training data, usually constrained by the
training set size. To further improve the TTS quality in pronunciation, prosody
and perceived naturalness, we propose to exploit the information embedded in a
syntactically parsed tree where the inter-phrase/word information of a sentence
is organized in a multilevel tree structure. Specifically, two key features:
phrase structure and relations between adjacent words are investigated.
Experimental results in subjective listening, measured on three test sets, show
that the proposed approach is effective to improve the pronunciation clarity,
prosody and naturalness of the synthesized speech of the baseline system.
","[{""version"":""v1"",""created"":""Tue, 9 Apr 2019 16:20:52 GMT""}]","2019-04-10"
"1904.04765","Song Fang","Song Fang, Mikael Skoglund, Karl Henrik Johansson, Hideaki Ishii,
  Quanyan Zhu","Generic Variance Bounds on Estimation and Prediction Errors in Time
  Series Analysis: An Entropy Perspective",,,,,"cs.IT cs.LG eess.SP math.IT math.ST stat.ML stat.TH","http://arxiv.org/licenses/nonexclusive-distrib/1.0/","  In this paper, we obtain generic bounds on the variances of estimation and
prediction errors in time series analysis via an information-theoretic
approach. It is seen in general that the error bounds are determined by the
conditional entropy of the data point to be estimated or predicted given the
side information or past observations. Additionally, we discover that in order
to achieve the prediction error bounds asymptotically, the necessary and
sufficient condition is that the ""innovation"" is asymptotically white Gaussian.
When restricted to Gaussian processes and 1-step prediction, our bounds are
shown to reduce to the Kolmogorov-Szeg\""o formula and Wiener-Masani formula
known from linear prediction theory.
","[{""version"":""v1"",""created"":""Tue, 9 Apr 2019 16:22:14 GMT""},{""version"":""v2"",""created"":""Mon, 15 Apr 2019 09:17:02 GMT""},{""version"":""v3"",""created"":""Tue, 3 Sep 2019 15:57:47 GMT""},{""version"":""v4"",""created"":""Fri, 11 Oct 2019 23:12:57 GMT""},{""version"":""v5"",""created"":""Tue, 11 May 2021 14:48:31 GMT""}]","2021-05-12"
"1904.04766","Akimi Watanabe","Shinya Sasa, Akimi Watanabe and Yutaka Matsuo","A note on S-dual basis in free fermion system","30 pages, 4 figures; typos corrected, references added","Prog Theor Exp Phys (2020)","10.1093/ptep/ptz158","UT-19-05","hep-th math-ph math.MP math.QA","http://arxiv.org/licenses/nonexclusive-distrib/1.0/","  Free fermion system is the simplest quantum field theory which has the
symmetry of Ding-Iohara-Miki algebra (DIM). DIM has S-duality symmetry, known
as Miki automorphism which defines the transformation of generators. In this
note, we introduce the second set of the fermionic basis (S-dual basis) which
implement the duality transformation. It may be interpreted as the Fourier dual
of the standard basis, and the inner product between the standard and the
S-dual ones is proportional to the Hopf link invariant. We also rewrite the
general topological vertex in the form of Awata-Feigin-Shiraishi intertwiner
and show that it becomes more symmetric for the duality transformation.
","[{""version"":""v1"",""created"":""Tue, 9 Apr 2019 16:23:06 GMT""},{""version"":""v2"",""created"":""Tue, 26 Nov 2019 05:15:14 GMT""}]","2020-02-12"
"1904.04767","Maxwell Henderson","Maxwell Henderson, Samriddhi Shakya, Shashindra Pradhan, and Tristan
  Cook","Quanvolutional Neural Networks: Powering Image Recognition with Quantum
  Circuits","7 pages, 3 figures",,,,"quant-ph cs.ET","http://arxiv.org/licenses/nonexclusive-distrib/1.0/","  Convolutional neural networks (CNNs) have rapidly risen in popularity for
many machine learning applications, particularly in the field of image
recognition. Much of the benefit generated from these networks comes from their
ability to extract features from the data in a hierarchical manner. These
features are extracted using various transformational layers, notably the
convolutional layer which gives the model its name. In this work, we introduce
a new type of transformational layer called a quantum convolution, or
quanvolutional layer. Quanvolutional layers operate on input data by locally
transforming the data using a number of random quantum circuits, in a way that
is similar to the transformations performed by random convolutional filter
layers. Provided these quantum transformations produce meaningful features for
classification purposes, then the overall algorithm could be quite useful for
near term quantum computing, because it requires small quantum circuits with
little to no error correction. In this work, we empirically evaluated the
potential benefit of these quantum transformations by comparing three types of
models built on the MNIST dataset: CNNs, quantum convolutional neural networks
(QNNs), and CNNs with additional non-linearities introduced. Our results showed
that the QNN models had both higher test set accuracy as well as faster
training compared to the purely classical CNNs.
","[{""version"":""v1"",""created"":""Tue, 9 Apr 2019 16:25:48 GMT""}]","2019-04-10"
"1904.04768","Fritz Colonius","Fritz Colonius and Alexandre J. Santana and Jo\~ao A. N. Cossich","Bounds for Invariance Pressure","16 pages",,,,"math.OC math.DS","http://arxiv.org/licenses/nonexclusive-distrib/1.0/","  This paper provides an upper for the invariance pressure of control sets with
nonempty interior and a lower bound for sets with finite volume. In the special
case of the control set of a hyperbolic linear control system in R^{d} this
yields an explicit formula. Further applications to linear control systems on
Lie groups and to inner control sets are discussed.
","[{""version"":""v1"",""created"":""Tue, 9 Apr 2019 16:25:53 GMT""}]","2019-04-10"
"1904.04769","Julian Iseringhausen","Julian Iseringhausen and Michael Weinmann and Weizhen Huang and
  Matthias B. Hullin","Computational Parquetry: Fabricated Style Transfer with Wood Pixels",,,,,"cs.GR","http://arxiv.org/licenses/nonexclusive-distrib/1.0/","  Parquetry is the art and craft of decorating a surface with a pattern of
differently colored veneers of wood, stone or other materials. Traditionally,
the process of designing and making parquetry has been driven by color, using
the texture found in real wood only for stylization or as a decorative effect.
Here, we introduce a computational pipeline that draws from the rich natural
structure of strongly textured real-world veneers as a source of detail in
order to approximate a target image as faithfully as possible using a
manageable number of parts. This challenge is closely related to the
established problems of patch-based image synthesis and stylization in some
ways, but fundamentally different in others. Most importantly, the limited
availability of resources (any piece of wood can only be used once) turns the
relatively simple problem of finding the right piece for the target location
into the combinatorial problem of finding optimal parts while avoiding resource
collisions. We introduce an algorithm that allows to efficiently solve an
approximation to the problem. It further addresses challenges like gamut
mapping, feature characterization and the search for fabricable cuts. We
demonstrate the effectiveness of the system by fabricating a selection of
""photo-realistic"" pieces of parquetry from different kinds of unstained wood
veneer.
","[{""version"":""v1"",""created"":""Tue, 9 Apr 2019 16:26:19 GMT""},{""version"":""v2"",""created"":""Thu, 19 Dec 2019 13:01:46 GMT""}]","2019-12-20"
