"1904.05023","Charith Perera","Charith Perera, Mahmoud Barhamgi, Suparna De, Tim Baarslag, Massimo
  Vecchio, Kim-Kwang Raymond Choo","Designing Sensing as a Service (S2aaS) Ecosystem for Internet of Things",,"IEEE Internet of Things Magazine, 2019",,,"cs.NI cs.CY","http://arxiv.org/licenses/nonexclusive-distrib/1.0/","  The Internet of Things (IoT) envisions the creation of an environment where
everyday objects (e.g. microwaves, fridges, cars, coffee machines, etc.) are
connected to the internet and make users' lives more productive, efficient, and
convenient. During this process, everyday objects capture a vast amount of data
that can be used to understand individuals and their behaviours. In the current
IoT ecosystems, such data is collected and used only by the respective IoT
solutions. There is no formal way to share data with external entities. We
believe this is very efficient and unfair for users. We believe that users, as
data owners, should be able to control, manage, and share data about them in
any way that they choose and make or gain value out of them. To achieve this,
we proposed the Sensing as a Service (S2aaS) model. In this paper, we discuss
the Sensing as a Service ecosystem in terms of its architecture, components and
related user interaction designs. This paper aims to highlight the weaknesses
of the current IoT ecosystem and to explain how S2aaS would eliminate those
weaknesses. We also discuss how an everyday user may engage with the S2aaS
ecosystem and design challenges.
","[{""version"":""v1"",""created"":""Wed, 10 Apr 2019 06:51:16 GMT""}]","2019-04-11"
"1904.05024","Mohammad Nami","Fatemeh Torkamani, Farshad Nazaraghaie, Mohammad Nami","Geometric Meditation-Based Cognitive Behavioral Therapy in
  Obsessive-Compulsive Disorder: A Case Study",,,,,"q-bio.NC","http://arxiv.org/licenses/nonexclusive-distrib/1.0/","  Obsessive-Compulsive Disorder (OCD), characterized by unwanted and
distressing intrusive thoughts, images, urges, doubts and ideas or sensations
and repetitive mental or behavioral acts, which is regarded as an overwhelming
mental disorder. Over the past few years, several studies have indicated how
mindfulness-based interventions may be effectively used to remediate OCD
symptoms based on which such methods are endorsed as effective complementary or
alternative options to remediate OCD. The present pilot investigation assessed
the effectiveness of Geometric Meditation-based Cognitive Behavior Therapy
(GM-CBT) as a novel integrated approach to help OCD symptoms. Accordingly, an
eight-week treatment program (90 minute sessions per week) in a single case of
intractable OCD was found to result in a significant reduction in OCD symptoms,
anxiety and depression as well as increased mindfulness skills and subsequent
secondary outcomes. A three-month post treatment follow up suggested
long-lasting beneficial effects. Such a pilot model may receive further
endorsement as a holistic CBT approach for OCD.
","[{""version"":""v1"",""created"":""Wed, 10 Apr 2019 06:58:59 GMT""}]","2019-04-11"
"1904.05025","Vikhyaat Ahlawat","Vikhyaat Ahlawat, Shatruhan Singh Rajput and Shivprasad Patil","Elastic response of poly(ethylene glycol) polymer chains studied using
  dynamic atomic force microscopy","there is error in interpretation of data",,,,"cond-mat.soft physics.bio-ph","http://arxiv.org/licenses/nonexclusive-distrib/1.0/","  Stretching response of polymer chains under external force is crucial in
understanding polymer dynamics under equilibrium and non-equilibrium
conditions. Here we measure the elastic response of poly(ethylene glycol) using
a lock-in based amplitude modulation-AFM with sub-angstrom amplitude in both
low and high frequency regime. Appropriate analysis that takes into account the
cantilever geometry and hydrodynamic loading effects of oscillating cantilever
in liquid, relates X signal of lock-in amplifier linearly to
stiffness.Stiffness data extracted from X signal was compared with stiffness
from derivative of conventional ""static"" force extension curves. For stiffness
data from X signal, fitting to standard entropic model of WLC gives a
physically meaningful value of persistense length and also follows scaling
behaviour of WLC. Entropy dominated conformational transition with its
characteristic V-shaped signature was observed at arount 250 pN. Accurate
measurement of stiffness enabled us in understanding the thermodynamics of
conformational changes.
","[{""version"":""v1"",""created"":""Wed, 10 Apr 2019 06:59:47 GMT""},{""version"":""v2"",""created"":""Thu, 22 Oct 2020 14:14:01 GMT""}]","2020-10-23"
"1904.05026","Sabine Plancoulaine","Sabine Plancoulaine, Camille Stagnara, Sophie Flori, Flora
  Bat-Pitault, Jian-Sheng Lin, Hugues Patural (SNA-EPIS), Patricia Franco
  (CRNL)","Early features associated with the neurocognitive development at 36
  months of age: the AuBE study",,"Sleep Medicine, Elsevier, 2017, 30, pp.222-228","10.1016/j.sleep.2016.10.015",,"stat.AP q-bio.NC","http://arxiv.org/licenses/nonexclusive-distrib/1.0/","  Background. Few studies on the relations between sleep quantity and/or
quality and cognition were conducted among pre-schoolers from healthy general
population. We aimed at identifying, among 3 years old children, early factors
associated with intelligence quotient estimated through Weschler Preschool and
Primary Scale Intelligence-III test and its indicators: full-scale-, verbal-
and performance-intelligence quotients and their sub-scale scores. Methods. We
included 194 children from the French birth-cohort AuBE with both available
Weschler Preschool and Primary Scale Intelligence-III scores at 3y and sleep
data. Information was collected through self-questionnaires at birth, 6, 12, 18
and 24 months. A day/night sleep ratio was calculated. Results. Mean scores
were in normal ranges for verbal-, performance- and full-scale-intelligence
quotients. In multivariate models, being a $\ge$3 born-child and watching
television $\ge$1 hour/day at 24 months were negatively associated with all
intelligence quotient scores while collective care arrangement was positively
associated. Night waking at 6 and frequent snoring at 18 months were negatively
associated with performance intelligence quotient, some subscales and
full-scale-intelligence quotient contrary to day/night sleep ratio at 12
months. No association was observed between early sleep characteristics and
verbal intelligence quotient. Conclusion. We showed that early features
including infant sleep characteristics influence intelligence quotient scores
at 3 years old. Some of these may be accessible to prevention.
","[{""version"":""v1"",""created"":""Wed, 10 Apr 2019 07:01:47 GMT""}]","2019-04-11"
"1904.05027","Enrique Fernandez-Blanco","Daniel Rivero, Enrique Fernandez-Blanco, Julian Dorado, Alejandro
  Pazos","Classification of Two-channel Signals by Means of Genetic Programming","Conference paper, doble-column, 7 pages, 1 figure, 3 tables","Proceedings of Annual Conference on Genetic and Evolutionary
  Computation 2015 (GECCO'15), pp. 1319-1325","10.1145/2739482.2768507",,"cs.NE","http://arxiv.org/licenses/nonexclusive-distrib/1.0/","  Traditionally, signal classification is a process in which previous knowledge
of the signals is needed. Human experts decide which features are extracted
from the signals, and used as inputs to the classification system. This
requirement can make significant unknown information of the signal be missed by
the experts and not be included in the features. This paper proposes a new
method that automatically analyses the signals and extracts the features
without any human participation. Therefore, there is no need for previous
knowledge about the signals to be classified. The proposed method is based on
Genetic Programming and, in order to test this method, it has been applied to a
well-known EEG database related to epilepsy, a disease suffered by millions of
people. As the results section shows, high accuracies in classification are
obtained
","[{""version"":""v1"",""created"":""Wed, 10 Apr 2019 07:18:49 GMT""}]","2019-04-11"
"1904.05028","Zhiyong Tu","Zhiyong Tu (Peking University HSBC Business School University Town,
  Shenzhen, China), Lan Ju (Peking University HSBC Business School University
  Town, Shenzhen, China)","A Normative Dual-value Theory for Bitcoin and other Cryptocurrencies",,,,,"econ.GN q-fin.EC","http://arxiv.org/licenses/nonexclusive-distrib/1.0/","  Bitcoin as well as other cryptocurrencies are all plagued by the impact from
bifurcation. Since the marginal cost of bifurcation is theoretically zero, it
causes the coin holders to doubt on the existence of the coin's intrinsic
value. This paper suggests a normative dual-value theory to assess the
fundamental value of Bitcoin. We draw on the experience from the art market,
where similar replication problems are prevalent. The idea is to decompose the
total value of a cryptocurrency into two parts: one is its art value and the
other is its use value. The tradeoff between these two values is also analyzed,
which enlightens our proposal of an image coin for Bitcoin so as to elevate its
use value without sacrificing its art value. To show the general validity of
the dual-value theory, we also apply it to evaluate the prospects of four major
cryptocurrencies. We find this framework is helpful for both the investors and
the exchanges to examine a new coin's value when it first appears in the
market.
","[{""version"":""v1"",""created"":""Wed, 10 Apr 2019 07:19:02 GMT""}]","2019-04-11"
"1904.05029","Masaru Ikehata","Masaru Ikehata","Remarks on Lin-Nakamura-Wang's paper","7 pages",,,,"math.AP","http://arxiv.org/licenses/nonexclusive-distrib/1.0/","  Theorem 1.2 in their paper arXiv:1904.00999v1 [math.AP] 30 Mar 2019
""Reconstruction of unknown cavity by single measurement"" is not valid.
","[{""version"":""v1"",""created"":""Wed, 10 Apr 2019 07:31:54 GMT""}]","2019-04-11"
"1904.05030","Yohei Hosoe","Yohei Hosoe and Dimitri Peaucelle","Distribution Modeling and Stabilization Control for Discrete-Time Linear
  Random Dynamical Systems Using Ensemble Kalman Filter",,,,,"cs.SY","http://arxiv.org/licenses/nonexclusive-distrib/1.0/","  This paper studies an output feedback stabilization control framework for
discrete-time linear systems with stochastic dynamics determined by an
independent and identically distributed (i.i.d.) process. The controller is
constructed with an ensemble Kalman filter (EnKF) and a feedback gain designed
with our earlier result about state feedback control. The EnKF is also used for
modeling the distribution behind the system, which is required in the feedback
gain synthesis. The effectiveness of our control framework is demonstrated with
numerical experiments. This study will become the first step toward the
realization of learning type control using our stochastic systems control
theory.
","[{""version"":""v1"",""created"":""Wed, 10 Apr 2019 07:35:26 GMT""}]","2019-04-11"
"1904.05031","Mohammad Nami","Azadeh Mojdehfarahbakhsh, Saba Nouri, Abolfazl Alipour, Mohammad Nami","Top-down predictions influence binocular rivalry through beta band
  rhythms: a qEEG-based investigation",,,,,"q-bio.NC","http://arxiv.org/licenses/nonexclusive-distrib/1.0/","  Predictive coding theory suggests that conscious perception results from the
interaction between top-down and bottom-up signals in the brain. However, the
electrophysiological signatures of top-down predictions are not clear yet.
Here, we cued subjects to expect a certain perceptual state in a binocular
rivalry task and quantitatively analyzed their EEG signals during the cue
period and prior to binocular rivalry task. We found that when predictions can
successfully influence the perception of the rivalrous stimuli, the power of
beta band rhythms increases in primary visual cortices and beta band phase lag
in a frontal-visual homologous channel pair was notably diminished. Building
upon earlier works, our findings suggest that beta rhythm is potentially
considered as a signature of top-down communication in the brain.
","[{""version"":""v1"",""created"":""Wed, 10 Apr 2019 07:36:43 GMT""}]","2019-04-11"
"1904.05032","Takeru Ken Suzuki","Takeru K. Suzuki, Tetsuo Taki, Scott S. Suriano","Magnetohydrodynamics in a Cylindrical Shearing Box","27 pages, 10 figures, accepted by PASJ, movie is available at
  http://ea.c.u-tokyo.ac.jp/astro/Members/stakeru/research/cylshbx/",,"10.1093/pasj/psz082",,"astro-ph.HE astro-ph.EP astro-ph.SR","http://arxiv.org/licenses/nonexclusive-distrib/1.0/","  We develop a framework for magnetohydrodynamical (MHD) simulations in a local
cylindrical shearing box by extending the formulation of the Cartesian shearing
box. We construct shearing-periodic conditions at the radial boundaries of a
simulation box from the conservation relations of the basic MHD equations,
taking into account the explicit radial dependence of physical quantities. We
demonstrate quasi-steady mass accretion, which cannot be handled by the
standard Cartesian shearing box model, with an ideal MHD simulation in a
vertically unstratified cylindrical shearing box up to 200 rotations. In this
demonstrative run we set up (i) net vertical magnetic flux, (ii) a locally
isothermal equation of state, and (iii) a sub-Keplerian equilibrium rotation,
whereas the sound velocity and the initial Alfven velocity have the same radial
dependence as that of the Keplerian velocity. Inward mass accretion is induced
to balance with the outward angular momentum flux of the MHD turbulence
triggered by the magnetorotational instability in a self-consistent manner. We
discuss detailed physical properties of the saturated magnetic field, in
comparison to the results of a Cartesian shearing box simulation.
","[{""version"":""v1"",""created"":""Wed, 10 Apr 2019 07:42:25 GMT""},{""version"":""v2"",""created"":""Thu, 11 Apr 2019 00:42:36 GMT""},{""version"":""v3"",""created"":""Tue, 2 Jul 2019 03:55:21 GMT""}]","2019-10-23"
"1904.05033","Prakhar Gupta","Prakhar Gupta, Matteo Pagliardini and Martin Jaggi","Better Word Embeddings by Disentangling Contextual n-Gram Information","NAACL 2019",,,,"cs.CL cs.AI cs.IR cs.LG","http://arxiv.org/licenses/nonexclusive-distrib/1.0/","  Pre-trained word vectors are ubiquitous in Natural Language Processing
applications. In this paper, we show how training word embeddings jointly with
bigram and even trigram embeddings, results in improved unigram embeddings. We
claim that training word embeddings along with higher n-gram embeddings helps
in the removal of the contextual information from the unigrams, resulting in
better stand-alone word embeddings. We empirically show the validity of our
hypothesis by outperforming other competing word representation models by a
significant margin on a wide variety of tasks. We make our models publicly
available.
","[{""version"":""v1"",""created"":""Wed, 10 Apr 2019 07:44:06 GMT""}]","2019-04-11"
"1904.05034","Chen Zhao","Chen Zhao and Bernard Ghanem","ThumbNet: One Thumbnail Image Contains All You Need for Recognition",,,,,"cs.CV","http://arxiv.org/licenses/nonexclusive-distrib/1.0/","  Although deep convolutional neural networks (CNNs) have achieved great
success in computer vision tasks, its real-world application is still impeded
by its voracious demand of computational resources. Current works mostly seek
to compress the network by reducing its parameters or parameter-incurred
computation, neglecting the influence of the input image on the system
complexity. Based on the fact that input images of a CNN contain substantial
redundancy, in this paper, we propose a unified framework, dubbed as ThumbNet,
to simultaneously accelerate and compress CNN models by enabling them to infer
on one thumbnail image. We provide three effective strategies to train
ThumbNet. In doing so, ThumbNet learns an inference network that performs
equally well on small images as the original-input network on large images.
With ThumbNet, not only do we obtain the thumbnail-input inference network that
can drastically reduce computation and memory requirements, but also we obtain
an image downscaler that can generate thumbnail images for generic
classification tasks. Extensive experiments show the effectiveness of ThumbNet,
and demonstrate that the thumbnail-input inference network learned by ThumbNet
can adequately retain the accuracy of the original-input network even when the
input images are downscaled 16 times.
","[{""version"":""v1"",""created"":""Wed, 10 Apr 2019 07:44:09 GMT""},{""version"":""v2"",""created"":""Wed, 12 Aug 2020 09:01:45 GMT""},{""version"":""v3"",""created"":""Thu, 3 Dec 2020 12:32:20 GMT""}]","2020-12-04"
"1904.05035","Alexei Chepelianskii","K.M. Yunusova, D. Konstantinov, H. Bouchiat and A.D. Chepelianskii","Coupling between Rydberg states and Landau levels of electrons trapped
  on liquid helium",,,"10.1103/PhysRevLett.122.176802",,"cond-mat.mes-hall cond-mat.quant-gas","http://arxiv.org/licenses/nonexclusive-distrib/1.0/","  We investigate the coupling between Rydberg states of electrons trapped on a
liquid Helium surface and Landau levels induced by a perpendicular magnetic
field. We show that this realises a prototype quantum system equivalent to an
atom in a cavity, where their coupling strength can be tuned by a parallel
magnetic field. We determine experimentally the renormalisation of the atomic
transition energies induced by the coupling to the cavity, which can be seen as
an analogue of the Lamb shift. When the coupling is sufficiently strong the
transition between the ground and first excited Rydberg states splits into two
resonances corresponding to dressed states with vacuum and one photon in the
cavity. Our results are in quantitative agreement with the energy shifts
predicted by the effective atom in a cavity model where all parameters are
known with high accuracy.
","[{""version"":""v1"",""created"":""Wed, 10 Apr 2019 07:47:17 GMT""}]","2019-05-22"
"1904.05036","Sabine Plancoulaine","Eve Reynaud (CRESS - U1153, EHESP), Marie-Fran\c{c}oise Vecchierini,
  Barbara Heude (CRESS - U1153), Marie-Aline Charles (CRESS - U1153), Sabine
  Plancoulaine (INSERM, CRESS - U1153)","Sleep and its relation to cognition and behaviour in preschool-aged
  children of the general population: a systematic review",,"Journal of Sleep Research, Wiley, 2018, 27 (3), pp.e12636","10.1111/jsr.12636",,"q-bio.NC","http://arxiv.org/licenses/nonexclusive-distrib/1.0/","  Background: While the relations between sleep, cognition and behavior have
been extensively studied in adolescents and school-aged children, very little
attention has been given to preschoolers. Objective: In this systematic review,
our aim was to survey articles that address the link between sleep and both
cognition and behavior in preschoolers (24 to 72 months old). Methods: Four
electronic databases were searched, namely Medline, Web of Science, PsycINFO
and ERIC, completed by forward and backward citation search. Results: Among the
1590 articles identified (minus duplicates), 26 met the inclusion criteria.
Globally, studies with the largest sample sizes (N=13) found that a greater
quantity or quality of sleep was associated with better behavioral and
cognitive outcomes, while the others were less consistent. Conclusion: Although
the current literature seems to indicate that sleep is related to behavioral
and cognitive development as early as preschool years, the strength of the
associations (i.e. effect sizes) was relatively small. In addition to taking
stock of the available data, this systematic review identifies potential
sources of improvement for future research.
","[{""version"":""v1"",""created"":""Wed, 10 Apr 2019 07:47:20 GMT""}]","2019-04-11"
"1904.05037","Thilo Reich","Thilo Reich, Marcin Budka, Derek Robbins, David Hulbert","Survey of ETA prediction methods in public transport networks","8 pages, 4 figures, 1 table and 1 supplementary table",,,,"cs.CY","http://arxiv.org/licenses/nonexclusive-distrib/1.0/","  The majority of public transport vehicles are fitted with Automatic Vehicle
Location (AVL) systems generating a continuous stream of data. The availability
of this data has led to a substantial body of literature addressing the
development of algorithms to predict Estimated Times of Arrival (ETA). Here
research literature reporting the development of ETA prediction systems
specific to busses is reviewed to give an overview of the state of the art.
Generally, reviews in this area categorise publications according to the type
of algorithm used, which does not allow an objective comparison. Therefore this
survey will categorise the reviewed publications according to the input data
used to develop the algorithm. The review highlighted inconsistencies in
reporting standards of the literature. The inconsistencies were found in the
varying measurements of accuracy preventing any comparison and the frequent
omission of a benchmark algorithm. Furthermore, some publications were lacking
in overall quality. Due to these highlighted issues, any objective comparison
of prediction accuracies is impossible. The bus ETA research field therefore
requires a universal set of standards to ensure the quality of reported
algorithms. This could be achieved by using benchmark datasets or algorithms
and ensuring the publication of any code developed.
","[{""version"":""v1"",""created"":""Wed, 10 Apr 2019 07:49:27 GMT""}]","2019-04-11"
"1904.05038","Bernard Segard","Bruno Macke (PhLAM), Bernard S\'egard (PhLAM)","Material slow and fast light in a zero-dispersion configuration",,"Journal of the Optical Society of America B, Optical Society of
  America, 2020, 37 (7), pp.2080","10.1364/JOSAB.389480",,"physics.optics","http://arxiv.org/licenses/nonexclusive-distrib/1.0/","  We study the propagation of light pulses in an absorbing medium when the
frequency of their carrier coincides with a zero of the refractive index
dispersion. Although slow light and, a fortiori, fast light are not expected in
such conditions, we show that both can be obtained by selecting particular
phase-components of the transmitted field. Analytical expressions of the
resulting signals are obtained by a procedure of periodic continuation of the
incident pulse and a proof of principle of the predicted phenomena is performed
by means of a very simple electrical network, the transfer function of which
mimics that of the medium.
","[{""version"":""v1"",""created"":""Wed, 10 Apr 2019 07:50:43 GMT""},{""version"":""v2"",""created"":""Fri, 18 Sep 2020 13:07:44 GMT""}]","2020-09-21"
"1904.05039","Zhixiong Gong","Zhixiong Gong and Michael Baudoin","Particle assembly with synchronized acoustical tweezers",,,"10.1103/PhysRevApplied.12.024045",,"physics.app-ph","http://arxiv.org/licenses/nonexclusive-distrib/1.0/","  The contactless selective manipulation of individual objects at the
microscale is powerfully enabled by acoustical tweezers based on acoustical
vortices [Baudoin et al., Sci. Adv., 5:eaav1967 (2019)]. Nevertheless, the
ability to assemble multiple objects with these tweezers has not yet been
demonstrated yet and is critical for many applications, such as tissue
engineering or microrobotics. To achieve this goal, it is necessary to overcome
a major difficulty: the ring of high intensity ensuring particles trapping at
the core of the vortex beam is repulsive for particles located outside the
trap. This prevents the assembly of multiple objects. In this paper, we show
(in the Rayleigh limit and in 2D) that this problem can be overcome by trapping
the target objects at the core of two synchronized vortices. Indeed, in this
case, the destructive interference between neighboring vortices enables to
create an attractive path between the captured objects. The present work may
pioneer particles precise assembly and patterning with multi-tweezers.
","[{""version"":""v1"",""created"":""Wed, 10 Apr 2019 07:52:06 GMT""}]","2021-02-05"
"1904.05040","Brendan Patch Dr","Brendan Patch, Mark S. Squillante, Peter M. Van de Ven","Optimising capacity allocation in networks of stochastic loss systems: A
  functional-form approach",,,,,"cs.NI cs.PF math.PR","http://arxiv.org/licenses/nonexclusive-distrib/1.0/","  Motivated by a wide variety of applications, this paper introduces a general
class of networks of stochastic loss systems in which congestion renders lost
revenue due to customers or jobs being permanently removed from the system. We
seek to balance the trade-off between mitigating congestion by increasing
service capacity and maintaining low costs for the service capacity provided.
Given the lack of analytical results and the computational burden of
simulation-based methods, we propose a hybrid functional-form approach for
finding the optimal resource allocation in general networks of stochastic loss
systems that combines the speed of an analytical approach with the accuracy of
simulation-based optimisation. The key insight is a core iterative algorithm
that replaces the computationally expensive gradient estimation in simulation
optimisation with a closed-form analytical approximation that is calibrated
using a simple simulation run. Extensive computational experiments on complex
networks show that our approach renders near-optimal solutions with objective
function values that are comparable to those obtained using stochastic
approximation, surrogate optimisation and Bayesian optimisation methods while
requiring significantly less computational effort.
","[{""version"":""v1"",""created"":""Wed, 10 Apr 2019 07:55:30 GMT""},{""version"":""v2"",""created"":""Tue, 22 Oct 2019 21:42:33 GMT""},{""version"":""v3"",""created"":""Wed, 11 May 2022 13:55:37 GMT""}]","2022-05-12"
