"1904.06363","Adi Foord","Adi Foord, Kayhan Gultekin, Mark T. Reynolds, Edmund Hodges-Kluck,
  Edward M. Cackett, Julia M. Comerford, Ashley L. King, Jon M. Miller, Jessie
  C. Runnoe","A Bayesian Analysis of SDSS J0914+0853, a Low-Mass Dual AGN Candidate","16 pages, 5 figures, accepted to ApJ",,"10.3847/1538-4357/ab18a3",,"astro-ph.HE astro-ph.GA","http://arxiv.org/licenses/nonexclusive-distrib/1.0/","  We present the first results from BAYMAX (Bayesian AnalYsis of Multiple AGN
in X-rays), a tool that uses a Bayesian framework to quantitatively evaluate
whether a given Chandra observation is more likely a single or dual point
source. Although the most robust method of determining the presence of dual
AGNs is to use X-ray observations, only sources that are widely separated
relative to the instrument PSF are easy to identify. It becomes increasingly
difficult to distinguish dual AGNs from single AGNs when the separation is on
the order of Chandra's angular resolution (<1''). Using likelihood models for
single and dual point sources, BAYMAX quantitatively evaluates the likelihood
of an AGN for a given source. Specifically, we present results from BAYMAX
analyzing the lowest-mass dual AGN candidate to date, SDSS J0914+0853, where
archival Chandra data shows a possible secondary AGN ~0.3'' from the primary.
Analyzing a new 50 ks Chandra observation, results from BAYMAX shows that SDSS
J0914+0853 is most likely a single AGN with a Bayes factor of 13.5 in favor of
a single point source model. Further, posterior distributions from the dual
point source model are consistent with emission from a single AGN. We find the
probability of SDSS J0914+0853 being a dual AGN system with a flux ratio f>0.3
and separation r>0.3'' to be very low. Overall, BAYMAX will be an important
tool for correctly classifying candidate dual AGNs in the literature, and
studying the dual AGN population where past spatial resolution limits have
prevented systematic analyses.
","[{""version"":""v1"",""created"":""Fri, 12 Apr 2019 18:03:44 GMT""}]","2019-05-29"
"1904.06364","John Gough","John E. Gough","How to estimate past measurement interventions on a quantum system
  undergoing continuous monitoring",,"Russian Journal of Mathematical Physics 27, 218-227, 2020","10.1134/S1061920820020089",,"quant-ph","http://arxiv.org/licenses/nonexclusive-distrib/1.0/","  We analyze the problem of estimating past quantum states of a monitored
system from a mathematical perspective in order to ensure self-consistency with
the principle of quantum non-demolition. Despite several claims of ``measuring
noncommuting observables'' in the physics literature, we show that we are
always measuring commuting processes. Our main interest is in the notion of
quantum smoothing or retrodiction. In particular, we examine proposals to
estimate the result of an external measurement made on an open quantum systems
during a period where it is also undergoing continuous monitoring. A full
analysis shows that the non-demolition principle is not actually violated, and
so a well-posed as a statistical inference problem can be formulated. We extend
the formalism to consider multiple independent external measurements made on
the system over the course of a continual period of monitoring.
","[{""version"":""v1"",""created"":""Fri, 12 Apr 2019 18:06:27 GMT""}]","2020-12-23"
"1904.06365","Nicola Franchini","Nikolas Andreou, Nicola Franchini, Giulia Ventagli, Thomas P. Sotiriou","Spontaneous scalarization in generalised scalar-tensor theory","Added a term than had accidentally been omitted in equations (24),
  (25), (40), (42). Typos corrected. Results unchanged","Phys. Rev. D 99, 124022 (2019)","10.1103/PhysRevD.99.124022",,"gr-qc hep-th","http://arxiv.org/licenses/nonexclusive-distrib/1.0/","  Spontaneous scalarization is a mechanism that endows relativistic stars and
black holes with a nontrivial configuration only when their spacetime curvature
exceeds some threshold. The standard way to trigger spontaneous scalarization
is via a tachyonic instability at the linear level, which is eventually
quenched due to the effect of non-linear terms. In this paper, we identify all
of the terms in the Horndeski action that contribute to the (effective) mass
term in the linearized equations and, hence, can cause or contribute to the
tachyonic instability that triggers scalarization.
","[{""version"":""v1"",""created"":""Fri, 12 Apr 2019 18:07:02 GMT""},{""version"":""v2"",""created"":""Tue, 18 Jun 2019 08:56:38 GMT""},{""version"":""v3"",""created"":""Mon, 11 May 2020 14:21:12 GMT""}]","2020-05-12"
"1904.06367","Sam Payne","Melody Chan, Carel Faber, Soren Galatius, Sam Payne","The $S_n$-equivariant top weight Euler characteristic of $M_{g,n}$","28 pages, 5 figures; v3: minor revisions, final version to appear in
  Amer. J. Math",,,"CPH-GEOTOP-DNRF151","math.AG","http://arxiv.org/licenses/nonexclusive-distrib/1.0/","  We prove a formula, conjectured by Zagier, for the $S_n$-equivariant Euler
characteristic of the top weight cohomology of $M_{g,n}$.
","[{""version"":""v1"",""created"":""Fri, 12 Apr 2019 18:19:31 GMT""},{""version"":""v2"",""created"":""Wed, 24 Jun 2020 16:15:15 GMT""},{""version"":""v3"",""created"":""Fri, 2 Dec 2022 15:40:38 GMT""}]","2022-12-05"
"1904.06368","Peter Shternin","Peter Shternin, Aida Kirichenko, Dmitry Zyuzin, Meng Yu, Andrey
  Danilenko, Maxim Voronkov, Yuriy Shibanov","Tracking the footprints of the radio pulsar B1727$-$47: proper motion,
  host supernova remnant, and the glitches","21 pages, 13 figures; accepted to ApJ","ApJ 877, 78 (2019)","10.3847/1538-4357/ab1905",,"astro-ph.HE","http://arxiv.org/licenses/nonexclusive-distrib/1.0/","  The bright radio pulsar B1727$-$47 with a characteristic age of 80 kyr is
among the first pulsars discovered 50 yr ago. Using its regular timing
observations and interferometric positions at three epochs, we measured, for
the first time, the pulsar proper motion of $151 \pm 19$ mas yr$^{-1}$. At the
dispersion measure distance of $\gtrsim 2.7$ kpc, this would suggest a record
transverse velocity of the pulsar $\gtrsim 1900$ km s$^{-1}$. However, a
backward extrapolation of the pulsar track to its birth epoch points remarkably
close to the center of the evolved nearby supernova remnant RCW 114, which
suggests genuine association of the two objects. In this case, the pulsar is
substantially closer ($\sim 0.6$ kpc) and younger ($\sim 50$ kyr), and its
velocity ($\sim400$ km s$^{-1}$) is compatible with the observed pulsar
velocity distribution. We also identified two new glitches of the pulsar. We
discuss implications of our results on the pulsar and remnant properties.
","[{""version"":""v1"",""created"":""Fri, 12 Apr 2019 18:20:13 GMT""}]","2019-05-30"
"1904.06369","Lalit Vaishya","B. Ramakrishnan and Lalit Vaishya","On triangular numbers, forms of mixed type and their representation
  numbers","36 pages, 17 tables, revised abstract, sections are reordered, some
  typos fixed,corollary 1.5 and remark 1.1 are combined, (p,k)-parametrization
  of Eisenstein series are corrected",,,,"math.NT","http://arxiv.org/licenses/nonexclusive-distrib/1.0/","  In \cite{ono}, K. Ono, S. Robins and P.T. Wahl considered the problem of
determining formulas for the number of representations of a natural number $n$
by a sum of $k$ triangular numbers and derived many applications, including the
one connecting these numbers with the number of representations of $n$ as a sum
of $k$ odd square integers. They also obtained an application to the number of
lattice points in the $k$-dimensional sphere. In this paper, we consider
triangular numbers with positive integer coefficients. First we show that if
the sum of these coefficients is a multiple of $8$, then the associated
generating function gives rise to a modular form of integral weight (when even
number of triangular numbers are taken). We then use the theory of modular
forms to get the representation number formulas corresponding to the triangular
numbers with coefficients. We also obtain several applications concerning the
triangular numbers with coefficients similar to the ones obtained in
\cite{ono}. In the second part of the paper, we consider more general mixed
forms (as done in Xia-Ma-Tian \cite{xia}) and derive modular properties for the
corresponding generating functions associated to these mixed forms. Using our
method we deduce all the 21 formulas proved in \cite[Theorem 1.1]{xia} and show
that our method of deriving the 21 formulas together with the $(p,k)$
parametrization of the generating functions of the three mixed forms imply the
$(p,k)$ parametrization of the Eisenstein series $E_4(\tau)$ and its
duplications. It is to be noted that the $(p,k)$ parametrization of $E_4$ and
its duplications were derived by a different method by K. S. Williams and his
co-authors. In the final section, we provide sample formulas for these
representation numbers in the case of 4 and 6 variable forms.
","[{""version"":""v1"",""created"":""Fri, 12 Apr 2019 18:27:09 GMT""},{""version"":""v2"",""created"":""Wed, 1 May 2019 08:04:59 GMT""},{""version"":""v3"",""created"":""Sat, 22 Jun 2019 19:12:47 GMT""}]","2019-06-25"
"1904.06370","Althea Moorhead","Althea V. Moorhead, Auriane Egal, Peter G. Brown, Danielle E. Moser,
  William J. Cooke","Meteor shower forecasting in near-Earth space","Accepted for publication in the Journal of Spacecraft and Rockets",,,,"astro-ph.EP physics.space-ph","http://arxiv.org/licenses/nonexclusive-distrib/1.0/","  NASA's Meteoroid Environment Office (MEO) produces an annual meteor shower
forecast in order to help spacecraft operators assess the risk posed by
meteoroid streams. Previously, this forecast focused on the International Space
Station and therefore reported meteoroid fluxes and enhancement factors at an
orbital altitude of 400 km. This paper presents an updated forecast algorithm
that has an improved calculation of the flux enhancement produced by showers
and can calculate fluxes at any selected Earth or lunar orbital altitude.
Finally, we discuss and generate forecasted fluxes for the 2018 Draconid meteor
shower, which is expected to produce meteoroid flux enhancements near the
Sun-Earth L1 and L2 Lagrange points but not at Earth.
","[{""version"":""v1"",""created"":""Fri, 12 Apr 2019 18:44:22 GMT""}]","2019-04-16"
"1904.06371","Chengchao Yuan","Chengchao Yuan, Kohta Murase, Peter M\'esz\'aros","Complementarity of Stacking and Multiplet Constraints on the Blazar
  Contribution to the Cumulative High-Energy Neutrino Intensity","Accepted for publication in The Astrophysical Journal. 8 pages, 4
  figures","Astrophys.J. 890 (2020) 25","10.3847/1538-4357/ab65ea",,"astro-ph.HE hep-ph","http://arxiv.org/licenses/nonexclusive-distrib/1.0/","  We investigate the blazar contribution to the cumulative neutrino intensity
assuming a generic relationship between neutrino and gamma-ray luminosities,
$L_{\nu}\propto (L_{\rm ph})^{\gamma_{\rm lw}}$. Using the gamma-ray luminosity
functions for blazars including flat spectrum radio quasars (FSRQs) and BL Lac
objects, as well as the $Fermi$-LAT detection efficiency, we estimate
contributions from {blazars resolved by $Fermi$-LAT as well as the unresolved
counterpart.} Combining the existing upper limits from stacking analyses, the
cumulative neutrino flux from all blazars ({including $Fermi$-LAT resolved and
unresolved ones}) are constrained { in the range $0\lesssim\gamma_{\rm
lw}\lesssim2.5$}. We also evaluate the effects of the redshift evolution and
the effective local number densities for each class of FSRQs, BL Lacs, and all
blazars, by which we place another type of constraints on the blazar
contribution using the non-detection of high-energy neutrino multiplets. We
demonstrate that these two upper limits are complementary, and that the joint
consideration of the stacking and multiplet analyses { not only supports the
argument that blazars are disfavored as the dominant sources of the 100-TeV
neutrino background, but it extends this argument by including also
$Fermi$-LAT-unresolved blazars as well, for a more generic luminosity
correlation $L_{\nu}\propto (L_{\rm ph})^{\gamma_{\rm lw}}$}.
","[{""version"":""v1"",""created"":""Fri, 12 Apr 2019 18:51:07 GMT""},{""version"":""v2"",""created"":""Wed, 17 Apr 2019 05:17:20 GMT""},{""version"":""v3"",""created"":""Wed, 25 Dec 2019 18:47:10 GMT""}]","2020-02-13"
"1904.06372","Roman Polozkov","R.G. Polozkov, N.Y. Senkevich, S. Morina, P. Kuzhir, M.E. Portnoi,
  I.A. Shelykh","Carbon nanotube array as a van der Waals two-dimensional hyperbolic
  material",,"Phys. Rev. B 100, 235401 (2019)","10.1103/PhysRevB.100.235401",,"cond-mat.mes-hall physics.comp-ph","http://arxiv.org/licenses/nonexclusive-distrib/1.0/","  We use an ab-initio approach to design and study a novel two-dimensional
material - a planar array of carbon nanotubes separated by an optimal distance
defined by the van der Waals interaction. We show that the energy spectrum for
an array of quasi-metallic nanotubes is described by a strongly anisotropic
hyperbolic dispersion and formulate a model low-energy Hamiltonian for its
semi-analytical treatment. Periodic-potential-induced lifting of the valley
degeneracy for an array of zigzag narrow-gap nanotubes leads to the band gap
collapse. In contrast, the band gap is opened in an array of gapless armchair
tubes. These unusual spectra, marked by pronounced van Hove singularities in
the low-energy density of states, open the opportunity for interesting physical
effects and prospective optoelectronic applications.
","[{""version"":""v1"",""created"":""Fri, 12 Apr 2019 18:54:44 GMT""},{""version"":""v2"",""created"":""Tue, 9 Jul 2019 14:10:34 GMT""},{""version"":""v3"",""created"":""Thu, 24 Oct 2019 13:51:20 GMT""},{""version"":""v4"",""created"":""Fri, 25 Oct 2019 06:03:22 GMT""}]","2019-12-11"
"1904.06373","Kean Chen","Kean Chen, Jianguo Li, Weiyao Lin, John See, Ji Wang, Lingyu Duan,
  Zhibo Chen, Changwei He, Junni Zou","Towards Accurate One-Stage Object Detection with AP-Loss","13 pages, 7 figures, 4 tables, main paper + supplementary material,
  accepted to CVPR 2019",,,,"cs.CV","http://arxiv.org/licenses/nonexclusive-distrib/1.0/","  One-stage object detectors are trained by optimizing classification-loss and
localization-loss simultaneously, with the former suffering much from extreme
foreground-background class imbalance issue due to the large number of anchors.
This paper alleviates this issue by proposing a novel framework to replace the
classification task in one-stage detectors with a ranking task, and adopting
the Average-Precision loss (AP-loss) for the ranking problem. Due to its
non-differentiability and non-convexity, the AP-loss cannot be optimized
directly. For this purpose, we develop a novel optimization algorithm, which
seamlessly combines the error-driven update scheme in perceptron learning and
backpropagation algorithm in deep networks. We verify good convergence property
of the proposed algorithm theoretically and empirically. Experimental results
demonstrate notable performance improvement in state-of-the-art one-stage
detectors based on AP-loss over different kinds of classification-losses on
various benchmarks, without changing the network architectures. Code is
available at https://github.com/cccorn/AP-loss.
","[{""version"":""v1"",""created"":""Fri, 12 Apr 2019 18:58:55 GMT""},{""version"":""v2"",""created"":""Sat, 25 Jan 2020 10:04:05 GMT""},{""version"":""v3"",""created"":""Thu, 13 Feb 2020 18:23:50 GMT""}]","2020-02-14"
"1904.06374","Wouter Vlemmings","W.H.T. Vlemmings, T. Khouri, H. Olofsson","Resolving the extended stellar atmospheres of Asymptotic Giant Branch
  stars at (sub-)millimetre wavelengths","18 pages, 13 figures, Accepted to A&A, final version after language
  editing","A&A 626, A81 (2019)","10.1051/0004-6361/201935329",,"astro-ph.SR","http://arxiv.org/licenses/nonexclusive-distrib/1.0/","  The initial conditions for the mass loss during the asymptotic giant branch
(AGB) phase are set in their extended atmospheres, where, among others,
convection and pulsation driven shocks determine the physical conditions. High
resolution observations of AGB stars at (sub)millimetre wavelengths can now
directly determine the morphology, activity, density, and temperature close to
the stellar photosphere. We used the Atacama Large Millimeter/submillimeter
Array (ALMA) high angular resolution observations to resolve the extended
atmospheres of four of the nearest AGB stars: W Hya, Mira A, R Dor and R Leo.
We interpreted the observations using a parameterised atmosphere model. We
resolve all four AGB stars and determine the brightness temperature structure
between $1$ and $2$ stellar radii. For W Hya and R Dor we confirm the existence
of hotspots with brightness temperatures $>3000$ to $10000$~K. All four stars
show deviations from spherical symmetry. We find variations on a timescale of
days to weeks, and for R Leo we directly measure an outward motion of the
millimetre wavelength surface with a velocity of at least
$10.6\pm1.4$~km~s$^{-1}$. For all objects but W Hya we find that the
temperature-radius and size-frequency relations require the existence of a
(likely inhomogeneous) layer of enhanced opacity. The ALMA observations provide
a unique probe of the structure of the extended AGB atmosphere. We find highly
variable structures of hotspots and likely convective cells. In the future,
these observations can be directly compared to multi-dimensional chromosphere
and atmosphere models that determine the temperature, density, velocity, and
ionisation structure between the stellar photosphere and the dust formation
region. However, our results show that for the best interpretation, both very
accurate flux calibration and near-simultaneous observations are essential.
","[{""version"":""v1"",""created"":""Fri, 12 Apr 2019 18:59:15 GMT""},{""version"":""v2"",""created"":""Mon, 6 May 2019 07:51:27 GMT""}]","2019-06-19"
"1904.06375","Angana Ray","Angana Ray and Rosa Di Felice","Molecular simulations have boosted knowledge of CRISPR/Cas9: A Review","24 pages, 10 figures, few figures are from previously published work
  for which appropriate permissions have been taken",,,,"physics.bio-ph q-bio.BM","http://arxiv.org/licenses/nonexclusive-distrib/1.0/","  Genome editing allows scientists to change an organism's DNA. One promising
genome editing protocol, already validated in living organisms, is based on
clustered regularly interspaced short palindromic repeats (CRISPR)/Cas
protein-nucleic acid complexes. When the CRISPR/Cas approach was first
demonstrated in 2012, its advantages with respect to previously available
techniques, such as zinc-finger nucleases (ZFNs) and transcription
activator-like effector nucleases (TALENs), immediately got attention and the
method has seen a surge of experimental and computational investigations since
then. However, the molecular mechanisms involved in target DNA recognition and
cleavage are still not completely resolved and need further attention. The
large size and complex nature of CRISPR/Cas9 complexes has been a challenge for
computational studies, but some seed results exist and are illuminating on the
cleavage activity. In this short review, we present recent progress in studying
CRISPR/Cas9 systems by molecular dynamics simulations with coarse-grained and
atomistic descriptions, including enhanced sampling.
","[{""version"":""v1"",""created"":""Fri, 12 Apr 2019 19:00:24 GMT""},{""version"":""v2"",""created"":""Wed, 24 Jul 2019 00:05:20 GMT""}]","2019-07-25"
"1904.06376","Alexander Heinecke","Greg Henry, Ping Tak Peter Tang, Alexander Heinecke","Leveraging the bfloat16 Artificial Intelligence Datatype For
  Higher-Precision Computations","Accepted at ARITH26",,,,"cs.MS cs.NA","http://arxiv.org/licenses/nonexclusive-distrib/1.0/","  In recent years fused-multiply-add (FMA) units with lower-precision
multiplications and higher-precision accumulation have proven useful in machine
learning/artificial intelligence applications, most notably in training deep
neural networks due to their extreme computational intensity. Compared to
classical IEEE-754 32 bit (FP32) and 64 bit (FP64) arithmetic, these reduced
precision arithmetic can naturally be sped up disproportional to their
shortened width. The common strategy of all major hardware vendors is to
aggressively further enhance their performance disproportionately. One
particular FMA operation that multiplies two BF16 numbers while accumulating in
FP32 has been found useful in deep learning, where BF16 is the 16-bit floating
point datatype with IEEE FP32 numerical range but 8 significant bits of
precision. In this paper, we examine the use this FMA unit to implement
higher-precision matrix routines in terms of potential performance gain and
implications on accuracy. We demonstrate how a decomposition into multiple
smaller datatypes can be used to assemble a high-precision result, leveraging
the higher precision accumulation of the FMA unit. We first demonstrate that
computations of vector inner products and by natural extension, matrix-matrix
products can be achieved by decomposing FP32 numbers in several BF16 numbers
followed by appropriate computations that can accommodate the dynamic range and
preserve accuracy compared to standard FP32 computations, while projecting up
to 5.2x speed-up. Furthermore, we examine solution of linear equations
formulated in the residual form that allows for iterative refinement. We
demonstrate that the solution obtained to be comparable to those offered by
FP64 under a large range of linear system condition numbers.
","[{""version"":""v1"",""created"":""Fri, 12 Apr 2019 19:04:47 GMT""}]","2019-04-16"
"1904.06377","Martin Frasch","Colin Wakefield, Ben Janoschek, Yael Frank, Floyd Karp, Nicholas
  Reyes, Jay Schulkin, Martin G. Frasch","Chronic stress may disrupt covariant fluctuations of vitamin D and
  cortisol plasma levels in pregnant sheep during the last trimester: a
  preliminary report","See also https://github.com/martinfrasch/stressed_sheep for data and
  results",,,,"q-bio.TO","http://creativecommons.org/licenses/by-nc-sa/4.0/","  Psychosocial stress during pregnancy is a known contributor to preterm birth,
but also has been increasingly appreciated as an in utero insult acting
long-term on prenatal and postnatal neurodevelopmental trajectories. These
events impact many information molecules, including both vitamin D and
cortisol. Both have been linked to low birth premature babies. Cortisol tends
to be further elevated in women, while vitamin D tends to be decreased from
their normal levels during pregnancy. One facilitates labor in part by
elevating placental CRH, the other by limiting CRH in placental tissue. Both
are linked to managing adversity. Studies in large animal models with high
resemblance to human physiology are sparse to model the changes induced by such
stress exposure. Using an established pregnant sheep model of stress during
human development, here we focused on measuring the changes in maternal Vitamin
D and cortisol responses due to chronic inescapable stress mimicking daily
challenges in the last trimester of human pregnancy. The present pilot data
show that chronic maternal stress during pregnancy results in endocrine and
metabolic chronic habituation paralleled by sensitization to acute stress
challenges. Chronic stress appears to disrupt a physiological relationship
between oscillations of vitamin D and cortisol. These speculations need to be
explored in future studies.
","[{""version"":""v1"",""created"":""Fri, 12 Apr 2019 19:04:49 GMT""},{""version"":""v2"",""created"":""Wed, 17 Jul 2019 23:00:55 GMT""},{""version"":""v3"",""created"":""Mon, 12 Aug 2019 08:16:53 GMT""}]","2019-08-13"
"1904.06378","Francisco Fern\'andez Dr.","Francisco M. Fern\'andez","On the permutation symmetry of atomic and molecular wavefunctions",,,,,"quant-ph","http://arxiv.org/licenses/nonexclusive-distrib/1.0/","  In this paper we analyze a recently proposed approach for the construction of
antisymmetric functions for atomic and molecular systems. It is based on the
assumption that the main problems with Hartree-Fock wavefunctions stem from
their lack of proper permutation symmetry. This alternative building approach
is based on products of a space times a spin function with opposite permutation
symmetry. The main argument for devising such factors is that the
eigenfunctions of the non-relativistic Hamiltonian are either symmetric or
antisymmetric with respect to the transposition of the variables of a pair of
electrons. However, since the eigenfunctions of the non-relativistic
Hamiltonian are basis for the irreducible representations of the symmetric
group they are not necessarily symmetric or antisymmetric, except in the
trivial case of two electrons. We carry out a simple and straightforward
general analysis of the symmetry of the eigenfunctions of the non-relativistic
Hamiltonian and illustrate our conclusions by means of two exactly-solvable
models of $N=2$ and $N=3$ identical interacting particles.
","[{""version"":""v1"",""created"":""Fri, 12 Apr 2019 19:07:24 GMT""},{""version"":""v2"",""created"":""Sun, 28 Apr 2019 18:46:09 GMT""},{""version"":""v3"",""created"":""Sun, 16 Jun 2019 20:23:42 GMT""}]","2019-06-18"
