"1904.06503","Hao Xu","Hao Xu, Man-Hong Yung","Black hole evaporation in Lovelock gravity with diverse dimensions","6 pages + references, 3 figures;minor corrections, references added,
  published version","Physics Letters B 794 (2019) 77-82","10.1016/j.physletb.2019.05.031",,"gr-qc hep-th","http://arxiv.org/licenses/nonexclusive-distrib/1.0/","  We investigate the black hole evaporation process in Lovelock gravity with
diverse dimensions. By selecting the appropriate coefficients, the space-time
solutions can possess a unique AdS vacuum with a fixed cosmological constant
$\Lambda=-\frac{(d-1)(d-2)}{2\ell^{2}}$. The black hole solutions can be
divided into two cases: $d>2k+1$ and $d=2k+1$. In the case of $d>2k+1$, the
black hole is in an analogy with the Schwarzschild AdS black hole, and the life
time is bounded by a time of the order of $\ell^{d-2k+1}$, which reduces Page's
result on the Einstein gravity in $k=1$. In the case of $d=2k+1$, the black
hole resembles the three dimensional black hole. The black hole vacuum
corresponds to $T=0$, so the black hole will take infinite time to evaporate
away for any initial states, which obeys the third law of thermodynamics. In
the asymptotically flat limit $\ell\rightarrow \infty$, the system reduces to
the pure Lovelock gravity that only possesses the highest $k$-th order term.
For a initial mass $M_0$, the life time of the black hole is in the order of
$M_0^{\frac{d-2k+1}{d-2k-1}}$.
","[{""version"":""v1"",""created"":""Sat, 13 Apr 2019 08:14:54 GMT""},{""version"":""v2"",""created"":""Thu, 30 May 2019 05:53:33 GMT""}]","2019-05-31"
"1904.06504","Vladyslav Usenko","Vladyslav Usenko, Nikolaus Demmel, David Schubert, J\""org St\""uckler,
  Daniel Cremers","Visual-Inertial Mapping with Non-Linear Factor Recovery",,,"10.1109/LRA.2019.2961227",,"cs.CV cs.RO","http://arxiv.org/licenses/nonexclusive-distrib/1.0/","  Cameras and inertial measurement units are complementary sensors for
ego-motion estimation and environment mapping. Their combination makes
visual-inertial odometry (VIO) systems more accurate and robust. For globally
consistent mapping, however, combining visual and inertial information is not
straightforward. To estimate the motion and geometry with a set of images large
baselines are required. Because of that, most systems operate on keyframes that
have large time intervals between each other. Inertial data on the other hand
quickly degrades with the duration of the intervals and after several seconds
of integration, it typically contains only little useful information.
  In this paper, we propose to extract relevant information for visual-inertial
mapping from visual-inertial odometry using non-linear factor recovery. We
reconstruct a set of non-linear factors that make an optimal approximation of
the information on the trajectory accumulated by VIO. To obtain a globally
consistent map we combine these factors with loop-closing constraints using
bundle adjustment. The VIO factors make the roll and pitch angles of the global
map observable, and improve the robustness and the accuracy of the mapping. In
experiments on a public benchmark, we demonstrate superior performance of our
method over the state-of-the-art approaches.
","[{""version"":""v1"",""created"":""Sat, 13 Apr 2019 08:15:00 GMT""},{""version"":""v2"",""created"":""Mon, 29 Apr 2019 16:19:36 GMT""},{""version"":""v3"",""created"":""Sat, 30 May 2020 19:01:09 GMT""}]","2020-06-02"
"1904.06505","Kede Ma","Kede Ma, Wentao Liu, Tongliang Liu, Zhou Wang, Dacheng Tao","dipIQ: Blind Image Quality Assessment by Learning-to-Rank Discriminable
  Image Pairs",,,"10.1109/TIP.2017.2708503",,"cs.CV cs.MM","http://arxiv.org/licenses/nonexclusive-distrib/1.0/","  Objective assessment of image quality is fundamentally important in many
image processing tasks. In this work, we focus on learning blind image quality
assessment (BIQA) models which predict the quality of a digital image with no
access to its original pristine-quality counterpart as reference. One of the
biggest challenges in learning BIQA models is the conflict between the gigantic
image space (which is in the dimension of the number of image pixels) and the
extremely limited reliable ground truth data for training. Such data are
typically collected via subjective testing, which is cumbersome, slow, and
expensive. Here we first show that a vast amount of reliable training data in
the form of quality-discriminable image pairs (DIP) can be obtained
automatically at low cost by exploiting large-scale databases with diverse
image content. We then learn an opinion-unaware BIQA (OU-BIQA, meaning that no
subjective opinions are used for training) model using RankNet, a pairwise
learning-to-rank (L2R) algorithm, from millions of DIPs, each associated with a
perceptual uncertainty level, leading to a DIP inferred quality (dipIQ) index.
Extensive experiments on four benchmark IQA databases demonstrate that dipIQ
outperforms state-of-the-art OU-BIQA models. The robustness of dipIQ is also
significantly improved as confirmed by the group MAximum Differentiation (gMAD)
competition method. Furthermore, we extend the proposed framework by learning
models with ListNet (a listwise L2R algorithm) on quality-discriminable image
lists (DIL). The resulting DIL Inferred Quality (dilIQ) index achieves an
additional performance gain.
","[{""version"":""v1"",""created"":""Sat, 13 Apr 2019 08:25:54 GMT""}]","2019-04-16"
"1904.06506","Andrej Zorko","M. Gomil\v{s}ek, R. \v{Z}itko, M. Klanj\v{s}ek, M. Pregelj, C. Baines,
  Y. Li, Q. M. Zhang, and A. Zorko","Kondo screening in a charge-insulating spinon metal","accepted for publication in Nature Physics","Nat. Phys. (2019)","10.1038/s41567-019-0536-2",,"cond-mat.str-el","http://arxiv.org/licenses/nonexclusive-distrib/1.0/","  The Kondo effect, an eminent manifestation of many-body physics in condensed
matter, is traditionally explained as exchange scattering of conduction
electrons on a spinful impurity in a metal. The resulting screening of the
impurity's local moment by the electron Fermi sea is characterized by a Kondo
temperature $T_K$, below which the system enters a non-perturbative
strongly-coupled regime. In recent years, this effect has found its
realizations beyond the bulk-metal paradigm in many other itinerant-electron
systems, such as quantum dots in semiconductor heterostructures and in
nanomaterials, quantum point contacts, and graphene. Here we report on the
first experimental observation of the Kondo screening by chargeless
quasiparticles. This occurs in a charge-insulating quantum spin liquid, where
spinon excitations forming a Fermi surface take the role of conduction
electrons. The observed impurity behaviour therefore bears a strong resemblance
to the conventional case in a metal. The discovered spinon-based Kondo effect
provides a prominent platform for characterising and possibly manipulating
enigmatic host spin liquids.
","[{""version"":""v1"",""created"":""Sat, 13 Apr 2019 08:26:25 GMT""}]","2019-05-28"
"1904.06507","Gabriel Fuhrmann","Flavia Remo, Gabriel Fuhrmann, Tobias J\""ager","On the effect of forcing of fold bifurcations and early-warning signals
  in population dynamics",,,,,"q-bio.PE math.DS","http://arxiv.org/licenses/nonexclusive-distrib/1.0/","  The classical fold bifurcation is a paradigmatic example of a critical
transition. It has been used in a variety of contexts, including in particular
ecology and climate science, to motivate the role of slow recovery rates and
increased autocorrelations as early-warning signals of such transitions.
  We study the influence of external forcing on fold bifurcations and the
respective early-warning signals. Thereby, our prime examples are
single-species population dynamical models with Allee effect under the
influence of either quasiperiodic forcing or bounded random noise. We show that
the presence of these external factors may lead to so-called non-smooth fold
bifurcations, and thereby has a significant impact on the behaviour of the
Lyapunov exponents (and hence the recovery rates). In particular, it may lead
to the absence of critical slowing down prior to population collapse. More
precisely, unlike in the unforced case, the question whether slow recovery
rates can be observed or detected prior to the transition crucially depends on
the chosen time-scales and the size of the considered data set.
","[{""version"":""v1"",""created"":""Sat, 13 Apr 2019 08:36:01 GMT""},{""version"":""v2"",""created"":""Tue, 8 Sep 2020 09:53:02 GMT""}]","2020-09-09"
"1904.06508","Tao Tu","Tao Tu, Yuan-Jui Chen, Cheng-chieh Yeh, Hung-yi Lee","End-to-end Text-to-speech for Low-resource Languages by Cross-Lingual
  Transfer Learning","Accepted to Interspeech 2019",,,,"cs.CL cs.LG cs.SD eess.AS","http://arxiv.org/licenses/nonexclusive-distrib/1.0/","  End-to-end text-to-speech (TTS) has shown great success on large quantities
of paired text plus speech data. However, laborious data collection remains
difficult for at least 95% of the languages over the world, which hinders the
development of TTS in different languages. In this paper, we aim to build TTS
systems for such low-resource (target) languages where only very limited paired
data are available. We show such TTS can be effectively constructed by
transferring knowledge from a high-resource (source) language. Since the model
trained on source language cannot be directly applied to target language due to
input space mismatch, we propose a method to learn a mapping between source and
target linguistic symbols. Benefiting from this learned mapping, pronunciation
information can be preserved throughout the transferring procedure. Preliminary
experiments show that we only need around 15 minutes of paired data to obtain a
relatively good TTS system. Furthermore, analytic studies demonstrated that the
automatically discovered mapping correlate well with the phonetic expertise.
","[{""version"":""v1"",""created"":""Sat, 13 Apr 2019 08:51:11 GMT""},{""version"":""v2"",""created"":""Tue, 2 Jul 2019 07:43:40 GMT""}]","2019-07-03"
"1904.06509","Saurav Islam Mr","Saurav Islam, Semonti Bhattacharyya, Hariharan Nhalil, Suja Elizabeth,
  and Arindam Ghosh","Signature of pseudo-diffusive transport in mesoscopic topological
  insulators","5 pages, 4 figures","Phys. Rev. Research 2, 033019 (2020)","10.1103/PhysRevResearch.2.033019",,"cond-mat.mes-hall","http://arxiv.org/licenses/nonexclusive-distrib/1.0/","  One of the unique features of Dirac Fermions is pseudo-diffusive transport by
evanescent modes at low Fermi energies when the disorder is low. At higher
Fermi energies i.e. carrier densities, the electrical transport is diffusive in
nature and the propagation occurs via plane-waves. In this study, we report the
detection of such evanescent modes in the surface states of topological
insulator through 1/f noise. While signatures of pseudo-diffusive transport
have been seen experimentally in graphene, such behavior is yet to be observed
explicitly in any other system with a Dirac dispersion. To probe this, we have
studied 1/f noise in topological insulators as a function of gate-voltage, and
temperature. Our results show a non-monotonic behavior in 1=f noise as the
Fermi energy is varied, suggesting a crossover from pseudo-diffusive to
diffusive transport regime in mesoscopic topological insulators. The
temperature dependence of noise points towards conductance fluctuations from
quantum interference as the dominant source of the noise in these samples.
","[{""version"":""v1"",""created"":""Sat, 13 Apr 2019 09:08:26 GMT""}]","2020-07-15"
"1904.06510","Nizar Demni","Nizar Demni","Generalized Stochastic areas and windings arising from Anti-de Sitter
  and Hopf fibrations","the density of the winding process in the complex projective line is
  worked out",,,,"math.PR","http://arxiv.org/licenses/nonexclusive-distrib/1.0/","  In the first part of this paper, we derive explicit expressions of the
semi-group densities of generalized stochastic areas arising from the Anti-de
Sitter and the Hopf fibrations. Motivated by the number-theoretical connection
between the Heisenberg group and Dirichlet series, we express the Mellin
transform of the generalized stochastic area corresponding to the
one-dimensional Anti de Sitter fibration as a series of Riemann Zeta function
evaluated at integers. In the second part of the paper, we focus on winding
processes around the origin in the Poincar\'e disc and in the complex
projective line. More pricesely, we derive the fixed-time marginal density of
the former process while we give a ultraspherical series expansion of the
characteristic function of the latter.
","[{""version"":""v1"",""created"":""Sat, 13 Apr 2019 09:09:02 GMT""},{""version"":""v2"",""created"":""Sun, 1 Sep 2019 19:24:31 GMT""}]","2019-09-04"
"1904.06511","Anver Hisham","Anver Hisham, Di Yuan, Erik G. Str\""om, and Fredrik Br\""annstr\""om","Joint Scheduling and Power Control for V2V Broadcast Communication with
  Adjacent Channel Interference",,,,,"eess.SP math.OC","http://creativecommons.org/licenses/by-sa/4.0/","  This paper investigates how to mitigate the impact of adjacent channel
interference (ACI) in vehicular broadcast communication, using scheduling and
power control. Our objective is to maximize the number of connected vehicles.
First, we formulate the joint scheduling and power control problem as a mixed
Boolean linear programming (MBLP) problem. From this problem formulation, we
derive scheduling alone problem as Boolean linear programming (BLP) problem,
and power control alone problem as an MBLP problem. Due to the hardness in
solving joint scheduling and power control for multiple timeslots, we propose a
column generation method to reduce the computational complexity. We also
observe that the problem is highly numerically sensitive due to the high
dynamic range of channel parameters and adjacent channel interference ratio
(ACIR) values. Therefore, we propose a novel sensitivity reduction technique,
which can compute the optimal solution. Finally, we compare the results for
optimal scheduling, near-optimal joint scheduling and power control schemes,
and conclude that the effective scheduling and power control schemes indeed
significantly improve the performance.
","[{""version"":""v1"",""created"":""Sat, 13 Apr 2019 09:18:16 GMT""}]","2019-04-16"
"1904.06512","Olivier Wittenberg","Yonatan Harpaz and Olivier Wittenberg","The Massey vanishing conjecture for number fields","33 pages; improved exposition, final version","Duke Mathematical Journal 172 (2023), no. 1, 1-41","10.1215/00127094-2022-0004",,"math.NT math.AG","http://arxiv.org/licenses/nonexclusive-distrib/1.0/","  A conjecture of Min\'a\v{c} and T\^an predicts that for any n>2, any prime p
and any field k, the Massey product of n Galois cohomology classes in
H^1(k,Z/pZ) must vanish if it is defined. We establish this conjecture when k
is a number field.
","[{""version"":""v1"",""created"":""Sat, 13 Apr 2019 09:51:00 GMT""},{""version"":""v2"",""created"":""Wed, 5 Jan 2022 09:56:29 GMT""}]","2023-02-01"
"1904.06513","Baogui Xin","Baogui Xin and Wei Peng","An Integrated Autoencoder-Based Filter for Sparse Big Data",,,,,"cs.LG","http://arxiv.org/licenses/nonexclusive-distrib/1.0/","  We propose a novel filter for sparse big data, called an integrated
autoencoder (IAE), which utilizes auxiliary information to mitigate data
sparsity. The proposed model achieves an appropriate balance between prediction
accuracy, convergence speed, and complexity. We implement experiments on a GPS
trajectory dataset, and the results demonstrate that the IAE is more accurate
and robust than some state-of-the-art methods.
","[{""version"":""v1"",""created"":""Sat, 13 Apr 2019 09:53:27 GMT""},{""version"":""v2"",""created"":""Fri, 14 Jun 2019 00:30:27 GMT""}]","2019-06-17"
"1904.06514","Fabrizio Pucci Dr.","Fabrizio Pucci, Alexander Schug","Shedding light on the dark matter of the biomolecular structural
  universe: Progress in RNA 3D structure prediction","14 pages, 4 figures",,,,"q-bio.MN physics.bio-ph q-bio.BM","http://arxiv.org/licenses/nonexclusive-distrib/1.0/","  Structured RNA plays many functionally relevant roles in molecular life.
Structural information, while required to understand the functional cycles in
detail, is challenging to gather. Computational methods promise to complement
experimental efforts by predicting three-dimensional RNA models. Here, we
provide a concise view of the state of the art methodologies with a focus on
the strengths and the weaknesses of the different approaches. Furthermore, we
analyzed the recent developments regarding the use of coevolutionary
information and how it can boost the prediction performances. We finally
discuss some open perspectives and challenges for the near future in the RNA
structural stability field.
","[{""version"":""v1"",""created"":""Sat, 13 Apr 2019 09:58:49 GMT""}]","2019-04-16"
"1904.06515","Yunhe Sheng","Jun Jiang, Satyendra Kumar Mishra, Yunhe Sheng","Hom-Lie Algebras and Hom-Lie Groups, Integration and Differentiation",,"SIGMA 16 (2020), 137, 22 pages","10.3842/SIGMA.2020.137",,"math.DG","http://creativecommons.org/licenses/by-sa/4.0/","  In this paper, we introduce the notion of a (regular) Hom-Lie group. We
associate a Hom-Lie algebra to a Hom-Lie group and show that every regular
Hom-Lie algebra is integrable. Then, we define a Hom-exponential (Hexp) map
from the Hom-Lie algebra of a Hom-Lie group to the Hom-Lie group and discuss
the universality of this Hexp map. We also describe a Hom-Lie group action on a
smooth manifold. Subsequently, we give the notion of an adjoint representation
of a Hom-Lie group on its Hom-Lie algebra. At last, we integrate the Hom-Lie
algebra $(\mathfrak{gl}(V),[\cdot,\cdot],\mathsf{Ad})$, and the derivation
Hom-Lie algebra of a Hom-Lie algebra.
","[{""version"":""v1"",""created"":""Sat, 13 Apr 2019 10:06:46 GMT""},{""version"":""v2"",""created"":""Mon, 1 Jun 2020 11:29:26 GMT""},{""version"":""v3"",""created"":""Thu, 17 Dec 2020 06:19:55 GMT""}]","2021-02-09"
"1904.06516","Boris Latosh","A.B. Arbuzov and B.N. Latosh","Gravity and Nonlinear Symmetry Realisation","Minor corrections","Universe 2020, 6(1), 12","10.3390/universe6010012",,"gr-qc hep-th","http://arxiv.org/licenses/nonexclusive-distrib/1.0/","  Application of nonlinear symmetry realisation technique to gravity is
studied. We identify the simplest extensions of the Poincare group suitable for
nonlinear realisation. Among them only one model is suitable for description of
massless spin-2 states. This model, unlike general relativity, describes states
with well-defined mass that lack a linear interaction with the matter states.
We argue that this phenomenon points on a necessity to draw a distinction
between gravitational states with well defined masses and states that
participate in interaction with matter.
","[{""version"":""v1"",""created"":""Sat, 13 Apr 2019 10:10:05 GMT""},{""version"":""v2"",""created"":""Thu, 25 Apr 2019 10:17:41 GMT""},{""version"":""v3"",""created"":""Wed, 15 Jan 2020 16:34:14 GMT""}]","2020-01-16"
"1904.06517","Marta Stepniewska-Dziubinska","Marta M. Stepniewska-Dziubinska, Piotr Zielenkiewicz and Pawel
  Siedlecki","Improving detection of protein-ligand binding sites with 3D segmentation",,"Sci Rep 10, 5035 (2020)","10.1038/s41598-020-61860-z",,"q-bio.BM cs.LG","http://arxiv.org/licenses/nonexclusive-distrib/1.0/","  In recent years machine learning (ML) took bio- and cheminformatics fields by
storm, providing new solutions for a vast repertoire of problems related to
protein sequence, structure, and interactions analysis. ML techniques, deep
neural networks especially, were proven more effective than classical models
for tasks like predicting binding affinity for molecular complex. In this work
we investigated the earlier stage of drug discovery process - finding druggable
pockets on protein surface, that can be later used to design active molecules.
For this purpose we developed a 3D fully convolutional neural network capable
of binding site segmentation. Our solution has high prediction accuracy and
provides intuitive representations of the results, which makes it easy to
incorporate into drug discovery projects. The model's source code, together
with scripts for most common use-cases is freely available at
http://gitlab.com/cheminfIBB/kalasanty
","[{""version"":""v1"",""created"":""Sat, 13 Apr 2019 10:10:55 GMT""},{""version"":""v2"",""created"":""Sat, 28 Mar 2020 13:26:25 GMT""}]","2020-03-31"
"1904.06518","O\u{g}uzhan Atabek","Oguzhan Atabek","Challenges in Integrating Technology into Education","19 pages, 4 tables","Turkish Studies - Information Technologies and Applied Sciences
  14(1) (2019) 1-19","10.7827/TurkishStudies.14810",,"cs.CY cs.HC","http://creativecommons.org/licenses/by/4.0/","  Despite significant amount of investment, there seems to be obstacles to
technology integration in education. In order to shed light on the nature of
perceived obstacles to technology integration, opinions of 117 professionals,
who were selected by Turkish Ministry of National Education as experts in their
respective fields, about the obstacles to integration of technology into
education were investigated. After categorizing the perceived obstacles by
factor analysis, associations of those categories with personal and
professional differences were further investigated for better contextualizing
the findings. Correlations were analyzed by Pearson's product moment
coefficient and point-biserial coefficient. The results revealed that it's not
the hardware itself that constitute obstacles to technology integration.
Insufficiency of in-service and pre-service training, content support, and
incentive system emerged as major perceived obstacles to technology
integration. Inadequacy of physical and technological infrastructure was also
found to be an important obstacle to successful integration. Novelty of the
technologies compared to older ones were not found to be an obstacle to
technology integration. Moreover, participants stressed the lack of education
in teacher training institutions about current technologies that Ministry of
National Education officially requires teachers to use as part of their jobs to
be another important obstacle. There were no correlations between sex, age,
level of education, job position, year of experience in other careers, and any
of the categories of perceived obstacles. However, there was a strong negative
correlation between year of experience in teaching and insufficiency of
resources. Association between year of experience in educational administration
and negative psychological state was also strong and negative.
","[{""version"":""v1"",""created"":""Sat, 13 Apr 2019 10:11:40 GMT""}]","2019-05-06"
"1904.06519","Teresa Ledwina","\'Cmiel Bogdan and Ledwina Teresa","Validation of Association","40 pages, 3 figures, 1 table",,,,"stat.ME","http://arxiv.org/licenses/nonexclusive-distrib/1.0/","  Recognizing, quantifying and visualizing associations between two variables
is increasingly important. This paper investigates how a new function-valued
measure of dependence, the quantile dependence function, can be used to
construct tests for independence and to provide an easily interpretable
diagnostic plot of existing departures from the null model. The dependence
function is designed to detect general dependence structure between variables
in quantiles of the joint distribution. It gives an insight into how the
dependence structures changes in different parts of the joint distribution. We
define new estimators of the dependence function, discuss some of their
properties, and apply them to construct new tests of independence. Numerical
evidence is given on the test's benefits against three recognized independence
tests introduced in the previous years. In real-data analysis, we illustrate
the use of our tests and the graphical presentation of the underlying
dependence structure.
","[{""version"":""v1"",""created"":""Sat, 13 Apr 2019 10:16:25 GMT""}]","2019-04-16"
"1904.06520","Jamie Hentall MacCuish","Jamie Hentall MacCuish","Costly Attention and Retirement",,,,,"econ.GN q-fin.EC","http://arxiv.org/licenses/nonexclusive-distrib/1.0/","  Most people are mistaken about the details of their pensions. Mistaken
beliefs about financially important policies imply significant informational
frictions. This paper incorporates informational friction, specifically a cost
of attention to an uncertain pension policy, into a life-cycle model of
retirement. This entails solving a dynamic rational inattention model with
endogenous heterogeneous beliefs: a significant methodological contribution in
itself. Resulting endogenous mistaken beliefs help explain a puzzle, namely
labour market exits concentrate at official retirement ages despite weak
incentives to do so. The context of the study is the UK female state pension
age (SPA) reform. I find most women are mistaken about their SPA, mistakes are
predictive of behaviour, and mistakes decrease with age. I estimate the model
using simulated method of moments. Costly attention significantly improves
model predictions of the labour supply response to the SPA whilst accommodating
the observed learning about the individual's SPA. An extension addresses
another retirement puzzle, the extremely low take-up of actuarially
advantageous deferral options. Introducing costly attention into a model with
claiming significantly increase the number of people claiming early when the
option to defer appears actuarially advantageous.
","[{""version"":""v1"",""created"":""Sat, 13 Apr 2019 10:19:46 GMT""},{""version"":""v2"",""created"":""Fri, 22 Apr 2022 16:33:23 GMT""}]","2022-04-25"
