"1904.06438","Kevin Wagner","Kevin Wagner, D\'aniel Apai, Kaitlin M. Kratter","On the Mass Function, Multiplicity, and Origins of Wide-Orbit Giant
  Planets","19 pages, 10 figures, accepted to ApJ",,"10.3847/1538-4357/ab1904",,"astro-ph.EP astro-ph.SR","http://arxiv.org/licenses/nonexclusive-distrib/1.0/","  A major outstanding question regarding the formation of planetary systems is
whether wide-orbit giant planets form differently than close-in giant planets.
We aim to establish constraints on two key parameters that are relevant for
understanding the formation of wide-orbit planets: 1) the relative mass
function and 2) the fraction of systems hosting multiple companions. In this
study, we focus on systems with directly imaged substellar companions, and the
detection limits on lower-mass bodies within these systems. First, we uniformly
derive the mass probability distributions of known companions. We then combine
the information contained within the detections and detection limits into a
survival analysis statistical framework to estimate the underlying mass
function of the parent distribution. Finally, we calculate the probability that
each system may host multiple substellar companions. We find that 1) the
companion mass distribution is rising steeply toward smaller masses, with a
functional form of $N\propto M^{-1.3\pm0.3}$, and consequently, 2) many of
these systems likely host additional undetected sub-stellar companions.
Combined, these results strongly support the notion that wide-orbit giant
planets are formed predominantly via core accretion, similar to the better
studied close-in giant planets. Finally, given the steep rise in the relative
mass function with decreasing mass, these results suggest that future deep
observations should unveil a greater number of directly imaged planets.
","[{""version"":""v1"",""created"":""Fri, 12 Apr 2019 22:39:50 GMT""},{""version"":""v2"",""created"":""Tue, 16 Apr 2019 17:26:26 GMT""},{""version"":""v3"",""created"":""Tue, 23 Apr 2019 01:19:10 GMT""},{""version"":""v4"",""created"":""Wed, 8 May 2019 17:54:32 GMT""},{""version"":""v5"",""created"":""Mon, 20 May 2019 16:17:40 GMT""},{""version"":""v6"",""created"":""Fri, 26 Jul 2019 06:23:10 GMT""}]","2019-07-29"
"1904.06439","Jesse Maassen","Vahid Askarpour, Jesse Maassen","Unusual thermoelectric transport anisotropy in quasi-2D, rhombohedral
  GeTe","11 pages, 5 figures","Phys. Rev. B 100, 075201 (2019)","10.1103/PhysRevB.100.075201",,"cond-mat.mtrl-sci","http://arxiv.org/licenses/nonexclusive-distrib/1.0/","  In this study, we calculate the $T$=300 K scattering and thermoelectric
transport properties of rhombohedral GeTe using first-principles modeling. The
room-temperature phase of GeTe has a layered structure, with cross-plane and
in-plane directions oriented parallel and perpendicular to [111], respectively.
Based on rigorous electron-phonon scattering, our transport calculations reveal
unusual anisotropic properties; n-type GeTe has a cross-plane electrical
conductivity that is roughly 3$\times$ larger than in-plane. p-type GeTe,
however, displays opposite anisotropy with in-plane conducting roughly
2$\times$ more than cross-plane, as is expected in quasi-2D materials. The
power factor shows the same anisotropy as the electrical conductivity, since
the Seebeck coefficient is relatively isotropic. Interestingly, cross-plane
n-GeTe shows the largest mobility and power factor approaching 500 cm$^2$/V-s
and 32 $\mu$W/cm-K$^2$, respectively. The thermoelectric figure-of-merit, $zT$,
is enhanced as a result of this unusual anisotropy in n-GeTe since the lattice
thermal conductivity is minimized along cross-plane. This decouples the
preferred transport directions of electrons and phonons, leading to a threefold
increase in $zT$ along cross-plane compared to in-plane. The n-type anisotropy
results from high-velocity electron states formed by Ge p-orbitals that span
across the interstitial region. This surprising behavior, that would allow the
preferential conduction direction to be controlled by doping, could be observed
in other quasi-2D materials and exploited to achieve higher-performance
thermoelectrics.
","[{""version"":""v1"",""created"":""Fri, 12 Apr 2019 22:43:09 GMT""},{""version"":""v2"",""created"":""Wed, 5 Jun 2019 15:05:31 GMT""}]","2019-08-07"
"1904.06440","Benjamin Frandsen","Benjamin A. Frandsen, Qisi Wang, Shan Wu, Jun Zhao, and Robert J.
  Birgeneau","Quantitative characterization of short-range orthorhombic fluctuations
  in FeSe through pair distribution function analysis",,"Phys. Rev. B 100, 020504 (2019)","10.1103/PhysRevB.100.020504",,"cond-mat.supr-con","http://arxiv.org/licenses/nonexclusive-distrib/1.0/","  Neutron and x-ray total scattering measurements have been performed on powder
samples of the iron chalcogenide superconductor FeSe. Using pair distribution
function (PDF) analysis of the total scattering data to investigate short-range
atomic correlations, we establish the existence of an instantaneous, local
orthorhombic structural distortion attributable to nematic fluctuations that
persists well into the high-temperature tetragonal phase, at least up to 300 K
and likely to significantly higher temperatures. This short-range orthorhombic
distortion is correlated over a length scale of about 1 nm at 300 K and grows
to several nm as the temperature is lowered toward the long-range structural
transition temperature. In the low-temperature nematic state, the local
instantaneous structure exhibits an enhanced orthorhombic distortion relative
to the average structure with a typical relaxation length of 3 nm. The
quantitative characterization of these orthorhombic fluctuations sheds light on
nematicity in this canonical iron-based superconductor.
","[{""version"":""v1"",""created"":""Fri, 12 Apr 2019 22:44:55 GMT""},{""version"":""v2"",""created"":""Tue, 23 Jul 2019 21:08:29 GMT""}]","2019-07-25"
"1904.06441","John Adler","John Adler and Mikerah Quintyne-Collins","Building Scalable Decentralized Payment Systems",,,,,"cs.CR","http://arxiv.org/licenses/nonexclusive-distrib/1.0/","  Increasing the transactional throughput of decentralized blockchains in a
secure manner has been the holy grail of blockchain research for most of the
past decade. This paper introduces a scheme for scaling blockchains while
retaining virtually identical security and decentralization, colloquially known
as optimistic rollup. We propose a layer-2 scaling technique using a
permissionless side chain with merged consensus. The side chain only supports
functionality to transact UTXOs and transfer funds to and from a parent chain
in a trust-minimized manner. Optimized implementation and engineering of client
code, along with improvements to block propagation efficiency versus currently
deployed systems, allow use of this side chain to scale well beyond the
capacities exhibited by contemporary blockchains without undue resource demands
on full nodes.
","[{""version"":""v1"",""created"":""Fri, 12 Apr 2019 22:47:00 GMT""},{""version"":""v2"",""created"":""Fri, 24 May 2019 00:46:15 GMT""},{""version"":""v3"",""created"":""Fri, 24 Jul 2020 00:46:23 GMT""}]","2020-07-27"
"1904.06442","Qiyao Wang","Qiyao Wang, Shuai Zheng, Ahmed Farahat, Susumu Serita, Chetan Gupta","Remaining Useful Life Estimation Using Functional Data Analysis","Accepted by IEEE International Conference on Prognostics and Health
  Management 2019",,,,"cs.LG stat.ML","http://arxiv.org/licenses/nonexclusive-distrib/1.0/","  Remaining Useful Life (RUL) of an equipment or one of its components is
defined as the time left until the equipment or component reaches its end of
useful life. Accurate RUL estimation is exceptionally beneficial to Predictive
Maintenance, and Prognostics and Health Management (PHM). Data driven
approaches which leverage the power of algorithms for RUL estimation using
sensor and operational time series data are gaining popularity. Existing
algorithms, such as linear regression, Convolutional Neural Network (CNN),
Hidden Markov Models (HMMs), and Long Short-Term Memory (LSTM), have their own
limitations for the RUL estimation task. In this work, we propose a novel
Functional Data Analysis (FDA) method called functional Multilayer Perceptron
(functional MLP) for RUL estimation. Functional MLP treats time series data
from multiple equipment as a sample of random continuous processes over time.
FDA explicitly incorporates both the correlations within the same equipment and
the random variations across different equipment's sensor time series into the
model. FDA also has the benefit of allowing the relationship between RUL and
sensor variables to vary over time. We implement functional MLP on the
benchmark NASA C-MAPSS data and evaluate the performance using two
popularly-used metrics. Results show the superiority of our algorithm over all
the other state-of-the-art methods.
","[{""version"":""v1"",""created"":""Fri, 12 Apr 2019 22:48:49 GMT""}]","2019-04-16"
"1904.06443","Benjamin Blum-Smith","Ben Blum-Smith","A rotation group whose subspace arrangement is not from a real
  reflection group","6 pages, no figures","Linear Algebra and Its Applications 581 (2019) 405--412","10.1016/j.laa.2019.07.030",,"math.CO math.GR","http://arxiv.org/licenses/nonexclusive-distrib/1.0/","  We exhibit a family of real rotation groups whose subspace arrangements are
not contained in that of any real reflection group, answering a question of
Martino and Singh.
","[{""version"":""v1"",""created"":""Fri, 12 Apr 2019 22:48:52 GMT""},{""version"":""v2"",""created"":""Thu, 18 Apr 2019 11:42:31 GMT""}]","2021-10-12"
"1904.06444","Benjamin Ueland","Bing Li, Y. Sizyuk, N. S. Sangeetha, J. M. Wilde, P. Das, W. Tian, D.
  C. Johnston, A. I. Goldman, A. Kreyssig, P. P. Orth, R. J. McQueeney, B. G.
  Ueland","Antiferromagnetic Stacking of Ferromagnetic Layers and Doping Controlled
  Phase Competition in Ca$_{1-x}$Sr$_{x}$Co$_{2-y}$As$_{2}$",,"Phys. Rev. B 100, 024415 (2019)","10.1103/PhysRevB.100.024415",,"cond-mat.str-el","http://arxiv.org/licenses/nonexclusive-distrib/1.0/","  In search of a quantum phase transition between the two-dimensional ($2$D)
ferromagnetism of CaCo$_{2-y}$As$_{2}$ and stripe-type antiferromagnetism in
SrCo$_{2}$As$_{2}$, we rather find evidence for $1$D magnetic frustration
between magnetic square Co layers. We present neutron diffraction data for
Ca$_{1-x}$Sr$_{x}$Co$_{2-y}$As$_{2}$ that reveal a sequence of $x$-dependent
magnetic transitions which involve different stacking of $2$D
ferromagnetically-aligned layers with different magnetic anisotropy. We explain
the $x$-dependent changes to the magnetic order by utilizing classical
analytical calculations of a $1$D Heisenberg model where single-ion magnetic
anisotropy and frustration of antiferromagnetic nearest- and next-nearest-layer
exchange are all composition dependent.
","[{""version"":""v1"",""created"":""Fri, 12 Apr 2019 22:55:55 GMT""},{""version"":""v2"",""created"":""Mon, 15 Jul 2019 17:55:37 GMT""}]","2019-07-16"
"1904.06445","Olle Heinonen","Raghuveer Chimata, Hyeondeok Shin, Anouar Benali, and Olle Heinonen","Defect energetics of cubic hafnia from quantum Monte Carlo simulations",,"Phys. Rev. Materials 3, 075005 (2019)","10.1103/PhysRevMaterials.3.075005",,"cond-mat.mtrl-sci","http://arxiv.org/licenses/nonexclusive-distrib/1.0/","  Cubic hafnia (HfO$_2$) is of great interest for a number of applications in
electronics because of its high dielectric constant. However, common defects in
such applications degrade the properties of hafina. We have investigated the
electronic properties of oxygen vacancies and nitrogen substitution in cubic
HfO$_2$ using first principles calculations based on density functional theory
(DFT) and many-body diffusion Monte Carlo (DMC) methods. We investigate five
different charge defect states of oxygen vacancies, as well as substitutional N
defects which can lead to local magnetic moments. Both DMC and DFT calculations
shows that an oxygen vacancy induces strong lattice relaxations around the
defect. Finally, we compare defect formation energies, charge and spin
densities obtained from DMC with results obtained using DFT. While the obtained
formation energies from DMC are 0.6~eV -- 1.5~eV larger than those from GGA+U,
the agreement for the most important defects, neutral and positively charged
oxygen vacancies, and nitrogen substitutional defect, under oxygen-poor
conditions are in reasonably good agreement. Our work confirms that nitrogen
can act to passivate cubic hafnia for applications in electronics.
","[{""version"":""v1"",""created"":""Fri, 12 Apr 2019 23:02:29 GMT""}]","2019-07-31"
"1904.06446","Liming Yang","John B. Conway and Liming Yang","Approximation in the mean by rational functions",,,,,"math.FA","http://arxiv.org/licenses/nonexclusive-distrib/1.0/","  For $1\le t < \infty$, a compact subset $K\subset\mathbb C$, and a finite
positive measure $\mu$ supported on $K$, $R^t(K, \mu)$ denotes the closure in
$L^t(\mu)$ of rational functions with poles off $K$. Let $\text{abpe}(R^t(K,
\mu))$ denote the set of analytic bounded point evaluations. The objective of
this paper is to describe the structure of $R^t(K, \mu)$. In the work of
Thomson on describing the closure in $L^t(\mu)$ of analytic polynomials,
$P^t(\mu)$, the existence of analytic bounded point evaluations plays critical
roles, while $\text{abpe}(R^t(K, \mu))$ may be empty. We introduce the concept
of non-removable boundary $\mathcal F$ such that the removable set $\mathcal R
= K\setminus \mathcal F$ contains $\text{abpe}(R^t(K, \mu))$. Recent remarkable
developments in analytic capacity and Cauchy transform provide us the necessary
tools to describe $\mathcal F$ and obtain structural results for $R^t(K, \mu)$.
  Assume that $R^t(K, \mu)$ does not have a direct $L^t$ summand. Let
$H^\infty_{\mathcal R}(\mathcal L^2_{\mathcal R})$ be the weak$^*$ closure in
$L^\infty (\mathcal L^2_{\mathcal R})$ of the functions that are bounded
analytic off compact subsets of $\mathcal F$, where $\mathcal L^2_{\mathcal R}$
denotes the planar Lebesgue measure restricted to $\mathcal R$. We prove that
the identity map ($r\rightarrow r$, $r$ is a rational function with poles off
$K$) extends an isometric isomorphism and a weak$^*$ homeomorphism from $R^t(K,
\mu)\cap L^\infty(\mu )$ onto $H^\infty_{\mathcal R}(\mathcal L^2_{\mathcal R
})$.
  Consequently, we show that a decomposition theorem (Main Theorem II) of
$R^t(K, \mu)$ holds for an arbitrary compact subset $K$ and a finite positive
measure $\mu$ supported on $K$, which extends the central results regarding
$P^t(\mu)$.
","[{""version"":""v1"",""created"":""Fri, 12 Apr 2019 23:09:22 GMT""},{""version"":""v2"",""created"":""Fri, 19 Apr 2019 00:58:29 GMT""},{""version"":""v3"",""created"":""Wed, 24 Apr 2019 01:26:23 GMT""},{""version"":""v4"",""created"":""Mon, 11 Nov 2019 09:12:17 GMT""},{""version"":""v5"",""created"":""Sat, 16 Nov 2019 20:29:19 GMT""},{""version"":""v6"",""created"":""Mon, 7 Sep 2020 04:42:42 GMT""}]","2020-09-08"
"1904.06447","Kyle Genova","Kyle Genova, Forrester Cole, Daniel Vlasic, Aaron Sarna, William T.
  Freeman, Thomas Funkhouser","Learning Shape Templates with Structured Implicit Functions","12 pages, 9 figures, 4 tables",,,,"cs.CV cs.GR","http://arxiv.org/licenses/nonexclusive-distrib/1.0/","  Template 3D shapes are useful for many tasks in graphics and vision,
including fitting observation data, analyzing shape collections, and
transferring shape attributes. Because of the variety of geometry and topology
of real-world shapes, previous methods generally use a library of hand-made
templates. In this paper, we investigate learning a general shape template from
data. To allow for widely varying geometry and topology, we choose an implicit
surface representation based on composition of local shape elements. While long
known to computer graphics, this representation has not yet been explored in
the context of machine learning for vision. We show that structured implicit
functions are suitable for learning and allow a network to smoothly and
simultaneously fit multiple classes of shapes. The learned shape template
supports applications such as shape exploration, correspondence, abstraction,
interpolation, and semantic segmentation from an RGB image.
","[{""version"":""v1"",""created"":""Fri, 12 Apr 2019 23:15:47 GMT""}]","2019-04-16"
"1904.06448","Tineke L. Van Den Berg","T. L. van den Berg and P. Samuelsson","Charge-photon transport statistics and short-time correlations in a
  single quantum dot-resonator system with arbitrarily large coupling parameter","13 pages, 5 figures","Phys. Rev. B 100, 035408 (2019)","10.1103/PhysRevB.100.035408",,"cond-mat.mes-hall quant-ph","http://arxiv.org/licenses/nonexclusive-distrib/1.0/","  Electrical quantum conductors coupled to microwave resonators have in the
last decade emerged as a versatile testbed for controllable light-matter
interaction on the nanometer scale. Recent experimental progress with high
impedance resonators has resulted in conductor-resonator systems with a large,
dimensionless coupling parameter $\lambda \gtrsim 0.1$, well beyond the small
coupling regime $\lambda \ll 1$. Motivated by this progress, we here analyse
theoretically the joint statistics of transported electrons and emitted photons
in a single level quantum dot coupled to a microwave resonator, for arbitrarily
large $\lambda$. Describing the electron-photon dynamics via a number-resolved
master equation, we evaluate the joint long-time probability distribution as
well as joint short-time, $g^{(2)}(t)$, correlation functions. Considering the
high-bias regime, with sequential electron tunneling and working in the damping
basis, allows us to obtain analytical results for both transport cumulants and
$g^{(2)}(t)$ functions. It is found that the photons emitted out of the
resonator are bunched and display a super-Poissonian statistics, for all system
parameters. However, the electron transport properties are found to be
unaffected by the coupling to the resonator, anti-bunched and with
sub-Poissonian statistics. From the joint distribution we identify regimes of
electron tunneling induced photon cascades and very large $g^{(2)}(t)$
functions. All $g^{(2)}(t)$-functions are found to be independent of $\lambda$.
We also identify conditions for and transport signatures of a thermal resonator
photon state.
","[{""version"":""v1"",""created"":""Fri, 12 Apr 2019 23:27:23 GMT""}]","2019-07-17"
"1904.06449","Ryan Rossi","John Boaz Lee, Giang Nguyen, Ryan A. Rossi, Nesreen K. Ahmed, Eunyee
  Koh, and Sungchul Kim","Dynamic Node Embeddings from Edge Streams","IEEE Transactions on Emerging Topics in Computational Intelligence
  (TETIC)",,,,"cs.LG cs.AI cs.SI stat.ML","http://arxiv.org/licenses/nonexclusive-distrib/1.0/","  Networks evolve continuously over time with the addition, deletion, and
changing of links and nodes. Such temporal networks (or edge streams) consist
of a sequence of timestamped edges and are seemingly ubiquitous. Despite the
importance of accurately modeling the temporal information, most embedding
methods ignore it entirely or approximate the temporal network using a sequence
of static snapshot graphs. In this work, we propose using the notion of
temporal walks for learning dynamic embeddings from temporal networks. Temporal
walks capture the temporally valid interactions (e.g., flow of information,
spread of disease) in the dynamic network in a lossless fashion. Based on the
notion of temporal walks, we describe a general class of embeddings called
continuous-time dynamic network embeddings (CTDNEs) that completely avoid the
issues and problems that arise when approximating the temporal network as a
sequence of static snapshot graphs. Unlike previous work, CTDNEs learn dynamic
node embeddings directly from the temporal network at the finest temporal
granularity and thus use only temporally valid information. As such CTDNEs
naturally support online learning of the node embeddings in a streaming
real-time fashion. Finally, the experiments demonstrate the effectiveness of
this class of embedding methods that leverage temporal walks as it achieves an
average gain in AUC of 11.9% across all methods and graphs.
","[{""version"":""v1"",""created"":""Fri, 12 Apr 2019 23:44:25 GMT""},{""version"":""v2"",""created"":""Fri, 17 Jul 2020 15:44:02 GMT""}]","2020-07-20"
"1904.06450","Dominique Maldague","Dominique Maldague","Regularized Brascamp-Lieb inequalities and an application",,,,,"math.CA","http://arxiv.org/licenses/nonexclusive-distrib/1.0/","  We present a regularized version of H\""{o}lder-Brascamp-Lieb inequalities
studied by Bennett, Carbery, Christ, and Tao. These inequalities lead to a
generalization of the multilinear Kakeya inequality.
","[{""version"":""v1"",""created"":""Fri, 12 Apr 2019 23:46:46 GMT""},{""version"":""v2"",""created"":""Mon, 26 Aug 2019 18:08:20 GMT""},{""version"":""v3"",""created"":""Sat, 19 Sep 2020 20:35:19 GMT""},{""version"":""v4"",""created"":""Fri, 5 Feb 2021 17:53:02 GMT""}]","2021-02-08"
"1904.06451","Yuetsu Kodama","Yuetsu Kodama, Tetsuya Odajima, Akira Asato and Mitsuhisa Sato","Evaluation of the RIKEN Post-K Processor Simulator","6 pages, 5 figures",,,,"cs.DC","http://arxiv.org/licenses/nonexclusive-distrib/1.0/","  For the purpose of developing applications for Post-K at an early stage,
RIKEN has developed a post-K processor simulator. This simulator is based on
the general-purpose processor simulator gem5. It does not simulate the actual
hardware of a post-K processor. However, we believe that sufficient simulation
accuracy can be obtained since it simulates the instruction pipeline of
out-of-order execution with cycle-level accuracy along with performing detailed
parameter tuning of out-of-order resources and function expansion of
cache/memory hierarchy. In this simulator, we aim to estimate the execution
cycles of one node application on a post-K processor with accuracy that enables
relative evaluation and application tuning. In this paper, we show the details
of the implementation of this simulator and verify its accuracy compared with
that of a post-K test chip.
","[{""version"":""v1"",""created"":""Sat, 13 Apr 2019 00:11:43 GMT""}]","2019-04-16"
"1904.06452","Zixiang Liu","Zixiang Liu, Jonathan R. Clausen, Rekha R. Rao, Cyrus K. Aidun","Nanoparticle diffusion in sheared cellular blood flow",,"Journal of Fluid Mechanics 871 (2019): 636-667","10.1017/jfm.2019.320",,"physics.bio-ph cond-mat.soft physics.comp-ph physics.flu-dyn","http://arxiv.org/licenses/nonexclusive-distrib/1.0/","  Using a multiscale blood flow solver, the complete diffusion tensor of
nanoparticle (NP) in sheared cellular blood flow is calculated over a wide
range of shear rate and haematocrit. In the short-time regime, NPs exhibit
anomalous dispersive behaviors under high shear and high haematocrit due to the
transient elongation and alignment of the red blood cells (RBCs). In the
long-time regime, the NP diffusion tensor features high anisotropy.
Particularly, there exists a critical shear rate ($\sim$100 $s^{-1}$) around
which the shear-rate dependence of the diffusivity tensor changes from linear
to nonlinear scale. Above the critical shear rate, the cross-stream diffusivity
terms vary sublinearly with shear rate, while the longitudinal term varies
superlinearly. The dependence on haematocrit is linear in general except at
high shear rates, where a sublinear scale is found for the vorticity term and a
quadratic scale for the longitudinal term. Through analysis of the suspension
microstructure and numerical experiments, the nonlinear hemorheological
dependence of the NP diffusion tensor is attributed to the streamwise
elongation and cross-stream contraction of RBCs under high shear, quantified by
a Capillary number. The RBC size is shown to be the characteristic length scale
affecting the RBC-enhanced shear-induced diffusion (RESID), while the NP size
at submicron exhibits negligible influence on the RESID. Based on the observed
scaling behaviors, empirical correlations are proposed to bridge the NP
diffusion tensor to specific shear rate and haematocrit. The characterized NP
diffusion tensor provides a constitutive relation that can lead to more
effective continuum models to tackle large-scale NP biotransport applications.
","[{""version"":""v1"",""created"":""Sat, 13 Apr 2019 00:14:48 GMT""},{""version"":""v2"",""created"":""Thu, 9 May 2019 20:16:13 GMT""},{""version"":""v3"",""created"":""Tue, 11 Jun 2019 11:22:45 GMT""}]","2019-06-12"
"1904.06453","Kamran Karimi","Kamran Karimi","Self-diffusion in plastic flow of amorphous solids",,"Phys. Rev. E 100, 063003 (2019)","10.1103/PhysRevE.100.063003",,"cond-mat.soft","http://arxiv.org/licenses/nonexclusive-distrib/1.0/","  We report on a particle-based numerical study of sheared amorphous solids in
the dense slow flow regime. In this framework, deformation and flow are
accompanied by critical fluctuation patterns associated with the macroscopic
plastic response and single particle kinematics. The former is commonly
attributed to the collective slip patterns that relax internal stresses within
the bulk material and give rise to an effective mechanical noise governing the
latter particle-level process. In this work, the avalanche-type dynamics
between plastic events is shown to have a strong relevance on the
self-diffusion of tracer particles in the Fickian regime. As a consequence,
strong size effects emerge in the effective diffusion coefficient that is
rationalized in terms of avalanche size distributions and the relevant temporal
occurrence.
","[{""version"":""v1"",""created"":""Sat, 13 Apr 2019 00:21:04 GMT""}]","2020-01-08"
