"1903.00778","Yiwei Sun","Yiwei Sun, David Holec, Dominik N\""oger, David Dunstan and Colin
  Humphreys","Disruption of the $sp^2$ bonding by the compression of the
  $\pi$-electronic orbitals of graphene at various stacking orders","6 pages, 5 figures","Phys. Rev. B 101, 125421 (2020)","10.1103/PhysRevB.101.125421",,"cond-mat.mtrl-sci","http://arxiv.org/licenses/nonexclusive-distrib/1.0/","  We investigate the behaviour of the $\pi$-electrons under compression and the
effect of the stacking order of graphene layers. First we find that electrons
can hardly be squeezed through the $sp^2$ network, regardless of the stacking
order. The largely deformed electronic orbitals (mainly those of
$\pi$-electrons) under compression along the $\textit{c}$-axis increase
interlayer interaction between graphene layers as expected, but surprisingly in
a similar way for the A-A and Bernal stacking. On the other hand, the large
out-of-plane compression shifts the in-plane phonon frequencies of A-A stacked
graphene layers significantly and very differently from Bernal stacked layers.
We attribute these results to the $sp^2$-electrons filling the low-density
central area in a carbon hexagon under compression for the A-A stacking, hence
resulting in a non-monotonic change of the $sp^2$-bonding. The results strongly
suggest not to ignore 3D features of a 2D material.
","[{""version"":""v1"",""created"":""Sat, 2 Mar 2019 22:17:57 GMT""}]","2020-03-25"
"1903.00779","Fritz Gesztesy","Fritz Gesztesy and Alexander Sakhnovich","The inverse approach to Dirac-type systems based on the $A$-function
  concept","30 pages",,,,"math.SP","http://arxiv.org/licenses/nonexclusive-distrib/1.0/","  The principal objective in this paper is a new inverse approach to general
Dirac-type systems modeled after B. Simon's 1999 inverse approach to half-line
Schr\""odinger operators. In particular, we derive the so-called A-equation
associated to Dirac-type systems and, given a fundamental positivity condition,
we prove that this integro-differential equation for A is uniquely solvable. We
show how to recover the matrix-valued potential coefficient from A. This
approach is also applicable to matrix-valued Schr\""odinger operators on a
half-line.
","[{""version"":""v1"",""created"":""Sat, 2 Mar 2019 22:24:48 GMT""}]","2019-03-05"
"1903.00780","Alex Beutel","Alex Beutel, Jilin Chen, Tulsee Doshi, Hai Qian, Li Wei, Yi Wu, Lukasz
  Heldt, Zhe Zhao, Lichan Hong, Ed H. Chi, Cristos Goodrow","Fairness in Recommendation Ranking through Pairwise Comparisons",,,,,"cs.CY cs.AI cs.IR cs.LG stat.ML","http://arxiv.org/licenses/nonexclusive-distrib/1.0/","  Recommender systems are one of the most pervasive applications of machine
learning in industry, with many services using them to match users to products
or information. As such it is important to ask: what are the possible fairness
risks, how can we quantify them, and how should we address them? In this paper
we offer a set of novel metrics for evaluating algorithmic fairness concerns in
recommender systems. In particular we show how measuring fairness based on
pairwise comparisons from randomized experiments provides a tractable means to
reason about fairness in rankings from recommender systems. Building on this
metric, we offer a new regularizer to encourage improving this metric during
model training and thus improve fairness in the resulting rankings. We apply
this pairwise regularization to a large-scale, production recommender system
and show that we are able to significantly improve the system's pairwise
fairness.
","[{""version"":""v1"",""created"":""Sat, 2 Mar 2019 22:29:42 GMT""}]","2019-03-12"
"1903.00781","George Pavlov","George G. Pavlov, Jeremy Hare, and Oleg Kargaltsev","High-speed Ejecta from the Gamma-ray Binary PSR B1259-63/LS 2883","Published in ""Rendiconti Lincei. Scienze Fisiche e Naturali''. The
  final authenticated version is available online at
  \url{http://link.springer.com/article/10.1007/s12210-019-00765-0}. Based on
  presentation at the Conference on Gamma-Ray Astrophysics with the AGILE
  Satellite held at Accademia Nazionale dei Lincei and Agenzia Spaziale
  Italiana, Rome on December 11-13, 2017",,"10.1007/s12210-019-00765-0",,"astro-ph.HE","http://arxiv.org/licenses/nonexclusive-distrib/1.0/","  Observing the famous high-mass, eccentric X-ray and gamma-ray binary PSR
B1259-63/LS 2883 with Chandra, we detected X-ray emitting clumps moving from
the binary with speeds of about 0.1 of the speed of light, possibly with
acceleration. The clumps are being ejected at least once per binary period, 3.4
years, presumably around binary periastrons. The power-law spectra of the
clumps can be interpreted as synchrotron emission of relativistic electrons.
Here we report the results of 8 observations of the clumps in 2011-2017 (two
binary cycles) and discuss possible interpretations of this unique phenomenon.
","[{""version"":""v1"",""created"":""Sat, 2 Mar 2019 22:31:50 GMT""}]","2019-03-05"
"1903.00782","Shehryar Khattak","Shehryar Khattak, Christos Papachristos, Kostas Alexis","Marker based Thermal-Inertial Localization for Aerial Robots in
  Obscurant Filled Environments","10 pages, 5 figures, Published in International Symposium on Visual
  Computing 2018",,"10.1007/978-3-030-03801-4_49",,"cs.RO cs.CV","http://arxiv.org/licenses/nonexclusive-distrib/1.0/","  For robotic inspection tasks in known environments fiducial markers provide a
reliable and low-cost solution for robot localization. However, detection of
such markers relies on the quality of RGB camera data, which degrades
significantly in the presence of visual obscurants such as fog and smoke. The
ability to navigate known environments in the presence of obscurants can be
critical for inspection tasks especially, in the aftermath of a disaster.
Addressing such a scenario, this work proposes a method for the design of
fiducial markers to be used with thermal cameras for the pose estimation of
aerial robots. Our low cost markers are designed to work in the long wave
infrared spectrum, which is not affected by the presence of obscurants, and can
be affixed to any object that has measurable temperature difference with
respect to its surroundings. Furthermore, the estimated pose from the fiducial
markers is fused with inertial measurements in an extended Kalman filter to
remove high frequency noise and error present in the fiducial pose estimates.
The proposed markers and the pose estimation method are experimentally
evaluated in an obscurant filled environment using an aerial robot carrying a
thermal camera.
","[{""version"":""v1"",""created"":""Sat, 2 Mar 2019 22:33:02 GMT""}]","2019-03-05"
"1903.00783","Leon Lampret","Leon Lampret","Chain complex reduction via fast digraph traversal","24 pages, 14 figures, tests of implementation efficiency",,,,"math.AT","http://arxiv.org/licenses/nonexclusive-distrib/1.0/","  Reducing a chain complex (whilst preserving its homotopy-type) using
algebraic Morse theory gives the same end-result as Gaussian elimination, but
AMT does it only on certain rows/columns and with several pivots (in all
matrices simultaneously). Crucially, instead of doing costly row/column
operations on a sparse matrix, it computes traversals of a bipartite digraph.
This significantly reduces the running time and memory load (smaller fill-in
and coefficient growth of the matrices). However, computing with AMT requires
the construction of a valid set of pivots (called a Morse matching).
  We discover a family of Morse matchings on any chain complex of free modules
of finite rank. We show that every acyclic matching is a subset of some member
of our family, so all maximal Morse matchings are of this type.
  Both the input and output of AMT are chain complexes, so the procedure can be
used iteratively. When working over a field or a local PID, this process ends
in a chain complex with zero matrices, which produces homology. However, even
over more general rings, the process often reveals homology, or at least
reduces the complex so much that other algorithms can finish the job. Moreover,
it also returns homotopy equivalences to the reduced complexes, which reveal
the generators of the homology and the induced maps $H_\ast(\varphi)$.
  We design a new algorithm for reducing a chain complex and implement it. We
test that it outperforms other CASs. As a special case, given a sparse matrix
over any field, the algorithm offers a new way of computing the rank and a
sparse basis of the kernel (or null space), cokernel (or quotient space, or
complementary subspace), image, preimage, sum and intersection subspace. It
outperforms built-in algorithms in other CASs.
","[{""version"":""v1"",""created"":""Sat, 2 Mar 2019 22:36:55 GMT""},{""version"":""v2"",""created"":""Thu, 1 Oct 2020 22:30:11 GMT""}]","2020-10-05"
"1903.00784","Joseph Suarez","Joseph Suarez, Yilun Du, Phillip Isola, Igor Mordatch","Neural MMO: A Massively Multiagent Game Environment for Training and
  Evaluating Intelligent Agents",,,,,"cs.MA cs.LG stat.ML","http://arxiv.org/licenses/nonexclusive-distrib/1.0/","  The emergence of complex life on Earth is often attributed to the arms race
that ensued from a huge number of organisms all competing for finite resources.
We present an artificial intelligence research environment, inspired by the
human game genre of MMORPGs (Massively Multiplayer Online Role-Playing Games,
a.k.a. MMOs), that aims to simulate this setting in microcosm. As with MMORPGs
and the real world alike, our environment is persistent and supports a large
and variable number of agents. Our environment is well suited to the study of
large-scale multiagent interaction: it requires that agents learn robust combat
and navigation policies in the presence of large populations attempting to do
the same. Baseline experiments reveal that population size magnifies and
incentivizes the development of skillful behaviors and results in agents that
outcompete agents trained in smaller populations. We further show that the
policies of agents with unshared weights naturally diverge to fill different
niches in order to avoid competition.
","[{""version"":""v1"",""created"":""Sat, 2 Mar 2019 22:42:33 GMT""}]","2019-03-05"
"1903.00785","Michael Overton","Anne Greenbaum, Ren-cang Li, Michael L. Overton","First-order Perturbation Theory for Eigenvalues and Eigenvectors",,,,,"math.NA cs.NA","http://arxiv.org/licenses/nonexclusive-distrib/1.0/","  We present first-order perturbation analysis of a simple eigenvalue and the
corresponding right and left eigenvectors of a general square matrix, not
assumed to be Hermitian or normal. The eigenvalue result is well known to a
broad scientific community. The treatment of eigenvectors is more complicated,
with a perturbation theory that is not so well known outside a community of
specialists. We give two different proofs of the main eigenvector perturbation
theorem. The first, a block-diagonalization technique inspired by the numerical
linear algebra research community and based on the implicit function theorem,
has apparently not appeared in the literature in this form. The second, based
on complex function theory and on eigenprojectors, as is standard in analytic
perturbation theory, is a simplified version of well-known results in the
literature. The second derivation uses a convenient normalization of the right
and left eigenvectors defined in terms of the associated eigenprojector, but
although this dates back to the 1950s, it is rarely discussed in the
literature. We then show how the eigenvector perturbation theory is easily
extended to handle other normalizations that are often used in practice. We
also explain how to verify the perturbation results computationally. We
conclude with some remarks about difficulties introduced by multiple
eigenvalues and give references to work on perturbation of invariant subspaces
corresponding to multiple or clustered eigenvalues. Throughout the paper we
give extensive bibliographic commentary and references for further reading.
","[{""version"":""v1"",""created"":""Sat, 2 Mar 2019 22:51:22 GMT""},{""version"":""v2"",""created"":""Mon, 3 Jun 2019 14:27:28 GMT""}]","2019-06-04"
"1903.00786","Christopher Holloway","Christopher L. Holloway, Matthew T. Simons, Abdulaziz H. Haddab,
  Joshua A. Gordon, and Stephen D. Voran","A Multiple-Band Rydberg-Atom Based Receiver/Antenna: AM/FM Stereo
  Reception","10 pages, 9 figures, 1 Table, and 32 references",,"10.1109/MAP.2020.2976914",,"physics.atom-ph","http://arxiv.org/licenses/nonexclusive-distrib/1.0/","  With the re-definition of the International System of Units (SI) that
occurred in October of 2018, there has recently been a great deal of attention
on the development of atom-based sensors for metrology applications. In
particular, great progress has been made in using Rydberg-atom based techniques
for electric (E) field metrology. These Rydberg-atom based E-field sensors have
made it possible to develop atom-based receivers and antennas, which
potentially have many benefits over conventional technologies in detecting and
receiving modulated signals. In this paper, we demonstrate the ``first''
multi-channel atom-based reception of both amplitude (AM) and frequency (FM)
modulation signals. We demonstrate this by using two different atomic species
in order to detect and receive AM and FM modulated signals in stereo. Also, in
this paper we investigate the effect of Gaussian noise on the ability to
receive AM/FM signals. These results illustrate the multi-band (or
multi-channel) receiving capability of a atom-based receiver/antenna to produce
high fidelity stereo reception from both AM and FM signals. This paper shows an
interesting way of applying the relatively newer (and something esoteric) field
of quantum-optics and atomic-physics to the century old topic of radio
reception.
","[{""version"":""v1"",""created"":""Sat, 2 Mar 2019 22:56:30 GMT""}]","2021-08-31"
"1903.00787","Guanghao Hong","Guanghao Hong and Yu Yuan","Maximal hypersurfaces over exterior domains","24 pages, 1 figure","Comm. Pure Appl. Math. 2020",,,"math.AP math.DG","http://arxiv.org/licenses/nonexclusive-distrib/1.0/","  In this paper, we study the exterior problem for the maximal surface
equation. We obtain the precise asymptotic behavior of the exterior solution at
infinity. And we prove that the exterior Dirichlet problem is uniquely solvable
given admissible boundary data and prescribed asymptotic behavior at infinity.
","[{""version"":""v1"",""created"":""Sat, 2 Mar 2019 23:08:05 GMT""}]","2020-01-17"
"1903.00788","Ayush Jaiswal","Ayush Jaiswal, Yue Wu, Wael AbdAlmageed, Iacopo Masi, Premkumar
  Natarajan","AIRD: Adversarial Learning Framework for Image Repurposing Detection","Camera-ready version for the IEEE Conference on Computer Vision and
  Pattern Recognition (CVPR), 2019",,,,"cs.CV cs.LG","http://arxiv.org/licenses/nonexclusive-distrib/1.0/","  Image repurposing is a commonly used method for spreading misinformation on
social media and online forums, which involves publishing untampered images
with modified metadata to create rumors and further propaganda. While manual
verification is possible, given vast amounts of verified knowledge available on
the internet, the increasing prevalence and ease of this form of semantic
manipulation call for the development of robust automatic ways of assessing the
semantic integrity of multimedia data. In this paper, we present a novel method
for image repurposing detection that is based on the real-world adversarial
interplay between a bad actor who repurposes images with counterfeit metadata
and a watchdog who verifies the semantic consistency between images and their
accompanying metadata, where both players have access to a reference dataset of
verified content, which they can use to achieve their goals. The proposed
method exhibits state-of-the-art performance on location-identity,
subject-identity and painting-artist verification, showing its efficacy across
a diverse set of scenarios.
","[{""version"":""v1"",""created"":""Sat, 2 Mar 2019 23:14:58 GMT""},{""version"":""v2"",""created"":""Wed, 6 Mar 2019 16:10:51 GMT""},{""version"":""v3"",""created"":""Tue, 9 Apr 2019 21:17:49 GMT""}]","2019-04-11"
"1903.00789","Guanghao Hong","Guanghao Hong","Remarks on area maximizing hypersurfaces over
  $\mathbb{R}^n\backslash\{0\}$ and exterior domains","8 pages",,,,"math.AP math.DG","http://arxiv.org/licenses/nonexclusive-distrib/1.0/","  In this note, we provide a complete classification for entire area maximizing
hypersurfaces having an isolated singularity. We also construct an interesting
illustrated example. For area maximizing hypersurfaces over exterior domains,
we obtain a partial result on their asymptotic behavior at infinity. We also
establish the solvability of exterior Dirichlet problems for area maximizing
hypersurfaces.
","[{""version"":""v1"",""created"":""Sat, 2 Mar 2019 23:17:07 GMT""}]","2019-03-05"
"1903.00790","Taewoon Kong","Taewoon Kong and Brani Vidakovic","Non-decimated Quaternion Wavelet Spectral Tools with Applications","29 pages",,,,"stat.AP","http://arxiv.org/licenses/nonexclusive-distrib/1.0/","  Quaternion wavelets are redundant wavelet transforms generalizing
complex-valued non-decimated wavelet transforms. In this paper we propose a
matrix-formulation for non-decimated quaternion wavelet transforms and define
spectral tools for use in machine learning tasks. Since quaternionic algebra is
an extension of complex algebra, quaternion wavelets bring redundancy in the
components that proves beneficial in wavelet based tasks. Specifically, the
wavelet coefficients in the decomposition are quaternion-valued numbers that
define the modulus and three phases.
  The novelty of this paper is definition of non-decimated quaternion wavelet
spectra based on the modulus and phase-dependent statistics as low-dimensional
summaries for 1-D signals or 2-D images. A structural redundancy in
non-decimated wavelets and a componential redundancy in quaternion wavelets are
linked to extract more informative features. In particular, we suggest an
improved way of classifying signals and images based on their scaling indices
in terms of spectral slopes and information contained in the three quaternionic
phases. We show that performance of the proposed method significantly improves
when compared to the standard versions of wavelets including the complex-valued
wavelets.
  To illustrate performance of the proposed spectral tools we provide two
examples of application on real-data problems: classification of sounds using
scaling in high-frequency recordings over time and monitoring of steel rolling
process using the fractality of captured digitized images. The proposed tools
are compared with the counterparts based on standard wavelet transforms.
","[{""version"":""v1"",""created"":""Sat, 2 Mar 2019 23:31:38 GMT""}]","2019-03-05"
"1903.00791","Matthias Ikeda","Matthias S. Ikeda, Joshua A.W. Straquadine, Alexander T. Hristov,
  Thanapat Worasaran, Johanna C. Palmstrom, Matthew Sorensen, Philip Walmsley,
  Ian R. Fisher","AC Elastocaloric effect as a probe for thermodynamic signatures of
  continuous phase transitions","13 pages, 11 figures",,"10.1063/1.5099924",,"cond-mat.mtrl-sci","http://arxiv.org/licenses/nonexclusive-distrib/1.0/","  Studying the response of materials to strain can elucidate subtle properties
of electronic structure in strongly correlated materials. So far, mostly the
relation between strain and resistivity, the so called elastoresistivity, has
been investigated. The elastocaloric effect is a second rank tensor quantity
describing the relation between entropy and strain. In contrast to the
elastoresistivity, the elastocaloric effect is a thermodynamic quantity.
Experimentally, elastocaloric effect measurements are demanding since the
thermodynamic conditions during the measurement have to be well controlled.
Here we present a technique to measure the elastocaloric effect under quasi
adiabatic conditions. The technique is based on oscillating strain, which
allows for increasing the frequency of the elastocaloric effect above the
thermal relaxation rate of the sample. We apply the technique to Co-doped iron
pnictide superconductors and show that the thermodynamic signatures of second
order phase transitions in the elastocaloric effect closely follow those
observed in calorimetry experiments. In contrast to the heat capacity, the
electronic signatures in the elastocaloric effect are measured against a small
phononic background even at high temperatures, establishing this technique as a
powerful complimentary tool for extracting the entropy landscape proximate to a
continuous phase transition.
","[{""version"":""v1"",""created"":""Sat, 2 Mar 2019 23:40:28 GMT""}]","2019-09-04"
"1903.00792","Michael Ratz","Mu-Chun Chen and Michael Ratz","Group-theoretical origin of CP violation","6 pages, 4 figures",,,,"hep-ph hep-th","http://arxiv.org/licenses/nonexclusive-distrib/1.0/","  This is a short review of the proposal that CP violation may be due to the
fact that certain finite groups do not admit a physical CP transformation. This
origin of CP violation is realized in explicit string compactifications
exhibiting the Standard Model spectrum.
","[{""version"":""v1"",""created"":""Sat, 2 Mar 2019 23:44:07 GMT""}]","2019-03-05"
"1903.00793","Nam Vo","Nam Vo, Lu Jiang, James Hays","Let's Transfer Transformations of Shared Semantic Representations",,,,,"cs.CV","http://arxiv.org/licenses/nonexclusive-distrib/1.0/","  With a good image understanding capability, can we manipulate the images high
level semantic representation? Such transformation operation can be used to
generate or retrieve similar images but with a desired modification (for
example changing beach background to street background); similar ability has
been demonstrated in zero shot learning, attribute composition and attribute
manipulation image search. In this work we show how one can learn
transformations with no training examples by learning them on another domain
and then transfer to the target domain. This is feasible if: first,
transformation training data is more accessible in the other domain and second,
both domains share similar semantics such that one can learn transformations in
a shared embedding space. We demonstrate this on an image retrieval task where
search query is an image, plus an additional transformation specification (for
example: search for images similar to this one but background is a street
instead of a beach). In one experiment, we transfer transformation from
synthesized 2D blobs image to 3D rendered image, and in the other, we transfer
from text domain to natural image domain.
","[{""version"":""v1"",""created"":""Sat, 2 Mar 2019 23:53:45 GMT""}]","2019-03-05"
"1903.00794","Simion Filip","Simion Filip","Tropical Dynamics of Area-Preserving Maps","58 pages, 15 figures. Accepted, Journal of Modern Dynamics",,,,"math.DS math.AG","http://arxiv.org/licenses/nonexclusive-distrib/1.0/","  We consider a class of area-preserving, piecewise affine maps on the
2-sphere. These maps encode degenerating families of K3 surface automorphisms
and are profitably studied using techniques from tropical and Berkovich
geometries.
","[{""version"":""v1"",""created"":""Sat, 2 Mar 2019 23:55:02 GMT""}]","2019-03-05"
"1903.00795","Shimpei Kobayashi","Josef F. Dorfmeister, Jun-ichi Inoguchi, Shimpei Kobayashi","Minimal surfaces with non-trivial topology in the three-dimensional
  Heisenberg group","59 pages, the version 2 has been changed substantially",,,,"math.DG","http://arxiv.org/licenses/nonexclusive-distrib/1.0/","  We study symmetric minimal surfaces in the three-dimensional Heisenberg group
$\mathrm{Nil}_3$ using the generalized Weierstrass type representation, the
so-called loop group method. In particular, we will discuss how to construct
minimal surfaces in $\mathrm{Nil}_3$ with non-trivial topology. Moreover, we
will classify equivariant minimal surfaces given by one-parameter subgroups of
the isometry group $\mathrm{Iso}_{\circ}(\mathrm{Nil}_3)$ of $\mathrm{Nil}_3$.
","[{""version"":""v1"",""created"":""Sun, 3 Mar 2019 00:04:08 GMT""},{""version"":""v2"",""created"":""Fri, 6 May 2022 03:59:25 GMT""},{""version"":""v3"",""created"":""Wed, 26 Oct 2022 08:15:46 GMT""},{""version"":""v4"",""created"":""Sat, 5 Nov 2022 03:44:15 GMT""}]","2022-11-08"
"1903.00796","Chunlei Liu","Chunlei Liu","Proof of Mining in Blockchain Systems",,,,,"cs.CR","http://arxiv.org/licenses/nonexclusive-distrib/1.0/","  We propose a proof of mining system. Roughly speaking, in this system the
mining stake ${\rm mstak}(A)$ with discrimination index $a\in[0,1]$ of an
account $A$ is defined by the formula: $${\rm mstak}(A)=(1-a)\cdot\frac{1}{{\rm
NOM}}+a\cdot\frac{{\rm NOBM}(A)}{L},$$ where $L$ is the length of the
block-chain, ${\rm NOM}$ is the number of miners in the block-chain, and ${\rm
NOBM}(A)$ is the number of blocks mined by $A$.
","[{""version"":""v1"",""created"":""Sun, 3 Mar 2019 00:04:10 GMT""}]","2019-03-05"
