"1903.00831","Sourav Mukherjee","Sourav Mukherjee","How IT allows E-Participation in Policy-Making Process","12 pages, 1 figure",,"10.6084/m9.figshare.7796063.v2",,"cs.CY","http://arxiv.org/licenses/nonexclusive-distrib/1.0/","  With the art and practice of government policy-making, public work, and
citizen participation, many governments adopt information and communication
technologies (ICT) as a vehicle to facilitate their relationship with citizens.
This participation process is widely known as E-Participation or Electronic
Participation. This article focuses on different performance indicators and the
relevant tools for each level. Despite the growing scientific and pragmatic
significance of e-participation, that area still was not able to grow as it was
expected. Our diverse set of knowledge and e-participation policies and its
implementation is very limited. This is the key reason why e-participation
initiatives in practice often fall short of expectations. This study collects
the existing perceptions from the various interdisciplinary scientific
literature to determine a unifying definition and demonstrates the strong
abilities of e-participation and other related components which have great
potential in the coming years.
","[{""version"":""v1"",""created"":""Sun, 3 Mar 2019 04:43:40 GMT""},{""version"":""v2"",""created"":""Mon, 18 Mar 2019 19:48:56 GMT""}]","2019-03-20"
"1903.00832","Hao Li","Hao Li, Jun Li, Xiaozhu Lin, Xiaohua Qian","A Model-Driven Stack-Based Fully Convolutional Network for Pancreas
  Segmentation",,,,,"cs.CV","http://arxiv.org/licenses/nonexclusive-distrib/1.0/","  The irregular geometry and high inter-slice variability in computerized
tomography (CT) scans of the human pancreas make an accurate segmentation of
this crucial organ a challenging task for existing data-driven deep learning
methods. To address this problem, we present a novel model-driven stack-based
fully convolutional network with a sliding window fusion algorithm for pancreas
segmentation, termed MDS-Net. The MDS-Net's cost function includes a data
approximation term and a prior knowledge regularization term combined with a
stack scheme for capturing and fusing the two-dimensional (2D) and local
three-dimensional (3D) context information. Specifically, 3D CT scans are
divided into multiple stacks to capture the local spatial context feature. To
highlight the importance of single slices, the inter-slice relationships in the
stack data are also incorporated in the MDS-Net framework. For implementing
this proposed model-driven method, we create a stack-based U-Net architecture
and successfully derive its back-propagation procedure for end-to-end training.
Furthermore, a sliding window fusion algorithm is utilized to improve the
consistency of adjacent CT slices and intra-stack. Finally, extensive
quantitative assessments on the NIH Pancreas-CT dataset demonstrated higher
pancreatic segmentation accuracy and reliability of MDS-Net compared to other
state-of-the-art methods.
","[{""version"":""v1"",""created"":""Sun, 3 Mar 2019 04:52:49 GMT""},{""version"":""v2"",""created"":""Wed, 11 Dec 2019 15:14:40 GMT""},{""version"":""v3"",""created"":""Sat, 17 Oct 2020 01:24:22 GMT""}]","2020-10-20"
"1903.00833","In-Jee Jeong","Tarek M. Elgindi and In-Jee Jeong","On Singular Vortex Patches, I: Well-posedness Issues","80 pages, 8 figures, to appear in Memoirs of the AMS",,,,"math.AP math-ph math.MP physics.flu-dyn","http://arxiv.org/licenses/nonexclusive-distrib/1.0/","  The purpose of this work is to discuss the well-posedness theory of singular
vortex patches. Our main results are of two types: well-posedness and
ill-posedness. On the well-posedness side, we show that globally $m-$fold
symmetric vortex patches with corners emanating from the origin are globally
well-posed in natural regularity classes as long as $m\geq 3$. In this case,
all of the angles involved solve a \emph{closed} ODE system which dictates the
global-in-time dynamics of the corners and only depends on the initial
locations and sizes of the corners. {Along the way we obtain a global
well-posedness result for a class of symmetric patches with boundary singular
at the origin, which includes logarithmic spirals.} On the ill-posedness side,
we show that \emph{any} other type of corner singularity in a vortex patch
cannot evolve continuously in time except possibly when all corners involved
have precisely the angle $\frac{\pi}{2}$ for all time. Even in the case of
vortex patches with corners of angle $\frac{\pi}{2}$ or with corners which are
only locally $m-$fold symmetric, we prove that they are generically ill-posed.
We expect that in these cases of ill-posedness, the vortex patches actually
cusp immediately in a self-similar way and we derive some asymptotic models
which may be useful in giving a more precise description of the dynamics. In a
companion work, we discuss the long-time behavior of symmetric vortex patches
with corners and use them to construct patches on $\mathbb{R}^2$ with
interesting dynamical behavior such as cusping and spiral formation in infinite
time.
","[{""version"":""v1"",""created"":""Sun, 3 Mar 2019 04:53:36 GMT""},{""version"":""v2"",""created"":""Mon, 23 Dec 2019 01:42:05 GMT""}]","2019-12-24"
"1903.00834","Zhifei Zhang","Zhifei Zhang, Zhaowen Wang, Zhe Lin, Hairong Qi","Image Super-Resolution by Neural Texture Transfer","Project Page:
  http://web.eecs.utk.edu/~zzhang61/project_page/SRNTT/SRNTT.html. arXiv admin
  note: text overlap with arXiv:1804.03360",,,,"cs.CV","http://arxiv.org/licenses/nonexclusive-distrib/1.0/","  Due to the significant information loss in low-resolution (LR) images, it has
become extremely challenging to further advance the state-of-the-art of single
image super-resolution (SISR). Reference-based super-resolution (RefSR), on the
other hand, has proven to be promising in recovering high-resolution (HR)
details when a reference (Ref) image with similar content as that of the LR
input is given. However, the quality of RefSR can degrade severely when Ref is
less similar. This paper aims to unleash the potential of RefSR by leveraging
more texture details from Ref images with stronger robustness even when
irrelevant Ref images are provided. Inspired by the recent work on image
stylization, we formulate the RefSR problem as neural texture transfer. We
design an end-to-end deep model which enriches HR details by adaptively
transferring the texture from Ref images according to their textural
similarity. Instead of matching content in the raw pixel space as done by
previous methods, our key contribution is a multi-level matching conducted in
the neural space. This matching scheme facilitates multi-scale neural transfer
that allows the model to benefit more from those semantically related Ref
patches, and gracefully degrade to SISR performance on the least relevant Ref
inputs. We build a benchmark dataset for the general research of RefSR, which
contains Ref images paired with LR inputs with varying levels of similarity.
Both quantitative and qualitative evaluations demonstrate the superiority of
our method over state-of-the-art.
","[{""version"":""v1"",""created"":""Sun, 3 Mar 2019 05:06:09 GMT""},{""version"":""v2"",""created"":""Wed, 6 Mar 2019 20:55:14 GMT""}]","2019-03-11"
"1903.00835","Nian Hong Zhou","Zhi-Guo Liu, Nian Hong Zhou","Uniform asymptotic formulas for the Fourier coefficients of the inverse
  of theta functions","39 pages, accepted for publication in The Ramanujan Journal",,,,"math.NT math.CO","http://arxiv.org/licenses/nonexclusive-distrib/1.0/","  In this paper, we use basic asymptotic analysis to establish some uniform
asymptotic formulas for the Fourier coefficients of the inverse of Jacobi theta
functions. In particular, we answer and improve some problems suggested and
investigated by Bringmann, Manschot, and Dousse. As applications, we establish
the asymptotic monotonicity properties for the rank and crank of the integer
partitions introduced and investigated by Dyson, Andrews, and Garvan.
","[{""version"":""v1"",""created"":""Sun, 3 Mar 2019 05:07:40 GMT""},{""version"":""v2"",""created"":""Sun, 9 Feb 2020 07:14:28 GMT""},{""version"":""v3"",""created"":""Tue, 30 Mar 2021 09:38:46 GMT""}]","2021-03-31"
"1903.00836","Yingkai Li","Yingkai Li, Pinyan Lu, Haoran Ye","Revenue Maximization with Imprecise Distribution",,,,,"cs.GT","http://arxiv.org/licenses/nonexclusive-distrib/1.0/","  We study the revenue maximization problem with an imprecisely estimated
distribution of a single buyer or several independent and identically
distributed buyers given that this estimation is not far away from the true
distribution. We use the earth mover's distance to capture the estimation error
between those two distributions in terms of both values and their
probabilities, i.e., the error in value space given a quantile, and the error
in quantile space given a value. We give explicit characterization of the
optimal mechanisms for the single buyer setting. For the multi-buyer case, we
provide an algorithm that finds an approximately optimal mechanism (FPTAS)
among the family of second price auctions with a fixed reserve.
","[{""version"":""v1"",""created"":""Sun, 3 Mar 2019 05:21:22 GMT""}]","2019-03-05"
"1903.00837","Armin Vahdat Motlagh","Armin Vahdat Motlagh, Emrah Kalemci, Thomas J. Maccarone","Investigating state transition luminosities of Galactic black hole
  transients in the outburst decay","17 pages, 20 figures, accepted for publication in MNRAS",,"10.1093/mnras/stz569",,"astro-ph.HE","http://arxiv.org/licenses/nonexclusive-distrib/1.0/","  We have performed a comprehensive spectral and timing analyses of Galactic
black hole transients (GBHTs) during outburst decay in order to obtain the
distribution of state transition luminosities. Using the archival data of the
Rossi X-ray Timing Explorer (RXTE), we have calculated the weighted mean for
state transition luminosities of 11 BH sources in 19 different outbursts and
for disk and power-law luminosities separately. We also produced histograms of
these luminosities in terms of Eddington luminosity fraction (ELF) and fitted
them with a Gaussian. Our results show the tightest clustering in bolometric
power-law luminosity with a mean logarithmic ELF of -1.70 $\pm$ 0.21 during the
index transition (as the photon index starts to decrease towards the hard
state). We obtained mean logarithmic ELF of -1.80 $\pm$ 0.25 during the
transition to the hard state (as the photon index reaches the lowest value) and
-1.50 $\pm$ 0.32 for disk blackbody luminosity (DBB) during the transition to
the hard-intermediate state (HIMS). We discussed the reasons for clustering and
possible explanations for sources that show a transition luminosity
significantly below or above the general trends.
","[{""version"":""v1"",""created"":""Sun, 3 Mar 2019 05:22:51 GMT""}]","2019-03-05"
"1903.00838","Donghi Lee","Jan Kim and Donghi Lee","Non-residually finite groups hyperbolic relative to residually finite
  subgroups","Due to an important error in Section 4, we would like to politely ask
  to withdraw this manuscript. We greatly appreciate Professors Yves Cornulier,
  Francois Dahmani, Anthony Genevois, Daniel Groves, Ilya Kapovich, Dennis Osin
  and Henry Wilton for their kind comments and pointing out the error",,,,"math.GR","http://arxiv.org/licenses/nonexclusive-distrib/1.0/","  Let $m$ and $k$ be integers such that $|m|, \, |k| >1$ and $\gcd (m,k)=1$. We
show that all Baumslag-Solitar groups $BS(m,mk)$ are non-residually finite
groups hyperbolic relative to residually finite subgroups. By a result of Osin
(2007), this implies that there exists a non-residually finite hyperbolic
group, thus solving a long-standing open problem of Gromov (1987). We also show
that all $BS(m, mk)$ are non-Hopfian groups hyperbolic relative to Hopfian
subgroups.
","[{""version"":""v1"",""created"":""Sun, 3 Mar 2019 05:45:55 GMT""},{""version"":""v2"",""created"":""Wed, 6 Mar 2019 14:48:19 GMT""}]","2019-03-07"
"1903.00839","Xihui Liu","Xihui Liu, Zihao Wang, Jing Shao, Xiaogang Wang, Hongsheng Li","Improving Referring Expression Grounding with Cross-modal
  Attention-guided Erasing","Accepted by CVPR 2019",,,,"cs.CV cs.CL","http://arxiv.org/licenses/nonexclusive-distrib/1.0/","  Referring expression grounding aims at locating certain objects or persons in
an image with a referring expression, where the key challenge is to comprehend
and align various types of information from visual and textual domain, such as
visual attributes, location and interactions with surrounding regions. Although
the attention mechanism has been successfully applied for cross-modal
alignments, previous attention models focus on only the most dominant features
of both modalities, and neglect the fact that there could be multiple
comprehensive textual-visual correspondences between images and referring
expressions. To tackle this issue, we design a novel cross-modal
attention-guided erasing approach, where we discard the most dominant
information from either textual or visual domains to generate difficult
training samples online, and to drive the model to discover complementary
textual-visual correspondences. Extensive experiments demonstrate the
effectiveness of our proposed method, which achieves state-of-the-art
performance on three referring expression grounding datasets.
","[{""version"":""v1"",""created"":""Sun, 3 Mar 2019 05:55:15 GMT""},{""version"":""v2"",""created"":""Tue, 2 Apr 2019 07:33:37 GMT""}]","2019-04-03"
"1903.00840","Amir Zadeh","Amir Zadeh, Yao-Chong Lim, Paul Pu Liang, Louis-Philippe Morency","Variational Auto-Decoder: A Method for Neural Generative Modeling from
  Incomplete Data","Link to code and data available from
  https://github.com/A2Zadeh/Variational-Autodecoder",,,,"cs.LG cs.AI stat.ML","http://arxiv.org/licenses/nonexclusive-distrib/1.0/","  Learning a generative model from partial data (data with missingness) is a
challenging area of machine learning research. We study a specific
implementation of the Auto-Encoding Variational Bayes (AEVB) algorithm, named
in this paper as a Variational Auto-Decoder (VAD). VAD is a generic framework
which uses Variational Bayes and Markov Chain Monte Carlo (MCMC) methods to
learn a generative model from partial data. The main distinction between VAD
and Variational Auto-Encoder (VAE) is the encoder component, as VAD does not
have one. Using a proposed efficient inference method from a multivariate
Gaussian approximate posterior, VAD models allow inference to be performed via
simple gradient ascent rather than MCMC sampling from a probabilistic decoder.
This technique reduces the inference computational cost, allows for using more
complex optimization techniques during latent space inference (which are shown
to be crucial due to a high degree of freedom in the VAD latent space), and
keeps the framework simple to implement. Through extensive experiments over
several datasets and different missing ratios, we show that encoders cannot
efficiently marginalize the input volatility caused by imputed missing values.
We study multimodal datasets in this paper, which is a particular area of
impact for VAD models.
","[{""version"":""v1"",""created"":""Sun, 3 Mar 2019 06:19:55 GMT""},{""version"":""v2"",""created"":""Wed, 13 Mar 2019 02:47:29 GMT""},{""version"":""v3"",""created"":""Sun, 24 Mar 2019 00:39:41 GMT""},{""version"":""v4"",""created"":""Wed, 3 Apr 2019 21:04:05 GMT""},{""version"":""v5"",""created"":""Sun, 26 May 2019 13:45:51 GMT""},{""version"":""v6"",""created"":""Sun, 3 Jan 2021 08:27:20 GMT""}]","2021-01-05"
"1903.00841","Michel Kinsy","Novak Boskov, Mihailo Isakov and Michel A. Kinsy","CodeTrolley: Hardware-Assisted Control Flow Obfuscation","2019 Boston Area Architecture Workshop (BARC'19)",,,,"cs.CR","http://arxiv.org/licenses/nonexclusive-distrib/1.0/","  Many cybersecurity attacks rely on analyzing a binary executable to find
exploitable sections of code. Code obfuscation is used to prevent attackers
from reverse engineering these executables. In this work, we focus on control
flow obfuscation - a technique that prevents attackers from statically
determining which code segments are original, and which segments are added in
to confuse attackers. We propose a RISC-V-based hardware-assisted deobfuscation
technique that deobfuscates code at runtime based on a secret safely stored in
hardware, along with an LLVM compiler extension for obfuscating binaries.
Unlike conventional tools, our work does not rely on compiling
hard-to-reverse-engineer code, but on securing a secret key. As such, it can be
seen as a lightweight alternative to on-the-fly binary decryption.
","[{""version"":""v1"",""created"":""Sun, 3 Mar 2019 06:21:24 GMT""},{""version"":""v2"",""created"":""Sat, 9 Mar 2019 12:44:28 GMT""},{""version"":""v3"",""created"":""Tue, 27 Aug 2019 03:18:42 GMT""}]","2019-08-28"
"1903.00842","Ettore Minguzzi","E. Minguzzi and S. Suhr","Some regularity results for Lorentz-Finsler spaces","18 pages, 3 figures. v2: added two figures","Ann Glob Anal Geom (2019) 56: 597-611","10.1007/s10455-019-09681-w",,"gr-qc","http://arxiv.org/licenses/nonexclusive-distrib/1.0/","  We prove that for continuous Lorentz-Finsler spaces timelike completeness
implies inextendibility. Furthermore, we prove that under suitable locally
Lipschitz conditions on the Finsler fundamental function the continuous causal
curves that are locally length maximizing (geodesics) have definite causal
character, either lightlike almost everywhere or timelike almost everywhere.
These results generalize previous theorems by Galloway, Ling and Sbierski, and
by Graf and Ling.
","[{""version"":""v1"",""created"":""Sun, 3 Mar 2019 06:23:07 GMT""},{""version"":""v2"",""created"":""Tue, 20 Aug 2019 09:36:04 GMT""}]","2019-09-30"
"1903.00843","Xiang Liu","Xiang Liu, Ziyang Tang, Huyunting Huang, Tonglin Zhang, Baijian Yang","Multiple Learning for Regression in big data","8 pages",,,,"cs.LG cs.DC stat.ML","http://arxiv.org/licenses/nonexclusive-distrib/1.0/","  Regression problems that have closed-form solutions are well understood and
can be easily implemented when the dataset is small enough to be all loaded
into the RAM. Challenges arise when data is too big to be stored in RAM to
compute the closed form solutions. Many techniques were proposed to overcome or
alleviate the memory barrier problem but the solutions are often local optimal.
In addition, most approaches require accessing the raw data again when updating
the models. Parallel computing clusters are also expected if multiple models
need to be computed simultaneously. We propose multiple learning approaches
that utilize an array of sufficient statistics (SS) to address this big data
challenge. This memory oblivious approach breaks the memory barrier when
computing regressions with closed-form solutions, including but not limited to
linear regression, weighted linear regression, linear regression with Box-Cox
transformation (Box-Cox regression) and ridge regression models. The
computation and update of the SS array can be handled at per row level or per
mini-batch level. And updating a model is as easy as matrix addition and
subtraction. Furthermore, multiple SS arrays for different models can be easily
computed simultaneously to obtain multiple models at one pass through the
dataset. We implemented our approaches on Spark and evaluated over the
simulated datasets. Results showed our approaches can achieve closed-form
solutions of multiple models at the cost of half training time of the
traditional methods for a single model.
","[{""version"":""v1"",""created"":""Sun, 3 Mar 2019 06:34:24 GMT""},{""version"":""v2"",""created"":""Sat, 5 Oct 2019 00:39:30 GMT""}]","2019-10-08"
"1903.00844","Fnu Setiawan","F. Setiawan, Chien-Te Wu and K. Levin","Full proximity treatment of topological superconductors in
  Josephson-junction architectures","19 pages, 14 figures","Phys. Rev. B 99, 174511 (2019)","10.1103/PhysRevB.99.174511",,"cond-mat.mes-hall cond-mat.supr-con","http://arxiv.org/licenses/nonexclusive-distrib/1.0/","  Experiments on planar Josephson junction architectures have recently been
shown to provide an alternative way of creating topological superconductors
hosting accessible Majorana modes. These zero-energy modes can be found at the
ends of a one-dimensional channel in the junction of a two-dimensional electron
gas (2DEG) proximitized by two spatially separated superconductors. The
channel, which is below the break between the superconductors, is not in direct
contact with the superconducting leads, so that proximity coupling is expected
to be weaker and less well-controlled than in the simple nanowire configuration
widely discussed in the literature. This provides a strong incentive for this
paper which investigates the nature of proximitization in these Josephson
architectures. At a microscopic level we demonstrate how and when it can lead
to topological phases. We do so by going beyond simple tunneling models through
solving self-consistently the Bogoliubov-de Gennes equations of a
heterostructure multicomponent system involving two spatially separated
$s$-wave superconductors in contact with a normal Rashba spin-orbit-coupled
2DEG. Importantly, within our self-consistent theory we present ways of
maximizing the proximity-induced superconducting gap by studying the effect of
the Rashba spin-orbit coupling, chemical potential mismatch between the
superconductor and 2DEG, and sample geometry on the gap. Finally, we note (as
in experiment) a Fulde-Ferrell-Larkin-Ovchinnikov phase is also found to appear
in the 2DEG channel, albeit under circumstances which are not ideal for
topological superconducting phase.
","[{""version"":""v1"",""created"":""Sun, 3 Mar 2019 06:37:26 GMT""},{""version"":""v2"",""created"":""Tue, 21 May 2019 17:04:44 GMT""}]","2019-05-22"
"1903.00845","Ivan Telpukhovskiy","Ivan Telpukhovskiy","Masur's criterion does not hold in the Thurston metric","29 pages, 18 figures. Completely rewritten following the referee's
  comments",,,,"math.GT","http://arxiv.org/licenses/nonexclusive-distrib/1.0/","  We construct a counterexample for an analogue of Masur's criterion in the
setting of Teichm\""uller space equipped with the Thurston metric. For that, we
find a minimal, filling, non-uniquely ergodic lamination $\lambda$ on the
seven-times punctured sphere with uniformly bounded annular projection
distances. Then we show that a geodesic in the corresponding Teichm\""uller
space that converges to $\lambda$, stays in the thick part for the whole time.
","[{""version"":""v1"",""created"":""Sun, 3 Mar 2019 06:37:48 GMT""},{""version"":""v2"",""created"":""Tue, 30 Aug 2022 16:17:14 GMT""}]","2022-08-31"
"1903.00846","Samundra Deep Mr.","Samundra Deep, Xi Zheng, Alireza Jolfaei, Dongjin Yu, Pouya Ostovari,
  Ali Kashif Bashir","A survey of security and privacy issues in the Internet of Things from
  the layered context",,,,,"cs.NI cs.CR","http://arxiv.org/licenses/nonexclusive-distrib/1.0/","  Internet of Things (IoT) is a novel paradigm, which not only facilitates a
large number of devices to be ubiquitously connected over the Internet but also
provides a mechanism to remotely control these devices. The IoT is pervasive
and is almost an integral part of our daily life. As devices are becoming
increasingly connected, privacy and security issues become more and more
critical and these need to be addressed on an urgent basis. IoT implementations
and devices are eminently prone to threats that could compromise the security
and privacy of the consumers, which, in turn, could influence its practical
deployment. In recent past, some research has been carried out to secure IoT
devices with an intention to alleviate the security concerns of users. The
purpose of this paper is to highlight the security and privacy issues in IoT
systems. To this effect, the paper examines the security issues at each layer
in the IoT protocol stack, identifies the underlying challenges and key
security requirements and provides a brief overview of existing security
solutions to safeguard the IoT from the layered context.
","[{""version"":""v1"",""created"":""Sun, 3 Mar 2019 06:50:51 GMT""},{""version"":""v2"",""created"":""Tue, 25 Feb 2020 02:33:49 GMT""}]","2020-02-26"
