"1903.00883","Peng Wang","Josef F. Dorfmeister, Peng Wang","Willmore surfaces in spheres: the DPW approach via the conformal Gauss
  map","23 pages. Following the suggestion of some anonymous referee we have
  divided the paper entitled ""Willmore surfaces in spheres via loop groups I:
  generic cases and some examples"" (arXiv:1301.2756) into three parts. The
  present paper is part II and [15,16] are part I and part III respectively",,,,"math.DG","http://arxiv.org/licenses/nonexclusive-distrib/1.0/","  The paper builds a DPW approach of Willmore surfaces via conformal Gauss
maps. As applications, we provide descriptions of minimal surfaces in $\mathbb
R^{n+2}$, isotropic surfaces in $S^4$ and homogeneous Willmore tori via the
loop group method. A new example of a Willmore two-sphere in $S^6$ without dual
surfaces is also presented.
","[{""version"":""v1"",""created"":""Sun, 3 Mar 2019 11:42:32 GMT""}]","2019-03-05"
"1903.00884","Yasir Hussain","Yasir Hussain, Zhiqiu Huang, Yu Zhou, Senzhang Wang","CodeGRU: Context-aware Deep Learning with Gated Recurrent Unit for
  Source Code Modeling",,"Information and Software Technology. Volume 125, September 2020,
  106309","10.1016/j.infsof.2020.106309",,"cs.NE cs.SE","http://arxiv.org/licenses/nonexclusive-distrib/1.0/","  Recently deep learning based Natural Language Processing (NLP) models have
shown great potential in the modeling of source code. However, a major
limitation of these approaches is that they take source code as simple tokens
of text and ignore its contextual, syntactical and structural dependencies. In
this work, we present CodeGRU, a gated recurrent unit based source code
language model that is capable of capturing source code's contextual,
syntactical and structural dependencies. We introduce a novel approach which
can capture the source code context by leveraging the source code token types.
Further, we adopt a novel approach which can learn variable size context by
taking into account source code's syntax, and structural information. We
evaluate CodeGRU with real-world data set and it shows that CodeGRU outperforms
the state-of-the-art language models and help reduce the vocabulary size up to
24.93\%. Unlike previous works, we tested CodeGRU with an independent test set
which suggests that our methodology does not requisite the source code comes
from the same domain as training data while providing suggestions. We further
evaluate CodeGRU with two software engineering applications: source code
suggestion, and source code completion. Our experiment confirms that the source
code's contextual information can be vital and can help improve the software
language models. The extensive evaluation of CodeGRU shows that it outperforms
the state-of-the-art models. The results further suggest that the proposed
approach can help reduce the vocabulary size and is of practical use for
software developers.
","[{""version"":""v1"",""created"":""Sun, 3 Mar 2019 11:44:08 GMT""},{""version"":""v2"",""created"":""Tue, 14 Jul 2020 12:12:00 GMT""}]","2020-07-15"
"1903.00885","Peng Wang","Josef F. Dorfmeister, Peng Wang","A duality theorem for harmonic maps into non-compact symmetric spaces
  and compact symmetric spaces","8 pages. Following the suggestion of some anonymous referee we have
  divided the paper entitled ""Willmore surfaces in spheres via loop groups I:
  generic cases and some examples ""(arXiv:1301.2756) into three parts. The
  present paper is part III and [6,7] are part I and part II respectively",,,,"math.DG","http://arxiv.org/licenses/nonexclusive-distrib/1.0/","  In this note, we show that for any harmonic map into a non-compact symmetric
space one can find naturally a ""dual"" harmonic map into a compact symmetric
space which can be constructed from the same basic data (called ""potentials"" in
the loop group formalism). Locally also the inverse/converse duality theorem
holds.
","[{""version"":""v1"",""created"":""Sun, 3 Mar 2019 11:51:30 GMT""}]","2019-03-05"
"1903.00886","Yuri Litvinov","Adam Sobiczewski, Yuri A. Litvinov, Michal Palczewski","Detailed illustration of accuracy of presently used nuclear-mass models","70 pages","Atomic Data and Nuclear Data Tables 119 (2018) 1-32","10.1016/j.adt.2017.05.001",,"nucl-th","http://arxiv.org/licenses/nonexclusive-distrib/1.0/","  The accuracy of description of measured nuclear masses by presently used
nuclear-mass models is studied. Twelve models of various kinds are considered,
eleven of the global character and one local model specially adapted to
description of heavy nuclei. To decrease the number of nuclei over which the
accuracy is averaged, the global region (Z,N >= 8) is divided into four
subregions, in which the accuracy is studied separately. Still, to reach the
best precision, the accuracy is finally investigated without any averaging, for
each nucleus separately. The results are presented in a form of colored maps,
large enough to be easily and accurately read. Besides the accuracy of the
studied models, also their predictive power is considered. It is found that the
accuracy of description of mass strongly depends on a nuclear-mass model and on
the region of nuclei to which the model is applied. The best accuracy is
obtained by the recent two Chinese models WS3+ and WS4+. Generally, no clear,
strong correlation between the accuracy of description of already known masses
by a given model and its predictive power for new masses is observed. Still,
such correlation is found for separate models and in separate regions of
nuclei. More often for the macroscopic-microscopic models than for the other
approaches.
","[{""version"":""v1"",""created"":""Sun, 3 Mar 2019 11:58:43 GMT""}]","2019-03-05"
"1903.00887","Bulat Nurmievich Khabibullin","Bulat N. Khabibullin, Anna E. Egorova","Balayage of measures and subharmonic functions on a system of rays. III.
  Growth of entire functions of exponential type","32 pages, in Russian",,,,"math.CV","http://arxiv.org/licenses/nonexclusive-distrib/1.0/","  In the second part of this work was developed a technique of balayage of
finite genus $q=0,1,2,\dots$ for measures (charges) and ($\delta$-) subharmonic
functions of finite order to an arbitrary closed system of rays $S$ with vertex
at origin on the complex plane $\mathbb C$. In this third part of our work, we
use only the case $q=1$ when $S$ is a pair of oppositely directed rays, i.e.,
$S$ is a straight line as the point set, and balayage is made from both sides
of this line. We consider measures and subharmonic functions of finite type of
order $1$. This bilateral balayage of genus $1$ will be applied to the
non-triviality of weight classes of entire functions of exponential type $E$
that allocated only constraint on their growth along the line; for the full
description of subsequences of zeros for classes $E$; the existence of entire
functions-multipliers of $h$ for entire functions of exponential type $g$,
limiting by the multiplication of their growth as $fh\in E$; the possibility of
the representation of meromorphic functions in the form of a ratio of functions
from $E$. The origins of the study lies in the classical Malliavin-Rubel
Theorem on the conditions of existence of an entire function of exponential
type vanishing on a given sequence of positive numbers. These studies also are
parallel to the famous Beurling-Malliavin Theorems on the multiplier and on the
radius of completeness.
","[{""version"":""v1"",""created"":""Sun, 3 Mar 2019 12:18:12 GMT""}]","2019-03-05"
"1903.00888","Kele Xu","Bo Li, Kele Xu, Dawei Feng, Haibo Mi, Huaimin Wang, Jian Zhu","Denoising convolutional autoencoder based B-mode ultrasound tongue image
  feature extraction","Accepted by ICASSP 2019",,,,"eess.IV","http://arxiv.org/licenses/nonexclusive-distrib/1.0/","  B-mode ultrasound tongue imaging is widely used in the speech production
field. However, efficient interpretation is in a great need for the tongue
image sequences. Inspired by the recent success of unsupervised deep learning
approach, we explore unsupervised convolutional network architecture for the
feature extraction in the ultrasound tongue image, which can be helpful for the
clinical linguist and phonetics. By quantitative comparison between different
unsupervised feature extraction approaches, the denoising convolutional
autoencoder (DCAE)-based method outperforms the other feature extraction
methods on the reconstruction task and the 2010 silent speech interface
challenge. A Word Error Rate of 6.17% is obtained with DCAE, compared to the
state-of-the-art value of 6.45% using Discrete cosine transform as the feature
extractor. Our codes are available at
https://github.com/DeePBluE666/Source-code1.
","[{""version"":""v1"",""created"":""Sun, 3 Mar 2019 12:28:04 GMT""}]","2019-03-05"
"1903.00889","Joel Merker (LM-Orsay)","Joel Merker (LM-Orsay)","Affine Rigidity Without Integration","28 pages, 2 figures",,,,"math.DG math.CV","http://arxiv.org/licenses/nonexclusive-distrib/1.0/","  Real analytic ($\mathcal{C}^\omega$) surfaces $S^2$ in $\mathbb{R}^3 \ni
(x,y,u)$ graphed as $\big\{ u = F(x,y) \big\}$ with $F_{xx} \neq 0$ whose
Gaussian curvature vanishes identically: \[ 0 \,\equiv\, F_{xx}\,F_{yy} -
F_{xy}^2, \] possess, under the action of the affine transformation group ${\sf
Aff}_3(\mathbb{R}) = {\sf GL}_3(\mathbb{R}) \ltimes \mathbb{R}^3$, a basic
invariant analogous to $2$-nondegeneracy for $\mathcal{C}^\omega$ real
hypersurfaces $M^5 \subset \mathbb{C}^3$: \[ S_{\sf aff} \,:=\,
\frac{F_{xx}\,F_{xxy}-F_{xy}\,F_{xxx}}{ F_{xx}^2}. \] It is known (or easily
recovered) that $S$ is affinely equivalent to $\big\{ u = x^2 \big\}$ if and
only if $S_{\sf aff} \equiv 0$.
  Assuming that $S_{\sf aff} \neq 0$ everywhere, two deeper affine invariants
inspired from Pocchiola's Ph.D. are $W_{\sf aff}$ and $J_{\sf aff}$. Explicit
expressions are given in this article.
  Theorem. $S$ is affinely equivalent to $\big\{ u = \frac{x^2}{1-y} \big\}$ if
and only if $W_{\sf aff} \equiv 0 \equiv J_{\sf aff}$.
  As a direct corollary of the (brief) proof, affine rigidity of CR-flat
$2$-nondegenerate $\mathcal{C}^\omega$ Levi rank $1$ hypersurfaces $M^5 \subset
\mathbb{C}^3$ is deduced. The arguments rely on pure affine geometry, avoid any
tool from Analysis, and simplify A.V. Isaev, J. Differential Geom. 104 (2016),
111--141.
  An independent article will show, in a more general context, how
$\mathcal{C}^\infty$ (even $\mathcal{C}^7$) $F(x,y)$ can be handled.
","[{""version"":""v1"",""created"":""Sun, 3 Mar 2019 12:32:55 GMT""},{""version"":""v2"",""created"":""Sat, 20 Jul 2019 15:12:30 GMT""},{""version"":""v3"",""created"":""Wed, 7 Oct 2020 08:17:28 GMT""},{""version"":""v4"",""created"":""Mon, 15 Mar 2021 14:30:35 GMT""}]","2021-03-16"
"1903.00890","Azad Inshalla oglu Ahmadov","A.I. Ahmadov, C. Aydin, O. Uzun","The inclusive production of charged pion pairs in proton-antiproton
  collisions","26 pages, 16 figures. arXiv admin note: text overlap with
  arXiv:hep-ph/9808229 by other authors","Phys. Rev. C 99, 035204 (2019)","10.1103/PhysRevC.99.035204",,"hep-ph","http://arxiv.org/licenses/nonexclusive-distrib/1.0/","  In this study, we have considered the contribution of the higher-twist (HT)
effects of the subprocesses to inclusive pion pair production cross section in
the high energy proton-antiproton collisions by using various pion distribution
amplitudes (DAs) within the frozen coupling constant approach and compared them
with the leading-twist contributions. The feature of the HT effects may help
the theoretical interpretation of the future PANDA experiment. The dependencies
of the HT contribution on the transverse momentum $p_T$, the center of mass
energy $\sqrt s$, and the variable $x_T$ are discussed numerically with special
emphasis put on DAs. Moreover, the obtained analytical and numerical results
for the differential cross section of the pion pair production are compared
with the elastic backward scattering of the pion on the proton. We show that
the main contribution to the inclusive cross section comes from the HT direct
production process via gluon-gluon fusion. Also, it is strongly dependent on
the pion DAs, momentum cut-off parameter $\triangle p$ and $<{q_{T}^2}>$ which
is the mean square of the intrinsic momentum of either initial parton.
","[{""version"":""v1"",""created"":""Sun, 3 Mar 2019 12:33:23 GMT""}]","2019-03-27"
"1903.00891","Wei Zhang","Wei Zhang, Kaifa Luo, Zhendong Chen, Ziming Zhu, Rui Yu, Chen Fang,
  and Hongming Weng","Topological phases in pyrochlore thallium niobate Tl$_2$Nb$_2$O$_{6+x}$","20 pages, 4 figures","npj Computational Materials 2019, 5, 105","10.1038/s41524-019-0245-5",,"cond-mat.mtrl-sci","http://arxiv.org/licenses/nonexclusive-distrib/1.0/","  The discovery of new topological electronic materials brings a chance to
uncover novel physics and plays a key role in observing and controlling various
intriguing phenomena. Up to now, many materials have been theoretically
proposed and experimentally proved to host different kinds of topological
states. Unfortunately, there is little convincing experimental evidence for the
existence of topological oxides. The reason is that oxidation of oxygen leads
to ionic crystal in general and makes band inversion unlikely. In addition, the
realization of different topological states in a single material is quite
difficult, but strongly needed for exploring topological phase transitions. In
this work, using first-principles calculations and symmetry analysis, we
propose that the experimentally tunable continuous solid solution of oxygen in
pyrochlore Tl$_2$Nb$_2$O$_{6+x}$ ($ 0\leq x \leq 1.0$) leads to various
topological states. Topological insulator, Dirac semimetal and triply
degenerate nodal point semimetal can be realized in it via changing the oxygen
content and/or tuning the crystalline symmetries. When $x = 1$, it is a
semimetal with quadratic band touching point at Fermi level. It transits into a
Dirac semimetal or a topological insulator depending on the in-plane strain.
When $x = 0.5$, the inversion symmetry is spontaneously broken in
Tl$_2$Nb$_2$O$_{6.5}$, leading to triply degenerate nodal points. When $x = 0$,
Tl$_2$Nb$_2$O$_6$ becomes a trivial insulator with a narrow band gap. These
topological phase transitions driven by solid solution of oxygen are unique and
physically plausible due to the variation of valence state of $Tl^{1+}$ and
$Tl^{3+}$. This topological oxide will be promising for studying correlation
induced topological states and potential applications.
","[{""version"":""v1"",""created"":""Sun, 3 Mar 2019 12:35:39 GMT""},{""version"":""v2"",""created"":""Tue, 5 Mar 2019 13:17:54 GMT""},{""version"":""v3"",""created"":""Fri, 5 Jul 2019 13:51:47 GMT""},{""version"":""v4"",""created"":""Tue, 14 Dec 2021 11:07:30 GMT""}]","2021-12-15"
"1903.00892","Hai Yu","Hai Yu, Aman Singal, Jacob Peyton, Sara Crandall, Bharat Ratra","Gaussian Processes, Median Statistics, Milky Way Rotation Curves","37 pages, 32 figures. Comments are welcome",,"10.1007/s10509-020-03858-7",,"astro-ph.GA astro-ph.CO gr-qc hep-ph","http://arxiv.org/licenses/nonexclusive-distrib/1.0/","  We use the Iocco et al. (2015) compilation of 2,780 circular velocity
measurements to analyze the Milky Way rotation curve. We find that the error
bars for individual measurements are non-gaussian, and hence instead derive
median statistics binned central circular velocity values and error bars from
these data. We use these median statistics central values and error bars to fit
the data to simple, few parameter, rotation curve functions. These simple
functions are unable to adequately capture the significant small scale spatial
structure in these data and so provide poor fits. We introduce and use the
Gaussian Processes (GP) method to capture this small scale structure and use it
to derive Milky Way rotation curves from the binned median statistics circular
velocity data. The GP method rotation curves have significant small-scale
spatial structure superimposed on a broad rise to galactocentric radius
$R\approx7$ kpc and a decline at larger $R$. We use the GP method median
statistics rotation curve to measure the Oort $A$ and $B$ constants and other
characteristic rotation curve quantities. We study correlations in the residual
circular velocities (relative to the GP method rotation curve). Along with
other evidence for azimuthal asymmetry of the Milky Way circular rotation
velocity field, we find that larger residual circular velocities seem to favor
parts of spiral arms.
","[{""version"":""v1"",""created"":""Sun, 3 Mar 2019 12:36:46 GMT""},{""version"":""v2"",""created"":""Tue, 5 Mar 2019 02:42:48 GMT""}]","2020-09-09"
"1903.00893","Fang Li","Fang Li and Siyang Liu","Periodicities in cluster algebras and cluster automorphism groups","21 pages",,,,"math.RT","http://arxiv.org/licenses/nonexclusive-distrib/1.0/","  In this paper, we study the relations between groups related to cluster
automorphism groups which are defined by Assem, Schiffler and Shamchenko in
\cite{ASS}. We establish the relationship among (strict) direct cluster
automorphism groups and those groups consisting of periodicities of
respectively labeled seeds and exchange matrices in the language of short exact
sequences. As an application, we characterize automorphism-finite cluster
algebras in the cases with bipartite seeds or finite mutation type. Finally, we
study the relation between the groups $\mathrm{Aut}\mathcal{A}$ and
$\mathrm{Aut}_{M_n}S$ and give the negative answer via counter-examples to King
and Pressland's a problem in \cite{KP}.
","[{""version"":""v1"",""created"":""Sun, 3 Mar 2019 12:44:06 GMT""},{""version"":""v2"",""created"":""Mon, 13 Apr 2020 05:07:21 GMT""}]","2020-04-14"
"1903.00894","Yu Zhou","Yu Zhou, Yanqi Su, Taolue Chen, Zhiqiu Huang, Harald Gall, Sebastiano
  Panichella","User Review-Based Change File Localization for Mobile Applications","15 pages, 3 figures, 8 tables","IEEE Trans. on Software Engineering, 2020","10.1109/TSE.2020.2967383",,"cs.SE","http://arxiv.org/licenses/nonexclusive-distrib/1.0/","  In the current mobile app development, novel and emerging DevOps practices
(e.g., Continuous Delivery, Integration, and user feedback analysis) and tools
are becoming more widespread. For instance, the integration of user feedback
(provided in the form of user reviews) in the software release cycle represents
a valuable asset for the maintenance and evolution of mobile apps. To fully
make use of these assets, it is highly desirable for developers to establish
semantic links between the user reviews and the software artefacts to be
changed (e.g., source code and documentation), and thus to localize the
potential files to change for addressing the user feedback. In this paper, we
propose RISING (Review Integration via claSsification, clusterIng, and
linkiNG), an automated approach to support the continuous integration of user
feedback via classification, clustering, and linking of user reviews. RISING
leverages domain-specific constraint information and semi-supervised learning
to group user reviews into multiple fine-grained clusters concerning similar
users' requests. Then, by combining the textual information from both commit
messages and source code, it automatically localizes potential change files to
accommodate the users' requests. Our empirical studies demonstrate that the
proposed approach outperforms the state-of-the-art baseline work in terms of
clustering and localization accuracy, and thus produces more reliable results.
","[{""version"":""v1"",""created"":""Sun, 3 Mar 2019 12:45:46 GMT""},{""version"":""v2"",""created"":""Sat, 9 Mar 2019 02:09:36 GMT""},{""version"":""v3"",""created"":""Wed, 26 Feb 2020 03:13:59 GMT""}]","2021-08-03"
"1903.00895","Gang Chen Professor","Yao Dong Li, Xu Yang, Yi Zhou, Gang Chen","Non-Kitaev spin liquids in Kitaev materials","13 pages, 6 figures, to appear in PRB. Minor change.
  https://meetings.aps.org/Meeting/MAR18/Session/F24.10","Phys. Rev. B 99, 205119 (2019)","10.1103/PhysRevB.99.205119",,"cond-mat.str-el cond-mat.mtrl-sci cond-mat.supr-con","http://arxiv.org/licenses/nonexclusive-distrib/1.0/","  We point out that the Kitaev materials may not necessarily support Kitaev
spin liquid. It is well-known that having a Kitaev term in the spin interaction
is not the sufficient condition for the Kitaev spin liquid ground state. Many
other spin liquids may be stabilized by the competing spin interactions of the
systems. We thus explore the possibilities of non-Kitaev spin liquids in the
honeycomb Kitaev materials. We carry out a systematic classification of gapped
$\mathbb{Z}_2$ spin liquids using the Schwinger boson representation for the
spin variables. The presence of strong spin-orbit coupling in the Kitaev
materials brings new ingredients into the projective symmetry group
classification of the non-Kitaev spin liquid. We predict the spectroscopic
properties of these gapped non-Kitaev spin liquids. Moreover, among the gapped
spin liquids that we discover, we identify the spin liquid whose spinon
condensation leads to the magnetic Bragg peak structure of the zig-zag magnetic
order that was observed in Na$_2$IrO$_3$ and $\alpha$-RuCl$_3$. We further
discuss the possibility of gapped $\mathbb{Z}_2$ spin liquid and the deconfined
quantum criticality from the zig-zag magnetic order to spin dimerization in
pressurized $\alpha$-RuCl$_3$.
","[{""version"":""v1"",""created"":""Sun, 3 Mar 2019 12:54:05 GMT""},{""version"":""v2"",""created"":""Thu, 25 Apr 2019 15:28:55 GMT""}]","2019-05-22"
"1903.00896","Yanyan Bu","Yanyan Bu, Tuna Demircik and Michael Lublinsky","Chiral transport in strong fields from holography","v1: 33 pages, 13 figures; v2: published version",,"10.1007/JHEP05(2019)071",,"hep-th hep-ph nucl-th","http://arxiv.org/licenses/nonexclusive-distrib/1.0/","  Anomaly-induced transport phenomena in presence of strong external
electromagnetic fields are explored within a 4D field theory defined
holographically as $U(1)_V\times U(1)_A$ Maxwell-Chern-Simons theory in
Schwarzschild-$AdS_5$. Two complementary studies are reported. In the first
one, we present results on the Ohmic conductivity, diffusion constant, chiral
magnetic conductivity, and additional anomaly-induced transport coefficients as
functions of external e/m fields. Next, gradient resummation in a constant
background magnetic field is performed. All-order resummed constitutive
relations are parameterised by four momenta-dependent transport coefficient
functions (TCFs). A highlight of this part is a thorough study of {\it
non-dissipative} chiral magnetic waves (CMW) in strong magnetic fields.
","[{""version"":""v1"",""created"":""Sun, 3 Mar 2019 12:59:49 GMT""},{""version"":""v2"",""created"":""Thu, 16 May 2019 09:06:05 GMT""}]","2019-06-05"
"1903.00897","Naotaka Yoshikawa","Naotaka Yoshikawa, Masayuki Takayama, Naoki Shikama, Tomoya Ishikawa,
  Fuyuki Nabeshima, Atsutaka Maeda, Ryo Shimano","Charge carrier dynamics of FeSe thin film investigated by terahertz
  magneto-optical spectroscopy",,"Phys. Rev. B 100, 035110 (2019)","10.1103/PhysRevB.100.035110",,"cond-mat.supr-con","http://arxiv.org/licenses/nonexclusive-distrib/1.0/","  We performed terahertz magneto-optical spectroscopy of FeSe thin film to
elucidate the charge carrier dynamics. The measured diagonal (longitudinal) and
off-diagonal (Hall) conductivity spectra are well reproduced by two-carrier
Drude model, from which the carrier densities, scattering times and effective
masses of electron and hole carriers are determined in a wide range of
temperature. The hole density decreases below the structural transition
temperature while electron density increases, which is attributed to the band
structure modification in the electronic nematic phase. The scattering time of
the hole carrier becomes substantially longer than that of the electron at
lower temperature, which accounts for the increase of the positive dc Hall
coefficient at low temperature.
","[{""version"":""v1"",""created"":""Sun, 3 Mar 2019 13:12:14 GMT""}]","2019-07-26"
"1903.00898","Azimatu Seidu","Azimatu Seidu, Lauri Himanen, Jingrui Li and Patrick Rinke","Database-driven high-throughput study for hybrid perovskite coating
  materials",,,,,"physics.app-ph","http://arxiv.org/licenses/nonexclusive-distrib/1.0/","  We developed a high-throughput screening scheme to acquire candidate coating
materials for hybrid perovskites. From more than 1.8 million entries of an
inorganic compound database, we collected 93 binary and ternary materials with
promising properties for protectively coating halide-perovskite photoabsorbers
in perovskite solar cells. These candidates fulfill a series of criteria,
including wide band gaps, abundant and non-toxic elements, water-insoluble, and
small lattice mismatch with surface models of halide perovskites.
","[{""version"":""v1"",""created"":""Sun, 3 Mar 2019 13:14:46 GMT""}]","2019-03-05"
