"1903.04183","Andreas Michels","Giordano Benacchio, Ivan Titov, Artem Malyeyev, Inma Peral, Mathias
  Bersweiler, Philipp Bender, Denis Mettus, Dirk Honecker, Elliot Paul Gilbert,
  Mauro Coduri, Andre Heinemann, Sebastian M\""uhlbauer, Asli Cakir, Mehmet
  Acet, and Andreas Michels","Evidence for the formation of nanoprecipitates with magnetically
  disordered regions in bulk $\mathrm{Ni}_{50}\mathrm{Mn}_{45}\mathrm{In}_{5}$
  Heusler alloys","11 pages, 8 figures","Phys. Rev. B 99, 184422 (2019)","10.1103/PhysRevB.99.184422",,"cond-mat.mes-hall","http://arxiv.org/licenses/nonexclusive-distrib/1.0/","  Shell ferromagnetism is a new functional property of certain Heusler alloys
which has been recently observed in
$\mathrm{Ni}_{50}\mathrm{Mn}_{45}\mathrm{In}_{5}$. We report the results of a
comparative study of the magnetic microstructure of bulk
$\mathrm{Ni}_{50}\mathrm{Mn}_{45}\mathrm{In}_{5}$ Heusler alloys using
magnetometry, synchrotron x-ray diffraction, and magnetic small-angle neutron
scattering (SANS). By combining unpolarized and spin-polarized SANS (POLARIS)
we demonstrate that a number of important conclusions regarding the mesoscopic
spin structure can be made. In particular, the analysis of the magnetic neutron
data suggests that nanoprecipitates with an effective ferromagnetic component
form in an antiferromagnetic matrix on field annealing at $700 \, \mathrm{K}$.
These particles represent sources of perturbation, which seem to give rise to
magnetically disordered regions in the vicinity of the particle-matrix
interface. Analysis of the spin-flip SANS cross section via the computation of
the correlation function yields a value of $\sim 55 \, \mathrm{nm}$ for the
particle size and $\sim 20 \, \mathrm{nm}$ for the size of the spin-canted
region.
","[{""version"":""v1"",""created"":""Mon, 11 Mar 2019 09:21:46 GMT""}]","2019-05-22"
"1903.04184","Julien Serreau","Jan Maelger, Urko Reinosa, Julien Serreau","Localized rainbows in the QCD phase diagram","14 pages, 8 figures","Phys. Rev. D 101, 014028 (2020)","10.1103/PhysRevD.101.014028",,"hep-th hep-ph nucl-th","http://arxiv.org/licenses/nonexclusive-distrib/1.0/","  We study the phase diagram of strongly interacting matter with light quarks
using a recently proposed, small parameter approach to infrared QCD in the
Landau gauge. This is based on an expansion with respect to both the inverse
number of colors and the pure Yang-Mills coupling in the presence of a
Curci-Ferrari mass term. At leading order, this leads to the well-known rainbow
equation for the quark propagator with a massive gluon propagator. We solve the
latter at nonzero temperature and chemical potential using a simple
semi-analytic approximation known to capture the essence of chiral symmetry
breaking in the vacuum. In the chiral limit, we find a tricritical point which
becomes a critical endpoint in the presence of a nonzero bare quark mass, in
agreement with the results of nonperturbative functional methods and model
calculations. This supports the view that the present approach allows for a
systematic study of the QCD phase diagram in a controlled expansion scheme.
","[{""version"":""v1"",""created"":""Mon, 11 Mar 2019 09:27:26 GMT""},{""version"":""v2"",""created"":""Fri, 9 Aug 2019 13:39:58 GMT""}]","2020-02-05"
"1903.04185","Thomas Chambrion","Thomas Chambrion (EDP, IECL, SPHINX), Laurent Thomann (IECL, EDP)","Obstruction to the billinear control of the Gross-Pitaevskii equation:
  an example with an unbounded potential",,,,,"math.OC math.AP","http://arxiv.org/licenses/nonexclusive-distrib/1.0/","  In 1982, Ball, Marsden, and Slemrod proved an obstruction to the
controllability of linear dynamics with a bounded bilinear control term. This
note presents an example of nonlinear dynamics with respect to the state for
which this obstruction still holds while the control potential is not bounded.
","[{""version"":""v1"",""created"":""Mon, 11 Mar 2019 09:28:53 GMT""}]","2019-03-12"
"1903.04186","Oliver Henrich","Yair Augusto Gutierrez Fosado, Zhongyang Xing, Erika Eiser, Magdalena
  Hudek, and Oliver Henrich","A Numerical Study of Three-Armed DNA Hydrogel Structures","17 pages, 6 figures, 6 tables",,,,"cond-mat.soft cond-mat.mtrl-sci physics.bio-ph","http://arxiv.org/licenses/nonexclusive-distrib/1.0/","  We present a numerical analysis of a DNA hydrogel that consists of
three-valent Y-shaped DNA molecules. The building blocks self-assemble fully
reversibly from complementary single-stranded DNA segments. We compare melting
curves from both simulations with the oxDNA2 model and experiments and find
excellent agreement. The morphology of the Y-DNA molecules is investigated when
several alterations in the design are made. Adding inert nucleotides to the
central core region of the Y-DNA molecules has a very minor effect on their
overall geometry, whereas palindromic sequences in the sticky ends via which
the individual Y-DNA molecules hybridize, have a profound influence on their
relative twisting and bending angles.
","[{""version"":""v1"",""created"":""Mon, 11 Mar 2019 09:31:02 GMT""},{""version"":""v2"",""created"":""Wed, 3 Apr 2019 10:59:11 GMT""}]","2019-04-04"
"1903.04187","Peng Xie","Peng Xie, Yi Zhu","Wave packet dynamics in slowly modulated photonic graphene",,"Journal of Differential Equations-2019","10.1016/j.jde.2019.06.006",,"math.AP","http://arxiv.org/licenses/nonexclusive-distrib/1.0/","  Mathematical analysis on electromagnetic waves in photonic graphene, a
photonic topological material which has a honeycomb structure, is one of the
most important current research topics. By modulating the honeycomb structure,
numerous topological phenomena have been observed recently. The electromagnetic
waves in such a media are generally described by the 2-dimensional wave
equation. It has been shown that the corresponding elliptic operator with a
honeycomb material weight has Dirac points in its dispersion surfaces. In this
paper, we study the time evolution of the wave packets spectrally concentrated
at such Dirac points in a modulated honeycomb material weight. We prove that
such wave packet dynamics is governed by the Dirac equation with a varying mass
in a large but finite time. Our analysis provides mathematical insights to
those topological phenomena in photonic graphene.
","[{""version"":""v1"",""created"":""Mon, 11 Mar 2019 09:35:17 GMT""}]","2020-06-11"
"1903.04188","Vojtech Mrazek","Zdenek Vasicek and Vojtech Mrazek and Lukas Sekanina","Automated Circuit Approximation Method Driven by Data Distribution","Accepted for publication at Design, Automation and Test in Europe
  (DATE 2019). Florence, Italy",,"10.23919/DATE.2019.8714977",,"cs.AR cs.LG","http://arxiv.org/licenses/nonexclusive-distrib/1.0/","  We propose an application-tailored data-driven fully automated method for
functional approximation of combinational circuits. We demonstrate how an
application-level error metric such as the classification accuracy can be
translated to a component-level error metric needed for an efficient and fast
search in the space of approximate low-level components that are used in the
application. This is possible by employing a weighted mean error distance
(WMED) metric for steering the circuit approximation process which is conducted
by means of genetic programming. WMED introduces a set of weights (calculated
from the data distribution measured on a selected signal in a given
application) determining the importance of each input vector for the
approximation process. The method is evaluated using synthetic benchmarks and
application-specific approximate MAC (multiply-and-accumulate) units that are
designed to provide the best trade-offs between the classification accuracy and
power consumption of two image classifiers based on neural networks.
","[{""version"":""v1"",""created"":""Mon, 11 Mar 2019 09:36:06 GMT""}]","2019-07-30"
"1903.04189","Victor Efros","Victor D. Efros, Winfried Leidemann, and Veronika Yu. Shalamova","On calculating response functions via their Lorentz integral transforms","18 pages, 5 figures, submitted to FBS","Few-Body Syst. 60:35 (2019)","10.1007/s00601-019-1497-9",,"nucl-th physics.comp-ph","http://arxiv.org/licenses/nonexclusive-distrib/1.0/","  The accuracy of reconstruction of a response function from its Lorentz
integral transform is studied in an exactly solvable model. An inversion
procedure is elaborated in detail and features of the procedure are studied.
Unlike results in the literature pertaining to the same model, the response
function is reconstructed from its Lorentz integral transform with rather high
accuracy.
","[{""version"":""v1"",""created"":""Mon, 11 Mar 2019 09:41:52 GMT""}]","2019-05-09"
"1903.04190","Xingyi Cheng","Weipeng Huang, Xingyi Cheng, Kunlong Chen, Taifeng Wang, Wei Chu","Toward Fast and Accurate Neural Chinese Word Segmentation with
  Multi-Criteria Learning","Accepted at COLING 2020",,,,"cs.CL","http://arxiv.org/licenses/nonexclusive-distrib/1.0/","  The ambiguous annotation criteria lead to divergence of Chinese Word
Segmentation (CWS) datasets in various granularities. Multi-criteria Chinese
word segmentation aims to capture various annotation criteria among datasets
and leverage their common underlying knowledge. In this paper, we propose a
domain adaptive segmenter to exploit diverse criteria of various datasets. Our
model is based on Bidirectional Encoder Representations from Transformers
(BERT), which is responsible for introducing open-domain knowledge. Private and
shared projection layers are proposed to capture domain-specific knowledge and
common knowledge, respectively. We also optimize computational efficiency via
distillation, quantization, and compiler optimization. Experiments show that
our segmenter outperforms the previous state of the art (SOTA) models on 10 CWS
datasets with superior efficiency.
","[{""version"":""v1"",""created"":""Mon, 11 Mar 2019 09:48:39 GMT""},{""version"":""v2"",""created"":""Fri, 9 Oct 2020 07:58:36 GMT""}]","2020-10-12"
"1903.04191","Wouter Kouw","Wouter M. Kouw, Silas N. {\O}rting, Jens Petersen, Kim S. Pedersen,
  Marleen de Bruijne","A cross-center smoothness prior for variational Bayesian brain tissue
  segmentation","12 pages, 2 figures, 1 table. Accepted to the International
  Conference on Information Processing in Medical Imaging (2019)","International Conference on Information Processing in Medical
  Imaging (IPMI), Hong Kong, 2019, pp. 360-371","10.1007/978-3-030-20351-1_27",,"stat.ML cs.CV cs.LG","http://arxiv.org/licenses/nonexclusive-distrib/1.0/","  Suppose one is faced with the challenge of tissue segmentation in MR images,
without annotators at their center to provide labeled training data. One option
is to go to another medical center for a trained classifier. Sadly, tissue
classifiers do not generalize well across centers due to voxel intensity shifts
caused by center-specific acquisition protocols. However, certain aspects of
segmentations, such as spatial smoothness, remain relatively consistent and can
be learned separately. Here we present a smoothness prior that is fit to
segmentations produced at another medical center. This informative prior is
presented to an unsupervised Bayesian model. The model clusters the voxel
intensities, such that it produces segmentations that are similarly smooth to
those of the other medical center. In addition, the unsupervised Bayesian model
is extended to a semi-supervised variant, which needs no visual interpretation
of clusters into tissues.
","[{""version"":""v1"",""created"":""Mon, 11 Mar 2019 09:54:07 GMT""}]","2019-08-28"
"1903.04192","Xinyu Peng","Xinyu Peng, Li Li, Fei-Yue Wang","Accelerating Minibatch Stochastic Gradient Descent using Typicality
  Sampling","10 pages, 4 figures, for journal",,,,"cs.LG math.OC stat.ML","http://arxiv.org/licenses/nonexclusive-distrib/1.0/","  Machine learning, especially deep neural networks, has been rapidly developed
in fields including computer vision, speech recognition and reinforcement
learning. Although Mini-batch SGD is one of the most popular stochastic
optimization methods in training deep networks, it shows a slow convergence
rate due to the large noise in gradient approximation. In this paper, we
attempt to remedy this problem by building more efficient batch selection
method based on typicality sampling, which reduces the error of gradient
estimation in conventional Minibatch SGD. We analyze the convergence rate of
the resulting typical batch SGD algorithm and compare convergence properties
between Minibatch SGD and the algorithm. Experimental results demonstrate that
our batch selection scheme works well and more complex Minibatch SGD variants
can benefit from the proposed batch selection strategy.
","[{""version"":""v1"",""created"":""Mon, 11 Mar 2019 09:57:18 GMT""}]","2019-03-12"
"1903.04193","Denis Steckelmacher","Denis Steckelmacher, H\'el\`ene Plisnier, Diederik M. Roijers, Ann
  Now\'e","Sample-Efficient Model-Free Reinforcement Learning with Off-Policy
  Critics","Accepted at the European Conference on Machine Learning 2019 (ECML)",,,,"cs.LG cs.AI","http://arxiv.org/licenses/nonexclusive-distrib/1.0/","  Value-based reinforcement-learning algorithms provide state-of-the-art
results in model-free discrete-action settings, and tend to outperform
actor-critic algorithms. We argue that actor-critic algorithms are limited by
their need for an on-policy critic. We propose Bootstrapped Dual Policy
Iteration (BDPI), a novel model-free reinforcement-learning algorithm for
continuous states and discrete actions, with an actor and several off-policy
critics. Off-policy critics are compatible with experience replay, ensuring
high sample-efficiency, without the need for off-policy corrections. The actor,
by slowly imitating the average greedy policy of the critics, leads to
high-quality and state-specific exploration, which we compare to Thompson
sampling. Because the actor and critics are fully decoupled, BDPI is remarkably
stable, and unusually robust to its hyper-parameters. BDPI is significantly
more sample-efficient than Bootstrapped DQN, PPO, and ACKTR, on discrete,
continuous and pixel-based tasks. Source code:
https://github.com/vub-ai-lab/bdpi.
","[{""version"":""v1"",""created"":""Mon, 11 Mar 2019 09:59:58 GMT""},{""version"":""v2"",""created"":""Wed, 12 Jun 2019 13:49:50 GMT""}]","2019-06-13"
"1903.04194","Yong Sheng Soh","Yong Sheng Soh and Venkat Chandrasekaran","Fitting Tractable Convex Sets to Support Function Evaluations","35 pages, 80 figures",,"10.1007/s00454-020-00258-0",,"math.ST cs.CG math.OC stat.TH","http://arxiv.org/licenses/nonexclusive-distrib/1.0/","  The geometric problem of estimating an unknown compact convex set from
evaluations of its support function arises in a range of scientific and
engineering applications. Traditional approaches typically rely on estimators
that minimize the error over all possible compact convex sets; in particular,
these methods do not allow for the incorporation of prior structural
information about the underlying set and the resulting estimates become
increasingly more complicated to describe as the number of measurements
available grows. We address both of these shortcomings by describing a
framework for estimating tractably specified convex sets from support function
evaluations. Building on the literature in convex optimization, our approach is
based on estimators that minimize the error over structured families of convex
sets that are specified as linear images of concisely described sets -- such as
the simplex or the spectraplex -- in a higher-dimensional space that is not
much larger than the ambient space. Convex sets parametrized in this manner are
significant from a computational perspective as one can optimize linear
functionals over such sets efficiently; they serve a different purpose in the
inferential context of the present paper, namely, that of incorporating
regularization in the reconstruction while still offering considerable
expressive power. We provide a geometric characterization of the asymptotic
behavior of our estimators, and our analysis relies on the property that
certain sets which admit semialgebraic descriptions are Vapnik-Chervonenkis
(VC) classes. Our numerical experiments highlight the utility of our framework
over previous approaches in settings in which the measurements available are
noisy or small in number as well as those in which the underlying set to be
reconstructed is non-polyhedral.
","[{""version"":""v1"",""created"":""Mon, 11 Mar 2019 10:01:00 GMT""},{""version"":""v2"",""created"":""Thu, 25 Feb 2021 08:22:31 GMT""}]","2021-02-26"
"1903.04195","Viktor Reimer","Viktor Reimer, Maarten Rolf Wegewijs, Konstantin Nestmann, Mikhail
  Pletyukhov","Five approaches to exact open-system dynamics: Complete positivity,
  divisibility and time-dependent observables","Submitted to The Journal of Chemical Physics, 19 pages + 14 pages of
  appendices with 13 figures. Significantly extended introduction and
  discussion, no results changed","J. Chem. Phys. 151, 044101 (2019)","10.1063/1.5094412",,"quant-ph cond-mat.stat-mech","http://arxiv.org/licenses/nonexclusive-distrib/1.0/","  To extend the classical concept of Markovianity to an open quantum system,
different notions of the divisibility of its dynamics have been introduced.
Here we analyze this issue by five complementary approaches: equations of
motion, real-time diagrammatics, Kraus-operator sums, as well as time-local
(TCL) and nonlocal (Nakajima-Zwanzig) quantum master equations. As a case study
featuring several types of divisible dynamics, we examine in detail an exactly
solvable noninteracting fermionic resonant level coupled arbitrarily strongly
to a fermionic bath at arbitrary temperature in the wideband limit. In
particular, the impact of divisibility on the time-dependence of the observable
level occupation is investigated and compared with typical Markovian
approximations. We find that the loss of semigroup-divisibility is accompanied
by a prominent reentrant behavior: Counter to intuition, the level occupation
may temporarily \emph{increase} significantly in order to reach a stationary
state with \emph{smaller} occupation, implying a reversal of the measurable
transport current. In contrast, the loss of the so-called completely-positive
divisibility is more subtly signaled by the \emph{prohibition} of such current
reversals in specific time-intervals. Experimentally, it can be detected in the
family of transient currents obtained by varying the initial occupation. To
quantify the nonzero footprint left by the system in its effective environment,
we determine the exact time-dependent state of the latter as well as related
information measures such as entropy, exchange entropy and coherent
information.
","[{""version"":""v1"",""created"":""Mon, 11 Mar 2019 10:02:51 GMT""},{""version"":""v2"",""created"":""Thu, 25 Jul 2019 13:05:46 GMT""}]","2019-07-26"
"1903.04196","Richard C. Kraaij","Richard C. Kraaij","A general convergence result for viscosity solutions of Hamilton-Jacobi
  equations and non-linear semigroups",,,,,"math.FA math.AP","http://arxiv.org/licenses/nonexclusive-distrib/1.0/","  We extend the Barles-Perthame procedure of semi-relaxed limits of viscosity
solutions of Hamilton-Jacobi equations of the type f - lambda H f = h.
  The convergence result allows for equations on a `converging sequence of
spaces' as well as Hamilton-equations written in terms of two equations in
terms of operators H_\dagger and H_\dagger that serve as natural upper and
lower bounds for the `true' operator H.
  In the process, we establish a strong relation between non-linear
pseudo-resolvents and viscosity solutions of Hamilton-Jacobi equations. As a
consequence we derive a convergence result for non-linear semigroups.
","[{""version"":""v1"",""created"":""Mon, 11 Mar 2019 10:04:09 GMT""},{""version"":""v2"",""created"":""Thu, 23 May 2019 08:10:08 GMT""}]","2019-05-24"
"1903.04197","Yifan Liu","Yifan Liu, Changyong Shun, Jingdong Wang, and Chunhua Shen","Structured Knowledge Distillation for Dense Prediction","v1:10 pages cvpr2019 accepted; v2:15 pages for a journal version;
  Code is available at:
  https://github.com/irfanICMLL/structure_knowledge_distillation; fix typos",,,,"cs.CV","http://arxiv.org/licenses/nonexclusive-distrib/1.0/","  In this work, we consider transferring the structure information from large
networks to compact ones for dense prediction tasks in computer vision.
Previous knowledge distillation strategies used for dense prediction tasks
often directly borrow the distillation scheme for image classification and
perform knowledge distillation for each pixel separately, leading to
sub-optimal performance. Here we propose to distill structured knowledge from
large networks to compact networks, taking into account the fact that dense
prediction is a structured prediction problem. Specifically, we study two
structured distillation schemes: i) pair-wise distillation that distills the
pair-wise similarities by building a static graph; and ii) holistic
distillation that uses adversarial training to distill holistic knowledge. The
effectiveness of our knowledge distillation approaches is demonstrated by
experiments on three dense prediction tasks: semantic segmentation, depth
estimation and object detection. Code is available at: https://git.io/StructKD
","[{""version"":""v1"",""created"":""Mon, 11 Mar 2019 10:05:09 GMT""},{""version"":""v2"",""created"":""Tue, 12 Mar 2019 00:38:30 GMT""},{""version"":""v3"",""created"":""Thu, 17 Oct 2019 00:12:14 GMT""},{""version"":""v4"",""created"":""Wed, 11 Dec 2019 05:32:03 GMT""},{""version"":""v5"",""created"":""Thu, 20 Feb 2020 23:52:50 GMT""},{""version"":""v6"",""created"":""Thu, 30 Apr 2020 10:25:50 GMT""},{""version"":""v7"",""created"":""Sun, 14 Jun 2020 13:37:24 GMT""}]","2020-06-16"
"1903.04198","Eric Charron","R. Chamakhi, M. Telmini, O. Atabek and E. Charron","Anisotropy Control in Photoelectron Spectra: A Coherent Two-Pulse
  Interference Strategy",,"Phys. Rev. A 100, 033402 (2019)","10.1103/PhysRevA.100.033402",,"physics.chem-ph physics.atm-clus physics.atom-ph quant-ph","http://arxiv.org/licenses/nonexclusive-distrib/1.0/","  Coherence among rotational ion channels during photoionization is exploited
to control the anisotropy of the resulting photoelectron angular distributions
at specific photoelectron energies. The strategy refers to a robust and single
parameter control using two ultra-short light pulses delayed in time. The first
pulse prepares a superposition of a few ion rotational states, whereas the
second pulse serves as a probe that gives access to a control of the molecular
asymmetry parameter $\beta$ for individual rotational channels. This is
achieved by tuning the time delay between the pulses leading to channel
interferences that can be turned from constructive to destructive. The
illustrative example is the ionization of the $E(1\Sigma_{g}^{+})$ state of
Li$_{2}$. Quantum wave packet evolutions are conducted including both
electronic and nuclear degrees of freedom to reach angle-resolved photoelectron
spectra. A simple interference model based on coherent phase accumulation
during the field-free dynamics between the two pulses is precisely exploited to
control the photoelectron angular distributions from almost isotropic, to
marked anisotropic.
","[{""version"":""v1"",""created"":""Mon, 11 Mar 2019 10:15:46 GMT""},{""version"":""v2"",""created"":""Mon, 19 Aug 2019 14:11:16 GMT""}]","2019-09-11"
"1903.04199","G. S. Bisnovatyi-Kogan","V.S. Belyaev, G.S. Bisnovatyi-Kogan, A.I. Gromov, B.V. Zagreev, A.V.
  Lobanov, A.P. Matafonov, S.G. Moiseenko, O.D. Toropina","Numerical Simulations of Magnetized Astrophysical Jets and Comparison
  with Laboratory Laser Experiments","21 pages, 19 figures, published in Astronomy reports 62, 162-188,
  2018",,"10.1134/S1063772918030034",,"astro-ph.HE physics.plasm-ph","http://arxiv.org/licenses/nonexclusive-distrib/1.0/","  The results of MHD numerical simulations of the formation and development of
magnetized jets are presented. Similarity criteria for comparisons of the
results of laboratory laser experiments and numerical simulations of
astrophysical jets are discussed. The results of laboratory simulations of jets
generated in experiments at the Neodim laser installation are presented.
","[{""version"":""v1"",""created"":""Mon, 11 Mar 2019 10:26:20 GMT""}]","2019-03-20"
"1903.04200","Henri Lombardi","Henri Lombardi","Algebra in Bishop's style: some major features of the book ""A Course in
  Constructive Algebra'' by Mines, Richman, and Ruitenburg","This article has to appear as a chapter in the forthcoming Handbook
  of Bishop's Constructive Mathematics",,,,"math.HO","http://arxiv.org/licenses/nonexclusive-distrib/1.0/","  The book ""A Course in Constructive Algebra"" (1988) shows the way of
understanding classical basic algebra in a constructive style similar to
Bishop's Constructive Mathematics. Classical theorems are revisited, with a new
flavour, and become much more precise. We are often surprised to find proofs
that are simpler and more elegant than the usual ones. In fact, when one cannot
use magic tools as the law of excluded middle, it is necessary to understand
what is the true content of a classical proof. Also, usual shortcuts allowed in
classical proofs introduce sometimes useless detours. In order to understand
clearly a problem, prescience may be a handicap.
","[{""version"":""v1"",""created"":""Mon, 11 Mar 2019 10:26:25 GMT""}]","2019-03-12"
