"1903.04318","Kiyoshi Igusa","Kiyoshi Igusa, Gordana Todorov","Cyclic posets and triangulation clusters","32 pages, 10 figures, presented by second author at Tsinghua
  University and at the Chern Institute of Mathematics, Nankai University,
  China, July 3-13, 2017, accepted for publication in SCIENCE CHINA
  Mathematics. v2: minor corrections, theorems renumbers",,"10.1007/s11425-018-9507-3",,"math.RT","http://arxiv.org/licenses/nonexclusive-distrib/1.0/","  Triangulated categories coming from cyclic posets were originally introduced
by the authors in [IT15b] as a generalization of the constructions of various
triangulated categories with cluster structures. We give an overview, then
analyze triangulation clusters which are those corresponding to topological
triangulations of the 2-disk. Locally finite non-triangulation clusters give
topological triangulations of the cactus space associated to the cactus cyclic
poset.
","[{""version"":""v1"",""created"":""Mon, 11 Mar 2019 14:17:35 GMT""},{""version"":""v2"",""created"":""Mon, 25 Mar 2019 00:50:37 GMT""}]","2019-03-26"
"1903.04319","Gilberto Sousa Farias","Thiago Gouveia da Silva, Gilberto F. de Sousa Filho, Luiz Satoru Ochi,
  Philippe Michelon, Serigne Gueye and Lucidio A. F. Cabral","Solving the minimum labeling global cut problem by mathematical
  programming",,,,,"cs.DM","http://arxiv.org/licenses/nonexclusive-distrib/1.0/","  Let G = (V, E, L) be an edge-labeled graph such that V is the set of
vertices, E is the set of edges, L is the set of labels (colors) and each edge
e \in E has a label l(e) associated; The goal of the minimum labeling global
cut problem (MLGCP) is to find a subset L \subseteq L of labels such that G =
(V, E , L\L ) is not connected and |L| is minimized. This work proposes three
new mathematical formulations for the MLGCP as well as branch-and-cut
algorithms to solve them. The computational experiments showed that the
proposed methods are able to solve small to average sized instances in a
reasonable amount of time.
","[{""version"":""v1"",""created"":""Mon, 11 Mar 2019 14:21:18 GMT""}]","2019-03-20"
"1903.04320","Jian Wang","Long-Bin Chen, Jian Wang","Master integrals of a planar double-box family for top-quark pair
  production","11 pages, 4 figures",,"10.1016/j.physletb.2019.03.030","TUM-HEP-1183/19","hep-ph","http://arxiv.org/licenses/nonexclusive-distrib/1.0/","  We calculate analytically the master integrals of a planar double-box family
for top-quark pair production using the method of differential equations. With
a proper choice of the bases, the differential equations can be transformed to
the $d$-log form. The square roots of the kinematic variables in the
differential equations can be rationalized by defining two dimensionless
variables. We find that all the boundary conditions can be fully fixed either
by simple integrals or regularity conditions at some special kinematic points.
The analytic results for thirty-three master integrals at general kinematics
are all expressed in terms of multiple polylogarithms up to transcendental
weight four.
","[{""version"":""v1"",""created"":""Mon, 11 Mar 2019 14:21:57 GMT""}]","2019-03-27"
"1903.04321","Goutam Sheet","Aastha Vasdev, Anshu Sirohi, M.K. Hooda, C.S Yadav, Goutam Sheet","Enhanced, homogeneous type II superconductivity in Cu-intercalated
  PdTe$_2$","4 pages , 3 figures",,"10.1088/1361-648X/ab5ac4",,"cond-mat.supr-con","http://arxiv.org/licenses/nonexclusive-distrib/1.0/","  Though the superconducting phase of the type-II Dirac semimetal PdTe$_2$ was
shown to be conventional in nature, the phase continued to be interesting in
terms of its magnetic properties. While certain experiments indicated an
unexpected type-I superconducting phase, other experiments revealed formation
of vortices under the application of magnetic fields. Recently, scanning
tunneling spectroscopy (STS) experiments revealed the existence of a mixed
phase where type-I and type-II behaviours coexist. Here, based on our
temperature and magnetic field dependent STS experiments on Cu-intercalated
PdTe$_2$ we show that as the critical temperature of the superconducting phase
goes up from 1.7 K to 2.4 K on Cu-intercalation, the mixed phase disappears and
the system becomes homogeneously type-II. This may be attributed to an
averaging effect caused by quasiparticle exchange between type-I and type-II
domains mediated by the Cu atoms and to decreased coherence length due to
increased disorder.
","[{""version"":""v1"",""created"":""Mon, 11 Mar 2019 14:27:04 GMT""}]","2020-01-29"
"1903.04322","Lei Zhang","Lei Zhang","The Exterior Cubic L-function of GU(6) and Unitary Automorphic Induction","44 pages",,,,"math.NT math.RT","http://arxiv.org/licenses/nonexclusive-distrib/1.0/","  In this paper, we extend Ginzburg-Rallis' integral representation for the
exterior cube automorphic $L$-function of ${\rm GL}_6\times {\rm GL}_1$ to that
of the quasi-split unitary similitude group ${\rm GU}_6$ and establish its
analytic properties to determine the poles of this $L$-function. Furthermore,
we introduce the automorphic induction for automorphic representations of ${\rm
GU}_n$ and then show that the weak Langlands functorial lift for the
automorphic induction exists for generic cuspidal automorphic representations.
By using this automorphic induction, we give a conjectural criterion on the
existence of poles of $L(s,\pi,\wedge^{3}\otimes\chi)$ for discrete automorphic
representations in the tempered spectrum.
","[{""version"":""v1"",""created"":""Mon, 11 Mar 2019 14:29:57 GMT""}]","2019-03-12"
"1903.04323","Babette D\""obrich","S. Arguedas Cuendis, A. \'Alvarez Melc\'on, C. Cogollos, A.
  D\'iaz-Morcillo, B. D\""obrich, J.D. Gallego, B. Gimeno, I.G. Irastorza, A.J.
  Lozano-Guerrero, C. Malbrunot, P. Navarro, C. Pe\~na Garay, J. Redondo, T.
  Vafeiadis, W. Wuensch","The 3 cavity prototypes of RADES, an axion detector using microwave
  filters at CAST","Proceedings for the 3rd Axion Cavity and Detector Workshop, Livermore
  Valley Open Campus August 21-25th, 2018",,,,"physics.ins-det hep-ex","http://arxiv.org/licenses/nonexclusive-distrib/1.0/","  The Relic Axion Detector Experimental Setup (RADES) is an axion search
project that uses a microwave filter as resonator for Dark Matter conversion.
The main focus of this publication is the description of the 3 different cavity
prototypes of RADES. The result of the first tests of one of the prototypes is
also presented. The filters consist of 5 or 6 stainless steel sub-cavities
joined by rectangular irises. The size of the sub-cavities determines the
working frequency, the amount of sub-cavities determine the working volume. The
first cavity prototype was built in 2017 to work at a frequency of $\sim$ 8.4
GHz and it was placed at the 9 T CAST dipole magnet at CERN. Two more
prototypes were designed and built in 2018. The aim of the new designs is to
find and test the best cavity geometry in order to scale up in volume and to
introduce an effective tuning mechanism. Our results demonstrate the promising
potential of this type of filter to reach QCD axion sensitivity at X-Band
frequencies.
","[{""version"":""v1"",""created"":""Mon, 11 Mar 2019 14:31:35 GMT""}]","2019-03-12"
"1903.04324","Alexander Kashlinsky","A. Kashlinsky, R. G. Arendt, M. Ashby, F. Atrio-Barandela, V. Bromm,
  N. Cappelluti, S. Clesse, A. Comastri, J-G. Cuby, S. Driver, G. Fazio, A.
  Ferrara, A. Finoguenov, D. Fixsen, J. Garcia-Bellido, G. Hasinger, K.
  Helgason, R. J. Hill, R. Jansen, J. Kruk, J. Mather, P. Natarajan, N.
  Odegard, T. Reiprich, M. Ricotti, M. Sahlen, E. Switzer, R. Windhorst, E.
  Wollack, Bin Yue","Populations behind the source-subtracted cosmic infrared background
  anisotropies","Science whitepaper submitted to the Astro2020 Decadal Survey",,,,"astro-ph.CO","http://arxiv.org/licenses/nonexclusive-distrib/1.0/","  While the upcoming telescopes will reveal correspondingly fainter, more
distant galaxies, a question will persist: what more is there that these
telescopes cannot see? One answer is the source-subtracted Cosmic Infrared
Background (CIB). The CIB is comprised of the collective light from all sources
remaining after known, resolved sources are accounted for. Ever-more-sensitive
surveys will identify the brightest of these, allowing them to be removed, and
- like peeling layers off an onion - reveal deeper layers of the CIB. In this
way it is possible to measure the contributions from populations not accessible
to direct telescopic observation. Measurement of fluctuations in the
source-subtracted CIB, i.e., the spatial power spectrum of the CIB after
subtracting resolved sources, provides a robust means of characterizing its
faint, and potentially new, populations. Studies over the past 15 years have
revealed source-subtracted CIB fluctuations on scales out to ~100' which cannot
be explained by extrapolating from known galaxy populations. Moreover, they
appear highly coherent with the unresolved Cosmic X-ray Background, hinting at
a significant population of accreting black holes among the CIB sources.
Characterizing the source-subtracted CIB with high accuracy, and thereby
constraining the nature of the new populations, is feasible with upcoming
instruments and would produce critically important cosmological information in
the next decade. New coextensive deep and wide-area near-infrared, X-ray, and
microwave surveys will bring decisive opportunities to examine, with high
fidelity, the spatial spectrum and origin of the CIB fluctuations and their
cross-correlations with cosmic microwave and X-ray backgrounds, and determine
the formation epochs and the nature of the new sources (stellar nucleosynthetic
or accreting black holes).
","[{""version"":""v1"",""created"":""Mon, 11 Mar 2019 14:32:58 GMT""}]","2019-03-12"
"1903.04325","Pascal Vanier","Ronnie Pavlov, Pascal Vanier (LACL)","The relationship between word complexity and computational complexity in
  subshifts",,,,,"cs.DM cs.CC cs.FL math.DS","http://arxiv.org/licenses/nonexclusive-distrib/1.0/","  We prove several results about the relationship between the word complexity
function of a subshift and the set of Turing degrees of points of the subshift,
which we call the Turing spectrum. Among other results, we show that a Turing
spectrum can be realized via a subshift of linear complexity if and only if it
consists of the union of a finite set and a finite number of cones, that a
Turing spectrum can be realized via a subshift of exponential complexity (i.e.
positive entropy) if and only if it contains a cone, and that every Turing
spectrum which either contains degree 0 or is a union of cones is realizable by
subshifts with a wide range of 'intermediate' complexity growth rates between
linear and exponential.
","[{""version"":""v1"",""created"":""Mon, 11 Mar 2019 14:34:13 GMT""}]","2019-03-12"
"1903.04326","Denise Ratasich","Denise Ratasich, Michael Platzer, Radu Grosu, Ezio Bartocci","Adaptive Fault Detection exploiting Redundancy with Uncertainties in
  Space and Time","preprint",,,,"cs.SY","http://arxiv.org/licenses/nonexclusive-distrib/1.0/","  The Internet of Things (IoT) connects millions of devices of different
cyber-physical systems (CPSs) providing the CPSs additional (implicit)
redundancy during runtime. However, the increasing level of dynamicity,
heterogeneity, and complexity adds to the system's vulnerability, and
challenges its ability to react to faults. Self-healing is an increasingly
popular approach for ensuring resilience, that is, a proper monitoring and
recovery, in CPSs. This work encodes and searches an adaptive knowledge base in
Prolog/ProbLog that models relations among system variables given that certain
implicit redundancy exists in the system. We exploit the redundancy represented
in our knowledge base to generate adaptive runtime monitors which compares
related signals by considering uncertainties in space and time. This enables
the comparison of uncertain, asynchronous, multi-rate and delayed measurements.
The monitor is used to trigger the recovery process of a self-healing
mechanism. We demonstrate our approach by deploying it in a real-world CPS
prototype of a rover whose sensors are susceptible to failure.
","[{""version"":""v1"",""created"":""Mon, 11 Mar 2019 14:34:58 GMT""}]","2019-03-12"
"1903.04327","Hans Franzen","Hans Franzen","Rationality of Rigid Quiver Grassmannians","10 pages",,,,"math.AG math.RT","http://arxiv.org/licenses/nonexclusive-distrib/1.0/","  We show that any quiver Grassmannian associated with a rigid representation
of a quiver is a rational variety using torus localization techniques.
","[{""version"":""v1"",""created"":""Mon, 11 Mar 2019 14:38:37 GMT""}]","2019-03-12"
"1903.04328","Adrien Baldit","Ahmed H. Alamoud, Emmanuel Baillot (ENIM), Camila Belabbas (ENIM),
  Hadi S. Samimi Ardestani, Hamid Bahai, Adrien Baldit (ENIM, LEM3), Mahmoud
  Chizari","Continuous and Pulsed Experiments with Numerical Simulation to Dissect
  Pituitary Gland Tumour by Using Liquid Jet",,"Engineering Letters, 2017",,,"physics.med-ph physics.class-ph","http://arxiv.org/licenses/nonexclusive-distrib/1.0/","  Endoscopic endonasal surgery is a minimal invasive surgery that has been used
to dissect pituitary gland tumour via curettes with the help of endoscope.
However, this type of surgery has a high risk of failure because curettes may
cause damages to blood vessels and optical nerves that lead to more
complication for the patient. The aim of this study is to develop a new
technique to dissect the tumour by using liquid jet. A series of experimental
tests have been performed on animal tissue to study the effect of liquid
pressure and nozzle diameter on dissecting and cutting the tissue. Continuous /
pulsed liquid jet used with variable nozzle diameters, distances, pressures and
angles. The study concluded with promising results on liquid jet to dissect
hypophysis tumour and preserving fine blood vessels and optical nerve located
near the pituitary gland. Index Terms-Endoscopic endonasal surgery, tumour
removal, liquid jet, continuous and pulsed jet
","[{""version"":""v1"",""created"":""Mon, 11 Mar 2019 14:40:11 GMT""}]","2019-03-12"
"1903.04329","Eszter Bok\'anyi","Eszter Bok\'anyi, D\'aniel Kondor, G\'abor Vattay","Scaling in Words on Twitter",,,,,"physics.soc-ph cs.CL cs.SI","http://arxiv.org/licenses/nonexclusive-distrib/1.0/","  Scaling properties of language are a useful tool for understanding generative
processes in texts. We investigate the scaling relations in citywise Twitter
corpora coming from the Metropolitan and Micropolitan Statistical Areas of the
United States. We observe a slightly superlinear urban scaling with the city
population for the total volume of the tweets and words created in a city. We
then find that a certain core vocabulary follows the scaling relationship of
that of the bulk text, but most words are sensitive to city size, exhibiting a
super- or a sublinear urban scaling. For both regimes we can offer a plausible
explanation based on the meaning of the words. We also show that the parameters
for Zipf's law and Heaps law differ on Twitter from that of other texts, and
that the exponent of Zipf's law changes with city size.
","[{""version"":""v1"",""created"":""Mon, 11 Mar 2019 14:41:07 GMT""}]","2019-03-12"
"1903.04330","Lukas Liensberger","Lukas Liensberger, Akashdeep Kamra, Hannes Maier-Flaig, Stephan
  Gepr\""ags, Andreas Erb, Sebastian T. B. Goennenwein, Rudolf Gross, Wolfgang
  Belzig, Hans Huebl, Mathias Weiler","Exchange-enhanced Ultrastrong Magnon-Magnon Coupling in a Compensated
  Ferrimagnet",,"Phys. Rev. Lett. 123, 117204 (2019)","10.1103/PhysRevLett.123.117204",,"cond-mat.mtrl-sci cond-mat.mes-hall","http://arxiv.org/licenses/nonexclusive-distrib/1.0/","  The ultrastrong coupling of (quasi-)particles has gained considerable
attention due to its application potential and richness of the underlying
physics. Coupling phenomena arising due to electromagnetic interactions are
well explored. In magnetically ordered systems, the quantum-mechanical
exchange-interaction should furthermore enable a fundamentally different
coupling mechanism. Here, we report the observation of ultrastrong intralayer
exchange-enhanced magnon-magnon coupling in a compensated ferrimagnet. We
experimentally study the spin dynamics in a gadolinium iron garnet single
crystal using broadband ferromagnetic resonance. Close to the ferrimagnetic
compensation temperature, we observe ultrastrong coupling of clockwise and
anticlockwise magnon modes. The magnon-magnon coupling strength reaches more
than 30% of the mode frequency and can be tuned by varying the direction of the
external magnetic field. We theoretically explain the observed phenomenon in
terms of an exchange-enhanced mode-coupling mediated by a weak cubic
anisotropy.
","[{""version"":""v1"",""created"":""Mon, 11 Mar 2019 14:41:10 GMT""},{""version"":""v2"",""created"":""Mon, 23 Sep 2019 11:09:43 GMT""}]","2019-09-24"
"1903.04331","Rachid Zarouf","Anton Baranov, Rachid Zarouf (ADEF)","$H^{\infty}$ interpolation and embedding theorems for rational functions",,,,,"math.CV math.SP","http://arxiv.org/licenses/nonexclusive-distrib/1.0/","  We consider a Nevanlinna-Pick interpolation problem on finite sequences of
the unit disc D constrained by Hardy and radial-weighted Bergman norms. We find
sharp asymptotics on the corresponding interpolation constants. As another
application of our techniques we prove embedding theorems for rational
functions. We find that the embedding of H $\infty$ into Hardy or
radial-weighted Bergman spaces in D is invertible on the subset of rational
functions of a given degree n whose poles are separated from the unit circle
and obtain asymptotically sharp estimates of the corresponding embedding
constants. Mathematics Subject Classification (2010). Primary 15A60, 32A36,
26A33; Secondary 30D55, 26C15, 41A10.
","[{""version"":""v1"",""created"":""Mon, 11 Mar 2019 14:42:09 GMT""}]","2019-03-12"
"1903.04332","Emmanuel Paradis","Emmanuel Paradis (ISEM)","Interactions between spatial and temporal scales in the evolution of
  dispersal rate",,"Evolutionary Ecology, Springer Verlag, 1998, 12 (2), pp.235-244","10.1023/A:1006539930788",,"q-bio.PE","http://arxiv.org/licenses/nonexclusive-distrib/1.0/","  The evolution of dispersal rate is studied with a model of several local
populations linked by dispersal. Three dispersal strategies are considered
where all, half, or none of the offspring disperse. The spatial scale (number
of patches) and the temporal scale (probability of local extinction) of the
environment are critical in determining the selective advantage of the
different dispersal strategies. The results from the simulations suggest that
an interaction between group selection and individual selection results in a
different outcome in relation to the spatial and temporal scales of the
environment. Such an interaction is able to maintain a polymorphism in
dispersal strategies. The maintenance of this polymorphism is also
scale-dependent. This study suggests a mechanism for the short-term evolution
of dispersal, and provides a testable prediction of this hypothesis, namely
that loss of dispersal abilities should be more frequent in spatially more
continuous environments, or in temporally more stable environments.
","[{""version"":""v1"",""created"":""Mon, 11 Mar 2019 14:43:38 GMT""}]","2019-03-12"
"1903.04333","Mauricio Bustamante","Markus Ackermann, Markus Ahlers, Luis Anchordoqui, Mauricio
  Bustamante, Amy Connolly, Cosmin Deaconu, Darren Grant, Peter Gorham, Francis
  Halzen, Albrecht Karle, Kumiko Kotera, Marek Kowalski, Miguel A. Mostafa,
  Kohta Murase, Anna Nelles, Angela Olinto, Andres Romero-Wolf, Abigail
  Vieregg, Stephanie Wissel","Fundamental Physics with High-Energy Cosmic Neutrinos","White paper for the Astro2020 US decadal survey. Companion paper:
  ""Astrophysics Uniquely Enabled by Observations of High-Energy Cosmic
  Neutrinos"" (1903.04334). Corresponding Authors: Luis Anchordoqui, Mauricio
  Bustamante, Darren Grant, Andres Romero-Wolf, Abigail Vieregg, Stephanie
  Wissel","Bull. Am. Astron. Soc. 51, 215 (2019)",,,"astro-ph.HE astro-ph.CO hep-ph","http://arxiv.org/licenses/nonexclusive-distrib/1.0/","  High-energy cosmic neutrinos can reveal new fundamental particles and
interactions, probing energy and distance scales far exceeding those accessible
in the laboratory. This white paper describes the outstanding particle physics
questions that high-energy cosmic neutrinos can address in the coming decade. A
companion white paper discusses how the observation of cosmic neutrinos can
address open questions in astrophysics. Tests of fundamental physics using
high-energy cosmic neutrinos will be enabled by detailed measurements of their
energy spectrum, arrival directions, flavor composition, and timing.
","[{""version"":""v1"",""created"":""Mon, 11 Mar 2019 14:45:01 GMT""},{""version"":""v2"",""created"":""Sun, 30 Jun 2019 13:45:00 GMT""}]","2019-07-02"
"1903.04334","Abigail Vieregg","Markus Ackermann, Markus Ahlers, Luis Anchordoqui, Mauricio
  Bustamante, Amy Connolly, Cosmin Deaconu, Darren Grant, Peter Gorham, Francis
  Halzen, Albrecht Karle, Kumiko Kotera, Marek Kowalski, Miguel A. Mostafa,
  Kohta Murase, Anna Nelles, Angela Olinto, Andres Romero-Wolf, Abigail
  Vieregg, Stephanie Wissel","Astrophysics Uniquely Enabled by Observations of High-Energy Cosmic
  Neutrinos","White paper for the Astro2020 US decadal survey. Companion paper:
  ""Fundamental Physics with High-Energy Cosmic Neutrinos"" (1903.04333).
  Corresponding Authors: Markus Ahlers, Albrecht Karle, Kohta Murase, Anna
  Nelles, Andres Romero-Wolf, Abigail Vieregg","Bull. Am. Astron. Soc. 51, 185 (2019)",,,"astro-ph.HE astro-ph.CO hep-ph","http://arxiv.org/licenses/nonexclusive-distrib/1.0/","  High-energy cosmic neutrinos carry unique information about the most
energetic non-thermal sources in the Universe. This white paper describes the
outstanding astrophysics questions that neutrino astronomy can address in the
coming decade. A companion white paper discusses how the observation of cosmic
neutrinos can address open questions in fundamental physics. Detailed
measurements of the diffuse neutrino flux, measurements of neutrinos from point
sources, and multi-messenger observations with neutrinos will enable the
discovery and characterization of the most energetic sources in the Universe.
","[{""version"":""v1"",""created"":""Mon, 11 Mar 2019 14:45:04 GMT""},{""version"":""v2"",""created"":""Mon, 1 Jul 2019 20:24:16 GMT""}]","2019-07-03"
"1903.04335","Jean Bernard Lasserre","Simon Foucart (TAMU), Jean-Bernard Lasserre (LAAS)","Computation of Chebyshev Polynomials for Union of Intervals",,,,,"math.OC math.FA math.NA","http://arxiv.org/licenses/nonexclusive-distrib/1.0/","  Chebyshev polynomials of the first and second kind for a set K are monic
polynomials with minimal L $\infty$-and L 1-norm on K, respectively. This
articles presents numerical procedures based on semidefinite programming to
compute these polynomials in case K is a finite union of compact intervals. For
Chebyshev polynomials of the first kind, the procedure makes use of a
characterization of polynomial nonnegativity. It can incorporate additional
constraints, e.g. that all the roots of the polynomial lie in K. For Chebyshev
polynomials of the second kind, the procedure exploits the method of moments.
Key words and phrases: Chebyshev polynomials of the first kind, Chebyshev
polynomials of the second kind, nonnegative polynomials, method of moments,
semidefinite programming.
","[{""version"":""v1"",""created"":""Mon, 11 Mar 2019 14:45:10 GMT""}]","2019-03-12"
"1903.04336","Ming Li","Ming Li, Zong Wang, Jing Wang, Shuqian Shen and Shao-ming Fei","The norms of Bloch vectors and classification of four qudits quantum
  states","8 pages, 1 figure","EPL, 125, 20006 (2019)","10.1209/0295-5075/125/20006",,"quant-ph","http://arxiv.org/licenses/nonexclusive-distrib/1.0/","  We investigate the norms of the Bloch vectors for any quantum state with
subsystems less than or equal to four. Tight upper bounds of the norms are
obtained, which can be used to derive tight upper bounds for entanglement
measure defined by the norms of Bloch vectors. By using these bounds a
trade-off relation of the norms of Bloch vectors is discussed. Theses upper
bounds are then applied on separability. Necessary conditions are presented for
different kinds of separable states in four-partite quantum systems. We further
present a complete classification of quantum states for four qudits quantum
systems.
","[{""version"":""v1"",""created"":""Mon, 11 Mar 2019 14:47:39 GMT""}]","2019-03-27"
