"1903.03614","Jiawei Zhang","Jiawei Zhang","Gradient Descent based Optimization Algorithms for Deep Learning Models
  Training","arXiv admin note: text overlap with arXiv:1805.07500",,,,"cs.LG cs.AI stat.ML","http://arxiv.org/licenses/nonexclusive-distrib/1.0/","  In this paper, we aim at providing an introduction to the gradient descent
based optimization algorithms for learning deep neural network models. Deep
learning models involving multiple nonlinear projection layers are very
challenging to train. Nowadays, most of the deep learning model training still
relies on the back propagation algorithm actually. In back propagation, the
model variables will be updated iteratively until convergence with gradient
descent based optimization algorithms. Besides the conventional vanilla
gradient descent algorithm, many gradient descent variants have also been
proposed in recent years to improve the learning performance, including
Momentum, Adagrad, Adam, Gadam, etc., which will all be introduced in this
paper respectively.
","[{""version"":""v1"",""created"":""Mon, 11 Mar 2019 12:59:47 GMT""}]","2019-03-12"
"1903.04015","Wenbo Zhao","Wenbo Zhao, Xianming Liu, Yongsen Zhao, Xiaopeng Fan, Debin Zhao","NormalNet: Learning-based Normal Filtering for Mesh Denoising",,,,,"cs.GR cs.CG","http://arxiv.org/licenses/nonexclusive-distrib/1.0/","  Mesh denoising is a critical technology in geometry processing that aims to
recover high-fidelity 3D mesh models of objects from their noise-corrupted
versions. In this work, we propose a learning-based normal filtering scheme for
mesh denoising called NormalNet, which maps the guided normal filtering (GNF)
into a deep network. The scheme follows the iterative framework of
filtering-based mesh denoising. During each iteration, first, the voxelization
strategy is applied on each face in a mesh to transform the irregular local
structure into the regular volumetric representation, therefore, both the
structure and face normal information are preserved and the convolution
operations in CNN(Convolutional Neural Network) can be easily performed.
Second, instead of the guidance normal generation and the guided filtering in
GNF, a deep CNN is designed, which takes the volumetric representation as
input, and outputs the learned filtered normals. At last, the vertex positions
are updated according to the filtered normals. Specifically, the iterative
training framework is proposed, in which the generation of training data and
the network training are alternately performed, whereas the ground truth
normals are taken as the guidance normals in GNF to get the target normals.
Compared to state-of-the-art works, NormalNet can effectively remove noise
while preserving the original features and avoiding pseudo-features.
","[{""version"":""v1"",""created"":""Sun, 10 Mar 2019 16:04:38 GMT""},{""version"":""v2"",""created"":""Thu, 14 Nov 2019 11:56:27 GMT""}]","2019-11-15"
"1903.04016","Yu Chen","Yu Chen and Telmo Silva Filho and Ricardo B. C. Prud\^encio and Tom
  Diethe and Peter Flach","$\beta^3$-IRT: A New Item Response Model and its Applications",,"AISTATS 2019",,,"stat.ML cs.LG","http://arxiv.org/licenses/nonexclusive-distrib/1.0/","  Item Response Theory (IRT) aims to assess latent abilities of respondents
based on the correctness of their answers in aptitude test items with different
difficulty levels. In this paper, we propose the $\beta^3$-IRT model, which
models continuous responses and can generate a much enriched family of Item
Characteristic Curve (ICC). In experiments we applied the proposed model to
data from an online exam platform, and show our model outperforms a more
standard 2PL-ND model on all datasets. Furthermore, we show how to apply
$\beta^3$-IRT to assess the ability of machine learning classifiers. This novel
application results in a new metric for evaluating the quality of the
classifier's probability estimates, based on the inferred difficulty and
discrimination of data instances.
","[{""version"":""v1"",""created"":""Sun, 10 Mar 2019 16:06:50 GMT""},{""version"":""v2"",""created"":""Wed, 13 Mar 2019 11:09:51 GMT""},{""version"":""v3"",""created"":""Mon, 3 Jun 2019 16:07:12 GMT""}]","2019-06-04"
"1903.04017","Yangwen Zhang","Gang Chen, Liangya Pi, Liwei Xu, Yangwen Zhang","A Superconvergent Ensemble HDG Method for Parameterized Convection
  Diffusion Equations",,,,,"math.NA","http://arxiv.org/licenses/nonexclusive-distrib/1.0/","  In this paper, we first devise an ensemble hybridizable discontinuous
Galerkin (HDG) method to efficiently simulate a group of parameterized
convection diffusion PDEs. These PDEs have different coefficients, initial
conditions, source terms and boundary conditions. The ensemble HDG discrete
system shares a common coefficient matrix with multiple right hand side (RHS)
vectors; it reduces both computational cost and storage. We have two
contributions in this paper. First, we derive an optimal $L^2$ convergence rate
for the ensemble solutions on a general polygonal domain, which is the first
such result in the literature. Second, we obtain a superconvergent rate for the
ensemble solutions after an element-by-element postprocessing under some
assumptions on the domain and the coefficients of the PDEs. We present
numerical experiments to confirm our theoretical results.
","[{""version"":""v1"",""created"":""Sun, 10 Mar 2019 16:14:41 GMT""}]","2019-03-12"
"1903.04018","Yeor Hafouta","Yeor Hafouta","Limit theorems for some time dependent expanding dynamical systems","36 pages. The title has changed, all the results concerning
  inhomogeneous will appear somewhere else. In addition, non-uniformly distance
  expanding maps are now considered",,"10.1088/1361-6544/aba5e7",,"math.DS math.PR","http://arxiv.org/licenses/nonexclusive-distrib/1.0/","  In this paper we will prove various probabilistic limit theorems for some
classes of distance expanding sequential dynamical systems (SDS). Our starting
point here is certain sequential complex Ruelle-Perron-Frobenius (RPF) theorems
which were proved in \cite{book} and \cite{ASIP me} using contraction
properties of a complex version of the projective Hilbert metric developed in
\cite{Rug}. We will start from the growth rate of the variances of the
underlying partial sums. This is well understood in the random dynamics setup,
when the maps are stationary, but not in the SDS setup, where various growth
rates can occur. Some of our results in this direction rely on certain type of
stability in these RPF theorems, which is one of the novelties of this paper.
Then we will provide general conditions for several classical limit theorems to
hold true in the sequential setup. Some of our general results mostly have
applications for composition of random non-stationary map, while the conditions
of the other results hold true for general type of SDS. In the latter setup,
results such as the Berry-Esse\'en theorem and the local central limit theorem
were not obtained so far even for independent but not identically distributed
maps, which is a particular case of the setup considered in this paper.
","[{""version"":""v1"",""created"":""Sun, 10 Mar 2019 16:20:33 GMT""},{""version"":""v2"",""created"":""Mon, 18 Mar 2019 14:24:14 GMT""},{""version"":""v3"",""created"":""Mon, 1 Apr 2019 14:48:52 GMT""},{""version"":""v4"",""created"":""Thu, 4 Apr 2019 15:17:54 GMT""},{""version"":""v5"",""created"":""Tue, 29 Oct 2019 15:47:42 GMT""}]","2020-12-02"
"1903.04019","Zhang Zhaoxuan","Xiaoguang Han, Zhaoxuan Zhang, Dong Du, Mingdai Yang, Jingming Yu, Pan
  Pan, Xin Yang, Ligang Liu, Zixiang Xiong, Shuguang Cui","Deep Reinforcement Learning of Volume-guided Progressive View Inpainting
  for 3D Point Scene Completion from a Single Depth Image","Accepted as CVPR 2019 Oral",,,,"cs.CV","http://arxiv.org/licenses/nonexclusive-distrib/1.0/","  We present a deep reinforcement learning method of progressive view
inpainting for 3D point scene completion under volume guidance, achieving
high-quality scene reconstruction from only a single depth image with severe
occlusion. Our approach is end-to-end, consisting of three modules: 3D scene
volume reconstruction, 2D depth map inpainting, and multi-view selection for
completion. Given a single depth image, our method first goes through the 3D
volume branch to obtain a volumetric scene reconstruction as a guide to the
next view inpainting step, which attempts to make up the missing information;
the third step involves projecting the volume under the same view of the input,
concatenating them to complete the current view depth, and integrating all
depth into the point cloud. Since the occluded areas are unavailable, we resort
to a deep Q-Network to glance around and pick the next best view for large hole
completion progressively until a scene is adequately reconstructed while
guaranteeing validity. All steps are learned jointly to achieve robust and
consistent results. We perform qualitative and quantitative evaluations with
extensive experiments on the SUNCG data, obtaining better results than the
state of the art.
","[{""version"":""v1"",""created"":""Sun, 10 Mar 2019 16:25:03 GMT""},{""version"":""v2"",""created"":""Tue, 12 Mar 2019 03:23:49 GMT""}]","2019-03-13"
"1903.04020","Arnab Kar","Arnab Kar, T. R. Boehly, P. B. Radha, D. H. Edgell, S. X. Hu, P. M.
  Nilson, A. Shvydky, W. Theobald, D. Cao, K. S. Anderson, V. N. Goncharov, S.
  P. Regan","Simulated Refraction-Enhanced X-Ray Radiography of Laser-Driven Shocks",,"Phys. Plasmas 26, 032705 (2019)","10.1063/1.5084968",,"physics.plasm-ph","http://arxiv.org/licenses/nonexclusive-distrib/1.0/","  Refraction-enhanced x-ray radiography (REXR) is used to infer shock-wave
positions of more than one shock wave, launched by a multiple-picket pulse in a
planar plastic foil. This includes locating shock waves before the shocks
merge, during the early time and the main drive of the laser pulse that is not
possible with the velocity interferometer system for any reflector. Simulations
presented in this paper of REXR show that it is necessary to incorporate
refraction and attenuation of x rays along with the appropriate opacity and
refractive-index tables to interpret experimental images. Simulated REXR shows
good agreement with an experiment done on the OMEGA laser facility to image a
shock wave. REXR can be applied to design multiple-picket pulses with a better
understanding of the shock locations. This will be beneficial to obtain the
required adiabats for inertial confinement fusion implosions.
","[{""version"":""v1"",""created"":""Sun, 10 Mar 2019 16:25:33 GMT""}]","2019-03-12"
"1903.04021","Blair Davey","Blair Davey","Quantitative unique continuation for Schr\""odinger operators",,,,,"math.AP","http://arxiv.org/licenses/nonexclusive-distrib/1.0/","  We investigate the quantitative unique continuation properties of solutions
to second order elliptic equations with singular lower order terms. The main
theorem presents a quantification of the strong unique continuation property
for $\Delta + V$. That is, for any non-trivial $u$ that solves $\Delta u + V u
= 0$ in some open, connected subset of $\mathbb{R}^n$, we estimate the
vanishing order of solutions in terms of the $L^t$-norm of $V$. Our results
apply to all $t > \frac n 2$ and $n \ge 3$. With these maximal order of
vanishing estimates, we employ a scaling argument to produce quantitative
unique continuation at infinity estimates for global solutions to $\Delta u + V
u = 0$. To handle $V \in L^t$ for every $t \in (\frac n 2, \infty]$, we prove a
novel $L^p - L^q$ Carleman estimate by interpolating a known $L^p - L^2$
estimate with a new endpoint Carleman estimate. This new Carleman estimate may
also be used to establish improved order of vanishing estimates for equations
with a first order term, those of the form $\Delta u + W \cdot \nabla u + V u =
0$.
","[{""version"":""v1"",""created"":""Sun, 10 Mar 2019 16:30:14 GMT""}]","2019-03-12"
"1903.04022","Andreas Landig","A. J. Landig, J. V. Koski, P. Scarlino, C. M\""uller, J. C.
  Abadillo-Uriel, B. Kratochwil, C. Reichl, W. Wegscheider, S. N. Coppersmith,
  Mark Friesen, A. Wallraff, T. Ihn, K. Ensslin","Coherent long-distance spin-qubit-transmon coupling",,"Nature Communications 10, 5037 (2019)","10.1038/s41467-019-13000-z",,"cond-mat.mes-hall","http://arxiv.org/licenses/nonexclusive-distrib/1.0/","  Spin qubits and superconducting qubits are among the promising candidates for
a solid state quantum computer. For the implementation of a hybrid architecture
which can profit from the advantages of either world, a coherent long-distance
link is necessary that integrates and couples both qubit types on the same
chip. We realize such a link with a frequency-tunable high impedance SQUID
array resonator. The spin qubit is a resonant exchange qubit hosted in a GaAs
triple quantum dot. It can be operated at zero magnetic field, allowing it to
coexist with superconducting qubits on the same chip. We find a working point
for the spin qubit, where the ratio between its coupling strength and
decoherence rate is optimized. We observe coherent interaction between the
resonant exchange qubit and a transmon qubit in both resonant and dispersive
regimes, where the interaction is mediated either by real or virtual resonator
photons.
","[{""version"":""v1"",""created"":""Sun, 10 Mar 2019 17:00:47 GMT""}]","2019-11-07"
"1903.04023","Dirk Puetzfeld","Dirk Puetzfeld, Yuri N. Obukhov, Friedrich W. Hehl","Constitutive law of nonlocal gravity","7 pages","Phys. Rev. D 99, 104013 (2019)","10.1103/PhysRevD.99.104013",,"gr-qc","http://arxiv.org/licenses/nonexclusive-distrib/1.0/","  We analyze the structure of a recent nonlocal generalization of Einstein's
theory of gravitation by Mashhoon et al. By means of a covariant technique, we
derive an expanded version of the nonlocality tensor which constitutes the
theory. At the lowest orders of approximation, this leads to a simplification
which sheds light on the fundamental structure of the theory and may prove
useful in the search for exact solutions of nonlocal gravity.
","[{""version"":""v1"",""created"":""Sun, 10 Mar 2019 17:03:28 GMT""},{""version"":""v2"",""created"":""Thu, 9 May 2019 12:57:21 GMT""}]","2019-05-10"
"1903.04024","Peter Kazinski","O.V. Bogdanov, P.O. Kazinski, G.Yu. Lazarenko","Semiclassical probability of radiation of twisted photons in the
  ultrarelativistic limit","33 pp., 7 figs","Phys. Rev. D 99, 116016 (2019)","10.1103/PhysRevD.99.116016",,"physics.acc-ph physics.optics","http://arxiv.org/licenses/nonexclusive-distrib/1.0/","  The semiclassical general formula for the probability of radiation of twisted
photons by ultrarelativistic scalar and Dirac particles moving in the
electromagnetic field of a general form is derived. This formula is the analog
of the Baier-Katkov formula for the probability of radiation of one plane wave
photon with the quantum recoil taken into account. The derived formula is used
to describe the radiation of twisted photons by charged particles in undulators
and laser waves. Thus, the general theory of undulator radiation of twisted
photons and radiation of twisted photons in the nonlinear Compton process is
developed with account for the quantum recoil. The explicit formulas for the
probability to record a twisted photon are obtained in these cases. In
particular, we found that the quantum recoil and spin degrees of freedom
increase the radiation probability of twisted photons in comparison with the
formula for scalar particles without recoil. In the range of applicability of
the semiclassical formula, the selection rules for undulator radiation
established in the purely classical framework are not violated. The
manifestation of the blossoming out rose effect in the nonlinear Compton
process in a strong laser wave with circular polarization and in the wiggler
radiation is revealed. Several examples are studied: the radiation of MeV
twisted photons by $180$ GeV electrons in the wiggler; the radiation of twisted
photons by $256$ MeV electrons in strong electromagnetic waves produced by the
CO$_2$ and Ti:Sa lasers; and the radiation of MeV twisted photons by $51.1$ MeV
electrons in the electromagnetic wave generated by the FEL with photon energy
$1$ keV.
","[{""version"":""v1"",""created"":""Sun, 10 Mar 2019 17:18:33 GMT""}]","2019-06-25"
"1903.04025","Xiaoyang Guo","Xiaoyang Guo, Kai Yang, Wukui Yang, Xiaogang Wang, Hongsheng Li","Group-wise Correlation Stereo Network","accepted to CVPR 2019",,,,"cs.CV","http://creativecommons.org/licenses/by/4.0/","  Stereo matching estimates the disparity between a rectified image pair, which
is of great importance to depth sensing, autonomous driving, and other related
tasks. Previous works built cost volumes with cross-correlation or
concatenation of left and right features across all disparity levels, and then
a 2D or 3D convolutional neural network is utilized to regress the disparity
maps. In this paper, we propose to construct the cost volume by group-wise
correlation. The left features and the right features are divided into groups
along the channel dimension, and correlation maps are computed among each group
to obtain multiple matching cost proposals, which are then packed into a cost
volume. Group-wise correlation provides efficient representations for measuring
feature similarities and will not lose too much information like full
correlation. It also preserves better performance when reducing parameters
compared with previous methods. The 3D stacked hourglass network proposed in
previous works is improved to boost the performance and decrease the inference
computational cost. Experiment results show that our method outperforms
previous methods on Scene Flow, KITTI 2012, and KITTI 2015 datasets. The code
is available at https://github.com/xy-guo/GwcNet
","[{""version"":""v1"",""created"":""Sun, 10 Mar 2019 17:34:54 GMT""}]","2019-03-12"
"1903.04026","Suhail Gulzar Mattoo","N.A. Rather and Suhail Gulzar","A note on a recent attempt to prove Sendov's conjecture",,,,,"math.CV","http://arxiv.org/licenses/nonexclusive-distrib/1.0/","  Recently GM Sofi & SA Shabir [arXive: 1903.01850v2 [math.GM] 6 Mar 2019] made
an attempt to prove the Sendov's conjecture. But unfortunately the proof is not
correct. In this note, we discuss the fallacy in the proof.
","[{""version"":""v1"",""created"":""Sun, 10 Mar 2019 17:51:34 GMT""}]","2019-03-12"
"1903.04027","Satyananda Kashyap","Satyananda Kashyap, Honghai Zhang, Milan Sonka","Just-Enough Interaction Approach to Knee MRI Segmentation: Data from the
  Osteoarthritis Initiative","Proceedings of the 3rd International Workshop on Interactive Medical
  Image Computing (IMIC), Held in Conjunction with MICCAI, 2016",,,,"cs.CV","http://arxiv.org/licenses/nonexclusive-distrib/1.0/","  State-of-the-art automated segmentation algorithms are not 100\% accurate
especially when segmenting difficult to interpret datasets like those with
severe osteoarthritis (OA). We present a novel interactive method called
just-enough interaction (JEI), which adds a fast correction step to the
automated layered optimal graph segmentation of multiple objects and surfaces
(LOGISMOS). After LOGISMOS segmentation in knee MRI, the JEI user interaction
does not modify boundary surfaces of the bones and cartilages directly. Local
costs of underlying graph nodes are modified instead and the graph is
re-optimized, providing globally optimal corrected results. Significant
performance improvement ($p \ll 0.001$) was observed when comparing
JEI-corrected results to the automated. The algorithm was extended from 3D JEI
to longitudinal multi-3D (4D) JEI allowing simultaneous visualization and
interaction of multiple-time points of the same patient.
","[{""version"":""v1"",""created"":""Sun, 10 Mar 2019 17:55:47 GMT""}]","2019-03-12"
"1903.04028","Mark Edwards","Elizabeth Ashwood and Ed Wesley Wells and Doga Murat Kurkcuoglu and
  Robert Colson Sapp and Charles W Clark and Mark Edwards","Tools for designing atom interferometers in a microgravity environment","19 pages, 4 figures submitted to Physical Review A","Phys. Rev. A 99, 043615 (2019)","10.1103/PhysRevA.99.043615",,"cond-mat.quant-gas","http://arxiv.org/licenses/nonexclusive-distrib/1.0/","  We present a variational model suitable for rapid preliminary design of atom
interferometers in a microgravity environment. The model approximates the
solution of the 3D rotating--frame Gross--Pitaevskii equation (GPE) as the sum
of Nc Gaussian clouds. Each Gaussian cloud is assumed to have time--dependent
center positions, widths, and linear and quadratic phase parameters. We applied
the Lagrangian Variational Method (LVM) with this trial wave function to derive
equations of motion for these parameters that can be adapted to any external
potential. We also present a 1D version of this variational model. As an
example we apply the model to a 1D atom interferometry scheme for measuring
Newton's gravitational constant, G, in a microgravity environment. We show how
the LVM model can (1) constrain the experimental parameter space size, (2) show
how the value of G can be obtained from the experimental conditions and
interference pattern characteristics, and (3) show how to improve the
sensitivity of the measurement and construct a preliminary error budget.
","[{""version"":""v1"",""created"":""Sun, 10 Mar 2019 18:03:36 GMT""}]","2019-04-24"
"1903.04029","Michael Schneier","Camille Zerfas, Leo G. Rebholz, Michael Schneier, Traian Iliescu","Continuous Data Assimilation Reduced Order Models of Fluid Flow",,,"10.1016/j.cma.2019.112596",,"math.NA","http://arxiv.org/licenses/nonexclusive-distrib/1.0/","  We propose, analyze, and test a novel continuous data assimilation reduced
order model (DA-ROM) for simulating incompressible flows. While ROMs have a
long history of success on certain problems with recurring dominant structures,
they tend to lose accuracy on more complicated problems and over longer time
intervals. Meanwhile, continuous data assimilation (DA) has recently been used
to improve accuracy and, in particular, long time accuracy in fluid simulations
by incorporating measurement data into the simulation. This paper synthesizes
these two ideas, in an attempt to address inaccuracies in ROM by applying DA,
especially over long time intervals and when only inaccurate snapshots are
available. We prove that with a properly chosen nudging parameter, the proposed
DA-ROM algorithm converges exponentially fast in time to the true solution, up
to discretization and ROM truncation errors. Finally, we propose a strategy for
nudging adaptively in time, by adjusting dissipation arising from the nudging
term to better match true solution energy. Numerical tests confirm all results,
and show that the DA-ROM strategy with adaptive nudging can be highly effective
at providing long time accuracy in ROMs.
","[{""version"":""v1"",""created"":""Sun, 10 Mar 2019 18:10:02 GMT""}]","2019-10-02"
"1903.04030","Suroor Gandhi","Suroor S Gandhi and Melissa K Ness","High- and Low-$\alpha$ Disk Stars Separate Dynamically at all Ages","11 pages, 7 figures; under review for submission to ApJ",,"10.3847/1538-4357/ab2981",,"astro-ph.GA astro-ph.SR","http://arxiv.org/licenses/nonexclusive-distrib/1.0/","  There is a dichotomy in the Milky Way in the $[\alpha/$Fe]-[Fe/H] plane, in
which stars fall into high-$\alpha$, and low-$\alpha$ sequences. The
high-$\alpha$ sequence comprises mostly old stars, and the low-$\alpha$
sequence comprises primarily young stars. The origin of this dichotomy is
uncertain. To better understand how the high- and low-$\alpha$ stars are
affiliated, we examine if the high- and low-$\alpha$ sequences have distinct
orbits at all ages, or if age sets the orbital properties of stars irrespective
of their $\alpha$-enhancement. Orbital actions $J_R$, $J_z$, and $J_\phi$ (or
$L_z$) are our labels of stellar dynamics. We use ages for 58,278 LAMOST stars
(measured to a precision of 40\%) within $\leq$2kpc of the Sun and we calculate
orbital actions from proper motions and parallaxes given by Gaia's DR2. We find
that \emph{at all ages}, the high- and low-$\alpha$ sequences are dynamically
distinct. This implies separate formation and evolutionary histories for the
two sequences; a star's membership in the high- or low-$\alpha$ sequence
indicates its dynamical properties at a given time. We use action space to make
an efficient selection of halo stars and subsequently report a group of old,
low-$\alpha$ stars in the halo, which may be a discrete population from an
infall event.
","[{""version"":""v1"",""created"":""Sun, 10 Mar 2019 18:19:43 GMT""}]","2019-08-08"
"1903.04031","Ruediger Klingeler","C. Koo, J. Park, J. Butscher, E. Rentschler, R. Klingeler","High-frequency EPR study on Cu$_4$Cu- and Co$_4$Co-metallacrown
  complexes",,"J. Magn. Magn. Mat. 477, 340 (2019)","10.1016/j.jmmm.2019.01.038",,"cond-mat.mes-hall cond-mat.mtrl-sci","http://arxiv.org/licenses/nonexclusive-distrib/1.0/","  High-frequency/high-field electron paramagnetic resonance studies on two
homo-nuclear 12-MC-4 metallacrown complexes Cu$_4$Cu and Co$_4$Co are
presented. For Cu$_4$Cu, our data imply axial-type $g$-anisotropy with $g_{x}$
= 2.03 $\pm$ 0.01, $g_{y}$ = 2.04 $\pm$ 0.01, and $g_{z}$ = 2.23 $\pm$ 0.01,
yielding $g=2.10 \pm 0.02$. No significant zero field splitting (ZFS) of the
ground state mode is observed. In Co$_4$Co, we find a m$_S$ = $\pm$3/2 ground
state with $g=2.66$. The data suggest large anisotropy $D$ of negative sign.
","[{""version"":""v1"",""created"":""Sun, 10 Mar 2019 18:20:59 GMT""}]","2019-03-20"
