"1903.04100","Guilherme Fran\c{c}a","Guilherme Fran\c{c}a, Jeremias Sulam, Daniel P. Robinson, Ren\'e Vidal","Conformal Symplectic and Relativistic Optimization","A short version of this paper appeared at NeurIPS 2020 (spotlight).
  This lengthier version matches the published paper at JSTAT, which contains
  additional results","J. Stat. Mech. (2020) 124008","10.1088/1742-5468/abcaee",,"math.OC stat.ML","http://arxiv.org/licenses/nonexclusive-distrib/1.0/","  Arguably, the two most popular accelerated or momentum-based optimization
methods in machine learning are Nesterov's accelerated gradient and Polyaks's
heavy ball, both corresponding to different discretizations of a particular
second order differential equation with friction. Such connections with
continuous-time dynamical systems have been instrumental in demystifying
acceleration phenomena in optimization. Here we study structure-preserving
discretizations for a certain class of dissipative (conformal) Hamiltonian
systems, allowing us to analyze the symplectic structure of both Nesterov and
heavy ball, besides providing several new insights into these methods.
Moreover, we propose a new algorithm based on a dissipative relativistic system
that normalizes the momentum and may result in more stable/faster optimization.
Importantly, such a method generalizes both Nesterov and heavy ball, each being
recovered as distinct limiting cases, and has potential advantages at no
additional cost.
","[{""version"":""v1"",""created"":""Mon, 11 Mar 2019 02:13:03 GMT""},{""version"":""v2"",""created"":""Wed, 26 Jun 2019 03:08:51 GMT""},{""version"":""v3"",""created"":""Wed, 10 Jul 2019 18:54:40 GMT""},{""version"":""v4"",""created"":""Wed, 12 Aug 2020 23:36:45 GMT""},{""version"":""v5"",""created"":""Wed, 14 Oct 2020 13:57:01 GMT""},{""version"":""v6"",""created"":""Tue, 27 Oct 2020 22:53:50 GMT""},{""version"":""v7"",""created"":""Thu, 24 Dec 2020 12:51:35 GMT""}]","2020-12-25"
"1903.04101","Chun Kai Ling","Chun Kai Ling, Fei Fang, J. Zico Kolter","Large Scale Learning of Agent Rationality in Two-Player Zero-Sum Games",,,,,"cs.LG cs.AI","http://arxiv.org/licenses/nonexclusive-distrib/1.0/","  With the recent advances in solving large, zero-sum extensive form games,
there is a growing interest in the inverse problem of inferring underlying game
parameters given only access to agent actions. Although a recent work provides
a powerful differentiable end-to-end learning frameworks which embed a game
solver within a deep-learning framework, allowing unknown game parameters to be
learned via backpropagation, this framework faces significant limitations when
applied to boundedly rational human agents and large scale problems, leading to
poor practicality. In this paper, we address these limitations and propose a
framework that is applicable for more practical settings. First, seeking to
learn the rationality of human agents in complex two-player zero-sum games, we
draw upon well-known ideas in decision theory to obtain a concise and
interpretable agent behavior model, and derive solvers and gradients for
end-to-end learning. Second, to scale up to large, real-world scenarios, we
propose an efficient first-order primal-dual method which exploits the
structure of extensive-form games, yielding significantly faster computation
for both game solving and gradient computation. When tested on randomly
generated games, we report speedups of orders of magnitude over previous
approaches. We also demonstrate the effectiveness of our model on both
real-world one-player settings and synthetic data.
","[{""version"":""v1"",""created"":""Mon, 11 Mar 2019 02:15:02 GMT""}]","2019-03-12"
"1903.04102","Meir Friedenberg","Meir Friedenberg, Joseph Y. Halpern","Blameworthiness in Multi-Agent Settings","Appears in AAAI-19",,,,"cs.CY cs.AI cs.MA","http://arxiv.org/licenses/nonexclusive-distrib/1.0/","  We provide a formal definition of blameworthiness in settings where multiple
agents can collaborate to avoid a negative outcome. We first provide a method
for ascribing blameworthiness to groups relative to an epistemic state (a
distribution over causal models that describe how the outcome might arise). We
then show how we can go from an ascription of blameworthiness for groups to an
ascription of blameworthiness for individuals using a standard notion from
cooperative game theory, the Shapley value. We believe that getting a good
notion of blameworthiness in a group setting will be critical for designing
autonomous agents that behave in a moral manner.
","[{""version"":""v1"",""created"":""Mon, 11 Mar 2019 02:26:30 GMT""}]","2019-03-12"
"1903.04103","Alvin Heng","Alvin J.R. Heng, Wenan Guo, Anders W. Sandvik and Pinaki Sengupta","Pair hopping in systems of strongly interacting hard-core bosons","8 pages, 7 figures","Phys. Rev. B 100, 104433 (2019)","10.1103/PhysRevB.100.104433",,"cond-mat.str-el","http://arxiv.org/licenses/nonexclusive-distrib/1.0/","  We have used the Stochastic Series Expansion quantum Monte Carlo method to
study interacting hard-core bosons on the square lattice, with pair-hopping
processes supplementing the standard single-particle hopping. Such pair hopping
arises in effective models for frustrated quantum magnets. Our goal is to
investigate the effects of the pair hopping process on the commonly observed
superfluid, insulating (Mott), and super-solid ground-state phases in the
standard hard-core boson model with various interaction terms. The model is
specifically motivated by the observation of finite dispersion of 2-magnon
bound states in neutron diffraction experiments SrCu$_2$(BO$_3$)$_2$. Our
results show that the pair hopping has different effects on Mott phases at
different filling fractions, ""melting"" them at different critical pair-hopping
amplitudes. Thus, it appears that pair hopping may have an important role in
determining which out of a potentially large number of Mott phases (stabilized
by details of the charge-diagonal interaction terms) actually survive the
totality of quantum fluctuations present.
","[{""version"":""v1"",""created"":""Mon, 11 Mar 2019 02:28:24 GMT""},{""version"":""v2"",""created"":""Thu, 14 Mar 2019 14:50:36 GMT""},{""version"":""v3"",""created"":""Sun, 17 Mar 2019 02:38:10 GMT""},{""version"":""v4"",""created"":""Mon, 16 Sep 2019 18:01:54 GMT""},{""version"":""v5"",""created"":""Thu, 26 Sep 2019 17:04:45 GMT""}]","2019-09-27"
"1903.04104","Yixin Li","Yixin Li, Shengqin Tang, Yun Ye, Jinwen Ma","Spatial-Aware Non-Local Attention for Fashion Landmark Detection",,,,,"cs.CV","http://arxiv.org/licenses/nonexclusive-distrib/1.0/","  Fashion landmark detection is a challenging task even using the current deep
learning techniques, due to the large variation and non-rigid deformation of
clothes. In order to tackle these problems, we propose Spatial-Aware Non-Local
(SANL) block, an attentive module in deep neural network which can utilize
spatial information while capturing global dependency. Actually, the SANL block
is constructed from the non-local block in the residual manner which can learn
the spatial related representation by taking a spatial attention map from
Grad-CAM. We then establish our fashion landmark detection framework on feature
pyramid network, equipped with four SANL blocks in the backbone. It is
demonstrated by the experimental results on two large-scale fashion datasets
that our proposed fashion landmark detection approach with the SANL blocks
outperforms the current state-of-the-art methods considerably. Some
supplementary experiments on fine-grained image classification also show the
effectiveness of the proposed SANL block.
","[{""version"":""v1"",""created"":""Mon, 11 Mar 2019 02:35:39 GMT""}]","2019-03-12"
"1903.04105","Shuangjing Xu","Shuangjing Xu, Bo Zhang, Mark J. Reid, Xingwu Zheng, Guangli Wang","Comparison of Gaia DR2 Parallaxes of Stars with VLBI Astrometry","Accepted by ApJ",,"10.3847/1538-4357/ab0e83",,"astro-ph.SR astro-ph.GA astro-ph.IM","http://arxiv.org/licenses/nonexclusive-distrib/1.0/","  We compare the parallaxes of stars from VLBI astrometry in the literature to
those in the Gaia DR2 catalog. Our full sample contains young stellar objects,
evolved AGB stars, pulsars and other radio stars. Excluding AGB stars, which
show significant discrepancies between Gaia and VLBI parallaxes, and stars in
binary systems, we obtain an average, systematic, parallax offset of $-75 \pm
29~\mu$as for Gaia DR2, consistent with their estimate of a parallax zero-point
between $-100$ and 0 $\mu$as.
","[{""version"":""v1"",""created"":""Mon, 11 Mar 2019 02:43:03 GMT""},{""version"":""v2"",""created"":""Thu, 14 Mar 2019 02:02:54 GMT""}]","2019-05-01"
"1903.04106","Hyong-Chol O","Hyong-Chol O, Dae-Sung Choe","Pricing Formulae of Power Binary and Normal Distribution Standard
  Options and Applications","24 pages",,,,"q-fin.PR","http://arxiv.org/licenses/nonexclusive-distrib/1.0/","  In this paper the Buchen's pricing formulae of (higher order) asset and bond
binary options are incorporated into the pricing formula of power binary
options and a pricing formula of ""the normal distribution standard options""
with the maturity payoff related to a power function and the density function
of normal distribution is derived. And as their applications, pricing formulae
of savings plans that provide a choice of indexing and discrete geometric
average Asian options are derived and the fact that the price of discrete
geometric average Asian option converges to the price of continuous geometric
average Asian option when the largest distance between neighboring monitoring
times goes to zero is proved.
","[{""version"":""v1"",""created"":""Mon, 11 Mar 2019 02:43:57 GMT""}]","2019-03-12"
"1903.04107","Yositake Takane","Yositake Takane","Spontaneous charge current in a doped Weyl semimetal","7 pages, 16 figures","J. Phys. Soc. Jpn. 87, 074706 (2018)","10.7566/JPSJ.87.074706",,"cond-mat.mes-hall","http://arxiv.org/licenses/nonexclusive-distrib/1.0/","  A Weyl semimetal hosts low-energy chiral surface states, which appear to
connect a pair of Weyl nodes in reciprocal space. As these chiral surface
states propagate in a given direction, a spontaneous circulating current is
expected to appear near the surface of a singly connected Weyl semimetal. This
possibility is examined by using a simple model with particle-hole symmetry. It
is shown that no spontaneous charge current appears when the Fermi level is
located at the band center. However, once the Fermi level deviates from the
band center, a spontaneous charge current appears to circulate around the
surface of the system and its direction of flow is opposite for the cases of
electron doping and hole doping. These features are qualitatively unchanged
even in the absence of particle-hole symmetry. The circulating charge current
is shown to be robust against weak disorder.
","[{""version"":""v1"",""created"":""Mon, 11 Mar 2019 02:54:18 GMT""}]","2019-03-20"
"1903.04108","Lie-Wen Chen","Zhao-Wen Zhang, Lie-Wen Chen","Cold dilute nuclear matter with $\alpha$-particle condensation in a
  generalized nonlinear relativistic mean-field model","10 pages, 5 figures. Effects of resonance and continuum states
  considered effectively, the symmetry energy defined under parabolic
  approximation investigated, and presentation improved. Accepted version to
  appear in PRC","Phys. Rev. C 100, 054304 (2019)","10.1103/PhysRevC.100.054304",,"nucl-th nucl-ex","http://arxiv.org/licenses/nonexclusive-distrib/1.0/","  We explore the thermodynamic properties of homogeneous cold
(zero-temperature) nuclear matter including nucleons and $\alpha$-particle
condensation at low densities by using a generalized nonlinear relativistic
mean-field (gNL-RMF) model. In the gNL-RMF model, the $\alpha$-particle is
included as explicit degree of freedom and treated as point-like particle with
its interaction described by meson exchanges and the in-medium effects on the
$\alpha$ binding energy is described by density- and temperature-dependent
energy shift with the parameters obtained by fitting the experimental Mott
density. We find that below the dropping density $n_{\rm{drop}}$ ($\sim 3\times
10^{-3}$ fm$^{-3}$), the zero-temperature symmetric nuclear matter is in the
state of pure Bose-Einstein condensate (BEC) of $\alpha$ particles while the
neutron-rich nuclear matter is composed of $\alpha$-BEC and neutrons. Above the
$n_{\rm{drop}}$, the fraction of $\alpha$-BEC decreases with density and
vanishes at the transition density $n_t$ ($\sim 8\times 10^{-3}$ fm$^{-3}$).
Above the $n_t$, the nuclear matter becomes pure nucleonic matter. Our results
indicate that the empirical parabolic law for the isospin asymmetry dependence
of nuclear matter equation of state is heavily violated by the
$\alpha$-particle condensation in the zero-temperature dilute nuclear matter,
making the conventional definition of the symmetry energy meaningless. We
investigate the symmetry energy defined under parabolic approximation for the
zero-temperature dilute nuclear matter with $\alpha$-particle condensation, and
find it is significantly enhanced compared to the case without clusters and
becomes saturated at about $7$ MeV at very low densities ($\lesssim 10^{-3}$
fm$^{-3}$). The critical temperature for $\alpha$-condensation in homogeneous
dilute nuclear matter is also discussed.
","[{""version"":""v1"",""created"":""Mon, 11 Mar 2019 03:05:17 GMT""},{""version"":""v2"",""created"":""Thu, 24 Oct 2019 00:47:13 GMT""}]","2019-11-13"
"1903.04109","Shukai Ma","Shukai Ma, Bo Xiao, Yang Yu, Kueifu Lai, Gennady Shvets, and Steven M.
  Anlage","Topologically Protected Photonic Modes in Composite Quantum Hall/Quantum
  Spin Hall Waveguides",,"Phys. Rev. B 100, 085118 (2019)","10.1103/PhysRevB.100.085118",,"cond-mat.mes-hall","http://arxiv.org/licenses/nonexclusive-distrib/1.0/","  Photonic topological systems, the electromagnetic analog of the topological
materials in condensed matter physics, create many opportunities to design
optical devices with novel properties. We present an experimental realization
of the bi-anisotropic meta waveguide photonic system replicating both quantum
Hall (QH) and quantum spin-Hall (QSH) topological insulating phases. With
careful design, a composite QH-QSH photonic topological material is created and
experimentally shown to support reflection-free edgemodes, a heterogeneous
topological structure that is unprecedented in condensed matter physics. The
effective spin degree of freedom of such topologically protected modes
determines their unique pathways through these systems, free from
backscattering and able to travel around sharp corners. {As an example of their
novel properties, we experimentally demonstrate reflection-less photonic
devices including a 2-port isolator, a unique 3-port topological device, and a
full 4-port circulator based on composite QH and QSH structures
","[{""version"":""v1"",""created"":""Mon, 11 Mar 2019 03:08:46 GMT""},{""version"":""v2"",""created"":""Tue, 13 Aug 2019 18:48:15 GMT""}]","2019-08-21"
"1903.04110","Xiaoxiao Guo","Xiaoxiao Guo, Shiyu Chang, Mo Yu, Gerald Tesauro, Murray Campbell","Hybrid Reinforcement Learning with Expert State Sequences","AAAI 2019; https://github.com/XiaoxiaoGuo/tensor4rl",,,,"cs.LG cs.AI stat.ML","http://arxiv.org/licenses/nonexclusive-distrib/1.0/","  Existing imitation learning approaches often require that the complete
demonstration data, including sequences of actions and states, are available.
In this paper, we consider a more realistic and difficult scenario where a
reinforcement learning agent only has access to the state sequences of an
expert, while the expert actions are unobserved. We propose a novel
tensor-based model to infer the unobserved actions of the expert state
sequences. The policy of the agent is then optimized via a hybrid objective
combining reinforcement learning and imitation learning. We evaluated our
hybrid approach on an illustrative domain and Atari games. The empirical
results show that (1) the agents are able to leverage state expert sequences to
learn faster than pure reinforcement learning baselines, (2) our tensor-based
action inference model is advantageous compared to standard deep neural
networks in inferring expert actions, and (3) the hybrid policy optimization
objective is robust against noise in expert state sequences.
","[{""version"":""v1"",""created"":""Mon, 11 Mar 2019 03:28:13 GMT""}]","2019-03-12"
"1903.04111","Yasushi Yoneta","Yasushi Yoneta, Akira Shimizu","Squeezed ensemble for systems with first-order phase transitions","15 pages, 10 figures","Phys. Rev. B 99, 144105 (2019)","10.1103/PhysRevB.99.144105",,"cond-mat.stat-mech quant-ph","http://arxiv.org/licenses/nonexclusive-distrib/1.0/","  All ensembles of statistical mechanics are equivalent in the sense that they
give the equivalent thermodynamic functions in the thermodynamic limit.
However, when investigating microscopic structures in the first-order phase
transition region, one must choose an appropriate statistical ensemble. The
appropriate choice is particularly important when one investigates finite
systems, for which even the equivalence of ensembles does not hold. We propose
a class of statistical ensembles, which always give the correct equilibrium
state even in the first-order phase transition region. We derive various
formulas for this class of ensembles, including the one by which temperature is
obtained directly from energy without knowing entropy. Moreover, these
ensembles are convenient for practical calculations because of good analytic
properties. We also derive formulas which relate statistical-mechanical
quantities of different ensembles, including the conventional ones, for finite
systems. The formulas are useful for obtaining results with smaller finite-size
effects, and for improving the computational efficiency. The advantages of the
squeezed ensembles are confirmed by applying them to the Heisenberg model and
the frustrated Ising model.
","[{""version"":""v1"",""created"":""Mon, 11 Mar 2019 03:29:23 GMT""},{""version"":""v2"",""created"":""Fri, 10 May 2019 08:30:00 GMT""}]","2019-05-13"
"1903.04112","Yue Zhang","Yue Zhang","Hausdorff-$(2n-2)$ dimensional measure zero set and compactness of the
  $\overline{\partial}$-Neumann operator on $(0,n-1)$ forms","Note: this paper has been merged into arXiv:1710.09614",,,,"math.CV","http://arxiv.org/licenses/nonexclusive-distrib/1.0/","  By using a variant Property $(P_q)$ of Catlin, we discuss the relation of
small set of weakly pseudoconvex points on the boundary of pseudoconvex domain
and compactness of the $\overline{\partial}$-Neumann operator. In particular,
we show that if the Hausdorff $(2n-2)$-dimensional measure of the weakly
pseudoconvex points on the boundary of a smooth bounded pseudoconvex domain is
zero, then the $\overline{\partial}$-Neumann operator $N_{n-1}$ is compact on
$(0,n-1)$-level $L^2$-integrable forms.
","[{""version"":""v1"",""created"":""Mon, 11 Mar 2019 03:30:03 GMT""},{""version"":""v2"",""created"":""Fri, 9 Aug 2019 13:02:11 GMT""}]","2019-08-12"
"1903.04113","Miklos Bona","Miklos Bona","Stack words and a bound for 3-stack sortable permutations","6 pages",,,,"math.CO","http://arxiv.org/licenses/nonexclusive-distrib/1.0/","  We use stack words to find a new, simple proof for the best known upper bound
for the number of 3-stack sortable permutations of a given length. This is the
first time that stack words are used to obtain such a result.
","[{""version"":""v1"",""created"":""Mon, 11 Mar 2019 03:32:01 GMT""},{""version"":""v2"",""created"":""Thu, 14 Mar 2019 12:46:18 GMT""},{""version"":""v3"",""created"":""Fri, 29 Mar 2019 18:50:32 GMT""},{""version"":""v4"",""created"":""Tue, 21 Jan 2020 20:53:09 GMT""}]","2020-01-23"
"1903.04114","Anthony Bahri","A. Bahri, M. Bendersky and F.R. Cohen","Polyhedral products and features of their homotopy theory","A submission to the forthcoming Handbook of Homotopy Theory",,,,"math.AT math.AC math.CO math.HO","http://arxiv.org/licenses/nonexclusive-distrib/1.0/","  A polyhedral product is a natural subspace of a Cartesian product that is
specified by a simplicial complex. The modern formalism arose as a
generalization of the spaces known as moment-angle complexes which were
developed within the nascent subject of toric topology. This field, which began
as a topological approach to toric geometry and aspects of symplectic geometry,
has expanded rapidly in recent years. The investigation of polyhedral products
and their homotopy theoretic properties has developed to the point where they
are studied in various fields of mathematics far removed from their origin. In
this survey, we provide a brief historical overview of the development of this
subject, summarize many of the main results and describe applications.
","[{""version"":""v1"",""created"":""Mon, 11 Mar 2019 03:36:42 GMT""}]","2019-03-12"
"1903.04115","Prabodh Shukla","Diana Thongjaomayum and Prabodh Shukla","Critical hysteresis on dilute triangular lattice","Replaced with published version (11 pages, 8 figures)","Phys. Rev. E 99, 062136 (2019)","10.1103/PhysRevE.99.062136",,"cond-mat.stat-mech","http://arxiv.org/licenses/nonexclusive-distrib/1.0/","  Critical hysteresis in the zero-temperature random-field Ising model on a
two-dimensional triangular lattice has been studied earlier with site dilution
on one sublattice. It was reported that criticality vanishes if less than one
third of the sublattice is occupied. This appears at variance with recently
obtained exact solutions of the model on dilute Bethe lattices and prompts us
to revisit the problem using an alternate numerical method. Contrary to our
speculation that criticality may not be exactly zero below one third dilution,
the present study indicates it is nearly zero if approximately less than
two-thirds of the sublattice is occupied. This suggests that hysteresis on
dilute periodic lattices is qualitatively different from that on dilute Bethe
lattices. Possible reasons are discussed briefly.
","[{""version"":""v1"",""created"":""Mon, 11 Mar 2019 03:55:29 GMT""},{""version"":""v2"",""created"":""Fri, 28 Jun 2019 03:27:21 GMT""}]","2019-07-03"
"1903.04116","Nathakhun Wiroonsri","Nathakhun Wiroonsri","Normal approximation for associated point processes via Stein's method
  with applications to determinantal point processes","20 pages","Journal of Mathematical Analysis and Applications, 480(1), 123396,
  2019","10.1016/j.jmaa.2019.123396",,"math.PR","http://arxiv.org/licenses/nonexclusive-distrib/1.0/","  We use Stein's method to provide non asymptotic $L^1$ bounds to the normal
for functionals of associated point processes. As for supporting tools, we use
the connection between association and $\alpha$-mixing properties that was
recently uncovered by [PDL17]. We apply our main results to determinantal point
processes which are known to be negatively associated. A potential application
to point processes in the Laguerre-Gaussian family is also presented.
","[{""version"":""v1"",""created"":""Mon, 11 Mar 2019 03:56:56 GMT""},{""version"":""v2"",""created"":""Thu, 2 Apr 2020 08:25:40 GMT""}]","2020-04-03"
"1903.04117","Andreas Haungs","Andreas Haungs (for the IceCube Collaboration)","A Scintillator and Radio Enhancement of the IceCube Surface Detector
  Array","6 pages, conference proceedings of UHECR 2018",,"10.1051/epjconf/201921006009",,"astro-ph.IM astro-ph.HE","http://arxiv.org/licenses/nonexclusive-distrib/1.0/","  An upgrade of the present IceCube surface array (IceTop) with scintillation
detectors and possibly radio antennas is foreseen. The enhanced array will
calibrate the impact of snow accumulation on the reconstruction of cosmic-ray
showers detected by IceTop as well as improve the veto capabilities of the
surface array. In addition, such a hybrid surface array of radio antennas,
scintillators and Cherenkov tanks will enable a number of complementary science
targets for IceCube such as enhanced accuracy to mass composition of cosmic
rays, search for PeV photons from the Galactic Center, or more thorough tests
of the hadronic interaction models. Two prototype stations with 7 scintillation
detectors each have been already deployed at the South Pole in January 2018.
These R&D studies provide a window of opportunity to integrate radio antennas
with minimal effort.
","[{""version"":""v1"",""created"":""Mon, 11 Mar 2019 03:59:58 GMT""}]","2019-06-12"
