"1903.06221","Shigeo Kimura","Shigeo S. Kimura","High-energy emissions from neutron star mergers","9 pages, 4 figures, 5 tables, conference proceedings of UHECR 2018",,"10.1051/epjconf/201921003001",,"astro-ph.HE hep-ph","http://arxiv.org/licenses/nonexclusive-distrib/1.0/","  In 2017, LIGO-Virgo collaborations reported detection of the first neutron
star merger event, GW170817, which is accompanied by electromagnetic
counterparts from radio to gamma rays. Although high-energy neutrinos were not
detected from this event, mergers of neutron stars are expected to produce such
high-energy particles. Relativistic jets are launched when neutron stars merge.
If the jets contain protons, they can emit high-energy neutrinos through
photomeson production. In addition, neutron star mergers produce massive and
fast ejecta, which can be a source of Galactic high-energy cosmic rays above
the knee. We briefly review what we learned from the multi-messenger event,
GW170817, and discuss prospects for multi-messenger detections and hadronic
cosmic-ray production related to the neutron star mergers.
","[{""version"":""v1"",""created"":""Thu, 14 Mar 2019 19:03:01 GMT""}]","2019-06-12"
"1903.06222","Erik Walsberg","Erik Walsberg","Dp-minimal expansions of discrete ordered abelian groups","This has be superseded by arXiv:1909.05399",,,,"math.LO","http://arxiv.org/licenses/nonexclusive-distrib/1.0/","  If $\mathcal{Z}$ is a dp-minimal expansion of a discrete ordered abelian
group $(Z,<,+)$ and $\mathcal{Z}$ does not admit a nontrivial definable convex
subgroup then $\mathcal{Z}$ is interdefinable with $(Z,<,+)$ and $(Z,<,+)$ is
elementarily equivalent to $(\mathbb{Z},<,+)$.
","[{""version"":""v1"",""created"":""Thu, 14 Mar 2019 19:06:19 GMT""},{""version"":""v2"",""created"":""Mon, 27 Apr 2020 19:23:58 GMT""}]","2020-04-29"
"1903.06223","George F. Bertsch","G.F. Bertsch","Monopole moments and nuclear compressibility","Original version was submitted to the topical EPJA issue Giant,Pygmy
  ,Pairing Resonances and Related Topics",,,,"nucl-th","http://arxiv.org/licenses/nonexclusive-distrib/1.0/","  The nuclear compressibility has a role in nuclear physics in several ways.
Its relationship to the giant monopole is well known and has been subject of
much theoretical work. Less well known is its affect on in nuclear structure,
namely monopole transitions between low-lying states in the spectrum. Here I
revisit the relationship between monopole and quadrupole moments in deformed
nuclei. It has often been assumed without any microscopic justification that
the nucleus can be treated as an incompressible fluid. An analytic formula is
derived here for the resulting relationship between monopole and quadrupole
moments. The formula is shown to be well satisfied within self-consistent
mean-field theory calculated with several energy functionals. The formula can
be tested when both monopole and quadrupole matrix elements of band-to-band
transitions are known. Data is available for the decay of the first excited
$K^\pi = 0^+$ band to the ground-state band in $^{156}$Gd, and the extracted
matrix elements are found to be consistent with the incompressible fluid
picture.
","[{""version"":""v1"",""created"":""Thu, 14 Mar 2019 19:06:54 GMT""},{""version"":""v2"",""created"":""Thu, 25 Apr 2019 16:25:40 GMT""}]","2019-04-26"
"1903.06224","Goutam Sheet","Suman Kamboj, Partha Sarathi Rana, Anshu Sirohi, Aastha Vasdev, Manasi
  Mandal, Sourav Marik, Ravi Prakash Singh, Tanmoy Das and Goutam Sheet","Generation of strain-induced pseudo-magnetic field in a doped type-II
  Weyl semimetal","6 pages, 4 figures","Phys. Rev. B 100, 115105 (2019)","10.1103/PhysRevB.100.115105",,"cond-mat.mes-hall","http://arxiv.org/licenses/nonexclusive-distrib/1.0/","  In Weyl semimetals, there is an intriguing possibility of realizing a
pseudo-magnetic field in presence of small strain due to certain special cases
of static deformations. This pseudo-magnetic field can be large enough to form
quantized Landau levels and thus become observable in Weyl semimetals. In this
paper, we experimentally show the emergence of a pseudo-magnetic field (~ 3
Tesla) by Scanning Tunneling Spectroscopy (STS) on the doped Weyl semimetal
Re-MoTe2, where distinct Landau level oscillations in the tunneling conductance
are clearly resolved. The crystal lattice is intrinsically strained where large
area STM imaging of the surface reveals differently strained domains where
atomic scale deformations exist forming topographic ripples with varying
periodicity in the real space. The effect of pseudo-magnetic field is clearly
resolved in areas under maximum strain.
","[{""version"":""v1"",""created"":""Thu, 14 Mar 2019 19:25:46 GMT""}]","2019-09-11"
"1903.06225","Igal Jaegle","Sankha S. Chakrabarty and Igal Jaegl\'e","Search for dark photon, axion-like particles, dark scalar, or light dark
  matter in Compton-like processes","11 pages, 9 figures",,,,"hep-ph hep-ex nucl-ex","http://arxiv.org/licenses/nonexclusive-distrib/1.0/","  We propose a novel way to search for the dark photon ($A'$), the axion-like
pseudo-scalar ($a$), the dark scalar ($\phi$), and the light dark matter
($\chi$) in the Compton-like processes, $\gamma + e^- \rightarrow A'/a/\phi +
e^-$ with $A'/a/\phi$ decaying into leptons, photons, or $\chi$'s (when
permitted) for the mass ranges of $m_{A'/a/\phi} \leq$ 100 MeV/$c^2$ and
$m_{\chi} \leq $ 50 MeV/$c^2$. We examine how the past, current, and future
fixed target experiments can use this under-explored production mechanism of
dark particles. We show that the existing and planned tagged photon beam
fixed-target experiments (GlueX, LEPS2, LEPS, and FOREST) are competitive with
the electron beam fixed target experiments, particularly for searching an
invisible particle. We also show that the photon flux produced in the beam dump
experiments increases the dark particle flux significantly and therefore the
sensitivities of these experiments. By only considering the Compton-like
processes, we determine the new limits and expected sensitivities for several
beam dump and active beam dump experiments (E774, E141, KEK, Orsay, E137, NA64,
BDX and LDMX) on the kinetic mixing parameter ($\epsilon$) between the dark
photon and the Standard Model photon, the axion-like pseudo-scalar coupling to
electrons ($g_{ae}$), the dark scalar coupling to electrons ($y_e$) and the
dimensionless interaction strength ($y$) to light dark matter.
","[{""version"":""v1"",""created"":""Thu, 14 Mar 2019 19:28:42 GMT""}]","2019-03-18"
"1903.06226","Kai Wu","Kai Wu, Jie Ren, and Dong Li","Architecture-Aware, High Performance Transaction for Persistent Memory",,,,,"cs.DC","http://creativecommons.org/licenses/by/4.0/","  Byte-addressable non-volatile main memory (NVM) demands transactional
mechanisms to access and manipulate data on NVM atomically. Those transaction
mechanisms often employ a logging mechanism (undo logging or redo logging).
However, the logging mechanisms can bring large runtime overhead (8%-49% in our
evaluation), and 41%-78% of the overhead attributes to the frequent cache-line
flushing. Such large overhead significantly diminishes the performance benefits
offered by NVM. In this paper, we introduce a new method to reduce the overhead
of cache-line flushing for logging-based transactions. Different from the
traditional method that works at the program level and leverages program
semantics to reduce the logging overhead, we introduce architecture awareness.
In particular, we do not flush certain cache blocks, as long as they are
estimated to be eliminated out of the cache because of the hardware caching
mechanism (e.g., the cache replacement algorithm). Furthermore, we coalesce
those cache blocks with low dirtiness to improve the efficiency of cache-line
flushing. We implement an architecture-aware, high performance transaction
runtime system for persistent memory, Archapt. Our results show that comparing
with an undo logging (PMDK) and a redo logging (Mnemosyne), Archapt reduces
cache-line flushing by 66% and improves system throughput by 19% on average
(42% at most). Our crash tests with four hardware caching policies show that
Archapt provides a strong guarantee on crash consistency.
","[{""version"":""v1"",""created"":""Thu, 14 Mar 2019 19:35:17 GMT""},{""version"":""v2"",""created"":""Thu, 18 Apr 2019 17:06:16 GMT""}]","2019-04-19"
"1903.06227","Ludwig Bartels","Thomas A. Empante, Aimee Martinez, Michelle Wurch, Yanbing Zhu, Adane
  K. Geremew, Koichi Yamaguchi, Miguel Isarraraz, Sergey Rumyantsev, Evan J.
  Reed, Alexander A. Balandin, Ludwig Bartels","Low Resistivity and High Breakdown Current Density of 10-nm Diameter van
  der Waals TaSe3 Nanowires by Chemical Vapor Deposition",,,"10.1021/acs.nanolett.9b00958",,"cond-mat.mtrl-sci","http://arxiv.org/licenses/nonexclusive-distrib/1.0/","  Micron-scale single-crystal nanowires of metallic TaSe3, a material that
forms -Ta-Se3-Ta-Se3- stacks separated from one another by a tubular van der
Waals (vdW) gap, have been synthesized using chemical vapor deposition (CVD) on
a SiO2/Si substrate, in a process compatible with semiconductor industry
requirements. Their electrical resistivity was found unaffected by downscaling
from the bulk to as little as 7 nm in width and height, in striking contrast to
the resistivity of copper for the same dimensions. While the bulk resistivity
of TaSe3 is substantially higher than that of bulk copper, at the nanometer
scale the TaSe3 wires become competitive to similar-sized copper ones.
Moreover, we find that the vdW TaSe3 nanowires sustain current densities in
excess of 108 A/cm2 and feature an electromigration energy barrier twice that
of copper. The results highlight the promise of quasi-one-dimensional
transition metal trichalcogenides for electronic interconnect applications and
the potential of van der Waals materials for downscaled electronics.
","[{""version"":""v1"",""created"":""Thu, 14 Mar 2019 19:36:40 GMT""}]","2019-06-25"
"1903.06228","Duc-Phuc Nguyen","Duc-Phuc Nguyen, Dinh-Dung Le","An FPGA-based centralized visible light beacon network","Submitted to IEICE Electronics Express (ELEX)",,,,"eess.SP","http://arxiv.org/licenses/nonexclusive-distrib/1.0/","  Indoor localization systems based on Visible Light Communication (VLC) have
shown promising advantages compared with systems based on other wireless
technologies. In these systems, many VLC light-emitting diode (LED) anchors are
employed in an indoor space in which location identification messages are sent
to user devices in small packets. In normal beacon network models,
micro-controller (MCU) or low-end system-on-chip (SoC) are often the
coordinators which configure messages for one or many VLC-LED bulbs. In this
paper, we discuss about processing overload and implementation cost of the two
typical models of VLC beacon network in scenarios of a hundred of VLC-LED
anchors are taken into account. Finally, an FPGA-based centralized VLC
transmitter and its aided Nios II-based system has been introduced to enhance
the performance of the VLC beacon network. Besides, due to the centralized
processing, our system model is considered to be more cost-efficient than the
dedicated-processor-based models
","[{""version"":""v1"",""created"":""Thu, 14 Mar 2019 19:36:51 GMT""}]","2019-03-18"
"1903.06229","Song-Bo Zhang","Daniel Breunig, Song-Bo Zhang, Martin Stehno, Bj\""orn Trauzettel","Influence of a chiral chemical potential on Weyl hybrid junctions","11 pages, 8 figures","Phys. Rev. B 99, 174501 (2019)","10.1103/PhysRevB.99.174501",,"cond-mat.supr-con cond-mat.mes-hall","http://arxiv.org/licenses/nonexclusive-distrib/1.0/","  We study the transport properties and superconducting proximity effect in NSN
junctions formed by a time-reversal symmetry broken Weyl semimetal (WSM) in
proximity to an $s$-wave superconductor. We find that the differential
conductance and induced pairing amplitudes strongly depend on the angle between
the junction direction in real space and the axis separating the Weyl nodes in
momentum space. We identify the influence of a chiral chemical potential, i.e.,
the electron population imbalance between Weyl nodes of opposite chirality, on
the transport characteristics of the junction. Remarkably, we observe a net
spin polarization of Cooper pairs that are generated via Andreev reflection in
the two WSM regions. The spin polarization is opposite in the two WSM regions
and highly sensitive to the chirality imbalance and excitation energy.
","[{""version"":""v1"",""created"":""Thu, 14 Mar 2019 19:43:59 GMT""},{""version"":""v2"",""created"":""Sun, 5 May 2019 20:05:34 GMT""}]","2019-07-02"
"1903.06230","Enzo Busseti","Nicholas Moehle and Enzo Busseti and Stephen Boyd and Matt Wytock","Dynamic Energy Management","63 pages, 15 figures, accompanying open source library",,,,"math.OC q-fin.PM","http://arxiv.org/licenses/nonexclusive-distrib/1.0/","  We present a unified method, based on convex optimization, for managing the
power produced and consumed by a network of devices over time. We start with
the simple setting of optimizing power flows in a static network, and then
proceed to the case of optimizing dynamic power flows, i.e., power flows that
change with time over a horizon. We leverage this to develop a real-time
control strategy, model predictive control, which at each time step solves a
dynamic power flow optimization problem, using forecasts of future quantities
such as demands, capacities, or prices, to choose the current power flow
values. Finally, we consider a useful extension of model predictive control
that explicitly accounts for uncertainty in the forecasts. We mirror our
framework with an object-oriented software implementation, an open-source
Python library for planning and controlling power flows at any scale. We
demonstrate our method with various examples. Appendices give more detail about
the package, and describe some basic but very effective methods for
constructing forecasts from historical data.
","[{""version"":""v1"",""created"":""Thu, 14 Mar 2019 19:53:54 GMT""}]","2019-03-18"
"1903.06231","Pavel Kravetc","Oleg Gendelman, Pavel Kravetc, Dmitrii Rachinskii","Mixed global dynamics of forced vibro-impact oscillator with Coulomb
  friction",,,"10.1063/1.5095627",,"math.DS nlin.CD","http://arxiv.org/licenses/nonexclusive-distrib/1.0/","  The paper revisits a well-known model of forced vibro-impact oscillator with
Amonton-Coulomb friction. In vast majority of the existing studies, this model
included also viscous friction, and its global dynamics in the state space is
governed by periodic, quasiperiodic or chaotic attractors. We demonstrate that
removal of the viscous friction leads to qualitative modification of the global
dynamics. Namely, the state space is divided into the regions with ""regular""
attraction to the aforementioned special solutions, and the regions with
profoundly Hamiltonian dynamics. The latter regions contain structures typical
for forced Hamiltonian systems: stability islands, extended non-attractive
chaotic regions etc. We prove that such local Hamiltonian behavior should occur
for phase trajectories with non-vanishing velocity. Stability analysis for the
periodic orbits confirms the above statement. It is demonstrated that similar
mixed global dynamics can be observed in broader class of models.
","[{""version"":""v1"",""created"":""Thu, 14 Mar 2019 19:56:27 GMT""}]","2020-01-08"
"1903.06232","Divya Sindhu Lekha","Sruthi K S, Divya Sindhu Lekha, A Sreekumar, Kannan Balakrishnan","Predicting Stability of Community Members in Complex Networks",,,,,"cs.SI cs.DM physics.soc-ph","http://arxiv.org/licenses/nonexclusive-distrib/1.0/","  In this work, we analyse and predict the stability of communities in complex
networks. We use a variant of closeness centrality, known as profile closeness,
to measure the loyalty of a member towards its community. We show that the
profile closeness is an adequate indicator of how communities evolve in a
network. We investigate this in static as well as dynamic (temporal) networks
and establish the relevance of profile closeness in predicting the evolution of
a complex network.
  Keywords: Small world networks , Centrality , Community , Closeness ,
Clustering
","[{""version"":""v1"",""created"":""Thu, 14 Mar 2019 19:59:16 GMT""},{""version"":""v2"",""created"":""Fri, 7 Jun 2019 04:20:29 GMT""},{""version"":""v3"",""created"":""Wed, 13 Jul 2022 11:17:11 GMT""}]","2022-07-14"
"1903.06233","Danilo Merlini","Merlini Danilo, Sala Massimo, Sala Nicoletta","A numerical comment on the 'tiny' oscillations and a heuristic
  'conjecture'","8 pages, 6 figures",,,,"math.NT","http://arxiv.org/licenses/nonexclusive-distrib/1.0/","  In the first part of this short work (in the form of a comment) we add the
plots of two more values of the Li-Keiper coefficients lambda5 and lambda6,
computed as in our recent work where the first four values were in particular
given. This for the trend as well as for the oscillating path ('tiny', the term
coined by Maslanka in his pioneering work). Then, in the second part looking at
the tiny oscillations, we propose a 'numerical conjecture' in a more strong
form, i.e. with a logarithmic behaviour and carry out a short numerical
experiment on the new 'numerical conjecture'.
","[{""version"":""v1"",""created"":""Thu, 14 Mar 2019 20:01:22 GMT""},{""version"":""v2"",""created"":""Fri, 5 Apr 2019 20:06:00 GMT""}]","2019-04-09"
"1903.06235","Zhong Yang","Zhong Yang and Yuanwei Liu and Yue Chen and Lei Jiao","Learning Automata Based Q-learning for Content Placement in Cooperative
  Caching","30 pages, 10 figures",,,,"eess.SP","http://arxiv.org/licenses/nonexclusive-distrib/1.0/","  An optimization problem of content placement in cooperative caching is
formulated, with the aim of maximizing sum mean opinion score (MOS) of mobile
users. Firstly, a supervised feed-forward back-propagation connectionist model
based neural network (SFBC-NN) is invoked for user mobility and content
popularity prediction. More particularly, practical data collected from
GPS-tracker app on smartphones is tackled to test the accuracy of mobility
prediction. Then, a learning automata-based Q-learning (LAQL) algorithm for
cooperative caching is proposed, in which learning automata (LA) is invoked for
Q-learning to obtain an optimal action selection in a random and stationary
environment. It is proven that the LA-based action selection scheme is capable
of enabling every state to select the optimal action with arbitrarily high
probability if Q-learning is able to converge to the optimal Q value
eventually. To characterize the performance of the proposed algorithms, the sum
MOS of users is applied to define the reward function. Extensive simulations
reveal that: 1) The prediction error of SFBC-NN lessen with the increase of
iterations and nodes; 2) the proposed LAQL achieves significant performance
improvement against traditional Q-learning; 3) the cooperative caching scheme
is capable of outperforming non-cooperative caching and random caching of 3%
and 4%.
","[{""version"":""v1"",""created"":""Thu, 14 Mar 2019 20:12:04 GMT""},{""version"":""v2"",""created"":""Sat, 30 Mar 2019 23:24:01 GMT""}]","2019-04-02"
"1903.06236","Vladimir Macko","Vladimir Macko, Charles Weill, Hanna Mazzawi, Javier Gonzalvo","Improving Neural Architecture Search Image Classifiers via Ensemble
  Learning",,,,,"cs.LG stat.ML","http://arxiv.org/licenses/nonexclusive-distrib/1.0/","  Finding the best neural network architecture requires significant time,
resources, and human expertise. These challenges are partially addressed by
neural architecture search (NAS) which is able to find the best convolutional
layer or cell that is then used as a building block for the network. However,
once a good building block is found, manual design is still required to
assemble the final architecture as a combination of multiple blocks under a
predefined parameter budget constraint. A common solution is to stack these
blocks into a single tower and adjust the width and depth to fill the parameter
budget. However, these single tower architectures may not be optimal. Instead,
in this paper we present the AdaNAS algorithm, that uses ensemble techniques to
compose a neural network as an ensemble of smaller networks automatically.
Additionally, we introduce a novel technique based on knowledge distillation to
iteratively train the smaller networks using the previous ensemble as a
teacher. Our experiments demonstrate that ensembles of networks improve
accuracy upon a single neural network while keeping the same number of
parameters. Our models achieve comparable results with the state-of-the-art on
CIFAR-10 and sets a new state-of-the-art on CIFAR-100.
","[{""version"":""v1"",""created"":""Thu, 14 Mar 2019 20:17:33 GMT""}]","2019-03-18"
"1903.06237","Amir Gholami","Linjian Ma and Gabe Montague and Jiayu Ye and Zhewei Yao and Amir
  Gholami and Kurt Keutzer and Michael W. Mahoney","Inefficiency of K-FAC for Large Batch Size Training",,"AAAI 2020",,,"cs.LG stat.ML","http://arxiv.org/licenses/nonexclusive-distrib/1.0/","  In stochastic optimization, using large batch sizes during training can
leverage parallel resources to produce faster wall-clock training times per
training epoch. However, for both training loss and testing error, recent
results analyzing large batch Stochastic Gradient Descent (SGD) have found
sharp diminishing returns, beyond a certain critical batch size. In the hopes
of addressing this, it has been suggested that the Kronecker-Factored
Approximate Curvature (\mbox{K-FAC}) method allows for greater scalability to
large batch sizes, for non-convex machine learning problems such as neural
network optimization, as well as greater robustness to variation in model
hyperparameters. Here, we perform a detailed empirical analysis of large batch
size training %of these two hypotheses, for both \mbox{K-FAC} and SGD,
evaluating performance in terms of both wall-clock time and aggregate
computational cost. Our main results are twofold: first, we find that both
\mbox{K-FAC} and SGD doesn't have ideal scalability behavior beyond a certain
batch size, and that \mbox{K-FAC} does not exhibit improved large-batch
scalability behavior, as compared to SGD; and second, we find that
\mbox{K-FAC}, in addition to requiring more hyperparameters to tune, suffers
from similar hyperparameter sensitivity behavior as does SGD. We discuss
extensive results using ResNet and AlexNet on \mbox{CIFAR-10} and SVHN,
respectively, as well as more general implications of our findings.
","[{""version"":""v1"",""created"":""Thu, 14 Mar 2019 20:21:35 GMT""},{""version"":""v2"",""created"":""Thu, 27 Jun 2019 21:59:03 GMT""},{""version"":""v3"",""created"":""Wed, 31 Jul 2019 19:28:00 GMT""}]","2021-04-21"
"1903.06238","Helmut Dannerbauer","H. Dannerbauer, E. van Kampen, J. Afonso, P. Andreani, F. Arrigoni
  Battaia, F. Bertoldi, C. Casey, C.-C. Chen, D. L. Clements, C. De Breuck, B.
  Frye, J. Geach, K. Harrington, M. Hayashi, S. Jin, P. Klaassen, K. Kohno, M.
  D. Lehnert, I. Matute, T. Mroczkowski, A. Noble, C. Pappalardo, Y. Tamura, J.
  Zavala","Mapping Galaxy Clusters in the Distant Universe","Science white paper submitted to the Astro2020 Decadal Survey",,,,"astro-ph.GA","http://arxiv.org/licenses/nonexclusive-distrib/1.0/","  We present the science case for mapping several thousand galaxy
(proto)clusters at z=1-10 with a large aperture single dish sub-mm facility,
producing a high-redshift counterpart to local large surveys of rich clusters
like the well-studied Abell catalogue. Principal goals of a large survey of
distant clusters are the evolution of galaxy clusters over cosmic time and the
impact of environment on the evolution and formation of galaxies. To make a big
leap forward in this emerging research field, the community would benefit from
a large-format, wide-band, direct-detection spectrometer (e.g., based on MKID
technology), covering a wide field of ~1 square degree and a frequency coverage
from 70 to 700 GHz.
","[{""version"":""v1"",""created"":""Thu, 14 Mar 2019 20:21:41 GMT""}]","2019-03-18"
"1903.06239","Eran Palti","Eran Palti","The Swampland: Introduction and Review","198 Pages, 40 figures. Invited review for Fortschritte der Physik.
  Partially based on lectures delivered at BUSSTEPP 2018 (Oxford), and lectures
  to be delivered at SIFTS 2019 (Madrid) and BUSSTEPP 2019 (Glasgow). v2: Fixed
  typos, added comments and references. v3. More references added and typos
  fixed",,"10.1002/prop.201900037",,"hep-th gr-qc","http://arxiv.org/licenses/nonexclusive-distrib/1.0/","  The Swampland program aims to distinguish effective theories which can be
completed into quantum gravity in the ultraviolet from those which cannot. This
article forms an introduction to the field, assuming only a knowledge of
quantum field theory and general relativity. It also forms a comprehensive
review, covering the range of ideas that are part of the field, from the Weak
Gravity Conjecture, through compactifications of String Theory, to the de
Sitter conjecture.
","[{""version"":""v1"",""created"":""Thu, 14 Mar 2019 20:31:04 GMT""},{""version"":""v2"",""created"":""Wed, 27 Mar 2019 17:48:15 GMT""},{""version"":""v3"",""created"":""Wed, 19 Jun 2019 08:30:06 GMT""}]","2019-06-26"
