"1903.06486","Jiawei Mei","Liang Zhou, Junshu Chen, Xiaobin Chen, Bin Xi, Yang Qiu, Junwei Zhang,
  Linjing Wang, Runnan Zhang, Bicong Ye, Pingbo Chen, Xixiang Zhang, Guoping
  Guo, Dapeng Yu, Jia-Wei Mei, Fei Ye, Gan Wang, and Hongtao He","Topological Hall effect in bulk ferromagnet Cr$_2$Te$_3$ embedded with
  black-phosphorus-like bismuth nanosheets",,,,,"cond-mat.mtrl-sci cond-mat.mes-hall","http://arxiv.org/licenses/nonexclusive-distrib/1.0/","  We implement the molecular beam epitaxy method to embed the
black-phosphorus-like bismuth nanosheets into the bulk ferromagnet
Cr$_2$Te$_3$. As a typical surfactant, bismuth lowers the surface tensions and
mediates the layer-by-layer growth of Cr$_2$Te$_3$. Meanwhile, the bismuth
atoms precipitate into black-phosphorus-like nanosheets with the lateral size
of several tens of nanometers. In Cr$_2$Te$_3$ embedded with Bi-nanosheets, we
observe simultaneously a large topological Hall effect together with the
magnetic susceptibility plateau and magnetoresistivity anomaly. As a control
experiment, none of these signals is observed in the pristine Cr$_2$Te$_3$
samples. Therefore, the Bi-nanosheets serve as seeds of topological Hall effect
induced by non-coplanar magnetic textures planted into Cr$_2$Te$_3$. Our
experiments demonstrate a new method to generates a large topological Hall
effect by planting strong spin-orbit couplings into the traditional
ferromagnet, which may have potential applications in spintronics.
","[{""version"":""v1"",""created"":""Fri, 15 Mar 2019 12:33:31 GMT""}]","2019-03-18"
"1903.06487","Jeremy Green","Nesreen Hasan, Jeremy Green, Stefan Meinel, Michael Engelhardt, Stefan
  Krieg, John Negele, Andrew Pochinsky, Sergey Syritsyn","Nucleon axial, scalar, and tensor charges using lattice QCD at the
  physical pion mass","24 pages, 13 figures, 9 tables. v2: added references. v3: additional
  discussion of systematics and summary plot showing calculations by other
  groups","Phys. Rev. D 99, 114505 (2019)","10.1103/PhysRevD.99.114505","DESY 19-044","hep-lat hep-ph nucl-th","http://arxiv.org/licenses/nonexclusive-distrib/1.0/","  We report on lattice QCD calculations of the nucleon isovector axial, scalar,
and tensor charges. Our calculations are performed on two 2+1-flavor ensembles
generated using a 2-HEX-smeared Wilson-clover action at the physical pion mass
and lattice spacings $a\approx$ 0.116 and 0.093 fm. We use a wide range of
source-sink separations - eight values ranging from roughly 0.4 to 1.4 fm on
the coarse ensemble and three values from 0.9 to 1.5 fm on the fine ensemble -
which allows us to perform an extensive study of excited-state effects using
different analysis and fit strategies. To determine the renormalization
factors, we use the nonperturbative Rome-Southampton approach and compare
RI'-MOM and RI-SMOM intermediate schemes to estimate the systematic
uncertainties. Our final results are computed in the MS-bar scheme at scale 2
GeV. The tensor and axial charges have uncertainties of roughly 4%,
$g_T=0.972(41)$ and $g_A=1.265(49)$. The resulting scalar charge,
$g_S=0.927(303)$, has a much larger uncertainty due to a stronger dependence on
the choice of intermediate renormalization scheme and on the lattice spacing.
","[{""version"":""v1"",""created"":""Fri, 15 Mar 2019 12:34:00 GMT""},{""version"":""v2"",""created"":""Wed, 27 Mar 2019 16:46:29 GMT""},{""version"":""v3"",""created"":""Thu, 16 May 2019 10:33:39 GMT""}]","2019-06-26"
"1903.06489","Zi-Yu Chen","Zi-Yu Chen and Rui Qin","Strong-field nonlinear optical properties of monolayer black phosphorus","24 pages, 5 figures","Nanoscale, 2019","10.1039/C9NR04895B",,"physics.app-ph physics.optics","http://arxiv.org/licenses/nonexclusive-distrib/1.0/","  Within the past few years, atomically thin black phosphorus (BP) has been
demonstrated as a fascinating new 2D material that is promising for novel
nanoelectronics and nanophotonics applications, due to its many unique
properties such as direct and widely tunable bandgap, high carrier mobility and
remarkable intrinsic in-plane anisotropy. However, its important extreme
nonlinear behavior and ultrafast dynamics of carriers under strong-field
excitation have yet to be revealed to date. Herein, we report nonperturbative
high harmonic generation (HHG) in monolayer BP by first-principles simulations.
We show that BP exhibits extraordinary HHG properties, with clear advantages
over three major types of 2D materials under intensive study, i.e.,
semimetallic graphene, semiconducting MoS$_2$, and insulating hexagonal boron
nitride, in terms of HHG cutoff energy and spectral intensity. This study
advances the scope of current research activities of BP into a new regime,
suggesting its promising future in applications of extreme-ultraviolet and
attosecond nanophotonics, and also opening doors to investigate the
strong-field and ultrafast carrier dynamics of this emerging material.
","[{""version"":""v1"",""created"":""Fri, 15 Mar 2019 12:35:49 GMT""},{""version"":""v2"",""created"":""Sun, 4 Aug 2019 06:48:22 GMT""}]","2019-08-06"
"1903.06491","Alessio Porretta","Alessio Porretta and Michele Ricciardi","Mean field games under invariance conditions for the state space",,,,,"math.AP","http://arxiv.org/licenses/nonexclusive-distrib/1.0/","  We investigate mean field game systems under invariance conditions for the
state space, otherwise called {\it viability conditions} for the controlled
dynamics. First we analyze separately the Hamilton-Jacobi and the Fokker-Planck
equations, showing how the invariance condition on the underlying dynamics
yields the existence and uniqueness, respectively in $L^\infty$ and in $L^1$.
Then we apply this analysis to mean field games. We investigate further the
regularity of solutions proving, under some extra conditions, that the value
function is (globally) Lipschitz and semiconcave. This latter regularity
eventually leads the distribution density to be bounded, under suitable
conditions. The results are not restricted to smooth domains.
","[{""version"":""v1"",""created"":""Fri, 15 Mar 2019 12:36:45 GMT""}]","2019-03-18"
"1903.06492","Marie Maros","Marie Maros and Joakim Jal\'en","On Decentralized Tracking with ADMM for Problems with Time-Varying
  Curvature","Extended version of CDC submission",,,,"math.OC","http://arxiv.org/licenses/nonexclusive-distrib/1.0/","  We analyze the performance of the alternating direction method of multipliers
(ADMM) to track, in a decentralized manner, a solution of a stochastic sequence
of optimization problems parametrized by a discrete time Markov process. The
main advantage of considering a stochastic model is that we allow the objective
functions to occasionally lose strong convexity and/or Lipschitz continuity of
their gradients. Due to the stochastic nature of our model, the tracking
statement is given in a mean square deviation error.
","[{""version"":""v1"",""created"":""Fri, 15 Mar 2019 12:39:33 GMT""}]","2019-03-18"
"1903.06493","Thomas Bohnstingl","Thomas Bohnstingl, Franz Scherr, Christian Pehle, Karlheinz Meier,
  Wolfgang Maass","Neuromorphic Hardware learns to learn",,"https://www.frontiersin.org/articles/10.3389/fnins.2019.00483/full","10.3389/fnins.2019.00483",,"cs.NE","http://arxiv.org/licenses/nonexclusive-distrib/1.0/","  Hyperparameters and learning algorithms for neuromorphic hardware are usually
chosen by hand. In contrast, the hyperparameters and learning algorithms of
networks of neurons in the brain, which they aim to emulate, have been
optimized through extensive evolutionary and developmental processes for
specific ranges of computing and learning tasks. Occasionally this process has
been emulated through genetic algorithms, but these require themselves
hand-design of their details and tend to provide a limited range of
improvements. We employ instead other powerful gradient-free optimization
tools, such as cross-entropy methods and evolutionary strategies, in order to
port the function of biological optimization processes to neuromorphic
hardware. As an example, we show that this method produces neuromorphic agents
that learn very efficiently from rewards. In particular, meta-plasticity, i.e.,
the optimization of the learning rule which they use, substantially enhances
reward-based learning capability of the hardware. In addition, we demonstrate
for the first time Learning-to-Learn benefits from such hardware, in
particular, the capability to extract abstract knowledge from prior learning
experiences that speeds up the learning of new but related tasks.
Learning-to-Learn is especially suited for accelerated neuromorphic hardware,
since it makes it feasible to carry out the required very large number of
network computations.
","[{""version"":""v1"",""created"":""Fri, 15 Mar 2019 12:39:35 GMT""},{""version"":""v2"",""created"":""Mon, 18 Mar 2019 08:22:21 GMT""}]","2019-06-11"
"1903.06494","Daniel Hershcovich","Daniel Hershcovich and Omri Abend and Ari Rappoport","Content Differences in Syntactic and Semantic Representations","NAACL-HLT 2019 camera ready",,,,"cs.CL","http://arxiv.org/licenses/nonexclusive-distrib/1.0/","  Syntactic analysis plays an important role in semantic parsing, but the
nature of this role remains a topic of ongoing debate. The debate has been
constrained by the scarcity of empirical comparative studies between syntactic
and semantic schemes, which hinders the development of parsing methods informed
by the details of target schemes and constructions. We target this gap, and
take Universal Dependencies (UD) and UCCA as a test case. After abstracting
away from differences of convention or formalism, we find that most content
divergences can be ascribed to: (1) UCCA's distinction between a Scene and a
non-Scene; (2) UCCA's distinction between primary relations, secondary ones and
participants; (3) different treatment of multi-word expressions, and (4)
different treatment of inter-clause linkage. We further discuss the long tail
of cases where the two schemes take markedly different approaches. Finally, we
show that the proposed comparison methodology can be used for fine-grained
evaluation of UCCA parsing, highlighting both challenges and potential sources
for improvement. The substantial differences between the schemes suggest that
semantic parsers are likely to benefit downstream text understanding
applications beyond their syntactic counterparts.
","[{""version"":""v1"",""created"":""Fri, 15 Mar 2019 12:44:36 GMT""},{""version"":""v2"",""created"":""Tue, 19 Mar 2019 08:14:55 GMT""},{""version"":""v3"",""created"":""Thu, 28 Mar 2019 16:10:24 GMT""},{""version"":""v4"",""created"":""Fri, 29 Mar 2019 09:50:20 GMT""},{""version"":""v5"",""created"":""Wed, 1 May 2019 06:28:11 GMT""}]","2019-05-02"
"1903.06496","Valentin Vielzeuf","Juan-Manuel P\'erez-R\'ua, Valentin Vielzeuf, St\'ephane Pateux, Moez
  Baccouche, Fr\'ed\'eric Jurie","MFAS: Multimodal Fusion Architecture Search","CVPR 2019, Jun 2019, Long Beach, United States
  http://cvpr2019.thecvf.com/",,,,"cs.LG cs.CV cs.NE","http://arxiv.org/licenses/nonexclusive-distrib/1.0/","  We tackle the problem of finding good architectures for multimodal
classification problems. We propose a novel and generic search space that spans
a large number of possible fusion architectures. In order to find an optimal
architecture for a given dataset in the proposed search space, we leverage an
efficient sequential model-based exploration approach that is tailored for the
problem. We demonstrate the value of posing multimodal fusion as a neural
architecture search problem by extensive experimentation on a toy dataset and
two other real multimodal datasets. We discover fusion architectures that
exhibit state-of-the-art performance for problems with different domain and
dataset size, including the NTU RGB+D dataset, the largest multi-modal action
recognition dataset available.
","[{""version"":""v1"",""created"":""Fri, 15 Mar 2019 12:45:13 GMT""}]","2019-03-18"
"1903.06497","Alper Demir","Alper Demir and M. Selim Hanay","Phase-Locked Loop based Resonant Sensors: A Rigorous Theory and General
  Analysis Framework for Deciphering Fundamental Sensitivity Limitations due to
  Noise","37 pages, 8 figures",,"10.1109/JSEN.2019.2948681",,"physics.app-ph","http://arxiv.org/licenses/nonexclusive-distrib/1.0/","  Nanomechanical resonators are used in building ultra-sensitive mass and force
sensors. In a widely used resonator based sensing paradigm, each modal
resonance frequency is tracked with a phase-locked loop (PLL) based system.
There is great interest in deciphering the fundamental sensitivity limitations
due to inherent noise and fluctuations in PLL based resonant sensors to improve
their performance. In this paper, we present a precise, first-principles based
theory for the analysis of PLL based resonator tracking systems. Based on this
theory, we develop a general, rigorously-derived noise analysis framework for
PLL based sensors. We apply this framework to a setting where the sensor
performance is mainly limited by the thermomechanical noise of the
nanomechanical resonator. The results that are deduced through our analysis
framework are in complete agreement with the ones we obtain from extensive,
carefully run stochastic simulations of a PLL based sensor system. We compare
the conclusions we derive with the recent results in the literature. Our theory
and analysis framework can be used in assessing PLL based sensor performance
with other sources of noise, e.g., from the electronic components, actuation
and sensing mechanisms, and due to the signal generator, as well as for a
variety of PLL based sensor configurations such as multi-mode and nonlinear
sensing.
","[{""version"":""v1"",""created"":""Fri, 15 Mar 2019 12:46:41 GMT""}]","2020-10-12"
"1903.06498","Tim Zerrell","Tim Zerrell and Jeremy Bruestle","Stripe: Tensor Compilation via the Nested Polyhedral Model",,,,,"cs.DC cs.LG","http://arxiv.org/licenses/nonexclusive-distrib/1.0/","  Hardware architectures and machine learning (ML) libraries evolve rapidly.
Traditional compilers often fail to generate high-performance code across the
spectrum of new hardware offerings. To mitigate, engineers develop hand-tuned
kernels for each ML library update and hardware upgrade. Unfortunately, this
approach requires excessive engineering effort to scale or maintain with any
degree of state-of-the-art performance. Here we present a Nested Polyhedral
Model for representing highly parallelizable computations with limited
dependencies between iterations. This model provides an underlying framework
for an intermediate representation (IR) called Stripe, amenable to standard
compiler techniques while naturally modeling key aspects of modern ML
computing. Stripe represents parallelism, efficient memory layout, and multiple
compute units at a level of abstraction amenable to automatic optimization. We
describe how Stripe enables a compiler for ML in the style of LLVM that allows
independent development of algorithms, optimizations, and hardware
accelerators. We also discuss the design exploration advantages of Stripe over
kernel libraries and schedule-based or schedule-space-based code generation.
","[{""version"":""v1"",""created"":""Thu, 14 Mar 2019 17:49:48 GMT""}]","2019-03-18"
"1903.06499","C. Soule","Marcelle Kaufman (ULB), Christophe Soul\'e (IHES)","On the multistationarity of chemical reaction networks",,"Journal of Theoretical Biology, Elsevier, In press, 465,
  pp.126-133",,,"q-bio.MN","http://arxiv.org/licenses/nonexclusive-distrib/1.0/","  We present a new conjecture about a necessary condition that a (bio)chemical
network has to satisfy for it to exhibit multistationarity. According to a
Theorem of Feliu and Wiuf [27, 12], the conjecture is known for strictly
monotonic kinetics. We give several examples illustrating our conjecture.
","[{""version"":""v1"",""created"":""Fri, 15 Mar 2019 12:47:20 GMT""}]","2019-03-18"
"1903.06500","Rui Xia","Rui Xia, Vincent Y. F. Tan, Louis Filstroff, C\'edric F\'evotte","A Ranking Model Motivated by Nonnegative Matrix Factorization with
  Applications to Tennis Tournaments","16 pages, 2 figures, 9 tables. Accepted and to be presented at the
  European Conference on Machine Learning and Principles and Practice of
  Knowledge Discovery in Databases (ECML/PKDD) 2019. Supplementary material,
  code and datasets can be found in this URL
  https://github.com/XiaRui1996/btl-nmf",,,,"cs.LG eess.SP stat.ML","http://arxiv.org/licenses/nonexclusive-distrib/1.0/","  We propose a novel ranking model that combines the Bradley-Terry-Luce
probability model with a nonnegative matrix factorization framework to model
and uncover the presence of latent variables that influence the performance of
top tennis players. We derive an efficient, provably convergent, and
numerically stable majorization-minimization-based algorithm to maximize the
likelihood of datasets under the proposed statistical model. The model is
tested on datasets involving the outcomes of matches between 20 top male and
female tennis players over 14 major tournaments for men (including the Grand
Slams and the ATP Masters 1000) and 16 major tournaments for women over the
past 10 years. Our model automatically infers that the surface of the court
(e.g., clay or hard court) is a key determinant of the performances of male
players, but less so for females. Top players on various surfaces over this
longitudinal period are also identified in an objective manner.
","[{""version"":""v1"",""created"":""Fri, 15 Mar 2019 12:48:33 GMT""},{""version"":""v2"",""created"":""Thu, 13 Jun 2019 03:56:27 GMT""}]","2019-06-14"
"1903.06501","Jan Troost","Songyuan Li, Nicolaos Toumbas, Jan Troost","Liouville Quantum Gravity","26 pages, journal version",,"10.1016/j.nuclphysb.2019.114913",,"hep-th","http://arxiv.org/licenses/nonexclusive-distrib/1.0/","  We define a three-dimensional quantum theory of gravity as the holographic
dual of the Liouville conformal field theory. The theory is consistent and
unitary by definition. The corresponding theory of gravity with negative
cosmological constant has peculiar properties. The quantum theory has no
normalisable AdS3 vacuum. The model contains primary black holes with zero
spin. All states can be interpreted as black holes dressed with boundary
gravitons. There is a unique universal interaction between these states
consistent with unitarity and the conformal symmetry of the model. This theory
of gravity, though conceptually isolated from other models of quantum gravity,
is worth scrutinising.
","[{""version"":""v1"",""created"":""Fri, 15 Mar 2019 12:49:05 GMT""},{""version"":""v2"",""created"":""Tue, 7 Jan 2020 13:05:47 GMT""}]","2020-02-19"
"1903.06502","Jerome Bertrand","J\'er\^ome Bertrand (IMT), Philippe Castillon (IMAG)","Prescribing The Gauss Curvature Of Convex Bodies In Hyperbolic Space",,,,,"math.MG math.DG","http://arxiv.org/licenses/nonexclusive-distrib/1.0/","  The Gauss curvature measure of a pointed Euclidean convex body is a measure
on the unit sphere which extends the notion of Gauss curvature to non-smooth
bodies. Alexandrov's problem consists in finding a convex body with given
curvature measure. In Euclidean space, A.D. Alexandrov gave a necessary and
sufficient condition on the measure for this problem to have a solution. In
this paper, we address Alexandrov's problem for convex bodies in the hyperbolic
space H m+1. After defining the Gauss curvature measure of an arbitrary
hyperbolic convex body, we completely solve Alexandrov's problem in this
setting. Contrary to the Euclidean case, we also prove the uniqueness of such a
convex body. The methods for proving existence and uniqueness of the solution
to this problem are both new.
","[{""version"":""v1"",""created"":""Fri, 15 Mar 2019 12:49:26 GMT""}]","2019-03-18"
"1903.06503","M. Fazeel Anwar","M. Fazeel Anwar, Mairaj Bibi, M. Saeed Akram","On solvability of certain equations of arbitrary length over
  torsion-free groups",,,,,"math.GR math.GT","http://arxiv.org/licenses/nonexclusive-distrib/1.0/","  Let $G$ be a non-trivial torsion free group and
$s(t)=g_{1}t^{\epsilon_{1}}g_{2}t^{\epsilon_{2}} \cdots g_{n}t^{\epsilon_{n}}=1
\; (g_{i} \in G,\ \epsilon_i=\pm 1)$ be an equation over $G$ containing no
blocks of the form $t^{-1}g_{i}t^{-1}, \; g_{i} \in G$. In this paper we show
that $s(t)=1$ has a solution over $G$ provided a single relation on
coefficients of $s(t)$ holds. We also generalize our results to equations
containing higher powers of $t$. The later equations are also related to
Kaplansky zero-divisor conjecture \cite{K}.
","[{""version"":""v1"",""created"":""Fri, 15 Mar 2019 12:50:34 GMT""}]","2019-03-18"
"1903.06504","Salwa Ait Elkorchi","S. Ait Elkorchi, M. Chabab, A. El Batoul, A. Lahbas, M. Oulne","$\gamma$-rigid triaxial nuclei in the presence of a minimal length via a
  quantum perturbation method","9 pages,1 Figures, LaTeX, contribution to the Proceedings of the
  37-th International Workshop on Nuclear Theory (IWNT-37), Rila Mountains,
  Bulgaria, June 25-July 1, 2018. Editors: M. Gaidarov and N. Minkov, Published
  by Heron Press Ltd., Sofia, Bulgaria, ISSN 1313-2822","Nuclear Theory, Vol. 37 (2018) pp 169",,,"nucl-th","http://creativecommons.org/licenses/by/4.0/","  In this work, we derive a closed solution of the Shr$ \ddot{o} $dinger
equation for Bohr Hamiltonien within the minimal length formalism. This
formalism is inspired by Heisenberg algebra and a generlized uncertainty
principle (GUP), applied to the geometrical collective Bohr- Mottelson model
(BMM) of nuclei by means of deformed canonical commutation relation and the
Pauli-Podolsky prescription. The problem is solved by means conjointly of
asymptotic iteration method (AIM) and a quantum perturbation method (QPM) for
transitional nuclei near the critical point symmetry Z(4) corresponding to
phase transition from prolate to $\gamma$-rigid triaxial shape. A scaled
Davidson potentiel is used as a restoring potential in order to get physical
minimum. The agreement between the obtained theoretical results and the
experimental data is very satisfactory.
","[{""version"":""v1"",""created"":""Fri, 15 Mar 2019 12:51:49 GMT""}]","2019-03-18"
"1903.06505","Vyacheslav Shalyapin","Vyacheslav N. Shalyapin and Luis J. Goicoechea","Gravitationally Lensed Quasar SDSS J1442+4055: Redshifts of Lensing
  Galaxies, Time Delay, Microlensing Variability, and Intervening Metal System
  at z ~ 2","21 pages, 9 figures, 9 tables. The long Tables 1-4 are available at
  https://grupos.unican.es/glendama/q1442.htm","2019 ApJ 873 117","10.3847/1538-4357/ab08f0",,"astro-ph.GA","http://arxiv.org/licenses/nonexclusive-distrib/1.0/","  We present an $r$--band photometric monitoring of the two images A and B of
the gravitationally lensed quasar SDSS J1442+4055 using the Liverpool Telescope
(LT). From the LT light curves between 2015 December and 2018 August, we derive
at once a time delay of 25.0 $\pm$ 1.5 days (1$\sigma$ confidence interval; A
is leading) and microlensing magnification gradients below 10$^{-4}$ mag
day$^{-1}$. The delay interval is not expected to be affected by an appreciable
microlensing--induced bias, so it can be used to estimate cosmological
parameters. This paper also focuses on new Gran Telescopio Canarias (GTC) and
LT spectroscopic observations of the lens system. We determine the redshift of
two bright galaxies around the doubly imaged quasar using LT spectroscopy,
while GTC data lead to low--noise individual spectra of A, B, and the main
lensing galaxy G1. The G1 spectral shape is accurately matched to an
early--type galaxy template at $z$ = 0.284, and it has potential for further
relevant studies. Additionally, the quasar spectra show absorption by
metal--rich gas at $z \sim$ 2. This dusty absorber is responsible for an
extinction bump at a rest--frame wavelength of 2209 $\pm$ 2 \AA, which has
strengths of $\sim$ 0.47 and 0.76 mag $\mu$m$^{-1}$ for A and B, respectively.
In such intervening system, the dust--to--gas ratio, gas--phase metallicity
indicator [Zn/H], and dust depletion level [Fe/Zn] are relatively high.
","[{""version"":""v1"",""created"":""Fri, 15 Mar 2019 12:53:41 GMT""}]","2019-03-18"
"1903.06506","Soumyabrata Dev","Shilpa Manandhar, Soumyabrata Dev, Yee Hui Lee, and Stefan Winkler","Predicting GPS-based PWV Measurements Using Exponential Smoothing",,"Published in Proc. IEEE AP-S Symposium on Antennas and Propagation
  and USNC-URSI Radio Science Meeting, 2019",,,"physics.ao-ph","http://arxiv.org/licenses/nonexclusive-distrib/1.0/","  Global Positioning System (GPS) derived precipitable water vapor (PWV) is
extensively being used in atmospheric remote sensing for applications like
rainfall prediction. Many applications require PWV values with good resolution
and without any missing values. In this paper, we implement an exponential
smoothing method to accurately predict the missing PWV values. The method shows
good performance in terms of capturing the seasonal variability of PWV values.
We report a root mean square error of 0.1~mm for a lead time of 15 minutes,
using past data of 30 hours measured at 5-minute intervals.
","[{""version"":""v1"",""created"":""Fri, 15 Mar 2019 12:55:03 GMT""}]","2019-03-18"
