"1904.00299","Rangrang Zhang","Rangrang Zhang and Jie Xiong","Semilinear stochastic partial differential equations: central limit
  theorem and moderate deviations",,,,,"math.PR","http://arxiv.org/licenses/nonexclusive-distrib/1.0/","  In this paper, we establish a central limit theorem (CLT) and the moderate
deviation principles (MDP) for a class of semilinear stochastic partial
differential equations driven by multiplicative noise on a bounded domain. The
main results can be applied to stochastic partial differential equations of
various types such as the stochastic Burgers equation and the
reaction-diffusion equations perturbed by space-time white noise.
","[{""version"":""v1"",""created"":""Sat, 30 Mar 2019 21:58:07 GMT""}]","2019-04-02"
"1904.00300","Mikhail Yu. Kuznetsov","Telescope Array Collaboration: R.U.Abbasi, M.Abe, T.Abu-Zayyad,
  M.Allen, R.Azuma, E.Barcikowski, J.W.Belz, D.R.Bergman, S.A.Blake, R.Cady,
  B.G.Cheon, J.Chiba, M.Chikawa, A.diMatteo, T.Fujii, K.Fujita, R.Fujiwara,
  M.Fukushima, G.Furlich, W.Hanlon, M.Hayashi, Y.Hayashi, N.Hayashida,
  K.Hibino, K.Honda, D.Ikeda, N.Inoue, T.Ishii, R.Ishimori, H.Ito, D.Ivanov,
  H.M.Jeong, S.Jeong, C.C.H.Jui, K.Kadota, F.Kakimoto, O.Kalashev, K.Kasahara,
  H.Kawai, S.Kawakami, S.Kawana, K.Kawata, E.Kido, H.B.Kim, J.H.Kim, J.H.Kim,
  S.Kishigami, V.Kuzmin, M.Kuznetsov, Y.J.Kwon, K.H.Lee, B.Lubsandorzhiev,
  J.P.Lundquist, K.Machida, K.Martens, T.Matsuyama, J.N.Matthews, R.Mayta,
  M.Minamino, K.Mukai, I.Myers, S.Nagataki, K.Nakai, R.Nakamura, T.Nakamura,
  T.Nonaka, H.Oda, S.Ogio, M.Ohnishi, H.Ohoka, T.Okuda, Y.Omura, M.Ono,
  R.Onogi, A.Oshima, S.Ozawa, I.H.Park, M.S.Pshirkov, J.Remington,
  D.C.Rodriguez, G.Rubtsov, D.Ryu, H.Sagawa, R.Sahara, K.Saito, Y.Saito,
  N.Sakaki, T.Sako, N.Sakurai, L.M.Scott, T.Seki, K.Sekino, P.D.Shah,
  F.Shibata, T.Shibata, H.Shimodaira, B.K.Shin, H.S.Shin, J.D.Smith,
  P.Sokolsky, B.T.Stokes, S.R.Stratton, T.A.Stroman, T.Suzawa, Y.Takagi,
  Y.Takahashi, M.Takamura, M.Takeda, R.Takeishi, A.Taketa, M.Takita, Y.Tameda,
  H.Tanaka, K.Tanaka, M.Tanaka, Y.Tanoue, S.B.Thomas, G.B.Thomson, P.Tinyakov,
  I.Tkachev, H.Tokuno, T.Tomida, S.Troitsky, Y.Tsunesada, K.Tsutsumi,
  Y.Uchihori, S.Udo, F.Urban, T.Wong, K.Yada, M.Yamamoto, H.Yamaoka,
  K.Yamazaki, J.Yang, K.Yashiro, H.Yoshii, Y.Zhezher, and Z.Zundel","Search for point sources of ultra-high energy photons with the Telescope
  Array surface detector","accepted to MNRAS, 11 pages, 4 figures, 2 tables; results in
  text-file format are supplemented to paper source","MNRAS 492 (2020), 3984","10.1093/mnras/stz3618","INR-TH-2019-005","astro-ph.HE","http://arxiv.org/licenses/nonexclusive-distrib/1.0/","  The surface detector (SD) of the Telescope Array (TA) experiment allows one
to indirectly detect photons with energies of order $10^{18}$ eV and higher and
to separate photons from the cosmic-ray background. In this paper we present
the results of a blind search for point sources of ultra-high energy (UHE)
photons in the Northern sky using the TA SD data. The photon-induced extensive
air showers (EAS) are separated from the hadron-induced EAS background by means
of a multivariate classifier based upon 16 parameters that characterize the air
shower events. No significant evidence for the photon point sources is found.
The upper limits are set on the flux of photons from each particular direction
in the sky within the TA field of view, according to the experiment's angular
resolution for photons. Average 95% C.L. upper limits for the point-source flux
of photons with energies greater than $10^{18}$, $10^{18.5}$, $10^{19}$,
$10^{19.5}$ and $10^{20}$ eV are $0.094$, $0.029$, $0.010$, $0.0073$ and
$0.0058$ km$^{-2}$yr$^{-1}$ respectively. For the energies higher than
$10^{18.5}$ eV, the photon point-source limits are set for the first time.
Numerical results for each given direction in each energy range are provided as
a supplement to this paper.
","[{""version"":""v1"",""created"":""Sat, 30 Mar 2019 22:01:48 GMT""},{""version"":""v2"",""created"":""Mon, 15 Apr 2019 17:43:57 GMT""},{""version"":""v3"",""created"":""Mon, 9 Mar 2020 16:07:03 GMT""}]","2020-03-10"
"1904.00301","Douglas Gough","Douglas Gough","Anticipating the Sun's heavy-element abundance","3 pages",,"10.1093/mnrasl/slz044",,"astro-ph.SR","http://arxiv.org/licenses/nonexclusive-distrib/1.0/","  Much of our understanding of the internal structure of the Sun derives from
so-called standard theoretical solar models. Unfortunately, none of those
models agrees completely with observation. The discrepancy is commonly
associated with chemical abundance, and has led to what is now called the solar
abundance problem, the resolution of which has previously been out of sight.
But now the Borexino Collaboration, who recently announced measurements of the
pp-chain solar neutrinos, are optimistic that %in future they will be able to
measure the flux $\Phi_{\rm CNO}$ of the neutrinos emitted by the relatively
weak CNO cycle. Since C, N and O constitute the majority of the heavy elements,
that measurement will permit a crucial determination of the heavy-element
abundance $Z_{\rm c}$ in the Sun's energy-generating core, thereby shedding
important light on the problem. To accomplish that determination, a robust
relation between $Z_{\rm c}$ and $\Phi_{\rm CNO}$ will be required. That
relation is $Z_{\rm c}= 0.400\, \Phi_{\rm CNO}$, where $\Phi_{\rm CNO}$ is in
units of $10^{10} {\rm cm}^{-2}{\rm s}^{-1}$.
","[{""version"":""v1"",""created"":""Sat, 30 Mar 2019 22:02:31 GMT""}]","2019-04-10"
"1904.00302","Mauro Patti","Mauro Patti, Matteo Lombini, Edoardo Maria Alberto Redaelli, Emiliano
  Diolaiti","Simulating the optical alignment of the multiconjugate adaptive optics
  module for the extremely large telescope",,"Journal of Astronomical Telescopes, Instruments, and Systems,
  5(1), 018005 (2019)","10.1117/1.JATIS.5.1.018005",,"astro-ph.IM","http://arxiv.org/licenses/nonexclusive-distrib/1.0/","  Adaptive optics (AO) instruments for the future extremely large telescopes
(ELTs) are characterized by advanced optical systems with diffraction-limited
optical quality. Low geometric distortion is also crucial for high accuracy
astrometric applications. Optical alignment of such systems is a crucial step
of the instrument integration. Due to relative inaccessibility of these giant
instruments, automatic alignment methods are also favored to improve the
instrument availability after major events, such as extraordinary maintenance.
The proposed alignment concept for these systems is described: the notable
example which is analyzed here is the case of the multiconjugate AO relay for
the future ELT. The results of ray-tracing simulations carried out to validate
the method are discussed in detail, covering the error sources, which could
degrade the alignment performance.
","[{""version"":""v1"",""created"":""Sat, 30 Mar 2019 22:06:14 GMT""}]","2019-04-02"
"1904.00303","Mohit Sharma","Mohit Sharma, Kevin Zhang, Oliver Kroemer","Learning Semantic Embedding Spaces for Slicing Vegetables",,,,,"cs.RO","http://arxiv.org/licenses/nonexclusive-distrib/1.0/","  In this work, we present an interaction-based approach to learn semantically
rich representations for the task of slicing vegetables. Unlike previous
approaches, we focus on object-centric representations and use auxiliary tasks
to learn rich representations using a two-step process. First, we use simple
auxiliary tasks, such as predicting the thickness of a cut slice, to learn an
embedding space which captures object properties that are important for the
task of slicing vegetables. In the second step, we use these learned latent
embeddings to learn a forward model. Learning a forward model affords us to
plan online in the latent embedding space and forces our model to improve its
representations while performing the slicing task. To show the efficacy of our
approach we perform experiments on two different vegetables: cucumbers and
tomatoes. Our experimental evaluation shows that our method is able to capture
important semantic properties for the slicing task, such as the thickness of
the vegetable being cut. We further show that by using our learned forward
model, we can plan for the task of vegetable slicing.
","[{""version"":""v1"",""created"":""Sat, 30 Mar 2019 22:15:18 GMT""}]","2019-04-02"
"1904.00304","Bal\'azs Endre Szigeti","Bal\'azs Endre Szigeti, Monika Varga-Kofarago","Study of angular correlations in Monte Carlo simulations","6 pages, 10 figures",,,,"hep-ph","http://arxiv.org/licenses/nonexclusive-distrib/1.0/","  In two-particle angular correlation measurements the distribution of charged
hadron pairs are evaluated as a function of pseudorapidity ($\Delta \eta$) and
azimuthal ($\Delta \varphi$) differences. In these correlations, jets manifest
themselves as a near-side peak around $\Delta \eta = 0,$ $\Delta \varphi = 0$.
These correlations can be used to extract transverse momentum ($p_T$) and
centrality dependence of the shape of the near-side peak in Pb-Pb collision.
The shape of the near-side peak is quantified by the variances of the
distribution. The variances are evaluated from a fit combining the peak and the
background. In this contribution, identified and unidentified angular
correlations are shown from Pb-Pb collisions at $\sqrt{s_{NN}} = 2.76$ TeV from
Monte Carlo simulations (AMPT, PYTHIA 8.235/Angantyr). Results show that
transport models in AMPT give better results than PYTHIA 8.235/Angantyr when
comparing to the experimental results of the ALICE collaboration.
","[{""version"":""v1"",""created"":""Sat, 30 Mar 2019 22:58:03 GMT""}]","2019-04-02"
"1904.00305","Taras Banakh","Taras Banakh","$\sigma$-Continuous functions and related cardinal characteristics of
  the continuum","7 pages","Tatra Mountains Math. Publ. 76:1 (2020) 1-10","10.2478/tmmp-2020-0014",,"math.GN math.LO","http://arxiv.org/licenses/nonexclusive-distrib/1.0/","  A function $f:X\to Y$ between topological spaces is called
$\sigma$-$continuous$ (resp. $\bar\sigma$-$continuous$) if there exists a
(closed) cover $\{X_n\}_{n\in\omega}$ of $X$ such that for every $n\in\omega$
the restriction $f{\restriction}X_n$ is continuous. By $\mathfrak c_\sigma$
(resp. $\mathfrak c_{\bar\sigma}$) we denote the largest cardinal
$\kappa\le\mathfrak c$ such that every function $f:X\to\mathbb R$ defined on a
subset $X\subset\mathbb R$ of cardinality $|X|<\kappa$ is $\sigma$-continuous
(resp. $\bar\sigma$-continuous). It is clear that $\omega_1\le\mathfrak
c_{\bar\sigma}\le\mathfrak c_\sigma\le\mathfrak c$. We prove that $\mathfrak
p\le\mathfrak q_0=\mathfrak c_{\bar\sigma}=\min\{\mathfrak c_\sigma,\mathfrak
b,\mathfrak q\}\le\mathfrak c_\sigma\le\min\{\mathrm{non}(\mathcal
M),\mathrm{non}(\mathcal N)\}$. The equality $\mathfrak
c_{\bar\sigma}=\mathfrak q_0$ resolves a problem from the initial version of
the paper.
","[{""version"":""v1"",""created"":""Sat, 30 Mar 2019 23:19:59 GMT""},{""version"":""v2"",""created"":""Tue, 2 Apr 2019 18:30:21 GMT""},{""version"":""v3"",""created"":""Sun, 15 Sep 2019 15:50:12 GMT""},{""version"":""v4"",""created"":""Fri, 15 Nov 2019 09:18:22 GMT""}]","2021-11-01"
"1904.00306","Morando Franco","Franco Morando","Decomposition and Modeling in the Non-Manifold domain","PhD. Thesis",,"10.13140/RG.2.2.15402.88008/1","DISI-TH-2003-02","cs.GR","http://creativecommons.org/licenses/by-nc-sa/4.0/","  The problem of decomposing non-manifold object has already been studied in
solid modeling. However, the few proposed solutions are limited to the problem
of decomposing solids described through their boundaries. In this thesis we
study the problem of decomposing an arbitrary non-manifold simplicial complex
into more regular components. A formal notion of decomposition is developed
using combinatorial topology. The proposed decomposition is unique, for a given
complex, and is computable for complexes of any dimension. A decomposition
algorithm is proposed that is linear w.r.t. the size of the input. In three or
higher dimensions a decomposition into manifold parts is not always possible.
Thus, in higher dimensions, we decompose a non-manifold into a decidable super
class of manifolds, that we call, Initial-Quasi-Manifolds. We also defined a
two-layered data structure, the Extended Winged data structure. This data
structure is a dimension independent data structure conceived to model
non-manifolds through their decomposition into initial-quasi-manifold parts.
Our two layered data structure describes the structure of the decomposition and
each component separately. In the second layer we encode the connectivity
structure of the decomposition. We analyze the space requirements of the
Extended Winged data structure and give algorithms to build and navigate it.
Finally, we discuss time requirements for the computation of topological
relations and show that, for surfaces and tetrahedralizations, embedded in real
3D space, all topological relations can be extracted in optimal time. This
approach offers a compact, dimension independent, representation for
non-manifolds that can be useful whenever the modeled object has few
non-manifold singularities.
","[{""version"":""v1"",""created"":""Sat, 30 Mar 2019 23:23:44 GMT""}]","2019-04-03"
"1904.00307","Hugo Messias Dr.","Hugo Messias, Neil Nagar, Zhi-Yu Zhang, Ivan Oteo, Simon Dye, Eduardo
  Ibar, Nicholas Timmons, Paul van der Werf, Dominik Riechers, Stephen Eales,
  Rob Ivison, Jacob Maresca, Michal J. Michalowski, Chentao Yang","The molecular-gas properties in the gravitationally lensed merger HATLAS
  J142935.3-002836","Accepted on MNRAS (14 pages, 12 figures)",,"10.1093/mnras/stz945",,"astro-ph.GA astro-ph.CO","http://arxiv.org/licenses/nonexclusive-distrib/1.0/","  Follow-up observations of (sub-)mm-selected gravitationally-lensed systems
have allowed a more detailed study of the dust-enshrouded phase of
star-formation up to very early cosmic times. Here, the case of the
gravitationally lensed merger in HATLAS J142935.3-002836 (also known as
H1429-0028; z_lens=0.218, z_bkg=1.027) is revisited following recent
developments in the literature and new APEX observations targeting two carbon
monoxide (CO) rotational transitions J_up=3 and 6. We show that the
line-profiles comprise three distinct velocity components, where the fainter
high-velocity one is less magnified and more compact. The modelling of the
observed spectral line energy distribution of CO J_up=2 to 6 and [CI]3P_1-3P_0
assumes a large velocity gradient scenario, where the analysis is based on four
statistical approaches. Since the detected gas and dust emission comes
exclusively from only one of the two merging components (the one oriented
North-South, NS), we are only able to determine upper-limits for the companion.
The molecular gas in the NS component in H1429-0028 is found to have a
temperature of ~70K, a volume density of log(n[/cm3])~3.7, to be expanding at
~10km/s/pc, and amounts to M_H2=4(-2,+3)*1e9 Msun. The CO to H2 conversion
factor is estimated to be alpha_CO=0.4(-0.2,+0.3) Msun/(K.km/s.pc2). The NS
galaxy is expected to have a factor of >10x more gas than its companion
(M_H2<3e8 Msun). Nevertheless, the total amount of molecular gas in the system
comprises only up to 15 per cent (1sigma upper-limit) of the total (dynamical)
mass.
","[{""version"":""v1"",""created"":""Sat, 30 Mar 2019 23:35:17 GMT""}]","2019-04-24"
"1904.00308","Takaki Matsumoto","Goro Ishiki, Takaki Matsumoto","Diffeomorphisms on Fuzzy Sphere","34 pages, 3 figures; v4: appendix F added, section 6 improved, minor
  modifications","Prog Theor Exp Phys (2020)","10.1093/ptep/ptz151","UTHEP-734","hep-th","http://arxiv.org/licenses/nonexclusive-distrib/1.0/","  Diffeomorphisms can be seen as automorphisms of the algebra of functions. In
the matrix regularization, functions on a smooth compact manifold are mapped to
finite size matrices. We consider how diffeomorphisms act on the configuration
space of the matrices through the matrix regularization. For the case of the
fuzzy $S^2$, we construct the matrix regularization in terms of the
Berezin-Toeplitz quantization. By using this quantization map, we define
diffeomorphisms on the space of matrices. We explicitly construct the matrix
version of holomorphic diffeomorphisms on $S^2$. We also propose three methods
of constructing approximate invariants on the fuzzy $S^2$. These invariants are
exactly invariant under area-preserving diffeomorphisms and only approximately
invariant (i.e. invariant in the large-$N$ limit) under the general
diffeomorphisms.
","[{""version"":""v1"",""created"":""Sat, 30 Mar 2019 23:37:18 GMT""},{""version"":""v2"",""created"":""Wed, 8 May 2019 07:33:10 GMT""},{""version"":""v3"",""created"":""Sun, 25 Aug 2019 23:04:55 GMT""},{""version"":""v4"",""created"":""Tue, 12 Nov 2019 15:13:18 GMT""}]","2020-01-29"
"1904.00309","Wei Dai","Yang Lu, Wei Dai, Yonina C. Eldar","Optimal Number of Measurements in a Linear System with Quadratically
  Decreasing SNR","12 pages, accepted by IEEE Transactions on Signal Processing",,"10.1109/TSP.2019.2910451",,"eess.SP","http://arxiv.org/licenses/nonexclusive-distrib/1.0/","  We consider the design of a linear sensing system with a fixed energy budget
assuming that the sampling noise is the dominant noise source. The energy
constraint implies that the signal energy per measurement decreases linearly
with the number of measurements. When the maximum sampling rate of the sampling
circuit is chosen to match the designed sampling rate, the assumption on the
noise implies that its variance increases approximately linearly with the
sampling rate (number of measurements). Therefore, the overall SNR per
measurement decreases quadratically in the number of measurements. Our analysis
shows that, in this setting there is an optimal number of measurements. This is
in contrast to the standard case, where noise variance remains unchanged with
sampling rate, in which case more measurements imply better performance. Our
results are based on a state evolution technique of the well-known approximate
message passing algorithm. We consider both the sparse (e.g. Bernoulli-Gaussian
and least-favorable distributions) and the non-sparse (e.g. Gaussian
distribution) settings in both the real and complex domains. Numerical results
corroborate our analysis.
","[{""version"":""v1"",""created"":""Sun, 31 Mar 2019 00:26:50 GMT""}]","2019-05-22"
"1904.00310","Xilai Li","Xilai Li, Yingbo Zhou, Tianfu Wu, Richard Socher, Caiming Xiong","Learn to Grow: A Continual Structure Learning Framework for Overcoming
  Catastrophic Forgetting",,,,,"cs.LG cs.CV","http://arxiv.org/licenses/nonexclusive-distrib/1.0/","  Addressing catastrophic forgetting is one of the key challenges in continual
learning where machine learning systems are trained with sequential or
streaming tasks. Despite recent remarkable progress in state-of-the-art deep
learning, deep neural networks (DNNs) are still plagued with the catastrophic
forgetting problem. This paper presents a conceptually simple yet general and
effective framework for handling catastrophic forgetting in continual learning
with DNNs. The proposed method consists of two components: a neural structure
optimization component and a parameter learning and/or fine-tuning component.
By separating the explicit neural structure learning and the parameter
estimation, not only is the proposed method capable of evolving neural
structures in an intuitively meaningful way, but also shows strong capabilities
of alleviating catastrophic forgetting in experiments. Furthermore, the
proposed method outperforms all other baselines on the permuted MNIST dataset,
the split CIFAR100 dataset and the Visual Domain Decathlon dataset in continual
learning setting.
","[{""version"":""v1"",""created"":""Sun, 31 Mar 2019 00:35:36 GMT""},{""version"":""v2"",""created"":""Tue, 2 Apr 2019 03:35:25 GMT""},{""version"":""v3"",""created"":""Tue, 21 May 2019 16:36:25 GMT""}]","2019-05-22"
"1904.00311","Humberto Rodriguez Gutierrez","Prasana K. Sahoo, Shahriar Memaran, Yan Xin, Tania D\'iaz M\'arquez,
  Florence Ann Nugera, Zhengguang Lu, Wenkai Zheng, Nikolai D. Zhigadlo, Dmitry
  Smirnov, Luis Balicas and Humberto R. Guti\'errez","Enhanced Optoelectronic Response in Bilayer Lateral Heterostructures of
  Transition Metal Dichalcogenides",,"ACS Nano 2019, 13, 11, 12372-12384","10.1021/acsnano.9b04957",,"cond-mat.mtrl-sci","http://arxiv.org/licenses/nonexclusive-distrib/1.0/","  Two-dimensional lateral heterojunctions are basic components for low-power
and flexible optoelectronics. In contrast to monolayers, devices based on
few-layer lateral heterostructures could offer superior performance due to
their lower susceptibility to environmental conditions. Here, we report the
controlled synthesis of multi-junction bilayer lateral heterostructures based
on MoS2-WS2 and MoSe2-WSe2, where the hetero-junctions are created via
sequential lateral edge-epitaxy that happens simultaneously in both the first
and the second layer. With respect to their monolayer counterparts, bilayer
lateral heterostructures yield nearly one order of magnitude higher
rectification currents. They also display a clear photovoltaic response, with
short circuit currents ~103 times larger than those extracted from the
monolayers, in addition to room-temperature electroluminescence. The superior
performance of bilayer heterostructures significantly expands the
functionalities of 2D crystals.
","[{""version"":""v1"",""created"":""Sun, 31 Mar 2019 00:35:38 GMT""}]","2019-11-27"
"1904.00312","Rajan Gupta","Rajan Gupta","Lattice QCD calculations of the quark and gluon contributions to the
  proton spin","14 pages, 4 figures, 23rd International Spin Physics Symposium -
  SPIN2018 - 10-14 September, 2018, Ferrara, Italy",,,"LA-UR-19-22704","hep-lat","http://arxiv.org/licenses/nonexclusive-distrib/1.0/","  A review of the calculations of the proton's spin using lattice QCD is
presented. Results for the three contributions, the quark contribution
$\sum_{q=u,d,s,c} (\frac{1}{2} {\Delta q})$, the total angular momentum of the
quarks $J_q$ and of the gluons $J_g$, and the orbital angular momentum of the
quarks are discussed. The best measured is the the quark contribution
$\sum_{q=u,d,s,c} (\frac{1}{2} {\Delta q})$, and its analysis is used to
discuss the relative merits of calculations by the PNDME, ETMC and $\chi$QCD
collaborations and the level of control over systematic errors achieved in
each. The result by the PNMDE collaboration, $\sum_{q=u,d,s} \left[ \frac{1}{2}
{\Delta q} \right] = 0.143(31)(36) $, is consistent with the COMPASS analysis
$0.13 < \frac{1}{2} \Delta \Sigma < 0.18$. Results for $J_q$ and $J_g$ by the
ETMC collaborations are also consistent with phenomenology. Lastly, I review
first results from the LHPC collaboration for the calculation of the orbital
angular momentum of the quarks. With much larger computing resources
anticipated over the next five years, high precision results for all three will
become available and provide a detailed description of their relative
contributions to the nucleon spin.
","[{""version"":""v1"",""created"":""Sun, 31 Mar 2019 00:44:40 GMT""}]","2019-04-02"
"1904.00313","Christopher Potts","Bruno Godefroy and Christopher Potts","Modeling Drug-Disease Relations with Linguistic and Knowledge Graph
  Constraints",,,,,"cs.CL","http://creativecommons.org/licenses/by/4.0/","  FDA drug labels are rich sources of information about drugs and drug-disease
relations, but their complexity makes them challenging texts to analyze in
isolation. To overcome this, we situate these labels in two health knowledge
graphs: one built from precise structured information about drugs and diseases,
and another built entirely from a database of clinical narrative texts using
simple heuristic methods. We show that Probabilistic Soft Logic models defined
over these graphs are superior to text-only and relation-only variants, and
that the clinical narratives graph delivers exceptional results with little
manual effort. Finally, we release a new dataset of drug labels with
annotations for five distinct drug-disease relations.
","[{""version"":""v1"",""created"":""Sun, 31 Mar 2019 00:48:42 GMT""}]","2019-04-02"
