"1904.00348","Andrej Dujella","Andrej Dujella, Matija Kazalicki and Vinko Petri\v{c}evi\'c","Rational Diophantine sextuples containing two regular quadruples and one
  regular quintuple","5 pages","Acta Mathematica Spalatensia 1 (2020), 19-27","10.32817/ams.1.1.2",,"math.NT","http://arxiv.org/licenses/nonexclusive-distrib/1.0/","  A set of $m$ distinct nonzero rationals $\{a_1,a_2,\ldots,a_m\}$ such that
$a_ia_j+1$ is a perfect square for all $1\leq i<j\leq m$, is called a rational
Diophantine $m$-tuple. It is proved recently that there are infinitely many
rational Diophantine sextuples. In this paper, we construct infinite families
of rational Diophantine sextuples with special structure, namely the sextuples
containing quadruples and quintuples of certain type.
","[{""version"":""v1"",""created"":""Sun, 31 Mar 2019 07:03:08 GMT""}]","2021-01-29"
"1904.00349","Thach V. Bui","Thach V. Bui, Minoru Kuribayashi, Mahdi Cheraghchi, and Isao Echizen","Efficient and error-tolerant schemes for non-adaptive complex group
  testing and its application in complex disease genetics",,,,,"cs.IT math.IT","http://arxiv.org/licenses/nonexclusive-distrib/1.0/","  The goal of combinatorial group testing is to efficiently identify up to $d$
defective items in a large population of $n$ items, where $d \ll n$. Defective
items satisfy certain properties while the remaining items in the population do
not. To efficiently identify defective items, a subset of items is pooled and
then tested. In this work, we consider complex group testing (CmplxGT) in which
a set of defective items consists of subsets of positive items (called
\textit{positive complexes}). CmplxGT is classified into two categories:
classical CmplxGT (CCmplxGT) and generalized CmplxGT (GCmplxGT). In CCmplxGT,
the outcome of a test on a subset of items is positive if the subset contains
at least one positive complex, and negative otherwise. In GCmplxGT, the outcome
of a test on a subset of items is positive if the subset has a certain number
of items of some positive complex, and negative otherwise.
  For CCmplxGT, we present a scheme that efficiently identifies all positive
complexes in time $t \times \mathrm{poly}(d, \ln{n})$ in the presence of
erroneous outcomes, where $t$ is a predefined parameter. As $d \ll n$, this is
significantly better than the currently best time of $\mathrm{poly}(t) \times
O(n \ln{n})$. Moreover, in specific cases, the number of tests in our proposed
scheme is smaller than previous work. For GCmplxGT, we present a scheme that
efficiently identifies all positive complexes. These schemes are directly
applicable in various areas such as complex disease genetics, molecular
biology, and learning a hidden graph.
","[{""version"":""v1"",""created"":""Sun, 31 Mar 2019 07:20:48 GMT""}]","2019-04-02"
"1904.00350","Sungjoon Park","Sungjoon Park, Donghyun Kim, Alice Oh","Conversation Model Fine-Tuning for Classifying Client Utterances in
  Counseling Dialogues","9 pages, 2 figures, NAACL 2019",,,,"cs.CL cs.LG stat.ML","http://arxiv.org/licenses/nonexclusive-distrib/1.0/","  The recent surge of text-based online counseling applications enables us to
collect and analyze interactions between counselors and clients. A dataset of
those interactions can be used to learn to automatically classify the client
utterances into categories that help counselors in diagnosing client status and
predicting counseling outcome. With proper anonymization, we collect
counselor-client dialogues, define meaningful categories of client utterances
with professional counselors, and develop a novel neural network model for
classifying the client utterances. The central idea of our model, ConvMFiT, is
a pre-trained conversation model which consists of a general language model
built from an out-of-domain corpus and two role-specific language models built
from unlabeled in-domain dialogues. The classification result shows that
ConvMFiT outperforms state-of-the-art comparison models. Further, the attention
weights in the learned model confirm that the model finds expected linguistic
patterns for each category.
","[{""version"":""v1"",""created"":""Sun, 31 Mar 2019 07:30:47 GMT""}]","2019-04-02"
"1904.00351","Nilanjan Das","Bappaditya Bhowmik, Nilanjan Das","Bohr phenomenon for operator valued functions","14 pages, Submitted to a journal","Proc. Edinburgh Math. Soc (2021) (Revised version)","10.1017/S0013091520000395",,"math.CV math.FA","http://arxiv.org/licenses/nonexclusive-distrib/1.0/","  In this article we establish Bohr inequalities for operator valued functions,
which can be viewed as the analogues of a couple of interesting results from
scalar valued settings. Some results of this paper are motivated by the
classical flavor of Bohr inequality, while the others are based on a
generalized concept of the Bohr radius problem.
","[{""version"":""v1"",""created"":""Sun, 31 Mar 2019 07:33:32 GMT""}]","2021-01-12"
"1904.00352","Jonathan Samuel Lumentut","Jonathan Samuel Lumentut and Tae Hyun Kim and Ravi Ramamoorthi and In
  Kyu Park","Fast and Full-Resolution Light Field Deblurring using a Deep Neural
  Network","9 pages, 8 figures","IEEE Signal Processing Letters, vol. 26, no. 12, pp. 1788-1792,
  December 2019","10.1109/LSP.2019.2947379",,"cs.CV","http://arxiv.org/licenses/nonexclusive-distrib/1.0/","  Restoring a sharp light field image from its blurry input has become
essential due to the increasing popularity of parallax-based image processing.
State-of-the-art blind light field deblurring methods suffer from several
issues such as slow processing, reduced spatial size, and a limited motion blur
model. In this work, we address these challenging problems by generating a
complex blurry light field dataset and proposing a learning-based deblurring
approach. In particular, we model the full 6-degree of freedom (6-DOF) light
field camera motion, which is used to create the blurry dataset using a
combination of real light fields captured with a Lytro Illum camera, and
synthetic light field renderings of 3D scenes. Furthermore, we propose a light
field deblurring network that is built with the capability of large receptive
fields. We also introduce a simple strategy of angular sampling to train on the
large-scale blurry light field effectively. We evaluate our method through both
quantitative and qualitative measurements and demonstrate superior performance
compared to the state-of-the-art method with a massive speedup in execution
time. Our method is about 16K times faster than Srinivasan et. al. [22] and can
deblur a full-resolution light field in less than 2 seconds.
","[{""version"":""v1"",""created"":""Sun, 31 Mar 2019 07:36:27 GMT""}]","2019-12-06"
"1904.00353","Sadegh Movahed","Marjan Mozaffarilegha and S. M. S. Movahed","Long-range temporal correlation in Auditory Brainstem Responses to
  Spoken Syllable /da/","27 pages, 8 figures and one table","Scientific Reports, volume 9, Article number: 1751 (2019)","10.1038/s41598-018-38215-w",,"q-bio.QM physics.bio-ph q-bio.NC","http://arxiv.org/licenses/nonexclusive-distrib/1.0/","  The speech auditory brainstem response (sABR) is an objective clinical tool
to diagnose particular impairments along the auditory brainstem pathways. We
explore the scaling behavior of the brainstem in response to synthetic /da/
stimuli using a proposed pipeline including Multifractal Detrended Moving
Average Analysis (MFDMA) modified by Singular Value Decomposition. The scaling
exponent confirms that all normal sABR are classified into the non-stationary
process. The average Hurst exponent is $H=0.77\pm0.12$ at 68\% confidence
interval indicating long-range correlation which shows the first universality
behavior of sABR. Our findings exhibit that fluctuations in the sABR series are
dictated by a mechanism associated with long-term memory of the dynamic of the
auditory system in the brainstem level. The $q-$dependency of $h(q)$
demonstrates that underlying data sets have multifractal nature revealing the
second universality behavior of the normal sABR samples. Comparing Hurst
exponent of original sABR with the results of the corresponding shuffled and
surrogate series, we conclude that its multifractality is almost due to the
long-range temporal correlations which are devoted to the third universality.
Finally, the presence of long-range correlation which is related to the slow
timescales in the subcortical level and integration of information in the
brainstem network is confirmed.
","[{""version"":""v1"",""created"":""Sun, 31 Mar 2019 07:36:56 GMT""}]","2019-04-02"
"1904.00354","Lorenzo Resca Dr.","Lorenzo Gallerani Resca","Minimal cosmological masses for photons and gluons","3 pages",,,,"gr-qc","http://arxiv.org/licenses/nonexclusive-distrib/1.0/","  I conjecture non-zero photon and gluon bare masses derived from a
cosmological scale. That entails the existence of photon and gluon
Bose-Einstein (BE) condensates in a comoving
Friedmann-Lemaitre-Robertson-Walker geometry. I derive tantalizing results that
set the inter-particle distance in these BE condensates almost at the nucleon
scale and a corresponding critical temperature of condensation almost at the
end of the quark epoch or the beginning of quark-gluon confinement. My
estimates for particle mass and number density in these BE condensates suggest
remarkable relations among fundamental constants, $h, c, G, \Lambda$, at the
most microscopic and cosmological scales of quantum and relativity theories.
","[{""version"":""v1"",""created"":""Sun, 31 Mar 2019 07:48:25 GMT""},{""version"":""v2"",""created"":""Mon, 8 Apr 2019 02:40:45 GMT""}]","2019-04-09"
"1904.00355","Zitong Yu","Hui Li, Meng Yang, Zhihui Lai, Weishi Zheng, Zitong Yu","Pedestrian re-identification based on Tree branch network with local and
  global learning","accepted by ICME2019(Oral)",,,,"cs.CV","http://arxiv.org/licenses/nonexclusive-distrib/1.0/","  Deep part-based methods in recent literature have revealed the great
potential of learning local part-level representation for pedestrian image in
the task of person re-identification. However, global features that capture
discriminative holistic information of human body are usually ignored or not
well exploited. This motivates us to investigate joint learning global and
local features from pedestrian images. Specifically, in this work, we propose a
novel framework termed tree branch network (TBN) for person re-identification.
Given a pedestrain image, the feature maps generated by the backbone CNN, are
partitioned recursively into several pieces, each of which is followed by a
bottleneck structure that learns finer-grained features for each level in the
hierarchical tree-like framework. In this way, representations are learned in a
coarse-to-fine manner and finally assembled to produce more discriminative
image descriptions. Experimental results demonstrate the effectiveness of the
global and local feature learning method in the proposed TBN framework. We also
show significant improvement in performance over state-of-the-art methods on
three public benchmarks: Market-1501, CUHK-03 and DukeMTMC.
","[{""version"":""v1"",""created"":""Sun, 31 Mar 2019 07:51:08 GMT""}]","2019-04-02"
"1904.00356","Khoa Tran","Khoa Anh Tran, Khuong Ba Dinh, Peter Hannaford and Lap Van Dao","Phase-matched nonlinear wave-mixing processes in XUV region with
  multicolor lasers","12 pages, 4 figures","Appl. Opt. 58 2540-2545 (2019)","10.1364/AO.58.002540",,"physics.optics","http://arxiv.org/licenses/nonexclusive-distrib/1.0/","  We report here experimental results of perturbative nonlinear optical
wave-mixing processes in the extreme ultraviolet region by using two-color and
three-color laser fields. Besides the usual odd-harmonic spectrum of high
harmonic generation, new spectral components are observed when multiple
incommensurate lasers (one driving plus one or two control field) interact with
neutral krypton gas. To demonstrate the wave-mixing process underlying such an
observation, we firstly couple the driving field with either the signal or the
idler field of an optical parametric amplifier in the gaseous ensemble to
generate certain mixing frequencies. The two control fields are then
simultaneously combined with the driving field to produce broad and
distinguishable mixing peaks that clearly reveal the contribution of each
control laser. Finally, the variation of the intensity of the mixing waves with
the intensity of each control field, the gas density, and the relative focus
position is examined for signatures of phase-matched generation of the mixing
fields in this spectral region.
","[{""version"":""v1"",""created"":""Sun, 31 Mar 2019 08:01:57 GMT""}]","2019-04-02"
"1904.00357","Philippe Gaborit","Nicolas Aragon and Philippe Gaborit and Adrien Hauteville and Olivier
  Ruatta and Gilles Z\'emor","Low Rank Parity Check Codes: New Decoding Algorithms and Applications to
  Cryptography","submitted to Transactions on Information Theory",,,,"cs.IT cs.CR math.IT","http://arxiv.org/licenses/nonexclusive-distrib/1.0/","  We introduce a new family of rank metric codes: Low Rank Parity Check codes
(LRPC), for which we propose an efficient probabilistic decoding algorithm.
This family of codes can be seen as the equivalent of classical LDPC codes for
the rank metric. We then use these codes to design cryptosystems \`a la
McEliece: more precisely we propose two schemes for key encapsulation mechanism
(KEM) and public key encryption (PKE). Unlike rank metric codes used in
  previous encryption algorithms -notably Gabidulin codes - LRPC codes have a
very weak algebraic structure. Our cryptosystems can be seen as an equivalent
of the NTRU cryptosystem (and also to the more recent MDPC \cite{MTSB12}
cryptosystem) in a rank metric context. The present paper is an extended
version of the article introducing LRPC codes, with important new
contributions. We have improved the decoder thanks to a new approach which
allows for decoding of errors of higher rank weight, namely up to
$\frac{2}{3}(n-k)$ when the previous decoding algorithm only decodes up to
$\frac{n-k}{2}$ errors. Our codes therefore outperform the classical Gabidulin
code decoder which deals with weights up to $\frac{n-k}{2}$. This comes at the
expense of probabilistic decoding, but the decoding error probability can be
made arbitrarily small. The new approach can also be used to decrease the
decoding error probability of previous schemes, which is especially useful for
cryptography. Finally, we introduce ideal rank codes, which generalize
double-circulant rank codes and allow us to avoid known structural attacks
based on folding. To conclude, we propose different parameter sizes for our
schemes and we obtain a public key of 3337 bits for key exchange and 5893 bits
for public key encryption, both for 128 bits of security.
","[{""version"":""v1"",""created"":""Sun, 31 Mar 2019 08:10:49 GMT""}]","2019-04-02"
"1904.00358","Parwat Anjana","Parwat Singh Anjana, Hagit Attiya, Sweta Kumari, Sathya Peri, and
  Archit Somani","Efficient Concurrent Execution of Smart Contracts in Blockchains using
  Object-based Transactional Memory","49 pages, 26 figures, 11 tables","Networked Systems 2021","10.1007/978-3-030-67087-0_6","2021","cs.DC","http://arxiv.org/licenses/nonexclusive-distrib/1.0/","  This paper proposes an efficient framework to execute Smart Contract
Transactions (SCTs) concurrently based on object semantics, using optimistic
Single-Version Object-based Software Transactional Memory Systems (SVOSTMs) and
Multi-Version OSTMs (MVOSTMs). In our framework, a multi-threaded miner
constructs a Block Graph (BG), capturing the object-conflicts relations between
SCTs, and stores it in the block. Later, validators re-execute the same SCTs
concurrently and deterministically relying on this BG.
  A malicious miner can modify the BG to harm the blockchain, e.g., to cause
double-spending. To identify malicious miners, we propose Smart Multi-threaded
Validator (SMV). Experimental analysis shows that the proposed multi-threaded
miner and validator achieve significant performance gains over state-of-the-art
SCT execution framework.
","[{""version"":""v1"",""created"":""Sun, 31 Mar 2019 08:57:52 GMT""},{""version"":""v2"",""created"":""Fri, 3 May 2019 17:22:12 GMT""},{""version"":""v3"",""created"":""Mon, 5 Aug 2019 09:01:47 GMT""},{""version"":""v4"",""created"":""Thu, 26 Mar 2020 12:19:21 GMT""},{""version"":""v5"",""created"":""Fri, 27 Mar 2020 19:07:54 GMT""}]","2022-01-24"
"1904.00359","Antti Per\""al\""a","Santeri Miihkinen, Jordi Pau, Antti Per\""al\""a, Maofa Wang","Volterra type integration operators from Bergman spaces to Hardy spaces","26 pages, 1 figure",,,,"math.CV math.FA","http://arxiv.org/licenses/nonexclusive-distrib/1.0/","  We completely characterize the boundedness of the Volterra type integration
operators $J_b$ acting from the weighted Bergman spaces $A^p_\alpha$ to the
Hardy spaces $H^q$ of the unit ball of $\mathbb{C}^n$ for all $0<p,q<\infty$. A
partial solution to the case $n=1$ was previously obtained by Z. Wu in
\cite{Wu}. We solve the cases left open there and extend all the results to the
setting of arbitrary complex dimension $n$. Our tools involve area methods from
harmonic analysis, Carleson measures and Kahane-Khinchine type inequalities,
factorization tricks for tent spaces of sequences, as well as techniques and
integral estimates related to Hardy and Bergman spaces.
","[{""version"":""v1"",""created"":""Sun, 31 Mar 2019 08:58:46 GMT""}]","2019-04-02"
"1904.00360","Xun Guo","Hao Wang and Xun Guo and Linfeng Zhang and Han Wang and Jianming Xue","Deep learning inter-atomic potential model for accurate irradiation
  damage simulations",,,"10.1063/1.5098061",,"physics.comp-ph","http://arxiv.org/licenses/nonexclusive-distrib/1.0/","  We propose a hybrid scheme that interpolates smoothly the
Ziegler-Biersack-Littmark (ZBL) screened nuclear repulsion potential with a
newly developed deep learning potential energy model. The resulting DP-ZBL
model can not only provide overall good performance on the predictions of
near-equilibrium material properties but also capture the right physics when
atoms are extremely close to each other, an event that frequently happens in
computational simulations of irradiation damage events. We applied this scheme
to the simulation of the irradiation damage processes in the
face-centered-cubic aluminium system, and found better descriptions in terms of
the defect formation energy, evolution of collision cascades, displacement
threshold energy, and residual point defects, than the widely-adopted ZBL
modified embedded atom method potentials and its variants. Our work provides a
reliable and feasible scheme to accurately simulate the irradiation damage
processes and opens up new opportunities to solve the predicament of lacking
accurate potentials for enormous newly-discovered materials in the irradiation
effect field.
","[{""version"":""v1"",""created"":""Sun, 31 Mar 2019 09:02:21 GMT""},{""version"":""v2"",""created"":""Tue, 2 Apr 2019 02:40:00 GMT""}]","2019-07-24"
"1904.00361","Ying Qin","Ying Qin, Yuzhong Wu, Tan Lee and Anthony Pak Hin Kong","An End-to-End Approach to Automatic Speech Assessment for
  Cantonese-speaking People with Aphasia",,,,,"eess.AS","http://arxiv.org/licenses/nonexclusive-distrib/1.0/","  Conventional automatic assessment of pathological speech usually follows two
main steps: (1) extraction of pathology-specific features; (2) classification
or regression on extracted features. Given the great variety of speech and
language disorders, feature design is never a straightforward task, and yet it
is most crucial to the performance of assessment. This paper presents an
end-to-end approach to automatic speech assessment for Cantonese-speaking
People With Aphasia (PWA). The assessment is formulated as a binary
classification task to discriminate PWA with high scores of subjective
assessment from those with low scores. The sequence-to-one Recurrent Neural
Network with Gated Recurrent Unit (GRU-RNN) and Convolutional Neural Network
(CNN) models are applied to realize the end-to-end mapping from fundamental
speech features to the classification result. The pathology-specific features
used for assessment can be learned implicitly by the neural network model.
Class Activation Mapping (CAM) method is utilized to visualize how those
features contribute to the assessment result. Our experimental results show
that the end-to-end approach outperforms the conventional two-step approach in
the classification task, and confirm that the CNN model is able to learn
impairment-related features that are similar to human-designed features. The
experimental results also suggest that CNN model performs better than
sequence-to-one GRU-RNN model in this specific task.
","[{""version"":""v1"",""created"":""Sun, 31 Mar 2019 09:04:17 GMT""}]","2019-04-02"
"1904.00362","Aybike Ozer","Aybike Catal-Ozer","Non-Abelian T-duality as a Transformation in Double Field Theory","typos and signs corrected; references added",,"10.1007/JHEP08(2019)115",,"hep-th","http://arxiv.org/licenses/nonexclusive-distrib/1.0/","  Non-Abelian T-duality (NATD) is a solution generating transformation for
supergravity backgrounds with non-Abelian isometries. We show that NATD can be
described as a coordinate dependent O(d,d) transformation, where the dependence
on the coordinates is determined by the structure constants of the Lie algebra
associated with the isometry group. Besides making calculations significantly
easier, this approach gives a natural embedding of NATD in Double Field Theory
(DFT), a framework which provides an O(d,d) covariant formulation for effective
string actions. As a result of this embedding, it becomes easy to prove that
the NATD transformed backgrounds solve supergravity equations, when the
isometry algebra is unimodular. If the isometry algebra is non-unimodular, the
generalized dilaton field is forced to have a linear dependence on the dual
coordinates, which implies that the resulting background solves generalized
supergravity equations.
","[{""version"":""v1"",""created"":""Sun, 31 Mar 2019 09:05:59 GMT""},{""version"":""v2"",""created"":""Wed, 26 Jun 2019 15:54:24 GMT""},{""version"":""v3"",""created"":""Mon, 1 Jul 2019 12:50:57 GMT""}]","2019-10-02"
"1904.00363","Tristan van Leeuwen","Tristan van Leeuwen","A note on extended full waveform inversion",,,,,"math.OC physics.geo-ph","http://arxiv.org/licenses/nonexclusive-distrib/1.0/","  Full waveform inversion (FWI) aims at estimating subsurface medium properties
from measured seismic data. It is usually cast as a non-linear least-squares
problem that incorporates uncertainties in the measurements. In exploration
seismology, extended formulations of FWI that allow for uncertaties in the
physics have been proposed. Even when the physics is modelled accurately, these
extensions have been shown to be beneficial because they reduce the non-lineary
of the resulting data-fitting problem. In this note, I derive an alternative
(but equivalent) formulation of extended full waveform inversion. This
re-formulation takes the form of a conventional FWI formulation that includes a
medium-dependent weight on the residuals. I discuss the implications of this
re-formulation and illustrate its properties with a simple numerical example.
","[{""version"":""v1"",""created"":""Sun, 31 Mar 2019 09:17:10 GMT""}]","2019-04-02"
"1904.00364","Nicola Salvati","Ray Chambers, Enrico Fabrizi, Nicola Salvati","Small Area Estimation with Linked Data","29 pages, 3 Figures",,,,"stat.ME","http://arxiv.org/licenses/nonexclusive-distrib/1.0/","  In Small Area Estimation data linkage can be used to combine values of the
variableof interest from a national survey with values of auxiliary variables
obtained from another source like a population register. Linkage errors can
induce bias when fitting regression models; moreover, they can create
non-representative outliers in the linked data in addition to the presence of
potential representative outliers. In this paper we adopt a secondary analyst's
point view, assuming limited information is available on the linkage process,
and we develop small area estimators based on linear mixed and linear
M-quantile models to accommodate linked data containing a mix of both types of
outliers. We illustrate the properties of these small area estimators, as well
as estimators of their mean squared error, by means of model-based and
design-based simulation experiments. These experiments show that the proposed
predictors can lead to more efficient estimators when there is linkage error.
Furthermore, the proposed mean-squared error estimation methods appear to
perform well.
","[{""version"":""v1"",""created"":""Sun, 31 Mar 2019 09:19:10 GMT""}]","2019-04-02"
