"1904.00403","Ljubisa Stankovic","Ljubisa Stankovic, Milos Brajovic, Milos Dakovic, Danilo Mandic","On the Decomposition of Multivariate Nonstationary Multicomponent
  Signals","13 pages, 10 figures",,,,"cs.IT math.IT","http://arxiv.org/licenses/nonexclusive-distrib/1.0/","  With their ability to handle an increased amount of information, multivariate
and multichannel signals can be used to solve problems normally not solvable
with signals obtained from a single source. One such problem is the
decomposition signals with several components whose domains of support
significantly overlap in both the time and the frequency domain, including the
joint time-frequency domain. Initially, we proposed a solution to this problem
based on the Wigner distribution of multivariate signals, which requires the
attenuation of the cross-terms. In this paper, an advanced solution based on an
eigenvalue analysis of the multivariate signal autocorrelation matrix, followed
by their time-frequency concentration measure minimization, is presented. This
analysis provides less restrictive conditions for the signal decomposition than
in the case of Wigner distribution. The algorithm for the components separation
is based on the concentration measures of the eigenvector time-frequency
representation, that are linear combinations of the overlapping signal
components. With an increased number of sensors/channels, the robustness of the
decomposition process to additive noise is also achieved. The theory is
supported by numerical examples. The required channel dissimilarity is
statistically investigated as well.
","[{""version"":""v1"",""created"":""Sun, 31 Mar 2019 13:04:43 GMT""}]","2019-04-02"
"1904.00404","Xing Chen","Xing Chen, Wang Kang, Daoqian Zhu, Na Lei, Xichao Zhang, Yan Zhou,
  Youguang Zhang, Weisheng Zhao","Magnetic skyrmion spectrum under voltage excitation and its linear
  modulation","29 pages, 8 figures","Phys. Rev. Applied 12, 024008 (2019)","10.1103/PhysRevApplied.12.024008",,"physics.app-ph cond-mat.mes-hall","http://arxiv.org/licenses/nonexclusive-distrib/1.0/","  Magnetic skyrmions are topological quasiparticles with great potential for
applications in future information storage and processing devices because of
their nanoscale size, high stability, and large velocity. Recently, the
high-frequency properties of skyrmions have been explored for magnon
nanodevices. Here we systematically study the dynamics of an isolated skyrmion
under voltage excitation through the voltage-controlled magnetic anisotropy
effect in a circular thin film. A theoretical model considering the
demagnetization energy, which has often been neglected or treated superficially
in previous skyrmion research but is demonstrated to have importance in
determining the skyrmion dynamic state, is developed. With our model, the
periodic oscillation of the skyrmion radius can be solved numerically with
similar precision compared to micromgnetic simulations, and the characteristic
frequency of the skyrmion breathing can be determined analytically with greater
precision than previous studies. Furthermore, we find that the breathing
skyrmion can be analogized as a modulator by investigating its linear
modulation functionality under sinusoidal-form voltage excitation. Different
from the conventional modulation system with complex CMOS circuits, this
skyrmion modulator device integrates with both the modulation and carrier wave
generation functionality, thus showing greater convenience and efficiency in
applications. Our findings can provide useful guidance for both theoretical and
experimental skyrmions research as well as the development of skyrmion-based
magnonic devices with significant potential applicability in future
communication system.
","[{""version"":""v1"",""created"":""Sun, 31 Mar 2019 13:07:20 GMT""},{""version"":""v2"",""created"":""Fri, 26 Jul 2019 04:24:28 GMT""}]","2019-08-14"
"1904.00405","Michael Harrison","Michael Harrison","Contact structures induced by skew fibrations of R^3","to appear in BLMS, 13 pages, 2 figures",,"10.1112/blms.12284",,"math.GT","http://arxiv.org/licenses/nonexclusive-distrib/1.0/","  A smooth fibration of $\mathbb{R}^3$ by oriented lines is given by a smooth
unit vector field $V$ on $\mathbb{R}^3$, for which all of the integral curves
are oriented lines. Such a fibration is called skew if no two fibers are
parallel, and it is called nondegenerate if $\nabla V$ vanishes only in the
direction of $V$. Nondegeneracy is a form of local skewness, though in fact any
nondegenerate fibration is globally skew. Nondegenerate and skew fibrations
have each been recently studied, from both geometric and topological
perspectives, in part due to their close relationship with great circle
fibrations of $S^3$.
  Any fibration of $\mathbb{R}^3$ by oriented lines induces a plane field on
$\mathbb{R}^3$, obtained by taking the orthogonal plane to the unique line
through each point. We show that the plane field induced by any nondegenerate
fibration is a tight contact structure. For contactness we require a new
characterization of nondegenerate fibrations, whereas the proof of tightness
employs a recent result of Etnyre, Komendarczyk, and Massot on tightness in
contact metric 3-manifolds.
  We conclude with some examples which highlight relationships among great
circle fibrations, nondegenerate fibrations, skew fibrations, and the contact
structures associated to fibrations.
","[{""version"":""v1"",""created"":""Sun, 31 Mar 2019 13:09:41 GMT""},{""version"":""v2"",""created"":""Wed, 31 Jul 2019 19:00:25 GMT""}]","2019-09-11"
"1904.00406","Kazumitsu Sakai","Kimihiko Fukushima and Kazumitsu Sakai","Numerical Study on a Crossing Probability for the Four-State Potts
  Model: Logarithmic Correction to the Finite-Size Scaling","11 pages","Prog. Theor. Exp. Phys. 2019, 091A01","10.1093/ptep/ptz101",,"cond-mat.stat-mech math-ph math.MP","http://arxiv.org/licenses/nonexclusive-distrib/1.0/","  A crossing probability for the critical four-state Potts model on an $L\times
M$ rectangle on a square lattice is numerically studied. The crossing
probability here denotes the probability that spin clusters cross from one side
of the boundary to the other. First, by employing a Monte Carlo method, we
calculate the fractal dimension of a spin cluster interface with a fluctuating
boundary condition. By comparison of the fractal dimension with that of the
Schramm-Loewner evolution (SLE), we numerically confirm that the interface can
be described by the SLE with $\kappa=4$, as predicted in the scaling limit.
Then, we compute the crossing probability of this spin cluster interface for
various system sizes and aspect ratios. Furthermore, comparing with the
analytical results for the scaling limit, which have been previously obtained
by a combination of the SLE and conformal field theory, we numerically find
that the crossing probability exhibits a logarithmic correction $\sim 1/\log(L
M)$ to the finite-size scaling.
","[{""version"":""v1"",""created"":""Sun, 31 Mar 2019 13:11:47 GMT""},{""version"":""v2"",""created"":""Wed, 14 Aug 2019 10:15:05 GMT""},{""version"":""v3"",""created"":""Thu, 19 Sep 2019 14:13:06 GMT""}]","2019-10-01"
"1904.00407","Ryo Yamada","Ryo Yamada, Tetsuo Mohri","Application of Cluster Variation and Path Probability Methods to the
  Tetragonal-Cubic Phase Transition in ZrO2","5 pages, 4 figures",,"10.7566/JPSJ.88.074005",,"cond-mat.mtrl-sci","http://arxiv.org/licenses/nonexclusive-distrib/1.0/","  Cluster variation method (CVM) and path probability method (PPM) have
generally been employed to study replacive phase transitions in alloy systems.
Recently, displacive phase transitions have been explored within the realm of
replacive phase transition in the CVM theoretical framework by viewing
displaced atoms as different atomic species, i.e., by converting a freedom of
atomic displacement to a configurational freedom. The same methodology is
applied to the PPM calculations in this work, and the kinetics of displacive
phase transition from tetragonal to cubic phases in ZrO2 are investigated as
well as their equilibrium states.
","[{""version"":""v1"",""created"":""Sun, 31 Mar 2019 13:11:50 GMT""}]","2019-07-24"
"1904.00408","Weipeng Chen","Weipeng Chen, Jin An","Topological Ising pairing states in monolayer and trilayer TaS$_2$","11 pages, 5 figures","Phys. Rev. B 100, 054503 (2019)","10.1103/PhysRevB.100.054503",,"cond-mat.supr-con","http://arxiv.org/licenses/nonexclusive-distrib/1.0/","  We study the possibility of topological superconductivity in the
noncentrosymmetric monolayer and trilayer TaS$_2$ with out-of-plane mirror
symmetry. A gapless time-reversal invariant f+s-wave pairing state with even
mirror parity is found to be a promising candidate. This mixing state holds
12(36) nodes at the Fermi pockets around $\Gamma$ for monolayer(trilayer) case
and its unconventional superconductivity is consistent with the STM experiments
observed in 2$H$-TaS$_2$ thin flakes. Furthermore, with doping or under
uniaxial pressure for trilayer 2$H$-TaS$_2$, large-Chern-number time-reversal
symmetry breaking mixing states between d+id- and p-ip-wave pairings can be
realized in the phase diagram.
","[{""version"":""v1"",""created"":""Sun, 31 Mar 2019 13:15:32 GMT""}]","2019-08-14"
"1904.00409","Pratik Dabhade","P. Dabhade, H. J. A. Rottgering, J. Bagchi, T. W. Shimwell, M. J.
  Hardcastle, S. Sankhyayan, R. Morganti, M. Jamrozy, A. Shulevski, and K. J.
  Duncan","Giant radio galaxies in the LOFAR Two-metre Sky Survey-I","Accepted for publication in Astronomy & Astrophysics","A&A 635, A5 (2020)","10.1051/0004-6361/201935589",,"astro-ph.GA","http://arxiv.org/licenses/nonexclusive-distrib/1.0/","  Giant radio galaxies (GRGs) are a subclass of radio galaxies which have grown
to megaparsec scales. GRGs are much rarer than normal sized radio galaxies (<
0.7 Mpc) and the reason for their gigantic sizes is still debated. Here, we
report the biggest sample of GRGs identified to date. These objects were found
in the LOFAR Two-metre Sky Survey (LoTSS) first data release images, which
cover a 424 square degrees region. Of the 239 GRGs found, 225 are new
discoveries. The GRGs in our sample have sizes ranging from 0.7 to 3.5 Mpc and
have redshifts (z) between 0.1 and 2.3. Seven GRGs have sizes above 2 Mpc and
one has a size of ~ 3.5 Mpc. The sample contains 40 GRGs hosted by
spectroscopically confirmed quasars. Here, we present the search techniques
employed and the resulting catalogue of the newly discovered large sample of
GRGs along with their radio properties. We, here also show for the first time
that the spectral index of GRGs is similar to that of normal sized radio
galaxies, indicating that most of the GRG population is not dead or is not like
remnant type radio galaxy. We find 20/239 GRGs in our sample are located at the
centres of clusters and present our analysis on their cluster environment and
radio morphology.
","[{""version"":""v1"",""created"":""Sun, 31 Mar 2019 13:31:09 GMT""},{""version"":""v2"",""created"":""Wed, 4 Dec 2019 14:23:26 GMT""}]","2020-03-04"
"1904.00410","N. D. Tracas","Sven Heinemeyer, Myriam Mondrag\'on, Nick Tracas and George Zoupanos","Reduction of Couplings and its application in Particle Physics","To be published in Physics Reports. The following published were used
  for this report: Nucl.Phys.Proc.Suppl.56B(1997)no.3,281, Symmetry
  10(2018)no.3,62, Acta Phys.Polon. B27 (1997)3911, Phys.Lett.B728(2014)51,
  Phys.Lett.B389 (1996)523, Nucl.Phys.B927(2018)319, Fortsch.Phys.61(2013)no.11
  969, Ann.U.Craiova Phys.21, JHEP 1808(2018)150, JHEP1808(2018) 150,
  arXiv:1411.7155, PoS CORFU2016(2017)041",,"10.1016/j.physrep.2019.04.002","IFT-UAM/CSIC-19-020, LAPTH-004/19","hep-ph","http://creativecommons.org/publicdomain/zero/1.0/","  The idea of reduction of couplings in renormalizable theories will be
presented and then will be applied in Particle Physics models. Reduced
couplings appeared as functions of a primary one, compatible with the
renormalization group equation and thus solutions of a specific set of ordinary
differential equations. If these functions have the form of power series the
respective theories resemble standard renormalizable ones and thus widen
considerably the area covered until then by symmetries as a tool for
constraining the number of couplings consistently. Still on the more abstract
level reducing couplings enabled one to construct theories with beta-functions
vanishing to all orders of perturbation theory. Reduction of couplings became
physics-wise truly interesting and phenomenologically important when applied to
the standard model and its possible extensions. In particular in the context of
supersymmetric theories it became the most powerful tool known today once it
was learned how to apply it also to couplings having dimension of mass and to
mass parameters. Technically this all relies on the basic property that
reducing couplings is a renormalization scheme independent procedure.
Predictions of top and Higgs mass prior to their experimental finding highlight
the fundamental physical significance of this notion.
","[{""version"":""v1"",""created"":""Sun, 31 Mar 2019 13:32:02 GMT""}]","2019-07-24"
"1904.00411","Madhav Suresh","Madhav Suresh, Zuohao She, William Wallace, Adel Lahlou, and Jennie
  Rogers","KloakDB: A Platform for Analyzing Sensitive Data with $K$-anonymous
  Query Processing",,,,,"cs.DB cs.CR","http://arxiv.org/licenses/nonexclusive-distrib/1.0/","  A private data federation enables data owners to pool their information for
querying without disclosing their secret tuples to one another. Here, a client
queries the union of the records of all data owners. The data owners work
together to answer the query using privacy-preserving algorithms that prevent
them from learning unauthorized information about the inputs of their peers.
Only the client, and a federation coordinator, learn the query's output.
KloakDB is a private data federation that uses trusted hardware to process SQL
queries over the inputs of two or more parties. Currently private data
federations compute their queries fully-obliviously, guaranteeing that no
information is revealed about the sensitive inputs of a data owner to their
peers by observing the query's instruction traces and memory access patterns.
Oblivious querying almost always exacts multiple orders of magnitude slowdown
in query runtimes compared to plaintext execution, making it impractical for
many applications. KloakDB offers a semi-oblivious computing framework,
$k$-anonymous query processing. We make the query's observable transcript
$k$-anonymous because it is a popular standard for data release in many domains
including medicine, educational research, and government data. KloakDB's
queries run such that each data owner may deduce information about no fewer
than $k$ individuals in the data of their peers. In addition, stakeholders set
$k$, creating a novel trade-off between privacy and performance. Our results
show that KloakDB enjoys speedups of up to $117$X using k-anonymous query
processing over full-oblivious evaluation.
","[{""version"":""v1"",""created"":""Sun, 31 Mar 2019 13:34:26 GMT""},{""version"":""v2"",""created"":""Fri, 20 Mar 2020 20:36:32 GMT""}]","2020-03-24"
"1904.00412","Wei Ling Katherine Tan","W. Katherine Tan and Patrick J. Heagerty","Surrogate-guided sampling designs for classification of rare outcomes
  from electronic medical records data",,,"10.1093/biostatistics/kxaa028",,"stat.ME","http://arxiv.org/licenses/nonexclusive-distrib/1.0/","  Scalable and accurate identification of specific clinical outcomes has been
enabled by machine-learning applied to electronic medical record (EMR) systems.
The development of classification models requires the collection of a complete
labeled data set, where true clinical outcomes are obtained by human expert
manual review. For example, the development of natural language processing
algorithms requires the abstraction of clinical text data to obtain outcome
information necessary for training models. However, if the outcome is rare then
simple random sampling results in very few cases and insufficient information
to develop accurate classifiers. Since large scale detailed abstraction is
often expensive, time-consuming, and not feasible, more efficient strategies
are needed. Under such resource constrained settings, we propose a class of
enrichment sampling designs, where selection for abstraction is stratified by
auxiliary variables related to the true outcome of interest. Stratified
sampling on highly specific variables results in targeted samples that are more
enriched with cases, which we show translates to increased model discrimination
and better statistical learning performance. We provide mathematical details,
and simulation evidence that links sampling designs to their resulting
prediction model performance. We discuss the impact of our proposed sampling on
both model training and validation. Finally, we illustrate the proposed designs
for outcome label collection and subsequent machine-learning, using radiology
report text data from the Lumbar Imaging with Reporting of Epidemiology (LIRE)
study.
","[{""version"":""v1"",""created"":""Sun, 31 Mar 2019 13:59:55 GMT""},{""version"":""v2"",""created"":""Fri, 6 Nov 2020 01:16:59 GMT""}]","2020-11-09"
"1904.00413","Michael Strickland","Michael Strickland","The non-equilibrium attractor: Beyond hydrodynamics","8 pages, 2 figures; Proceedings contribution for Epiphany 2019,
  Krakow, 8-11 Jan 2019",,"10.5506/APhysPolB.50.1243",,"hep-ph nucl-th","http://arxiv.org/licenses/nonexclusive-distrib/1.0/","  The quark-gluon plasma created in heavy-ion collisions is not in local
thermal equilibrium at early times. Despite this, dissipative hydrodynamics
describes the evolution of the energy-momentum tensor quite well after only
roughly 0.5 - 1 fm/c. This can be understood using the concept of a
non-equilibrium dynamical attractor. The attractor is a uniquely identifiable
solution to the dynamical equations to which all solutions are drawn as the
system evolves. Once solutions collapse onto the non-equilibrium attractor they
are ``pseudo-thermalized'' in the sense that they have lost information about
the precise initial conditions used, but are not yet in exact local thermal
equilibrium. Here I review recent work which demonstrates that there exists a
non-equilibrium attractor in full kinetic theory models which goes beyond the
usual low-order momentum moments considered in hydrodynamical treatments.
","[{""version"":""v1"",""created"":""Sun, 31 Mar 2019 13:59:58 GMT""}]","2019-07-24"
"1904.00414","Cesar Fosco","C. D. Fosco, M. L. Remaggi and M. C. Rodr\'iguez","Vacuum fluctuation effects due to an Abelian gauge field in 2+1
  dimensions, in the presence of moving mirrors","14 pages, no figures",,"10.1016/j.physletb.2019.134838",,"hep-th cond-mat.other","http://arxiv.org/licenses/nonexclusive-distrib/1.0/","  We study the Dynamical Casimir Effect (DCE) due to an Abelian gauge field in
2+1 dimensions, in the presence of semitransparent, zero-width mirrors, which
may move or deform in a time-dependent way. We obtain general expressions for
the probability of motion-induced pair creation, which we render in a more
explicit form, for some relevant states of motion.
","[{""version"":""v1"",""created"":""Sun, 31 Mar 2019 14:01:42 GMT""}]","2019-10-02"
"1904.00415","Shaul Oron","Liat Sless, Gilad Cohen, Bat El Shlomo, Shaul Oron","Road Scene Understanding by Occupancy Grid Learning from Sparse Radar
  Clusters using Semantic Segmentation",,"ICCV 2019 CVRSUAD",,,"cs.CV","http://creativecommons.org/licenses/by-nc-sa/4.0/","  Occupancy grid mapping is an important component in road scene understanding
for autonomous driving. It encapsulates information of the drivable area, road
obstacles and enables safe autonomous driving. Radars are an emerging sensor in
autonomous vehicle vision, becoming more widely used due to their long range
sensing, low cost, and robustness to severe weather conditions. Despite recent
advances in deep learning technology, occupancy grid mapping from radar data is
still mostly done using classical filtering approaches.In this work, we propose
learning the inverse sensor model used for occupancy grid mapping from
clustered radar data. This is done in a data driven approach that leverages
computer vision techniques. This task is very challenging due to data sparsity
and noise characteristics of the radar sensor. The problem is formulated as a
semantic segmentation task and we show how it can be learned using lidar data
for generating ground truth. We show both qualitatively and quantitatively that
our learned occupancy net outperforms classic methods by a large margin using
the recently released NuScenes real-world driving data.
","[{""version"":""v1"",""created"":""Sun, 31 Mar 2019 14:04:16 GMT""},{""version"":""v2"",""created"":""Mon, 2 Sep 2019 18:35:09 GMT""}]","2019-09-04"
"1904.00416","Hongxi Xing","Hongxi Xing, Shinsuke Yoshida","Introduction to the transverse-momentum-weighted technique in the
  twist-3 collinear factorization approach","15 pages, 4 figures, invited review article for the special issue
  ""Transverse Momentum Dependent Observables from Low to High Energy:
  Factorization, Evolution, and Global Analyses"" of the journal ""Advances in
  High Energy Physics"", accepted for publication",,,,"hep-ph nucl-ex nucl-th","http://arxiv.org/licenses/nonexclusive-distrib/1.0/","  The twist-3 collinear factorization framework has drawn much attention in
recent decades as a successful approach in describing the data for single spin
asymmetries (SSAs). Many SSAs data have been experimentally accumulated in a
variety of energies since the first measurement was done in late 70s and it is
expected that the future experiments like Electron-Ion collider will provide us
with more data. In order to perform a consistent and precise description of the
data taken in different kinematic regimes, the scale evolution of the collinear
twist-3 functions and the perturbative higher order hard part coefficients are
mandatory. In this paper, we introduce the techniques for next-to-leading order
(NLO) calculation of transverse-momentum-weighted SSAs, which can be served as
a useful tool to derive the QCD evolution equation for twist-3 functions, and
to verify the QCD collinear factorization for twist-3 observables at NLO, as
well as to obtain the finite NLO hard part coefficients.
","[{""version"":""v1"",""created"":""Sun, 31 Mar 2019 14:09:18 GMT""}]","2019-04-05"
"1904.00417","Jinglei Zhang","J. L. Zhang, C. M. Wang, C. Y. Guo, X. D. Zhu, J. Y. Yang, Y. Q. Wang,
  Z. Qu, L. Pi, H. Z. Lu, M. L. Tian","Anomalous thermoelectric effects of ZrTe$_{5}$ in and beyond the quantum
  limit","6 pages, 4 figures","Phys. Rev. Lett. 123, 196602 (2019)","10.1103/PhysRevLett.123.196602",,"cond-mat.mtrl-sci cond-mat.mes-hall","http://arxiv.org/licenses/nonexclusive-distrib/1.0/","  Thermoelectric effects are more sensitive and promising probes to topological
properties of emergent materials, but much less addressed compared to other
physical properties. Zirconium pentatelluride (ZrTe$_{5}$) has inspired active
investigations recently because of its multiple topological nature. We study
the thermoelectric effects of ZrTe$_{5}$ in a magnetic field and find several
anomalous behaviors. The Nernst response has a steplike profile near zero field
when the charge carriers are electrons only, suggesting the anomalous Nernst
effect arising from a nontrivial profile of Berry curvature. Both the
thermopower and Nernst signal exhibit exotic peaks in the strong-field quantum
limit. At higher magnetic fields, the Nernst signal has a sign reversal at a
critical field where the thermopower approaches to zero. We propose that these
anomalous behaviors can be attributed to the Landau index inversion, which is
resulted from the competition of the $\sqrt{B}$ dependence of the Dirac-type
Landau bands and linear-$B$ dependence of the Zeeman energy ($B$ is the
magnetic field). Our understanding to the anomalous thermoelectric properties
in ZrTe$_{5}$ opens a new avenue for exploring Dirac physics in topological
materials.
","[{""version"":""v1"",""created"":""Sun, 31 Mar 2019 14:09:59 GMT""},{""version"":""v2"",""created"":""Tue, 16 Apr 2019 13:25:36 GMT""}]","2019-11-13"
