"1911.07383","Srikrishna Karanam","Ren Li, Changjiang Cai, Georgios Georgakis, Srikrishna Karanam,
  Terrence Chen, and Ziyan Wu","Towards Robust RGB-D Human Mesh Recovery","10 pages, 4 figures, 4 tables",,,,"cs.CV cs.LG cs.RO","http://arxiv.org/licenses/nonexclusive-distrib/1.0/","  We consider the problem of human pose estimation. While much recent work has
focused on the RGB domain, these techniques are inherently under-constrained
since there can be many 3D configurations that explain the same 2D projection.
To this end, we propose a new method that uses RGB-D data to estimate a
parametric human mesh model. Our key innovations include (a) the design of a
new dynamic data fusion module that facilitates learning with a combination of
RGB-only and RGB-D datasets, (b) a new constraint generator module that
provides SMPL supervisory signals when explicit SMPL annotations are not
available, and (c) the design of a new depth ranking learning objective, all of
which enable principled model training with RGB-D data. We conduct extensive
experiments on a variety of RGB-D datasets to demonstrate efficacy.
","[{""version"":""v1"",""created"":""Mon, 18 Nov 2019 00:55:37 GMT""}]","2019-11-19"
"1911.07384","Zehua Cheng","Zehua Cheng, Weiyang Wang, Yan Pan, Thomas Lukasiewicz","Distributed Low Precision Training Without Mixed Precision",,,,,"cs.CV cs.DC","http://arxiv.org/licenses/nonexclusive-distrib/1.0/","  Low precision training is one of the most popular strategies for deploying
the deep model on limited hardware resources. Fixed point implementation of
DCNs has the potential to alleviate complexities and facilitate potential
deployment on embedded hardware. However, most low precision training solution
is based on a mixed precision strategy. In this paper, we have presented an
ablation study on different low precision training strategy and propose a
solution for IEEE FP-16 format throughout the training process. We tested the
ResNet50 on 128 GPU cluster on ImageNet-full dataset. We have viewed that it is
not essential to use FP32 format to train the deep models. We have viewed that
communication cost reduction, model compression, and large-scale distributed
training are three coupled problems.
","[{""version"":""v1"",""created"":""Mon, 18 Nov 2019 00:56:52 GMT""},{""version"":""v2"",""created"":""Fri, 27 Dec 2019 05:37:54 GMT""}]","2019-12-30"
"1911.07385","Shuang Chen","Shuang Chen, Jun Shen","Smooth inertial manifolds for neutral differential equations with small
  delays","accepted in Journal of Dynamics and Differential Equations",,,,"math.DS","http://arxiv.org/licenses/nonexclusive-distrib/1.0/","  In this paper, we study the dynamical behaviors of neutral differential
equations with small delays. We first establish the existence and smoothness of
the global inertial manifolds for these equations. Then we further prove the
smoothness of inertial manifolds with respect to small delays for a certain
class of neutral differential equations. The method can be also applied to deal
with more general small-delay systems. Finally, we apply our main results to
the van der Pol oscillator model with small delay.
","[{""version"":""v1"",""created"":""Mon, 18 Nov 2019 01:00:53 GMT""},{""version"":""v2"",""created"":""Mon, 20 Jul 2020 21:00:25 GMT""},{""version"":""v3"",""created"":""Sat, 27 Mar 2021 09:22:58 GMT""}]","2021-03-30"
"1911.07386","Blake Stacey","Blake C. Stacey","Ideas Abandoned en Route to QBism","21 pages, 8 footnotes, 1 demonstration that not everything from the
  '90s has held up as well as Daria and OK Computer",,,,"quant-ph physics.hist-ph","http://arxiv.org/licenses/nonexclusive-distrib/1.0/","  The interpretation of quantum mechanics known as QBism developed out of
efforts to understand the probabilities arising in quantum physics as Bayesian
in character. But this development was neither easy nor without casualties.
Many ideas voiced, and even committed to print, during earlier stages of
Quantum Bayesianism turn out to be quite fallacious when seen from the vantage
point of QBism.
","[{""version"":""v1"",""created"":""Mon, 18 Nov 2019 01:02:21 GMT""},{""version"":""v2"",""created"":""Mon, 25 Nov 2019 03:18:36 GMT""}]","2019-11-26"
"1911.07387","Reza Asgari","Shiva Heidari, Reza Asgari","Chiral Hall effect in strained Weyl semimetals","7 pages, 3 figures (Introduction part and References are changed). To
  appear in Phys. Rev. B (2020)","Phys. Rev. B 101, 165309 (2020)","10.1103/PhysRevB.101.165309",,"cond-mat.mtrl-sci cond-mat.mes-hall","http://arxiv.org/licenses/nonexclusive-distrib/1.0/","  In this paper, the chiral Hall effect of strained Weyl semimetals without any
external magnetic field is proposed. Electron-phonon coupling emerges in the
low-energy fermionic sector through a pseudogauge potential. We show that, by
using chiral kinetic theory, the chiral Hall effect appears as a response to a
real time-varying electric field in the presence of structural distortion and
it causes spatial chirality and charges separation in a Weyl system. We also
show that the coupling of the electrons to acoustic phonons as a gapless
excitation leads to emerging an optical absorption peak at
$\omega=\omega_{el}$, where $\omega_{el}$ is defined as a characteristic
frequency associated with the pseudomagnetic field. We also propose the
strain-induced planar Hall effect as another transport signature of the
chiral-anomaly equation.
","[{""version"":""v1"",""created"":""Mon, 18 Nov 2019 01:03:15 GMT""},{""version"":""v2"",""created"":""Wed, 15 Apr 2020 00:17:01 GMT""}]","2020-04-22"
"1911.07388","Armin Najarpour Foroushani","Armin Najarpour Foroushani, Sujaya Neupane, Pablo De Heredia Pastor,
  Christopher C. Pack, and Mohamad Sawan","Spatial Resolution of Local Field Potential Signals in Macaque V4",,,,,"q-bio.NC","http://arxiv.org/licenses/nonexclusive-distrib/1.0/","  A main challenge for the development of cortical visual prostheses is to
spatially localize individual spots of light, called phosphenes, by assigning
appropriate stimulating parameters to implanted electrodes. Imitating the
natural responses to phosphene-like stimuli at different positions can help in
designing a systematic procedure to determine these parameters. The key
characteristic of such a system is the ability to discriminate between
responses to different positions in the visual field. While most previous
prosthetic devices have targeted the primary visual cortex, the extrastriate
cortex has the advantage of covering a large part of the visual field with a
smaller amount of cortical tissue, providing the possibility of a more compact
implant. Here, we studied how well ensembles of Multiunit activity (MUA) and
Local Field Potentials (LFPs) responses from extrastriate cortical visual area
V4 of a behaving macaque monkey can discriminate between two-dimensional
spatial positions. We found that despite the large receptive field sizes in V4,
the combined responses from multiple sites, whether MUA or LFP, has the
capability for fine and coarse discrimination of positions. We identified a
selection procedure that could significantly increase the discrimination
performance while reducing the required number of electrodes. Analysis of noise
correlation in MUA and LFP responses showed that noise correlations in LFP
responses carry more information about the spatial positions. Overall, these
findings suggest that spatial positions could be localized with patterned
stimulation in extrastriate area V4.
","[{""version"":""v1"",""created"":""Mon, 18 Nov 2019 01:03:52 GMT""}]","2019-11-19"
"1911.07389","Srikrishna Karanam","Wenqian Liu, Runze Li, Meng Zheng, Srikrishna Karanam, Ziyan Wu, Bir
  Bhanu, Richard J. Radke, Octavia Camps","Towards Visually Explaining Variational Autoencoders","10 pages, 9 figures, 2 tables, CVPR 2020",,,,"cs.CV cs.LG","http://arxiv.org/licenses/nonexclusive-distrib/1.0/","  Recent advances in Convolutional Neural Network (CNN) model interpretability
have led to impressive progress in visualizing and understanding model
predictions. In particular, gradient-based visual attention methods have driven
much recent effort in using visual attention maps as a means for visual
explanations. A key problem, however, is these methods are designed for
classification and categorization tasks, and their extension to explaining
generative models, e.g. variational autoencoders (VAE) is not trivial. In this
work, we take a step towards bridging this crucial gap, proposing the first
technique to visually explain VAEs by means of gradient-based attention. We
present methods to generate visual attention from the learned latent space, and
also demonstrate such attention explanations serve more than just explaining
VAE predictions. We show how these attention maps can be used to localize
anomalies in images, demonstrating state-of-the-art performance on the MVTec-AD
dataset. We also show how they can be infused into model training, helping
bootstrap the VAE into learning improved latent space disentanglement,
demonstrated on the Dsprites dataset.
","[{""version"":""v1"",""created"":""Mon, 18 Nov 2019 01:05:41 GMT""},{""version"":""v2"",""created"":""Mon, 24 Feb 2020 16:11:16 GMT""},{""version"":""v3"",""created"":""Thu, 5 Mar 2020 15:52:04 GMT""},{""version"":""v4"",""created"":""Wed, 11 Mar 2020 14:20:02 GMT""},{""version"":""v5"",""created"":""Mon, 23 Mar 2020 15:09:27 GMT""},{""version"":""v6"",""created"":""Tue, 24 Mar 2020 15:51:40 GMT""},{""version"":""v7"",""created"":""Tue, 14 Apr 2020 16:52:49 GMT""}]","2020-04-15"
"1911.07390","Jinwook Jung","Jiu-Gang Dong, Seung-Yeal Ha, Jinwook Jung and Doheon Kim","On the stochastic flocking of the Cucker-Smale flock with randomly
  switching topologies","18 pages",,,,"math.OC","http://arxiv.org/licenses/nonexclusive-distrib/1.0/","  We present an emergent stochastic flocking dynamics of the Cucker-Smale (CS)
ensemble under randomly switching topologies. The evolution of the CS ensemble
with randomly switching topologies involves two random components (switching
times and choices of network topologies at switching instant). First, we allow
switching times for the network topology to be random so that the successive
increments are i.i.d. processes following the common probability distribution.
Second, at each switching instant, we choose a network topology randomly from a
finite set of admissible network topologies whose union contains a spanning
tree. Even for the fixed deterministic network topology, the CS ensemble may
not exhibit a mono-cluster flocking depending on the initial data and the decay
mode of the communication weight functions measuring the degree of interactions
between particles. For the flocking dynamics of the CS ensemble with these two
random components, we first use a priori conditions on the network topologies
and uniform boundedness of position diameter, and derive the flocking estimates
via matrix theory together with a priori conditions, and then replace the a
priori condition for the position diameter by some suitable condition on the
system parameters and communication weight. The a priori condition on the
network topology will be guaranteed by the suitable spanning tree time-blocks
with probability one.
","[{""version"":""v1"",""created"":""Mon, 18 Nov 2019 01:09:38 GMT""}]","2019-11-19"
"1911.07391","Zhaoyuan Yang","Nurali Virani, Naresh Iyer, Zhaoyuan Yang","Justification-Based Reliability in Machine Learning","Extended version of paper accepted at AAAI 2020 with supplementary
  materials, update remark and fix typo",,,,"cs.LG stat.ML","http://arxiv.org/licenses/nonexclusive-distrib/1.0/","  With the advent of Deep Learning, the field of machine learning (ML) has
surpassed human-level performance on diverse classification tasks. At the same
time, there is a stark need to characterize and quantify reliability of a
model's prediction on individual samples. This is especially true in
application of such models in safety-critical domains of industrial control and
healthcare. To address this need, we link the question of reliability of a
model's individual prediction to the epistemic uncertainty of the model's
prediction. More specifically, we extend the theory of Justified True Belief
(JTB) in epistemology, created to study the validity and limits of
human-acquired knowledge, towards characterizing the validity and limits of
knowledge in supervised classifiers. We present an analysis of neural network
classifiers linking the reliability of its prediction on an input to
characteristics of the support gathered from the input and latent spaces of the
network. We hypothesize that the JTB analysis exposes the epistemic uncertainty
(or ignorance) of a model with respect to its inference, thereby allowing for
the inference to be only as strong as the justification permits. We explore
various forms of support (for e.g., k-nearest neighbors (k-NN) and l_p-norm
based) generated for an input, using the training data to construct a
justification for the prediction with that input. Through experiments conducted
on simulated and real datasets, we demonstrate that our approach can provide
reliability for individual predictions and characterize regions where such
reliability cannot be ascertained.
","[{""version"":""v1"",""created"":""Mon, 18 Nov 2019 01:15:24 GMT""},{""version"":""v2"",""created"":""Tue, 21 Jan 2020 22:47:44 GMT""},{""version"":""v3"",""created"":""Sun, 14 Nov 2021 16:58:11 GMT""}]","2021-11-16"
"1911.07392","Emanuel Reinecke","Emanuel Reinecke","The cohomology of the moduli space of curves at infinite level","27 pages; minor changes, comments still welcome",,,,"math.AG","http://arxiv.org/licenses/nonexclusive-distrib/1.0/","  Full level-n structures on smooth, complex curves are trivializations of the
n-torsion points of their Jacobians. We give an algebraic proof that the etale
cohomology of the moduli space of smooth, complex curves of genus at least 2
with ""infinite level structure"" vanishes in degrees above 4g-5. This yields a
new perspective on a result of Harer who showed such vanishing already at
finite level via topological methods. We obtain similar results for moduli
spaces of stable curves and curves of compact type which are not covered by
Harer's methods. The key ingredients in the proof are a vanishing statement for
certain constructible sheaves on perfectoid spaces and a comparison of the
etale cohomology of different towers of Deligne-Mumford stacks in the presence
of ramification.
","[{""version"":""v1"",""created"":""Mon, 18 Nov 2019 01:16:29 GMT""},{""version"":""v2"",""created"":""Mon, 2 Mar 2020 14:50:40 GMT""}]","2020-03-03"
"1911.07393","Vladimir Filkov","Baishakhi Ray, Prem Devanbu, Vladimir Filkov","Rebuttal to Berger et al., TOPLAS 2019","12 pages",,,,"cs.SE cs.PL","http://arxiv.org/licenses/nonexclusive-distrib/1.0/","  Berger et al., published in TOPLAS 2019, is a critique of our 2014 FSE
conference abstract and its archival version, the 2017 CACM paper: A
Large-Scale Study of Programming Languages and Code Quality in Github. In their
paper Berger et al. make academic claims about the veracity of our work. Here,
we respond to their technical and scientific critiques aimed at our work,
attempting to stick with scientific discourse. We find that Berger et al.
largely replicated our results, and agree with us in their conclusion: that the
effects (in a statistical sense) found in the data are small, and should be
taken with caution, and that it is possible that an absence of effect is the
correct interpretation. Thus, our CACM paper's conclusions still hold, even
more so now that they have been reproduced, and our paper is eminently citable.
","[{""version"":""v1"",""created"":""Mon, 18 Nov 2019 01:22:58 GMT""}]","2019-11-19"
"1911.07394","Louis Ly","Suda Bharadwaj, Louis Ly, Bo Wu, Richard Tsai, and Ufuk Topcu","Strategy Synthesis for Surveillance-Evasion Games with Learning-Enabled
  Visibility Optimization",,,,,"cs.RO","http://arxiv.org/licenses/nonexclusive-distrib/1.0/","  This paper studies a two-player game with a quantitative surveillance
requirement on an adversarial target moving in a discrete state space and a
secondary objective to maximize short-term visibility of the environment. We
impose the surveillance requirement as a temporal logic constraint.We then use
a greedy approach to determine vantage points that optimize a notion of
information gain, namely, the number of newly-seen states. By using a
convolutional neural network trained on a class of environments, we can
efficiently approximate the information gain at each potential vantage
point.Subsequent vantage points are chosen such that moving to that location
will not jeopardize the surveillance requirement, regardless of any future
action chosen by the target. Our method combines guarantees of correctness from
formal methods with the scalability of machine learning to provide an efficient
approach for surveillance-constrained visibility optimization.
","[{""version"":""v1"",""created"":""Mon, 18 Nov 2019 01:27:04 GMT""}]","2019-11-19"
"1911.07395","Hesham Rakha","Hao Chen and Hesham A Rakha","Automatic Freeway Bottleneck Identification and Visualization using
  Image Processing Techniques","18 pages, 8 figures, 1 table",,,,"eess.IV","http://creativecommons.org/licenses/by/4.0/","  This paper develops an automatic freeway bottleneck identification and
visualization algorithm using a combination of image processing techniques and
traffic flow theory. Unlike previous studies that are based solely on loop
detector data, the proposed method can use traffic measurements from various
sensing technologies. Four steps are included in the proposed algorithm. First,
the raw spatiotemporal speed data are transformed into binary matrices using
image binarization techniques. Second, two post-processer filters are developed
to clean the binary matrices by filtering scattered noise cells and localized
congested regions. Subsequently, the roadway geometry information is used to
remove the impact of acceleration zones downstream of bottlenecks and thus
locate bottlenecks more precisely. Finally, the major characteristics of
bottlenecks including activation and deactivation points, shockwave speeds and
traffic delay caused by bottleneck are automatically extracted and visualized.
The proposed algorithm is tested using loop detector data from I-5
demonstrating that the proposed method outperforms the state-of-the-art methods
for congestion identification. The second test using INRIX data from I-66
demonstrates ability of the proposed algorithm to accurately extract and
visualize bottleneck characteristics.
","[{""version"":""v1"",""created"":""Mon, 18 Nov 2019 01:29:03 GMT""}]","2019-11-19"
"1911.07396","Guosheng Jiang","Guosheng Jiang, Zhehui Wang and Jintian Zhu","Liouville Type Theorems for Minimal Surface Equations in Half Space","16 pages",,,,"math.AP math.DG","http://arxiv.org/licenses/nonexclusive-distrib/1.0/","  For $n\geq2,$ we obtain Liouville type theorems for minimal surface equations
in half space $\mathbf R^n_+$ with affine Dirichlet boundary value or constant
Neumann boundary value.
","[{""version"":""v1"",""created"":""Mon, 18 Nov 2019 01:36:25 GMT""}]","2019-11-19"
"1911.07397","Zhi Xu","Jun-Feng Hou, Zhi Xu, Shu Yuan, Yu-Chao Chen, Jian-Guo Peng,
  Dong-Guang Wang, Jun Xu, Yuan-Yong Deng, Zhen-Yu Jin, Kai-Fan Ji, Zhong Liu","Spectro-polarimetric Observations at the NVST: I. Instrumental
  Polarization Calibration and Primary Measurements","17pages, 9 figures,accepted by Research in Astronomy and Astrophysics",,"10.1088/1674-4527/20/4/45",,"astro-ph.SR astro-ph.IM","http://arxiv.org/licenses/nonexclusive-distrib/1.0/","  This paper is devoted to the primary spectro-polarimetric observation
performed at the New Vacuum Solar Telescope of China since 2017, and our aim is
to precisely evaluate the real polarimetric accuracy and sensitivity of this
polarimetry by using full Stokes spectro-polarimetric observations of the
photospheric line Fe I 532.4 nm. In the work, we briefly describe the salient
characteristic of the NVST as a polarimeter in technology and then characterize
its instrumental polarization based on the operation in 2017 and 2019. It is
verified that the calibration method making use of the instrumental
polarization calibration unit (ICU) is stable and credible. The calibration
accuracy can reach up to 3$\times 10^{-3}$ . Based on the scientific
observation of the NOAA 12645 on April 5th, 2017, we estimate that the residual
cross-talk from Stokes $I$ to Stokes $Q$, $U$ and $V$, after the instrumental
polarization calibration, is about 4$\times10^{-3}$ on average, which is
consistent with the calibration accuracy and close to the photon noise. The
polarimetric sensitivity (i.e., the detection limit) for polarized light is of
the order of $10^{-3}$ with an integration time over 20 seconds. Slow
modulation rate is indeed an issue for the present system. The present NVST
polarimeter is expected to be integrated with an high-order adaptive optics
system and a field scanner to realize 2D magnetic field vector measurements in
the following instrumentation update.
","[{""version"":""v1"",""created"":""Mon, 18 Nov 2019 01:54:58 GMT""}]","2020-05-06"
"1911.07398","Tatsuhiro Misumi","Tatsuhiro Misumi, Toshiaki Fujimori, Etsuko Itou, Muneto Nitta,
  Norisuke Sakai","Lattice study on the twisted ${\mathbb C}P^{N-1}$ models on ${\mathbb
  R}\times S^{1}$","7 pages, 5 figures, proceedings of the 37th International Symposium
  on Lattice Field Theory (LATTICE2019), 16-22 June 2019, Wuhan, China","PoS Lattice2019:015,2019","10.22323/1.363.0015",,"hep-lat hep-th","http://arxiv.org/licenses/nonexclusive-distrib/1.0/","  We report the results of the lattice simulation of the ${\mathbb C} P^{N-1}$
sigma model on $S_{s}^{1}$(large) $\times$ $S_{\tau}^{1}$(small). We take a
sufficiently large ratio of the circumferences to approximate the model on
${\mathbb R} \times S^1$. For periodic boundary condition imposed in the
$S_{\tau}^{1}$ direction, we show that the expectation value of the Polyakov
loop undergoes a deconfinement crossover as the compactified circumference is
decreased, where the peak of the associated susceptibility gets sharper for
larger $N$. For ${\mathbb Z}_{N}$ twisted boundary condition, we find that,
even at relatively high $\beta$ (small circumference), the regular $N$-sided
polygon-shaped distributions of Polyakov loop leads to small expectation values
of Polyakov loop, which implies unbroken ${\mathbb Z}_{N}$ symmetry if
sufficient statistics and large volumes are adopted. We also argue the
existence of fractional instantons and bions by investigating the dependence of
the Polyakov loop on $S_{s}^{1}$ direction, which causes transition between
${\mathbb Z}_{N}$ vacua.
","[{""version"":""v1"",""created"":""Mon, 18 Nov 2019 02:24:48 GMT""}]","2020-08-14"
"1911.07399","Xijie Huang","Xijie Huang, Moustafa Alzantot, Mani Srivastava","NeuronInspect: Detecting Backdoors in Neural Networks via Output
  Explanations","8 pages, 13 figures",,,,"cs.CR cs.LG","http://arxiv.org/licenses/nonexclusive-distrib/1.0/","  Deep neural networks have achieved state-of-the-art performance on various
tasks. However, lack of interpretability and transparency makes it easier for
malicious attackers to inject trojan backdoor into the neural networks, which
will make the model behave abnormally when a backdoor sample with a specific
trigger is input. In this paper, we propose NeuronInspect, a framework to
detect trojan backdoors in deep neural networks via output explanation
techniques. NeuronInspect first identifies the existence of backdoor attack
targets by generating the explanation heatmap of the output layer. We observe
that generated heatmaps from clean and backdoored models have different
characteristics. Therefore we extract features that measure the attributes of
explanations from an attacked model namely: sparse, smooth and persistent. We
combine these features and use outlier detection to figure out the outliers,
which is the set of attack targets. We demonstrate the effectiveness and
efficiency of NeuronInspect on MNIST digit recognition dataset and GTSRB
traffic sign recognition dataset. We extensively evaluate NeuronInspect on
different attack scenarios and prove better robustness and effectiveness over
state-of-the-art trojan backdoor detection techniques Neural Cleanse by a great
margin.
","[{""version"":""v1"",""created"":""Mon, 18 Nov 2019 02:27:10 GMT""}]","2019-11-19"
"1911.07400","Laurence Boxer","Laurence Boxer","Approximate Fixed Point Properties in Digital Topology",,,,,"math.GN","http://arxiv.org/licenses/nonexclusive-distrib/1.0/","  We study the approximate fixed point property (AFPP) for continuous
single-valued functions and for continuous multivalued functions in digital
topology. We extend what is known about these notions and discuss errors that
have appeared in the literature.
","[{""version"":""v1"",""created"":""Mon, 18 Nov 2019 02:40:31 GMT""},{""version"":""v2"",""created"":""Fri, 10 Jan 2020 15:17:00 GMT""},{""version"":""v3"",""created"":""Fri, 17 Jan 2020 14:56:53 GMT""}]","2020-01-20"
