"1911.07624","Misbahu Sharfuddeen Zubair","Misbahu S. Zubair, David J. Brown, Matthew Bates and Thomas
  Hughes-Roberts","Designing Accessible Visual Programming Tools for Children with Autism
  Spectrum Condition",,,,,"cs.HC","http://arxiv.org/licenses/nonexclusive-distrib/1.0/","  Visual Programming Tools (VPTs) allow users to create interactive media
projects such as games and animations using visual representations of
programming concepts. Although VPTs have been shown to have huge potential for
teaching children with cognitive impairments including those with Autism
Spectrum Condition (ASC), research has shown that existing VPTs may not be
accessible to them. Therefore, this study proposes a set of recommendations for
the design of accessible VPTs for children with ASC. Recommendations were
initially gathered and validated by interviewing experts (n=7). The interviews
were thematically analysed to identify recommendations. A second set of
interviews with a subset of the initial experts (n=3) was then conducted to
validate the gathered recommendations. An examination of the available
literature was then conducted to identify additional recommendations for the
design of VPTs. These recommendations arose from those used for the design of
other interactive applications for children with ASC (e.g. virtual
environments, serious games) and not identified as part of those the initially
gathered from interviews. A novel set of recommendations for the design of VPTs
for children with ASC and additional cognitive impairments has been defined as
the result of this study.
","[{""version"":""v1"",""created"":""Mon, 18 Nov 2019 13:40:10 GMT""}]","2019-11-19"
"1911.07626","Tong Zhang","Cong Fang and Yihong Gu and Weizhong Zhang and Tong Zhang","Convex Formulation of Overparameterized Deep Neural Networks",,,,,"cs.LG stat.ML","http://arxiv.org/licenses/nonexclusive-distrib/1.0/","  Analysis of over-parameterized neural networks has drawn significant
attention in recentyears. It was shown that such systems behave like convex
systems under various restrictedsettings, such as for two-level neural
networks, and when learning is only restricted locally inthe so-called neural
tangent kernel space around specialized initializations. However, there areno
theoretical techniques that can analyze fully trained deep neural networks
encountered inpractice. This paper solves this fundamental problem by
investigating such overparameterizeddeep neural networks when fully trained. We
generalize a new technique called neural feature repopulation, originally
introduced in (Fang et al., 2019a) for two-level neural networks, to analyze
deep neural networks. It is shown that under suitable representations,
overparameterized deep neural networks are inherently convex, and when
optimized, the system can learn effective features suitable for the underlying
learning task under mild conditions. This new analysis is consistent with
empirical observations that deep neural networks are capable of learning
efficient feature representations. Therefore, the highly unexpected result of
this paper can satisfactorily explain the practical success of deep neural
networks. Empirical studies confirm that predictions of our theory are
consistent with results observed in practice.
","[{""version"":""v1"",""created"":""Mon, 18 Nov 2019 13:42:04 GMT""}]","2019-11-19"
"1911.07627","Pierre Yves Gaudreau Lamarre","Beno\^it Collins and Pierre Yves Gaudreau Lamarre and Camille Male","Asymptotic Freeness of Unitary Matrices in Tensor Product Spaces for
  Invariant States","Incorporated referee comments; improved presentation and corrected
  statements. Accepted in Random Matrices Theory Appl",,,,"math.PR math.CO math.OA","http://arxiv.org/licenses/nonexclusive-distrib/1.0/","  In this paper, we pursue our study of asymptotic properties of families of
random matrices that have a tensor structure. In previous work, the first- and
second-named authors provided conditions under which tensor products of unitary
random matrices are asymptotically free with respect to the normalized trace.
Here, we extend this result by proving that asymptotic freeness of tensor
products of Haar unitary matrices holds with respect to a significantly larger
class of states. Our result relies on invariance under the symmetric group, and
therefore on traffic probability.
  As a byproduct, we explore two additional generalisations: (i) we state
results of freeness in a context of general sequences of representations of the
unitary group -- the fundamental representation being a particular case that
corresponds to the classical asymptotic freeness result for Haar unitary
matrices, and (ii) we consider actions of the symmetric group and the free
group simultaneously and obtain a result of asymptotic freeness in this context
as well.
","[{""version"":""v1"",""created"":""Mon, 18 Nov 2019 13:42:23 GMT""},{""version"":""v2"",""created"":""Thu, 25 Aug 2022 20:59:17 GMT""}]","2022-08-29"
"1911.07632","Gaurav Mittal Mr","Gaurav Mittal","A note on an inverse problem in algebra",,,,,"math.RA","http://arxiv.org/licenses/nonexclusive-distrib/1.0/","  In this paper, we discuss the inverse problem of determining a semisimple
group algebra from the knowledge of rings of the type sum_{t=1}^s M_{n_t}(Ft),
where j is an arbitrary integer and F_t is finite field for each t, and show
that it is ill-posed. After then, we define the concept of completeness of the
rings of the type sum_{t=1}^s M_{n_t}(Ft) to pose a well-posed inverse problem
and propose a conjecture in this direction.
","[{""version"":""v1"",""created"":""Mon, 18 Nov 2019 13:46:55 GMT""}]","2019-11-19"
"1911.07634","Victor Hugo Gonzalez Martinez","M. Astudillo, M. M. Cavalcanti, V. N. Domingos Cavalcanti and V. H.
  Gonzalez Martinez","Boundary Control for a Generalized Wave Equation -- Revisiting Russell's
  Method of Control",,,,,"math.AP","http://arxiv.org/licenses/nonexclusive-distrib/1.0/","  In this work we study the exact boundary controllability of a generalized
wave equation in a nonsmooth domain with a nontrapping obstacle. In the more
general case, this work contemplates the boundary control of a transmission
problem admitting several zones of transmission. The result is obtained using
the technique developed by David Russell, taking advantage of the local energy
decay for the problem, obtained through the Scattering Theory as used by Vodev,
combined with a powerful trace Theorem due to Tataru.
","[{""version"":""v1"",""created"":""Mon, 18 Nov 2019 13:47:15 GMT""}]","2019-11-19"
"1911.07637","Ralf Metzler","D. S. Grebenkov, R. Metzler, and G. Oshanin","Full distribution of first exit times in the narrow escape problem","30 pages, 9 figures, IOPLaTeX","New J. Phys. 21, 122001 (2019)","10.1088/1367-2630/ab5de4",,"cond-mat.stat-mech physics.bio-ph q-bio.QM","http://arxiv.org/licenses/nonexclusive-distrib/1.0/","  In the scenario of the narrow escape problem (NEP) a particle diffuses in a
finite container and eventually leaves it through a small ""escape window"" in
the otherwise impermeable boundary, once it arrives to this window and
over-passes an entropic barrier at the entrance to it. This generic problem is
mathematically identical to that of a diffusion-mediated reaction with a
partially-reactive site on the container's boundary. Considerable knowledge is
available on the dependence of the mean first-reaction time (FRT) on the
pertinent parameters. We here go a distinct step further and derive the full
FRT distribution for the NEP. We demonstrate that typical FRTs may be orders of
magnitude shorter than the mean one, thus resulting in a strong defocusing of
characteristic temporal scales. We unveil the geometry-control of the typical
times, emphasising the role of the initial distance to the target as a decisive
parameter. A crucial finding is the further FRT defocusing due to the barrier,
necessitating repeated escape or reaction attempts interspersed with bulk
excursions. These results add new perspectives and offer a broad comprehension
of various features of the by-now classical NEP that are relevant for numerous
biological and technological systems.
","[{""version"":""v1"",""created"":""Mon, 18 Nov 2019 13:49:03 GMT""}]","2020-01-03"
"1911.07638","Yidong Luo","Yidong Luo","Unified analysis on Petrov-Galerkin method into Symm's integral of the
  first kind",,,,,"math.NA cs.NA","http://arxiv.org/licenses/nonexclusive-distrib/1.0/","  On bounded and simply connected planar analytic domain $ \Omega $, by $ 2\pi
$ periodic parametric representation of boundary curve $ \partial \Omega $,
Symm's integral equation of the first kind takes form $ K \Psi = g $, where $ K
$ is seen as an operator mapping from $ L^2(0,2\pi) $ to itself. The classical
result show complete convergence and error analysis in $ L^2 $ setting for
least squares, dual least squares, Bubnov-Galerkin methods with Fourier basis
when $ g \in H^r(0,2\pi), \ r \geq 1 $.
  In this paper, weakening the boundary $ \partial \Omega $ from analytic to $
C^3 $ class, we maintain the convergence and error analysis from analytic case.
Besides, it is proven that, when $ g \in H^r(0,2\pi), \ 0 \leq r < 1 $, the
least squares, dual least squares, Bubnov-Galerkin methods with Fourier basis
will uniformly diverge to infinity at first order. The divergence effect and
optimality of first order rate are confirmed in an example.
","[{""version"":""v1"",""created"":""Mon, 18 Nov 2019 13:49:35 GMT""},{""version"":""v2"",""created"":""Tue, 3 Dec 2019 07:29:30 GMT""},{""version"":""v3"",""created"":""Sat, 18 Apr 2020 03:32:26 GMT""}]","2020-04-21"
"1911.07639","Lucien Besombes","V. Tiwari, K. Makita, M. Arino, M. Morita, S. Kuroda, H. Boukari, L.
  Besombes","Influence of non-equilibrium phonons on the spin dynamics of a single Cr
  atom",,"Phys. Rev. B 101, 035305 (2020)","10.1103/PhysRevB.101.035305",,"cond-mat.mes-hall","http://arxiv.org/licenses/nonexclusive-distrib/1.0/","  We analyse the influence of optically generated non-equilibrium phonons on
the spin relaxation and effective spin temperature of an individual Cr atom
inserted in a quantum dot. Using a three pulses pump-probe technique, we show
that the spin relaxation measured in resonant optical pumping experiments
strongly depends on the optical excitation conditions. We observe for an
isolated Cr in the dark a heating time shorter than a few hundreds $ns$ after
an initial high power non-resonant excitation pulse. A cooling time larger than
a few tens of $\mu s$, independent on the excitation, is obtained in the same
experimental conditions. We show that a tunable spin-lattice coupling dependent
on the density of non-equilibrium phonons can explain the observed dynamics.
Low energy excitation conditions are found where the Cr spin states
S$_z$=$\pm$1 can be efficiently populated by a non-resonant optical excitation,
prepared and read-out by resonant optical pumping and conserved in the dark
during a few $\mu$s.
","[{""version"":""v1"",""created"":""Mon, 18 Nov 2019 13:52:02 GMT""}]","2020-02-05"
"1911.07643","Miguel Suau","Miguel Suau, Jinke He, Elena Congeduti, Rolf A.N. Starre, Aleksander
  Czechowski, Frans A. Oliehoek","Influence-aware Memory Architectures for Deep Reinforcement Learning",,,,,"cs.LG stat.ML","http://arxiv.org/licenses/nonexclusive-distrib/1.0/","  Due to its perceptual limitations, an agent may have too little information
about the state of the environment to act optimally. In such cases, it is
important to keep track of the observation history to uncover hidden state.
Recent deep reinforcement learning methods use recurrent neural networks (RNN)
to memorize past observations. However, these models are expensive to train and
have convergence difficulties, especially when dealing with high dimensional
input spaces. In this paper, we propose influence-aware memory (IAM), a
theoretically inspired memory architecture that tries to alleviate the training
difficulties by restricting the input of the recurrent layers to those
variables that influence the hidden state information. Moreover, as opposed to
standard RNNs, in which every piece of information used for estimating Q values
is inevitably fed back into the network for the next prediction, our model
allows information to flow without being necessarily stored in the RNN's
internal memory. Results indicate that, by letting the recurrent layers focus
on a small fraction of the observation variables while processing the rest of
the information with a feedforward neural network, we can outperform standard
recurrent architectures both in training speed and policy performance. This
approach also reduces runtime and obtains better scores than methods that stack
multiple observations to remove partial observability.
","[{""version"":""v1"",""created"":""Mon, 18 Nov 2019 13:54:25 GMT""},{""version"":""v2"",""created"":""Thu, 21 Nov 2019 20:50:00 GMT""},{""version"":""v3"",""created"":""Tue, 18 Aug 2020 09:00:18 GMT""},{""version"":""v4"",""created"":""Wed, 17 Feb 2021 18:26:14 GMT""}]","2021-02-18"
"1911.07645","Jan Patrick Hackstein","Jan P. Hackstein, Eva Hackmann","Influence of weak electromagnetic fields on charged particle ISCOs","19 pages, 9 figues; v2: typos corrected","Gen. Relativ. Gravit. 52:22 (2020)","10.1007/s10714-020-02675-1",,"gr-qc astro-ph.HE","http://arxiv.org/licenses/nonexclusive-distrib/1.0/","  Astrophysical black holes are often embedded into electromagnetic fields,
that can usually be treated as test fields not influencing the spacetime
geometry. Here we analyse the innermost stable circular orbit (ISCO) of charged
particles moving around a Schwarzschild black hole in the presence of a radial
electric test field and an asymptotically uniform magnetic test field. We
discuss the structure of the in general four ISCO solutions for different
magnitudes of the electric and the magnetic field's strength. In particular, we
find that the nonexistence of stable circular orbits of particles with equal
sign of charge as the black hole for sufficiently strong electric fields can be
canceled by a sufficiently strong magnetic field. In this situation, we find
that ISCOs made of static particles will emerge.
","[{""version"":""v1"",""created"":""Mon, 18 Nov 2019 13:57:02 GMT""},{""version"":""v2"",""created"":""Tue, 10 Mar 2020 10:47:17 GMT""}]","2020-03-11"
"1911.07648","Xia Wu","Wei Lu, Xia Wu, Xiwang Cao","The Parameters of Minimal Linear Codes",,,,,"cs.IT math.IT","http://arxiv.org/licenses/nonexclusive-distrib/1.0/","  Let $k\leq n$ be two positive integers and $q$ a prime power. The basic
question in minimal linear codes is to determine if there exists an $[n,k]_q$
minimal linear code. The first objective of this paper is to present a new
sufficient and necessary condition for linear codes to be minimal. Using this
condition, it is easy to construct minimal linear codes or to prove some linear
codes are minimal. The second objective of this paper is to use the new
sufficient and necessary condition to partially give an answer to the basic
question in minimal linear codes. The third objective of this paper is to
present four classes of minimal linear codes, which generalize the results
about the binary case given in [X. Li and Q. Yue, Des. Codes Cryptogr., 2019].
One can find that our method is much easier and more effective.
","[{""version"":""v1"",""created"":""Mon, 18 Nov 2019 14:03:37 GMT""}]","2019-11-19"
"1911.07649","Panagiotis Papadopoulos","I\~nigo Querejeta-Azurmendi, Panagiotis Papadopoulos, Matteo Varvello,
  Antonio Nappa, Jiexin Zhang, Benjamin Livshits","ZKSENSE: A Friction-less Privacy-Preserving Human Attestation Mechanism
  for Mobile Devices",,"Proceedings on Privacy Enhancing Technologies 2021","10.2478/popets-2021-0058",,"cs.CR","http://creativecommons.org/licenses/by-nc-nd/4.0/","  Recent studies show that 20.4% of the internet traffic originates from
automated agents. To identify and block such ill-intentioned traffic,
mechanisms that verify the humanness of the user are widely deployed, with
CAPTCHAs being the most popular. Traditional CAPTCHAs require extra user effort
(e.g., solving mathematical puzzles), which can severely downgrade the
end-user's experience, especially on mobile, and provide sporadic humanness
verification of questionable accuracy. More recent solutions like Google's
reCAPTCHA v3, leverage user data, thus raising significant privacy concerns. To
address these issues, we present zkSENSE: the first zero-knowledge proof-based
humanness attestation system for mobile devices. zkSENSE moves the human
attestation to the edge: onto the user's very own device, where humanness of
the user is assessed in a privacy-preserving and seamless manner. zkSENSE
achieves this by classifying motion sensor outputs of the mobile device, based
on a model trained by using both publicly available sensor data and data
collected from a small group of volunteers. To ensure the integrity of the
process, the classification result is enclosed in a zero-knowledge proof of
humanness that can be safely shared with a remote server. We implement zkSENSE
as an Android service to demonstrate its effectiveness and practicality. In our
evaluation, we show that zkSENSE successfully verifies the humanness of a user
across a variety of attacking scenarios and demonstrates 92% accuracy. On a two
years old Samsung S9, zkSENSE's attestation takes around 3 seconds (when visual
CAPTCHAs need 9.8 seconds) and consumes a negligible amount of battery.
","[{""version"":""v1"",""created"":""Mon, 18 Nov 2019 14:04:11 GMT""},{""version"":""v2"",""created"":""Wed, 3 Jun 2020 11:14:17 GMT""},{""version"":""v3"",""created"":""Thu, 4 Jun 2020 12:56:13 GMT""},{""version"":""v4"",""created"":""Tue, 7 Sep 2021 10:54:31 GMT""}]","2021-09-08"
"1911.07650","Neil Fan","Neil J.Y. Fan, Peter L. Guo, Simon C.Y. Peng, Sophie C.C. Sun","Lattice Points in the Newton Polytopes of Key Polynomials","10 pages, 6 figures",,,,"math.CO","http://arxiv.org/licenses/nonexclusive-distrib/1.0/","  We confirm a conjecture of Monical, Tokcan and Yong on a characterization of
the lattice points in the Newton polytopes of key polynomials.
","[{""version"":""v1"",""created"":""Mon, 18 Nov 2019 14:05:58 GMT""}]","2019-11-19"
"1911.07651","Rustem Khasanov","Ritu Gupta, Alexander Maisuradze, Nikolai D. Zhigadlo, Hubertus
  Luetkens, Alex Amato, and Rustem Khasanov","Self-consistent two-gap approach in studying multi-band
  superconductivity in NdFeAsO$_{0.65}$F$_{0.35}$","10 pages, 8 figures","Frontiers in Physics 8, 2 (2020)","10.3389/fphy.2020.00002",,"cond-mat.supr-con","http://arxiv.org/licenses/nonexclusive-distrib/1.0/","  High-quality single crystals of NdFeAsO$_{0.65}$F$_{0.35}$ (the transition
temperature $T_{\rm c} \simeq 30.6$~K) were studied in zero-field (ZF) and
transverse-field (TF) muon-spin rotation/relaxation ($\mu$SR) experiments. An
upturn in muon-spin depolarization rate at $T\lesssim 3$~K was observed in
ZF-$\mu$SR measurements and it was associated with the onset of ordering of Nd
electronic moments. Measurements of the magnetic field penetration depth
($\lambda$) were performed in the TF geometry. By applying the external
magnetic field $B_{\rm ex}$ parallel to the crystallographic $c$-axis ($B_{\rm
ex}\| c$) and parallel to the $ab$-plane ($B_{\rm ex}\| ab$), the temperature
dependencies of the in-plane component ($\lambda_{ab}^{-2}$) and the
combination of the in-plane and the out of plane components
($\lambda_{ab,c}^{-2}$) of the superfluid density were determined,
respectively. The out-of-plane superfluid density component
($\lambda_{c}^{-2}$) was further obtained by combining the results of $B_{\rm
ex} \| c$ and $B_{\rm ex} \| {ab}$ set of experiments. The temperature
dependencies of $\lambda_{ab}^{-2}$, $\lambda_{ab,c}^{-2}$, and
$\lambda_{c}^{-2}$ were analyzed within the framework of a self-consistent
two-gap model despite of using the traditional $\alpha$-model. Interband
coupling was taken into account, instead of assuming it to be zero as it stated
in the $\alpha$-model. A relatively small value of the interband coupling
constant $\Lambda_{12} \simeq 0.01$ was obtained, thus indicating that the
energy bands in NdFeAsO$_{0.65}$F$_{0.35}$ are only weakly coupled. In spite of
their small magnitude, the coupling between the bands leads to the single value
of the superconducting transition temperature $T_{\rm c}$.
","[{""version"":""v1"",""created"":""Mon, 18 Nov 2019 14:13:49 GMT""}]","2020-03-26"
"1911.07658","Michael Kissner","Michael Kissner","Hacking Neural Networks: A Short Introduction",,,,,"cs.CR cs.LG","http://arxiv.org/licenses/nonexclusive-distrib/1.0/","  A large chunk of research on the security issues of neural networks is
focused on adversarial attacks. However, there exists a vast sea of simpler
attacks one can perform both against and with neural networks. In this article,
we give a quick introduction on how deep learning in security works and explore
the basic methods of exploitation, but also look at the offensive capabilities
deep learning enabled tools provide. All presented attacks, such as
backdooring, GPU-based buffer overflows or automated bug hunting, are
accompanied by short open-source exercises for anyone to try out.
","[{""version"":""v1"",""created"":""Mon, 18 Nov 2019 14:15:58 GMT""},{""version"":""v2"",""created"":""Sun, 1 Dec 2019 12:35:02 GMT""}]","2019-12-03"
"1911.07659","Frederique Ham-Pichavant","Kelechukwu Onwukamike, St\'ephane Grelier (LCPO), Etienne Grau (LCPO),
  Henri Cramail (LCPO), Michael Meier (KIT)","Critical Review on Sustainable Homogeneous Cellulose Modification: Why
  Renewability Is Not Enough",,"ACS Sustainable Chemistry & Engineering, American Chemical
  Society, 2018, 7 (2), pp.1826-1840","10.1021/acssuschemeng.8b04990",,"physics.app-ph cond-mat.mtrl-sci","http://arxiv.org/licenses/nonexclusive-distrib/1.0/","  As we passed the 20th anniversary of the publication of the 12 principles of
green chemistry, the sustainable modification of cellulose, being the most
abundant biobased polymer, is certainly worth considering. Many researchers
work on an efficient valorization of this renewable resource due to its
manifold and promising application possibilities, but very often the use of
non-sustainable approaches (i.e., solvents, reactants and modification
approaches) only addresses the renewability aspect of cellulose, while
neglecting most or all of the other principles of green chemistry. In this
review, we have employed the use of E-factors together with basic toxicity
information to compare between various approaches for homogeneous cellulose
modification. This approach, though simple and certainly not overarching, can
provide a quick and useful first sustainability assessment. Therefore, in order
to achieve a truly sustainable modification of cellulose, its renewability
combined with mild and efficient reaction protocols is crucial in order to
obtain sustainable materials that are capable of reducing the overall negative
impact of today's fossil-based polymeric materials.
","[{""version"":""v1"",""created"":""Mon, 18 Nov 2019 14:20:44 GMT""}]","2019-11-19"
"1911.07660","Maria Kostenko","N. V. Antonov and M. M. Kostenko","Renormalization Group in the Problem of Active Scalar Advection",,,"10.1007/s10958-021-05492-2",,"cond-mat.stat-mech","http://arxiv.org/licenses/nonexclusive-distrib/1.0/","  The field theoretic renormalization group (RG) is applied to the model of a
near-equilibrium fluid coupled to a scalar field (like temperature or density
of an impurity) which is active, that is, influencing the dynamics of the fluid
itself. It is shown that the only possible nontrivial infrared (IR) asymptotic
regimes are governed by ""passive"" fixed points of the RG equations, where the
back reaction is irrelevant. This result reminds of that obtained in [Nandy and
Bhattacharjee, J. Phys. A: Math. Gen. {\bf 31}, 2621 (1998)] in a model
describing active convection by fully developed turbulence. Furthermore, we
establish the existence of ""exotic"" fixed points with negative and complex
effective couplings and transport coefficients that may suggest possible
directions for future studies.
","[{""version"":""v1"",""created"":""Mon, 18 Nov 2019 14:20:47 GMT""}]","2021-09-15"
