"1911.07493","Chengjie Yu","Chengjie Yu","Cartan-Amborse-Hicks Theorem for isometric immersions","We have combine this work with arXiv:1911.13242 into a new paper",,,,"math.DG","http://arxiv.org/licenses/nonexclusive-distrib/1.0/","  In this paper, we generalize the Cartan-Ambrose-Hicks theorem to the case of
isometric immersions which contains the fundamental theorem of submanifolds as
a special case.
","[{""version"":""v1"",""created"":""Mon, 18 Nov 2019 09:15:58 GMT""},{""version"":""v2"",""created"":""Thu, 21 Nov 2019 06:16:00 GMT""},{""version"":""v3"",""created"":""Wed, 27 Nov 2019 05:03:34 GMT""},{""version"":""v4"",""created"":""Wed, 11 Dec 2019 06:03:37 GMT""},{""version"":""v5"",""created"":""Wed, 8 Sep 2021 07:50:34 GMT""}]","2021-09-09"
"1911.07494","Yi Yu","Oscar Hernan Madrid Padilla, Yi Yu and Carey E. Priebe","Change point localization in dependent dynamic nonparametric random dot
  product graphs",,,,,"stat.ME math.ST stat.TH","http://arxiv.org/licenses/nonexclusive-distrib/1.0/","  In this paper, we study the offline change point localization problem in a
sequence of dependent nonparametric random dot product graphs. To be specific,
assume that at every time point, a network is generated from a nonparametric
random dot product graph model \citep[see e.g.][]{athreya2017statistical},
where the latent positions are generated from unknown underlying distributions.
The underlying distributions are piecewise constant in time and change at
unknown locations, called change points. Most importantly, we allow for
dependence among networks generated between two consecutive change points. This
setting incorporates edge-dependence within networks and temporal dependence
between networks, which is the most flexible setting in the published
literature.
  To accomplish the task of consistently localizing change points, we propose a
novel change point detection algorithm, consisting of two steps. First, we
estimate the latent positions of the random dot product model, our theoretical
result being a refined version of the state-of-the-art results, allowing the
dimension of the latent positions to diverge. Subsequently, we construct a
nonparametric version of the CUSUM statistic \citep[e.g.][]{Page1954,
padilla2019optimal} that allows for temporal dependence. Consistent
localization is proved theoretically and supported by extensive numerical
experiments, which illustrate state-of-the-art performance. We also provide in
depth discussion of possible extensions to give more understanding and
insights.
","[{""version"":""v1"",""created"":""Mon, 18 Nov 2019 09:18:02 GMT""},{""version"":""v2"",""created"":""Tue, 23 Jun 2020 17:28:10 GMT""},{""version"":""v3"",""created"":""Thu, 15 Sep 2022 16:07:22 GMT""}]","2022-09-16"
"1911.07495","Xiwang Cao","Xiwang Cao, Jinlong Wan and Keqin Feng","Some results on uniform mixing on abelian Cayley graphs","37 pages",,,,"math.CO","http://arxiv.org/licenses/nonexclusive-distrib/1.0/","  In the past few decades, quantum algorithms have become a popular research
area of both mathematicians and engineers. Among them, uniform mixing provides
a uniform probability distribution of quantum information over time which
attracts a special attention. However, there are only a few known examples of
graphs which admit uniform mixing. In this paper, a characterization of abelian
Cayley graphs having uniform mixing is presented. Some concrete constructions
of such graphs are provided. Specifically, for cubelike graphs, it is shown
that the Cayley graph ${\rm Cay}(\mathbb{F}_2^{2k};S)$ has uniform mixing if
the characteristic function of $S$ is bent. Moreover, a difference-balanced
property of the eigenvalues of an abelian Cayley graph having uniform mixing is
established. Furthermore, it is proved that an integral abelian Cayley graph
exhibits uniform mixing if and only if the underlying group is one of the
groups: $\mathbb{Z}_2^d, \mathbb{Z}_3^d$, $\mathbb{Z}_4^d$ or
$\mathbb{Z}_2^{r}\otimes \mathbb{Z}_4^d$ for some integers $r \geq 1, d\geq 1$.
Thus the classification of integral abelian Cayley graphs having uniform mixing
is completed.
","[{""version"":""v1"",""created"":""Mon, 18 Nov 2019 09:19:58 GMT""},{""version"":""v2"",""created"":""Sun, 29 Dec 2019 14:58:15 GMT""},{""version"":""v3"",""created"":""Tue, 13 Oct 2020 04:46:09 GMT""},{""version"":""v4"",""created"":""Fri, 16 Jul 2021 01:07:26 GMT""},{""version"":""v5"",""created"":""Fri, 8 Apr 2022 02:20:58 GMT""}]","2022-04-11"
"1911.07496","Zakaria Mahhouti","Z. Mahhouti, H. El Moussaoui, T. Mahfoud, M. Hamedoun, M. El Marssi,
  A. Lahmar, A. El Kenz, and A. Benyoussef","Chemical synthesis and magnetic properties of monodisperse cobalt
  ferrite nanoparticles","10 pages, 9 figures","J Mater Sci: Mater Electron (2019) 30: 14913","10.1007/s10854-019-01863-3",,"cond-mat.mtrl-sci","http://creativecommons.org/licenses/by/4.0/","  In this work, a successful synthesis of magnetic cobalt ferrite (CoFe2O4)
nanoparticles is presented. The synthesized CoFe2O4 nanoparticles have a
spherical shape and highly monodisperse in the selected solvent. The effect of
different reaction conditions such as temperature, reaction time and varying
capping agents on the phase and morphology is studied. Scanning transmission
electron microscopy showed that the size of these nanoparticles can be
controlled by varying reaction conditions. Both X-ray diffraction and energy
dispersive X-ray spectroscopy corroborate the formation of CoFe2O4 spinel
structure with cubic symmetry. Due to optimized reaction parameters, each
nanoparticle was shown to be a single magnetic domain with diameter ranges from
6 to 16 nm. Finally, the magnetic investigations showed that the obtained
nanoparticles are superparamagnetic with a small coercivity value of about 315
Oe and a saturation magnetization of 58 emu/g at room temperature. These
results make the cobalt ferrite nanoparticles promising for advanced magnetic
nanodevices and biomagnetic applications.
","[{""version"":""v1"",""created"":""Mon, 18 Nov 2019 09:21:27 GMT""}]","2019-11-19"
"1911.07497","Arman Arian","Arman Arian, Ozgur Yilmaz","Deterministic partial binary circulant compressed sensing matrices",,,,,"cs.IT math.IT math.ST stat.TH","http://arxiv.org/licenses/nonexclusive-distrib/1.0/","  Compressed sensing (CS) is a signal acquisition paradigm to simultaneously
acquire and reduce dimension of signals that admit sparse representation. This
is achieved by collecting linear, non-adaptive measurements of a signal, which
can be formalized as multiplying the signal with a ""measurement matrix"". Most
of matrices used in CS are random matrices as they satisfy the restricted
isometry property (RIP) in an optimal regime of number of measurements with
high probability. However, these matrices have their own caveats and for this
reason, deterministic measurement matrices have been proposed. While there is a
wide classes of deterministic matrices in the literature, we propose a novel
class of deterministic matrices using the Legendre symbol. This construction
has a simple structure, it enjoys being a binary matrix, and having a partial
circulant structure which provides a fast matrix-vector multiplication and a
fast reconstruction algorithm. We will derive a bound on the sparsity level of
signals that can be measured (and be reconstructed) with this class of
matrices. We perform quantization using these matrices, and we verify the
performance of these matrices (and compare with other existing constructions)
numerically.
","[{""version"":""v1"",""created"":""Mon, 18 Nov 2019 09:35:01 GMT""}]","2019-11-19"
"1911.07498","Yifan Zhang","Yifan Zhang, Peilin Zhao, Shuaicheng Niu, Qingyao Wu, Jiezhang Cao,
  Junzhou Huang, Mingkui Tan","Online Adaptive Asymmetric Active Learning with Limited Budgets",,"IEEE Transactions on Knowledge and Data Engineering (TKDE), 2019",,,"cs.LG stat.ML","http://creativecommons.org/licenses/by-nc-sa/4.0/","  Online Active Learning (OAL) aims to manage unlabeled datastream by
selectively querying the label of data. OAL is applicable to many real-world
problems, such as anomaly detection in health-care and finance. In these
problems, there are two key challenges: the query budget is often limited; the
ratio between classes is highly imbalanced. In practice, it is quite difficult
to handle imbalanced unlabeled datastream when only a limited budget of labels
can be queried for training. To solve this, previous OAL studies adopt either
asymmetric losses or queries (an isolated asymmetric strategy) to tackle the
imbalance, and use first-order methods to optimize the cost-sensitive measure.
However, the isolated strategy limits their performance in class imbalance,
while first-order methods restrict their optimization performance. In this
paper, we propose a novel Online Adaptive Asymmetric Active learning algorithm,
based on a new asymmetric strategy (merging both asymmetric losses and queries
strategies), and second-order optimization. We theoretically analyze its
mistake bound and cost-sensitive metric bounds. Moreover, to better balance
performance and efficiency, we enhance our algorithm via a sketching technique,
which significantly accelerates the computational speed with quite slight
performance degradation. Promising results demonstrate the effectiveness and
efficiency of the proposed methods.
","[{""version"":""v1"",""created"":""Mon, 18 Nov 2019 09:36:38 GMT""}]","2019-11-19"
"1911.07499","Rajshekhar Bhat Vishweshwar","Rajshekhar Vishweshwar Bhat, Rahul Vaze and Mehul Motani","Throughput Maximization with an Average Age of Information Constraint in
  Fading Channels",,,,,"cs.IT math.IT","http://arxiv.org/licenses/nonexclusive-distrib/1.0/","  In the emerging fifth generation (5G) technology, communication nodes are
expected to support two crucial classes of information traffic, namely, the
enhanced mobile broadband (eMBB) traffic with high data rate requirements, and
ultra-reliable low-latency communications (URLLC) traffic with strict
requirements on latency and reliability. The URLLC traffic, which is usually
analyzed by a metric called the age of information (AoI), is assigned the first
priority over the resources at a node. Motivated by this, we consider long-term
average throughput maximization problems subject to average AoI and power
constraints in a single user fading channel, when (i) perfect and (ii) no
channel state information at the transmitter (CSIT) is available. We propose
simple age-independent stationary randomized policies (AI-SRP), which allocate
powers at the transmitter based only on the channel state and/or distribution
information, without any knowledge of the AoI. We show that the optimal
throughputs achieved by the AI-SRPs for scenarios (i) and (ii) are at least
equal to the half of the respective optimal long-term average throughputs,
independent of all the parameters of the problem, and that they are within
additive gaps, expressed in terms of the optimal dual variable corresponding to
their average AoI constraints, from the respective optimal long-term average
throughputs.
","[{""version"":""v1"",""created"":""Mon, 18 Nov 2019 09:36:44 GMT""}]","2019-11-19"
"1911.07500","Colin MacLaurin","Colin MacLaurin","Clarifying spatial distance measurement","6 pages, 0 figures, submitted to the proceedings of the 2018 Marcel
  Grossmann conference, Rome. v2 has minor rewording and typo corrections","p.1372--77 in Battistelli, Jantzen & Ruffini, eds., The Fifteenth
  Marcel Grossmann Meeting (World Scientific, 2022, vol. 2)","10.1142/9789811258251_0198",,"gr-qc","http://arxiv.org/licenses/nonexclusive-distrib/1.0/","  We examine length measurement in curved spacetime, based on the 1+3-splitting
of a local observer frame. This situates extended objects within spacetime, in
terms of a given coordinate which serves as an external reference. The radar
metric is shown to coincide with the spatial projector, but these only give
meaningful results on the observer's 3-space, where they reduce to the metric.
Examples from Schwarzschild spacetime are given.
","[{""version"":""v1"",""created"":""Mon, 18 Nov 2019 09:39:33 GMT""},{""version"":""v2"",""created"":""Tue, 19 Nov 2019 03:32:10 GMT""}]","2022-09-05"
"1911.07501","Joakim Bj\""ork","Joakim Bj\""ork and Karl Henrik Johansson","Control Limitations due to Zero Dynamics in a Single-Machine Infinite
  Bus Network","This work has been submitted to IFAC for possible publication",,,,"eess.SY cs.SY","http://arxiv.org/licenses/nonexclusive-distrib/1.0/","  In this work, fundamental control limitations for rotor angle stability are
considered. Limitations are identified by characterizing open-loop transfer
function zeros for input-output combinations of certain power system
configurations. Of particular interest are non-minimum phase (NMP) zeros that
limit the achievable performance of the closed-loop system. By studying a
single-machine infinite bus power system model, analytic conditions for the
presence of NMP zeros are derived. They are shown to be closely linked to the
destabilizing effect of automatic voltage regulators (AVRs). Depending on the
control loop, it is found that NMP zeros may persist in the system even if the
closed-loop system is stabilized through feedback control. A simulation study
shows that NMP zeros introduced by AVR limit the achievable performance and
stabilization using feedback control.
","[{""version"":""v1"",""created"":""Mon, 18 Nov 2019 09:40:48 GMT""},{""version"":""v2"",""created"":""Mon, 5 Oct 2020 12:18:33 GMT""}]","2020-10-06"
"1911.07502","Dmitry Voskresensky","D. N. Voskresensky","Vector-boson condensates, spin-triplet superfluidity of paired neutral
  and charged fermions, and $3P_2$ pairing of nucleons","34 pages, some misprints are corrected","Phys. Rev. D 101, 056011 (2020)","10.1103/PhysRevD.101.056011",,"nucl-th cond-mat.supr-con hep-ph","http://arxiv.org/licenses/nonexclusive-distrib/1.0/","  After reminding of properties of the condensate of the complex scalar field
in the external uniform magnetic field $H$ focus is made on the study of phases
of the complex neutral vector boson fields coupled with magnetic field by the
Zeeman coupling and phases of the charged vector boson fields. These systems
may behave as nonmagnetic and ferromagnetic superfluids and ordinary and
ferromagnetic superconductors. Response of the ferromagnetic superfluid and
superconducting systems occupying half of space on the external uniform static
magnetic field $H$ is thoroughly studied. Then the spin-triplet pairing of
neutral fermions at conserved spin is considered. Novel phases are found. In
external magnetic field the phase with zero mean spin proves to be unstable to
the formation of a phase with a non-zero spin. For $H>H_{\rm cr 2}$ the
spin-triplet pairing and ferromagnetic superfluidity continue to exist above
the ""old"" phase transition critical temperature $T_{\rm cr}$. For a certain
parameter choice ferromagnetic superfluid phases are formed already for $H=0$,
characterized by an own magnetic field $h$. Formation of domains is discussed.
Next, spin-triplet pairing of charged fermions is studied. Novel phases are
found with a ferromagnetic superconductivity. Then, the 3P$_2$ $nn$ pairing in
neutron star matter is studied. Also a 3P$_2$ $pp$ pairing is considered.
Numerical estimates are performed in the BCS weak coupling limit and beyond it
for the $3P_2$ $nn$ and $pp$ pairings, as well as for the 3S$_1$ $np$ pairing.
","[{""version"":""v1"",""created"":""Mon, 18 Nov 2019 09:40:53 GMT""},{""version"":""v2"",""created"":""Wed, 23 Jun 2021 06:52:39 GMT""}]","2021-06-24"
"1911.07503","Jairo Inga","Jairo Inga, Esther Bischoff, Florian K\""opf, S\""oren Hohmann","Inverse Dynamic Games Based on Maximum Entropy Inverse Reinforcement
  Learning",,,,,"eess.SY cs.GT cs.MA cs.SY","http://arxiv.org/licenses/nonexclusive-distrib/1.0/","  We consider the inverse problem of dynamic games, where cost function
parameters are sought which explain observed behavior of interacting players.
Maximum entropy inverse reinforcement learning is extended to the N-player case
in order to solve inverse dynamic games with continuous-valued state and
control spaces. We present methods for identification of cost function
parameters from observed data which correspond to (i) a Pareto efficient
solution, (ii) an open-loop Nash equilibrium or (iii) a feedback Nash
equilibrium. Furthermore, we give results on the unbiasedness of the estimation
of cost function parameters for each arising class of inverse dynamic game. The
applicability of the methods is demonstrated with simulation examples of a
nonlinear and a linear-quadratic dynamic game.
","[{""version"":""v1"",""created"":""Mon, 18 Nov 2019 09:41:47 GMT""},{""version"":""v2"",""created"":""Fri, 24 Jul 2020 09:29:52 GMT""}]","2020-07-27"
"1911.07504","Sang Won Bae","Sang Won Bae","Minimum-Width Double-Strip and Parallelogram Annulus","18 pages, 4 figures, presented at ISAAC 2019",,,,"cs.CG","http://arxiv.org/licenses/nonexclusive-distrib/1.0/","  In this paper, we study the problem of computing a minimum-width double-strip
or parallelogram annulus that encloses a given set of $n$ points in the plane.
A double-strip is a closed region in the plane whose boundary consists of four
parallel lines and a parallelogram annulus is a closed region between two
edge-parallel parallelograms. We present several first algorithms for these
problems. Among them are $O(n^2)$ and $O(n^3 \log n)$-time algorithms that
compute a minimum-width double-strip and parallelogram annulus, respectively,
when their orientations can be freely chosen.
","[{""version"":""v1"",""created"":""Mon, 18 Nov 2019 09:43:54 GMT""}]","2019-11-19"
"1911.07505","Mohammadreza Kasaei","Mohammadreza Kasaei, Nuno Lau, Artur Pereira","A Hierarchical Framework to Generate Robust Biped Locomotion Based on
  Divergent Component of Motion",,,,,"cs.RO","http://arxiv.org/licenses/nonexclusive-distrib/1.0/","  Keeping the stability can be counted as the essential ability of a humanoid
robot to step out of the laboratory to work in our real environment. Since
humanoid robots have similar kinematic to a human, humans expect these robots
to be robustly capable of stabilizing even in a challenging situation like
while a severe push is applied. This paper presents a robust walking framework
which not only takes into account the traditional push recovery approaches
(e.g., ankle, hip and step strategies) but also uses the concept of Divergent
Component of the Motion (DCM) to adjust next step timing and location. The
control core of the proposed framework is composed of a
Linear-Quadratic-Gaussian (LQG) controller and two proportional controllers. In
this framework, the LQG controller tries to track the reference trajectories
and the proportional controllers are designed to adjust the next step timing
and location that allow the robot to recover from a severe push. The robustness
and the performance of the proposed framework have been validated by performing
a set of simulations, including walking and push recovery using MATLAB. The
simulation results verified that the proposed framework is capable of providing
a robust walking even in very challenging situations.
","[{""version"":""v1"",""created"":""Mon, 18 Nov 2019 09:44:23 GMT""}]","2019-11-19"
"1911.07506","Clemens Gneiting","Abhijeet Melkani and Clemens Gneiting and Franco Nori","Eigenstate extraction with neural-network tomography","12 pages","Phys. Rev. A 102, 022412 (2020)","10.1103/PhysRevA.102.022412",,"quant-ph","http://arxiv.org/licenses/nonexclusive-distrib/1.0/","  We discuss quantum state tomography via a stepwise reconstruction of the
eigenstates of the mixed states produced in experiments. Our method is tailored
to the experimentally relevant class of nearly pure states or simple mixed
states, which exhibit dominant eigenstates and thus lend themselves to low-rank
approximations. The developed scheme is applicable to any pure-state tomography
method, promoting it to mixed-state tomography. Here, we demonstrate it with
machine learning-inspired pure-state tomography based on neural-network
representations of quantum states. The latter have been shown to efficiently
approximate generic classes of complex (pure) states of large quantum systems.
We test our method by applying it to experimental data from trapped ion
experiments with four to eight qubits.
","[{""version"":""v1"",""created"":""Mon, 18 Nov 2019 09:45:11 GMT""},{""version"":""v2"",""created"":""Tue, 1 Sep 2020 09:10:42 GMT""}]","2020-09-02"
"1911.07507","Sheetal Dharmatti Dr.","Tania Biswas and Sheetal Dharmatti","Interior and H$^\infty$ feedback stabilization for sabra Shell model of
  turbulence",,,,,"math.OC","http://arxiv.org/licenses/nonexclusive-distrib/1.0/","  Shell models of turbulence are representation of turbulence equations in
Fourier domain. Various shell models along with numerical simulations have been
studied earlier. One of the most suitable shell model of turbulence is so
called sabra shell model. The existence, uniqueness and regularity property of
this model are extensively studied in \cite{PBT}. In this paper we have
addressed stabilization problems related to sabra shell model of turbulence. We
have studied internal stabilization via finite dimensional controller. Moreover
we have also studied optimal robust control problem by solving an infinite time
horizon max-min control problem. We first prove the $H^ \infty$ stabilization
of the linearized system and charatarize it in terms of a feedback operator by
solving an algebric ricatti equation. Finally we show that the control will
asymptotically stabilize the nonlinear system.
","[{""version"":""v1"",""created"":""Mon, 18 Nov 2019 09:45:48 GMT""},{""version"":""v2"",""created"":""Sat, 24 Apr 2021 11:11:36 GMT""}]","2021-04-27"
"1911.07508","Cl\'ement Elvira","Cl\'ement Elvira and C\'edric Herzet","Safe squeezing for antisparse coding",,,"10.1109/TSP.2020.2995192",,"cs.LG stat.ML","http://creativecommons.org/licenses/by/4.0/","  Spreading the information over all coefficients of a representation is a
desirable property in many applications such as digital communication or
machine learning. This so-called antisparse representation can be obtained by
solving a convex program involving an $\ell_\infty$-norm penalty combined with
a quadratic discrepancy. In this paper, we propose a new methodology, dubbed
safe squeezing, to accelerate the computation of antisparse representation. We
describe a test that allows to detect saturated entries in the solution of the
optimization problem. The contribution of these entries is compacted into a
single vector, thus operating a form of dimensionality reduction. We propose
two algorithms to solve the resulting lower dimensional problem. Numerical
experiments show the effectiveness of the proposed method to detect the
saturated components of the solution and illustrates the induced computational
gains in the resolution of the antisparse problem.
","[{""version"":""v1"",""created"":""Mon, 18 Nov 2019 09:46:20 GMT""},{""version"":""v2"",""created"":""Sat, 28 Mar 2020 17:35:20 GMT""}]","2020-07-15"
"1911.07509","Anis Koubaa","Marwa Ben Jabra, Adel Ammar, Anis Koubaa, Omar Cheikhrouhou, Habib
  Hamam","AI-based Pilgrim Detection using Convolutional Neural Networks","Accepted in ATSIP'2020",,,,"cs.CV cs.LG cs.NE","http://creativecommons.org/licenses/by/4.0/","  Pilgrimage represents the most important Islamic religious gathering in the
world where millions of pilgrims visit the holy places of Makkah and Madinah to
perform their rituals. The safety and security of pilgrims is the highest
priority for the authorities. In Makkah, 5000 cameras are spread around the
holy for monitoring pilgrims, but it is almost impossible to track all events
by humans considering the huge number of images collected every second. To
address this issue, we propose to use artificial intelligence technique based
on deep learning and convolution neural networks to detect and identify
Pilgrims and their features. For this purpose, we built a comprehensive dataset
for the detection of pilgrims and their genders. Then, we develop two
convolutional neural networks based on YOLOv3 and Faster-RCNN for the detection
of Pilgrims. Experiments results show that Faster RCNN with Inception v2
feature extractor provides the best mean average precision over all classes of
51%.
","[{""version"":""v1"",""created"":""Mon, 18 Nov 2019 09:46:54 GMT""},{""version"":""v2"",""created"":""Tue, 18 Feb 2020 19:06:10 GMT""}]","2020-02-20"
