"1909.08673","Markus Aschwanden","Markus J. Aschwanden","Non-Stationary Fast-Driven Self-Organized Criticality in Solar Flares","19 p, 8 Figs",,"10.3847/1538-4357/ab5371",,"astro-ph.SR","http://arxiv.org/licenses/nonexclusive-distrib/1.0/","  The original concept of self-organized criticality (Bak et al.~1987), applied
to solar flare statistics (Lu and Hamilton 1991), assumed a slow-driven and
stationary flaring rate, which warrants time scale separation (between flare
durations and inter-flare waiting times), it reproduces power-law distributions
for flare peak fluxes and durations, but predicts an exponential waiting time
distribution. In contrast to these classical assumptions we observe: (i)
multiple energy dissipation episodes during most flares, (ii) violation of the
principle of time scale separation, (iii) a fast-driven and non-stationary
flaring rate, (iv) a power law distribution for waiting times $\Delta t$, with
a slope of $\alpha_{\Delta t} \approx 2.0$, as predicted from the universal
reciprocality between mean flaring rates and mean waiting times; and (v) pulses
with rise times and decay times of the dissipated magnetic free energy on time
scales of $12\pm6$ min, up to 13 times in long-duration ($\lapprox 4$ hrs)
flares. These results are inconsistent with coronal long-term energy storage
(Rosner and Vaiana 1978), but require photospheric-chromospheric current
injections into the corona.
","[{""version"":""v1"",""created"":""Wed, 18 Sep 2019 19:56:23 GMT""}]","2020-01-08"
"1909.08674","Luigi Mancini","L. Mancini, P. Sarkis, Th. Henning, G. A. Bakos, D. Bayliss, J. Bento,
  W. Bhatti, R. Brahm, Z. Csubry, N. Espinoza, J. Hartman, A. Jordan, K. Penev,
  M. Rabus, V. Suc, M. de Val-Borro, G. Zhou, G. Chen, M. Damasso, J.
  Southworth, T. G. Tan","The highly inflated giant planet WASP-174b","12 pages, 14 figures, Accepted for publication in Astronomy &
  Astrophysics","A&A 633, A30 (2020)","10.1051/0004-6361/201936532",,"astro-ph.EP","http://arxiv.org/licenses/nonexclusive-distrib/1.0/","  The transiting exoplanetary system WASP-174 was reported to be composed by a
main-sequence F star (V=11.8 mag) and a giant planet, WASP-174b (orbital period
4.23 days). However only an upper limit was placed on the planet mass (<1.3
Mj), and a highly uncertain planetary radius (0.7-1.7 Rj) was determined. We
aim to better characterise both the star and the planet and precisely measure
their orbital and physical parameters. In order to constrain the mass of the
planet, we obtained new measurements of the radial velocity of the star and
joined them with those from the discovery paper. Photometric data from the
HATSouth survey and new multi-band, high-quality (precision reached up to
0.37~mmag) photometric follow-up observations of transit events were acquired
and analysed for getting accurate photometric parameters. We fit the model to
all the observations, including data from the TESS space telescope, in two
different modes: incorporating the stellar isochrones into the fit, and using
an empirical method to get the stellar parameters. The two modes resulted to be
consistent with each other to within 2 sigma. We confirm the grazing nature of
the WASP-174b transits with a confidence level greater than 5 sigma, which is
also corroborated by simultaneously observing the transit through four optical
bands and noting how the transit depth changes due to the limb-darkening
effect. We estimate that ~76% of the disk of the planet actually eclipses the
parent star at mid-transit of its transit events. We find that WASP-174b is a
highly-inflated hot giant planet with a mass of 0.330 Mj and a radius of 1.435
Rj, and is therefore a good target for transmission-spectroscopy observations.
With a density of 0.135 g/cm^3, it is amongst the lowest-density planets ever
discovered with precisely measured mass and radius.
","[{""version"":""v1"",""created"":""Wed, 18 Sep 2019 20:00:04 GMT""}]","2022-09-14"
"1909.08675","Prudhvi Gurram","Pengcheng Xu, Prudhvi Gurram, Gene Whipps, Rama Chellappa","Wasserstein Distance Based Domain Adaptation for Object Detection",,,,,"cs.CV","http://arxiv.org/licenses/nonexclusive-distrib/1.0/","  In this paper, we present an adversarial unsupervised domain adaptation
framework for object detection. Prior approaches utilize adversarial training
based on cross entropy between the source and target domain distributions to
learn a shared feature mapping that minimizes the domain gap. Here, we minimize
the Wasserstein distance between the two distributions instead of cross entropy
or Jensen-Shannon divergence to improve the stability of domain adaptation in
high-dimensional feature spaces that are inherent to object detection task.
Additionally, we remove the exact consistency constraint of the shared feature
mapping between the source and target domains, so that the target feature
mapping can be optimized independently, which is necessary in the case of
significant domain gap. We empirically show that the proposed framework can
mitigate domain shift in different scenarios, and provide improved target
domain object detection performance.
","[{""version"":""v1"",""created"":""Wed, 18 Sep 2019 20:00:31 GMT""}]","2019-09-20"
"1909.08676","Diganta Das","Diganta Das","Lepton flavor violating $\Lambda_b\to\Lambda\ell_1\ell_2$ decay","9 pages, two figures, published in EPJC, matches published version",,,,"hep-ph","http://arxiv.org/licenses/nonexclusive-distrib/1.0/","  Inspired by the recent hints of lepton flavor universality violation in $b\to
s\ell\ell$ and $b\to c\ell\nu$ transitions, we study lepton flavor violating
exclusive $\Lambda_b\to\Lambda\ell_1^+\ell_2^-$ ($\ell_1\neq \ell_2$) decay,
which is forbidden in the Standard Model. Starting from a general effective
Hamiltonian for a $b\to s\ell_1^+\ell_2^-$ transition that includes vector and
axial-vector operators, and scalar and pseudo-scalar operators, we derive a
two-fold decay distribution of $\Lambda_b\to\Lambda\ell_1^+\ell_2^-$. The
distribution helps us to construct the differential branching ratio and the
lepton side forward-backward asymmetry, which are studied in a vector
leptoquark model. The parameter space of the vector leptoquark model is
constrained by low energy observables.
","[{""version"":""v1"",""created"":""Wed, 18 Sep 2019 20:05:45 GMT""},{""version"":""v2"",""created"":""Mon, 23 Sep 2019 17:09:39 GMT""},{""version"":""v3"",""created"":""Sun, 22 Dec 2019 06:40:56 GMT""}]","2019-12-24"
"1909.08677","Christian Haase","Christian Haase, Franz Roters, Angela Quadfasel","Application-oriented strain-hardening engineering of high-manganese
  steels",,,,,"cond-mat.mtrl-sci","http://arxiv.org/licenses/nonexclusive-distrib/1.0/","  The outstanding mechanical properties of high-manganese steels (HMnS) are a
result of their high strain-hardenability. That is facilitated by strong
suppression of dynamic recovery, predominant planar glide, and the activation
of additional deformation mechanisms, such as transformation-induced plasticity
(TRIP) and twinning-induced plasticity (TWIP). However, depending on the final
application, strongly differing requirements on the mechanical properties of
HMnS are of relevance. In order to design HMnS for specific applications,
multi-scale material simulation under consideration of the processing
conditions that allows for prediction of the final mechanical properties is
required, i.e. strain-hardening engineering based on integrated computational
materials engineering (ICME). In this work, we present an approach that employs
alloy selection by stacking-fault energy calculations, which enables
activation/suppression of specific deformation mechanisms. Tailored
manufacturing, e.g. by thermo-mechanical treatment, severe plastic deformation
or additive manufacturing, provides possibilities to make use of the
strain-hardenability during and after processing to define the mechanical
properties. A computational approach for alloy and process design will be
discussed.
","[{""version"":""v1"",""created"":""Wed, 18 Sep 2019 20:06:43 GMT""}]","2019-09-20"
"1909.08678","Sauli Lindberg","Daniel Faraco, Sauli Lindberg and L\'aszl\'o Sz\'ekelyhidi Jr","Bounded solutions of ideal MHD with compact support in space-time",,,"10.1007/s00205-020-01570-y",,"math.AP math-ph math.MP","http://arxiv.org/licenses/nonexclusive-distrib/1.0/","  We show that in 3-dimensional ideal magnetohydrodynamics there exist
infinitely many bounded solutions that are compactly supported in space-time
and have non-trivial velocity and magnetic fields. The solutions violate
conservation of total energy and cross helicity, but preserve magnetic
helicity. For the 2-dimensional case we show that, in contrast, no nontrivial
compactly supported solutions exist in the energy space.
","[{""version"":""v1"",""created"":""Wed, 18 Sep 2019 20:06:59 GMT""}]","2020-10-28"
"1909.08679","Richard Fitzpatrick","Richard Fitzpatrick","Analytic Theory of Edge Localized Mode Suppression by Static Resonant
  Magnetic Perturbations in H-mode Tokamak Discharges",,,,,"physics.plasm-ph","http://arxiv.org/licenses/nonexclusive-distrib/1.0/","  An analytic theory of edge localized mode (ELM) suppression in an H-mode
tokamak plasma via the application of a static, externally generated, resonant
magnetic perturbation (RMP) is presented. This theory is based on the plausible
hypothesis that mode penetration at the top of the pedestal is a necessary and
sufficient condition for the RMP-induced suppression of ELMs. The theory also
makes use of a number of key insights gained in a recent publication
(Fitzpatrick R 2019). The first insight is that the response of the plasma to a
particular helical component of the RMP, in the immediate vicinity of the
associated resonant surface, is governed by nonlinear magnetic island physics,
rather than by linear layer physics. The second insight is that neoclassical
effects play a vital role in the physics of RMP-induced ELM suppression. The
final insight is that plasma impurities play an important role in the physics
of RMP-induced ELM suppression. The theory presented in this paper is employed
to gain a better understanding ELM suppression in DIII-D and ITER H-mode
discharges. It is found that ELM suppression is only possible when q_95 takes
values that lie in certain narrow windows. Moreover, the widths of these
windows decrease with increasing plasma density. Assuming a core plasma
rotation of 20 krad/s, the window width for a model ITER H-mode discharge is
found to be similar to, but slightly smaller than, the window width in a
typical DIII-D H-mode discharge.
","[{""version"":""v1"",""created"":""Wed, 18 Sep 2019 20:07:04 GMT""}]","2019-09-20"
"1909.08680","Linyuan Lu","Linyuan Lu and Joshua C. Thompson","Poset Ramsey Numbers for Boolean Lattices","19 pages",,,,"math.CO","http://arxiv.org/licenses/nonexclusive-distrib/1.0/","  A subposet $Q'$ of a poset $Q$ is a \textit{copy of a poset} $P$ if there is
a bijection $f$ between elements of $P$ and $Q'$ such that $x \le y$ in $P$ iff
$f(x) \le f(y)$ in $Q'$. For posets $P, P'$, let the \textit{poset Ramsey
number} $R(P,P')$ be the smallest $N$ such that no matter how the elements of
the Boolean lattice $Q_N$ are colored red and blue, there is a copy of $P$ with
all red elements or a copy of $P'$ with all blue elements. Axenovich and Walzer
introduced this concept in \textit{Order} (2017), where they proved $R(Q_2,
Q_n) \le 2n + 2$ and $R(Q_n, Q_m) \le mn + n + m$, where $Q_n$ is the Boolean
lattice of dimension $n$. They later proved $2n \le R(Q_n, Q_n) \le n^2 + 2n$.
Walzer later proved $R(Q_n, Q_n) \le n^2 + 1$. We provide some improved bounds
for $R(Q_n, Q_m)$ for various $n,m \in \mathbb{N}$. In particular, we prove
that $R(Q_n, Q_n) \le n^2 - n + 2$, $R(Q_2, Q_n) \le \frac{5}{3}n + 2$, and
$R(Q_3, Q_n) \le \frac{37}{16}n + \frac{39}{16}$. We also prove that
$R(Q_2,Q_3) = 5$, and $R(Q_m, Q_n) \le (m - 2 + \frac{9m - 9}{(2m - 3)(m +
1)})n + m + 3$ for all $n \ge m \ge 4$.
","[{""version"":""v1"",""created"":""Wed, 18 Sep 2019 20:09:49 GMT""}]","2019-09-20"
"1909.08681","Zheng Zhang","Zheng Zhang, Ruiqing Yin, Jun Zhu, Pierre Zweigenbaum","Cross-Lingual Contextual Word Embeddings Mapping With Multi-Sense Words
  In Mind","12 pages",,,,"cs.CL","http://arxiv.org/licenses/nonexclusive-distrib/1.0/","  Recent work in cross-lingual contextual word embedding learning cannot handle
multi-sense words well. In this work, we explore the characteristics of
contextual word embeddings and show the link between contextual word embeddings
and word senses. We propose two improving solutions by considering contextual
multi-sense word embeddings as noise (removal) and by generating cluster level
average anchor embeddings for contextual multi-sense word embeddings
(replacement). Experiments show that our solutions can improve the supervised
contextual word embeddings alignment for multi-sense words in a microscopic
perspective without hurting the macroscopic performance on the bilingual
lexicon induction task. For unsupervised alignment, our methods significantly
improve the performance on the bilingual lexicon induction task for more than
10 points.
","[{""version"":""v1"",""created"":""Wed, 18 Sep 2019 20:10:32 GMT""}]","2019-09-20"
"1909.08682","Semeon Arthamonov","S. Arthamonov and N. Reshetikhin","Superintegrable Systems on Moduli Spaces of Flat Connections",,"Commun. Math. Phys. 386, 1337-1381 (2021)","10.1007/s00220-021-04128-5",,"math-ph math.MP nlin.SI","http://arxiv.org/licenses/nonexclusive-distrib/1.0/","  The main result of this paper is the construction of a family of
superintegrable Hamiltonian systems on moduli spaces of flat connections on a
principle $G$-bundle on a surface. The moduli space is a Poisson variety with
Atiyah-Bott Poisson structure. Among particular cases of such systems are spin
generalizations of Ruijsenaars-Schneider models.
","[{""version"":""v1"",""created"":""Wed, 18 Sep 2019 20:13:05 GMT""}]","2022-02-18"
"1909.08683","Tom\'a\v{s} Nagy","Tom\'a\v{s} Nagy","Non-affine latin quandles of order $2^k$","to appear in Journal of Algebra and its Applications",,,,"math.GR","http://arxiv.org/licenses/nonexclusive-distrib/1.0/","  We prove that a non-affine latin quandle (also known as left distributive
quasigroup) of order $2^k$ exists if and only if $k = 6$ or $k \geq 8$. The
construction is expressed in terms of central extensions of affine quandles.
","[{""version"":""v1"",""created"":""Wed, 18 Sep 2019 20:17:34 GMT""},{""version"":""v2"",""created"":""Thu, 27 Feb 2020 14:02:19 GMT""}]","2020-02-28"
"1909.08684","Amin Aboubrahim","Amin Aboubrahim and Pran Nath","LHC phenomenology with hidden sector dark matter: a long-lived stau and
  heavy Higgs in an observable range","Talks presented at the 2019 Meeting of the Division of Particles and
  Fields of the American Physical Society (DPF2019), July 29 - August 2, 2019,
  Northeastern University, Boston, C1907293",,,,"hep-ph hep-ex","http://arxiv.org/licenses/nonexclusive-distrib/1.0/","  The presence of a hidden sector with very weak interactions with the standard
model has significant implications on LHC signatures. In this work we discuss
LHC phenomenology with the inclusion of a hidden sector by a $U(1)$ extension
of MSSM/SUGRA. We consider both kinetic mixing and Stueckelberg mass mixing
between the $U(1)$ gauge field of the hidden sector and $U(1)_Y$ of the visible
sector. Such a model has an extended parameter space. We consider here two
limited regions of this parameter space. In the first case we consider a $U(1)$
gauge field along with chiral fields needed for the Stueckelberg mechanism to
operate and discuss the mixing between the hidden and the visible sectors. Here
if the stau is the lightest sparticle in the MSSM sector and the neutralino of
the hidden sector is the LSP of the full system and a dark matter candidate,
the stau can be long-lived and decay inside an LHC detector tracker. In the
second case we include extra vectorlike matter in the hidden sector which can
give rise to a Dirac fermion in addition to the two neutralinos in the hidden
sector. The neutralino sector now has six neutralinos and we assume that the
lightest of these is the LSP and is higgsino-like. In this case the dark matter
is constituted of a Majorana and a Dirac fermion, and a small $\mu$ leads to
heavy Higgs boson masses which reside in the observable range of HL-LHC and
HE-LHC.
","[{""version"":""v1"",""created"":""Wed, 18 Sep 2019 20:18:28 GMT""}]","2019-09-20"
"1909.08685","Muhammad Kamran Janjua","Shah Nawaz, Muhammad Kamran Janjua, Ignazio Gallo, Arif Mahmood,
  Alessandro Calefati","Deep Latent Space Learning for Cross-modal Mapping of Audio and Visual
  Signals","Accepted to DICTA 2019",,,,"cs.CV cs.SD eess.AS","http://arxiv.org/licenses/nonexclusive-distrib/1.0/","  We propose a novel deep training algorithm for joint representation of audio
and visual information which consists of a single stream network (SSNet)
coupled with a novel loss function to learn a shared deep latent space
representation of multimodal information. The proposed framework characterizes
the shared latent space by leveraging the class centers which helps to
eliminate the need for pairwise or triplet supervision. We quantitatively and
qualitatively evaluate the proposed approach on VoxCeleb, a benchmarks
audio-visual dataset on a multitude of tasks including cross-modal
verification, cross-modal matching, and cross-modal retrieval. State-of-the-art
performance is achieved on cross-modal verification and matching while
comparable results are observed on the remaining applications. Our experiments
demonstrate the effectiveness of the technique for cross-modal biometric
applications.
","[{""version"":""v1"",""created"":""Wed, 18 Sep 2019 20:18:44 GMT""}]","2019-09-20"
"1909.08686","Mukuntha Narayanan Sundararaman","Alan Aipe, Mukuntha Narayanan Sundararaman, Asif Ekbal","Sentiment-Aware Recommendation System for Healthcare using Social Media","Accepted at the 20th International Conference on Computational
  Linguistics and Intelligent Text Processing (CICLing 2019), April 7-13, 2019,
  La Rochelle, France; Springer LNCS Proceedings for CICLing 2019",,,,"cs.CL","http://arxiv.org/licenses/nonexclusive-distrib/1.0/","  Over the last decade, health communities (known as forums) have evolved into
platforms where more and more users share their medical experiences, thereby
seeking guidance and interacting with people of the community. The shared
content, though informal and unstructured in nature, contains valuable medical
and/or health-related information and can be leveraged to produce structured
suggestions to the common people. In this paper, at first we propose a stacked
deep learning model for sentiment analysis from the medical forum data. The
stacked model comprises of Convolutional Neural Network (CNN) followed by a
Long Short Term Memory (LSTM) and then by another CNN. For a blog classified
with positive sentiment, we retrieve the top-n similar posts. Thereafter, we
develop a probabilistic model for suggesting the suitable treatments or
procedures for a particular disease or health condition. We believe that
integration of medical sentiment and suggestion would be beneficial to the
users for finding the relevant contents regarding medications and medical
conditions, without having to manually stroll through a large amount of
unstructured contents.
","[{""version"":""v1"",""created"":""Wed, 18 Sep 2019 20:20:25 GMT""}]","2019-09-20"
"1909.08687","Yeison Sanchez","Haydee Jim\'enez Tafur, Carlos Luque Arias, Yeison S\'anchez Rubio","Unusual elementary axiomatizations for abelian groups","9 pages",,,,"math.GR","http://arxiv.org/licenses/nonexclusive-distrib/1.0/","  One of the most studied algebraic structures with one operation is the
Abelian group, which is defined as a structure whose operation satisfies the
associative and commutative properties, has identical element and every element
has an inverse element. In this article, we characterize the Abelian groups
with other properties and we even reduce it to two the list of properties to be
fulfilled by the operation. For this, we make use of properties that, in
general, are hardly ever mencioned.
","[{""version"":""v1"",""created"":""Wed, 18 Sep 2019 20:21:35 GMT""}]","2019-09-20"
"1909.08688","Sevak Mkrtchyan","Erin Crossen Brown, Sevak Mkrtchyan, Jonathan Pakianathan","Random gap processes and asymptotically complete sequences",,,,,"math.PR math.CO math.NT","http://arxiv.org/licenses/nonexclusive-distrib/1.0/","  We study a process of generating random positive integer weight sequences $\{
W_n \}$ where the gaps between the weights $\{ X_n = W_n - W_{n-1} \}$ are
i.i.d. positive integer-valued random variables. We show that as long as the
gap distribution has finite $\frac{1}{2}$-moment, almost surely, the resulting
weight sequence is asymptotically complete, i.e., all large enough multiples of
the gcd of the possible gap values can be written as a sum of distinct weights.
We then show a much stronger result that if the gap distribution has a moment
generating function with large enough radius of convergence, then every large
enough multiple of the gcd of gap values can be written as a sum of $m$
distinct weights for any fixed $m \geq 2$.
","[{""version"":""v1"",""created"":""Wed, 18 Sep 2019 20:24:17 GMT""}]","2019-09-20"
"1909.08689","Cyril Belardinelli","Cyril Belardinelli","Linear mass Density of vertically suspended heavy springs","9 pages, 4 figures",,,,"physics.class-ph","http://creativecommons.org/licenses/by/4.0/","  In the present article the linear mass Density for vertically suspended heavy
springs is calculated for two different cases. First for a spring of invariable
length suspended at the top and fixed at the bottom of the spring, then for a
hanging heavy spring with an additional load. Both cases are solved by
minimizing the total energy which is a sum of potential energy and energy due
to the deformation.
","[{""version"":""v1"",""created"":""Wed, 18 Sep 2019 20:34:31 GMT""}]","2019-09-20"
"1909.08690","Chris Palmstr{\o}m","Nathaniel S Wilson, Stephan Kraemer, Daniel J. Pennachio, Patrick
  Callahan, Mihir Pendharkar, and Christopher J Palmstr{\o}m","Mechanism for Embedded In-plane Self Assembled Nanowire Formation",,"Phys. Rev. Materials 4, 066003 (2020)","10.1103/PhysRevMaterials.4.066003",,"cond-mat.mtrl-sci","http://arxiv.org/licenses/nonexclusive-distrib/1.0/","  We report a novel growth mechanism that produces in-plane [1-10] oriented
ErSb nanowires formed during codeposition of Er0.3Ga0.7Sb via molecular beam
epitaxy (MBE). Nanowires are characterized by in-situ scanning tunneling
microscopy (STM), as well as ex-situ transmission electron microscopy (TEM) and
electron channeling contrast imaging (ECCI). We show that complexes of
macrosteps with step heights on the order of 7 nm form during nanowire growth.
The macrosteps are shown to be part of the in-plane nanowire growth process and
are directly responsible for the observed stratified distribution of in-plane
nanowires. TEM indicates that initial growth results in out-of-plane nanowires
transitioning to in-plane nanowires after a critical film thickness. A surface
energy model is put forward that shows the critical thickness is due to
minimization of the GaSb{110} surfaces formed during out-of-plane nanowire
growth. Kinetics of the transition are discussed with respect to observed
features in STM, along with the material parameters needed to achieve in-plane
nanowire growth.
","[{""version"":""v1"",""created"":""Wed, 18 Sep 2019 20:41:43 GMT""}]","2020-07-01"
"1909.08698","Pedro Moraes","M.M. Lapola, P.H.R.S. Moraes, W. de Paula, J. F. Jesus, R. Valentim,
  M. Malheiro","A unique equation of state for the universe evolution from AdS$_5$
  space-time","14 pages, 11 figures",,,,"gr-qc","http://arxiv.org/licenses/nonexclusive-distrib/1.0/","  We apply the Induced Matter Model to a five-dimensional metric. For the case
with null cosmological constant, we obtain a solution able to describe the
radiation-dominated era of the universe. The positive $\Lambda$ case yields a
bounce cosmological model. In the negative five-dimensional cosmological
constant case, the scale factor is obtained as $a(t)\sim\sqrt[]{\sinh t}$,
which is able to describe not only the late-time cosmic acceleration but also
the non-accelerated stages of the cosmic expansion in a continuous form. This
solution together with the extra-dimensional scale factor solution yields the
material content of the model to be remarkably related through an equation of
state analogous to the renowned MIT bag model equation of state for quark
matter $p=(\rho-4B)/3$. In our case, $\rho=\rho_m+B$, with $\rho_m$ being the
energy density of relativistic and non-relativistic matter and $B=\ \Lambda\
/16\pi$ represents the bag energy constant, which plays the role of the dark
energy in the four-dimensional universe, with $\Lambda$ being the cosmological
constant of the AdS$_5$ space-time. Our model satisfactorily fits the
observational data for the low redshift sample of the experimental measurement
of the Hubble parameter, which resulted in $H_0=72.2^{+5.3}_{-5.5}$km s$^{-1}$
Mpc$^{-1}$.
","[{""version"":""v1"",""created"":""Wed, 18 Sep 2019 20:47:17 GMT""}]","2019-09-20"
