"1909.08951","Leonid Gurvits","M.J. Bentum, M.K. Verma, R.T. Rajan, A.-J. Boonstra, C.J.M. Verhoeven,
  E.K.A. Gill, A.J. van der Veen, H. Falcke, M. Klein Wolt, B. Monna, S.
  Engelen, J. Rotteveel, and L.I. Gurvits","A Roadmap towards a Space-based Radio Telescope for Ultra-Low Frequency
  Radio Astronomy","28 pages, 2 figures, 5 tables; accepted","Advances in Space Research, 2019","10.1016/j.asr.2019.09.007",,"astro-ph.IM","http://arxiv.org/licenses/nonexclusive-distrib/1.0/","  The past two decades saw a renewed interest in low frequency radio astronomy,
with a particular focus on frequencies above 30 MHz. However, at frequencies
below 30 MHz, Earth-based observations are limited due to a combination of
severe ionospheric distortions, almost full reflection of radio waves below 10
MHz, solar eruptions and human-made radio frequency interference (RFI). A space
or Lunar-based ultra-low-frequency (or ultra-long-wavelength, ULW) array would
suffer significantly less from these limitations and hence would open up the
last, virtually unexplored frequency domain in the electromagnetic spectrum. A
roadmap has been initiated in order to explore the opportunity of building a
swarm of satellites to observe at the frequency band below 30 MHz. This
roadmap, dubbed Orbiting Low Frequency Antennas for Radio Astronomy (OLFAR),
presents a space-based ultra-low frequency radio telescope that will explore
the Universe's so-called dark ages, map the interstellar medium, and study
planetary and solar bursts in the solar system and search them in other
planetary systems. Such a system will comprise of a swarm of hundreds to
thousands of satellites, working together as a single aperture synthesis
instrument deployed sufficiently far away from Earth to avoid terrestrial RFI.
A number of key technologies of OLFAR are still to be developed and proven. The
first step in this roadmap is the NCLE (Netherlands China Low Frequency
Explorer) experiment launched in May 2018 on the Chinese Chang'e-4 mission. The
NCLE payload consists of a three monopole antenna system from which the first
data stream is expected in the second half of 2019, which will provide
important feedback for future science and technology opportunities. In this
paper, the roadmap towards OLFAR, a brief overview of the science
opportunities, and the technological and programmatic challenges of the mission
are presented.
","[{""version"":""v1"",""created"":""Thu, 19 Sep 2019 12:58:05 GMT""}]","2020-01-15"
"1909.08952","Davor Sudar","Davor Sudar, Roman Braj\v{s}a, Ivica Skoki\'c and Arnold O. Benz","Centre to limb brightness variations from ALMA full disk solar images",,,,,"astro-ph.SR","http://arxiv.org/licenses/nonexclusive-distrib/1.0/","  Science Verification (SV) data of solar observations with Atacama Large
Millimeter-submillimeter Array (ALMA) telescope were released to the scientific
community. Understanding the centre to limb brightness function is necessary to
compare features in full disk images. Our goals are to find the empirical
centre to limb brightness functions in two available spectral bands and create
flattened images with centre to limb brightness variations removed. We used
second-order polynomial fit of the cosine of incidence angle to data points as
a function of radial distance to the centre of the solar disk. The method also
includes iterative removal of outliers based on the interquartile range.
Fitting functions for all available images proved to adequately describe the
data with comparatively small errors in the fitting coefficients. In both bands
we found brightening towards the limb which is a consequence of increase in
electron temperatures with radial distance in this region of the solar
atmosphere. This study found that the $T_{b}$ of an active region has about 180
K difference between with and without the limb brightening at radial distance
$\approx$0.75$R_{\odot}$ in Band 6. We also made flattened images with limb
brightening removed. The limb brightening effect in ALMA images is significant
enough (of the order of 10% for Band 3 and about 15% in Band 6) that it can not
be neglected in further analyses. Since the effect of the side lobes was not
included in this study, these values probably represent the lower limit of the
limb brightening. The shape of the limb brightening function can also be used
to constrain electron densities and temperatures in various layers of the solar
atmosphere.
","[{""version"":""v1"",""created"":""Thu, 19 Sep 2019 12:59:05 GMT""}]","2019-09-20"
"1909.08953","Asmaa Shamesaldeen","Julio Andrade, Asmaa Shamesaldeen","Hybrid Euler-Hadamard Product for Dirichlet $L$-functions with Prime
  conductors over Function Fields","20 pages, comments are welcome",,,,"math.NT","http://arxiv.org/licenses/nonexclusive-distrib/1.0/","  In this paper we extend the hybrid Euler-Hadamard product model for quadratic
Dirichlet $L$-functions associated to irreducible polynomials over function
fields. We also establish an asymptotic formula for the first twisted moment in
this family of L-functions and then we provide further evidence for the
conjectural asymptotic formulas for its moments.
","[{""version"":""v1"",""created"":""Thu, 19 Sep 2019 13:05:21 GMT""}]","2019-09-20"
"1909.08954","Michael Klasen","V. Guzey, M. Klasen","Inclusive and diffractive dijet photoproduction in UPCs at the LHC in
  NLO QCD","7 pages, 5 figures, 1 table. Proceedings of the EPS Conference on
  High-Energy Physics (EPS-HEP 2019), Ghent, Belgium",,,"MS-TP-19-25","hep-ph hep-ex nucl-ex nucl-th","http://arxiv.org/licenses/nonexclusive-distrib/1.0/","  We present a next-to-leading order QCD calculation of inclusive dijet
photoproduction in ultraperipheral Pb-Pb collisions at the LHC and show that
the results agree very well with various kinematic distributions measured by
the ATLAS collaboration. The effect of including these data in nCTEQ or EPPS16
nuclear parton density functions (nPDFs) is then studied using the Bayesian
reweighting technique. For an assumed total error of 5\% on the final data, its
inclusion would lead to a significant reduction of the nPDF uncertainties of up
to a factor of two at small values of the parton momentum fraction. As an
outlook, we discuss future analyes of diffractive nPDFs, which are so far
completely unknown.
","[{""version"":""v1"",""created"":""Thu, 19 Sep 2019 13:06:08 GMT""}]","2019-09-20"
"1909.08955","Amando Hala","Ulrich Haisch and Amando Hala","Sum rules for CP-violating operators of Weinberg type","28 pages, 4 figures; v6: discussion on the proton electric dipole
  moment clarified",,"10.1007/JHEP11(2019)154",,"hep-ph","http://arxiv.org/licenses/nonexclusive-distrib/1.0/","  We estimate the size of the hadronic matrix elements of CP-violating
three-gluon and four-gluon Weinberg operators using sum-rule techniques. In the
three-gluon case, we are able to reproduce the expressions given in earlier
works, while the four-gluon results obtained in this article are new. Our paper
therefore represents the first systematic study of contributions to the
electric dipole moment of the neutron due to CP-violating dimension-six and
dimension-eight operators. We provide many details on both the derivation of
the sum rules as well as the analysis of the uncertainties that plague our
final predictions.
","[{""version"":""v1"",""created"":""Thu, 19 Sep 2019 13:07:36 GMT""},{""version"":""v2"",""created"":""Wed, 20 Nov 2019 09:34:09 GMT""},{""version"":""v3"",""created"":""Tue, 26 Nov 2019 09:58:51 GMT""},{""version"":""v4"",""created"":""Thu, 5 Dec 2019 12:48:32 GMT""},{""version"":""v5"",""created"":""Tue, 10 Nov 2020 13:32:14 GMT""},{""version"":""v6"",""created"":""Wed, 9 Dec 2020 13:22:07 GMT""}]","2020-12-10"
"1909.08956","Valerio Scagnoli","Claire Donnelly and Valerio Scagnoli","Imaging three-dimensional magnetic systems with X-rays",,"J. Phys.: Condens. Matter 32 213001 (2020)","10.1088/1361-648X/ab5e3c",,"cond-mat.mes-hall cond-mat.mtrl-sci physics.app-ph","http://arxiv.org/licenses/nonexclusive-distrib/1.0/","  Recent progress in nanofabrication and additive manufacturing have
facilitated the building of nanometer-scale three-dimensional structures, that
promise to lead to an emergence of new functionalities within a number of
fields, compared to state-of-the-art two dimensional systems. In magnetism, the
move to three-dimensional systems offers the possibility for novel magnetic
properties not available in planar systems, as well as enhanced performance,
both of which are key for the development of new technological applications. In
this review paper we will focus our attention on three-dimensional magnetic
systems and how their magnetic configuration can be retrieved using X-ray
magnetic nanotomography.
","[{""version"":""v1"",""created"":""Thu, 19 Sep 2019 13:09:29 GMT""},{""version"":""v2"",""created"":""Wed, 2 Oct 2019 14:30:19 GMT""},{""version"":""v3"",""created"":""Fri, 8 Nov 2019 13:47:05 GMT""}]","2020-04-22"
"1909.08957","Alexander Levin","Alexander Levin","Bivariate Kolchin-type dimension polynomials of non-reflexive prime
  difference-differential ideals. The case of one translation","16 pages",,,,"math.AC","http://arxiv.org/licenses/nonexclusive-distrib/1.0/","  We use the method of characteristic sets with respect to two term orderings
to prove the existence and obtain a method of computation of a bivariate
Kolchin-type dimension polynomial associated with a non-reflexive
difference-differential ideal in the algebra of difference-differential
polynomials with several basic derivations and one translation. In particular,
we obtain a new proof and a method of computation of the dimension polynomial
of a non-reflexive prime difference ideal in the algebra of difference
polynomials over an ordinary difference field. As a consequence, it is shown
that the reflexive closure of a prime difference polynomial ideal is the
inverse image of this ideal under a power of the basic translation. We also
discuss applications of our results to the analysis of systems of algebraic
difference-differential equations.
","[{""version"":""v1"",""created"":""Thu, 19 Sep 2019 13:10:03 GMT""}]","2019-09-20"
"1909.08958","Aviral Goel","Aviral Goel, Jan Vitek","On the Design, Implementation, and Use of Laziness in R","27 pages, 4 tables, 21 figures","Object-Oriented Programming, Systems, Languages & Applications.
  October 2019, Pages 153:1--153:27","10.1145/3360579",,"cs.PL","http://creativecommons.org/licenses/by/4.0/","  The R programming language has been lazy for over twenty-five years. This
paper presents a review of the design and implementation of call-by-need in R,
and a data-driven study of how generations of programmers have put laziness to
use in their code. We analyze 16,707 packages and observe the creation of 270.9
B promises. Our data suggests that there is little supporting evidence to
assert that programmers use laziness to avoid unnecessary computation or to
operate over infinite data structures. For the most part R code appears to have
been written without reliance on, and in many cases even knowledge of, delayed
argument evaluation. The only significant exception is a small number of
packages which leverage call-by-need for meta-programming.
","[{""version"":""v1"",""created"":""Thu, 19 Sep 2019 13:14:19 GMT""}]","2019-09-20"
"1909.08967","Guangcun Lu","Rongrong Jin, Guangcun Lu","Coisotropic Hofer-Zehnder capacities of convex domains and related
  results","Latex, 52 pages; final version, to appear in Journal of Fixed Point
  Theory and Applications",,,,"math.SG","http://arxiv.org/licenses/nonexclusive-distrib/1.0/","  We prove representation formulas for the coisotropic Hofer-Zehnder capacities
of bounded convex domains with special coisotropic submanifolds and the leaf
relation (introduced by Lisi and Rieser recently), study their estimates and
relations with the Hofer-Zehnder capacity,give some interesting corollaries,
and also obtain corresponding versions of a Brunn-Minkowski type inequality by
Artstein-Avidan and Ostrover and a theorem by Evgeni Neduv.
","[{""version"":""v1"",""created"":""Thu, 19 Sep 2019 13:20:24 GMT""},{""version"":""v2"",""created"":""Wed, 12 Aug 2020 15:59:58 GMT""},{""version"":""v3"",""created"":""Tue, 28 Mar 2023 08:18:38 GMT""}]","2023-03-29"
"1909.08968","Tom Bridgeland","Tom Bridgeland and Antony Maciocia","Complex surfaces with equivalent derived categories","This paper was first published in 2001. We post it on the arXiv now
  to correct an error in Section 6 (see the footnote on page 18)","Math. Z. 236 (2001), no. 4, 677--697",,,"math.AG","http://arxiv.org/licenses/nonexclusive-distrib/1.0/","  We examine the extent to which a smooth minimal complex projective surface X
is determined by its derived category of coherent sheaves D(X). To do this we
find, for each such surface X, the set of surfaces Y for which there exists a
Fourier-Mukai transform D(Y) --> D(X).
","[{""version"":""v1"",""created"":""Thu, 19 Sep 2019 13:20:29 GMT""}]","2019-09-20"
"1909.08969","Roch Guerin","R. Guerin","When Two is Worse Than One",,,,,"cs.DC cs.NI","http://arxiv.org/licenses/nonexclusive-distrib/1.0/","  This note is concerned with the impact on job latency of splitting a token
bucket into multiple sub-token buckets with equal aggregate parameters and
offered the same job arrival process. The situation commonly arises in
distributed computing environments where job arrivals are rate controlled (each
job needs one token to enter the system), but capacity limitations call for
distributing jobs across multiple compute resources with scalability
considerations preventing the use of a centralized rate control component (each
compute resource is responsible for monitoring and enforcing that the job
stream it receives conforms to a certain traffic envelope). The question we
address is to what extent splitting a token bucket into multiple sub-token
buckets that individually rate control a subset of the original arrival process
affects job latency, when jobs wait for a token whenever the token bucket is
empty upon their arrival. Our contribution is to establish that independent of
the job arrival process and how jobs are distributed across compute resources
(and sub-token buckets), splitting a token bucket always increases the sum of
job latencies in the token buckets, and consequently the average job latency.
","[{""version"":""v1"",""created"":""Thu, 19 Sep 2019 13:21:00 GMT""}]","2019-09-20"
"1909.08970","Tzuf Paz-Argaman","Tzuf Paz-Argaman and Reut Tsarfaty","RUN through the Streets: A New Dataset and Baseline Models for Realistic
  Urban Navigation","accepted to appear at the EMNLP 2019 conference",,,,"cs.CL","http://arxiv.org/licenses/nonexclusive-distrib/1.0/","  Following navigation instructions in natural language requires a composition
of language, action, and knowledge of the environment. Knowledge of the
environment may be provided via visual sensors or as a symbolic world
representation referred to as a map. Here we introduce the Realistic Urban
Navigation (RUN) task, aimed at interpreting navigation instructions based on a
real, dense, urban map. Using Amazon Mechanical Turk, we collected a dataset of
2515 instructions aligned with actual routes over three regions of Manhattan.
We propose a strong baseline for the task and empirically investigate which
aspects of the neural architecture are important for the RUN success. Our
results empirically show that entity abstraction, attention over words and
worlds, and a constantly updating world-state, significantly contribute to task
accuracy.
","[{""version"":""v1"",""created"":""Thu, 19 Sep 2019 13:21:05 GMT""}]","2019-09-20"
"1909.08971","Farhad Khoeini","Farrokh Yousefi, Farhad Khoeini, Ali Rajabpour","Thermal rectification and interface thermal resistance in hybrid
  pillared-graphene and graphene: A molecular dynamics approach","21 pages, 7 Figures","Nanotechnology 2020","10.1088/1361-6528/ab8420",,"cond-mat.mtrl-sci cond-mat.mes-hall","http://arxiv.org/licenses/nonexclusive-distrib/1.0/","  In this study, we investigate the thermal rectification and thermal
resistance in the hybrid pillared-graphene and graphene (PGG) system. This is
done through the classical molecular dynamics simulation (MD) and also with a
continuum model. At first, the thermal conductivity of both pillared-graphene
and graphene is calculated employing MD simulation and Fourier low. Our results
show that the thermal conductivity of the pillared-graphene is much smaller
than the graphene by an order of magnitude. Next, by applying positive and
negative temperature gradients along the longitudinal direction of PGG, the
thermal rectification is examined. The MD results indicate that for the lengths
in the range of 36 to 86nm, the thermal rectification remains almost constant
(~3-5%). We have also studied the phonon density of states (DOS) on both sides
of the interface of PGG. The DOS curves show that there is phonon scattering at
low frequencies (acoustic mode) that depends on the imposed temperature
gradient direction in the system. Therefore, we can introduce the PGG as a
promising thermal rectifier at room temperature. Furthermore, in the following
of this work, we also explore the temperature distribution over the PGG by
using the continuum model. The results that obtained from the continuum model
predict the MD results such as the temperature distribution in the upper half
layer and lower full layer graphene, the temperature gap and also the thermal
resistance at the interface.
","[{""version"":""v1"",""created"":""Thu, 19 Sep 2019 13:21:26 GMT""}]","2020-05-06"
"1909.08972","Kisa Barkemeyer","Kisa Barkemeyer, Regina Finsterh\""olzl, Andreas Knorr, Alexander
  Carmele","Revisiting Quantum Feedback Control: Disentangling the Feedback-induced
  Phase from the Corresponding Amplitude",,"Adv. Quantum Technol. 3 (2020) 1900078","10.1002/qute.201900078",,"quant-ph","http://arxiv.org/licenses/nonexclusive-distrib/1.0/","  Coherent time-delayed feedback allows the control of a quantum system and its
partial stabilization against noise and decoherence. The crucial and externally
accessible parameters in such control setups are the round-trip-induced delay
time $\tau$ and the frequencies $\omega$ of the involved optical transitions
which are typically controllable via global parameters like temperature, bias
or strain. They influence the dynamics via the amplitude and the phase $\phi =
\omega \tau$ of the feedback signal. These quantities are, however, not
independent. Here, we propose to control the feedback phase via a microwave
pump field. Using the example of a $\Lambda$-type three-level system, we show
that the Rabi frequency of the pump field induces phase shifts on demand and
therefore increases the applicability of coherent quantum feedback control
protocols.
","[{""version"":""v1"",""created"":""Thu, 19 Sep 2019 13:21:52 GMT""}]","2020-05-19"
"1909.08973","Aleksey Fedorov","E.O. Kiktenko, A.S. Nikolaeva, Peng Xu, G.V. Shlyapnikov, and A.K.
  Fedorov","Scalable quantum computing with qudits on a graph","7 pages; 3 figures","Phys. Rev. A 101, 022304 (2020)","10.1103/PhysRevA.101.022304",,"quant-ph cond-mat.quant-gas","http://arxiv.org/licenses/nonexclusive-distrib/1.0/","  We show a significant reduction of the number of quantum operations and the
improvement of the circuit depth for the realization of the Toffoli gate by
using qudits. This is done by establishing a general relation between the
dimensionality of qudits and their topology of connections for a scalable
multi-qudit processor, where higher qudit levels are used for substituting
ancillas. The suggested model is of importance for the realization of quantum
algorithms and as a method of quantum error correction codes for single-qubit
operations.
","[{""version"":""v1"",""created"":""Thu, 19 Sep 2019 13:22:52 GMT""},{""version"":""v2"",""created"":""Fri, 20 Sep 2019 04:10:54 GMT""},{""version"":""v3"",""created"":""Tue, 11 Feb 2020 12:04:05 GMT""}]","2020-02-12"
"1909.08974","Jianxiang Xi","Le Wang, Jianxiang Xi, Ming He, Guangbin Liu","Robust time-varying formation design for multi-agent systems with
  disturbances: Extended-state-observer method","14 pages, 5 figures","INTERNATIONAL JOURNAL OF ROBUST AND NONLINEAR CONTROL Volume: 30
  Issue: 7 Pages: 2796-2808 Published: MAY 10 2020","10.1002/rnc.4941",,"cs.MA cs.SY eess.SY","http://arxiv.org/licenses/nonexclusive-distrib/1.0/","  Robust time-varying formation design problems for second-order multi-agent
systems subjected to external disturbances are investigated. Firstly, by
constructing an extended state observer, the disturbance compensation is
estimated, which is a critical term in the proposed robust time-varying
formation control protocol. Then, an explicit expression of the formation
center function is determined and impacts of disturbance compensations on the
formation center function are presented. With the formation feasibility
conditions, robust time-varying formation design criteria are derived to
determine the gain matrix of the formation control protocol by utilizing the
algebraic Riccati equation technique. Furthermore, the tracking performance and
the robustness property of multi-agent systems are analyzed. Finally, the
numerical simulation is provided to illustrate the effectiveness of theoretical
results.
","[{""version"":""v1"",""created"":""Thu, 19 Sep 2019 13:22:54 GMT""}]","2020-05-08"
"1909.08975","Dieuwke Hupkes","Jaap Jumelet, Willem Zuidema and Dieuwke Hupkes","Analysing Neural Language Models: Contextual Decomposition Reveals
  Default Reasoning in Number and Gender Assignment","To appear at CoNLL2019",,,,"cs.CL cs.AI stat.ML","http://arxiv.org/licenses/nonexclusive-distrib/1.0/","  Extensive research has recently shown that recurrent neural language models
are able to process a wide range of grammatical phenomena. How these models are
able to perform these remarkable feats so well, however, is still an open
question. To gain more insight into what information LSTMs base their decisions
on, we propose a generalisation of Contextual Decomposition (GCD). In
particular, this setup enables us to accurately distil which part of a
prediction stems from semantic heuristics, which part truly emanates from
syntactic cues and which part arise from the model biases themselves instead.
We investigate this technique on tasks pertaining to syntactic agreement and
co-reference resolution and discover that the model strongly relies on a
default reasoning effect to perform these tasks.
","[{""version"":""v1"",""created"":""Thu, 19 Sep 2019 13:24:29 GMT""}]","2019-09-20"
"1909.08976","Marc Peter Westig","Marc Westig, Holger Thierschmann, Allard Katan, Matvey Finkel, Teun M.
  Klapwijk","Analysis of a single-mode waveguide at sub-terahertz frequencies as a
  communication channel","13 pages, 6 figures. Submitted, comments welcome","AIP Advances 10, 015008 (2020)","10.1063/1.5128451",,"physics.optics cond-mat.mes-hall physics.ins-det quant-ph","http://arxiv.org/licenses/nonexclusive-distrib/1.0/","  We study experimentally the transmission of an electro-magnetic waveguide in
the frequency range from 160 to 300 GHz. Photo-mixing is used to excite and
detect the fundamental TE10 mode in a rectangular waveguide with two
orders-of-magnitude lower impedance. The large impedance mismatch leads to a
strong frequency dependence of the transmission, which we measure with a
high-dynamic range of up to 80 dB, and with high frequency-resolution. The
modified transmission function is directly related to the information rate of
the waveguide, which we estimate to be about 1 bit per photon. We suggest that
the results are applicable to a Josephson junction employed as a single-photon
source and coupled to a superconducting waveguide to achieve a simple on-demand
narrow-bandwidth free-space number-state channel.
","[{""version"":""v1"",""created"":""Thu, 19 Sep 2019 13:25:29 GMT""}]","2020-01-10"
