"1909.08825","Benjamin Deneu","Benjamin Deneu (LIRMM, ZENITH), Maximilien Servajean (LIRMM),
  Christophe Botella (BIOSP, ZENITH), Alexis Joly (ZENITH)","Evaluation of Deep Species Distribution Models using Environment and
  Co-occurrences",,"CLEF 2019, Sep 2019, Lugano, Switzerland",,,"cs.NE","http://arxiv.org/licenses/nonexclusive-distrib/1.0/","  This paper presents an evaluation of several approaches of plants species
distribution modeling based on spatial, environmental and co-occurrences data
using machine learning methods. In particular, we re-evaluate the environmental
convolutional neural network model that obtained the best performance of the
GeoLifeCLEF 2018 challenge but on a revised dataset that fixes some of the
issues of the previous one. We also go deeper in the analysis of co-occurrences
information by evaluating a new model that jointly takes environmental
variables and co-occurrences as inputs of an end-to-end network. Results show
that the environmental models are the best performing methods and that there is
a significant amount of complementary information between co-occurrences and
environment. Indeed, the model learned on both inputs allows a significant
performance gain compared to the environmental model alone.
","[{""version"":""v1"",""created"":""Thu, 19 Sep 2019 06:51:56 GMT""}]","2019-09-20"
"1909.08826","Marino Gran","Alberto Facchini, Carmelo Finocchiaro and Marino Gran","A new Galois structure in the category of internal preorders","24 pages, minor corrections","Theory and Applications of Categories, Vol. 35, 2020, No. 11,
  326-349",,,"math.CT","http://arxiv.org/licenses/nonexclusive-distrib/1.0/","  Let $\mathsf{PreOrd}(\mathbb C)$ be the category of internal preorders in an
exact category $\mathbb C$. We show that the pair $(\mathsf{Eq}(\mathbb C),
\mathsf{ParOrd}(\mathbb C))$ is a pretorsion theory in $\mathsf{PreOrd}(\mathbb
C)$, where $\mathsf{Eq}(\mathbb C)$ and $\mathsf{ParOrd}(\mathbb C)$) are the
full subcategories of internal equivalence relations and of internal partial
orders in $\mathbb C$, respectively. We observe that $\mathsf{ParOrd}(\mathbb
C)$ is a reflective subcategory of $\mathsf{PreOrd}(\mathbb C)$ such that each
component of the unit of the adjunction is a pullback-stable regular
epimorphism. The reflector $F:\mathsf{PreOrd}(\mathbb C)\to
\mathsf{ParOrd}(\mathbb C)$ turns out to have stable units in the sense of
Cassidy, H\'ebert and Kelly, thus inducing an admissible categorical Galois
structure. In particular, when $\mathbb C$ is the category $\mathsf{Set}$ of
sets, we show that this reflection induces a monotone-light factorization
system (in the sense of Carboni, Janelidze, Kelly and Par\'e) in
$\mathsf{PreOrd}(\mathsf{Set})$. A topological interpretation of our results in
the category of Alexandroff-discrete spaces is also given, via the well-known
isomorphism between this latter category and $\mathsf{PreOrd}(\mathsf{Set})$.
","[{""version"":""v1"",""created"":""Thu, 19 Sep 2019 06:53:44 GMT""},{""version"":""v2"",""created"":""Fri, 6 Mar 2020 13:24:10 GMT""}]","2020-03-09"
"1909.08827","Takeshi Araki","Takeshi Araki, Kento Asai, Joe Sato, Takashi Shimomura","Low scale seesaw models for low scale $U(1)_{L_\mu-L_\tau}$ symmetry","23 pages, 5 figures; v2: references added, minor changes, accepted
  for publication in PRD","Phys. Rev. D 100, 095012 (2019)","10.1103/PhysRevD.100.095012",,"hep-ph","http://arxiv.org/licenses/nonexclusive-distrib/1.0/","  We propose models for neutrino masses and mixing in the framework of low
scale $U(1)_{L_\mu-L_\tau}$ gauge extension of the standard model. The models
are designed to spontaneously break $U(1)_{L_\mu-L_\tau}$ so that the
$U(1)_{L_\mu-L_\tau}$ gauge boson acquires an MeV scale mass, which is required
to solve the long-standing problem of muon anomalous magnetic moment. Tiny
neutrino masses are obtained by simultaneously invoking the linear and the
inverse seesaw mechanism, and we succeed in realizing two types of one-zero
textures in the active neutrino mass matrix. Both of the obtained textures
favor inverted neutrino mass ordering and are testable in next generation
experiments of neutrinoless double beta decay. We also show that some of extra
scalar bosons can have MeV scale masses and would have significant impacts on
observations of high energy cosmic neutrinos.
","[{""version"":""v1"",""created"":""Thu, 19 Sep 2019 07:02:51 GMT""},{""version"":""v2"",""created"":""Thu, 14 Nov 2019 06:47:40 GMT""}]","2019-11-20"
"1909.08828","Peng Luo","Peng Luo, Shuangjie Peng and Shusen Yan","Excited states on Bose-Einstein condensates with attractive interactions","34 pages",,,,"math.AP","http://arxiv.org/licenses/nonexclusive-distrib/1.0/","  We study the Bose-Einstein condensates (BEC) in two or three dimensions with
attractive interactions, described by $L^{2}$ constraint Gross-Pitaevskii
energy functional. First, we give the precise description of the chemical
potential of the condensate $\mu$ and the attractive interaction $a$. Next, for
a class of degenerated trapping potential with non-isolated critical points, we
obtain the existence and the local uniqueness of excited states by precise
analysis of the concentrated points and the Lagrange multiplier.
  To our best knowledge, this is the first result concerning on excited states
of BEC in Mathematics. Also, our results show that $ka_*$ are critical values
in two dimension when the concentration occurs for any positive integer $k$
with some positive constant $a_*$. And we point out that our results on
degenerated trapping potential with non-isolated critical points are also new
even for the classical Schr\""odinger equations. Here our main tools are
finite-dimensional reduction and various Pohozave identities. The main
difficulties come from the estimates on Lagrange multiplier and the different
degenerate rate along different directions at the critical points of $V(x)$.
","[{""version"":""v1"",""created"":""Thu, 19 Sep 2019 07:04:08 GMT""}]","2019-09-20"
"1909.08829","Mohamed Saidi","Mohamed Saidi and Akio Tamagawa","The $m$-step solvable anabelian geometry of number fields","Final version, to appear in Crelle journal",,,,"math.NT math.AG","http://arxiv.org/licenses/nonexclusive-distrib/1.0/","  Given a number field $K$ and an integer $m\geq 0$, let $K_m$ denote the
maximal $m$-step solvable Galois extension of $K$ and write $G_K^m$ for the
maximal $m$-step solvable Galois group Gal$(K_m/K)$ of $K$. In this paper, we
prove that the isomorphy type of $K$ is determined by the isomorphy type of
$G_K^3$. Further, we prove that $K_m/K$ is determined functorially by
$G_K^{m+3}$ (resp. $G_K^{m+4}$) for $m\geq 2$ (resp. $m \leq 1$). This is a
substantial sharpening of a famous theorem of Neukirch and Uchida. A key step
in our proof is the establishment of the so-called local theory, which in our
context characterises group-theoretically the set of decomposition groups (at
nonarchimedean primes) in $G_K^m$, starting from $G_K^{m+2}$.
","[{""version"":""v1"",""created"":""Thu, 19 Sep 2019 07:05:05 GMT""},{""version"":""v2"",""created"":""Tue, 19 Apr 2022 12:13:41 GMT""}]","2022-04-20"
"1909.08830","Sekitoshi Kanai","Sekitoshi Kanai, Yasutoshi Ida, Yasuhiro Fujiwara, Masanori Yamada,
  Shuichi Adachi","Absum: Simple Regularization Method for Reducing Structural Sensitivity
  of Convolutional Neural Networks","16 pages, 39 figures",,,,"stat.ML cs.CV cs.LG","http://arxiv.org/licenses/nonexclusive-distrib/1.0/","  We propose Absum, which is a regularization method for improving adversarial
robustness of convolutional neural networks (CNNs). Although CNNs can
accurately recognize images, recent studies have shown that the convolution
operations in CNNs commonly have structural sensitivity to specific noise
composed of Fourier basis functions. By exploiting this sensitivity, they
proposed a simple black-box adversarial attack: Single Fourier attack. To
reduce structural sensitivity, we can use regularization of convolution filter
weights since the sensitivity of linear transform can be assessed by the norm
of the weights. However, standard regularization methods can prevent
minimization of the loss function because they impose a tight constraint for
obtaining high robustness. To solve this problem, Absum imposes a loose
constraint; it penalizes the absolute values of the summation of the parameters
in the convolution layers. Absum can improve robustness against single Fourier
attack while being as simple and efficient as standard regularization methods
(e.g., weight decay and L1 regularization). Our experiments demonstrate that
Absum improves robustness against single Fourier attack more than standard
regularization methods. Furthermore, we reveal that robust CNNs with Absum are
more robust against transferred attacks due to decreasing the common
sensitivity and against high-frequency noise than standard regularization
methods. We also reveal that Absum can improve robustness against
gradient-based attacks (projected gradient descent) when used with adversarial
training.
","[{""version"":""v1"",""created"":""Thu, 19 Sep 2019 07:05:14 GMT""}]","2019-09-20"
"1909.08831","Boris Kopeliovich","B. Z. Kopeliovich, Jan Nemchik, I. K. Potashnikova, Ivan Schmidt","Distinctive features of hadronizing heavy quarks","5 pages, 4 figures",,,,"hep-ph nucl-th","http://arxiv.org/licenses/nonexclusive-distrib/1.0/","  The color field of a quark, stripped off in a hard reaction, is regenerated
via gluon radiation. The space-time development of a jet is controlled by the
coherence time of gluon radiation, which for heavy quarks is subject to the
dead-cone effect, suppressing gluons with small transverse momenta. As a
result, heavy quarks can radiate only a small fraction of the initial energy.
This explains the peculiar shape of the measured heavy quark fragmentation
function, which strongly peaks at large fractional momenta z. The fragmentation
length distribution, related to the fragmentation function in a model
independent way, turns out to be concentrated at distances much shorter than
the confinement radius. This implies that the mechanisms of heavy quark
fragmentation is pure perturbative.
","[{""version"":""v1"",""created"":""Thu, 19 Sep 2019 07:13:10 GMT""}]","2019-09-20"
"1909.08832","Marc Kesseb\""ohmer","Marc Kesseb\""ohmer, Aljoscha Niemann, Tony Samuel, Hendrik Weyer","Generalised Krein-Feller operators and gap diffusions via
  transformations of measure spaces","20 pages, 4 figures",,,,"math.FA math.PR math.SP","http://arxiv.org/licenses/nonexclusive-distrib/1.0/","  We consider the generalised Kre\u{\i}n-Feller operator $\Delta_{\nu, \mu} $
with respect to compactly supported Borel probability measures $\mu$ and $\nu$
with the natural restrictions that $\mu$ is atomless, the
$\mathrm{supp}(\nu)\subseteq\mathrm{supp}(\mu)$ and the atoms of $\nu $ are
embedded in the $\mathrm{supp}(\mu)$. We show that the solutions of the
eigenvalue problem for $\Delta_{\nu, \mu} $ can be transferred to the
corresponding problem for the classical Kre\u{\i}n-Feller operator $\Delta_{\nu
\circ F_{\mu}^{-1}, \Lambda}$ with respect to the Lebesgue measure $\Lambda$
via an isometric isomorphism determined by the distribution function of $\mu$.
In this way, we obtain a new characterisation of the upper spectral dimension
and consolidate many known results on the spectral asymptotics of
Kre\u{\i}n-Feller operators. We also recover known properties of and
connections to generalised gap diffusions associated to theses operators.
","[{""version"":""v1"",""created"":""Thu, 19 Sep 2019 07:15:05 GMT""},{""version"":""v2"",""created"":""Thu, 28 Nov 2019 08:38:29 GMT""},{""version"":""v3"",""created"":""Fri, 22 Oct 2021 10:19:37 GMT""},{""version"":""v4"",""created"":""Fri, 16 Sep 2022 09:28:55 GMT""}]","2022-09-19"
"1909.08833","Mustafa Can Gursoy","Mustafa Can Gursoy, H. Birkan Yilmaz, Ali Emre Pusane, Tuna Tugcu","Simulation Study and Analysis of Diffusive Molecular Communications with
  an Apertured Plane","9 pages, 11 figures, accepted to IEEE Transactions on NanoBioscience
  (post-print, before publishing)",,"10.1109/TNB.2020.2986998",,"cs.ET","http://arxiv.org/licenses/nonexclusive-distrib/1.0/","  Molecular communication via diffusion (MCvD) is a method of achieving nano-
and micro-scale connectivity by utilizing the free diffusion mechanism of
information molecules. The randomness in diffusive propagation is the main
cause of inter-symbol interference (ISI) and the limiting factor of high data
rate MCvD applications. In this paper, an apertured plane is considered between
the transmitter and the receiver of an MCvD link. Either after being
artificially placed or occurring naturally, surfaces or volumes that resemble
an apertured plane only allow a fraction of the molecules to pass. Contrary to
intuition, it is observed that such topology may improve communication
performance, given the molecules that can pass through the aperture are the
ones that take more directed paths towards the receiver. Furthermore, through
both computer simulations and a theoretical signal evaluation metric named
signal-to-interference and noise amplitude ratio (SINAR), it is found that the
size of the aperture imposes a trade-off between the received signal power and
the ISI combating capability of an MCvD system, hinting to an optimal aperture
size that minimizes the bit error rate (BER). It is observed that the trend of
BER is accurately mirrored by SINAR, suggesting the proposed metric's
applicability to optimization tasks in MCvD systems, including finding the
optimal aperture size of an apertured plane. In addition, computer simulations
and SINAR show that said optimal aperture size is affected by the location of
the aperture and the bit rate. Lastly, the paper analyzes the effects of radial
and angular offsets in the placement of the apertured plane, and finds that a
reduction in BER is still in effect up to certain offset values. Overall, our
results imply that apertured plane-like surfaces may actually help
communication efficiency, even though they reduce the received signal power.
","[{""version"":""v1"",""created"":""Thu, 19 Sep 2019 07:17:36 GMT""},{""version"":""v2"",""created"":""Tue, 7 Apr 2020 21:51:13 GMT""}]","2020-04-09"
"1909.08834","Inge S. Helland","Inge S. Helland","When is a set of questions to nature together with sharp answers to
  those questions in one-to-one correspondence with a set of quantum states?","10 pages. arXiv admin note: text overlap with arXiv:1905.06592,
  arXiv:1507.07701",,,,"quant-ph","http://arxiv.org/licenses/nonexclusive-distrib/1.0/","  A general question is posed to the quantum community. Partial results are
formulated in a self-contained way. In particular, the title question is
answered affirmatorily in two cases: 1) The case of spin/ angular momentum of a
partcle; 2) A general symmetry situation under certain technical assumptions.
","[{""version"":""v1"",""created"":""Thu, 19 Sep 2019 07:26:08 GMT""},{""version"":""v2"",""created"":""Mon, 23 Sep 2019 06:34:22 GMT""}]","2019-09-24"
"1909.08835","Ali Akbar Arefijamaal","Fahimeh Arabyani Neyshaburi, Ali Akbar Arefijamaal","Weaving Hilbert Space Frames and Duality",,,,,"math.FA","http://arxiv.org/licenses/nonexclusive-distrib/1.0/","  Weaving Hilbert space frames have been introduced recently by Bemrose et al.
to deal with some problems in distributed signal processing. In this paper, we
survey this topic from the viewpoint of the duality principle, so we obtain new
properties in weaving frame theory related to dual frames. Specifically, we
give some sufficient conditions under which a frame with its canonical dual,
alternate duals or approximate duals constitute some concrete pairs of woven
frames. Moreover, we survey the stability of weaving frames under perturbations
and different operators.
","[{""version"":""v1"",""created"":""Thu, 19 Sep 2019 07:29:15 GMT""}]","2019-09-20"
"1909.08836","Jun Liu","Jun Liu, Yurong You, Ivan Batashev, Yuanyuan Gong, Xinmin You, Bowei
  Huang, Fengqi Zhang, Xuefei Miao, Feng Xu, Niels van Dijk, Ekkes Br\""uck","Design of reversible low-field magnetocaloric effect at room temperature
  in hexagonal MnMX ferromagnets","21 pages, 9 figures","Phys. Rev. Applied 13, 054003 (2020)","10.1103/PhysRevApplied.13.054003",,"cond-mat.mtrl-sci","http://arxiv.org/licenses/nonexclusive-distrib/1.0/","  Giant magnetocaloric effect is widely achieved in hexagonal MnMX-based (M =
Co or Ni, X = Si or Ge) ferromagnets at their first-order magnetostructural
transition. However, the thermal hysteresis and the low sensitivity of the
magnetostructural transition to the magnetic field inevitably lead to a
sizeable irreversibility of the low-field magnetocaloric effect. In this work,
we show an alternative way to realize a reversible low-field magnetocaloric
effect in MnMX-based alloys by taking advantage of the second-order phase
transition. With introducing Cu into Co in MnCoGe alloy, the martensitic
transition is stabilized at high temperature, while the Curie temperature of
the orthorhombic phase is reduced to room temperature. As a result, a
second-order magnetic transition with negligible thermal hysteresis and a large
magnetization change can be observed, enabling a large reversible
magnetocaloric effect. By both calorimetric and direct measurements, a
reversible adiabatic temperature change of about 1 K is obtained under a field
change of 0-1 T at 304 K, which is larger than that obtained in a first-order
magnetostructural transition. To get a better insight into the origin of these
experimental results, first-principles calculations are carried out to
characterize the chemical bonds and the magnetic exchange interaction. Our work
provides a new understanding of the MnCoGe alloy and indicates a feasible route
to improve the reversibility of the low-field magnetocaloric effect in the MnMX
system.
","[{""version"":""v1"",""created"":""Thu, 19 Sep 2019 07:36:02 GMT""}]","2020-05-06"
"1909.08837","Shen Gao","Shen Gao, Xiuying Chen, Piji Li, Zhangming Chan, Dongyan Zhao, Rui Yan","How to Write Summaries with Patterns? Learning towards Abstractive
  Summarization through Prototype Editing","EMNLP 2019. Dataset available at
  https://github.com/gsh199449/proto-summ",,,,"cs.CL","http://creativecommons.org/licenses/by/4.0/","  Under special circumstances, summaries should conform to a particular style
with patterns, such as court judgments and abstracts in academic papers. To
this end, the prototype document-summary pairs can be utilized to generate
better summaries. There are two main challenges in this task: (1) the model
needs to incorporate learned patterns from the prototype, but (2) should avoid
copying contents other than the patternized words---such as irrelevant
facts---into the generated summaries. To tackle these challenges, we design a
model named Prototype Editing based Summary Generator (PESG). PESG first learns
summary patterns and prototype facts by analyzing the correlation between a
prototype document and its summary. Prototype facts are then utilized to help
extract facts from the input document. Next, an editing generator generates new
summary based on the summary pattern or extracted facts. Finally, to address
the second challenge, a fact checker is used to estimate mutual information
between the input document and generated summary, providing an additional
signal for the generator. Extensive experiments conducted on a large-scale
real-world text summarization dataset show that PESG achieves the
state-of-the-art performance in terms of both automatic metrics and human
evaluations.
","[{""version"":""v1"",""created"":""Thu, 19 Sep 2019 07:36:54 GMT""}]","2019-09-20"
"1909.08838","Alessandro Palmieri","Wenhui Chen, Alessandro Palmieri","Nonexistence of global solutions for the semilinear
  Moore-Gibson-Thompson equation in the conservative case",,,"10.3934/dcds.2020236",,"math.AP","http://arxiv.org/licenses/nonexclusive-distrib/1.0/","  In this work, the Cauchy problem for the semilinear Moore-Gibson-Thompson
(MGT) equation with power nonlinearity $|u|^p$ on the right-hand side is
studied. Applying $L^2-L^2$ estimates and a fixed point theorem, we obtain
local (in time) existence of solutions to the semilinear MGT equation. Then,
the blow-up of local in time solutions is proved by using an iteration method,
under certain sign assumption for initial data, and providing that the exponent
of the power of the nonlinearity fulfills $1 < p \leqslant p_{\mathrm{Str}}(n)$
for $n \geqslant2$ and $p>1$ for $n=1$. Here the Strauss exponent
$p_{\mathrm{Str}}(n)$ is the critical exponent for the semilinear wave equation
with power nonlinearity. In particular, in the limit case
$p=p_{\mathrm{Str}}(n)$ a different approach with a weighted space average of a
local in time solution is considered.
","[{""version"":""v1"",""created"":""Thu, 19 Sep 2019 07:44:38 GMT""},{""version"":""v2"",""created"":""Wed, 6 Nov 2019 15:38:39 GMT""}]","2020-06-11"
"1909.08839","Irawan Nurhas","Irawan Nurhas, Jan Pawlowski, Stefan Geisler","Towards humane digitization: a wellbeing-driven process of personas
  creation","8 Pages, CHIuXiD '19: Proceedings of the 5th International ACM
  In-Cooperation HCI and UX Conference",,"10.1145/3328243.3328247",,"cs.HC cs.CY","http://arxiv.org/licenses/nonexclusive-distrib/1.0/","  Digital transformation is a process of digitizing the working and living
environment in which people are at the center of digitization. In this paper,
we present a personas-based guideline for system developers on how the
humanization of digital transformation integrates into the design process. The
proposed guideline uses the positive personas from the beginning as a basis for
the transformation of the working environment into the digital form. We used
the literature research as a preliminary study for the process of
wellbeing-driven digital transformation design, consisting of questions for
structuring the required information in the positive personas as well as a
potential method that could be integrated into the wellbeing-based design
process.
","[{""version"":""v1"",""created"":""Thu, 19 Sep 2019 07:55:17 GMT""}]","2019-09-20"
"1909.08840","Lamberto Ballan","Matteo Lisotto, Pasquale Coscia, Lamberto Ballan","Social and Scene-Aware Trajectory Prediction in Crowded Spaces","Accepted to ICCV 2019 Workshop on Assistive Computer Vision and
  Robotics (ACVR)",,,,"cs.CV","http://arxiv.org/licenses/nonexclusive-distrib/1.0/","  Mimicking human ability to forecast future positions or interpret complex
interactions in urban scenarios, such as streets, shopping malls or squares, is
essential to develop socially compliant robots or self-driving cars. Autonomous
systems may gain advantage on anticipating human motion to avoid collisions or
to naturally behave alongside people. To foresee plausible trajectories, we
construct an LSTM (long short-term memory)-based model considering three
fundamental factors: people interactions, past observations in terms of
previously crossed areas and semantics of surrounding space. Our model
encompasses several pooling mechanisms to join the above elements defining
multiple tensors, namely social, navigation and semantic tensors. The network
is tested in unstructured environments where complex paths emerge according to
both internal (intentions) and external (other people, not accessible areas)
motivations. As demonstrated, modeling paths unaware of social interactions or
context information, is insufficient to correctly predict future positions.
Experimental results corroborate the effectiveness of the proposed framework in
comparison to LSTM-based models for human path prediction.
","[{""version"":""v1"",""created"":""Thu, 19 Sep 2019 08:03:02 GMT""}]","2019-09-20"
"1909.08841","Xi-Wen Guan","Li Peng, Yicong Yu, Xi-Wen Guan","Gr\""uneisen parameters for Lieb-Liniger and Yang-Gaudin models","6 figures, 13 pages","Physical Review B 100, 245435 (2019)","10.1103/PhysRevB.100.245435",,"cond-mat.quant-gas","http://arxiv.org/licenses/nonexclusive-distrib/1.0/","  Using the Bethe ansatz solution, we analytically study expansionary, magnetic
and interacting Gr\""uneisen parameters (GPs) for one-dimensional (1D)
Lieb-Liniger and Yang-Gaudin models. These different GPs elegantly quantify the
dependences of characteristic energy scales of these quantum gases on the
volume, the magnetic field and the interaction strength, revealing the caloric
effects resulted from the variations of these potentials. The obtained GPs
further confirm an identity which is incurred by the symmetry of the thermal
potential. We also present universal scaling behavior of these GPs in the
vicinities of the quantum critical points driven by different potentials. The
divergence of the GPs not only provides an experimental identification of
non-Fermi liquid nature at quantum criticality but also elegantly determine low
temperature phases of the quantum gases. Moreover, the pairing and depairing
features in the 1D attractive Fermi gases can be captured by the magnetic and
interacting GPs, facilitating experimental observation of quantum phase
transitions. Our results open to further study the interaction- and
magnetic-field-driven quantum refrigeration and quantum heat engine in quantum
gases of ultracold atoms.
","[{""version"":""v1"",""created"":""Thu, 19 Sep 2019 08:05:50 GMT""}]","2020-08-10"
