"1906.06909","L\'eo Cances","Leo Cances, Patrice Guyot, Thomas Pellegrini","Evaluation of post-processing algorithms for polyphonic sound event
  detection","5 pages, 2 figures, 1 table 2019 IEEE Workshop on Applications of
  Signal Processing to Audio and Acoustics",,,,"eess.AS cs.SD","http://arxiv.org/licenses/nonexclusive-distrib/1.0/","  Sound event detection (SED) aims at identifying audio events (audio tagging
task) in recordings and then locating them temporally (localization task). This
last task ends with the segmentation of the frame-level class predictions, that
determines the onsets and offsets of the audio events. Yet, this step is often
overlooked in scientific publications. In this paper, we focus on the
post-processing algorithms used to identify the audio event boundaries.
Different post-processing steps are investigated, through smoothing,
thresholding, and optimization. In particular, we evaluate different approaches
for temporal segmentation, namely statistic-based and parametric methods.
Experiments are carried out on the DCASE 2018 challenge task 4 data. We
compared post-processing algorithms on the temporal prediction curves of two
models: one based on the challenge's baseline and a Multiple Instance Learning
(MIL) model. Results show the crucial impact of the post-processing methods on
the final detection score. Statistic-based methods yield a 22.9% event-based
F-score on the evaluation set with our MIL model. Moreover, the best results
were obtained using class-dependent parametric methods with 32.0% F-score.
","[{""version"":""v1"",""created"":""Mon, 17 Jun 2019 09:13:13 GMT""},{""version"":""v2"",""created"":""Mon, 24 Jun 2019 09:38:26 GMT""}]","2019-06-25"
"1906.06910","Antonio Garufi","A. Garufi, L. Podio, F. Bacciotti, S. Antoniucci, A. Boccaletti, C.
  Codella, C. Dougados, F. Menard, D. Mesa, M. Meyer, B. Nisini, H.M. Schmid,
  T. Stolker, J.L. Baudino, B. Biller, M. Bonavita, M. Bonnefoy, F.
  Cantalloube, G. Chauvin, A. Cheetham, S. Desidera, V. D'Orazi, M. Feldt, R.
  Galicher, A. Grandjean, R. Gratton, J. Hagelberg, A.M. Lagrange, M. Langlois,
  J. Lannier, C. Lazzoni, A.L. Maire, C. Perrot, E. Rickman, T. Schmidt, A.
  Vigan, A. Zurlo, A. Delboulbe, D. Le Mignant, D. Fantinel, O.
  Moeller-Nilsson, L. Weber, J.-F. Sauvage","The SPHERE view of the jet and the envelope of RY Tau","15 pages, 9 figures. Accepted for publication by A\&A","A&A 628, A68 (2019)","10.1051/0004-6361/201935546",,"astro-ph.SR astro-ph.EP astro-ph.GA","http://arxiv.org/licenses/nonexclusive-distrib/1.0/","  Jets are rarely associated with pre-main-sequence intermediate-mass stars.
Optical and near-IR observations of jet-driving sources are often hindered by
the presence of a natal envelope. Jets around partly embedded sources are a
useful diagnostic to constrain the geometry of the concealed protoplanetary
disk. In fact, the jet-driving mechanisms are affected by both spatial
anisotropies and episodic variations at the (sub-)au scale from the star. We
obtained a rich set of high-contrast VLT/SPHERE observations from 0.6 micron to
2.2 micron of the young intermediate-mass star RY Tau. Given the proximity to
the Sun of this source, our images have the highest spatial resolution ever
obtained for an atomic jet. Optical observations in polarized light show no
sign of the protoplanetary disk detected by ALMA. Instead, we observed a
diffuse signal resembling a remnant envelope with an outflow cavity. The jet is
detected in four spectral lines. The jet appears to be wiggling and its radial
width increasing with the distance is complementary to the shape of the outflow
cavity suggesting a strong jet/envelope interaction. Through the estimated
tangential velocity, we revealed a possible connection between the launching
time of the jet sub-structures and the stellar activity of RY Tau. RY Tau is at
an intermediate stage toward the dispersal of the natal envelope. This source
shows episodic increases of mass accretion/ejection similarly to other known
intermediate-mass stars. The amount of observed jet wiggle is consistent with
the presence of a precessing disk warp or misaligned inner disk that would be
induced by an unseen planetary/sub-stellar companion at sub-/few-au scales. The
high disk mass of RY Tau and of two other jet-driving intermediate-mass stars,
HD163296 and MWC480, suggests that massive, full disks are more efficient at
launching prominent jets.
","[{""version"":""v1"",""created"":""Mon, 17 Jun 2019 09:13:14 GMT""}]","2019-08-14"
"1906.06911","Anton Andreychuk","Konstantin Yakovlev, Anton Andreychuk, Juliya Belinskaya and Dmitry
  Makarov","Combining Safe Interval Path Planning and Constrained Path Following
  Control: Preliminary Results","Camera-ready version of the paper as submitted to ICR'19",,,,"cs.RO math.OC","http://arxiv.org/licenses/nonexclusive-distrib/1.0/","  We study the navigation problem for a robot moving amidst static and dynamic
obstacles and rely on a hierarchical approach to solve it. First, the reference
trajectory is planned by the safe interval path planning algorithm that is
capable of handling any-angle translations and rotations. Second, the path
following problem is treated as the constrained control problem and the
original flatness-based approach is proposed to generate control. We suggest a
few enhancements for the path planning algorithm aimed at finding trajectories
that are more likely to be followed by a robot without collisions. Results of
the conducted experimental evaluation show that the number of successfully
solved navigation instances significantly increases when using the suggested
techniques.
","[{""version"":""v1"",""created"":""Mon, 17 Jun 2019 09:19:40 GMT""}]","2019-06-18"
"1906.06912","Riccardo Longo","Riccardo Longo and Massimiliano Sala","Public Ledger for Sensitive Data","21 pages Second version with extended explanations, construction and
  proofs updated and generalised to asymmetric pairings, compatible with the
  more secure and efficient type-3 pairings, simplified and streamlined
  construction of the static ledger",,,,"cs.CR","http://arxiv.org/licenses/nonexclusive-distrib/1.0/","  Satoshi Nakamoto's Blockchain allows to build publicly verifiable and almost
immutable ledgers, but sometimes privacy has to be factored in.
  In this work an original protocol is presented that allows sensitive data to
be stored on a ledger where its integrity may be publicly verified, but its
privacy is preserved and owners can tightly manage the sharing of their
information with efficient revocation.
","[{""version"":""v1"",""created"":""Mon, 17 Jun 2019 09:25:19 GMT""},{""version"":""v2"",""created"":""Thu, 9 Jul 2020 13:55:13 GMT""}]","2020-07-10"
"1906.06913","Hilmi Volkan Demir","Nima Taghipour, Savas Delikanli, Sushant Shendre, Mustafa Sak, Mingjie
  Li, Furkan Isik, Ibrahim Tanriover, Burak Guzelturk, Tze Chien Sum and Hilmi
  Volkan Demir","Sub-single exciton optical gain threshold in colloidal semiconductor
  quantum wells with gradient alloy shelling",,,"10.1038/s41467-020-17032-8",,"physics.app-ph cond-mat.mes-hall cond-mat.mtrl-sci","http://arxiv.org/licenses/nonexclusive-distrib/1.0/","  Colloidal semiconductor quantum wells have emerged as a promising material
platform for use in solution-processable light-generation including colloidal
lasers. However, application relying on their optical gain suffer from a
fundamental complication due to multi-excitonic nature of light amplification
in common II-VI semiconductor nanocrystals. This undesirably increases the
optical gain threshold and shortens the net gain lifetime because of fast
nonradiative Auger decay. Here, we demonstrate sub-single exciton level of
optical gain threshold in specially engineered CdSe/CdS@CdZnS
core/crown@gradient alloyed shell colloidal quantum wells. This sub-single
exciton ensemble-averaged gain threshold of Ng = 0.80 (per particle) resulting
from impeded Auger recombination along with a large absorption cross-section of
quantum wells enables us to observe the amplified spontaneous emission starting
at a low pump fluence of 800 nJ cm-2, at least three-folds better than the
previously best reported values among all colloidal semiconductor nanocrystals.
Moreover, long optical gain lifetimes of 800 ps accompanied with modal gain
coefficients of 2,000 cm-1 are achieved. Finally, using these gradient shelled
quantum wells, we show a vertical cavity surface-emitting colloidal laser
operating at an ultralow lasing threshold of 7.5 micro-joule cm-2. These
results represent a significant step towards the realization of
solution-processable electrically-driven colloidal lasers.
","[{""version"":""v1"",""created"":""Mon, 17 Jun 2019 09:26:32 GMT""}]","2020-08-26"
"1906.06914","Guillaume Dehaene P.","Alexander Immer and Guillaume P. Dehaene","Variational Inference with Numerical Derivatives: variance reduction
  through coupling","Under review (NEURIPS 2019)",,,,"stat.CO stat.ML","http://arxiv.org/licenses/nonexclusive-distrib/1.0/","  The Black Box Variational Inference (Ranganath et al. (2014)) algorithm
provides a universal method for Variational Inference, but taking advantage of
special properties of the approximation family or of the target can improve the
convergence speed significantly. For example, if the approximation family is a
transformation family, such as a Gaussian, then switching to the
reparameterization gradient (Kingma and Welling (2014)) often yields a major
reduction in gradient variance. Ultimately, reducing the variance can reduce
the computational cost and yield better approximations.
  We present a new method to extend the reparameterization trick to more
general exponential families including the Wishart, Gamma, and Student
distributions. Variational Inference with Numerical Derivatives (VIND)
approximates the gradient with numerical derivatives and reduces its variance
using a tight coupling of the approximation family. The resulting algorithm is
simple to implement and can profit from widely known couplings. Our experiments
confirm that VIND effectively decreases the gradient variance and therefore
improves the posterior approximation in relevant cases. It thus provides an
efficient yet simple Variational Inference method for computing non-Gaussian
approximations.
","[{""version"":""v1"",""created"":""Mon, 17 Jun 2019 09:30:29 GMT""}]","2019-06-18"
"1906.06915","Mathias Schacht","Dennis Clemens, Meysam Miralaei, Damian Reding, Mathias Schacht,
  Anusch Taraz","On the size-Ramsey number of grid graphs","21 pages, second version addresses changes arising from the referee
  report and comments from Thomas Lesgourgues",,"10.1017/S0963548320000322",,"math.CO","http://arxiv.org/licenses/nonexclusive-distrib/1.0/","  The size-Ramsey number of a graph $F$ is the smallest number of edges in a
graph $G$ with the Ramsey property for $F$, that is, with the property that any
2-colouring of the edges of $G$ contains a monochromatic copy of $F$. We prove
that the size-Ramsey number of the grid graph on $n\times n$ vertices is
bounded from above by $n^{3+o(1)}$.
","[{""version"":""v1"",""created"":""Mon, 17 Jun 2019 09:32:02 GMT""},{""version"":""v2"",""created"":""Tue, 26 May 2020 11:42:51 GMT""}]","2021-07-01"
"1906.06916","Lixiang Hong","Lixiang Hong, JinJian Lin, Jiang Tao and Jianyang Zeng","BERE: An accurate distantly supervised biomedical entity relation
  extraction network","My tutor told me to withdraw this paper at once",,,,"cs.CL","http://arxiv.org/licenses/nonexclusive-distrib/1.0/","  Automated entity relation extraction (RE) from literature provides an
important source for constructing biomedical database, which is more efficient
and extensible than manual curation. However, existing RE models usually ignore
the information contained in sentence structures and target entities. In this
paper, we propose BERE, a deep learning based model which uses Gumbel Tree-GRU
to learn sentence structures and joint embedding to incorporate entity
information. It also employs word-level attention for improved relation
extraction and sentence-level attention to suit the distantly supervised
dataset. Because the existing dataset are relatively small, we further
construct a much larger drug-target interaction extraction (DTIE) dataset by
distant supervision. Experiments conducted on both DDIExtraction 2013 task and
DTIE dataset show our model's effectiveness over state-of-the-art baselines in
terms of F1 measures and PR curves.
","[{""version"":""v1"",""created"":""Mon, 17 Jun 2019 09:33:27 GMT""},{""version"":""v2"",""created"":""Sat, 22 Jun 2019 15:58:54 GMT""}]","2019-06-25"
"1906.06917","Momchil Hardalov","Daniel Kopev, Dimitrina Zlatkova, Kristiyan Mitov, Atanas Atanasov,
  Momchil Hardalov, Ivan Koychev, Preslav Nakov","Recursive Style Breach Detection with Multifaceted Ensemble Learning","Accepted as regular paper at AIMSA 2018",,"10.1007/978-3-319-99344-7_12",,"cs.CL cs.LG","http://creativecommons.org/licenses/by/4.0/","  We present a supervised approach for style change detection, which aims at
predicting whether there are changes in the style in a given text document, as
well as at finding the exact positions where such changes occur. In particular,
we combine a TF.IDF representation of the document with features specifically
engineered for the task, and we make predictions via an ensemble of diverse
classifiers including SVM, Random Forest, AdaBoost, MLP, and LightGBM. Whenever
the model detects that style change is present, we apply it recursively,
looking to find the specific positions of the change. Our approach powered the
winning system for the PAN@CLEF 2018 task on Style Change Detection.
","[{""version"":""v1"",""created"":""Mon, 17 Jun 2019 09:33:30 GMT""}]","2019-06-18"
"1906.06918","Viji Thomas","Ammu. E. Antony, Komma Patali, Viji. Z. Thomas","On the Exponent of the Schur Multiplier","37 pages. arXiv admin note: text overlap with arXiv:1906.09585",,,,"math.GR","http://arxiv.org/licenses/nonexclusive-distrib/1.0/","  A longstanding problem attributed to I. Schur says that for a finite group
$G$, the exponent of the second homology group $H_2(G, \mathbb{Z})$ divides the
exponent of $G$. In this paper, we prove this conjecture for finite nilpotent
groups of odd exponent and of nilpotency class 5, $p$-central metabelian $p$
groups, and groups considered by L. E . Wilson in \cite{LEW}. Moreover, we
improve several bounds given by various authors.
","[{""version"":""v1"",""created"":""Mon, 17 Jun 2019 09:35:21 GMT""},{""version"":""v2"",""created"":""Wed, 19 Jun 2019 11:59:02 GMT""}]","2019-09-11"
"1906.06919","Shuyu Cheng","Shuyu Cheng, Yinpeng Dong, Tianyu Pang, Hang Su, Jun Zhu","Improving Black-box Adversarial Attacks with a Transfer-based Prior","NeurIPS 2019; Code available at
  https://github.com/thu-ml/Prior-Guided-RGF",,,,"cs.LG cs.CR cs.CV stat.ML","http://arxiv.org/licenses/nonexclusive-distrib/1.0/","  We consider the black-box adversarial setting, where the adversary has to
generate adversarial perturbations without access to the target models to
compute gradients. Previous methods tried to approximate the gradient either by
using a transfer gradient of a surrogate white-box model, or based on the query
feedback. However, these methods often suffer from low attack success rates or
poor query efficiency since it is non-trivial to estimate the gradient in a
high-dimensional space with limited information. To address these problems, we
propose a prior-guided random gradient-free (P-RGF) method to improve black-box
adversarial attacks, which takes the advantage of a transfer-based prior and
the query information simultaneously. The transfer-based prior given by the
gradient of a surrogate model is appropriately integrated into our algorithm by
an optimal coefficient derived by a theoretical analysis. Extensive experiments
demonstrate that our method requires much fewer queries to attack black-box
models with higher success rates compared with the alternative state-of-the-art
methods.
","[{""version"":""v1"",""created"":""Mon, 17 Jun 2019 09:40:32 GMT""},{""version"":""v2"",""created"":""Wed, 30 Oct 2019 07:56:53 GMT""},{""version"":""v3"",""created"":""Sun, 26 Jul 2020 14:00:51 GMT""}]","2020-07-28"
"1906.06920","Ganapathy Vaitheeswaran","S. Mondal, G. Vaitheeswaran, and Daniel Errandonea","Structural, vibrational, and electronic properties of TlReO4 studied
  using a first principles approach",,,,,"cond-mat.mtrl-sci","http://arxiv.org/licenses/nonexclusive-distrib/1.0/","  Present work provides extensive DFT study of TlReO4 using pseudopotential
approach for understanding the structural and vibrational properties and
full-potential linearized augmented plane wave method for electronic band
structure and associated optical properties. Calculated bulk modulus value
29.77 GPa using LDA functional is found to be close to experimental value 26
GPa. The order of elastic constant along the principal axis clearly indicates
the crucial role of Re and O3 atoms in the structural and mechanical properties
of this material. Analysis of Born effective charge (BEC) along with gamma
point phonon frequencies through density functional perturbation approach
(DFPT) have also shown the importance of these atoms. The anisotropic nature of
BEC is mainly found to be contributed due to O3 atoms. An asymmetric stretching
of Re-O3 bond is found to be mainly responsible for high intense IR peak in the
high-frequency range whereas the second most intense peak is due to the
symmetric stretching of these bonds along with the asymmetric stretching of the
Re-O2 bond. To get exact electronic band structure, spin orbit coupling (SOC)
in addition to Tran-Blaha Modified Becke-Johnson (TB-mBJ) potential have been
considered. Inclusion of SOC clearly shows a decreased band gap of 4.71 eV from
TB-mBJ implemented band gap 4.82 eV which mainly attributed to 0.08 eV
splitting of Re d-states. Study of density of states (DOS) reveals that
conduction band bottom (CBB) is mainly made up of Re d-states but main
contribution to valence band top (VBT) is due to oxygen p-states. The bonding
nature of this material has also been addressed using DOS which is further
verified through the electron charge density plot. Though the optical
properties of this material are found to be anisotropic but optical isotropy
can be seen in lower energy value.
","[{""version"":""v1"",""created"":""Mon, 17 Jun 2019 09:41:22 GMT""}]","2019-06-18"
"1906.06921","Md. Helal Ahmed","Md. Helal Ahmed, Jagmohan Tanti, Sumant Pushp","A Public-Key Cryptosystem Using Cyclotomic Matrices",,,,,"cs.CR math.NT","http://arxiv.org/licenses/nonexclusive-distrib/1.0/","  Confidentiality and Integrity are two paramount objectives in the evaluation
of information and communication technology. In this paper, we propose an
arithmetic approach for designing asymmetric key cryptography. Our method is
based on the formulation of cyclotomic matrices correspond to the diophantine
system. The proposed cyclotomic asymmetric cryptosystem (CAC) utilizes the
cyclotomic matrices, whose entries are cyclotomic numbers of order $2l^{2}$,
$l$ be prime over a finite field $\mathbb{F}_{p}$ of $p$ elements. The method
utilize cyclotomic matrices to design a one-way function. The outcome of a
one-way function that is efficient to compute however difficult to compute its
inverse unless if secret data about the trapdoor is known. We demonstrate that
the encryption and decryption can be efficiently performed with asymptotic
complexity of $\mathcal{O}(e^{2.373})$. Besides, we study the computational
complexity of the CAC.
","[{""version"":""v1"",""created"":""Mon, 17 Jun 2019 09:44:15 GMT""},{""version"":""v2"",""created"":""Fri, 15 May 2020 07:36:15 GMT""}]","2020-05-18"
"1906.06922","Laurent Pagnier","Laurent Pagnier and Philippe Jacquod","Optimal placement of inertia and primary control : a matrix perturbation
  theory approach","9 pages, 2 figures","IEEE Access, vol. 7, pp. 145889-145900, 2019","10.1109/ACCESS.2019.2945475",,"math.OC","http://arxiv.org/licenses/nonexclusive-distrib/1.0/","  The increasing penetration of inertialess new renewable energy sources
reduces the overall mechanical inertia available in power grids and accordingly
raises a number of issues of grid stability over short to medium time scales.
It has been suggested that this reduction of overall inertia can be compensated
to some extent by the deployment of substitution inertia - synthetic inertia,
flywheels or synchronous condensers. Of particular importance is to optimize
the placement of the limited available substitution inertia, to mitigate
voltage angle and frequency disturbances following a fault such as an abrupt
power loss. Performance measures in the form of H2-norms have been recently
introduced to evaluate the overall magnitude of such disturbances on an
electric power grid. However, despite the mathematical conveniance of these
measures, analytical results can be obtained only under rather restrictive
assumptions of uniform damping ratio, or homogeneous distribution of inertia
and/or primary control in the system. Here, we introduce matrix perturbation
theory to obtain analytical results for optimal inertia and primary control
placement where both are heterogeneous. Armed with that efficient tool, we
construct two simple algorithms that independently determine the optimal
geographical distribution of inertia and primary control. These algorithms are
then implemented on a model of the synchronous transmission grid of continental
Europe. We find that the optimal distribution of inertia is geographically
homogeneous but that primary control should be mainly located on the slow modes
of the network, where the intrinsic grid dynamics takes more time to damp
frequency disturbances.
","[{""version"":""v1"",""created"":""Mon, 17 Jun 2019 09:50:12 GMT""}]","2021-02-16"
"1906.06923","Thorsten Rasmussen","Thorsten S. Rasmussen, Yi Yu, and Jesper Mork","Suppression of coherence collapse in semiconductor Fano lasers",,"Phys. Rev. Lett. 123, 233904 (2019)","10.1103/PhysRevLett.123.233904",,"physics.optics","http://arxiv.org/licenses/nonexclusive-distrib/1.0/","  We show that semiconductor Fano lasers strongly suppress dynamic
instabilities induced by external optical feedback. A comparison with
conventional Fabry-Perot lasers shows orders of magnitude improvement in
feedback stability, and in many cases even total suppression of coherence
collapse, which is of major importance for applications in integrated
photonics. The laser dynamics are analysed using a generalisation of the
Lang-Kobayashi model for semiconductor lasers with external feedback, and an
analytical expression for the critical feedback level is derived.
","[{""version"":""v1"",""created"":""Mon, 17 Jun 2019 09:54:22 GMT""},{""version"":""v2"",""created"":""Wed, 6 Nov 2019 13:30:15 GMT""}]","2019-12-11"
"1906.06924","Ken Kobayashi","Akinori Tanaka, Akiyoshi Sannai, Ken Kobayashi, Naoki Hamada","Asymptotic Risk of Bezier Simplex Fitting",,,,,"cs.LG stat.ML","http://arxiv.org/licenses/nonexclusive-distrib/1.0/","  The Bezier simplex fitting is a novel data modeling technique which exploits
geometric structures of data to approximate the Pareto front of multi-objective
optimization problems. There are two fitting methods based on different
sampling strategies. The inductive skeleton fitting employs a stratified
subsampling from each skeleton of a simplex, whereas the all-at-once fitting
uses a non-stratified sampling which treats a simplex as a whole. In this
paper, we analyze the asymptotic risks of those B\'ezier simplex fitting
methods and derive the optimal subsample ratio for the inductive skeleton
fitting. It is shown that the inductive skeleton fitting with the optimal ratio
has a smaller risk when the degree of a Bezier simplex is less than three.
Those results are verified numerically under small to moderate sample sizes. In
addition, we provide two complementary applications of our theory: a
generalized location problem and a multi-objective hyper-parameter tuning of
the group lasso. The former can be represented by a Bezier simplex of degree
two where the inductive skeleton fitting outperforms. The latter can be
represented by a Bezier simplex of degree three where the all-at-once fitting
gets an advantage.
","[{""version"":""v1"",""created"":""Mon, 17 Jun 2019 09:56:22 GMT""}]","2019-06-18"
"1906.06925","Johannes Sappl","Johannes Sappl, Laurent Seiler, Matthias Harders, Wolfgang Rauch","Deep Learning of Preconditioners for Conjugate Gradient Solvers in Urban
  Water Related Problems","8 pages, 5 figures, 2 tables",,,,"cs.LG cs.NA math.NA stat.ML","http://arxiv.org/licenses/nonexclusive-distrib/1.0/","  Solving systems of linear equations is a problem occuring frequently in water
engineering applications. Usually the size of the problem is too large to be
solved via direct factorization. One can resort to iterative approaches, in
particular the conjugate gradients method if the matrix is symmetric positive
definite. Preconditioners further enhance the rate of convergence but hitherto
only handcrafted ones requiring expert knowledge have been used. We propose an
innovative approach employing Machine Learning, in particular a Convolutional
Neural Network, to unassistedly design preconditioning matrices specifically
for the problem at hand. Based on an in-depth case study in fluid simulation we
are able to show that our learned preconditioner is able to improve the
convergence rate even beyond well established methods like incomplete Cholesky
factorization or Algebraic MultiGrid.
","[{""version"":""v1"",""created"":""Mon, 17 Jun 2019 09:57:06 GMT""}]","2019-06-18"
