"1906.06826","Renchi Yang","Renchi Yang, Jieming Shi, Xiaokui Xiao, Yin Yang, Sourav S. Bhowmick","Homogeneous Network Embedding for Massive Graphs via Reweighted
  Personalized PageRank","full version of a paper published in PVLDB 2020, Volume 13, Number 5,
  pages 670-683, https://doi.org/10.14778/3377369.3377376, 17 pages",,,,"cs.SI cs.LG","http://arxiv.org/licenses/nonexclusive-distrib/1.0/","  Given an input graph G and a node v in G, homogeneous network embedding (HNE)
maps the graph structure in the vicinity of v to a compact, fixed-dimensional
feature vector. This paper focuses on HNE for massive graphs, e.g., with
billions of edges. On this scale, most existing approaches fail, as they incur
either prohibitively high costs, or severely compromised result utility. Our
proposed solution, called Node-Reweighted PageRank (NRP), is based on a classic
idea of deriving embedding vectors from pairwise personalized PageRank (PPR)
values. Our contributions are twofold: first, we design a simple and efficient
baseline HNE method based on PPR that is capable of handling billion-edge
graphs on commodity hardware; second and more importantly, we identify an
inherent drawback of vanilla PPR, and address it in our main proposal NRP.
Specifically, PPR was designed for a very different purpose, i.e., ranking
nodes in G based on their relative importance from a source node's perspective.
In contrast, HNE aims to build node embeddings considering the whole graph.
Consequently, node embeddings derived directly from PPR are of suboptimal
utility. The proposed NRP approach overcomes the above deficiency through an
effective and efficient node reweighting algorithm, which augments PPR values
with node degree information, and iteratively adjusts embedding vectors
accordingly. Overall, NRP takes O(mlogn) time and O(m) space to compute all
node embeddings for a graph with m edges and n nodes. Our extensive experiments
that compare NRP against 18 existing solutions over 7 real graphs demonstrate
that NRP achieves higher result utility than all the solutions for link
prediction, graph reconstruction and node classification, while being up to
orders of magnitude faster. In particular, on a billion-edge Twitter graph, NRP
terminates within 4 hours, using a single CPU core.
","[{""version"":""v1"",""created"":""Mon, 17 Jun 2019 03:18:26 GMT""},{""version"":""v2"",""created"":""Tue, 3 Sep 2019 08:05:29 GMT""},{""version"":""v3"",""created"":""Wed, 4 Sep 2019 06:21:11 GMT""},{""version"":""v4"",""created"":""Thu, 5 Sep 2019 01:26:03 GMT""},{""version"":""v5"",""created"":""Tue, 17 Dec 2019 03:48:31 GMT""},{""version"":""v6"",""created"":""Tue, 23 Jun 2020 15:42:12 GMT""}]","2020-06-24"
"1906.06827","Roy Joshua","Gunnar Carlsson and Roy Joshua","Atiyah-Segal Derived Completions for Equivariant Algebraic G-Theory and
  K-Theory","Preprint (submitted)",,,,"math.AG","http://arxiv.org/licenses/nonexclusive-distrib/1.0/","  In the mid 1980s, while working on establishing completion theorems for
equivariant Algebraic K- Theory similar to the well-known Atiyah-Segal
completion theorem for equivariant topological K-theory, the late Robert
Thomason found the strong finiteness conditions that are required in such
theorems to be too restrictive. Then he made a conjecture on the existence of a
completion theorem in the sense of Atiyah and Segal for equivariant Algebraic
G-theory, for actions of linear algebraic groups on schemes that holds without
any of the strong finiteness conditions that are required in such theorems
proven by him, and also appearing in the original Atiyah-Segal theorem. The
main goal of the present paper is to provide a proof of this conjecture in as
broad a context as possible, making use of the technique of derived completion,
and to consider several of the applications.
  Our solution is broad enough to allow actions by all linear algebraic groups,
irrespective of whether they are connected or not, and acting on any
quasi-projective scheme of finite type over a field, irrespective of whether
they are regular or projective. This allows us therefore to consider the
Equivariant Algebraic G-Theory of large classes of varieties like all Toric
varieties (for the action of a torus) and all Spherical varieties (for the
action of a reductive group). Restricting to actions by split tori, we are also
able to consider actions on Algebraic Spaces. These enable us to obtain a wide
range of applications, some of which are briefly sketched and which we plan to
explore in detail in the future. A comparison of our results with previously
known results, none of which made use of derived completions, shows that
without the use of derived completions, one can only obtain results which are
indeed very restrictive.
","[{""version"":""v1"",""created"":""Mon, 17 Jun 2019 03:24:41 GMT""},{""version"":""v2"",""created"":""Sun, 27 Oct 2019 18:57:26 GMT""}]","2019-10-29"
"1906.06828","Abhijit Mandal","Abhijit Mandal","An Optimal Test for the Additive Model with Discrete or Categorical
  Predictors","26 pages, 4 figures",,,,"stat.ME","http://arxiv.org/licenses/nonexclusive-distrib/1.0/","  In multivariate nonparametric regression the additive models are very useful
when a suitable parametric model is difficult to find. The backfitting
algorithm is a powerful tool to estimate the additive components. However, due
to complexity of the estimators, the asymptotic $p$-value of the associated
test is difficult to calculate without a Monte Carlo simulation. Moreover, the
conventional tests assume that the predictor variables are strictly continuous.
In this paper, a new test is introduced for the additive components with
discrete or categorical predictors, where the model may contain continuous
covariates. This method is also applied to the semiparametric regression to
test the goodness-of-fit of the model. These tests are asymptotically optimal
in terms of the rate of convergence, as they can detect a specific class of
contiguous alternatives at a rate of $n^{-1/2}$. An extensive simulation study
is presented to support the theoretical results derived in this paper. Finally,
the method is applied to a real data to model the diamond price based on its
quality attributes and physical measurements.
","[{""version"":""v1"",""created"":""Mon, 17 Jun 2019 03:33:28 GMT""}]","2019-06-18"
"1906.06829","Xiaoqiang Yue","Xiaoqiang Yue, Kejia Pan, Jie Zhou, Zhifeng Weng, Shi Shu, Juan Tang","A multigrid-reduction-in-time solver with a new two-level convergence
  for unsteady fractional Laplacian problems","17 pages, 4 figures",,,,"math.NA cs.NA","http://arxiv.org/licenses/nonexclusive-distrib/1.0/","  The multigrid-reduction-in-time (MGRIT) technique has proven to be successful
in achieving higher run-time speedup by exploiting parallelism in time. The
goal of this article is to develop and analyze a MGRIT algorithm, using
FCF-relaxation with time-dependent time-grid propagators, to seek the finite
element approximations of unsteady fractional Laplacian problems. The multigrid
with line smoother proposed in [L. Chen, R. H. Nochetto, E. Ot{\'a}rola, A. J.
Salgado, Math. Comp. 85 (2016) 2583--2607] is chosen to be the spatial solver.
Motivated by [B. S. Southworth, SIAM J. Matrix Anal. Appl. 40 (2019) 564--608],
we provide a new temporal eigenvalue approximation property and then deduce a
generalized two-level convergence theory which removes the previous unitary
diagonalization assumption on the fine and coarse time-grid propagators
required in [X. Q. Yue, S. Shu, X. W. Xu, W. P. Bu, K. J. Pan, Comput. Math.
Appl. 78 (2019) 3471--3484]. Numerical computations are included to confirm the
theoretical predictions and demonstrate the sharpness of the derived
convergence upper bound.
","[{""version"":""v1"",""created"":""Mon, 17 Jun 2019 03:34:49 GMT""},{""version"":""v2"",""created"":""Tue, 9 Feb 2021 04:57:36 GMT""}]","2021-02-10"
"1906.06830","Aly Magassouba","Aly Magassouba, Komei Sugiura, Anh Trinh Quoc and Hisashi Kawai","Understanding Natural Language Instructions for Fetching Daily Objects
  Using GAN-Based Multimodal Target-Source Classification","8 pages, 6 figures, 5 tables. Accepted for RA-L with presentation at
  IROS 2019",,,,"cs.RO","http://arxiv.org/licenses/nonexclusive-distrib/1.0/","  In this paper, we address multimodal language understanding for unconstrained
fetching instruction in domestic service robots context. A typical fetching
instruction such as ""Bring me the yellow toy from the white shelf"" requires to
infer the user intention, that is what object (target) to fetch and from where
(source). To solve the task, we propose a Multimodal Target-source Classifier
Model (MTCM), which predicts the region-wise likelihood of target and source
candidates in the scene. Unlike other methods, MTCM can handle regionwise
classification based on linguistic and visual features. We evaluated our
approach that outperformed the state-of-the-art method on a standard data set.
In addition, we extended MTCM with Generative Adversarial Nets (MTCM-GAN), and
enabled simultaneous data augmentation and classification.
","[{""version"":""v1"",""created"":""Mon, 17 Jun 2019 03:34:55 GMT""}]","2019-06-18"
"1906.06831","Masroor C. Pookkillath","Masroor C. Pookkillath, Antonio De Felice, Shinji Mukohyama","Baryon Physics and Tight Coupling Approximation in Boltzmann Codes","29 pages, 6 figures, uses revtex, matches with published version.
  Code available at:
  http://www2.yukawa.kyoto-u.ac.jp/~antonio.defelice/new_baryon.zip","Universe 2020, 6(1), 6","10.3390/universe6010006","YITP-19-52, IPMU19-0088","astro-ph.CO gr-qc hep-th","http://arxiv.org/licenses/nonexclusive-distrib/1.0/","  We provide two derivations of the baryonic equations that can be
straightforwardly implemented in existing Einstein--Boltzmann solvers. One of
the derivations begins with an action principle, while the other exploits the
conservation of the stress-energy tensor. While our result is manifestly
covariant and satisfies the Bianchi identities, we point out that this is not
the case for the implementation of the seminal work by Ma and Bertschinger and
in the existing Boltzmann codes. We also study the tight coupling approximation
up to the second order without choosing any gauge using the covariant full
baryon equations. We implement the improved baryon equations in a Boltzmann
code and investigate the change in the estimate of cosmological parameters by
performing an MCMC analysis. With the covariantly correct baryon equations of
motion, we find 1% deviation for the best fit values of the cosmological
parameters that should be taken into account. While in this paper, we study the
Lambda-CDM model only, our baryon equations can be easily implemented in other
models and various modified gravity theories.
","[{""version"":""v1"",""created"":""Mon, 17 Jun 2019 03:35:16 GMT""},{""version"":""v2"",""created"":""Mon, 6 Jan 2020 06:23:37 GMT""}]","2020-01-07"
"1906.06832","Linnan Wang","Linnan Wang, Saining Xie, Teng Li, Rodrigo Fonseca, Yuandong Tian","Sample-Efficient Neural Architecture Search by Learning Action Space","Accepted at TPAMI-2021",,,,"cs.LG cs.CV stat.ML","http://arxiv.org/licenses/nonexclusive-distrib/1.0/","  Neural Architecture Search (NAS) has emerged as a promising technique for
automatic neural network design. However, existing MCTS based NAS approaches
often utilize manually designed action space, which is not directly related to
the performance metric to be optimized (e.g., accuracy), leading to
sample-inefficient explorations of architectures. To improve the sample
efficiency, this paper proposes Latent Action Neural Architecture Search
(LaNAS), which learns actions to recursively partition the search space into
good or bad regions that contain networks with similar performance metrics.
During the search phase, as different action sequences lead to regions with
different performance, the search efficiency can be significantly improved by
biasing towards the good regions. On three NAS tasks, empirical results
demonstrate that LaNAS is at least an order more sample efficient than baseline
methods including evolutionary algorithms, Bayesian optimizations, and random
search. When applied in practice, both one-shot and regular LaNAS consistently
outperform existing results. Particularly, LaNAS achieves 99.0% accuracy on
CIFAR-10 and 80.8% top1 accuracy at 600 MFLOPS on ImageNet in only 800 samples,
significantly outperforming AmoebaNet with 33x fewer samples. Our code is
publicly available at https://github.com/facebookresearch/LaMCTS.
","[{""version"":""v1"",""created"":""Mon, 17 Jun 2019 03:50:25 GMT""},{""version"":""v2"",""created"":""Wed, 31 Mar 2021 19:13:16 GMT""}]","2021-04-02"
"1906.06833","X. F. Sun","Z. Y. Zhao, Q. J. Li, X. G. Liu, X. Rao, H. L. Che, L. G. Chu, Z. Z.
  He, X. Zhao, X. F. Sun","Low-temperature thermal conductivity and magnetic transitions of the
  kagom\'{e}-staircase compound Ni$_3$V$_2$O$_8$","9 pages, 12 figures, accepted for publication in Phys. Rev. B","Phys. Rev. B 99, 104419 (2019)","10.1103/PhysRevB.99.104419",,"cond-mat.str-el","http://arxiv.org/licenses/nonexclusive-distrib/1.0/","  Kagom\'{e}-staircase compound Ni$_3$V$_2$O$_8$ is an attractive multiferroic
material exhibiting rich phase diagrams. However, the magnetic properties and
magnetic transitions have been studied only above 1.3 K. In this work, we study
the thermal conductivity ($\kappa$) of Ni$_3$V$_2$O$_8$ single crystals at low
temperatures down to 0.3 K and in magnetic fields up to 14 T. In zero field,
the magnetic transitions from the low-temperature incommensurate (LTI) phase to
the commensurate phase (C) and then to a second commensurate phase (C') yield
anomalies in $\kappa(T)$ curves at $T\rm_{LC}$ = 3.7 K and $T\rm_{CC'}$ = 2.0
K, respectively, which indicates a significant phonon scattering by the
critical spin fluctuations. When the field is applied along the $a$ axis, the
field dependence of $\kappa$ displays four anomalies associated with different
magnetic transitions and reveals an undetected magnetic state at subKelvin
temperatures. In addition, the $\kappa(B)$ curves are found to depend not only
on the history but also on the magnitude of applying field. When the field is
applied along the $b$ axis, a high-field phase locating above the LTI and
high-temperature incommensurate (HTI) phases is revealed.
","[{""version"":""v1"",""created"":""Mon, 17 Jun 2019 04:00:52 GMT""}]","2019-07-10"
"1906.06834","Jun Xu","Yingkun Hou, Jun Xu, Mingxia Liu, Guanghai Liu, Li Liu, Fan Zhu, Ling
  Shao","NLH: A Blind Pixel-level Non-local Method for Real-world Image Denoising","14 pages, 9 figures, 10 tables, accept by IEEE TIP",,"10.1109/TIP.2020.2980116",,"cs.CV","http://arxiv.org/licenses/nonexclusive-distrib/1.0/","  Non-local self similarity (NSS) is a powerful prior of natural images for
image denoising. Most of existing denoising methods employ similar patches,
which is a patch-level NSS prior. In this paper, we take one step forward by
introducing a pixel-level NSS prior, i.e., searching similar pixels across a
non-local region. This is motivated by the fact that finding closely similar
pixels is more feasible than similar patches in natural images, which can be
used to enhance image denoising performance. With the introduced pixel-level
NSS prior, we propose an accurate noise level estimation method, and then
develop a blind image denoising method based on the lifting Haar transform and
Wiener filtering techniques. Experiments on benchmark datasets demonstrate
that, the proposed method achieves much better performance than previous
non-deep methods, and is still competitive with existing state-of-the-art deep
learning based methods on real-world image denoising. The code is publicly
available at https://github.com/njusthyk1972/NLH.
","[{""version"":""v1"",""created"":""Mon, 17 Jun 2019 04:08:42 GMT""},{""version"":""v2"",""created"":""Thu, 4 Jul 2019 07:34:22 GMT""},{""version"":""v3"",""created"":""Sun, 4 Aug 2019 05:27:15 GMT""},{""version"":""v4"",""created"":""Sat, 14 Sep 2019 05:34:51 GMT""},{""version"":""v5"",""created"":""Sun, 8 Mar 2020 15:25:48 GMT""},{""version"":""v6"",""created"":""Wed, 11 Mar 2020 06:37:58 GMT""}]","2020-04-22"
"1906.06835","Athanasios Georgiadis","Galatia Cleanthous, Athanasios G. Georgiadis and Emilio Porcu","Minimax Density Estimation on Sobolev Spaces With Dominating Mixed
  Smoothness","29 pages, 2 figures",,,,"math.ST math.PR stat.TH","http://arxiv.org/licenses/nonexclusive-distrib/1.0/","  We study minimax density estimation on the product space
$\mathbb{R}^{d_1}\times\mathbb{R}^{d_2}$. We consider $L^p$-risk for
probability density functions defined over regularity spaces that allow for
different level of smoothness in each of the variables. Precisely, we study
probabilities on Sobolev spaces with dominating mixed-smoothness. We provide
the rate of convergence that is optimal even for the classical Sobolev spaces.
","[{""version"":""v1"",""created"":""Mon, 17 Jun 2019 04:14:12 GMT""}]","2019-06-18"
"1906.06838","Vladimir Minakov","V.A. Minakov, A.P. Sosedkin and K.V. Lotov","Accelerating field enhancement due to ion motion in plasma wakefield
  accelerators","5 pages, 4 figures",,"10.1088/1361-6587/ab41a7",,"physics.plasm-ph","http://arxiv.org/licenses/nonexclusive-distrib/1.0/","  Ion motion in plasma wakefield accelerators can cause temporal increase of
the longitudinal electric field shortly before the wave breaks. The increase is
caused by re-distribution of the wave energy in transverse direction and may be
important for correct interpretation of experimental results and acceleration
of high-quality beams.
","[{""version"":""v1"",""created"":""Mon, 17 Jun 2019 04:22:54 GMT""}]","2019-10-23"
"1906.06839","Gang Guo","Gang Guo, Yong-Zhong Qian, Alexander Heger","Presupernova neutrino signals as potential probes of neutrino mass
  hierarchy","5 pages, 4 figures",,"10.1016/j.physletb.2019.07.030",,"astro-ph.HE hep-ph nucl-th","http://arxiv.org/licenses/nonexclusive-distrib/1.0/","  We assess the potential of using presupernova neutrino signals at the
Jiangmen Underground Neutrino Observatory (JUNO) to probe the yet-unknown
neutrino mass hierarchy. Using models for stars of 12, 15, 20, and 25 solar
masses, we find that if the electron antineutrino signals from such a star can
be predicted precisely and the star is within ~440-880 pc, the number of events
of electron antineutrino captures on protons detected within one day of its
explosion allows to determine the hierarchy at the > ~95% confidence level. For
determination at this level using such signals from Betelgeuse, which is at a
distance of ~222 pc, the uncertainty in the predicted number of signals needs
to be < ~14-30%. In view of more realistic uncertainties, we discuss and
advocate a model-independent determination using both electron neutrino and
antineutrino signals from Betelgeuse. This method is feasible if the cosmogenic
background for neutrino-electron scattering events can be reduced by a factor
of ~2.5-10 from the current estimate. Such reduction might be achieved by using
coincidence of the background events, the exploration of which for JUNO is
highly desirable.
","[{""version"":""v1"",""created"":""Mon, 17 Jun 2019 04:30:51 GMT""}]","2019-09-04"
"1906.06840","Kirti Joshi","Kirti Joshi","Mochizuki's anabelian variation of ring structures and formal groups","New additions are: Proposition 7.5 and Theorem 7.6. 19 pages",,,,"math.AG math.NT","http://arxiv.org/licenses/nonexclusive-distrib/1.0/","  I show that there is a universal formal group (over a suitable (non-zero)
ring) which is equipped with an action of the multiplicative monoid
$\mathcal{O}^\triangleright$ of non-zero elements of the ring of integers of a
$p$-adic field. Lubin-Tate formal groups also arise from this universal formal
group. If two $p$-adic fields have isomorphic multiplicative monoids
$\mathcal{O}^\triangleright$ then the additive structure of one arises from
that of the other by means of this universal formal group law (in a suitable
manner). In particular if two $p$-adic fields have isomorphic absolute Galois
groups then it is well-known that the two respective monoids
$\mathcal{O}^\triangleright$ are isomorphic and so this construction can be
applied to such $p$-adic fields. In this sense this universal formal group law
provides a single additive structure which binds together $p$-adic fields whose
absolute Galois groups are isomorphic (this anabelian variation of ring
structure is studied and used extensively by Shinichi Mochizuki). In particular
one obtains a universal (additive) expression for any non-zero $p$-adic integer
(in a given $p$-adic field) which is independent of the ring structure of the
$p$-adic field (this is also inspired by Mochizuki's results). These ideas
extend to geometric situations: for a smooth curve $X/K$ there is a universal
$K(X)^*$-formal group (here $K(X)^*$ is the monoid of non-zero meromorphic
functions on a smooth curve $X/K$ over a $p$-adic field $K$, which binds
together all the additive structures on $K(X)^*\cup \{0\}$ compatibly with the
universal additive structure on $K^*\cup\{0\}$ and hence a non-zero meromorphic
function on $X$ is given by a universal additive expression which is
independent of the ring structure of $K(X)^*\cup\{0\}$ (this is also inspired
by Mochizuki's results on Theta functions). Also see Theorem 7.6.
","[{""version"":""v1"",""created"":""Mon, 17 Jun 2019 04:31:46 GMT""},{""version"":""v2"",""created"":""Tue, 27 Aug 2019 16:45:08 GMT""},{""version"":""v3"",""created"":""Tue, 10 Dec 2019 16:15:50 GMT""}]","2019-12-11"
"1906.06841","Biao Jia","Biao Jia, Jonathan Brandt, Radomir Mech, Byungmoon Kim, Dinesh Manocha","LPaintB: Learning to Paint from Self-Supervision",,,,,"cs.LG cs.AI cs.CV","http://arxiv.org/licenses/nonexclusive-distrib/1.0/","  We present a novel reinforcement learning-based natural media painting
algorithm. Our goal is to reproduce a reference image using brush strokes and
we encode the objective through observations. Our formulation takes into
account that the distribution of the reward in the action space is sparse and
training a reinforcement learning algorithm from scratch can be difficult. We
present an approach that combines self-supervised learning and reinforcement
learning to effectively transfer negative samples into positive ones and change
the reward distribution. We demonstrate the benefits of our painting agent to
reproduce reference images with brush strokes. The training phase takes about
one hour and the runtime algorithm takes about 30 seconds on a GTX1080 GPU
reproducing a 1000x800 image with 20,000 strokes.
","[{""version"":""v1"",""created"":""Mon, 17 Jun 2019 04:52:15 GMT""},{""version"":""v2"",""created"":""Sat, 21 Sep 2019 15:14:21 GMT""}]","2019-09-24"
"1906.06842","Alireza Kashir","Alireza Kashir, Veronica Goian, Oliva Pacherova, Yoon Hee Jeong,
  Gil-Ho Lee, Stanislav Kamba,","Spin-phonon interaction increased by compressive strain in
  antiferromagnetic MnO thin films",,,"10.1088/1361-648X/ab6be9",,"cond-mat.str-el","http://arxiv.org/licenses/nonexclusive-distrib/1.0/","  MnO thin films with various thicknesses and strains were grown on MgO
substrates by pulsed laser deposition, then characterized using x-ray
diffraction and infrared reflectance spectroscopy. Films grown on
(001)-oriented MgO substrates exhibit homogenous biaxial compressive strain
which increases as the film thickness is reduced. For that reason, the
frequency of doubly-degenerate phonon increases with the strain, and splits
below N\'eel temperature TN due to the magnetic-exchange interaction. Films
grown on (110)-oriented MgO substrates exhibit a huge phonon splitting already
at room temperature due to the anisotropic in-plane compressive strain. Below
TN, additional phonon is activated in the IR spectra; this trend is evidence
for a spin-order-induced structural phase transition from tetragonal to
monoclinic phase. Total phonon splitting is 55 cm-1 in (110)-oriented MnO film,
which is more than twice the value in bulk MnO. This result is evidence that
the nearest neighbor exchange interaction, which is responsible for the
magnetically driven phonon splitting, is greatly increased in compressively
strained films.
","[{""version"":""v1"",""created"":""Mon, 17 Jun 2019 05:05:07 GMT""}]","2020-01-20"
