"1906.07001","Ankur Das","Ankur Das, Sumiran Pujari","SU(3) fermions in a three-band Graphene-like model","14 pages, 16 figures. Closely matches the published version","Phys. Rev. B 100, 125152 (2019)","10.1103/PhysRevB.100.125152",,"cond-mat.str-el","http://arxiv.org/licenses/nonexclusive-distrib/1.0/","  Two-dimensional Graphene is fascinating because of its unique electronic
properties. From a fundamental perspective, one among them is the geometric
phase structure near the Dirac points in the Brillouin zone, owing to the SU(2)
nature of the Dirac cone wave functions. We ask if there are geometric phase
structures in two dimensions which go beyond that of a Dirac cone. Here we
write down a family of three-band continuum models of non-interacting fermions
which have more intricate geometric phase structures. This is connected to the
SU(3) nature of the wavefunctions near three-fold degeneracies. We also give a
tight-binding free fermion model on a two-dimensional Graphene-like lattice
where the three-fold degeneracies are realized at fine-tuned points. Away from
them, we obtain new ""three-band"" Dirac cone structures with associated
non-standard Landau level quantization, whose organization is strongly affected
by the non-SU(2) or beyond-Dirac geometric phase structure of the fine-tuned
points.
","[{""version"":""v1"",""created"":""Mon, 17 Jun 2019 12:50:14 GMT""},{""version"":""v2"",""created"":""Wed, 22 Jul 2020 13:00:16 GMT""}]","2020-07-23"
"1906.07002","Eleonora Zari","E. Zari, A. G. A. Brown, and P.T. de Zeeuw","Structure, kinematics, and ages of the young stellar populations in the
  Orion region","17 pages, 18 figures; accepted for publication in A&A","A&A 628, A123 (2019)","10.1051/0004-6361/201935781",,"astro-ph.SR astro-ph.GA","http://arxiv.org/licenses/nonexclusive-distrib/1.0/","  We present a study of the three dimensional structure, kinematics, and age
distribution of the Orion OB association, based on the second data release of
the Gaia satellite (Gaia DR2). Our goal is to obtain a complete picture of the
star formation history of the Orion complex and to relate our findings to
theories of sequential and triggered star formation. We select the Orion
population with simple photometric criteria, and we construct a three
dimensional map in galactic Cartesian coordinates to study the physical
arrangement of the stellar clusters in the Orion region. The map shows
structures that extend for roughly $150 \, \mathrm{pc}$ along the line of
sight, divided in multiple sub-clusters. We separate different groups by using
the density based clustering algorithm DBSCAN. We study the kinematic
properties of all the groups found by DBSCAN first by inspecting their proper
motion distribution, and then by applying a kinematic modelling code based on
an iterative maximum likelihood approach, which we use to derive their mean
velocity, velocity dispersion and isotropic expansion. By using an isochrone
fitting procedure we provide ages and extinction values for all the groups. We
confirm the presence of an old population ($\sim 15$ Myr) towards the 25 Ori
region, and we find that groups with ages of $12-15 \, \mathrm{Myr}$ are
present also towards the Belt region. We notice the presence of a population of
$\sim 10$ Myr also in front of the Orion A molecular cloud. Our findings
suggest that star formation in Orion does not follow a simple sequential
scenario, but instead consists of multiple events, which caused kinematic and
physical sub-structure. To fully explain the detailed sequence of events,
specific simulations and further radial velocity data are needed.
","[{""version"":""v1"",""created"":""Mon, 17 Jun 2019 12:51:44 GMT""}]","2019-08-21"
"1906.07007","Hame Sehmi","Hame Sehmi, Wolfgang Langbein, Egor Muljarov","Applying the resonant-state expansion to realistic materials with
  frequency dispersion",,"Phys. Rev. B 101, 045304 (2020)","10.1103/PhysRevB.101.045304",,"physics.optics cond-mat.mes-hall","http://arxiv.org/licenses/nonexclusive-distrib/1.0/","  The dispersive resonant-state expansion, developed for an accurate
calculation of the resonant states in open optical systems with frequency
dispersion, is applied here to realistic materials, such as metallic
nanoparticles and semiconductor microspheres. The material permittivity is
determined by fitting the measured indices of refraction and absorption with a
generalized Drude-Lorentz model containing a number of poles in the complex
frequency plane. Each Drude or Lorentz pole generates an infinite series of
resonant states. Furthermore, for small nanoparticles, each of these poles
produces a distinct surface plasmon polariton mode. The evolution of these
multiple surface modes with increasing radius traces the transition from the
electrostatic limit to significant retardation and radiation. Treating the
optical phonon range in a semiconductor microsphere, a reststrahlen band
separating the resonant states is found. Considering a small energy range
around the semiconductor band gap, the transition from absorption to gain is
described by inverting the Lorentz pole weight, which results in the formation
of lasing resonant states. Interestingly, the series of resonant states
converging towards the absorption pole from the lower frequency side reshapes
for a gain pole into a clockwise loop approaching the pole from the higher
frequency side, being separated from a series spanning from low to high
frequencies and containing the lasing modes.
","[{""version"":""v1"",""created"":""Mon, 17 Jun 2019 13:01:09 GMT""}]","2020-01-29"
"1906.07008","Qiangqiang Wu","Qiangqiang Wu, Zhihui Chen, Lin Cheng, Yan Yan, Bo Li, Hanzi Wang","Hallucinated Adversarial Learning for Robust Visual Tracking","Visual object tracking, data hallucination",,,,"cs.CV","http://arxiv.org/licenses/nonexclusive-distrib/1.0/","  Humans can easily learn new concepts from just a single exemplar, mainly due
to their remarkable ability to imagine or hallucinate what the unseen exemplar
may look like in different settings. Incorporating such an ability to
hallucinate diverse new samples of the tracked instance can help the trackers
alleviate the over-fitting problem in the low-data tracking regime. To achieve
this, we propose an effective adversarial approach, denoted as adversarial
""hallucinator"" (AH), for robust visual tracking. The proposed AH is designed to
firstly learn transferable non-linear deformations between a pair of
same-identity instances, and then apply these deformations to an unseen tracked
instance in order to generate diverse positive training samples. By
incorporating AH into an online tracking-by-detection framework, we propose the
hallucinated adversarial tracker (HAT), which jointly optimizes AH with an
online classifier (e.g., MDNet) in an end-to-end manner. In addition, a novel
selective deformation transfer (SDT) method is presented to better select the
deformations which are more suitable for transfer. Extensive experiments on 3
popular benchmarks demonstrate that our HAT achieves the state-of-the-art
performance.
","[{""version"":""v1"",""created"":""Mon, 17 Jun 2019 13:02:23 GMT""}]","2019-06-18"
"1906.07009","Miguel Sepulcre","Miguel Sepulcre, Javier Gozalvez, M. Carmen Lucas-Esta\~n","Power and Packet Rate Control for Vehicular Networks in
  Multi-Application Scenarios",,"IEEE Transactions on Vehicular Technology, Volume 68, Issue 9, pp.
  9029 - 9037, September 2019","10.1109/TVT.2019.2922539",,"cs.NI","http://arxiv.org/licenses/nonexclusive-distrib/1.0/","  Vehicular networks require vehicles to periodically transmit 1-hop broadcast
packets in order to detect other vehicles in their local neighborhood. Many
vehicular applications depend on the correct reception of these packets that
are transmitted on a common control channel. Vehicles will actually be required
to simultaneously execute multiple applications. The transmission of the
broadcast packets should hence be configured to satisfy the requirements of all
applications while controlling the channel load. This can be challenging when
vehicles simultaneously run multiple applications, and each application has
different requirements that vary with the vehicular context (e.g. speed and
density). In this context, this paper proposes and evaluates different
techniques to dynamically adapt the rate and power of 1-hop broadcast packets
per vehicle in multi-application scenarios. The proposed techniques are
designed to satisfy the requirements of multiple simultaneous applications and
reduce the channel load. The evaluation shows that the proposed techniques
significantly decrease the channel load, and can better satisfy the
requirements of multiple applications compared to existing approaches, in
particular the Message Handler specified in the SAE J2735 DSRC Message Set
Dictionary.
","[{""version"":""v1"",""created"":""Mon, 17 Jun 2019 13:02:45 GMT""},{""version"":""v2"",""created"":""Fri, 4 Oct 2019 08:14:31 GMT""}]","2019-10-07"
"1906.07010","Giuseppe D'Alessandro Dr.","G. D'Alessandro, L. Mele, F. Columbro, L. Pagano, F. Piacentini, P. de
  Bernardis, S. Masi","Systematic effects induced by Half Wave Plate precession into Cosmic
  Microwave Background polarization measurements","18 pages","A&A 627, A160 (2019)","10.1051/0004-6361/201834495",,"astro-ph.IM astro-ph.CO","http://arxiv.org/licenses/nonexclusive-distrib/1.0/","  The most accessible method to measure polarization features of the CMB
radiation is by means of a Stokes Polarimeter based on the rotation of an Half
Wave Plate. The current observational cosmology is starting to be limited by
the presence of systematic effects. The Stokes polarimeter with a rotating Half
Wave Plate (HWP) has the advantage of mitigating a long list of potential
systematics, by modulation of the linearly polarized component of the
radiation, but the presence of the rotating HWP can by itself introduce new
systematic effects, which must be under control, representing one of the most
critical part in the design of a B-Modes experiment. In this paper we present,
simulate and analyse the spurious signal arising from the precession of a
rotating HWP. We first find an analytical formula for the impact of the
systematic effect induced by the HWP precession on the propagating radiation,
using the 3D generalization of the Muller formalism. We then perform several
numerical simulations, showing the effect induced on the Stokes parameters by
this systematic. We also derive and discuss the impact into B-modes measured by
a satellite experiment. We find the analytical formula for the Stokes
parameters from a Stokes polarimeter where the HWP follows a precessional
motion with an angle $\theta_0$. We show the result depending on the HWP
inertia tensor, spinning speed and on $\theta_0$. The result of numerical
simulations is reported as a simple timeline of the electric fields. Finally,
assuming to observe all the sky with a satellite mission, we analyze the effect
on B-modes measurements. The effect is not negligible giving the current
B-modes experiments sensitivity, therefore it is a systematic which needs to be
carefully considered for future experiments.
","[{""version"":""v1"",""created"":""Mon, 17 Jun 2019 13:03:05 GMT""}]","2019-07-24"
"1906.07011","Nees Jan van Eck","Nees Jan van Eck, Ludo Waltman","Accuracy of citation data in Web of Science and Scopus","Paper published in the Proceedings of the 16th International
  Conference of the International Society for Scientometrics and Informetrics
  (pp. 1087-1092)",,,,"cs.DL","http://arxiv.org/licenses/nonexclusive-distrib/1.0/","  We present a large-scale analysis of the accuracy of citation data in the Web
of Science and Scopus databases. The analysis is based on citations given in
publications in Elsevier journals. We reveal significant data quality problems
for both databases. Missing and incorrect references are important problems in
Web of Science. Duplicate publications are a serious problem in Scopus.
","[{""version"":""v1"",""created"":""Mon, 17 Jun 2019 13:03:45 GMT""}]","2019-06-18"
"1906.07012","Krishan Kumar Tiwari","Krishan Kumar Tiwari, Eckhard Grass, John S. Thompson, Rolf Kraemer","Beam Entropy of 5G Cellular Millimetre-Wave Channels","Under peer-review for IEEE VTC Fall 2019",,"10.1109/VTCFall.2019.8891530","Published in Proc. of IEEE VTC2019-Fall","eess.SP cs.IT cs.SY eess.SY math.IT","http://arxiv.org/licenses/nonexclusive-distrib/1.0/","  In this paper, we obtain and study typical beam entropy values for millimetre
wave (mm-wave) channel models using the NYUSIM simulator for frequencies up to
100 GHz for fifth generation (5G) and beyond 5G cellular communication systems.
The beam entropy is used to quantify sparse MIMO channel randomness in
beamspace. Lower relative beam entropy channels are suitable for
memory-assisted statistically-ranked (MarS) and hybrid radio frequency (RF)
beam training algorithms. High beam entropies can potentially be advantageous
for low overhead secured radio communications by generating cryptographic keys
based on channel randomness in beamspace, especially for sparse multiple input
multiple output (MIMO) channels. Urban micro (UMi), urban macro (UMa) and rural
macro (RMa) cellular scenarios have been investigated in this work for 28, 60,
73 and 100 GHz.
","[{""version"":""v1"",""created"":""Mon, 17 Jun 2019 13:08:46 GMT""},{""version"":""v2"",""created"":""Thu, 20 Jun 2019 14:06:48 GMT""},{""version"":""v3"",""created"":""Mon, 15 Jul 2019 16:01:41 GMT""}]","2022-11-22"
"1906.07013","Xiaokai Chang","Xiaokai Chang, Sanyang Liu","First-order primal-dual algorithm with correction","20 pages, 12 figures. arXiv admin note: text overlap with
  arXiv:1608.08883 by other authors",,,,"math.OC","http://arxiv.org/licenses/nonexclusive-distrib/1.0/","  This paper is devoted to the design of efficient primal-dual algorithm (PDA)
for solving convex optimization problems with known saddle-point structure. We
present a new PDA with larger acceptable range of parameters and correction,
which result in larger step sizes. The step sizes are predicted by using a
local information of the linear operator and corrected by linesearch to satisfy
a very weak condition, even weaker than the boundedness of sequence generated.
The convergence and ergodic convergence rate are established for general cases,
and in case when one of the prox-functions is strongly convex. The numerical
experiments illustrate the improvements in efficiency from the larger step
sizes and acceptable range of parameters.
","[{""version"":""v1"",""created"":""Mon, 17 Jun 2019 13:10:50 GMT""},{""version"":""v2"",""created"":""Tue, 17 Sep 2019 12:17:30 GMT""},{""version"":""v3"",""created"":""Mon, 2 Dec 2019 01:46:36 GMT""}]","2019-12-04"
"1906.07017","Ali Mollabashi","M. Reza Mohammadi Mozaffar, Ali Mollabashi","Universal Scaling in Fast Quenches Near Lifshitz-Like Fixed Points","5 pages",,,"MPP-2019-119 IPM/P-2019/021","hep-th cond-mat.stat-mech","http://arxiv.org/licenses/nonexclusive-distrib/1.0/","  We study critical dynamics through time evolution of quantum field theories
driven to a Lifshitz-like fixed point, with $z>1$, under relevant deformations.
The deformations we consider are fast smooth quantum quenches, namely when the
quench scale $\delta t^{-z}$ is large compared to the deformation scale. We
show that in holographic models the response of the system merely depends on
the scaling dimension of the quenched operator as $\delta\lambda\cdot\delta
t^{d-2\Delta+z-1}$, where $\delta\lambda$ is the deformation amplitude. This
scaling behavior is enhanced logarithmically in certain cases. We also study
free Lifshitz scalar theory deformed by mass operator and show that the
universal scaling of the response completely matches with holographic analysis.
We argue that this scaling behavior is universal for any relevant deformation
around Lifshitz-like UV fixed points.
","[{""version"":""v1"",""created"":""Mon, 17 Jun 2019 13:14:28 GMT""}]","2019-06-18"
"1906.07022","Naoko Nakagawa","Naoko Nakagawa, Shin-ichi Sasa","Global Thermodynamics for Heat Conduction Systems","59 pages, 20 figures",,"10.1007/s10955-019-02393-2",,"cond-mat.stat-mech","http://arxiv.org/licenses/nonexclusive-distrib/1.0/","  We propose the concept of global temperature for spatially non-uniform heat
conduction systems. With this novel quantity, we present an extended framework
of thermodynamics for the whole system such that the fundamental relation of
thermodynamics holds, which we call ""global thermodynamics"" for heat conduction
systems. Associated with this global thermodynamics, we formulate a variational
principle for determining thermodynamic properties of the liquid-gas phase
coexistence in heat conduction, which corresponds to the natural extension of
the Maxwell construction for equilibrium systems. We quantitatively predict
that the temperature of the liquid-gas interface deviates from the equilibrium
transition temperature. This result indicates that a super-cooled gas stably
appears near the interface.
","[{""version"":""v1"",""created"":""Mon, 17 Jun 2019 13:18:48 GMT""},{""version"":""v2"",""created"":""Fri, 20 Sep 2019 05:08:42 GMT""}]","2019-10-23"
"1906.07023","Valery Ugrinovskii","Valery Ugrinovskii","Distributed $H_\infty$ Estimation Resilient to Biasing Attacks","Accepted for publication in IEEE Transactions on Control of Network
  Systems",,,,"eess.SY cs.SY","http://arxiv.org/licenses/nonexclusive-distrib/1.0/","  We consider the distributed $H_\infty$ estimation problem with an additional
requirement of resilience to biasing attacks. An attack scenario is considered
where an adversary misappropriates some of the observer nodes and injects
biasing signals into observer dynamics. The paper proposes a procedure for the
derivation of a distributed observer which endows each node with an attack
detector which also functions as an attack compensating feedback controller for
the main observer. Connecting these controlled observers into a network results
in a distributed observer whose nodes produce unbiased robust estimates of the
plant. We show that the gains for each controlled observer in the network can
be computed in a decentralized fashion, thus reducing vulnerability of the
network.
","[{""version"":""v1"",""created"":""Mon, 17 Jun 2019 13:25:18 GMT""}]","2019-06-18"
"1906.07024","Madita Willsch","Madita Willsch, Dennis Willsch, Fengping Jin, Hans De Raedt, Kristel
  Michielsen","Real-time simulation of flux qubits used for quantum annealing","improved structure and introduction and minor changes after the
  referee process","Phys. Rev. A 101, 012327 (2020)","10.1103/PhysRevA.101.012327",,"quant-ph","http://arxiv.org/licenses/nonexclusive-distrib/1.0/","  The real-time flux dynamics of up to three superconducting quantum
interference devices (SQUIDs) are studied by numerically solving the
time-dependent Schr\""odinger equation. The numerical results are used to
scrutinize the mapping of the flux degrees of freedom onto two-level systems
(the qubits) as well as the performance of the intermediate SQUID as a tunable
coupling element. It is shown that the qubit representation yields a good
description of the flux dynamics during quantum annealing and the presence of
the tunable coupling element does not have negative effects on the overall
performance. Additionally, data obtained from a simulation of the dynamics of
two-level systems during quantum annealing are compared to experimental data
produced by the D-Wave 2000Q quantum annealer. The effects of finite
temperature are incorporated in the simulation by coupling the qubit system to
a bath of two-level systems. It is shown that an environment modeled as
non-interacting two-level systems coupled to the qubits can produce data which
matches the experimental data much better than the simulation data of the
qubits without coupling to an environment and better than data obtained from a
simulation of an environment modeled as interacting two-level systems coupling
to the qubits.
","[{""version"":""v1"",""created"":""Mon, 17 Jun 2019 13:26:34 GMT""},{""version"":""v2"",""created"":""Fri, 31 Jan 2020 13:54:02 GMT""}]","2020-02-03"
"1906.07025","Santanu Maiti K.","Moumita Patra, Santanu K. Maiti","Bias induced circular spin current: Effects of environmental dephasing
  and disorder","Thoroughly revised and extended version. Accepted for publication in
  Physical Review B","Phys. Rev. B 100, 165408 (2019)","10.1103/PhysRevB.100.165408",,"cond-mat.mes-hall cond-mat.dis-nn cond-mat.other","http://arxiv.org/licenses/nonexclusive-distrib/1.0/","  Analogous to circular spin current in an isolated quantum loop, bias induced
spin circular current can also be generated under certain physical conditions
in a nanojunction having single and/or multiple loop geometries which we
propose first time, to the best of our concern, considering a magnetic quantum
system. The key aspect of our work is the development of a suitable theory for
defining and analyzing circular spin current in presence of environmental
dephasing and impurities. Unlike transport current in a conducting junction,
circular current may enhance significantly in presence of disorder and phase
randomizing processes. Our analysis provides a new spin dependent phenomenon,
and can give important signatures in designing suitable spintronic devices as
well as selective spin regulations.
","[{""version"":""v1"",""created"":""Mon, 17 Jun 2019 13:28:37 GMT""},{""version"":""v2"",""created"":""Wed, 25 Sep 2019 09:44:43 GMT""}]","2019-10-16"
"1906.07026","Jan Govaerts","Daddy Balondo Iyela (Univ. Kinshasa, UNIKIN, DRC), Jan Govaerts (Univ.
  cath. Louvain, UCLouvain, Louvain-la-Neuve, Belgium)","Non Local Global Symmetries of a Free Scalar Field in a Bounded Domain","1+17 pages",,"10.1063/1.5115308","Preprint CP3-19-31","math-ph hep-th math.MP","http://arxiv.org/licenses/nonexclusive-distrib/1.0/","  BMS symmetries have been attracting a great deal of interest in recent years.
Originally discovered as being the symmetries of asymptotically flat spacetime
geometries at null infinity in General Relativity, BMS symmetries have also
been shown to exist for free field theories over Minkowski spacetime. In
wanting to better understand their status and the underlying reasons for their
existence, this work proposes a general rationale towards identifying all
possible global symmetries of a free field theory over Minkowski spacetime, by
allowing the corresponding conserved generators not to be necessarily spatially
local in phase space since fields and their conjugate momenta are intrinsically
spatially non local physical entities. As a preliminary towards a separate
study of the role of asymptotic states for BMS symmetries in an unbounded
Minkowski spacetime, the present discussion focuses first onto a 2+1
dimensional free scalar field theory in a bounded spatial domain with the
topology of a disk and an arbitrary radial Robin boundary condition. The
complete set of global symmetries of that system, most of which are dynamical
symmetries but include as well those generated by the local total energy and
angular-momentum of the field, is thereby identified.
","[{""version"":""v1"",""created"":""Mon, 17 Jun 2019 13:33:53 GMT""}]","2019-10-02"
"1906.07027","Amir Djalalian-Assl","Amir Djalalian-Assl","Surface Plasmon Wave plates","Some historical facts added to the end",,"10.1063/1.4906596",,"physics.optics","http://arxiv.org/licenses/nonexclusive-distrib/1.0/","  Here I investigate both numerically and experimentally, the polarization
conversion capabilities of a rectangular array of holes with two unequal
orthogonal periodicities. We show that it is possible to tune the periodicities
in such a way that the transmitted light is circularly polarized for a
nominated wavelength, Lambda-CPL, when the structure is illuminated with
appropriately oriented linearly polarized light at normal incidence. A device
was fabricated and experiments confirmed that a degree of circular polarization
of 0.89 could be achieved at the resonant wavelength.
","[{""version"":""v1"",""created"":""Mon, 17 Jun 2019 13:34:21 GMT""},{""version"":""v2"",""created"":""Thu, 11 Jul 2019 23:38:11 GMT""},{""version"":""v3"",""created"":""Thu, 28 Nov 2019 17:06:40 GMT""}]","2019-12-02"
"1906.07028","Szymon Myga","Szymon Myga","Optimal transport on completely integrable toric manifolds","12 pages; comments are welcomed","J Geom Anal (2020)","10.1007/s12220-020-00482-3",,"math.AP math.CV math.SG","http://arxiv.org/licenses/nonexclusive-distrib/1.0/","  We show that existence and uniqueness of solutions to transported
Monge-Ampere problem on complex compact toric manifold follows easily from the
real theory of optimal transportation.
","[{""version"":""v1"",""created"":""Mon, 17 Jun 2019 13:36:11 GMT""}]","2021-02-18"
