"1901.03236","Lars Pastewka","Adam R. Hinkle, Wolfram N\""ohring, Lars Pastewka","The universal emergence of self-affine roughness from deformation","16 pages, 6 figures","Sci. Adv. 6, eaax0847 (2020)","10.1126/sciadv.aax0847",,"cond-mat.mtrl-sci","http://arxiv.org/licenses/nonexclusive-distrib/1.0/","  Most natural and man-made surfaces appear to be rough on many length scales.
There is presently no unifying theory of the origin of roughness or the
self-affine nature of surface topography. One likely contributor to the
formation of roughness is deformation, which underlies many processes that
shape surfaces such as machining, fracture, and wear. Using molecular dynamics,
we simulate the bi-axial compression of single-crystal Au, the high-entropy
alloy Ni$_{36.67}$Co$_{30}$Fe$_{16.67}$Ti$_{16.67}$, and amorphous
Cu$_{50}$Zr$_{50}$, and show that even surfaces of homogeneous materials
develop a self-affine structure. By characterizing subsurface deformation, we
connect the self-affinity of the surface to the spatial correlation of
deformation events occurring within the bulk and present scaling relations for
the evolution of roughness with strain.
","[{""version"":""v1"",""created"":""Thu, 10 Jan 2019 16:02:40 GMT""}]","2020-02-18"
"1901.03237","Johannes Tiedau","Johannes Tiedau, Tim J. Bartley, Georg Harder, Adriana E. Lita, Sae
  Woo Nam, Thomas Gerrits and Christine Silberhorn","On the scalability of parametric down-conversion for generating
  higher-order Fock states",,"Phys. Rev. A 100, 041802 (2019)","10.1103/PhysRevA.100.041802",,"quant-ph","http://arxiv.org/licenses/nonexclusive-distrib/1.0/","  Spontaneous parametric down-conversion (SPDC) is the most widely-used method
to generate higher-order Fock states ($n\geq 2$). Yet, a consistent performance
analysis from fundamental principles is missing. Here we address this problem
by introducing a framework for state fidelity and generation probability under
the consideration of losses and multimode emission. With this analysis we show
the fundamental limitations of this process as well as a trade-off between
state fidelity and generation rate intrinsic to the probabilistic nature of the
process. This identifies the parameter space for which SPDC is useful when
generating higher-order Fock states for quantum applications. We experimentally
investigate the strong pump regime of SPDC and demonstrate heralded Fock states
up to $\lvert n\rangle =4$.
","[{""version"":""v1"",""created"":""Thu, 10 Jan 2019 16:02:47 GMT""}]","2019-10-23"
"1901.03238","Idir Arab","Idir Arab, Milto Hadjikyriakou and Paulo Eduardo Oliveira","On a conjecture about the comparability of parallel systems with respect
  to convex transform order",,,,,"math.PR","http://arxiv.org/licenses/nonexclusive-distrib/1.0/","  In this paper we prove that two heterogeneous parallel systems with
independent exponentially distributed components are comparable via the star
transform order while the comparison via the convex transform fails. The latter
conclusion provides a partial answer to a problem that remained open for a
decade.
","[{""version"":""v1"",""created"":""Thu, 10 Jan 2019 16:02:56 GMT""}]","2019-01-11"
"1901.03239","Emilio Calvanese Strinati","Emilio Calvanese Strinati, Sergio Barbarossa, Jos\'e Luis
  Gonzalez-Jimenez, Dimitri Kt\'enas, Nicolas Cassiau, C\'edric Dehos","6G: The Next Frontier","This paper was submitted to IEEE Vehicular Technologies Magazine on
  the 7th of January 2019",,,,"cs.NI","http://arxiv.org/licenses/nonexclusive-distrib/1.0/","  The current development of 5G networks represents a breakthrough in the
design of communication networks, for its ability to provide a single platform
enabling a variety of different services, from enhanced mobile broadband
communications, automated driving, Internet-of-Things, with its huge number of
connected devices, etc. Nevertheless, looking at the current development of
technologies and new services, it is already possible to envision the need to
move beyond 5G with a new architecture incorporating new services and
technologies. The goal of this paper is to motivate the need to move to a sixth
generation (6G) of mobile communication networks, starting from a gap analysis
of 5G, and predicting a new synthesis of near future services, like hologram
interfaces, ambient sensing intelligence, a pervasive introduction of
artificial intelligence and the incorporation of technologies, like TeraHertz
(THz) or Visible Light Communications (VLC), 3-dimensional coverage.
","[{""version"":""v1"",""created"":""Thu, 10 Jan 2019 16:03:17 GMT""},{""version"":""v2"",""created"":""Thu, 16 May 2019 12:29:00 GMT""}]","2019-05-17"
"1901.03240","Florian Gensheimer","Florian Gensheimer, Tobias Dietz, Kira Kraft, Stefan Ruzika, Norbert
  Wehn","A Reduced-Complexity Projection Algorithm for ADMM-based LP Decoding",,,,,"cs.IT math.IT","http://arxiv.org/licenses/nonexclusive-distrib/1.0/","  The Alternating Direction Method of Multipliers has recently been adapted for
Linear Programming Decoding of Low-Density Parity-Check codes. The computation
of the projection onto the parity polytope is the core of this algorithm and
usually involves a sorting operation, which is the main effort of the
projection.
  In this paper, we present an algorithm with low complexity to compute this
projection. The algorithm relies on new findings in the recursive structure of
the parity polytope and iteratively fixes selected components. It requires up
to 37% less arithmetical operations compared to state-of-the-art projections.
Additionally, it does not involve a sorting operation, which is needed in all
exact state-of-the-art projection algorithms. These two benefits make it
appealing for efficient hard- and software implementations.
","[{""version"":""v1"",""created"":""Thu, 10 Jan 2019 16:06:14 GMT""}]","2019-01-11"
"1901.03241","Sebastian Mai","Sebastian Mai and Felix Plasser and Mathias Pabst and Frank Neese and
  Andreas K\""ohn and Leticia Gonz\'alez","Surface Hopping Dynamics Including Intersystem Crossing using the
  Algebraic Diagrammatic Construction Method","30 pages, 5 figures, 2 tables","J. Chem. Phys. 147, 184109 (2017)","10.1063/1.4999687 10.1063/1.4999687",,"physics.chem-ph","http://arxiv.org/licenses/nonexclusive-distrib/1.0/","  We report an implementation for employing the algebraic diagrammatic
construction to second order [ADC(2)] ab initio electronic structure level of
theory in nonadiabatic dynamics simulations in the framework of the SHARC
(surface hopping including arbitrary couplings) dynamics method. The
implementation is intended to enable computationally efficient, reliable, and
easy-to-use nonadiabatic dynamics simulations of intersystem crossing in
organic molecules. The methodology is evaluated for the 2-thiouracil molecule.
It is shown that ADC(2) yields reliable excited-state energies, wave functions,
and spin-orbit coupling terms for this molecule. Dynamics simulations are
compared to previously reported results using high-level multi-state complete
active space perturbation theory, showing favorable agreement.
","[{""version"":""v1"",""created"":""Thu, 10 Jan 2019 16:07:00 GMT""}]","2019-01-11"
"1901.03242","Sebastian Klein","Sebastian Klein, Martin Kilian","On closed finite gap curves in spaceforms II","21 pages","Journal of Integrable Systems 5 (2020), xyaa002, 25 pages","10.1093/integr/xyaa002",,"math.DG math.DS","http://arxiv.org/licenses/nonexclusive-distrib/1.0/","  We prove that the set of closed finite gap curves in hyperbolic 3-space
$\mathbb{H}^3$ is $W^{2,2}$-dense in the Sobolev space of all closed
$W^{2,2}$-curves in $\mathbb{H}^3$. We also show that the set of closed finite
gap curves in any 2-dimensional space form $\mathbb{E}^2$ is $W^{2,2}$-dense in
the Sobolev space of all closed $W^{2,2}$-curves in $\mathbb{E}^2$.
","[{""version"":""v1"",""created"":""Thu, 10 Jan 2019 16:07:05 GMT""}]","2020-06-16"
"1901.03243","William Norledge","Zhengwei Liu, William Norledge, and Adrian Ocneanu","The adjoint braid arrangement as a combinatorial Lie algebra via the
  Steinmann relations","Rewritten introduction and abstract, some changes to notation, no
  changes to results",,,,"math.CO","http://arxiv.org/licenses/nonexclusive-distrib/1.0/","  We study a certain discrete differentiation of piecewise-constant functions
on the adjoint of the braid hyperplane arrangement, defined by taking
finite-differences across hyperplanes. In terms of Aguiar-Mahajan's Lie theory
of hyperplane arrangements, we show that this structure is equivalent to the
action of Lie elements on faces. We use layered binary trees to encode flags of
adjoint arrangement faces, allowing for the representation of certain Lie
elements by antisymmetrized layered binary forests. This is dual to the
well-known use of (delayered) binary trees to represent Lie elements of the
braid arrangement. The discrete derivative then induces an action of layered
binary forests on piecewise-constant functions, which we call the forest
derivative. Our main result states that forest derivatives of functions
factorize as external products of functions precisely if one restricts to
functions which satisfy the Steinmann relations, which are certain four-term
linear relations appearing in the foundations of axiomatic quantum field
theory. We also show that the forest derivative satisfies the Lie properties of
antisymmetry the Jacobi identity. It follows from these Lie properties, and
also crucially factorization, that functions which satisfy the Steinmann
relations form a left comodule of the Lie cooperad, with the coaction given by
the forest derivative. Dually, this endows the adjoint braid arrangement modulo
the Steinmann relations with the structure of a Lie algebra internal to the
category of vector species. This work is a first step towards describing new
connections between Hopf theory in species and quantum field theory.
","[{""version"":""v1"",""created"":""Thu, 10 Jan 2019 16:07:17 GMT""},{""version"":""v2"",""created"":""Fri, 1 Mar 2019 18:59:33 GMT""},{""version"":""v3"",""created"":""Mon, 6 Jul 2020 13:25:53 GMT""},{""version"":""v4"",""created"":""Wed, 12 Jan 2022 14:09:03 GMT""}]","2022-01-13"
"1901.03244","Lisa Maria Kreusser","Jan Haskovec, Henrik J\""onsson, Lisa Maria Kreusser and Peter
  Markowich","Auxin transport model for leaf venation",,"Proceedings of the Royal Society A, 475 (2231), 20190015, 2019","10.1098/rspa.2019.0015",,"math.DS cs.NA math.AP math.NA","http://creativecommons.org/licenses/by-nc-sa/4.0/","  The plant hormone auxin controls many aspects of the development of plants.
One striking dynamical feature is the self-organisation of leaf venation
patterns which is driven by high levels of auxin within vein cells. The auxin
transport is mediated by specialised membrane-localised proteins. Many venation
models have been based on polarly localised efflux-mediator proteins of the PIN
family. Here, we investigate a modeling framework for auxin transport with a
positive feedback between auxin fluxes and transport capacities that are not
necessarily polar, i.e.\ directional across a cell wall. Our approach is
derived from a discrete graph-based model for biological transportation
networks, where cells are represented by graph nodes and intercellular
membranes by edges. The edges are not a-priori oriented and the direction of
auxin flow is determined by its concentration gradient along the edge. We prove
global existence of solutions to the model and the validity of Murray's law for
its steady states. Moreover, we demonstrate with numerical simulations that the
model is able connect an auxin source-sink pair with a mid-vein and that it can
also produce branching vein patterns. A significant innovative aspect of our
approach is that it allows the passage to a formal macroscopic limit which can
be extended to include network growth. We perform mathematical analysis of the
macroscopic formulation, showing the global existence of weak solutions for an
appropriate parameter range.
","[{""version"":""v1"",""created"":""Thu, 10 Jan 2019 16:08:10 GMT""},{""version"":""v2"",""created"":""Mon, 4 Nov 2019 10:22:37 GMT""}]","2019-12-20"
"1901.03245","Alexander I Golikov","Alexander I. Golikov and Igor E. Kaporin","Inexact Newton method for minimization of convex piecewise quadratic
  functions","16 pages",,,,"math.OC","http://arxiv.org/licenses/nonexclusive-distrib/1.0/","  An inexact Newton type method for numerical minimization of convex piecewise
quadratic functions is considered and its convergence is analyzed. Earlier, a
similar method was successfully applied to optimizaton problems arising in
numerical grid generation. The method can be applied for computing a minimum
norm nonnegative solution of underdetermined system of linear equations or for
finding the distance between two convex polyhedra. The performance of the
method is tested using sample data from NETLIB family of the University of
Florida sparse matrix collection as well as quasirandom data.
","[{""version"":""v1"",""created"":""Thu, 10 Jan 2019 16:12:14 GMT""}]","2019-01-11"
"1901.03246","Julia Menzel","Harald Garcke and Julia Menzel and Alessandra Pluda","Long Time Existence of Solutions to an Elastic Flow of Networks",,,,,"math.AP","http://arxiv.org/licenses/nonexclusive-distrib/1.0/","  The $L^2$--gradient flow of the elastic energy of networks leads to a
Willmore type evolution law with nontrivial nonlinear boundary conditions. We
show local in time existence and uniqueness for this elastic flow of networks
in a Sobolev space setting under natural boundary conditions. In addition we
show a regularisation property and geometric existence and uniqueness. The main
result is a long time existence result using energy methods.
","[{""version"":""v1"",""created"":""Thu, 10 Jan 2019 16:14:07 GMT""},{""version"":""v2"",""created"":""Fri, 11 Jan 2019 09:57:50 GMT""},{""version"":""v3"",""created"":""Mon, 28 Jan 2019 13:37:12 GMT""}]","2019-01-29"
"1901.03247","Alexander Yong","Cara Monical, Benjamin Pankow, Alexander Yong","Reduced word enumeration, complexity, and randomization","23 pages. v2: added reference to University of Washington PhD thesis
  of B. Pawlowski, which proves a stronger version of Theorem 1.1","Electronic J. Combinatorics 29 (2) (2022), #P2.46","10.37236/8560",,"math.CO","http://arxiv.org/licenses/nonexclusive-distrib/1.0/","  A reduced word of a permutation $w$ is a minimal length expression of $w$ as
a product of simple transpositions. We examine the computational complexity,
formulas and (randomized) algorithms for their enumeration. In particular, we
prove that the Edelman-Greene statistic, defined by S. Billey-B. Pawlowski, is
typically exponentially large. This implies a result of B. Pawlowski, that it
has exponentially growing expectation. Our result is established by a formal
run-time analysis of A. Lascoux-M.-P. Sch\""utzenberger's transition algorithm.
The more general problem of Hecke word enumeration, and its closely related
question of counting set-valued standard Young tableaux, is also investigated.
The latter enumeration problem is further motivated by work on Brill-Noether
varieties due to M. Chan-N. Pflueger and D. Anderson-L. Chen-N. Tarasca.
","[{""version"":""v1"",""created"":""Thu, 10 Jan 2019 16:15:00 GMT""},{""version"":""v2"",""created"":""Fri, 15 Feb 2019 21:34:15 GMT""}]","2022-06-08"
"1901.03248","Nguyen Tien Dung","Nguyen Tien Dung","Gaussian lower bounds for the density via Malliavin calculus","To appear in Comptes Rendus Mathematique, 10 pages",,,,"math.PR","http://arxiv.org/licenses/nonexclusive-distrib/1.0/","  In this paper, based on a known formula, we use a simple idea to get a new
representation for the density of Malliavin differentiable random variables.
This new representation is particularly useful for finding lower bounds for the
density.
","[{""version"":""v1"",""created"":""Thu, 10 Jan 2019 16:17:41 GMT""},{""version"":""v2"",""created"":""Sun, 11 Aug 2019 10:42:00 GMT""},{""version"":""v3"",""created"":""Fri, 20 Dec 2019 11:53:12 GMT""}]","2019-12-23"
"1901.03249","Xiangmin Jiao","Aditi Ghai and Xiangmin Jiao","Robust Optimal-Complexity Multilevel ILU for Predominantly Symmetric
  Systems",,,,,"math.NA","http://arxiv.org/licenses/nonexclusive-distrib/1.0/","  Incomplete factorization is a powerful preconditioner for Krylov subspace
methods for solving large-scale sparse linear systems. Existing incomplete
factorization techniques, including incomplete Cholesky and incomplete LU
factorizations, are typically designed for symmetric or nonsymmetric matrices.
For some numerical discretizations of partial differential equations, the
linear systems are often nonsymmetric but predominantly symmetric, in that they
have a large symmetric block. In this work, we propose a multilevel incomplete
LU factorization technique, called PS-MILU, which can take advantage of
predominant symmetry to reduce the factorization time by up to half. PS-MILU
delivers robustness for ill-conditioned linear systems by utilizing diagonal
pivoting and deferred factorization. We take special care in its data
structures and its updating and pivoting steps to ensure optimal time
complexity in input size under some reasonable assumptions. We present
numerical results with PS-MILU as a preconditioner for GMRES for a collection
of predominantly symmetric linear systems from numerical PDEs with unstructured
and structured meshes in 2D and 3D, and show that PS-MILU can speed up
factorization by about a factor of 1.6 for most systems. In addition, we
compare PS-MILU against the multilevel ILU in ILUPACK and the supernodal ILU in
SuperLU to demonstrate its robustness and lower time complexity.
","[{""version"":""v1"",""created"":""Thu, 10 Jan 2019 16:18:50 GMT""}]","2019-01-11"
"1901.03250","Ole Steuernagel","Ole Steuernagel and Andrei Klimov","Isospectral mapping for quantum systems with energy point spectra to
  polynomial quantum harmonic oscillators","5 pages, 6 figures",,"10.1016/j.physleta.2021.127144",,"quant-ph","http://arxiv.org/licenses/nonexclusive-distrib/1.0/","  We show that a polynomial H(N) of degree N of a harmonic oscillator
hamiltonian allows us to devise a fully solvable continuous quantum system for
which the first N discrete energy eigenvalues can be chosen at will. In general
such a choice leads to a re-ordering of the associated energy eigenfunctions of
H such that the number of their nodes does not increase monotonically with
increasing level number. Systems H have certain universal features, we study
their basic behaviours.
","[{""version"":""v1"",""created"":""Thu, 10 Jan 2019 16:19:24 GMT""},{""version"":""v2"",""created"":""Mon, 4 Jan 2021 21:00:31 GMT""}]","2021-02-02"
"1901.03251","Andreas Trautner","Alexander Baur, Hans Peter Nilles, Andreas Trautner, Patrick K.S.
  Vaudrevange","Unification of Flavor, CP, and Modular Symmetries","18 pages, 3 figures; v2: minor changes, version accepted by PLB",,"10.1016/j.physletb.2019.03.066","LMU-ASC 02/19, TUM-HEP 1181/19","hep-th hep-ph","http://arxiv.org/licenses/nonexclusive-distrib/1.0/","  Flavor symmetry plays a crucial role in the standard model of particle
physics but its origin is still unknown. We develop a new method (based on
outer automorphisms of the Narain space group) to determine flavor symmetries
within compactified string theory. A picture emerges where traditional
(discrete) flavor symmetries, CP-like symmetries and modular symmetries (like
T-duality) of string theory combine to unified flavor symmetries. The groups
depend on the geometry of compact space and the geographical location of fields
in the extra dimensions. We observe a phenomenon of ""local flavor groups"" with
potentially different flavor symmetries for the various sectors of quarks and
leptons. This should allow interesting connections to existing bottom-up
attempts in flavor model building.
","[{""version"":""v1"",""created"":""Thu, 10 Jan 2019 16:20:00 GMT""},{""version"":""v2"",""created"":""Fri, 15 Mar 2019 16:44:31 GMT""}]","2019-06-05"
"1901.03252","Veronica Dexheimer Dr.","V. Dexheimer, L. T. T. Soethe, J. Roark, R. O. Gomes, S. O. Kepler and
  S. Schramm","Phase Transitions in Neutron Stars","Invited review for the International Journal of Modern Physics E",,"10.1142/S0218301318300084",,"astro-ph.HE hep-ph nucl-th","http://arxiv.org/licenses/nonexclusive-distrib/1.0/","  In this paper we review the most common descriptions for the first order
phase transition to deconfined quark matter in the core of neutron stars. We
also present a new description of these phase transitions in the core of
proto-neutron stars, in which more constraints are enforced so as to include
trapped neutrinos. Finally, we calculate the emission of gravitational waves
associated with deconfinement phase transitions, discuss the possibility of
their detection, and how this would provide information about the equation of
state of dense matter.
","[{""version"":""v1"",""created"":""Thu, 10 Jan 2019 16:24:48 GMT""}]","2019-01-24"
"1901.03253","Robert West","Robert West and Eric Horvitz","Reverse-Engineering Satire, or ""Paper on Computational Humor Accepted
  Despite Making Serious Advances""","Proceedings of the 33rd AAAI Conference on Artificial Intelligence,
  2019",,,,"cs.AI cs.CL","http://arxiv.org/licenses/nonexclusive-distrib/1.0/","  Humor is an essential human trait. Efforts to understand humor have called
out links between humor and the foundations of cognition, as well as the
importance of humor in social engagement. As such, it is a promising and
important subject of study, with relevance for artificial intelligence and
human-computer interaction. Previous computational work on humor has mostly
operated at a coarse level of granularity, e.g., predicting whether an entire
sentence, paragraph, document, etc., is humorous. As a step toward deep
understanding of humor, we seek fine-grained models of attributes that make a
given text humorous. Starting from the observation that satirical news
headlines tend to resemble serious news headlines, we build and analyze a
corpus of satirical headlines paired with nearly identical but serious
headlines. The corpus is constructed via Unfun.me, an online game that
incentivizes players to make minimal edits to satirical headlines with the goal
of making other players believe the results are serious headlines. The edit
operations used to successfully remove humor pinpoint the words and concepts
that play a key role in making the original, satirical headline funny. Our
analysis reveals that the humor tends to reside toward the end of headlines,
and primarily in noun phrases, and that most satirical headlines follow a
certain logical pattern, which we term false analogy. Overall, this paper
deepens our understanding of the syntactic and semantic structure of satirical
news headlines and provides insights for building humor-producing systems.
","[{""version"":""v1"",""created"":""Thu, 10 Jan 2019 16:25:53 GMT""},{""version"":""v2"",""created"":""Tue, 7 May 2019 16:04:31 GMT""},{""version"":""v3"",""created"":""Tue, 13 Aug 2019 09:35:52 GMT""}]","2019-08-14"
"1901.03254","Tongyang Li","Nai-Hui Chia, Tongyang Li, Han-Hsuan Lin, Chunhao Wang","Quantum-inspired sublinear algorithm for solving low-rank semidefinite
  programming","37 pages, 1 figure. To appear in the Proceedings of the 45th
  International Symposium on Mathematical Foundations of Computer Science (MFCS
  2020)",,,,"cs.DS cs.LG math.OC quant-ph","http://arxiv.org/licenses/nonexclusive-distrib/1.0/","  Semidefinite programming (SDP) is a central topic in mathematical
optimization with extensive studies on its efficient solvers. In this paper, we
present a proof-of-principle sublinear-time algorithm for solving SDPs with
low-rank constraints; specifically, given an SDP with $m$ constraint matrices,
each of dimension $n$ and rank $r$, our algorithm can compute any entry and
efficient descriptions of the spectral decomposition of the solution matrix.
The algorithm runs in time $O(m\cdot\mathrm{poly}(\log n,r,1/\varepsilon))$
given access to a sampling-based low-overhead data structure for the constraint
matrices, where $\varepsilon$ is the precision of the solution. In addition, we
apply our algorithm to a quantum state learning task as an application.
  Technically, our approach aligns with 1) SDP solvers based on the matrix
multiplicative weight (MMW) framework by Arora and Kale [TOC '12]; 2)
sampling-based dequantizing framework pioneered by Tang [STOC '19]. In order to
compute the matrix exponential required in the MMW framework, we introduce two
new techniques that may be of independent interest:
  $\bullet$ Weighted sampling: assuming sampling access to each individual
constraint matrix $A_{1},\ldots,A_{\tau}$, we propose a procedure that gives a
good approximation of $A=A_{1}+\cdots+A_{\tau}$.
  $\bullet$ Symmetric approximation: we propose a sampling procedure that gives
the \emph{spectral decomposition} of a low-rank Hermitian matrix $A$. To the
best of our knowledge, this is the first sampling-based algorithm for spectral
decomposition, as previous works only give singular values and vectors.
","[{""version"":""v1"",""created"":""Thu, 10 Jan 2019 16:26:15 GMT""},{""version"":""v2"",""created"":""Wed, 5 Aug 2020 19:38:50 GMT""}]","2020-08-07"
