"1901.03553","Razvan Marinescu","Razvan V. Marinescu, Arman Eshaghi, Marco Lorenzi, Alexandra L. Young,
  Neil P. Oxtoby, Sara Garbarino, Sebastian J. Crutch, Daniel C. Alexander (for
  the Alzheimer's Disease Neuroimaging Initiative)","DIVE: A spatiotemporal progression model of brain pathology in
  neurodegenerative disorders","24 pages, 5 figures, 2 tables, 1 algorithm","NeuroImage, Volume 192, 15 May 2019, Pages 166-177","10.1016/j.neuroimage.2019.02.053",,"cs.CV cs.LG q-bio.NC q-bio.QM stat.ML","http://creativecommons.org/licenses/by/4.0/","  Here we present DIVE: Data-driven Inference of Vertexwise Evolution. DIVE is
an image-based disease progression model with single-vertex resolution,
designed to reconstruct long-term patterns of brain pathology from short-term
longitudinal data sets. DIVE clusters vertex-wise biomarker measurements on the
cortical surface that have similar temporal dynamics across a patient
population, and concurrently estimates an average trajectory of vertex
measurements in each cluster. DIVE uniquely outputs a parcellation of the
cortex into areas with common progression patterns, leading to a new signature
for individual diseases. DIVE further estimates the disease stage and
progression speed for every visit of every subject, potentially enhancing
stratification for clinical trials or management. On simulated data, DIVE can
recover ground truth clusters and their underlying trajectory, provided the
average trajectories are sufficiently different between clusters. We
demonstrate DIVE on data from two cohorts: the Alzheimer's Disease Neuroimaging
Initiative (ADNI) and the Dementia Research Centre (DRC), UK, containing
patients with Posterior Cortical Atrophy (PCA) as well as typical Alzheimer's
disease (tAD). DIVE finds similar spatial patterns of atrophy for tAD subjects
in the two independent datasets (ADNI and DRC), and further reveals distinct
patterns of pathology in different diseases (tAD vs PCA) and for distinct types
of biomarker data: cortical thickness from Magnetic Resonance Imaging (MRI) vs
amyloid load from Positron Emission Tomography (PET). Finally, DIVE can be used
to estimate a fine-grained spatial distribution of pathology in the brain using
any kind of voxelwise or vertexwise measures including Jacobian compression
maps, fractional anisotropy (FA) maps from diffusion imaging or other PET
measures. DIVE source code is available online:
https://github.com/mrazvan22/dive
","[{""version"":""v1"",""created"":""Fri, 11 Jan 2019 11:13:44 GMT""}]","2019-04-05"
"1901.03554","Kancharagunta Kishan BABU","Kishan Babu Kancharagunta and Shiv Ram Dubey","CSGAN: Cyclic-Synthesized Generative Adversarial Networks for
  Image-to-Image Transformation",,,,,"cs.CV","http://arxiv.org/licenses/nonexclusive-distrib/1.0/","  The primary motivation of Image-to-Image Transformation is to convert an
image of one domain to another domain. Most of the research has been focused on
the task of image transformation for a set of pre-defined domains. Very few
works are reported that actually developed a common framework for
image-to-image transformation for different domains. With the introduction of
Generative Adversarial Networks (GANs) as a general framework for the image
generation problem, there is a tremendous growth in the area of image-to-image
transformation. Most of the research focuses over the suitable objective
function for image-to-image transformation. In this paper, we propose a new
Cyclic-Synthesized Generative Adversarial Networks (CSGAN) for image-to-image
transformation. The proposed CSGAN uses a new objective function (loss) called
Cyclic-Synthesized Loss (CS) between the synthesized image of one domain and
cycled image of another domain. The performance of the proposed CSGAN is
evaluated on two benchmark image-to-image transformation datasets, including
CUHK Face dataset and CMP Facades dataset. The results are computed using the
widely used evaluation metrics such as MSE, SSIM, PSNR, and LPIPS. The
experimental results of the proposed CSGAN approach are compared with the
latest state-of-the-art approaches such as GAN, Pix2Pix, DualGAN, CycleGAN and
PS2GAN. The proposed CSGAN technique outperforms all the methods over CUHK
dataset and exhibits the promising and comparable performance over Facades
dataset in terms of both qualitative and quantitative measures. The code is
available at https://github.com/KishanKancharagunta/CSGAN.
","[{""version"":""v1"",""created"":""Fri, 11 Jan 2019 11:17:34 GMT""}]","2019-01-14"
"1901.03555","Christian Herrmann","Christian Herrmann","Direct finiteness of representable regular rings with involution",,,,,"math.RA","http://arxiv.org/licenses/nonexclusive-distrib/1.0/","  We show that a von Neumann regular ring with involution is directly finite
provided that it admits a representation as a ring of endomorphisms (the
involution given by taking adjoints) of a vector space endowed with a
non-degenerate orthosymmetric sesquilinear form.
","[{""version"":""v1"",""created"":""Fri, 11 Jan 2019 11:23:38 GMT""},{""version"":""v2"",""created"":""Thu, 25 Jul 2019 16:29:03 GMT""},{""version"":""v3"",""created"":""Wed, 7 Aug 2019 09:37:23 GMT""}]","2019-08-08"
"1901.03556","Steffen Lauritzen","Nadine Gissibl and Claudia Kl\""uppelberg and Steffen Lauritzen","Identifiability and estimation of recursive max-linear models",,,,,"math.ST stat.TH","http://arxiv.org/licenses/nonexclusive-distrib/1.0/","  We address the identifiablity and estimation of recursive max-linear
structural equation models represented by an edge weighted directed acyclic
graph (DAG). Such models are generally unidentifiable and we identify the whole
class of DAGs and edge weights corresponding to a given observational
distribution. For estimation, standard likelihood theory cannot be applied
because the corresponding families of distributions are not dominated. Given
the underlying DAG, we present an estimator for the class of edge weights and
show that it can be considered a generalized maximum likelihood estimator. In
addition, we develop a simple method for identifying the structures of the
DAGs. With probability tending to one at an exponential rate with the number of
observations, this method correctly identifies the class of DAGs and,
similarly, exactly identifies the possible edge weights.
","[{""version"":""v1"",""created"":""Fri, 11 Jan 2019 11:24:44 GMT""},{""version"":""v2"",""created"":""Mon, 7 Oct 2019 09:16:20 GMT""}]","2019-10-08"
"1901.03557","Joshua Haustein","Joshua A. Haustein, Isac Arnekvist, Johannes Stork, Kaiyu Hang, Danica
  Kragic","Learning Manipulation States and Actions for Efficient Non-prehensile
  Rearrangement Planning",,,,,"cs.RO","http://arxiv.org/licenses/nonexclusive-distrib/1.0/","  This paper addresses non-prehensile rearrangement planning problems where a
robot is tasked to rearrange objects among obstacles on a planar surface. We
present an efficient planning algorithm that is designed to impose few
assumptions on the robot's non-prehensile manipulation abilities and is simple
to adapt to different robot embodiments. For this, we combine sampling-based
motion planning with reinforcement learning and generative modeling. Our
algorithm explores the composite configuration space of objects and robot as a
search over robot actions, forward simulated in a physics model. This search is
guided by a generative model that provides robot states from which an object
can be transported towards a desired state, and a learned policy that provides
corresponding robot actions. As an efficient generative model, we apply
Generative Adversarial Networks. We implement and evaluate our approach for
robots endowed with configuration spaces in SE(2). We demonstrate empirically
the efficacy of our algorithm design choices and observe more than 2x speedup
in planning time on various test scenarios compared to a state-of-the-art
approach.
","[{""version"":""v1"",""created"":""Fri, 11 Jan 2019 11:25:52 GMT""}]","2019-01-14"
"1901.03558","Laszlo Feher","L. Feher","Bi-Hamiltonian structure of a dynamical system introduced by Braden and
  Hone","18 pages, references and some explanations added in v2","Nonlinearity 32 (2019) 4377-4394","10.1088/1361-6544/ab2d5e",,"math-ph hep-th math.MP nlin.SI","http://arxiv.org/licenses/nonexclusive-distrib/1.0/","  We investigate the finite dimensional dynamical system derived by Braden and
Hone in 1996 from the solitons of $A_{n-1}$ affine Toda field theory. This
system of evolution equations for an $n\times n$ Hermitian matrix $L$ and a
real diagonal matrix $q$ with distinct eigenvalues was interpreted as a special
case of the spin Ruijsenaars--Schneider models due to Krichever and Zabrodin. A
decade later, L.-C. Li re-derived the model from a general framework built on
coboundary dynamical Poisson groupoids. This led to a Hamiltonian description
of the gauge invariant content of the model, where the gauge transformations
act as conjugations of $L$ by diagonal unitary matrices. Here, we point out
that the same dynamics can be interpreted also as a special case of the spin
Sutherland systems obtained by reducing the free geodesic motion on symmetric
spaces, studied by Pusztai and the author in 2006; the relevant symmetric space
being $\mathrm{GL}(n,\mathbb{C})/ \mathrm{U}(n)$. This construction provides an
alternative Hamiltonian interpretation of the Braden--Hone dynamics. We prove
that the two Poisson brackets are compatible and yield a bi-Hamiltonian
description of the standard commuting flows of the model.
","[{""version"":""v1"",""created"":""Fri, 11 Jan 2019 11:42:11 GMT""},{""version"":""v2"",""created"":""Wed, 16 Oct 2019 08:45:26 GMT""}]","2019-11-04"
"1901.03559","Mehdi Mirza","Arthur Guez, Mehdi Mirza, Karol Gregor, Rishabh Kabra, S\'ebastien
  Racani\`ere, Th\'eophane Weber, David Raposo, Adam Santoro, Laurent Orseau,
  Tom Eccles, Greg Wayne, David Silver, Timothy Lillicrap","An investigation of model-free planning",,,,,"cs.LG cs.AI stat.ML","http://arxiv.org/licenses/nonexclusive-distrib/1.0/","  The field of reinforcement learning (RL) is facing increasingly challenging
domains with combinatorial complexity. For an RL agent to address these
challenges, it is essential that it can plan effectively. Prior work has
typically utilized an explicit model of the environment, combined with a
specific planning algorithm (such as tree search). More recently, a new family
of methods have been proposed that learn how to plan, by providing the
structure for planning via an inductive bias in the function approximator (such
as a tree structured neural network), trained end-to-end by a model-free RL
algorithm. In this paper, we go even further, and demonstrate empirically that
an entirely model-free approach, without special structure beyond standard
neural network components such as convolutional networks and LSTMs, can learn
to exhibit many of the characteristics typically associated with a model-based
planner. We measure our agent's effectiveness at planning in terms of its
ability to generalize across a combinatorial and irreversible state space, its
data efficiency, and its ability to utilize additional thinking time. We find
that our agent has many of the characteristics that one might expect to find in
a planning algorithm. Furthermore, it exceeds the state-of-the-art in
challenging combinatorial domains such as Sokoban and outperforms other
model-free approaches that utilize strong inductive biases toward planning.
","[{""version"":""v1"",""created"":""Fri, 11 Jan 2019 11:42:51 GMT""},{""version"":""v2"",""created"":""Mon, 20 May 2019 12:39:51 GMT""}]","2019-05-21"
"1901.03560","Siddhartha Sarkar","Siddhartha Sarkar, Renu Joshi","A survey on the Non-inner Automorphism Conjecture",,,,,"math.GR","http://arxiv.org/licenses/nonexclusive-distrib/1.0/","  In this survey article, we try to summarize the known results towards the
long-standing non-inner automorphism conjecture, which states that every finite
non-abelian $p$-group has a non-inner automorphism of order $p$.
","[{""version"":""v1"",""created"":""Fri, 11 Jan 2019 11:46:20 GMT""},{""version"":""v2"",""created"":""Thu, 19 Mar 2020 18:18:26 GMT""}]","2020-03-23"
"1901.03561","I. S. Burmistrov","I. S. Burmistrov, M. Goldstein, M. Kot, V. D. Kurilovich, P. D.
  Kurilovich","Dissipative and Hall viscosity of a disordered 2D electron gas","7 pages, 4 figures, Supplemental material","Phys. Rev. Lett. 123, 026804 (2019)","10.1103/PhysRevLett.123.026804",,"cond-mat.mes-hall","http://arxiv.org/licenses/nonexclusive-distrib/1.0/","  We study the dissipative and Hall viscosity of a disordered noninteracting 2D
electrons, both analytically and numerically. Analytically, we employ the
self-consistent Born approximation, explicitly taking into account the
modification of the single-particle density of states and the elastic transport
time due to the Landau quantization. The reported results interpolate smoothly
between the limiting cases of weak (strong) magnetic field and strong (weak)
disorder. In the regime of weak magnetic field, our results describes the
quantum (de Haas-van Alphen type) oscillations of the dissipative and Hall
viscosity. For strong magnetic field, we computed the dependence of the
dissipative and Hall viscosity on disorder broadening of a Landau level. In
particular, for the Hall viscosity the effect of the disorder broadening is
weak. This theoretical conclusion is in agreement with our numerical results
for a few lowest Landau levels, which show that Hall viscosity is robust to
disorder.
","[{""version"":""v1"",""created"":""Fri, 11 Jan 2019 11:51:21 GMT""},{""version"":""v2"",""created"":""Thu, 4 Jul 2019 09:49:32 GMT""}]","2019-07-17"
"1901.03562","Gurgen Adamian","I. B. Abdurakhmanov, Z. Kanokov, G. G. Adamian, N. V. Antonenko","Open quantum system in external magnetic field within non-Markovian
  quantum Langevin approach","31 pages, 8 figures. arXiv admin note: text overlap with
  arXiv:1806.10602, arXiv:1806.01685",,"10.1016/j.physa.2018.09.071",,"quant-ph","http://arxiv.org/licenses/nonexclusive-distrib/1.0/","  The non-Markovian dynamics of a charged particle linearly coupled to a
neutral bosonic heat bath is investigated in an external uniform magnetic
field. The analytical expressions for the time-dependent and asymptotic
friction and diffusion coefficients, cyclotron frequencies, variances of the
coordinate and momentum, and orbital magnetic moments are derived. The role of
magnetic field in the dissipation and diffusion processes is illustrated by
several examples in the low- and high-temperature regimes. The localization
phenomenon for a charged particle is observed. The orbital diamagnetism of
quantum system in a dissipative environment is studied. The quantization
conditions are found for the angular momentum.
","[{""version"":""v1"",""created"":""Fri, 11 Jan 2019 11:54:43 GMT""}]","2019-01-16"
"1901.03563","Prosenjit Kundu","Prosenjit Kundu, Lekha Sharma, Mauparna Nandan, Dibakar Ghosh,
  Chittaranjan Hens, and Pinaki Pal","Emergent dynamics in delayed attractive-repulsively coupled networks","Accepted for publication in Chaos",,"10.1063/1.5051535",,"nlin.AO nlin.CD","http://arxiv.org/licenses/nonexclusive-distrib/1.0/","  We investigate different emergent dynamics namely oscillation quenching and
revival of oscillation in a global network of identical oscillators coupled
with diffusive (positive) delay coupling as it is perturbed by symmetry
breaking localized repulsive delayed interaction. Starting from the oscillatory
states (OS) we systematically identify three types of transition phenomena in
the parameter space: (1) The system may reach inhomogeneous steady states
(IHSS) from the homogeneous steady state (HSS) sometimes called as the
transition from amplitude death (AD) to oscillation death (OD) state i.e.
OS-AD-OD scenario, (2) Revival of oscillation (OS) from the AD state (OS-AD-OS)
and (3) Emergence of OD state from oscillatory state (OS) without passing
through AD i.e. OS-OD. The dynamics of each node in the network is assumed to
be governed either by identical limit cycle Stuart-Landau system or by chaotic
Rossler system. Based on clustering behavior observed in oscillatory network we
derive a reduced low-dimensional model of the large network. Using the reduced
model, we investigate the effect of time delay on these transitions and
demarcate OS, AD and OD regimes in the parameter space. We also explore and
characterize the bifurcation transitions present in both systems. The generic
behavior of the low dimensional model and full network are found to match
satisfactorily.
","[{""version"":""v1"",""created"":""Fri, 11 Jan 2019 11:54:44 GMT""},{""version"":""v2"",""created"":""Mon, 14 Jan 2019 05:42:58 GMT""}]","2019-02-20"
"1901.03564","Nicola Gigli","Nicola Gigli, Alexander Tyulenev","Korevaar-Schoen's directional energy and Ambrosio's regular Lagrangian
  flows","Minor revisions over previous version",,,,"math.FA","http://arxiv.org/licenses/nonexclusive-distrib/1.0/","  We develop Korevaar-Schoen's theory of directional energies for metric-valued
Sobolev maps in the case of ${\sf RCD}$ source spaces; to do so we crucially
rely on Ambrosio's concept of Regular Lagrangian Flow.
  Our review of Korevaar-Schoen's spaces brings new (even in the smooth
category) insights on some aspects of the theory, in particular concerning the
notion of `differential of a map along a vector field' and about the
parallelogram identity for ${\sf CAT}(0)$ targets. To achieve these, one of the
ingredients we use is a new (even in the Euclidean setting) stability result
for Regular Lagrangian Flows.
","[{""version"":""v1"",""created"":""Fri, 11 Jan 2019 11:56:05 GMT""},{""version"":""v2"",""created"":""Thu, 8 Oct 2020 08:45:59 GMT""}]","2020-10-09"
"1901.03565","Michael McCann","Michael T. McCann and Michael Unser","Biomedical Image Reconstruction: From the Foundations to Deep Neural
  Networks",,"Foundations and Trends in Signal Processing, vol. 13, no. 3, Art.
  no. 3, Dec. 2019","10.1561/2000000101",,"eess.IV","http://arxiv.org/licenses/nonexclusive-distrib/1.0/","  This tutorial covers biomedical image reconstruction, from the foundational
concepts of system modeling and direct reconstruction to modern sparsity and
learning-based approaches.
  Imaging is a critical tool in biological research and medicine, and most
imaging systems necessarily use an image-reconstruction algorithm to create an
image; the design of these algorithms has been a topic of research since at
least the 1960's. In the last few years, machine learning-based approaches have
shown impressive performance on image reconstruction problems, triggering a
wave of enthusiasm and creativity around the paradigm of learning. Our goal is
to unify this body of research, identifying common principles and reusable
building blocks across decades and among diverse imaging modalities.
  We first describe system modeling, emphasizing how a few building blocks can
be used to describe a broad range of imaging modalities. We then discuss
reconstruction algorithms, grouping them into three broad generations. The
first are the classical direct methods, including Tikhonov regularization; the
second are the variational methods based on sparsity and the theory of
compressive sensing; and the third are the learning-based (also called
data-driven) methods, especially those using deep convolutional neural
networks. There are strong links between these generations: classical
(first-generation) methods appear as modules inside the latter two, and the
former two are used to inspire new designs for learning-based
(third-generation) methods. As a result, a solid understanding of all of three
generations is necessary for the design of state-of-the-art algorithms.
","[{""version"":""v1"",""created"":""Fri, 11 Jan 2019 12:07:16 GMT""},{""version"":""v2"",""created"":""Mon, 11 Nov 2019 20:10:11 GMT""},{""version"":""v3"",""created"":""Thu, 11 Mar 2021 16:34:07 GMT""}]","2021-03-12"
"1901.03566","Joeri Brackenhoff","Joeri Brackenhoff, Jan Thorbecke and Kees Wapenaar","Virtual sources and receivers in the real Earth -- considerations for
  practical applications",,"Journal of Geophysical Research: Solid Earth, 124, 11802-11821
  (2019)","10.1029/2019JB018485",,"physics.geo-ph","http://creativecommons.org/licenses/by/4.0/","  To enhance monitoring of the subsurface, virtual sources and receivers inside
the subsurface can be created from seismic reflection data at the surface of
the Earth using the Marchenko method. The response between these virtual
sources and receivers can be obtained through the use of homogeneous Green's
function retrieval. A homogeneous Green's function is a superposition of a
Green's function and its time-reversal. The main aim of this paper is to obtain
accurate homogeneous Green's functions from field data. Classical homogeneous
Green's function retrieval requires an unrealistic enclosing recording surface,
however, by using a recently proposed single-sided retrieval scheme, this
requirement can be avoided. We first demonstrate the principles of using the
single-sided representation on synthetic data and show that different source
signatures can be taken into account. Because the Marchenko method is sensitive
to recording limitations of the reflection data, we study five cases of
recording limitations with synthetic data and demonstrate their effects on the
final result. Finally, the method is demonstrated on a pre-processed field
dataset which fulfills the requirements for applying the single-sided Green's
function retrieval scheme. The scheme has the potential to be used in future
applications, such as source localization.
","[{""version"":""v1"",""created"":""Fri, 11 Jan 2019 12:10:59 GMT""},{""version"":""v2"",""created"":""Fri, 18 Sep 2020 11:50:19 GMT""}]","2020-09-21"
"1901.03567","Paige Randall North","Paige Randall North","Identity types and weak factorization systems in Cauchy complete
  categories","14 pages",,"10.1017/S0960129519000033",,"math.CT cs.LO","http://arxiv.org/licenses/nonexclusive-distrib/1.0/","  It has been known that categorical interpretations of dependent type theory
with Sigma- and Id-types induce weak factorization systems. When one has a weak
factorization system (L, R) on a category C in hand, it is then natural to ask
whether or not (L, R) harbors an interpretation of dependent type theory with
Sigma- and Id- (and possibly Pi-) types. Using the framework of display map
categories to phrase this question more precisely, one would ask whether or not
there exists a class D of morphisms of C such that the retract closure of D is
the class R and the pair (C, D) forms a display map category modeling Sigma-
and Id- (and possibly Pi-) types. In this paper, we show, with the hypothesis
that C is Cauchy complete, that there exists such a class D if and only if
(C,R) itself forms a display map category modeling Sigma- and Id- (and possibly
Pi-) types. Thus, we reduce the search space of our original question from a
potentially proper class to a singleton.
","[{""version"":""v1"",""created"":""Fri, 11 Jan 2019 12:13:31 GMT""}]","2019-06-03"
"1901.03568","Jordi Pailliss\'e Vilanova","Jordi Paillisse and Jordi Subira and Albert Lopez and Alberto
  Rodriguez-Natal and Vina Ermagan and Fabio Maino and Albert Cabellos","Distributed Access Control with Blockchain","7 pages, 9 figures, 2 tables",,,,"cs.NI cs.CR","http://arxiv.org/licenses/nonexclusive-distrib/1.0/","  The specification and enforcement of network-wide policies in a single
administrative domain is common in today's networks and considered as already
resolved. However, this is not the case for multi-administrative domains, e.g.
among different enterprises. In such situation, new problems arise that
challenge classical solutions such as PKIs, which suffer from scalability and
granularity concerns. In this paper, we present an extension to Group-Based
Policy -- a widely used network policy language -- for the aforementioned
scenario. To do so, we take advantage of a permissioned blockchain
implementation (Hyperledger Fabric) to distribute access control policies in a
secure and auditable manner, preserving at the same time the independence of
each organization. Network administrators specify polices that are rendered
into blockchain transactions. A LISP control plane (RFC 6830) allows routers
performing the access control to query the blockchain for authorizations. We
have implemented an end-to-end experimental prototype and evaluated it in terms
of scalability and network latency.
","[{""version"":""v1"",""created"":""Fri, 11 Jan 2019 12:15:31 GMT""}]","2019-01-14"
