"1901.03449","I-Te Lu","I-Te Lu, Jin-Jian Zhou, Marco Bernardi","Efficient Ab Initio Calculations of Electron-Defect Scattering and
  Defect-Limited Carrier Mobility","11 pages, 5 figures, submitted","Phys. Rev. Materials 3, 033804 (2019)","10.1103/PhysRevMaterials.3.033804",,"cond-mat.mtrl-sci","http://arxiv.org/licenses/nonexclusive-distrib/1.0/","  Electron-defect ($e$-d) interactions govern charge carrier dynamics at low
temperature, where they limit the carrier mobility and give rise to phenomena
of broad relevance in condensed matter physics. Ab initio calculations of $e$-d
interactions are still in their infancy, mainly because they require large
supercells and computationally expensive workflows. Here we develop an
efficient ab initio approach for computing elastic $e$-d interactions, their
associated $e$-d relaxation times (RTs), and the low-temperature defect-limited
carrier mobility. The method is applied to silicon with simple neutral defects,
such as vacancies and interstitials. Contrary to conventional wisdom, the
computed $e$-d RTs depend strongly on carrier energy and defect type, and the
defect-limited mobility is temperature dependent. These results highlight the
shortcomings of widely employed heuristic models of $e$-d interactions in
materials. Our method opens new avenues for studying $e$-d scattering and
low-temperature charge transport from first principles.
","[{""version"":""v1"",""created"":""Fri, 11 Jan 2019 01:48:26 GMT""}]","2020-03-19"
"1901.03450","Rong Zheng","Chao Cai, Rong Zheng, Jun Luo","Ubiquitous Acoustic Sensing on Commodity IoT Devices: A Survey",,,,,"cs.SD cs.HC cs.LG eess.AS","http://arxiv.org/licenses/nonexclusive-distrib/1.0/","  With the proliferation of Internet-of-Things devices, acoustic sensing
attracts much attention in recent years. It exploits acoustic transceivers such
as microphones and speakers beyond their primary functions, namely recording
and playing, to enable novel applications and new user experiences. In this
paper, we present the first systematic survey of recent advances in active
acoustic sensing using commodity hardware with a frequency range below
24~\!kHz. We propose a general framework that categorizes main building blocks
of acoustic sensing systems. This framework encompasses three layers, i.e.,
physical layer, core technique layer, and application layer. The physical layer
includes basic hardware components, acoustic platforms as well as the air-borne
and structure-borne channel characteristics. The core technique layer
encompasses key mechanisms to generate acoustic signals (waveforms) and to
extract useful temporal, spatial and spectral information from received
signals. The application layer builds upon the functions offered by the core
techniques to realize different acoustic sensing applications. We highlight
unique challenges due to the limitations of physical devices and acoustic
channels and how they are mitigated or overcame by core processing techniques
and application-specific solutions. Finally, research opportunities and future
directions are discussed to spawn further in-depth investigation on acoustic
sensing.
","[{""version"":""v1"",""created"":""Fri, 11 Jan 2019 01:58:35 GMT""},{""version"":""v2"",""created"":""Thu, 12 Aug 2021 04:30:13 GMT""}]","2021-08-13"
"1901.03451","Thomas Fleming","Thomas Fleming, Joel Foisy","Intrinsic linking and knotting in tournaments","16 pages, 4 figures",,,,"math.GT math.CO","http://arxiv.org/licenses/nonexclusive-distrib/1.0/","  A directed graph $G$ is $\textit{intrinsically linked}$ if every embedding of
that graph contains a non-split link $L$, where each component of $L$ is a
consistently oriented cycle in $G$. A $\textit{tournament}$ is a directed graph
where each pair of vertices is connected by exactly one directed edge. We
consider intrinsic linking and knotting in tournaments, and study the minimum
number of vertices required for a tournament to have various intrinsic linking
or knotting properties. We produce the following bounds: intrinsically linked
($n=8$), intrinsically knotted ($9 \leq n \leq 12$), intrinsically 3-linked
($10 \leq n \leq 23$), intrinsically 4-linked ($12 \leq n \leq 66$),
intrinsically 5-linked ($15 \leq n \leq 154$), intrinsically $m$-linked ($3m
\leq n \leq 8(2m-3)^2$), intrinsically linked with knotted components ($9 \leq
n \leq 107$), and the disjoint linking property ($12 \leq n \leq 14$). We also
introduce the $\textit{consistency gap}$, which measures the difference in the
order of a graph required for intrinsic $n$-linking in tournaments versus
undirected graphs. We conjecture the consistency gap to be non-decreasing in
$n$, and provide an upper bound at each $n$.
","[{""version"":""v1"",""created"":""Fri, 11 Jan 2019 01:58:46 GMT""}]","2019-01-14"
"1901.03452","Hsi-Wei Yen","Hsi-Wei Yen, Shigehisa Takakuwa, Pin-Gao Gu, Naomi Hirano, Chin-Fei
  Lee, Hauyu Baobab Liu, Sheng-Yuan Liu, Chun-Ju Wu","Signs of outflow feedback from a nearby young stellar object on the
  protostellar envelope around HL Tau","Accepted by A&A","A&A 623, A96 (2019)","10.1051/0004-6361/201834209",,"astro-ph.SR astro-ph.GA","http://arxiv.org/licenses/nonexclusive-distrib/1.0/","  HL Tau is a Class I-II protostar embedded in an infalling and rotating
envelope and possibly associated with a planet forming disk, and it is
co-located in a 0.1 pc molecular cloud with two nearby young stellar objects.
Our ALMA observations revealed two arc-like structures on a 1000 au scale
connected to the disk, and their kinematics could not be explained with any
conventional model of infalling and rotational motions. In this work, we
investigate the nature of these arc-like structures connected to the HL Tau
disk. We conducted new observations in the 13CO and C18O (3-2; 2-1) lines with
JCMT and IRAM 30m, and obtained the ACA data with the 7-m array. With the
single-dish, ACA, and ALMA data, we analyzed the gas motions on both 0.1 pc and
1000 au scales in the HL Tau region. We constructed new kinematical models of
an infalling and rotating envelope with the consideration of relative motion
between HL Tau and the envelope. By including the relative motion between HL
Tau and its protostellar envelope, our kinematical model can explain the
observed velocity features in the arc-like structures. The morphologies of the
arc-like structures can also be explained with an asymmetric initial density
distribution in our model envelope. In addition, our single-dish results
support that HL Tau is located at the edge of a large-scale (0.1 pc) expanding
shell driven by the wind or outflow from XZ Tau, as suggested in the
literature. The estimated expanding velocity of the shell is comparable to the
relative velocity between HL Tau and its envelope in our kinematical model.
These results hints that the large-scale expanding motion likely impacts the
protostellar envelope around HL Tau and affects its gas kinematics. We found
that the mass infalling rate from the envelope onto the HL Tau disk can be
decreased by a factor of two due to this impact by the large-scale expanding
shell.
","[{""version"":""v1"",""created"":""Fri, 11 Jan 2019 02:00:37 GMT""}]","2019-03-13"
"1901.03453","Karl Liechty","Jeffrey S. Geronimo and Karl Liechty","The Fourier extension method and discrete orthogonal polynomials on an
  arc of the circle","48 pages, 3 figures. v.2 corrects typos and adds Corollary 1.5 for
  clarity","Advances in Mathematics 365 (2020): 107064",,,"math.NA cs.NA","http://arxiv.org/licenses/nonexclusive-distrib/1.0/","  The Fourier extension method, also known as the Fourier continuation method,
is a method for approximating non-periodic functions on an interval using
truncated Fourier series with period larger than the interval on which the
function is defined. When the function being approximated is known at only
finitely many points, the approximation is constructed as a projection based on
this discrete set of points. In this paper we address the issue of estimating
the absolute error in the approximation. The error can be expressed in terms of
a system of discrete orthogonal polynomials on an arc of the unit circle, and
these polynomials are then evaluated asymptotically using Riemann--Hilbert
methods.
","[{""version"":""v1"",""created"":""Fri, 11 Jan 2019 02:05:25 GMT""},{""version"":""v2"",""created"":""Fri, 5 Nov 2021 14:57:13 GMT""}]","2021-11-08"
"1901.03454","Genwei Ma Mr","Genwei Ma, Yining Zhu, Xing Zhao","Learning image from projection: a full-automatic reconstruction (FAR)
  net for sparse-views computed tomography",,,,,"physics.med-ph eess.IV","http://arxiv.org/licenses/nonexclusive-distrib/1.0/","  The sparse-views x-ray computed tomography (CT) is essential for medical
diagnosis and industrial nondestructive testing. However, in particular, the
reconstructed image usually suffers from complex artifacts and noise, when the
sampling is insufficient. In order to deal such issue, a full-automatic
reconstruction (FAR) net is proposed for sparse-views CT reconstruction via
deep learning technique. Different with the usual network in deep learning
reconstruction, the proposed neural network is an End-to-End network by which
the image is predicted directly from projection data. The main challenge for
such a FAR net is the space complexity of the CT reconstruction in
full-connected (FC) network. For a CT image with the size $N \times N$ , a
typical requirement of memory space for the image reconstruction is $O(N^{4})$,
for which is unacceptable by conventional calculation device, e.g. GPU
workstation. In this paper, we utilize a series of smaller FC layers to replace
the huge based on the sparse nonnegative matrix factorization (SNMF) theory. By
applying such an approach, the FAR net is able to reconstruct sparse-views CT
images with the size $512\times 512$ on only one workstation. Furthermore, a
Res-Unet structure is composed in the FAR net for suppressing the artifacts and
noise caused by under-sampling data. The results of numerical experiments show
that the projection matrix and the FAR net is able to reconstruct the CT image
from sparse-views projection data with a superior quality than conventional
method such as FBP and optimization based approach. Meanwhile, the
factorization for the inverse projection matrix is validated in numerical.
","[{""version"":""v1"",""created"":""Fri, 11 Jan 2019 02:05:33 GMT""},{""version"":""v2"",""created"":""Mon, 7 Oct 2019 12:39:44 GMT""}]","2019-10-08"
"1901.03455","Bolin Liao","Alejandro Vega-Flick, Daehwan Jung, Shengying Yue, John E. Bowers and
  Bolin Liao","Reduced thermal conductivity of epitaxial GaAs on Si due to
  symmetry-breaking biaxial strain","8 pages, 8 figures","Phys. Rev. Materials 3, 034603 (2019)","10.1103/PhysRevMaterials.3.034603",,"cond-mat.mtrl-sci","http://arxiv.org/licenses/nonexclusive-distrib/1.0/","  Epitaxial growth of III-V semiconductors on Si is a promising route for
silicon photonics. Threading dislocations and the residual thermal stress
generated during growth are expected to affect the thermal conductivity of the
III-V semiconductors, which is crucial for efficient heat dissipation from
photonic devices built on this platform. In this work, we combine a non-contact
laser-induced transient thermal grating technique with ab initio phonon
simulations to investigate the in-plane thermal transport of epitaxial
GaAs-based buffer layers on Si, employed in the fabrication of III-V quantum
dot lasers. Surprisingly, we find a significant reduction of the in-plane
thermal conductivity of GaAs, up to 19%, as a result of a small in-plane
biaxial stress of 250 MPa. Using ab initio phonon calculations, we attribute
this effect to the enhancement of phonon-phonon scattering caused by the
in-plane biaxial stress, which breaks the cubic crystal symmetry of GaAs. Our
results indicate the importance of eliminating the residual thermal stress in
the epitaxial III-V layers on Si to avoid the reduction of thermal conductivity
and facilitate heat dissipation. Additionally, our results showcase potential
means of effectively controlling thermal conductivity of solids with external
strain/stress.
","[{""version"":""v1"",""created"":""Fri, 11 Jan 2019 02:07:16 GMT""}]","2019-03-27"
"1901.03456","Ryan  Hynd","Ryan Hynd","Lagrangian coordinates for the sticky particle system",,,,,"math.AP","http://arxiv.org/licenses/nonexclusive-distrib/1.0/","  The sticky particle system is a system of partial differential equations
which assert the conservation of mass and momentum of a collection of particles
that interact only via inelastic collisions. These equations arise in
Zel'dovich's theory for the formation of large scale structures in the
universe. We will show that this system of equations has a solution in one
spatial dimension for given initial conditions by generating a trajectory
mapping in Lagrangian coordinates.
","[{""version"":""v1"",""created"":""Fri, 11 Jan 2019 02:22:41 GMT""},{""version"":""v2"",""created"":""Mon, 14 Jan 2019 19:50:50 GMT""},{""version"":""v3"",""created"":""Sun, 20 Jan 2019 03:24:51 GMT""},{""version"":""v4"",""created"":""Wed, 30 Jan 2019 18:05:52 GMT""},{""version"":""v5"",""created"":""Sun, 16 Jun 2019 23:21:33 GMT""}]","2019-06-18"
"1901.03457","Tigran V. Shahbazyan","Mohamed ElKabbash, Ermanno Miele, Ahmad K. Fumani, Michael S. Wolf,
  Angelo Bozzola, Elisha Haber, Tigran V. Shahbazyan, Jesse Berezovsky,
  Francesco De Angelis, Giuseppe Strangi","Cooperative energy transfer controls the spontaneous emission rate
  beyond field enhancement limits","23 pages. Includes Supplemental Material","Phys. Rev. Lett. 122, 203901 (2019)","10.1103/PhysRevLett.122.203901",,"cond-mat.mes-hall physics.optics","http://arxiv.org/licenses/nonexclusive-distrib/1.0/","  Quantum emitters located in proximity to a metal nanostructure individually
transfer their energy via near-field excitation of surface plasmons. The energy
transfer process increases the spontaneous emission (SE) rate due to
plasmon-enhanced local field. Here, we demonstrate significant acceleration of
quantum emitter SE rate in a plasmonic nano-cavity due to cooperative energy
transfer (CET) from plasmon-correlated emitters. Using an integrated plasmonic
nano-cavity, we realize up to six-fold enhancement in the emission rate of
emitters coupled to the same nano-cavity on top of the plasmonic enhancement of
the local density of states. The radiated power spectrum retains the plasmon
resonance central frequency and lineshape, with the peak amplitude proportional
to the number of excited emitters indicating that the observed cooperative SE
is distinct from super-radiance. Plasmon-assisted CET offers unprecedented
control over the SE rate and allows to dynamically control the spontaneous
emission rate at room temperature enabling an SE rate based optical modulator.
","[{""version"":""v1"",""created"":""Fri, 11 Jan 2019 02:24:03 GMT""}]","2019-05-29"
"1901.03458","Khashayar Filom","Khashayar Filom","Monotonicity of entropy for real quadratic rational maps","The statement of Theorem 6.2 is made more precise, and its proof is
  shortened. Lemma 6.5 and Remark 6.9 are new. To appear in Nonlinearity. May
  vary slightly from the published version. 51 pages, 16 figures","Nonlinearity 34 (2021), 6587--6626","10.1088/1361-6544/ac15aa",,"math.DS","http://arxiv.org/licenses/nonexclusive-distrib/1.0/","  The monotonicity of entropy is investigated for real quadratic rational maps
on the real circle $\mathbb{R}\cup\{\infty\}$ based on the natural partition of
the corresponding moduli space $\mathcal{M}_2(\mathbb{R})$ into its monotonic,
covering, unimodal and bimodal regions. Utilizing the theory of polynomial-like
mappings, we prove that the level sets of the real entropy function
$h_\mathbb{R}$ are connected in the $(-+-)$-bimodal region and a portion of the
unimodal region in $\mathcal{M}_2(\mathbb{R})$. Based on the numerical
evidence, we conjecture that the monotonicity holds throughout the unimodal
region, but we conjecture that it fails in the region of $(+-+)$-bimodal maps.
","[{""version"":""v1"",""created"":""Fri, 11 Jan 2019 02:25:14 GMT""},{""version"":""v2"",""created"":""Mon, 21 Sep 2020 17:17:27 GMT""},{""version"":""v3"",""created"":""Mon, 26 Jul 2021 17:40:49 GMT""}]","2021-08-20"
"1901.03459","Yan Zhao","Yan Zhao, Lu Liu, Chunhua Liu, Ruoyao Yang and Dong Yu","From Plots to Endings: A Reinforced Pointer Generator for Story Ending
  Generation","12 pages, 1 figure, NLPCC 2018","Natural Language Processing and Chinese Computing. NLPCC 2018.
  Lecture Notes in Computer Science, vol 11108. Springer, Cham","10.1007/978-3-319-99495-6_5",,"cs.CL","http://arxiv.org/licenses/nonexclusive-distrib/1.0/","  We introduce a new task named Story Ending Generation (SEG), whic-h aims at
generating a coherent story ending from a sequence of story plot. Wepropose a
framework consisting of a Generator and a Reward Manager for thistask. The
Generator follows the pointer-generator network with coverage mech-anism to
deal with out-of-vocabulary (OOV) and repetitive words. Moreover, amixed loss
method is introduced to enable the Generator to produce story endingsof high
semantic relevance with story plots. In the Reward Manager, the rewardis
computed to fine-tune the Generator with policy-gradient reinforcement
learn-ing (PGRL). We conduct experiments on the recently-introduced
ROCStoriesCorpus. We evaluate our model in both automatic evaluation and human
evalua-tion. Experimental results show that our model exceeds the
sequence-to-sequencebaseline model by 15.75% and 13.57% in terms of CIDEr and
consistency scorerespectively.
","[{""version"":""v1"",""created"":""Fri, 11 Jan 2019 02:28:38 GMT""}]","2019-01-14"
"1901.03460","Zheng Shou","Zheng Shou, Xudong Lin, Yannis Kalantidis, Laura Sevilla-Lara, Marcus
  Rohrbach, Shih-Fu Chang, Zhicheng Yan","DMC-Net: Generating Discriminative Motion Cues for Fast Compressed Video
  Action Recognition","Accepted by CVPR'19",,,,"cs.CV","http://arxiv.org/licenses/nonexclusive-distrib/1.0/","  Motion has shown to be useful for video understanding, where motion is
typically represented by optical flow. However, computing flow from video
frames is very time-consuming. Recent works directly leverage the motion
vectors and residuals readily available in the compressed video to represent
motion at no cost. While this avoids flow computation, it also hurts accuracy
since the motion vector is noisy and has substantially reduced resolution,
which makes it a less discriminative motion representation. To remedy these
issues, we propose a lightweight generator network, which reduces noises in
motion vectors and captures fine motion details, achieving a more
Discriminative Motion Cue (DMC) representation. Since optical flow is a more
accurate motion representation, we train the DMC generator to approximate flow
using a reconstruction loss and a generative adversarial loss, jointly with the
downstream action classification task. Extensive evaluations on three action
recognition benchmarks (HMDB-51, UCF-101, and a subset of Kinetics) confirm the
effectiveness of our method. Our full system, consisting of the generator and
the classifier, is coined as DMC-Net which obtains high accuracy close to that
of using flow and runs two orders of magnitude faster than using optical flow
at inference time.
","[{""version"":""v1"",""created"":""Fri, 11 Jan 2019 02:39:41 GMT""},{""version"":""v2"",""created"":""Thu, 11 Apr 2019 19:56:57 GMT""},{""version"":""v3"",""created"":""Tue, 7 May 2019 20:51:27 GMT""}]","2019-05-09"
"1901.03461","Koichiro Yoshino Ph.D.","Koichiro Yoshino, Chiori Hori, Julien Perez, Luis Fernando D'Haro,
  Lazaros Polymenakos, Chulaka Gunasekara, Walter S. Lasecki, Jonathan K.
  Kummerfeld, Michel Galley, Chris Brockett, Jianfeng Gao, Bill Dolan, Xiang
  Gao, Huda Alamari, Tim K. Marks, Devi Parikh, Dhruv Batra","Dialog System Technology Challenge 7","This paper is presented at NIPS2018 2nd Conversational AI workshop",,,,"cs.CL","http://arxiv.org/licenses/nonexclusive-distrib/1.0/","  This paper introduces the Seventh Dialog System Technology Challenges (DSTC),
which use shared datasets to explore the problem of building dialog systems.
Recently, end-to-end dialog modeling approaches have been applied to various
dialog tasks. The seventh DSTC (DSTC7) focuses on developing technologies
related to end-to-end dialog systems for (1) sentence selection, (2) sentence
generation and (3) audio visual scene aware dialog. This paper summarizes the
overall setup and results of DSTC7, including detailed descriptions of the
different tracks and provided datasets. We also describe overall trends in the
submitted systems and the key results. Each track introduced new datasets and
participants achieved impressive results using state-of-the-art end-to-end
technologies.
","[{""version"":""v1"",""created"":""Fri, 11 Jan 2019 02:43:12 GMT""}]","2019-01-14"
"1901.03462","Xiaoyan Gu","Yizhi Liu, Xiaoyan Gu, Lei Huang, Junlin Ouyang, Miao Liao, Liangran
  Wu","Analyzing Periodicity and Saliency for Adult Video Detection",,,,,"cs.CV","http://arxiv.org/licenses/nonexclusive-distrib/1.0/","  Content-based adult video detection plays an important role in preventing
pornography. However, existing methods usually rely on single modality and
seldom focus on multi-modality semantics representation. Addressing at this
problem, we put forward an approach of analyzing periodicity and saliency for
adult video detection. At first, periodic patterns and salient regions are
respective-ly analyzed in audio-frames and visual-frames. Next, the multi-modal
co-occurrence semantics is described by combining audio periodicity with visual
saliency. Moreover, the performance of our approach is evaluated step by step.
Experimental results show that our approach obviously outper-forms some
state-of-the-art methods.
","[{""version"":""v1"",""created"":""Fri, 11 Jan 2019 02:50:29 GMT""}]","2019-01-14"
"1901.03463","Samira Masoudi","Samira Masoudi, Cameron H.G. Wright, Nazanin Rahnavard, Jay C. Gatlin,
  and John S. Oakey","Multiple Microtubule Tracking in Microscopy Time-Lapse Images Using
  Piecewise-stationary Multiple Motion Model Kalman Smoother","8 pages, 4figures, Rocky Mountain Biomedical Symposium 2018","Biomedical Sciences Instrumentation 54 (2018) 167-175","10.13140/rg.2.2.17832.01284",,"q-bio.QM","http://creativecommons.org/publicdomain/zero/1.0/","  Microtubules are inherently dynamic sub-cellular filamentuous polymers that
are spatially organized within the cell by motor proteins which cross-link and
move microtubules. In-vitro microtubule motility assays, in which motors
attached to a surface move microtubules along it, have been used traditionally
to study motor function. However, the way in which microtubule-microtubule
interactions affect microtubule movement remains largely unexplored. To address
this question, time-lapse image series of in-vitro microtubule motility assays
were obtained using total internal reflection fluorescence (TIRF) microscopy.
Categorized as a general problem of multiple object tracking (MOT), particular
challenges arising in this project include low feature diversity, dynamic
instability, sudden changes in microtubules motility patterns, as well as their
instantaneous appearance/disappearance. This work describes a new application
of piecewise-stationary multiple motion model Kalman smoother (PMMS) for
modeling individual microtubules motility trends. To both evaluate the
capability of this procedure and optimize its hyper-parameters, a large dataset
simulating the series of time-lapse images was used first. Next, we applied it
to the sequence of frames from the real data. Results of our analyses provide a
quantitative description of microtubule velocity which, in turn, enumerates the
occurrence of microtubule-microtubule interactions per frame.
","[{""version"":""v1"",""created"":""Fri, 11 Jan 2019 02:50:38 GMT""}]","2020-01-22"
