"1901.03334","Matteo Fossati","Matteo Fossati (CEA and ICC, Durham University), Michele Fumagalli
  (CEA and ICC, Durham University), Giuseppe Gavazzi (Universita' di
  Milano-Bicocca), Guido Consolandi (Universita' di Milano-Bicocca), Alessandro
  Boselli (LAM), Masafumi Yagi (NAOJ), Ming Sun (University of Alabama), David
  J. Wilman (USM, Munich)","MUSE sneaks a peek at extreme ram-pressure stripping events - IV.
  Hydrodynamic and gravitational interactions in the Blue Infalling Group","19 pages, 12 figures, accepted for publication in MNRAS",,"10.1093/mnras/stz136",,"astro-ph.GA","http://arxiv.org/licenses/nonexclusive-distrib/1.0/","  We report new wide-field (~ 4 x 4 square arcmin) MUSE observations of the
Blue Infalling Group (BIG), a compact group of galaxies located at a projected
distance of ~ 150 kpc from the X-Ray centre of the A1367 cluster at z = 0.021.
Our MUSE observations map in detail the extended ionized gas, primarily traced
by H$\alpha$ emission, in between the members of the group. The gas morphology
and its kinematics appear consistent with a tidal origin due to galaxy
encounters, as also supported by the disturbed kinematics visible in one of the
group members and the presence of tidal dwarf systems. A diffuse tail extending
in the direction opposite to the cluster centre is also detected, hinting at a
global ram-pressure stripping of the intra-group material as BIG falls inside
A1367. Based on the analysis of spatially-resolved emission line maps, we
identify multiple ionization mechanisms for the diffuse gas filaments,
including in situ photoionization from embedded HII regions and shocks.
Combining spatially resolved kinematics and line ratios, we rule out the
association of the most massive galaxy, CGCG097-120, with the group as this
system appears to be decoupled from the intragroup medium and subject to strong
ram pressure as it falls into A1367. Through our new analysis, we conclude that
BIG is shaped by pre-processing produced by gravitational interactions in the
local group environment combined with ram pressure stripping by the global
cluster halo.
","[{""version"":""v1"",""created"":""Thu, 10 Jan 2019 19:00:01 GMT""},{""version"":""v2"",""created"":""Mon, 14 Jan 2019 09:30:08 GMT""}]","2019-01-23"
"1901.03335","Steve Campbell","Steve Campbell, Bar{\i}\c{s} \c{C}akmak, \""Ozg\""ur E.
  M\""ustecapl{\i}o\u{g}lu, Mauro Paternostro, and Bassano Vacchini","Collisional unfolding of quantum Darwinism","7 pages, 3 figures. Close to published version","Phys. Rev. A 99, 042103 (2019)","10.1103/PhysRevA.99.042103",,"quant-ph","http://arxiv.org/licenses/nonexclusive-distrib/1.0/","  We examine the emergence of objectivity via quantum Darwinism through the use
of a collision model, i.e. where the dynamics is modeled through sequences of
unitary interactions between the system and the individual constituents of the
environment, termed ""ancillas"". By exploiting versatility of this framework, we
show that one can transition from a ""Darwinistic"" to an ""encoding"" environment
by simply tuning their interaction. Furthermore we establish that in order for
a setting to exhibit quantum Darwinism we require a mutual decoherence to occur
between the system and environmental ancillas, thus showing that system
decoherence alone is not sufficient. Finally, we demonstrate that the
observation of quantum Darwinism is sensitive to a non-uniform
system-environment interaction.
","[{""version"":""v1"",""created"":""Thu, 10 Jan 2019 19:00:01 GMT""},{""version"":""v2"",""created"":""Wed, 3 Apr 2019 23:22:16 GMT""}]","2019-04-05"
"1901.03336","Yannick Bah\'e","Yannick M. Bah\'e, Joop Schaye, David J. Barnes, Claudio Dalla
  Vecchia, Scott T. Kay, Richard G. Bower, Henk Hoekstra, Sean L. McGee, and
  Tom Theuns","Disruption of satellite galaxies in simulated groups and clusters: the
  roles of accretion time, baryons, and pre-processing","26 pages, 24 figures (16 pages, 14 figures without appendices);
  accepted by MNRAS (a few extra references added)",,"10.1093/mnras/stz361",,"astro-ph.GA","http://arxiv.org/licenses/nonexclusive-distrib/1.0/","  We investigate the disruption of group and cluster satellite galaxies with
total mass (dark matter plus baryons) above 10^10 M_sun in the Hydrangea
simulations, a suite of 24 high-resolution cosmological hydrodynamical zoom-in
simulations based on the EAGLE model. The simulations predict that ~50 per cent
of satellites survive to redshift z = 0, with higher survival fractions in
massive clusters than in groups and only small differences between baryonic and
pure N-body simulations. For clusters, up to 90 per cent of galaxy disruption
occurs in lower-mass sub-groups (i.e., during pre-processing); 96 per cent of
satellites in massive clusters that were accreted at z < 2 and have not been
pre-processed survive. Of those satellites that are disrupted, only a few per
cent merge with other satellites, even in low-mass groups. The survival
fraction changes rapidly from less than 10 per cent of those accreted at high z
to more than 90 per cent at low z. This shift, which reflects faster disruption
of satellites accreted at higher z, happens at lower z for more massive
galaxies and those accreted onto less massive haloes. The disruption of
satellite galaxies is found to correlate only weakly with their pre-accretion
baryon content, star formation rate, and size, so that surviving galaxies are
nearly unbiased in these properties. These results suggest that satellite
disruption in massive haloes is uncommon, and that it is predominantly the
result of gravitational rather than baryonic processes.
","[{""version"":""v1"",""created"":""Thu, 10 Jan 2019 19:00:01 GMT""},{""version"":""v2"",""created"":""Fri, 1 Feb 2019 17:10:46 GMT""}]","2019-02-20"
"1901.03337","Edward Schlafly","Edward F. Schlafly, Aaron M. Meisner, Gregory M. Green","The unWISE Catalog: Two Billion Infrared Sources from Five Years of WISE
  Imaging","23 pages, 10 figures, catalog available at http://catalog.unwise.me",,"10.3847/1538-4365/aafbea",,"astro-ph.IM astro-ph.GA","http://arxiv.org/licenses/nonexclusive-distrib/1.0/","  We present the unWISE Catalog, containing the positions and fluxes of roughly
two billion objects observed by the Wide-field Infrared Survey Explorer (WISE)
over the full sky. The unWISE Catalog has two advantages over the existing WISE
catalog (AllWISE): first, it is based on significantly deeper imaging, and
second, it features improved modeling of crowded regions. The deeper imaging
used in the unWISE Catalog comes from the coaddition of all publicly available
3$-$5 micron WISE imaging, including that from the ongoing NEOWISE-Reactivation
mission, thereby increasing the total exposure time by a factor of 5 relative
to AllWISE. At these depths, even at high Galactic latitudes many sources are
blended with their neighbors; accordingly, the unWISE analysis simultaneously
fits thousands of sources to obtain accurate photometry. Our new catalog
detects sources at 5-sigma roughly 0.7 magnitudes fainter than the AllWISE
catalog and more accurately models millions of faint sources in the Galactic
plane, enabling a wealth of Galactic and extragalactic science. In particular,
relative to AllWISE, unWISE doubles the number of galaxies detected between
redshifts 0 and 1 and triples the number between redshifts 1 and 2, cataloging
more than half a billion galaxies over the whole sky.
","[{""version"":""v1"",""created"":""Thu, 10 Jan 2019 19:00:02 GMT""}]","2019-02-13"
"1901.03338","Jonas Heinze","Jonas Heinze, Anatoli Fedynitch, Denise Boncioli and Walter Winter","A new view on Auger data and cosmogenic neutrinos in light of different
  nuclear disintegration and air-shower models","21 pages, 11 figures. Accepted for publication in ApJ",,"10.3847/1538-4357/ab05ce",,"astro-ph.HE","http://arxiv.org/licenses/nonexclusive-distrib/1.0/","  We study the implications of Ultra-High Energy Cosmic Ray (UHECR) data from
the Pierre Auger Observatory for potential accelerator candidates and
cosmogenic neutrino fluxes for different combinations of nuclear disintegration
and air-shower models. We exploit the most recent spectral and mass composition
data (2017) with a new, computationally very efficient simulation code PriNCe.
We extend the systematic framework originally developed by the Pierre Auger
Collaboration with the cosmological source evolution as an additional free
parameter. In this framework, an ensemble of generalized UHECR accelerators is
characterized by a universal spectral index (equal for all injection species),
a maximal rigidity, and the normalizations for five nuclear element groups. We
find that the 2017 data favor a small but constrained contribution of heavy
elements (iron) at the source. We demonstrate that the results moderately
depend on the nuclear disintegration (PSB, Peanut, or Talys) model, and more
strongly on the air-shower (EPOS-LHC, Sibyll-2.3, or QGSjet-II-04) model.
Variations of these models result in different source evolutions and spectral
indices, limiting the interpretation in terms of a particular class of cosmic
accelerators. Better constrained parameters include the maximal rigidity and
the mass composition at the source. Hence, the cosmogenic neutrino flux can be
robustly predicted, since it originates from interactions with the cosmic
infrared background and peaks at $10^8 \, \mathrm{GeV}$. Depending on the
source evolution at high redshifts the flux is likely out of reach of future
neutrino observatories in most cases, and a minimal cosmogenic neutrino flux
cannot be claimed from data without assuming a cosmological distribution of the
sources.
","[{""version"":""v1"",""created"":""Thu, 10 Jan 2019 19:00:02 GMT""},{""version"":""v2"",""created"":""Fri, 18 Jan 2019 15:25:11 GMT""},{""version"":""v3"",""created"":""Mon, 11 Feb 2019 16:36:01 GMT""}]","2019-03-20"
"1901.03339","Heather Wernke","Heather N. Wernke, Ann-Marie Madigan","The Effect of General Relativistic Precession on Tidal Disruption Events
  from Eccentric Nuclear Disks","10 pages, 8 figures, submitted to ApJ",,"10.3847/1538-4357/ab2711",,"astro-ph.HE","http://arxiv.org/licenses/nonexclusive-distrib/1.0/","  An eccentric nuclear disk consists of stars moving on apsidally-aligned
orbits around a central black hole. The secular gravitational torques that
dynamically stabilize these disks can also produce tidal disruption events
(TDEs) at very high rates in Newtonian gravity. General relativity, however, is
known to quench secular torques via rapid apsidal precession.
  Here we show that for a disk to black hole mass ratio $\gtrsim 10^{-3}$, the
system is in the full loss cone regime. The magnitude of the torque per orbital
period acting on a stellar orbit means that general relativistic precession
does not have a major effect on the dynamics. Thus we find that TDE rates from
eccentric nuclear disks are not affected by general relativistic precession.
Furthermore, we show that orbital elements between successive TDEs from
eccentric nuclear disks are correlated, potentially resulting in unique
observational signatures.
","[{""version"":""v1"",""created"":""Thu, 10 Jan 2019 19:00:02 GMT""}]","2019-07-31"
"1901.03340","Margherita Molaro","Margherita Molaro, Romeel Dav\'e, Sultan Hassan, Mario G. Santos,
  Kristian Finlator","ARTIST: Fast radiative transfer for large-scale simulations of the epoch
  of reionisation","18 pages, 16 figures, published by MNRAS (14 August 2019)","2019MNRAS.489.5594M","10.1093/mnras/stz2171",,"astro-ph.CO","http://arxiv.org/licenses/nonexclusive-distrib/1.0/","  We introduce the ""Asymmetric Radiative Transfer In Shells Technique""
(ARTIST), a new method for photon propagation on large scales that explicitly
conserves photons, propagates photons at the speed of light, approximately
accounts for photon directionality, and closely reproduces results of more
detailed radiative transfer (RT) codes. Crucially, it is computationally fast
enough to evolve the large cosmological volumes required to predict the 21cm
power spectrum on scales that will be probed by future experiments targeting
the Epoch of Reionisation (EoR). Most semi-numerical models aimed at predicting
the EoR 21cm signal make use of an excursion set formalism (ESF) approach,
which achieves computational viability by compromising on photon conservation,
constraining ionised regions to be spherical by construction, and not
accounting for light-travel time. By implementing our RT method within the
semi-numerical code SimFast21, we show that ARTIST predicts a significantly
different evolution for the EoR ionisation field compared to the code's native
ESF. In particular, ARTIST predicts a more gradual evolution of the
volume-averaged ionisation fraction, and up to an order-of-magnitude difference
in the ionisation power, depending on the physical parameters assumed. Its
application to large-scale EoR simulations will therefore allow more
physically-motivated constraints to be obtained for key EoR parameters, such as
the escape fraction.
","[{""version"":""v1"",""created"":""Thu, 10 Jan 2019 19:00:02 GMT""},{""version"":""v2"",""created"":""Tue, 7 Jan 2020 10:12:16 GMT""}]","2020-01-08"
"1901.03341","Mohammadtaher Safarzadeh","Mohammadtaher Safarzadeh, Abraham Loeb","An upper limit on primordial magnetic fields from ultra-faint dwarf
  galaxies","Accepted to ApJ Letters",,"10.3847/2041-8213/ab2335",,"astro-ph.CO astro-ph.GA","http://arxiv.org/licenses/nonexclusive-distrib/1.0/","  The presence of primordial magnetic fields increases the minimum halo mass in
which star formation is possible at high redshifts. Estimates of the dynamical
mass of ultra-faint dwarf galaxies (UFDs) within their half-light radius
constrain their virialized halo mass before their infall into the Milky Way.
The inferred halo mass and formation redshift of the UFDs place upper bounds on
the primordial comoving magnetic field, $B_0$. We derive an upper limit of
$0.50\pm 0.086$ ($0.31\pm 0.04$) nG on $B_0~$ assuming the average formation
redshift of the UFD host halos is $z_{\rm form}=$ 10 (20), respectively.
","[{""version"":""v1"",""created"":""Thu, 10 Jan 2019 19:00:02 GMT""},{""version"":""v2"",""created"":""Tue, 21 May 2019 16:38:40 GMT""}]","2019-06-05"
"1901.03342","Corneliu Malciu","Corneliu Malciu, Leonardo Mazza, Christophe Mora","4$\pi$ and 8$\pi$ dual Josephson effects induced by symmetry defects",,"Phys. Rev. B 99, 125153 (2019)","10.1103/PhysRevB.99.125153",,"cond-mat.mes-hall","http://arxiv.org/licenses/nonexclusive-distrib/1.0/","  In topological insulator edges, the duality between the Zeeman field
orientation and the proximitized superconducting phase has been recently
exploited to predict a magneto-Josephson effect with a 4$\pi$ periodicity. We
revisit this latter Josephson effect in the light of this duality and show that
the same 4$\pi$ quantum anomaly occurs when bridging two spinless Thouless
pumps to a p-wave superconducting region that could be as small as a single and
experimentally-relevant superconducting quantum dot - a point-like defect. This
interpretation as a dual Josephson effect never requires the presence of
Majorana modes but rather builds on the topological properties of adiabatic
quantum pumps with Z topological invariants. It allows for the systematic
construction of dual Josephson effects of arbitrary periodicity, such as 4$\pi$
and 8$\pi$, by using point-like defects whose symmetry differs from that of the
pump, dubbed symmetry defects. Although adiabatic quantum pumps are typically
discussed via mappings to two-dimensional geometries, we show that this
phenomenology does not have any counterpart in conventional two-dimensional
systems.
","[{""version"":""v1"",""created"":""Thu, 10 Jan 2019 19:00:03 GMT""}]","2019-04-03"
"1901.03343","Vivek Lohani","Vivek Lohani, Ciar\'an Hickey, Jan Masell and Achim Rosch","Quantum skyrmions in frustrated ferromagnets","14 pages, 10 figures, added force-magnetization coupling and periodic
  potential to skyrmion Hamiltonian","Phys. Rev. X 9, 041063 (2019)","10.1103/PhysRevX.9.041063",,"cond-mat.str-el cond-mat.mes-hall","http://arxiv.org/licenses/nonexclusive-distrib/1.0/","  We develop a quantum theory of magnetic skyrmions and antiskyrmions in a
spin-1/2 Heisenberg magnet with frustrating next-nearest neighbor interactions.
Using exact diagonalization we show numerically that a quantum skyrmion exists
as a stable many-magnon bound state and investigate its quantum numbers. We
then derive a phenomenological Schr\""odinger equation for the quantum skyrmion
and its internal degrees of freedom. We find that quantum skyrmions have highly
unusual properties. Their bandwidth is exponentially small and arises from
tunneling processes between skyrmion and antiskyrmion. The bandstructure
changes both qualitatively and quantitatively when a single spin is added or
removed from the quantum skyrmion, reflecting a locking of angular momentum and
spin quantum numbers characteristic for skyrmions. Additionally, while for weak
forces the quantum skyrmion is accelerated parallel to the force, it moves in a
perpendicular direction for stronger fields.
","[{""version"":""v1"",""created"":""Thu, 10 Jan 2019 19:00:04 GMT""},{""version"":""v2"",""created"":""Tue, 16 Jul 2019 15:46:39 GMT""},{""version"":""v3"",""created"":""Mon, 7 Oct 2019 13:43:55 GMT""}]","2020-01-01"
"1901.03344","Anna Schauer","Anna T. P. Schauer, Boyuan Liu, Volker Bromm","Constraining First Star Formation with 21cm-Cosmology","accepted by ApJ Letters",,"10.3847/2041-8213/ab1e51",,"astro-ph.GA astro-ph.CO","http://arxiv.org/licenses/nonexclusive-distrib/1.0/","  Within standard $\Lambda$CDM cosmology, Population III (Pop III) star
formation in minihalos of mass $M_\mathrm{halo}\gtrsim 5\times10^5$ M$_\odot$
provides the first stellar sources of Lyman$\alpha$ (Ly$\alpha$) photons. The
Experiment to Detect the Global Epoch of Reionization Signature (EDGES) has
measured a strong absorption signal of the redshifted 21 cm radiation from
neutral hydrogen at $z\approx 17$, requiring efficient formation of massive
stars before then. In this paper, we investigate whether star formation in
minihalos plays a significant role in establishing the early Ly$\alpha$
background required to produce the EDGES absorption feature. We find that Pop
III stars are important in providing the necessary Ly$\alpha$-flux at high
redshifts, and derive a best-fitting average Pop III stellar mass of $\sim$
750M$_\odot{}$ per minihalo, corresponding to a star formation efficiency of
0.1%. Further, it is important to include baryon-dark matter streaming
velocities in the calculation, to limit the efficiency of Pop~III star
formation in minihalos. Without this effect, the cosmic dawn coupling between
21 cm spin temperature and that of the gas would occur at redshifts higher than
what is implied by EDGES.
","[{""version"":""v1"",""created"":""Thu, 10 Jan 2019 19:00:10 GMT""},{""version"":""v2"",""created"":""Tue, 26 Mar 2019 15:33:57 GMT""},{""version"":""v3"",""created"":""Sat, 4 May 2019 01:57:44 GMT""}]","2019-05-29"
"1901.03345","Matteo Cantiello Dr.","Rosalba Perna, Yi-Han Wang, Will M. Farr, Nathan Leigh and Matteo
  Cantiello","Constraining the Black Hole Initial Mass Function with LIGO/VIRGO
  Observations","Accepted to ApJL. Major updates",,"10.3847/2041-8213/ab2336",,"astro-ph.HE astro-ph.GA astro-ph.SR","http://arxiv.org/licenses/nonexclusive-distrib/1.0/","  Prior to the detection of black holes (BHs) via the gravitational waves (GWs)
they generate at merger, the presence of BHs was inferred in X-ray binaries,
mostly via dynamical measurements, with masses in the range between $\sim
5-20~M_\odot$. The LIGO discovery of the first BHs via GWs was surprising in
that the two BHs that merged had masses of $35.6^{+4.8}_{-3.0}$ and
$30.6^{+3.0}_{-4.4}\,M_\odot$, which are both above the range inferred from
X-ray binaries. With 20 BH detections from the O1/O2 runs, the distribution of
masses remains generally higher than the X-ray inferred one, while the
effective spins are generally lower, suggesting that, at least in part, the
GW-detected population might be of dynamical origin rather than produced by the
common evolution of field binaries. Here we perform high-resolution N-body
simulations of a cluster of isolated BHs with a range of initial mass spectra
and upper mass cut-offs, and study the resulting binary mass spectrum resulting
from the dynamical interactions. Our clusters have properties similar to those
of the massive remnants in an OB association $\sim 10 \, \mathrm{Myr}$ after
formation. We perform a likelihood analysis for each of our dynamically-formed
binary population against the data from the O1 and O2 LIGO/Virgo runs. We find
that an initial mass spectrum $M_{\rm BH}\propto M^{-2.35}$ with an upper mass
cutoff $M_{\rm max}\sim 50M_\odot$ is favored by the data, together with a
slight preference for a merger rate that increases with redshift.
","[{""version"":""v1"",""created"":""Thu, 10 Jan 2019 19:00:11 GMT""},{""version"":""v2"",""created"":""Tue, 21 May 2019 16:59:11 GMT""}]","2019-06-12"
"1901.03346","Michel Fruchart","Marcello D. Caio, Marco Caccin, Paul Baireuther, Timo Hyart, Michel
  Fruchart","Machine learning assisted measurement of local topological invariants",,,,,"cond-mat.dis-nn cond-mat.mes-hall cond-mat.mtrl-sci","http://arxiv.org/licenses/nonexclusive-distrib/1.0/","  The continuous effort towards topological quantum devices calls for an
efficient and non-invasive method to assess the conformity of components in
different topological phases. Here, we show that machine learning paves the way
towards non-invasive topological quality control. To do so, we use a local
topological marker, able to discriminate between topological phases of
one-dimensional wires. The direct observation of this marker in solid state
systems is challenging, but we show that an artificial neural network can learn
to approximate it from the experimentally accessible local density of states.
Our method distinguishes different non-trivial phases, even for systems where
direct transport measurements are not available and for composite systems. This
new approach could find significant use in experiments, ranging from the study
of novel topological materials to high-throughput automated material design.
","[{""version"":""v1"",""created"":""Thu, 10 Jan 2019 19:00:15 GMT""},{""version"":""v2"",""created"":""Wed, 23 Jan 2019 16:47:07 GMT""}]","2019-01-24"
"1901.03347","Daisuke Yoshida","Tokiro Numasawa, Daisuke Yoshida","Global Spacetime Structure of Compactified Inflationary Universe","7 pages, 5 figures",,"10.1088/1361-6382/ab38ed","OU-HET 991","hep-th gr-qc","http://arxiv.org/licenses/nonexclusive-distrib/1.0/","  We investigate the global spacetime structure of torus de Sitter universe,
which is exact de Sitter space with torus identification based on the flat
chart. We show that past incomplete null geodesics in torus de Sitter universe
are locally extendible. Then we give an extension of torus de Sitter universe
so that at least one of the past incomplete null geodesics in the original
spacetime becomes complete. However we find that extended torus de Sitter
universe has two ill behaviors. The first one is a closed causal curve. The
second one is so called quasi regular singularity, which means that there is no
global, consistent extension of spacetime where all curves become complete,
nevertheless each curve is locally extensible.
","[{""version"":""v1"",""created"":""Thu, 10 Jan 2019 19:00:16 GMT""}]","2020-01-08"
"1901.03348","Vydas \v{C}ekanavi\v{c}ius","Vydas \v{C}ekanavi\v{c}ius and Palaniappan Vellaisamy","On large deviations for sums of discrete m-dependent random variables","To appear in ""Stochastics""",,,,"math.ST stat.TH","http://arxiv.org/licenses/nonexclusive-distrib/1.0/","  The ratio $P(S_n=x)/P(Z_n=x)$ is investigated for three cases: (a) when $S_n$
is a sum of 1-dependent non-negative integer-valued random variables (rvs),
satisfying some moment conditions, and $Z_n$ is Poisson rv; (b) when $S_n$ is a
statistic of 2-runs and $Z_n$ is negative binomial rv; and (c) when $S_n$ is
statistic of $N(1,1)$-events and $Z_n$ is a binomial r.v. We also consider the
approximation of $P(S_n\geqslant x)$ by Poisson distribution with parameter
depending on $x$.
","[{""version"":""v1"",""created"":""Thu, 10 Jan 2019 19:02:02 GMT""}]","2019-01-14"
