"1901.05265","Eugene Postnikov","Eugene B. Postnikov","Density fluctuations and random walks in an overdamped and supercooled
  simple liquid","9 pages; 4 figures","Phys. Rev. E 99, 062117 (2019)","10.1103/PhysRevE.99.062117",,"cond-mat.stat-mech","http://arxiv.org/licenses/nonexclusive-distrib/1.0/","  In this work, the short-time dynamics of simple liquid is explored both
analytically and numerically with the focus on the interplay between the
density fluctuations in a volume surrounding a chosen particle and its random
walk motion. The particles interact via the Lennard-Jones potential with
parameters corresponding to liquid argon. For large times, analytical
calculations based on the fluctuation theory provides an explicit expression
reproducing isothermal change of the self-diffusion coefficient in liquid argon
corresponding to the experimental data. These results lead to the conclusion
that such behavior is based on the reduced mobility of particles reflected in
their density fluctuations that can be equivalently achieved in the cases of
either low temperatures and pressures (supercooling) or moderate temperatures
and high pressures (overdamping).
","[{""version"":""v1"",""created"":""Wed, 16 Jan 2019 13:10:20 GMT""},{""version"":""v2"",""created"":""Wed, 1 May 2019 14:09:52 GMT""},{""version"":""v3"",""created"":""Mon, 17 Jun 2019 17:54:20 GMT""}]","2019-06-26"
"1901.05266","Luis Cort Barrada","Luis Cort, Soeren Ersbak Bang Nielsen, and Robert van Leeuwen","Strictly correlated electrons approach to excitation energies of
  dissociating molecules",,"Phys. Rev. A 99, 022501 (2019)","10.1103/PhysRevA.99.022501",,"cond-mat.str-el","http://arxiv.org/licenses/nonexclusive-distrib/1.0/","  In this work we consider a numerically solvable model of a two-electron
diatomic molecule to study a recently proposed approximation based on the
density-functional theory of so-called strictly correlated electrons (SCE). We
map out the full two-particle wave function for a wide range of bond distances
and interaction strengths and obtain analytic results for the two-particle
states and eigenenergies in various limits of strong and weak interactions, and
in the limit of large bond distance. We then study the so-called
Hartree-exchange-correlation (Hxc) kernel of time-dependent density functional
theory which is a key ingredient in calculating excitation energies. We study
an approximation based on adiabatic SCE (ASCE) theory which was shown to
display a particular feature of the exact Hxc-kernel, namely a spatial
divergence as function of the bond distance. This makes the ASCE kernel a
candidate for correcting a notorious failure of the commonly used adiabatic
local density approximation (ALDA) in the calculation of excitation energies of
dissociating molecules. Unlike the ALDA, we obtain non-zero excitation energies
from the ASCE kernel in the dissociation regime but they do not correspond to
those of the true spectrum unless the interaction strength is taken to be very
large such that the SCE theory has the right regime of validity, in which case
the excitation energies become exact and represent the so-called zero point
oscillations of the strictly correlated electrons. The commonly studied
physical dissociation regime, namely large molecular separation at intermediate
interaction strength, therefore remains a challenge for density functional
approximations based on SCE theory.
","[{""version"":""v1"",""created"":""Wed, 16 Jan 2019 13:13:22 GMT""}]","2019-02-13"
"1901.05268","Yue Zhang","Yue Zhang, Jin-Jun Geng, Yong-Feng Huang","Inverse Compton Scattering Spectra of Gamma-Ray Burst Prompt Emission","12 pages, 11 figures, accepted by ApJ",,"10.3847/1538-4357/ab1b10",,"astro-ph.HE","http://arxiv.org/licenses/nonexclusive-distrib/1.0/","  Although the physical origin of gamma-ray burst (GRB) prompt emission is
still controversial, synchrotron radiation from accelerated electrons is a
promising mechanism. It is believed that electrons are accelerated continuously
by ultra-relativistic shocks or magnetic reconnections. At the same time, these
electrons will be cooled via several processes (mainly adiabatic expansion,
synchrotron radiation and inverse Compton scattering (ICS)), which regulate the
distribution of electrons. An extra high-energy spectrum component is expected
to be induced by ICS. However, the gamma-gamma annihilation effect may
eliminate the high-energy photons and prevent the observers from distinguishing
the extra component. We perform numerical calculations by taking these effects
into account and discuss whether the extra ICS component could be observed. By
exploring the plausible parameter space for relevant quantities of the GRB
ejecta, we present the electron distributions and the corresponding spectra of
synchrotron radiation and ICS. It is found that the extra component is
observable only for ejecta with a rather large bulk Lorentz factor. A large
Lorentz factor means the adiabatic expansion is the leading process in the
electron cooling procedure, which makes the low-energy electron distribution
spectrum to be relatively hard. Therefore the ICS component is more likely to
be detected for GRBs that have a hard low-energy photon spectrum.
","[{""version"":""v1"",""created"":""Wed, 16 Jan 2019 13:18:46 GMT""},{""version"":""v2"",""created"":""Mon, 22 Apr 2019 06:51:31 GMT""}]","2019-06-05"
"1901.05269","Martin Flechl","Martin Flechl","Summary of recent progress in searches for additional Higgs bosons","9 pages. Invited talk given at Prospects for Charged Higgs Discovery
  at Colliders - CHARGED2018, 25-28 September 2018, Uppsala, Sweden","PoS(CHARGED2018)030",,,"hep-ph hep-ex","http://arxiv.org/licenses/nonexclusive-distrib/1.0/","  There has been a tremendous increase of sensitivity in searches for charged
Higgs bosons and additional neutral Higgs bosons since the last CHARGED
workshop in 2016. We will review recent experimental and theory developments as
presented at CHARGED2018, and conclude with future prospects for the field.
","[{""version"":""v1"",""created"":""Wed, 16 Jan 2019 13:21:52 GMT""}]","2019-01-17"
"1901.05270","Alex B. Grilo","Dorit Aharonov and Alex B. Grilo","Stoquastic PCP vs. Randomness",,,,,"quant-ph cs.CC","http://arxiv.org/licenses/nonexclusive-distrib/1.0/","  The derandomization of MA, the probabilistic version of NP, is a long
standing open question. In this work, we connect this problem to a variant of
another major problem: the quantum PCP conjecture. Our connection goes through
the surprising quantum characterization of MA by Bravyi and Terhal. They proved
the MA-completeness of the problem of deciding whether the groundenergy of a
uniform stoquastic local Hamiltonian is zero or inverse polynomial. We show
that the gapped version of this problem, i.e. deciding if a given uniform
stoquastic local Hamiltonian is frustration-free or has energy at least some
constant $\epsilon$, is in NP. Thus, if there exists a gap-amplification
procedure for uniform stoquastic Local Hamiltonians (in analogy to the gap
amplification procedure for constraint satisfaction problems in the original
PCP theorem), then MA = NP (and vice versa). Furthermore, if this gap
amplification procedure exhibits some additional (natural) properties, then P =
RP. We feel this work opens up a rich set of new directions to explore, which
might lead to progress on both quantum PCP and derandomization.
  We also provide two small side results of potential interest. First, we are
able to generalize our result by showing that deciding if a uniform stoquastic
Local Hamiltonian has negligible or constant frustration can be also solved in
NP. Additionally, our work reveals a new MA-complete problem which we call
SetCSP, stated in terms of classical constraints on strings of bits, which we
define in the appendix. As far as we know this is the first (arguably) natural
MA-complete problem stated in non-quantum CSP language.
","[{""version"":""v1"",""created"":""Wed, 16 Jan 2019 13:22:27 GMT""},{""version"":""v2"",""created"":""Wed, 9 Oct 2019 09:27:41 GMT""}]","2019-10-10"
"1901.05271","Felipe J. Llanes-Estrada","Eva Lope Oter, Andreas Windisch, Felipe J. Llanes-Estrada and Mark
  Alford","nEoS: Neutron Star Equation of State from hadron physics alone","16 pages with 11 plots","J. Phys. G: Nucl. Part. Phys. 46 084001 (2019)","10.1088/1361-6471/ab2567",,"gr-qc astro-ph.HE hep-ph nucl-th","http://arxiv.org/licenses/nonexclusive-distrib/1.0/","  We contribute a publicly available set of tables and code to provide
Equations of State (EoS) for matter at neutron star densities. Our EoSes are
constrained only by input from hadron physics and fundamental principles,
without feedback from neutron star observations, and so without relying on
General Relativity. They can therefore be used to test General Relativity
itself, as well as modified gravity theories, with neutron star observables,
without logical circularity. We have adapted state of the art results from NN
chiral potentials for the low--density limit, pQCD results for the
asymptotically high-density EoS, and use monotonicity and causality as the only
restrictions for intermediate densities, for the EoS sets to remain as
model-independent as is feasible today.
","[{""version"":""v1"",""created"":""Wed, 16 Jan 2019 13:33:30 GMT""}]","2021-03-24"
"1901.05272","Andrea Oldofredi","Andrea Oldofredi","Some remarks on the mentalistic reformulation of the measurement
  problem. A reply to S. Gao",,,,,"quant-ph","http://arxiv.org/licenses/nonexclusive-distrib/1.0/","  Gao (2017) presents a new mentalistic reformulation of the well-known
measurement problem affecting the standard formulation of quantum mechanics.
According to this author, it is essentially a determinate-experience problem,
namely a problem about the compatibility between the linearity of the
Schroedinger's equation, the fundamental law of quantum theory, and definite
experiences perceived by conscious observers. In this essay I aim to clarify
(i) that the well-known measurement problem is a mathematical consequence of
quantum theory's formalism, and that (ii) its mentalistic variant does not
grasp the relevant causes which are responsible for this puzzling issue. The
first part of this paper will be concluded claiming that the ""physical""
formulation of the measurement problem cannot be reduced to its mentalistic
version. In the second part of this work it will be shown that, contrary to the
case of quantum mechanics, Bohmian mechanics and GRW theories provide clear
explanations of the physical processes responsible for the definite
localization of macroscopic objects and, consequently, for well-defined
perceptions of measurement outcomes by conscious observers. More precisely, the
macro-objectification of states of experimental devices is obtained exclusively
in virtue of their clear ontologies and dynamical laws without any intervention
of human observers. Hence, it will be argued that in these theoretical
frameworks the measurement problem and the determinate-experience problem are
logically distinct issues.
","[{""version"":""v1"",""created"":""Wed, 16 Jan 2019 13:36:41 GMT""}]","2019-01-17"
"1901.05273","Peter Sj\""og{\aa}rde","Peter Sj\""og{\aa}rde and Per Ahlgren","Granularity of algorithmically constructed publication-level
  classifications of research publications: Identification of specialties","arXiv admin note: text overlap with arXiv:1801.02466",,"10.1162/qss_a_00004",,"cs.DL","http://creativecommons.org/licenses/by/4.0/","  In this work, in which we build on, and use the outcome of, an earlier study
on topic identification in an algorithmically constructed publication-level
classification (ACPLC), we address the issue how to algorithmically obtain a
classification of topics (containing articles), where the classes of the
classification correspond to specialties. The methodology we propose, which is
similar to the one used in the earlier study, uses journals and their articles
to construct a baseline classification. The underlying assumption of our
approach is that journals of a particular size and foci have a scope that
correspond to specialties. By measuring the similarity between (1) the baseline
classification and (2) multiple classifications obtained by topic clustering
and using different values of a resolution parameter, we have identified a
best-performing ACPLC. In two case studies, we could identify the subject foci
of involved specialties, and the subject foci of specialties were relatively
easy to distinguish. Further, the class size variation regarding the best
performing ACPLC is moderate, and only a small proportion of the articles
belong to very small classes. For these reasons, we conclude that the proposed
methodology is suitable to determine the specialty granularity level of an
ACPLC.
","[{""version"":""v1"",""created"":""Wed, 16 Jan 2019 13:39:13 GMT""}]","2019-09-02"
"1901.05275","Victor Churchill","Victor Churchill, Anne Gelb","Edge-masked CT image reconstruction from limited data",,,,,"eess.IV","http://arxiv.org/licenses/nonexclusive-distrib/1.0/","  This paper presents an iterative inversion algorithm for computed tomography
image reconstruction that performs well in terms of accuracy and speed using
limited data. The computational method combines an image domain technique and
statistical reconstruction by using an initial filtered back projection
reconstruction to create a binary edge mask, which is then used in an
l2-regularized reconstruction. Both theoretical and empirical results are
offered to support the algorithm. While in this paper a simple forward model is
used and physical edges are used as the sparse feature, the proposed method is
flexible and can accommodate any forward model and sparsifying transform.
","[{""version"":""v1"",""created"":""Wed, 16 Jan 2019 13:42:15 GMT""}]","2019-01-17"
"1901.05276","David Mart\'i-Pete","Vasiliki Evdoridou, David Mart\'i-Pete and David J. Sixsmith","Spiders' webs in the punctured plane",,,,,"math.DS math.CV","http://arxiv.org/licenses/nonexclusive-distrib/1.0/","  Many authors have studied sets, associated with the dynamics of a
transcendental entire function, which have the topological property of being a
spider's web. In this paper we adapt the definition of a spider's web to the
punctured plane. We give several characterisations of this topological
structure, and study the connection with the usual spider's web in
$\mathbb{C}$.
  We show that there are many transcendental self-maps of $\mathbb{C}^*$ for
which the Julia set is such a spider's web, and we construct a transcendental
self-map of $\mathbb{C}^*$ for which the escaping set $I(f)$ has this structure
and hence is connected. By way of contrast with transcendental entire
functions, we conjecture that there is no transcendental self-map of
$\mathbb{C}^*$ for which the fast escaping set $A(f)$ is such a spider's web.
","[{""version"":""v1"",""created"":""Wed, 16 Jan 2019 13:43:25 GMT""},{""version"":""v2"",""created"":""Fri, 27 Sep 2019 09:28:19 GMT""}]","2019-09-30"
"1901.05277","Yulia Solovyeva","Y. Solovyeva, A. Vinokurov, S. Fabrika, A. Kostenkov, O. Sholukhova,
  A. Sarkisyan, A. Valeev, K. Atapin, O. Spiridonova, A. Moskvitin, E.
  Nikolaeva","New Luminous Blue Variable Candidates in NGC 4736","5 pages, 4 figures: Monthly Notices of the Royal Astronomical
  Society: Letters, 484, L24, 2019",,"10.1093/mnrasl/sly241",,"astro-ph.SR astro-ph.GA","http://arxiv.org/licenses/nonexclusive-distrib/1.0/","  We have found three new LBV candidates in the star-forming galaxy NGC 4736.
They show typical well-known LBV spectra, broad and strong hydrogen lines, He I
lines, many Fe II lines, and forbidden [Fe II] and [Fe III]. Using archival
Hubble Space Telescope and ground-based telescope data, we have estimated the
bolometric magnitudes of these objects from -8.4 to -11.5, temperatures, and
reddening. Source NGC 4736_1 (Mv = -10.2 +/- 0.1 mag) demonstrated variability
between 2005 and 2018 as Delta V = 1.1 mag and Delta B = 0.82 mag, the object
belongs to LBV stars. NGC 4736_2 (Mv < -8.6 mag) shows P Cyg profiles and its
spectrum has changed from 2015 to 2018. The brightness variability of NGC
4736_2 is Delta V = 0.5 mag and Delta B = 0.4 mag. In NGC 4736_3 (Mv = -8.2 +/-
0.2 mag), we found strong nebular lines, broad wings of hydrogen; the
brightness variation is only 0.2 mag. Therefore, the last two objects may
reside to LBV candidates.
","[{""version"":""v1"",""created"":""Wed, 16 Jan 2019 13:46:41 GMT""}]","2019-01-23"
"1901.05278","Shabbar Raza","Waqas Ahmed, Adeel Mansha, Tianjun Li, Shabbar Raza, Joydeep Roy,
  Fang-Zhou Xu","The PeV-Scale Split Supersymmetry from Higgs Mass and Electroweak Vacuum
  Stability","14 pages, 3 figures","Prog Theor Exp Phys (2020)","10.1093/ptep/ptaa041",,"hep-ph","http://arxiv.org/licenses/nonexclusive-distrib/1.0/","  The null results of the LHC searches have put strong bounds on new physics
scenario such as supersymmetry (SUSY). With the latest values of top quark mass
and strong coupling, we study the upper bounds on the sfermion masses in
Split-SUSY from the observed Higgs boson mass and electroweak (EW) vacuum
stability. To be consistent with the observed Higgs mass, we find that the
largest value of supersymmetry breaking scales $M_{S}$ for $\tan\beta=2$ and
$\tan\beta=4$ are $\mathcal{O} (10^{3}\, {\rm TeV})$ and $\mathcal{O}
(10^{1.5}\, {\rm TeV})$ respectively, thus putting an upper bound on the
sfermion masses around $10^{3}\, {\rm TeV}$. In addition, the Higgs quartic
coupling becomes negative at much lower scale than the Standard Model (SM), and
we extract the upper bound of $\mathcal{O}(10^{4}\, {\rm TeV})$ on the sfermion
masses from EW vacuum stability. Therefore, we obtain the PeV-Scale Split-SUSY.
The key point is the extra contributions to the Renormalization Group Equation
(RGE) running from the couplings among Higgs boson, Higgsinos, and gauginos. We
briefly comment on the lifetime of gluinos in our study and compare it with
current LHC observations. Additionally, we comment on the prospects of
discovery of prompt gluinos in a 100 TeV proton-propton collider.
","[{""version"":""v1"",""created"":""Wed, 16 Jan 2019 13:46:48 GMT""}]","2020-05-06"
"1901.05279","Paolo Laffranchini","Paolo Laffranchini, Luis Rodrigues, Marco Canini, Balachander
  Krishnamurthy","Measurements As First-class Artifacts","Infocom 2019 extended version",,,,"cs.NI","http://arxiv.org/licenses/nonexclusive-distrib/1.0/","  The emergence of programmable switches has sparked a significant amount of
work on new techniques to perform more powerful measurement tasks, for
instance, to obtain fine-grained traffic and performance statistics. Previous
work has focused on the efficiency of these measurements alone and has
neglected flexibility, resulting in solutions that are hard to reuse or
repurpose and that often overlap in functionality or goals.
  In this paper, we propose the use of a set of reusable primitive building
blocks that can be composed to express measurement tasks in a concise and
simple way. We describe the rationale for the design of our primitives, that we
have named MAFIA (Measurements As FIrst-class Artifacts), and using several
examples we illustrate how they can be combined to realize a comprehensive
range of network measurement tasks. Writing MAFIA code does not require expert
knowledge of low-level switch architecture details. Using a prototype
implementation of MAFIA, we demonstrate the applicability of our approach and
show that the use of our primitives results in compiled code that is comparable
in size and resource usage with manually written specialized P4 code and can be
run in current hardware.
","[{""version"":""v1"",""created"":""Wed, 16 Jan 2019 13:48:24 GMT""}]","2019-01-17"
"1901.05280","Zuchao Li","Zuchao Li, Shexia He, Hai Zhao, Yiqing Zhang, Zhuosheng Zhang, Xi
  Zhou, Xiang Zhou","Dependency or Span, End-to-End Uniform Semantic Role Labeling",,,,,"cs.CL","http://arxiv.org/licenses/nonexclusive-distrib/1.0/","  Semantic role labeling (SRL) aims to discover the predicateargument structure
of a sentence. End-to-end SRL without syntactic input has received great
attention. However, most of them focus on either span-based or dependency-based
semantic representation form and only show specific model optimization
respectively. Meanwhile, handling these two SRL tasks uniformly was less
successful. This paper presents an end-to-end model for both dependency and
span SRL with a unified argument representation to deal with two different
types of argument annotations in a uniform fashion. Furthermore, we jointly
predict all predicates and arguments, especially including long-term ignored
predicate identification subtask. Our single model achieves new
state-of-the-art results on both span (CoNLL 2005, 2012) and dependency (CoNLL
2008, 2009) SRL benchmarks.
","[{""version"":""v1"",""created"":""Wed, 16 Jan 2019 13:48:53 GMT""}]","2019-01-17"
"1901.05281","Linyan Wan","Super-Kamiokande Collaboration: L. Wan, K. Abe, C. Bronner, Y. Hayato,
  M. Ikeda, K. Iyogi, J. Kameda, Y. Kato, Y. Kishimoto, Ll. Marti, M. Miura, S.
  Moriyama, T. Mochizuki, M. Nakahata, Y. Nakajima, Y. Nakano, S. Nakayama, T.
  Okada, K. Okamoto, A. Orii, G. Pronost, H. Sekiya, M. Shiozawa, Y. Sonoda, A.
  Takeda, A. Takenaka, H. Tanaka, T. Yano, R. Akutsu, T. Kajita, Y. Nishimura,
  K. Okumura, R. Wang, J. Xia, L. Labarga, P. Fernandez, F. d. M. Blaszczyk, C.
  Kachulis, E. Kearns, J. L. Raaf, J. L. Stone, S. Sussman, S. Berkman, J.
  Bian, N. J. Griskevich, W. R. Kropp, S. Locke, S. Mine, P. Weatherly, M. B.
  Smy, H. W. Sobel, V. Takhistov, K. S. Ganezer, J. Hill, J. Y. Kim, I. T. Lim,
  R. G. Park, B. Bodur, K. Scholberg, C. W. Walter, M. Gonin, J. Imber, Th. A.
  Mueller, T. Ishizuka, T. Nakamura, J. S. Jang, K. Choi, J. G. Learned, S.
  Matsuno, R. P. Litchfield, Y. Uchida, M. O. Wascko, N. F. Calabria, M. G.
  Catanesi, R. A. Intonti, E. Radicioni, G. De Rosa, A. Ali, G. Collazuol, F.
  Iacob, L. Ludovici, S. Cao, M. Friend, T. Hasegawa, T. Ishida, T. Kobayashi,
  T. Nakadaira, K. Nakamura, Y. Oyama, K. Sakashita, T. Sekiguchi, T.
  Tsukamoto, KE. Abe, M. Hasegawa, Y. Isobe, H. Miyabe, T. Sugimoto, A. T.
  Suzuki, Y. Takeuchi, Y. Ashida, T. Hayashino, S. Hirota, M. Jiang, T. Kikawa,
  M. Mori, KE. Nakamura, T. Nakaya, R. A. Wendell, L. H. V. Anthony, N.
  McCauley, A. Pritchard, K. M. Tsui, Y. Fukuda, Y. Itow, M. Murrase, P.
  Mijakowski, K. Frankiewicz, C. K. Jung, X. Li, J. L. Palomino, G. Santucci,
  C. Vilela, M. J. Wilking, C. Yanagisawa, D. Fukuda, K. Hagiwara, H. Ishino,
  S. Ito, Y. Koshio, M. Sakuda, Y. Takahira, C. Xu, Y. Kuno, C. Simpson, D.
  Wark, F. Di Lodovico, B. Richards, S. Molina Sedgwick, R. Tacik, S. B. Kim,
  M. Thiesse, L. Thompson, H. Okazawa, Y. Choi, K. Nishijima, M. Koshiba, M.
  Yokoyama, A. Goldsack, K. Martens, M. Murdoch, B. Quilain, Y. Suzuki, M. R.
  Vagins, M. Kuze, Y. Okajima, T. Yoshida, M. Ishitsuka, J. F. Martin, C. M.
  Nantais, H. A. Tanaka, T. Towstego, M. Hartz, A. Konaka, P. de Perio, S.
  Chen, and A. Minamino","Measurement of neutrino-oxygen neutral-current quasi-elastic cross
  section using atmospheric neutrinos at Super-Kamiokande","11 pages, 9 figures, submitted to PRD","Phys. Rev. D 99, 032005 (2019)","10.1103/PhysRevD.99.032005",,"hep-ex","http://arxiv.org/licenses/nonexclusive-distrib/1.0/","  Neutral current (NC) interactions of atmospheric neutrinos on oxygen form one
of the major backgrounds in the search for supernova relic neutrinos with
water-based Cherenkov detectors. The NC channel is dominated by neutrino
quasi-elastic (NCQE) scattering off nucleons inside $^{16}$O nuclei. In this
paper we report the first measurement of NCQE cross section using atmospheric
neutrinos at Super-Kamiokande (SK). The measurement used 2,778 live days of
SK-IV data with a fiducial volume of 22.5 kiloton water. Within the visible
energy window of 7.5-29.5 MeV, we observed $117$ events compared to the
expected $71.9$ NCQE signal and $53.1$ background events. Weighted by the
atmospheric neutrino spectrum from 160 MeV to 10 GeV, the flux averaged NCQE
cross section is measured to be
$(1.01\pm0.17(\text{stat.})^{+0.78}_{-0.30}(\text{sys.}))\times10^{-38}$
cm$^2$.
","[{""version"":""v1"",""created"":""Wed, 16 Jan 2019 13:48:56 GMT""}]","2019-02-20"
"1901.05282","Maurizio Pierini","Bobak Hashemi and Nick Amin and Kaustuv Datta and Dominick Olivito and
  Maurizio Pierini","LHC analysis-specific datasets with Generative Adversarial Networks","14 pages, 11 figures",,,,"hep-ex cs.LG hep-ph","http://arxiv.org/licenses/nonexclusive-distrib/1.0/","  Using generative adversarial networks (GANs), we investigate the possibility
of creating large amounts of analysis-specific simulated LHC events at limited
computing cost. This kind of generative model is analysis specific in the sense
that it directly generates the high-level features used in the last stage of a
given physics analyses, learning the N-dimensional distribution of relevant
features in the context of a specific analysis selection. We apply this idea to
the generation of muon four-momenta in $Z \to \mu\mu$ events at the LHC. We
highlight how use-case specific issues emerge when the distributions of the
considered quantities exhibit particular features. We show how substantial
performance improvements and convergence speed-up can be obtained by including
regression terms in the loss function of the generator. We develop an objective
criterion to assess the geenrator performance in a quantitative way. With
further development, a generalization of this approach could substantially
reduce the needed amount of centrally produced fully simulated events in large
particle physics experiments.
","[{""version"":""v1"",""created"":""Wed, 16 Jan 2019 13:49:25 GMT""}]","2019-01-17"
