"1901.05031","Jeff Calder","Mauricio Flores, Jeff Calder, Gilad Lerman","Analysis and algorithms for $\ell_p$-based semi-supervised learning on
  graphs",,,,,"math.NA cs.CV cs.LG cs.NA math.AP","http://arxiv.org/licenses/nonexclusive-distrib/1.0/","  This paper addresses theory and applications of $\ell_p$-based Laplacian
regularization in semi-supervised learning. The graph $p$-Laplacian for $p>2$
has been proposed recently as a replacement for the standard ($p=2$) graph
Laplacian in semi-supervised learning problems with very few labels, where
Laplacian learning is degenerate.
  In the first part of the paper we prove new discrete to continuum convergence
results for $p$-Laplace problems on $k$-nearest neighbor ($k$-NN) graphs, which
are more commonly used in practice than random geometric graphs. Our analysis
shows that, on $k$-NN graphs, the $p$-Laplacian retains information about the
data distribution as $p\to \infty$ and Lipschitz learning ($p=\infty$) is
sensitive to the data distribution. This situation can be contrasted with
random geometric graphs, where the $p$-Laplacian forgets the data distribution
as $p\to \infty$. We also present a general framework for proving discrete to
continuum convergence results in graph-based learning that only requires
pointwise consistency and monotonicity.
  In the second part of the paper, we develop fast algorithms for solving the
variational and game-theoretic $p$-Laplace equations on weighted graphs for
$p>2$. We present several efficient and scalable algorithms for both
formulations, and present numerical results on synthetic data indicating their
convergence properties. Finally, we conduct extensive numerical experiments on
the MNIST, FashionMNIST and EMNIST datasets that illustrate the effectiveness
of the $p$-Laplacian formulation for semi-supervised learning with few labels.
In particular, we find that Lipschitz learning ($p=\infty$) performs well with
very few labels on $k$-NN graphs, which experimentally validates our
theoretical findings that Lipschitz learning retains information about the data
distribution (the unlabeled data) on $k$-NN graphs.
","[{""version"":""v1"",""created"":""Tue, 15 Jan 2019 20:03:12 GMT""},{""version"":""v2"",""created"":""Mon, 8 Jun 2020 16:02:30 GMT""},{""version"":""v3"",""created"":""Fri, 21 Jan 2022 16:08:38 GMT""},{""version"":""v4"",""created"":""Thu, 27 Jan 2022 15:32:32 GMT""}]","2022-01-28"
"1901.05032","Arturo C. Marti","\'Alvaro Su\'arez, Daniel Baccino and Arturo C Mart\'i","A dynamical model of remote-control model cars","5 pages, 9 figures",,"10.1088/1361-6552/aaff98",,"physics.ed-ph physics.pop-ph","http://arxiv.org/licenses/nonexclusive-distrib/1.0/","  Simple experiments for which differential equations cannot be solved
analytically can be addressed using an effective model that satisfactorily
reproduces the experimental data. In this work, the one-dimensional kinematics
of a remote-control model (toy) car was studied experimentally and its
dynamical equation modelled. In the experiment, maximum power was applied to
the car, initially at rest, until it reached its terminal velocity. Digital
video recording was used to obtain the relevant kinematic variables that
enabled to plot trajectories in the phase space. A dynamical equation of motion
was proposed in which the overall frictional force was modelled as an effective
force proportional to the velocity raised to the power of a real number. Since
such an equation could not be solved analytically, a dynamical model was
developed and the system parameters were calculated by non-linear fitting.
Finally, the resulting values were substituted in the motion equation and the
numerical results thus obtained were compared with the experimental data,
corroborating the accuracy of the model.
","[{""version"":""v1"",""created"":""Tue, 15 Jan 2019 20:07:44 GMT""}]","2019-03-27"
"1901.05033","Edwin Khoo","Edwin Khoo, Hongbo Zhao, Martin Z. Bazant","Linear stability analysis of transient electrodeposition in charged
  porous media: suppression of dendritic growth by surface conduction","55 pages, 12 figures, 2 tables",,"10.1149/2.1521910jes",,"physics.chem-ph","http://arxiv.org/licenses/nonexclusive-distrib/1.0/","  We study the linear stability of transient electrodeposition in a charged
random porous medium, whose pore surface charges can be of any sign, flanked by
a pair of planar metal electrodes. Discretization of the linear stability
problem results in a generalized eigenvalue problem for the dispersion relation
that is solved numerically, which agrees well with the analytical approximation
obtained from a boundary layer analysis valid at high wavenumbers. Under
galvanostatic conditions in which an overlimiting current is applied, in the
classical case of zero surface charges, the electric field at the cathode
diverges at Sand's time due to electrolyte depletion. The same phenomenon
happens for positive charges but earlier than Sand's time. However, negative
charges allow the system to sustain an overlimiting current via surface
conduction past Sand's time, keeping the electric field bounded. Therefore, at
Sand's time, negative charges greatly reduce surface instabilities and suppress
dendritic growth, while zero and positive charges magnify them. We compare
theoretical predictions for overall surface stabilization with published
experimental data for copper electrodeposition in cellulose nitrate membranes
and demonstrate good agreement between theory and experiment. We also apply the
stability analysis to how crystal grain size varies with duty cycle during
pulse electroplating.
","[{""version"":""v1"",""created"":""Tue, 15 Jan 2019 20:13:58 GMT""},{""version"":""v2"",""created"":""Sun, 7 Jul 2019 11:54:50 GMT""}]","2019-07-09"
"1901.05034","Matej Melo","Matej Melo, (on behalf of the ATLAS Collaboration)","Top-antitop charge asymmetry measurements in the lepton+jets channel
  with the ATLAS detector","Presented at 11th International Workshop on Top Quark Physics Bad
  Neunahr, Germany, September 16-21,2018",,,,"hep-ex","http://creativecommons.org/licenses/by/4.0/","  We report a measurement of the charge asymmetry in top quark pair production
with the ATLAS experiment at the LHC using 20.3 fb$^{-1}$ of pp collision data
at $\sqrt{s}$ = 8 TeV. The data are unfolded using a fully Bayesian unfolding
method. Differential measurements of the charge asymmetry are performed.
","[{""version"":""v1"",""created"":""Tue, 15 Jan 2019 20:15:38 GMT""}]","2019-01-17"
"1901.05035","Jean-Christophe Mourrat","Jean-Christophe Mourrat","An informal introduction to quantitative stochastic homogenization","18 pages, 9 figures, proceedings of ICMP 2018",,"10.1063/1.5089210",,"math-ph math.AP math.MP","http://arxiv.org/licenses/nonexclusive-distrib/1.0/","  Divergence-form operators with random coefficients homogenize over large
scales. Over the last decade, an intensive research effort focused on turning
this asymptotic statement into quantitative estimates. The goal of this note is
to review one approach for doing so based on the idea of renormalization. The
discussion is highly informal, with pointers to mathematically precise
statements.
","[{""version"":""v1"",""created"":""Tue, 15 Jan 2019 20:16:18 GMT""},{""version"":""v2"",""created"":""Fri, 22 Feb 2019 16:50:05 GMT""}]","2019-05-01"
"1901.05036","Evgeny Panov","Evgeniy Yu. Panov","Decay of periodic entropy solutions to degenerate nonlinear parabolic
  equations",,,,,"math.AP","http://arxiv.org/licenses/nonexclusive-distrib/1.0/","  Under a precise nonlinearity-diffusivity condition we establish the decay of
space-periodic entropy solutions of a multidimensional degenerate nonlinear
parabolic equation.
","[{""version"":""v1"",""created"":""Tue, 15 Jan 2019 20:18:18 GMT""}]","2019-01-17"
"1901.05037","Brahim El Asri","Brahim El Asri and Sehail Mazid","The Finite Horizon impulse control Problem with arbitrary cost functions
  : the Viscosity Solution Approach","23 paes",,,,"math.OC math.PR","http://arxiv.org/licenses/nonexclusive-distrib/1.0/","  We consider stochastic impulse control problems when the impulses cost
functions are arbitrary. We use the dynamic programming principle and viscosity
solutions approach to show that the value function is a unique viscosity
solution for the associated Hamilton-Jacobi-Bellman equation (HJB) partial
differential equation (PDE) of stochastic impulse control problems
","[{""version"":""v1"",""created"":""Tue, 15 Jan 2019 20:25:33 GMT""}]","2019-01-17"
"1901.05039","Lawrence Mouill\'e","Lawrence Mouill\'e","Local symmetry rank bound for positive intermediate Ricci curvatures","15 pages, 1 figure, final version","Geom Dedicata 216, 23 (2022)","10.1007/s10711-022-00686-7",,"math.DG","http://creativecommons.org/licenses/by/4.0/","  We use a local argument to prove if an $r$-dimensional torus acts
isometrically and effectively on a connected $n$-dimensional manifold which has
positive $k^\mathrm{th}$-intermediate Ricci curvature at some point, then $r
\leq \lfloor \frac{n+k}{2} \rfloor$. This symmetry rank bound generalizes those
established by Grove and Searle for positive sectional curvature and Wilking
for quasipositive curvature. As a consequence, we show that the symmetry rank
bound in the Maximal Symmetry Rank Conjecture for manifolds of non-negative
sectional curvature holds for those which also have positive intermediate Ricci
curvature at some point. In the process of proving our symmetry rank bound, we
also obtain an optimal dimensional restriction on isometric immersions of
manifolds with non-positive intermediate Ricci curvature into manifolds with
positive intermediate Ricci curvature, generalizing a result by Otsuki.
","[{""version"":""v1"",""created"":""Tue, 15 Jan 2019 20:41:39 GMT""},{""version"":""v2"",""created"":""Fri, 20 Sep 2019 18:38:28 GMT""},{""version"":""v3"",""created"":""Sun, 19 Apr 2020 17:41:55 GMT""},{""version"":""v4"",""created"":""Mon, 26 Jul 2021 20:03:00 GMT""},{""version"":""v5"",""created"":""Tue, 22 Mar 2022 14:19:20 GMT""}]","2022-03-23"
"1901.05040","Ding-Fu Shao Ph. D.","Gautam Gurung, Ding-Fu Shao, Tula R. Paudel, and Evgeny Y. Tsymbal","Anomalous Hall Conductivity of a Non-Collinear Magnetic Antiperovskite",,"Phys. Rev. Materials 3, 044409 (2019)","10.1103/PhysRevMaterials.3.044409",,"cond-mat.mtrl-sci","http://arxiv.org/licenses/nonexclusive-distrib/1.0/","  The anomalous Hall effect (AHE) is a well-known fundamental property of
ferromagnetic metals, commonly associated with the presence of a net
magnetization. Recently, an AHE has been discovered in non-collinear
antiferromagnetic (AFM) metals. Driven by non-vanishing Berry curvature of AFM
materials with certain magnetic space group symmetry, anomalous Hall
conductivity (AHC) is very sensitive to the specific type of magnetic ordering.
Here, we investigate the appearance of AHC in antiperovskite GaNMn$_{3}$ as a
representative of broader materials family ANMn$_{3}$ (A is a main group
element), where different types of non-collinear magnetic ordering can emerge.
Using symmetry analyses and first-principles density-functional theory
calculations, we show that with almost identical band structure, the nearly
degenerate non-collinear AFM $\Gamma_{5g}$ and $\Gamma_{4g}$ phases of
GaNMn$_{3}$ have zero and finite AHC, respectively. In a non-collinear
ferrimagnetic $M$-1 phase, GaNMn$_{3}$ exhibits a large AHC due to the presence
of a sizable net magnetic moment. In the non-collinear antiperovskite magnets,
transitions between different magnetic phases, exhibiting different AHC states,
can be produced by doping, strain, or spin transfer torque, which makes these
materials promising for novel spintronic applications.
","[{""version"":""v1"",""created"":""Tue, 15 Jan 2019 20:44:53 GMT""}]","2019-04-25"
"1901.05041","Alexander Panchenko","Matthias Schildw\""achter, Alexander Bondarenko, Julian Zenker,
  Matthias Hagen, Chris Biemann, and Alexander Panchenko","Answering Comparative Questions: Better than Ten-Blue-Links?","In Proceeding of 2019 Conference on Human Information Interaction and
  Retrieval (CHIIR '19), March 10--14, 2019, Glasgow, United Kingdom",,"10.1145/3295750.3298916",,"cs.CL","http://creativecommons.org/licenses/by/4.0/","  We present CAM (comparative argumentative machine), a novel open-domain IR
system to argumentatively compare objects with respect to information extracted
from the Common Crawl. In a user study, the participants obtained 15% more
accurate answers using CAM compared to a ""traditional"" keyword-based search and
were 20% faster in finding the answer to comparative questions.
","[{""version"":""v1"",""created"":""Tue, 15 Jan 2019 20:50:28 GMT""}]","2019-01-17"
"1901.05042","Sourangsu Banerji","Sourangsu Banerji, Monjurul Meem, Berardi Sensale-Rodriguez and Rajesh
  Menon","Imaging with flat optics: metalenses or diffractive lenses?","4 figures, 2 tables",,,,"physics.optics","http://arxiv.org/licenses/nonexclusive-distrib/1.0/","  Recently, there has been an explosion of interest in metalenses for imaging.
The interest is primarily based on their sub-wavelength thicknesses.
Diffractive lenses have been used as thin lenses since the late 19th century.
Here, we show that multi-level diffractive lenses (MDLs), when designed
properly can exceed the performance of metalenses. Furthermore, MDLs can be
designed and fabricated with larger constituent features, making them
accessible to low-cost, large area volume manufacturing, which is generally
challenging for metalenses. The support substrate will dominate overall
thickness for all flat optics. Therefore the advantage of a slight decrease in
thickness (from ~2{\lambda} to ~{\lambda}/2) afforded by metalenses may not be
useful. We further elaborate on the differences between these approaches and
clarify that metalenses have unique advantages when manipulating the
polarization states of light.
","[{""version"":""v1"",""created"":""Tue, 15 Jan 2019 20:51:15 GMT""},{""version"":""v2"",""created"":""Wed, 7 Aug 2019 22:23:19 GMT""}]","2019-08-09"
"1901.05043","Mohammad Mahdi Dehshibi Dr.","Mohammad Mahdi Dehshibi, Jitka Cejkova, Dominik Svara, Andrew
  Adamatzky","On complexity of branching droplets in electrical field",,,,,"cs.ET cs.CC cs.CV","http://creativecommons.org/publicdomain/zero/1.0/","  Decanol droplets in a thin layer of sodium decanoate with sodium chloride
exhibit bifurcation branching growth due to interplay between osmotic pressure,
diffusion and surface tension. We aimed to evaluate if morphology of the
branching droplets changes when the droplets are subject to electrical
potential difference. We analysed graph-theoretic structure of the droplets and
applied several complexity measures. We found that, in overall, the current
increases complexity of the branching droplets in terms of number of connected
components and nodes in their graph presentations, morphological complexity and
compressibility.
","[{""version"":""v1"",""created"":""Tue, 15 Jan 2019 20:53:40 GMT""}]","2019-01-17"
"1901.05044","Nicholas Esterer","Nicholas Esterer, Philippe Depalle","A linear programming approach to the tracking of partials","5 pages, 1 pdf figure",,,,"eess.AS cs.SD eess.SP","http://creativecommons.org/licenses/by-nc-sa/4.0/","  A new approach to the tracking of sinusoidal chirps using linear programming
is proposed. It is demonstrated that the classical algorithm of McAulay and
Quatieri is greedy and exhibits exponential complexity for long searches, while
approaches based on the Viterbi algorithm exhibit factorial complexity. A
linear programming (LP) formulation to find the best $L$ paths in a lattice is
described and its complexity is shown to be less than previous approaches.
Finally it is demonstrated that the new LP formulation outperforms the
classical algorithm in the tracking of sinusoidal chirps in high levels of
noise.
","[{""version"":""v1"",""created"":""Tue, 15 Jan 2019 21:05:34 GMT""}]","2019-01-17"
"1901.05045","Shirin Jalali","Pei Peng, Shirin Jalali, Xin Yuan","Solving inverse problems via auto-encoders",,,,,"cs.IT math.IT","http://arxiv.org/licenses/nonexclusive-distrib/1.0/","  Compressed sensing (CS) is about recovering a structured signal from its
under-determined linear measurements. Starting from sparsity, recovery methods
have steadily moved towards more complex structures. Emerging machine learning
tools such as generative functions that are based on neural networks are able
to learn general complex structures from training data. This makes them
potentially powerful tools for designing CS algorithms. Consider a desired
class of signals $\cal Q$, ${\cal Q}\subset{R}^n$, and a corresponding
generative function $g:{\cal U}^k\rightarrow {R}^n$, ${\cal U}\subset {R}$,
such that $\sup_{{\bf x}\in {\cal Q}}\min_{{\bf u}\in{\cal U}^k}{1\over
\sqrt{n}}\|g({\bf u})-{\bf x}\|\leq \delta$. A recovery method based on $g$
seeks $g({\bf u})$ with minimum measurement error. In this paper, the
performance of such a recovery method is studied, under both noisy and
noiseless measurements. In the noiseless case, roughly speaking, it is proven
that, as $k$ and $n$ grow without bound and $\delta$ converges to zero, if the
number of measurements ($m$) is larger than the input dimension of the
generative model ($k$), then asymptotically, almost lossless recovery is
possible. Furthermore, the performance of an efficient iterative algorithm
based on projected gradient descent is studied. In this case, an auto-encoder
is used to define and enforce the source structure at the projection step. The
auto-encoder is defined by encoder and decoder (generative) functions
$f:{R}^n\to{\cal U}^k$ and $g:{\cal U}^k\to{R}^n$, respectively. We
theoretically prove that, roughly, given $m>40k\log{1\over \delta}$
measurements, such an algorithm converges to the vicinity of the desired
result, even in the presence of additive white Gaussian noise. Numerical
results exploring the effectiveness of the proposed method are presented.
","[{""version"":""v1"",""created"":""Tue, 15 Jan 2019 21:08:22 GMT""},{""version"":""v2"",""created"":""Tue, 17 Dec 2019 17:23:51 GMT""}]","2019-12-18"
"1901.05046","Camille Horbez","Vincent Guirardel and Camille Horbez","Boundaries of relative factor graphs and subgroup classification for
  automorphisms of free products","v2: Final version. Accepted in Geometry & Topology","Geom. Topol. 26 (2022) 71-126","10.2140/gt.2022.26.71",,"math.GR math.GT","http://arxiv.org/licenses/nonexclusive-distrib/1.0/","  Given a countable group $G$ splitting as a free product $G=G_1\ast\dots\ast
G_k\ast F_N$, we establish classification results for subgroups of the group
$Out(G,\mathcal{F})$ of all outer automorphisms of $G$ that preserve the
conjugacy classes of each $G_i$. We show that every finitely generated subgroup
$H\subseteq Out(G,\mathcal{F})$ either contains a relatively fully irreducible
automorphism, or else it virtually preserves the conjugacy class of a proper
free factor relative to the decomposition (the finite generation hypothesis on
$H$ can be dropped for $G=F_N$, or more generally when $G$ is toral relatively
hyperbolic). In the first case, either $H$ virtually preserves a nonperipheral
conjugacy class in $G$, or else $H$ contains an atoroidal automorphism. The key
geometric tool to obtain these classification results is a description of the
Gromov boundaries of relative versions of the free factor graph $\mathrm{FF}$
and the $\mathcal{Z}$-factor graph $\mathcal{Z}\mathrm{F}$, as spaces of
equivalence classes of arational trees (respectively relatively free arational
trees). We also identify the loxodromic isometries of $\mathrm{FF}$ with the
fully irreducible elements of $Out(G,\mathcal{F})$, and loxodromic isometries
of $\mathcal{Z}\mathrm{F}$ with the fully irreducible atoroidal outer
automorphisms.
","[{""version"":""v1"",""created"":""Tue, 15 Jan 2019 21:22:46 GMT""},{""version"":""v2"",""created"":""Fri, 25 Sep 2020 14:16:25 GMT""}]","2022-04-20"
"1901.05047","Alexander Zyuzin","Alexander A. Zyuzin, Pascal Simon","Disorder-induced exceptional points and nodal lines in Dirac
  superconductors","10 pages, 5 figures","Phys. Rev. B 99, 165145 (2019)","10.1103/PhysRevB.99.165145",,"cond-mat.supr-con cond-mat.mes-hall","http://arxiv.org/licenses/nonexclusive-distrib/1.0/","  We consider the effect of disorder on the spectrum of quasiparticles in the
point-node and nodal-line superconductors. Due to the anisotropic dispersion of
quasiparticles disorder scattering may render the Hamiltonian describing these
excitations non-Hermitian. Depending on the dimensionality of the system, we
show that the nodes in the spectrum are replaced by Fermi arcs or Fermi areas
bounded by exceptional points or exceptional lines, respectively. These
features are illustrated by first considering a model of a proximity-induced
superconductor in an anisotropic two-dimensional (2D) Dirac semimetal, where a
Fermi arc in the gap bounded by exceptional points can be realized. We next
show that the interplay between disorder and supercurrents can give rise to a
2D Fermi surface bounded by exceptional lines in three-dimensional (3D) nodal
superconductors.
","[{""version"":""v1"",""created"":""Tue, 15 Jan 2019 21:24:20 GMT""},{""version"":""v2"",""created"":""Thu, 2 May 2019 11:08:15 GMT""}]","2019-05-08"
"1901.05048","Inkang Kim","Inkang Kim, Xueyuan Wan, and Genkai Zhang","Plurisuperharmonicity of reciprocal energy function on Teichmuller space
  and Weil-Petersson metrics","27 pages",,,,"math.DG","http://arxiv.org/licenses/nonexclusive-distrib/1.0/","  We consider harmonic maps$u(z): \mathcal{X}_z\to N$ in a fixed homotopy class
from Riemann surfaces $\mathcal{X}_z$ of genus $g\geq 2$ varying in the
Teichm\""u{}ller space $\mathcal T$ to a Riemannian manifold $N$ with
non-positive Hermitian sectional curvature.
  The energy function $E(z)=E(u(z))$ can be viewed as a function on $\mathcal
T$ and we study its first and the second variations. We prove that the
reciprocal energy function $E(z)^{-1}$ is plurisuperharmonic on Teichm\""uller
space. We also obtain the (strict) plurisubharmonicity of $\log E(z)$ and
$E(z)$. As an application, we get the following relationship between the second
variation of logarithmic energy function and the Weil-Petersson metric if the
harmonic map $u(z)$ is holomorphic or anti-holomorphic and totally geodesic,
i.e., $$ \sqrt{-1}\p\b{\p}\log E(z)=\frac{\omega_{WP}}{2\pi(g-1)}. $$ We
consider also the energy function $E(z)$ associated to the harmonic maps from a
fixed compact K\""ahler manifold $M$ to Riemann surfaces
${\mathcal{X}_z\}_{z\in\mathcal{T}}$ in a fixed homotopy class. If $u(z)$ is
holomorphic or anti-holomorphic, then the above equation is also proved.
","[{""version"":""v1"",""created"":""Tue, 15 Jan 2019 21:26:02 GMT""}]","2019-01-17"
"1901.05049","Miguel de Prado","Miguel de Prado, Jing Su, Rabia Saeed, Lorenzo Keller, Noelia Vallez,
  Andrew Anderson, David Gregg, Luca Benini, Tim Llewellynn, Nabil Ouerhani,
  Rozenn Dahyot and, Nuria Pazos","Bonseyes AI Pipeline -- bringing AI to you. End-to-end integration of
  data, algorithms and deployment tools",,,"10.1145/3403572",,"cs.LG cs.DC cs.SD eess.AS stat.ML","http://arxiv.org/licenses/nonexclusive-distrib/1.0/","  Next generation of embedded Information and Communication Technology (ICT)
systems are collaborative systems able to perform autonomous tasks. The
remarkable expansion of the embedded ICT market, together with the rise and
breakthroughs of Artificial Intelligence (AI), have put the focus on the Edge
as it stands as one of the keys for the next technological revolution: the
seamless integration of AI in our daily life. However, training and deployment
of custom AI solutions on embedded devices require a fine-grained integration
of data, algorithms, and tools to achieve high accuracy. Such integration
requires a high level of expertise that becomes a real bottleneck for small and
medium enterprises wanting to deploy AI solutions on the Edge which,
ultimately, slows down the adoption of AI on daily-life applications. In this
work, we present a modular AI pipeline as an integrating framework to bring
data, algorithms, and deployment tools together. By removing the integration
barriers and lowering the required expertise, we can interconnect the different
stages of tools and provide a modular end-to-end development of AI products for
embedded devices. Our AI pipeline consists of four modular main steps: i) data
ingestion, ii) model training, iii) deployment optimization and, iv) the IoT
hub integration. To show the effectiveness of our pipeline, we provide examples
of different AI applications during each of the steps. Besides, we integrate
our deployment framework, LPDNN, into the AI pipeline and present its
lightweight architecture and deployment capabilities for embedded devices.
Finally, we demonstrate the results of the AI pipeline by showing the
deployment of several AI applications such as keyword spotting, image
classification and object detection on a set of well-known embedded platforms,
where LPDNN consistently outperforms all other popular deployment frameworks.
","[{""version"":""v1"",""created"":""Tue, 15 Jan 2019 21:27:28 GMT""},{""version"":""v2"",""created"":""Wed, 20 May 2020 08:12:04 GMT""},{""version"":""v3"",""created"":""Thu, 11 Jun 2020 06:41:02 GMT""}]","2020-08-18"
