"1901.05144","Longqing Cong","Longqing Cong, Ranjan Singh","Dual bound states in the continuum in metamaterials","15 pages, 5 figures",,,,"physics.optics","http://arxiv.org/licenses/nonexclusive-distrib/1.0/","  Bound state in the continuum (BIC) is a mathematical concept with an infinite
radiative quality factor (Q) that exists only in an ideal infinite array. It
was first proposed in quantum mechanics, and extended to general wave phenomena
such as acoustic, water, elastic, and electromagnetic waves. In photonics, it
is essential to achieve high Q resonances for enhanced light-mater interactions
that could enable low-threshold lasers, ultrasensitive sensors, and optical
tweezers. Here, we demonstrate dual bound states in the continuum in a
subwavelength planar metamaterial cavity that reveal symmetry-protected
features excited by orthogonal polarizations. The spectral features of dual
BICs are experimentally verified in the terahertz domain by breaking the C2
symmetry that invokes a leakage channel. The radiative Q factors tend to
infinity at a discrete symmetry-restoring point and obey an inverse square
dependence on the structural asymmetry. Metamaterials allow field confinement
in extremely small mode volumes, thereby improving the rate of spontaneous
emission in the cavity with a much larger Purcell factor along with high Q
factor. The symmetry-protected BICs in metamaterials also possess the unique
advantage of scalability at different wavelengths for potential applications in
sensing, lasing, switching, and spectral filtering.
","[{""version"":""v1"",""created"":""Wed, 16 Jan 2019 06:07:30 GMT""}]","2019-01-17"
"1901.05145","Mikel Palmero","Mikel Palmero, Xiansong Xu, Chu Guo and Dario Poletti","Thermalization with detailed-balanced two-site Lindblad dissipators","9 pages, 7 figures","Phys. Rev. E 100, 022111 (2019)","10.1103/PhysRevE.100.022111",,"cond-mat.stat-mech cond-mat.quant-gas quant-ph","http://arxiv.org/licenses/nonexclusive-distrib/1.0/","  The use of two-site Lindblad dissipator to generate thermal states and study
heat transport raised to prominence since [J. Stat. Mech. (2009) P02035] by
Prosen and \v{Z}nidari\v{c}. Here we propose a variant of this method based on
detailed balance of internal levels of the two site Hamiltonian and
characterize its performance. We study the thermalization profile in the chain,
the effective temperatures achieved by different single and two-site
observables, and we also investigate the decay of two-time correlations. We
find that at a large enough temperature the steady state approaches closely a
thermal state, with a relative error below 1% for the inverse temperature
estimated from different observables.
","[{""version"":""v1"",""created"":""Wed, 16 Jan 2019 06:07:44 GMT""}]","2019-08-14"
"1901.05146","Marianne Morillon","Marianne Morillon","Linear extenders and the Axiom of Choice",,"Commentationes Mathematicae Universitatis Carolinae, VOLUME =
  {58}, YEAR = {2017}, NUMBER = {4}, PAGES = {419--434},",,,"math.LO","http://arxiv.org/licenses/nonexclusive-distrib/1.0/","  In set theory without the axiom of Choice ZF, we prove that for every
commutative field IK, the following statement D_{\IK}: ""On every non null
IK-vector space, there exists a non null linear form"" implies the existence of
a IK-linear extender on every vector subspace of a $\IK$-vector space. This
solves a question raised in \cite{Mo09}. In the second part of the paper, we
generalize our results in the case of spherically complete ultrametric valued
fields, and show that Ingleton's statement is equivalent to the existence of
""isometric linear extenders"".
","[{""version"":""v1"",""created"":""Wed, 16 Jan 2019 06:09:17 GMT""}]","2019-01-17"
"1901.05147","Anna Guitart","Anna Guitart, Pei Pei Chen and \'Africa Peri\'a\~nez","The Winning Solution to the IEEE CIG 2017 Game Data Mining Competition",,"Machine Learning and Knowledge Extraction, 1(1), 252--264, 2019","10.3390/make1010016",,"stat.ML cs.LG","http://arxiv.org/licenses/nonexclusive-distrib/1.0/","  Machine learning competitions such as those organized by Kaggle or KDD
represent a useful benchmark for data science research. In this work, we
present our winning solution to the Game Data Mining competition hosted at the
2017 IEEE Conference on Computational Intelligence and Games (CIG 2017). The
contest consisted of two tracks, and participants (more than 250, belonging to
both industry and academia) were to predict which players would stop playing
the game, as well as their remaining lifetime. The data were provided by a
major worldwide video game company, NCSoft, and came from their successful
massively multiplayer online game Blade and Soul. Here, we describe the long
short-term memory approach and conditional inference survival ensemble model
that made us win both tracks of the contest, as well as the validation
procedure that we followed in order to prevent overfitting. In particular,
choosing a survival method able to deal with censored data was crucial to
accurately predict the moment in which each player would leave the game, as
censoring is inherent in churn. The selected models proved to be robust against
evolving conditions---since there was a change in the business model of the
game (from subscription-based to free-to-play) between the two sample datasets
provided---and efficient in terms of time cost. Thanks to these features and
also to their a ability to scale to large datasets, our models could be readily
implemented in real business settings.
","[{""version"":""v1"",""created"":""Wed, 16 Jan 2019 06:10:45 GMT""}]","2019-01-18"
"1901.05148","Brian White","Brian White","Generic Transversality of Minimal Submanifolds and Generic Regularity of
  Two-Dimensional Area-Minimizing Integral Currents","21 pages. The revised version (Dec, 2019) has a new section about
  generic regularity of $2$-dimensional area minimizers",,,,"math.DG","http://arxiv.org/licenses/nonexclusive-distrib/1.0/","  Suppose that $N$ is a smooth manifold with a smooth Riemannian metric $g_0$,
and that $\Gamma$ is a smooth submanifold of $N$. This paper proves that for a
generic (in the sense of Baire category) smooth metric $g$ conformal to $g_0$,
if $F$ is any simple $g$-minimal immersion of a closed manifold into N, then
$F$ is transverse to $\Gamma$ and $F$ is self-transverse. The theorem remains
true with ""transverse"" and ""self-transverse"" replaced by ""strongly transverse""
and ""strongly self-transverse"". The theorem also holds for hypersurfaces of
constant mean curvature or, more generally, of prescribed mean curvature.
  The paper also proves that for a generic ambient metric, every
$2$-dimensional surface (integral current or flat chain mod $2$) without
boundary that minimizes area in its homology class has support equal to a
smoothly embedded minimal surface.
","[{""version"":""v1"",""created"":""Wed, 16 Jan 2019 06:20:53 GMT""},{""version"":""v2"",""created"":""Tue, 3 Dec 2019 17:20:07 GMT""}]","2019-12-04"
"1901.05149","Guangmo Tong","Gunagmo Tong, Ding-Zhu Du","Beyond Uniform Reverse Sampling: A Hybrid Sampling Technique for
  Misinformation Prevention","New parameter estimation methods have been proposed to fix an error
  in the previous version",,,,"cs.SI cs.DS","http://arxiv.org/licenses/nonexclusive-distrib/1.0/","  Online misinformation has been considered as one of the top global risks as
it may cause serious consequences such as economic damages and public panic.
The misinformation prevention problem aims at generating a positive cascade
with appropriate seed nodes in order to compete against the misinformation. In
this paper, we study the misinformation prevention problem under the prominent
independent cascade model. Due to the #P-hardness in computing influence, the
core problem is to design effective sampling methods to estimate the function
value. The main contribution of this paper is a novel sampling method.
Different from the classic reverse sampling technique which treats all nodes
equally and samples the node uniformly, the proposed method proceeds with a
hybrid sampling process which is able to attach high weights to the users who
are prone to be affected by the misinformation. Consequently, the new sampling
method is more powerful in generating effective samples used for computing seed
nodes for the positive cascade. Based on the new hybrid sample technique, we
design an algorithm offering a $(1-1/e-\epsilon)$-approximation. We
experimentally evaluate the proposed method on extensive datasets and show that
it significantly outperforms the state-of-the-art solutions.
","[{""version"":""v1"",""created"":""Wed, 16 Jan 2019 06:24:37 GMT""},{""version"":""v2"",""created"":""Fri, 20 Dec 2019 20:56:38 GMT""}]","2019-12-24"
"1901.05150","Ikuo Ichinose","Takahiro Orito, Ikuo Ichinose","Extended stream functions for dynamics of Bose-Einstein condensations:
  Snake instability of dark soliton in ultra-cold atoms as an example","9 pages, 11 figures",,,,"cond-mat.quant-gas","http://arxiv.org/licenses/nonexclusive-distrib/1.0/","  In this paper, we formulate extended stream functions (ESFs) to describe the
dynamics of Bose-Einstein condensations in the two-dimensional space. The
ordinary stream function is applicable only for stationary and incompressible
superfluids, whereas the ESFs can describe the dynamics of compressible and
non-stationary superfluids. The ESFs are composed of two stream functions,
i.e., one describes the compressible density modulations and the other the
incompressible rotational superflow. As an application, we study the snake
instability of the dark soliton in a rectangular potential in detail by the
ESFs.
","[{""version"":""v1"",""created"":""Wed, 16 Jan 2019 06:29:57 GMT""}]","2019-01-17"
"1901.05151","Bhaskar Kanseri Dr.","Bhaskar Kanseri and Sethuraj K.R","Experimental observation of polarization coherence theorem",,"Optics Letters 44, 159 (2019)","10.1364/OL.44.000159",,"physics.optics quant-ph","http://arxiv.org/licenses/nonexclusive-distrib/1.0/","  For light fields, the manifestation of correlations between fluctuating
electric field components at different space-time points is referred to as
coherence, whereas these correlations appearing between orthogonal electric
field components at single space-time point are referred to as polarization. In
this context, a natural question is: how coherence and polarization are
interconnected? Very recently, a tight equality P^2=V^2+D^2 namely the
""polarization coherence theorem"" (PCT) connecting polarization P with
interference visibility V (measure of coherence) and distinguishability D
(measure of which-path information) has been proposed [Optica 4, 1113 (2017)].
We here report a direct observation of PCT for classical light fields using a
Mach-Zehnder interferometer along with a synthesized source producing a
complete gamut of degrees of polarizations. Our experimental demonstration
could motivate ongoing experimental efforts towards probing the hidden
coherences and complementarity features.
","[{""version"":""v1"",""created"":""Wed, 16 Jan 2019 06:30:35 GMT""}]","2019-02-07"
"1901.05152","Immanuel Trummer Mr.","Immanuel Trummer, Junxiong Wang, Deepak Maram, Samuel Moseley, Saehan
  Jo, Joseph Antonakakis","SkinnerDB: Regret-Bounded Query Evaluation via Reinforcement Learning",,"SIGMOD 2019","10.1145/3299869.3300088",,"cs.DB","http://arxiv.org/licenses/nonexclusive-distrib/1.0/","  SkinnerDB is designed from the ground up for reliable join ordering. It
maintains no data statistics and uses no cost or cardinality models. Instead,
it uses reinforcement learning to learn optimal join orders on the fly, during
the execution of the current query. To that purpose, we divide the execution of
a query into many small time slices. Different join orders are tried in
different time slices. We merge result tuples generated according to different
join orders until a complete result is obtained. By measuring execution
progress per time slice, we identify promising join orders as execution
proceeds.
  Along with SkinnerDB, we introduce a new quality criterion for query
execution strategies. We compare expected execution cost against execution cost
for an optimal join order. SkinnerDB features multiple execution strategies
that are optimized for that criterion. Some of them can be executed on top of
existing database systems. For maximal performance, we introduce a customized
execution engine, facilitating fast join order switching via specialized
multi-way join algorithms and tuple representations.
  We experimentally compare SkinnerDB's performance against various baselines,
including MonetDB, Postgres, and adaptive processing methods. We consider
various benchmarks, including the join order benchmark and TPC-H variants with
user-defined functions. Overall, the overheads of reliable join ordering are
negligible compared to the performance impact of the occasional, catastrophic
join order choice.
","[{""version"":""v1"",""created"":""Wed, 16 Jan 2019 06:38:11 GMT""}]","2019-01-17"
"1901.05153","Ragini Chaluvadi","Ragini Chaluvadi, Bolli Madhuri, Srikrishna Bhashyam","Channel Conditions for the Optimality of Interference Decoding Schemes
  for K-user Gaussian Interference Channels",,,"10.3390/e21111053",,"cs.IT math.IT","http://arxiv.org/licenses/nonexclusive-distrib/1.0/","  The Han-Kobayashi (HK) scheme achieves the best known achievable rate region
for the K user interference channel (IC). Simple HK schemes are HK schemes with
Gaussian signaling, no time sharing, and no private-common power splitting. The
class of simple HK schemes includes the treating interference as noise (TIN)
scheme and schemes that involve various levels of interference decoding and
cancellation at each receiver. We derive conditions under which simple HK
schemes achieve sum capacity for general K user Gaussian ICs. These results
generalize existing sum capacity results for the TIN scheme to the class of
simple HK schemes.
","[{""version"":""v1"",""created"":""Wed, 16 Jan 2019 06:39:17 GMT""},{""version"":""v2"",""created"":""Mon, 21 Jan 2019 10:36:01 GMT""}]","2020-01-08"
"1901.05154","Sixiang Zhao","Sixiang Zhao, William B. Haskell, Michel-Alexandre Cardin","An Accelerated Fitted Value Iteration Algorithm for MDPs with Finite and
  Vector-Valued Action Space",,,,,"math.OC","http://arxiv.org/licenses/nonexclusive-distrib/1.0/","  This paper studies an accelerated fitted value iteration (FVI) algorithm to
solve high-dimensional Markov decision processes (MDPs). FVI is an approximate
dynamic programming algorithm that has desirable theoretical properties.
However, it can be intractable when the action space is finite but
vector-valued. To solve such MDPs via FVI, we first approximate the value
functions by a two-layer neural network (NN) with rectified linear units (ReLU)
being activation functions. We then verify that such approximators are strong
enough for the MDP. To speed up the FVI, we recast the action selection problem
as a two-stage stochastic programming problem, where the resulting recourse
function comes from the two-layer NN. Then, the action selection problem is
solved with a specialized multi-cut decomposition algorithm. More specifically,
we design valid cuts by exploiting the structure of the approximated value
functions to update the actions. We prove that the decomposition can find the
global optimal solution in a finite number of iterations and the overall
accelerated FVI is consistent. Finally, we verify the performance of the FVI
algorithm via a multi-facility capacity investment problem (MCIP). A
comprehensive numerical study is implemented, where the results show that the
FVI is significantly accelerated without sacrificing too much in precision.
","[{""version"":""v1"",""created"":""Wed, 16 Jan 2019 06:43:53 GMT""},{""version"":""v2"",""created"":""Thu, 26 Nov 2020 02:53:27 GMT""}]","2020-11-30"
"1901.05155","Michael Haythorpe","Kieran Clancy, Michael Haythorpe, Alex Newcombe","A survey of graphs with known or bounded crossing numbers","95 pages. Dynamic survey, last updated December 2021",,,,"math.CO","http://arxiv.org/licenses/nonexclusive-distrib/1.0/","  We present, to the best of the authors' knowledge, all known results for the
(planar) crossing numbers of specific graphs and graph families. The results
are separated into various categories; specifically, results for general graph
families, results for graphs arising from various graph products, and results
for recursive graph constructions.
","[{""version"":""v1"",""created"":""Wed, 16 Jan 2019 06:44:05 GMT""},{""version"":""v2"",""created"":""Thu, 31 Jan 2019 07:45:04 GMT""},{""version"":""v3"",""created"":""Fri, 15 Feb 2019 06:03:17 GMT""},{""version"":""v4"",""created"":""Tue, 7 Jul 2020 05:29:24 GMT""},{""version"":""v5"",""created"":""Wed, 8 Dec 2021 04:47:17 GMT""}]","2021-12-09"
"1901.05156","Denis Novitsky","Denis Novitsky and Alexander Shalin","All-optical transmission modulation due to inelastic interactions of
  ultrashort pulses in a disordered resonant medium","9 pages, 8 figures","Annalen der Physik 1800405 (2018)","10.1002/andp.201800405",,"physics.optics","http://arxiv.org/licenses/nonexclusive-distrib/1.0/","  Random resonant media being one of the possible realizations of disordered
metamaterials open a room of opportunities for achieving new fundamental
effects and designing advanced nanophotonic devices. Strongly nonlinear optical
properties of such media attract ever increasing attention nowadays from both
theoretical and experimental points of view. Hereinafter we consider the case
of the photonic-crystal-like structure with a randomly varying light-matter
coupling provided by the random density of quantum particles. Using numerical
solution of the Maxwell-Bloch equations, we study the effects of the pulse
collisions in the medium. It is shown that disorder enables the qualitative
changes of the system's response for copropagating pulses, whereas this is not
the case for the counterpropagating ones. We propose the scheme for an
all-optical transmission modulation due to the disorder-induced inelasticity of
collisions of co-propagating pulses. The ability of the precise tuning the
modulation via the inter-pulse distance and background refractive index
adjustment is revealed. This novel approach for light control could be utilized
for some highly demanded applications, such as modulation and switching of a
pulsed radiation.
","[{""version"":""v1"",""created"":""Wed, 16 Jan 2019 06:46:11 GMT""}]","2019-01-17"
"1901.05157","Stefano Longhi","Stefano Longhi, Gian Luca Giorgi, Roberta Zambrini","Landau-Zener topological quantum state transfer","10 pages, 8 figures, to appear in Advanced Quantum Technologies","Advanced Quantum Technologies 2, 1800090 (2019)","10.1002/qute.201800090",,"quant-ph","http://arxiv.org/licenses/nonexclusive-distrib/1.0/","  Fast and robust quantum state transfer (QST) is a major requirement in
quantum control and in scalable quantum information processing. Topological
protection has emerged as a promising route for the realization of QST robust
against sizable imperfections in the network. Here we present a scheme for
robust QST of topologically protected edge states in a dimeric
Su-Schrieffer-Heeger spin chain assisted by Landau-Zener tunneling. As compared
to topological QST protocols based on Rabi flopping proposed in recent works,
our method is more advantageous in terms of robustness against both diagonal
and off-diagonal disorder in the chain, without a substantial increase of the
interaction time.
","[{""version"":""v1"",""created"":""Wed, 16 Jan 2019 06:47:04 GMT""}]","2021-02-19"
"1901.05158","Sally Shrapnel","Sally Shrapnel, Fabio Costa and Gerard Milburn","Quantum Markovianity as a supervised learning task",,"International Journal of Quantum Information, Special Issue on
  Quantum Techniques in Machine Learning, Volume 16, Issue 08 (December 2018),
  1840010","10.1142/S0219749918400105",,"quant-ph","http://arxiv.org/licenses/nonexclusive-distrib/1.0/","  Supervised learning algorithms take as input a set of labelled examples and
return as output a predictive model. Such models are used to estimate labels
for future, previously unseen examples drawn from the same generating
distribution. In this paper we investigate the possibility of using supervised
learning to estimate the dimension of a non-Markovian quantum environment. Our
approach uses an ensemble learning method, the Random Forest Regressor, applied
to classically simulated data sets. Our results indicate this is a promising
line of research.
","[{""version"":""v1"",""created"":""Wed, 16 Jan 2019 06:48:08 GMT""}]","2019-01-17"
"1901.05159","Aliya Siddiqui","Yavuz Selim Balkan, Aliya Naaz Siddiqui and Akram Ali","Generalized inequalities of warped product submanifolds of nearly
  Kenmotsu $f$-manifolds",,,,,"math.DG","http://arxiv.org/licenses/nonexclusive-distrib/1.0/","  In the present paper, we discuss the non-trivial warped product pseudo slant
submanifolds of type $M_{\bot }\times _{f}M_{\theta }$ and $M_{\theta}\times
_{f}M_{\bot }$ of nearly Kenmotsu $f$-manifold $\overline{M}$. Firstly, we get
some basic properties of these type warped product submanifolds. Then, we
establish the general sharp inequalities for squared norm of second fundamental
form for mixed totally geodesic warped product pseudo slant submanifolds of
both cases, in terms of the warping function and the slant angle. Also the
equality cases are verified. We show that some previous results are trivial
from our results.
","[{""version"":""v1"",""created"":""Wed, 16 Jan 2019 06:51:23 GMT""}]","2019-01-17"
"1901.05160","Chunguang Tang","Chunguang Tang and Peter Harrowell","Chemical Ordering and Crystal Nucleation at the Liquid Surface: A
  Comparison of $\rm{Cu}_{50}\rm{Zr}_{50}$ and $\rm{Ni}_{50}\rm{Al}_{50}$
  Alloys",,"The Journal of chemical physics, 148, 044509 (2018)","10.1063/1.5010051",,"cond-mat.mtrl-sci","http://arxiv.org/licenses/nonexclusive-distrib/1.0/","  We study the influence of the liquid-vapor surface on the crystallization
kinetics of supercooled metal alloys. While a good glass former,
$\rm{Cu}_{50}\rm{Zr}_{50}$, shows no evidence of surface enhancement of
crystallization, $\rm{Ni}_{50}\rm{Al}_{50}$ exhibits an increased rate of
crystallization due to heterogeneous nucleation at the free liquid surface. The
difference in the compositional fluctuations at the interface is proposed as
the explanation of the distinction between the two alloys. Specifically, we
observe compositional ordering at the surface of $\rm{Ni}_{50}\rm{Al}_{50}$
while the $\rm{Cu}_{50}\rm{Zr}_{50}$ alloy only exhibits a diffuse adsorption
of the Cu at the interface. We argue that the general difference in composition
susceptibilities at planar surfaces represents an important factor in
understanding the difference in the glass forming ability of the two alloys.
","[{""version"":""v1"",""created"":""Wed, 16 Jan 2019 06:57:05 GMT""}]","2019-01-17"
"1901.05161","Jens Kaad","Jens Kaad","On the Unbounded Picture of $KK$-Theory",,"SIGMA 16 (2020), 082, 21 pages","10.3842/SIGMA.2020.082",,"math.KT math.OA","http://creativecommons.org/licenses/by-sa/4.0/","  In the founding paper on unbounded $KK$-theory it was established by Baaj and
Julg that the bounded transform, which associates a class in $KK$-theory to any
unbounded Kasparov module, is a surjective homomorphism (under a separability
assumption). In this paper, we provide an equivalence relation on unbounded
Kasparov modules and we thereby describe the kernel of the bounded transform.
This allows us to introduce a notion of topological unbounded $KK$-theory,
which becomes isomorphic to $KK$-theory via the bounded transform. The
equivalence relation is formulated entirely at the level of unbounded Kasparov
modules and consists of homotopies together with an extra degeneracy condition.
Our degenerate unbounded Kasparov modules are called spectrally decomposable
since they admit a decomposition into a part with positive spectrum and a part
with negative spectrum.
","[{""version"":""v1"",""created"":""Wed, 16 Jan 2019 06:58:26 GMT""},{""version"":""v2"",""created"":""Mon, 21 Oct 2019 13:09:47 GMT""},{""version"":""v3"",""created"":""Sat, 22 Aug 2020 04:15:50 GMT""}]","2020-08-25"
"1901.05162","Muah Kim","Muah Kim, Jy-yong Sohn and Jaekyun Moon","Coded Matrix Multiplication on a Group-Based Model","9 pages, submitted to ISIT 2019",,,,"cs.IT math.IT","http://arxiv.org/licenses/nonexclusive-distrib/1.0/","  Coded distributed computing has been considered as a promising technique
which makes large-scale systems robust to the ""straggler"" workers. Yet,
practical system models for distributed computing have not been available that
reflect the clustered or grouped structure of real-world computing servers.
Neither the large variations in the computing power and bandwidth capabilities
across different servers have been properly modeled. We suggest a group-based
model to reflect practical conditions and develop an appropriate coding scheme
for this model. The suggested code, called group code, employs parallel
encoding for each group. We show that the suggested coding scheme can
asymptotically achieve optimal computing time in regimes of infinite n, the
number of workers. While theoretical analysis is conducted in the asymptotic
regime, numerical results also show that the suggested scheme achieves
near-optimal computing time for any finite but reasonably large n. Moreover, we
demonstrate that the decoding complexity of the suggested scheme is
significantly reduced by the virtue of parallel decoding.
","[{""version"":""v1"",""created"":""Wed, 16 Jan 2019 07:21:19 GMT""}]","2019-01-17"
