"1901.04894","Mustafa Savci","T. M. Aliev (1), T. Barakat (2), M. Savci (3) ((1,3) Middle East
  Technical University/Ankara/Turkey, (2) King Saud University/Riyadh/Saudi
  Arabia)","Study of the $\Lambda_{b} \to N^\ast \ell^+ \ell^- $ decay in light cone
  sum rules","21 pages, 2 figures, LaTeX formatted",,"10.1140/epjc/s10052-019-6879-0","metu-phys-hep-19-01","hep-ph","http://arxiv.org/licenses/nonexclusive-distrib/1.0/","  The form factors of the $\Lambda_{b} \to N^\ast \ell^+ \ell^-$ decay are
calculated in the framework of the light cone QCD sum rules. In the
calculations the contribution of the negative parity $\Lambda_b^\ast$ baryon is
eliminated by constructing the sum rules for different Lorentz structures.
Furthermore the branching ratio of the semileptonic $\Lambda_b \to N^\ast
\ell^+ \ell^-$ decay is calculated. The numerical study for the branching ratio
of the $\Lambda_{b} \to N^\ast \ell^+ \ell^-$ decay indicates that it is quite
large and could be measurable at future planned experiments to be conducted at
LHCb.
","[{""version"":""v1"",""created"":""Tue, 15 Jan 2019 16:01:51 GMT""},{""version"":""v2"",""created"":""Fri, 18 Jan 2019 09:22:39 GMT""}]","2019-05-22"
"1901.04895","Tian Lan","Tian Lan, Qiucui Li, Yushen Dou, Xunya Jiang","A Study Of a Wide-Angle Scanning Phased Array Based On a High-Impedance
  Surface Ground Plane",,,,,"physics.app-ph","http://arxiv.org/licenses/nonexclusive-distrib/1.0/","  This paper presents a two-dimensional infinite dipole array system with a
mushroom-like high-impedance surface (HIS) ground plane with wide-angle
scanning capability in the E-plane. The unit cell of the proposed antenna array
consists of a dipole antenna and a four-by-four HIS ground. The simulation
results show that the proposed antenna array can achieve a wide scanning angle
of up to 65$^{\circ}$ in the E-plane with an excellent impedance match and a
small $S11$. Floquet mode analysis is utilized to analyze the active impedance
and the reflection coefficient. Good agreement is obtained between the
theoretical results and the simulations. Using numerical and theoretical
analyses, we reveal the mechanism of such excellent wide scanning properties.
For the range of small scanning angles, these excellent properties result
mainly from the special reflection phase of the HIS ground, which can cause the
mutual coupling between the elements of the real array to be compensated by the
mutual coupling effect between the real array and the mirror array. For the
range of large scanning angles, since the surface wave (SW) mode could be
resonantly excited by a high-order Floquet mode $\textrm{TM}_{-1,0}$ from the
array and since the SW mode could be converted into a leaky wave (LW) mode by
the scattering of the array, the radiation field from the LW mode is nearly in
phase with the direct radiating field from the array. Therefore, with help from
the special reflection phase of the HIS and the designed LW mode of the HIS
ground, the antenna array with an HIS ground can achieve wide-angle scanning
performance.
","[{""version"":""v1"",""created"":""Tue, 15 Jan 2019 16:03:06 GMT""}]","2019-01-16"
"1901.04896","Luis Zapata Dr.","Luis A. Zapata (UNAM), Guido Garay (UC), Aina Palau (UNAM), Luis F.
  Rodriguez (UNAM), Manuel Fernandez-Lopez (IAR), Robert Estalella (UB), and
  Andres Guzman (NAOJ)","An Asymmetric Keplerian Disk Surrounding the O-type Protostar
  IRAS16547$-$4247","Accepted by The Astrophysical Journal",,"10.3847/1538-4357/aafedf",,"astro-ph.SR astro-ph.GA","http://arxiv.org/licenses/nonexclusive-distrib/1.0/","  During the last decades, a great interest has emerged to know if even the
most massive stars in our galaxy (namely the spectral O-type stars) are formed
in a similar manner as the low- and intermediate-mass stars, that is, through
the presence of accreting disks and powerful outflows. Here, using sensitive
observations of the Atacama Large Millimeter/Submillimeter Array (ALMA), we
report a resolved Keplerian disk (with fifteen synthesized beams across its
major axis) surrounding the deeply embedded O-type protostar IRAS16547$-$4247.
The disk shows some asymmetries that could arise because of the disk is
unstable and fragmenting or maybe because of different excitation conditions
within the disk. The enclosed mass estimated from the disk Keplerian radial
velocities is 25$\pm$3 M$_\odot$. The molecular disk is at the base of an
ionized thermal radio jet and is approximately perpendicular to the jet axis
orientation. We additionally find the existence of a binary system of compact
dusty objects at the center of the accreting disk, which indicates the possible
formation of an O-type star and a companion of lower mass. This is not
surprising due to the high binary fraction reported in massive stars.
Subtracting the contribution of the dusty disk plus the envelope and the
companion, we estimated a mass of 20 M$_\odot$ for the central star.
","[{""version"":""v1"",""created"":""Tue, 15 Jan 2019 16:05:55 GMT""}]","2019-02-27"
"1901.04897","David Barral Ra\~na","David Barral, Kamel Bencheikh, Peter J. Olver, Nadia Belabas and Juan
  Ariel Levenson","Symmetry-based analytical solutions to the \chi^{(2)} nonlinear
  directional coupler","7 pages, 6 figures","Phys. Rev. E 99, 042211 (2019)","10.1103/PhysRevE.99.042211",,"physics.optics nlin.SI quant-ph","http://arxiv.org/licenses/nonexclusive-distrib/1.0/","  In general the ubiquitous \chi^{(2)} nonlinear directional coupler, where
nonlinearity and evanescent coupling are intertwined, is nonintegrable. We
rigorously demonstrate that matching excitation to the even or odd fundamental
supermodes yields dynamical analytical solutions for any phase matching in a
symmetric coupler. We analyze second harmonic generation and optical parametric
amplification regimes and study the influence of fundamental fields parity and
power on the operation of the device. These fundamental solutions are useful to
develop applications in classical and quantum fields such as all-optical
modulation of light and quantum-states engineering.
","[{""version"":""v1"",""created"":""Tue, 15 Jan 2019 16:07:37 GMT""},{""version"":""v2"",""created"":""Wed, 6 Feb 2019 08:37:59 GMT""}]","2019-04-24"
"1901.04898","P. Gaspard","Pierre Gaspard","Multistate reversible copolymerization of nonMarkovian chains under low
  conversion conditions",,,"10.1063/1.5088942",,"physics.chem-ph","http://arxiv.org/licenses/nonexclusive-distrib/1.0/","  The reversible kinetics of copolymerization is solved analytically for the
multistate mechanism proposed by B. D. Coleman and T. G. Fox [J. Chem. Phys.
38, 1065 (1963)] under low conversion conditions where the concentrations of
monomeric species are chemostatted and stay constant in time. Although the
rates of this mechanism only depends on the currently attached or detached
monomer, the growing macromolecular chain forms a nonMarkovian sequence that is
characterized by matrices associated with every monomeric unit composing the
sequence. These matrices are obtained by solving the kinetic equations and they
determine the growth velocity of the copolymers, the statistical properties of
its possible sequences, as well as the thermodynamics of the copolymerization
process.
","[{""version"":""v1"",""created"":""Tue, 15 Jan 2019 16:08:25 GMT""}]","2019-05-22"
"1901.04900","Daniel Polak","Daniel W Polak, Andrew J Musser, George A Sutherland, Alexander Auty,
  Federico Branchi, Branislav Dzurnak, Jack Chidgey, Giulio Cerullo, C Neil
  Hunter, Jenny Clark","Band-edge Excitation of Carotenoids Removes S* Revealing Triplet-pair
  Contributions to the S1 Absorption Spectrum",,,,,"physics.chem-ph cond-mat.mtrl-sci","http://arxiv.org/licenses/nonexclusive-distrib/1.0/","  The nature of the low-lying electronic states in carotenoids has been debated
for decades. We use excitation-dependent transient absorption spectroscopy and
comparison with published results on \b{eta}-carotene to demonstrate that the
so-called S* feature in astaxanthin, echinenone and spheroidenone spectra is
due to an impurity in the sample. Excitation at the absorption band-edge
results in a transient absorption spectrum dominated by the pure S1
photo-induced absorption, with no contribution from impurities (S*). We find
that this S1 absorption resembles the triplet excited-state absorption
spectrum, shifted by ~200meV. To explain this, we suggest that the individual
triplets that make up the dominant triplet-pair (TT) configuration of 2A$_g^-$
contribute strongly to the S1 absorption band. Comparison with recent
literature on molecular polycrystalline films which undergo singlet fission
suggests the shift could be related to the binding energy of the triplet pair
state. These findings have implications for understanding triplet-pair states
in organic semiconductors and the excitation-energy dependence of singlet
fission in carotenoid aggregates and biological systems.
","[{""version"":""v1"",""created"":""Tue, 15 Jan 2019 16:09:58 GMT""}]","2019-01-16"
"1901.04901","Marek Sch\""onherr","Marek Sch\""onherr","Modelling and tuning in top quark physics","5 pages, 4 figures, 1 table, contribution to the TOP2018 conference
  proceedings",,,"IPPP/19/4","hep-ph hep-ex","http://arxiv.org/licenses/nonexclusive-distrib/1.0/","  In this proceedings I discuss the general strategy and impact of tuning
Monte-Carlo event generators for physics processes involving top quarks.
Special emphasis is put on disinguishing the different usages of event
generators in the experiments and the subsequent implications on the tuning
process. The current status of determining tune uncertainties is also
discussed.
","[{""version"":""v1"",""created"":""Tue, 15 Jan 2019 16:10:34 GMT""}]","2019-01-16"
"1901.04902","Jiayin Yuan Dr.","Jiang Gong, Jinshui Zhang, Huijuan Lin, Jiayin Yuan","""Cooking carbon in a solid salt"": Synthesis of porous heteroatom-doped
  carbon foams for enhanced organic pollutant degradation under visible light","31 pages, 24 figures","Applied Materials Today, Volume 12, September 2018, Pages 168-176","10.1016/j.apmt.2018.04.008",,"physics.chem-ph","http://arxiv.org/licenses/nonexclusive-distrib/1.0/","  Porous heteroatom-doped carbons are desirable for catalytic reactions due to
their tunable physicochemical properties, low cost and metal-free nature.
Herein, we introduce a facile general bottom-up strategy, so-called ""cooking
carbon in a solid salt"", to prepare hierarchically porous heteroatom-doped
carbon foams by using poly(ionic liquid) as precursor and common inorganic
salts as structural template. The obtained carbon foams bear
micro-/meso-/macropores, large specific surface area and rich nitrogen dopant.
The combination of these favorable features facilitates the catalytic
degradation of aqueous organic pollutants by persulfate under visible light
irradiation, in which they prevail over the state-of-the-art
metal-/carbon-based catalysts.
","[{""version"":""v1"",""created"":""Tue, 15 Jan 2019 16:11:26 GMT""}]","2019-01-16"
"1901.04903","Luigi Berselli C","Luigi C. Berselli, Traian Iliescu, Birgul Koc, Roger Lewandowski","Long-Time Reynolds Averaging of Reduced Order Models for Fluid Flows:
  Preliminary Results","20 pages, 1 figure, 9 tables",,,,"math.AP","http://arxiv.org/licenses/nonexclusive-distrib/1.0/","  We perform a theoretical and numerical investigation of the time-average of
energy exchange among modes of Reduced Order Models (ROMs) of fluid flows. We
are interested in the statistical equilibrium problem, and especially in the
possible forward and backward average transfer of energy among ROM basis
functions (modes). We consider two types of ROM modes: eigenfunctions of the
Stokes operator and Proper Orthogonal Decomposition (POD) modes. We prove
analytical results for both types of ROM modes and we highlight the differences
between them. We also investigate numerically whether the time-average energy
exchange between POD modes is positive. To this end, we utilize the
one-dimensional Burgers equation as a simplified mathematical model, which is
commonly used in ROM tests. The main conclusion of our numerical study is that,
for long enough time intervals, the time-average energy exchange from low index
POD modes to high index POD modes is positive, as predicted by our theoretical
results.
","[{""version"":""v1"",""created"":""Tue, 15 Jan 2019 16:14:39 GMT""}]","2019-01-16"
"1901.04904","Chiao-Peng Hsu","Nicole M. James, Chiao-Peng Hsu, Nicholas D. Spencer, Heinrich M.
  Jaeger, Lucio Isa","Tuning Interparticle Hydrogen Bonding in Shear-Jamming Suspensions:
  Kinetic Effects and Consequences for Tribology and Rheology",,,,,"cond-mat.soft","http://arxiv.org/licenses/nonexclusive-distrib/1.0/","  The shear-jamming of dense suspensions can be strongly affected by
molecular-scale interactions between particles, e.g. by chemically controlling
their propensity for hydrogen bonding. However, hydrogen bonding not only
enhances interparticle friction, a critical parameter for shear jamming, but
also introduces (reversible) adhesion, whose interplay with friction in
shear-jamming systems has so far remained unclear. Here, we present atomic
force microscopy studies to assess interparticle adhesion, its relationship to
friction, and how these attributes are influenced by urea, a molecule that
interferes with hydrogen bonding. We characterize the kinetics of this process
with nuclear magnetic resonance, relating it to the time dependence of the
macroscopic flow behavior with rheological measurements. We find that
time-dependent urea sorption reduces friction and adhesion, causing a shift in
the shear-jamming onset. These results extend our mechanistic understanding of
chemical effects on the nature of shear jamming, promising new avenues for
fundamental studies and applications alike.
","[{""version"":""v1"",""created"":""Tue, 15 Jan 2019 16:15:15 GMT""}]","2019-01-16"
"1901.04905","Anirban Guha","Eyal Heifetz and Anirban Guha","On the normal form of synchronization and resonance between vorticity
  waves in shear flow instability",,"Phys. Rev. E 100, 043105 (2019)","10.1103/PhysRevE.100.043105",,"physics.flu-dyn","http://arxiv.org/licenses/nonexclusive-distrib/1.0/","  A central mechanism of linearised two dimensional shear instability can be
described in terms of a nonlinear, action-at-a-distance, phase-locking
resonance between two vorticity waves which propagate counter to their local
mean flow as well as counter to each other. Here we analyze the prototype of
this interaction as an autonomous, nonlinear dynamical system. The wave
interaction equations can be written in a generalized Hamiltonian action-angle
form. The pseudo-energy serves as the Hamiltonian of the system, the action
coordinates are the contribution of the vorticity waves to the wave-action, and
the angles are the phases of the vorticity waves. The term ""generalized
action-angle"" emphasizes that the action of each wave is generally time
dependent, which allows instability. The synchronization mechanism between the
wave phases depends on the cosine of their relative phase, rather than the sine
as in the Kuramoto model. The unstable normal modes of the linearised dynamics
correspond to the stable fixed points of the dynamical system and vice versa.
Furthermore, the normal form of the wave interaction dynamics reveals a new
type of inhomogeneous bifurcation -- annihilation of a pair of stable and
unstable fixed points yields the emergence of two neutral center fixed points
of opposite circulation.
","[{""version"":""v1"",""created"":""Tue, 15 Jan 2019 16:15:58 GMT""},{""version"":""v2"",""created"":""Tue, 25 Jun 2019 22:22:07 GMT""}]","2019-10-16"
"1901.04906","Matthew Roberts","Matthew I. Roberts","Cover time for branching random walks on regular trees","15 pages. Substantial corrections throughout",,,,"math.PR","http://arxiv.org/licenses/nonexclusive-distrib/1.0/","  Let $T$ be the regular tree in which every vertex has exactly $d\ge 3$
neighbours. Run a branching random walk on $T$, in which at each time step
every particle gives birth to a random number of children with mean $d$ and
finite variance, and each of these children moves independently to a uniformly
chosen neighbour of its parent. We show that, starting with one particle at
some vertex $0$ and conditionally on survival of the process, the time it takes
for every vertex within distance $r$ of $0$ to be hit by a particle of the
branching random walk is almost surely $r + \frac{2}{\log(3/2)}\log\log r +
o(\log\log r)$.
","[{""version"":""v1"",""created"":""Tue, 15 Jan 2019 16:16:58 GMT""},{""version"":""v2"",""created"":""Sun, 17 Nov 2019 22:25:51 GMT""}]","2019-11-19"
"1901.04907","Jiayin Yuan Dr.","Xianjing Zhou, Jens Weber, Jiayin Yuan","Poly(ionic liquid)s: platform for CO2 capture and catalysis","13 pages, 5 figures","Current Opinion in Green and Sustainable Chemistry, Volume 16,
  April 2019, Pages 39-46","10.1016/j.cogsc.2018.11.014",,"physics.chem-ph","http://arxiv.org/licenses/nonexclusive-distrib/1.0/","  Capture and conversion of CO2 are of great importance for
environment-friendly and sustainable development of human society. Poly(ionic
liquid)s (PILs) combine some unique properties of ILs with that of polymers and
are versatile materials for CO2 utilization. In this contribution, we briefly
outline innovative poly(ionic liquid)s emerged over the past few years, such as
polytriazoliums, deep eutectic monomer (DEM) based PILs, and polyurethane PILs.
Additionally, we discuss their advantages and challenges as materials for
Carbon Capture and Storage (CCS), and the fixation of CO2 into useful
materials.
","[{""version"":""v1"",""created"":""Tue, 15 Jan 2019 16:21:20 GMT""}]","2019-01-16"
"1901.04908","Iuliia Kotseruba","John K. Tsotsos, Iuliia Kotseruba, Calden Wloka","Rapid Visual Categorization is not Guided by Early Salience-Based
  Selection","22 pages, 9 figures",,"10.1371/journal.pone.0224306",,"cs.CV q-bio.NC","http://arxiv.org/licenses/nonexclusive-distrib/1.0/","  The current dominant visual processing paradigm in both human and machine
research is the feedforward, layered hierarchy of neural-like processing
elements. Within this paradigm, visual saliency is seen by many to have a
specific role, namely that of early selection. Early selection is thought to
enable very fast visual performance by limiting processing to only the most
salient candidate portions of an image. This strategy has led to a plethora of
saliency algorithms that have indeed improved processing time efficiency in
machine algorithms, which in turn have strengthened the suggestion that human
vision also employs a similar early selection strategy. However, at least one
set of critical tests of this idea has never been performed with respect to the
role of early selection in human vision. How would the best of the current
saliency models perform on the stimuli used by experimentalists who first
provided evidence for this visual processing paradigm? Would the algorithms
really provide correct candidate sub-images to enable fast categorization on
those same images? Do humans really need this early selection for their
impressive performance? Here, we report on a new series of tests of these
questions whose results suggest that it is quite unlikely that such an early
selection process has any role in human rapid visual categorization.
","[{""version"":""v1"",""created"":""Tue, 15 Jan 2019 16:22:24 GMT""},{""version"":""v2"",""created"":""Fri, 20 Dec 2019 14:43:38 GMT""},{""version"":""v3"",""created"":""Thu, 30 Jan 2020 20:58:35 GMT""}]","2020-02-03"
"1901.04910","Brett Helms","Chengyin Fu, Victor Venturi, Zeeshan Ahmad, Andrew W. Ells,
  Venkatasubramanian Viswanathan, Brett A. Helms","Universal Chemomechanical Design Rules for Solid-Ion Conductors to
  Prevent Dendrite Formation in Lithium Metal Batteries",,"Nature Materials, 19, 758-766 (2020)","10.1038/s41563-020-0655-2",,"cond-mat.mtrl-sci","http://arxiv.org/licenses/nonexclusive-distrib/1.0/","  Dendrite formation during electrodeposition while charging lithium metal
batteries compromises their safety. While high shear modulus solid-ion
conductors (SICs) have been prioritized to resolve pressure-driven
instabilities that lead to dendrite propagation and cell shorting, it is
unclear whether these or alternatives are needed to guide uniform lithium
electrodeposition, which is intrinsically density-driven. Here, we show that
SICs can be designed within a universal chemomechanical paradigm to access
either pressure-driven dendrite-blocking or density-driven dendrite-suppressing
properties, but not both. This dichotomy reflects the competing influence of
the SICs mechanical properties and partial molar volume of Li+ relative to
those of the lithium anode on plating outcomes. Within this paradigm, we
explore SICs in a previously unrecognized dendrite-suppressing regime that are
concomitantly soft, as is typical of polymer electrolytes, but feature
atypically low Li+ partial molar volume, more reminiscent of hard ceramics. Li
plating mediated by these SICs is uniform, as revealed using synchrotron hard
x-ray microtomography. As a result, cell cycle-life is extended, even when
assembled with thin Li anodes and high-voltage NMC-622 cathodes, where 20
percent of the Li inventory is reversibly cycled.
","[{""version"":""v1"",""created"":""Tue, 15 Jan 2019 16:23:38 GMT""}]","2020-07-07"
"1901.04911","Yuri Gurevich","Yuri Gurevich","Unconstrained Church-Turing thesis cannot possibly be true",,,,,"cs.LO cs.CL cs.DS math.LO quant-ph","http://arxiv.org/licenses/nonexclusive-distrib/1.0/","  The Church-Turing thesis asserts that if a partial strings-to-strings
function is effectively computable then it is computable by a Turing machine.
  In the 1930s, when Church and Turing worked on their versions of the thesis,
there was a robust notion of algorithm. These traditional algorithms are known
also as classical or sequential. In the original thesis, effectively computable
meant computable by an effective classical algorithm. Based on an earlier
axiomatization of classical algorithms, the original thesis was proven in 2008.
  Since the 1930s, the notion of algorithm has changed dramatically. New
species of algorithms have been and are being introduced. We argue that the
generalization of the original thesis, where effectively computable means
computable by an effective algorithm of any species, cannot possibly be true.
","[{""version"":""v1"",""created"":""Tue, 15 Jan 2019 16:24:07 GMT""}]","2019-01-16"
"1901.04912","Sarah Recchia","S. Recchia, V. H. M. Phan, S. Biswas, S. Gabici","Can a cosmic ray carrot explain the ionization level in diffuse
  molecular clouds?",,,"10.1093/mnras/stz555",,"astro-ph.HE","http://arxiv.org/licenses/nonexclusive-distrib/1.0/","  Low energy cosmic rays are the major ionization agents of molecular clouds.
However, it has been shown that, if the cosmic ray spectrum measured by Voyager
1 is representative of the whole Galaxy, the predicted ionization rate in
diffuse clouds fails to reproduce data by 1-2 orders of magnitude, implying
that an additional source of ionization must exist. One of the solutions
proposed to explain this discrepancy is based on the existence of an unknown
low energy (in the range 1 keV-1 MeV, not probed by Voyager) cosmic ray
component, called carrot when first hypothesized by Reeves and collaborators in
the seventies. Here we investigate the energetic required by such scenario. We
show that the power needed to maintain such low energy component is comparable
of even larger than that needed to explain the entire observed cosmic ray
spectrum. Moreover, if the interstellar turbulent magnetic field has to sustain
a carrot, through second-order Fermi acceleration, the required turbulence
level would be definitely too large compared to the one expected at the scale
resonant with such low energy particles. Our study basically rules out all the
plausible sources of a cosmic ray carrot, thus making such hidden component
unlikely to be an appealing and viable source of ionization in molecular
clouds.
","[{""version"":""v1"",""created"":""Tue, 15 Jan 2019 16:26:22 GMT""},{""version"":""v2"",""created"":""Mon, 4 Mar 2019 15:13:46 GMT""}]","2019-03-05"
