"1910.01938","Kevin Aguyar Brix","Kevin Aguyar Brix and Toke Meier Carlsen","C*-algebras, groupoids and covers of shift spaces","45 pages; Section 3 and Theorem 3.3 improved, other minor changes.
  This is the published version","Trans. Amer. Math. Soc. Ser. B 7 (2020), 134-185","10.1090/btran/53","CPH-SYM-DNRF92","math.OA","http://arxiv.org/licenses/nonexclusive-distrib/1.0/","  To every one-sided shift space $\mathsf{X}$ we associate a cover
$\tilde{\mathsf{X}}$, a groupoid $\mathcal{G}_{\mathsf{X}}$ and a
$\mathrm{C^*}$-algebra $\mathcal{O}_{\mathsf{X}}$. We characterize one-sided
conjugacy, eventual conjugacy and (stabilizer preserving) continuous orbit
equivalence between $\mathsf{X}$ and $\mathsf{Y}$ in terms of isomorphism of
$\mathcal{G}_{\mathsf{X}}$ and $\mathcal{G}_{\mathsf{Y}}$, and diagonal
preserving $^*$-isomorphism of $\mathcal{O}_{\mathsf{X}}$ and
$\mathcal{O}_{\mathsf{Y}}$. We also characterize two-sided conjugacy and flow
equivalence of the associated two-sided shift spaces $\Lambda_{\mathsf{X}}$ and
$\Lambda_{\mathsf{Y}}$ in terms of isomorphism of the stabilized groupoids
$\mathcal{G}_{\mathsf{X}}\times \mathcal{R}$ and
$\mathcal{G}_{\mathsf{Y}}\times \mathcal{R}$, and diagonal preserving
$^*$-isomorphism of the stabilized $\mathrm{C^*}$-algebras
$\mathcal{O}_{\mathsf{X}}\otimes \mathbb{K}$ and
$\mathcal{O}_{\mathsf{Y}}\otimes \mathbb{K}$. Our strategy is to lift relations
on the shift spaces to similar relations on the covers. Restricting to the
class of sofic shifts whose groupoids are effective, we show that it is
possible to recover the continuous orbit equivalence class of $\mathsf{X}$ from
the pair $(\mathcal{O}_{\mathsf{X}}, C(\mathsf{X}))$, and the flow equivalence
class of $\Lambda_{\mathsf{X}}$ from the pair $(\mathcal{O}_{\mathsf{X}}\otimes
\mathbb{K}, C(\mathsf{X})\otimes c_0)$. In particular, continuous orbit
equivalence implies flow equivalence for this class of shift spaces.
","[{""version"":""v1"",""created"":""Fri, 4 Oct 2019 13:09:43 GMT""},{""version"":""v2"",""created"":""Sun, 22 Nov 2020 04:02:35 GMT""}]","2020-12-21"
"1910.01939","Rajat Gupta","Rajat Gupta (on behalf of the CMS Collaboration)","Latest results on Soft QCD and DPS from the CMS experiment","Presented at EDS Blois 2019 Conference, Quy Nhon, Vietnam, June
  23--28, 2019",,,,"hep-ex","http://arxiv.org/licenses/nonexclusive-distrib/1.0/","  We present latest results of soft and small-x QCD measurements with the CMS
experiment, such as minimum bias/underlying event physics, and studies on
forward jet production.
","[{""version"":""v1"",""created"":""Fri, 4 Oct 2019 13:11:34 GMT""}]","2019-10-07"
"1910.01940","Marc Robinson-Rechavi","Marc Robinson-Rechavi","Molecular evolution and gene function","To be published in book ""Phylogenomics"" (Nicolas Galtier, C\'eline
  Scornavacca, Fr\'ed\'eric Delsuc, Eds.)",,,,"q-bio.PE q-bio.GN","http://creativecommons.org/licenses/by/4.0/","  One of the basic questions of phylogenomics is how gene function evolves,
whether among species or inside gene families. In this chapter, we provide a
brief overview of the problems associated with defining gene function in a
manner which allows comparisons which are both large scale and evolutionarily
relevant. The main source of functional data, despite its limitations, is
transcriptomics. Functional data provides information on evolutionary
mechanisms primarily by showing which functional classes of genes evolve under
stronger or weaker purifying or adaptive selection, and on which classes of
mutations (e.g., substitutions or duplications). However, the example of the
""ortholog conjecture"" shows that we are still not at a point where we can
confidently study phylogenomically the evolution of gene function at a precise
scale.
","[{""version"":""v1"",""created"":""Fri, 4 Oct 2019 13:12:53 GMT""},{""version"":""v2"",""created"":""Mon, 7 Oct 2019 07:50:21 GMT""}]","2019-10-08"
"1910.01941","Roberto Peron Dr.","David M. Lucchesi, Massimo Visco, Roberto Peron, Massimo Bassan,
  Giuseppe Pucacco, Carmen Pardini, Luciano Anselmo, Carmelo Magnafico","An improved measurement of the Lense-Thirring precession on the orbits
  of laser-ranged satellites with an accuracy approaching the 1% level",,,,,"gr-qc astro-ph.EP hep-ph","http://arxiv.org/licenses/nonexclusive-distrib/1.0/","  We present a new measurement of the Lense-Thirring effect on the orbits of
the geodetic satellites LAGEOS, LAGEOS II and LARES. This secular precession is
a general relativity effect produced by the gravitomagnetic field of the Earth
generated by its rotation. The effect is a manifestation of spacetime curvature
generated by mass-currents, a peculiarity of Einstein's theory of gravitation.
This measurement stands out, compared to previous measurements in the same
context, for its precision ($\simeq7.4\times10^{-3}$) and accuracy
($\simeq16\times10^{-3}$), i.e. for a reliable and robust evaluation of the
systematic sources of error due to both gravitational and non-gravitational
perturbations. For this new measurement, we have largely exploited the results
of GRACE mission to significantly improve the description of the gravitational
field of the Earth, by also modeling its time dependence. In this way, we
strongly reduced the systematic errors due to the uncertainty in the knowledge
of the Earth even zonal harmonics and, at the same time, avoided a possible
bias of the final result and, consequently, of the precision of the
measurement, linked to a non-reliable handling of the unmodeled and mismodeled
periodic effects.
","[{""version"":""v1"",""created"":""Fri, 4 Oct 2019 13:17:44 GMT""}]","2019-10-07"
"1910.01942","Zhaona Wang","Yaoxing Bian, Xiaoyu Shi, Mengnan Hu and Zhaona Wang","A color-switchable ring-shaped random laser in momentum space",,,,,"physics.optics physics.app-ph","http://arxiv.org/licenses/nonexclusive-distrib/1.0/","  A color-switchable random laser is designed through directly coupling random
laser with a commercial optical fiber. By using a simple approach of
selectively coating the random gain layer on the surface of fiber, the red and
yellow random lasers are respectively achieved with low threshold and good
emission direction due to the guiding role of optical fibers. Moreover, the
unique coupling mechanism leads to the random lasing with ring-shape in
momentum space, indicating an excellent illuminating source for high-quality
imaging with an extremely low speckle noise. More importantly, random lasing
with different colors can be flexible obtained by simply moving the pump
position.
","[{""version"":""v1"",""created"":""Fri, 4 Oct 2019 13:19:15 GMT""}]","2019-10-07"
"1910.01943","M. Swisdak","L. Price, M Swisdak, J. F. Drake, and D. B. Graham","Turbulence and Transport During Guide-Field Reconnection at the
  Magnetopause",,,"10.1029/2019JA027498",,"physics.space-ph physics.plasm-ph","http://arxiv.org/licenses/nonexclusive-distrib/1.0/","  We analyze the development and influence of turbulence in three-dimensional
particle-in-cell simulations of guide-field magnetic reconnection at the
magnetopause with parameters based on observations of an electron diffusion
region by the Magnetospheric Multiscale (MMS) mission. Along the separatrices
the turbulence is a variant of the lower hybrid drift instability (LHDI) that
produces electric field fluctuations with amplitudes much greater than the
reconnection electric field. The turbulence controls the scale length of the
density and current profiles while enabling significant transport across the
magnetopause despite the electrons remaining frozen-in to the magnetic field.
Near the X-line the electrons are not frozen-in and the turbulence, which
differs from the LHDI, makes a significant net contribution to the generalized
Ohm's law through an anomalous viscosity. The characteristics of the turbulence
and associated particle transport are consistent with fluctuation amplitudes in
the MMS observations. However, for this event the simulations suggest that the
MMS spacecraft were not close enough to the core of the electron diffusion
region to identify the region where anomalous viscosity is important.
","[{""version"":""v1"",""created"":""Fri, 4 Oct 2019 13:21:42 GMT""}]","2020-05-06"
"1910.01944","Jaros{\l}aw Buczy\'nski","Weronika Buczy\'nska and Jaros{\l}aw Buczy\'nski","Apolarity, border rank and multigraded Hilbert scheme","37 pages; v2: accepted version, to appear in Duke Mathematical
  Journal",,,,"math.AG","http://arxiv.org/licenses/nonexclusive-distrib/1.0/","  We introduce an elementary method to study the border rank of polynomials and
tensors, analogous to the apolarity lemma. This can be used to describe the
border rank of all cases uniformly, including those very special ones that
resisted a systematic approach. We also define a border rank version of the
variety of sums of powers and analyse its usefulness in studying tensors and
polynomials with large symmetries. In particular, it can be applied to provide
lower bounds for the border rank of some very interesting tensors, such as the
matrix multiplication tensor. We work in a general setting, where the base
variety is not necessarily a Segre or Veronese variety, but an arbitrary smooth
toric projective variety. A critical ingredient of our work is an irreducible
component of a multigraded Hilbert scheme related to the toric variety in
question.
","[{""version"":""v1"",""created"":""Fri, 4 Oct 2019 13:22:33 GMT""},{""version"":""v2"",""created"":""Sat, 7 Nov 2020 17:11:41 GMT""}]","2020-11-10"
"1910.01945","Timothy Clos","Timothy G. Clos","Universality of Automorphisms on the Ball of Bounded Holomorphic
  Functions on the Polydisk","7 pages. Submitted",,"10.1016/j.jmaa.2019.123581",,"math.CV","http://arxiv.org/licenses/nonexclusive-distrib/1.0/","  Given a sequence of automorphisms of the polydisk, we show that the
associated composition semigroup homomorphisms on the ball of bounded
holomorphic functions on the polydisk admit a universal inner function if a
certain condition on the automorphisms are satisfied.
","[{""version"":""v1"",""created"":""Fri, 4 Oct 2019 13:32:42 GMT""}]","2022-04-18"
"1910.01946","Javier Segurado","S. Haouala, S. Lucarini, J. LLorca, J. Segurado","Simulation of the Hall-Petch effect in FCC polycrystals by means of
  strain gradient crystal plasticity and FFT homogenization",,,"10.1016/j.jmps.2019.103755",,"cond-mat.mtrl-sci","http://arxiv.org/licenses/nonexclusive-distrib/1.0/","  The influence of grain size on the flow stress of various FCC polycrystals
(Cu, Al, Ag and Ni) has been analyzed by means of computational homogenization
of a representative volume element of the microstructure using a FFT approach
in combination with a strain gradient crystal plasticity model. The density of
geometrically necessary dislocations resulting from the incompatibility of
plastic deformation among different crystals was obtained from the Nye tensor,
which was efficiently obtained from the curl operation in the Fourier space.
The simulation results were in good agreement with the experimental data for
Cu, Al, Ag and Ni polycrystals for grain sizes > 20 microns and strains < 5%
and provided a physical explanation for the higher strengthening provided by
grain boundaries in Al and Ni, as compared with Cu and Ag. The investigation
demonstrates how the combination of FFT with strain gradient crystal plasticity
can be used to include effect of grain boundaries in the mechanical behavior of
polycrystals using realistic representative volume elements of the
microstructure.
","[{""version"":""v1"",""created"":""Fri, 4 Oct 2019 13:35:03 GMT""}]","2020-01-08"
"1910.01947","Friedrich Knop","Friedrich Knop, Kay Paulus","(Quasi-)Hamiltonian manifolds of cohomogeneity one","v1: 24 pages, this paper replaces arXiv:1712.09036; v2: 26 pages,
  minor changes",,,,"math.SG math.AG math.DG math.RT","http://arxiv.org/licenses/nonexclusive-distrib/1.0/","  We classify compact, connected Hamiltonian and quasi-Hamiltonian manifolds of
cohomogeneity one (which is the same as being multiplicity free of rank one).
Here the group acting is a compact connected Lie group (simply connected in the
quasi-Hamiltonian case). This work is a concretization of the more general
classification (arXiv:1612.03843) of multiplicity free manifolds in the special
case of rank one. As a result we obtain numerous new concrete examples of
multiplicity free quasi-Hamiltonian manifolds or, equivalently, Hamiltonian
loop group actions.
","[{""version"":""v1"",""created"":""Fri, 4 Oct 2019 13:35:07 GMT""},{""version"":""v2"",""created"":""Tue, 23 Mar 2021 14:08:13 GMT""}]","2021-03-24"
"1910.01948","Ananthanarayanan Chockalingam","Bharath Shamasundar and A. Chockalingam","A DNN Architecture for the Detection of Generalized Spatial Modulation
  Signals","Accepted in IEEE Communications Letters",,,,"cs.IT eess.SP math.IT","http://arxiv.org/licenses/nonexclusive-distrib/1.0/","  In this letter, we consider the problem of signal detection in generalized
spatial modulation (GSM) using deep neural networks (DNN). We propose a novel
modularized DNN architecture that uses small sub-DNNs to detect the active
antennas and complex modulation symbols, instead of using a single large DNN to
jointly detect the active antennas and modulation symbols. The main idea is
that using small sub-DNNs instead of a single large DNN reduces the required
size of the NN and hence requires learning lesser number of parameters. Under
the assumption of i.i.d Gaussian noise, the proposed DNN detector achieves a
performance very close to that of the maximum likelihood detector. We also
analyze the performance of the proposed detector under two practical
conditions: i) correlated noise across receive antennas and ii) noise
distribution deviating from the standard Gaussian model. The proposed DNN-based
detector learns the deviations from the standard model and achieves superior
performance compared to that of the conventional maximum likelihood detector.
","[{""version"":""v1"",""created"":""Fri, 4 Oct 2019 13:37:54 GMT""},{""version"":""v2"",""created"":""Sat, 22 Aug 2020 12:55:55 GMT""}]","2020-08-25"
"1910.01949","Julius Kirkegaard","Julius B. Kirkegaard, Bjarke F. Nielsen, Ala Trusina, and Kim Sneppen","Self-assembly, Buckling & Density-Invariant Growth of Three-dimensional
  Vascular Networks",,,,,"q-bio.TO","http://arxiv.org/licenses/nonexclusive-distrib/1.0/","  The experimental actualisation of organoids modelling organs from brains to
pancreases has revealed that much of the diverse morphologies of organs are
emergent properties of simple intercellular ""rules"" and not the result of
top-down orchestration. In contrast to other organs, the initial plexus of the
vascular system is formed by aggregation of cells in the process known as
vasculogenesis. Here we study this self-assembling process of blood vessels in
three dimensions through a set of simple rules that align intercellular
apical-basal and planar cell polarity. We demonstrate that a fully connected
network of tubes emerges above a critical initial density of cells. Through
planar cell polarity our model demonstrates convergent extension, and this
polarity furthermore allows for both morphology-maintaining growth and
growth-induced buckling. We compare this buckling to the special vasculature of
Islets of Langerhans in the pancreas and suggest that the mechanism behind the
vascular density-maintaining growth of these islets could be the result of
growth-induced buckling.
","[{""version"":""v1"",""created"":""Fri, 4 Oct 2019 13:40:24 GMT""}]","2019-10-07"
"1910.01950","James Widdicombe","James Y. Widdicombe, Thomas Helfer, Eugene A. Lim","Black hole formation in relativistic Oscillaton collisions",,,"10.1088/1475-7516/2020/01/027",,"astro-ph.CO gr-qc hep-th","http://arxiv.org/licenses/nonexclusive-distrib/1.0/","  We investigate the physics of black hole formation from the head-on
collisions of boosted equal mass Oscillatons (OS) in full numerical relativity,
for both the cases where the OS have equal phases or are maximally off-phase
(anti-phase). While unboosted OS collisions will form a BH as long as their
initial compactness $\mathcal{C}\equiv GM/R$ is above a numerically determined
critical value $\mathcal{C}>0.035$, we find that imparting a small initial
boost counter-intuitively \emph{prevents} the formation of black holes even if
$\mathcal{C}> 0.035$. If the boost is further increased, at very high boosts
$\gamma>1/12\mathcal{C}$, BH formation occurs as predicted by the hoop
conjecture. These two limits combine to form a ""stability band"" where
collisions result in either the OS ""passing through"" (equal phase) or ""bouncing
back"" (anti-phase), with a critical point occurring around ${\cal C}\approx
0.07$. We argue that the existence of this stability band can be explained by
the competition between the free fall and the interaction timescales of the
collision.
","[{""version"":""v1"",""created"":""Fri, 4 Oct 2019 13:45:43 GMT""}]","2020-01-15"
"1910.01951","Marco Lucamarini","M. Minder, M. Pittaluga, G. L. Roberts, M. Lucamarini, J. F. Dynes, Z.
  L. Yuan, A. J. Shields","Experimental quantum key distribution beyond the repeaterless secret key
  capacity","12 pages, 8 figures, 2 tables. Supplementary information included","Nature Photonics 13, 334-338 (2019)","10.1038/s41566-019-0377-7",,"quant-ph physics.app-ph","http://arxiv.org/licenses/nonexclusive-distrib/1.0/","  Quantum communications promise to revolutionise the way information is
exchanged and protected. Unlike their classical counterpart, they are based on
dim optical pulses that cannot be amplified by conventional optical repeaters.
Consequently they are heavily impaired by propagation channel losses, which
confine their transmission rate and range below a theoretical limit known as
repeaterless secret key capacity. Overcoming this limit with today's technology
was believed to be impossible until the recent proposal of a scheme that uses
phase-coherent optical signals and an auxiliary measuring station to distribute
quantum information. Here we experimentally demonstrate such a scheme for the
first time and over significant channel losses, in excess of 90 dB. In the high
loss regime, the resulting secure key rate exceeds the repeaterless secret key
capacity, a result never achieved before. This represents a major step in
promoting quantum communications as a dependable resource in today's world.
","[{""version"":""v1"",""created"":""Fri, 4 Oct 2019 13:53:50 GMT""}]","2019-10-07"
"1910.01952","Karsten Kruse","Karsten Kruse","Extension of vector-valued functions and weak-strong principles for
  differentiable functions of finite order",,"Annals of Functional Analysis 13 (2022), 1-26","10.1007/s43034-021-00154-5",,"math.FA","http://arxiv.org/licenses/nonexclusive-distrib/1.0/","  In this paper we study the problem of extending functions with values in a
locally convex Hausdorff space $E$ over a field $\mathbb{K}$, which have weak
extensions in a weighted Banach space $\mathcal{F}\nu(\Omega,\mathbb{K})$ of
scalar-valued functions on a set $\Omega$, to functions in a vector-valued
counterpart $\mathcal{F}\nu(\Omega,E)$ of $\mathcal{F}\nu(\Omega,\mathbb{K})$.
Our findings rely on a description of vector-valued functions as linear
continuous operators and extend results of Frerick, Jord\'{a} and Wengenroth.
As an application we derive weak-strong principles for continuously partially
differentiable functions of finite order, vector-valued versions of Blaschke's
convergence theorem for several spaces and Wolff type descriptions of dual
spaces.
","[{""version"":""v1"",""created"":""Fri, 4 Oct 2019 13:54:00 GMT""},{""version"":""v2"",""created"":""Sun, 25 Apr 2021 12:16:34 GMT""},{""version"":""v3"",""created"":""Thu, 7 Oct 2021 11:27:19 GMT""},{""version"":""v4"",""created"":""Fri, 5 Nov 2021 23:57:53 GMT""},{""version"":""v5"",""created"":""Mon, 2 Jan 2023 15:26:03 GMT""}]","2023-01-03"
"1910.01953","Michael Moshe","Yohai Bar-Sinai, Gabriele Librandi, Katia Bertoldi and Michael Moshe","Geometric charges and nonlinear elasticity of soft metamaterials","12 pages, 5 figures",,"10.1073/pnas.1920237117",,"cond-mat.soft","http://arxiv.org/licenses/nonexclusive-distrib/1.0/","  Problems of flexible mechanical metamaterials, and highly deformable porous
solids in general, are rich and complex due to nonlinear mechanics and
nontrivial geometrical effects. While numeric approaches are successful,
analytic tools and conceptual frameworks are largely lacking. Using an analogy
with electrostatics, and building on recent developments in a nonlinear
geometric formulation of elasticity, we develop a formalism that maps the
elastic problem into that of nonlinear interaction of elastic charges. This
approach offers an intuitive conceptual framework, qualitatively explaining the
linear response, the onset of mechanical instability and aspects of the
post-instability state. Apart from intuition, the formalism also quantitatively
reproduces full numeric simulations of several prototypical structures.
Possible applications of the tools developed in this work for the study of
ordered and disordered porous mechanical metamaterials are discussed.
","[{""version"":""v1"",""created"":""Fri, 4 Oct 2019 13:58:26 GMT""}]","2022-06-08"
"1910.01954","Douglas Duarte Novaes Ph.D","Douglas D. Novaes, Tere M. Seara, Marco A. Teixeira, and Iris O. Zeli","Study of periodic orbits in periodic perturbations of planar reversible
  Filippov systems having a two-fold cycle",,"SIAM J. Appl. Dyn. Syst., 19(2), 2020, 1343-1371","10.1137/19M1289959",,"math.DS","http://arxiv.org/licenses/nonexclusive-distrib/1.0/","  We study the existence of periodic solutions in a class of planar Filippov
systems obtained from non-autonomous periodic perturbations of reversible
piecewise smooth differential systems. It is assumed that the unperturbed
system presents a simple two-fold cycle, which is characterized by a closed
trajectory connecting a visible two-fold singularity to itself. It is shown
that under certain generic conditions the perturbed system has sliding and
crossing periodic solutions. In order to get our results, Melnikov's ideas were
applied together with tools from the geometric singular perturbation theory.
Finally, a study of a perturbed piecewise Hamiltonian model is performed.
","[{""version"":""v1"",""created"":""Fri, 4 Oct 2019 13:59:10 GMT""},{""version"":""v2"",""created"":""Fri, 12 Jun 2020 10:59:01 GMT""}]","2020-06-15"
"1910.01955","Manolis Tsakiris","Aldo Conca, Manolis C. Tsakiris","Resolution of ideals associated to subspace arrangements","15 pages, added a new section describing an irredundant primary
  decomposition of $J$","Alg. Number Th. 16 (2022) 1121-1140","10.2140/ant.2022.16.1121",,"math.AC math.CO","http://arxiv.org/licenses/nonexclusive-distrib/1.0/","  Let $I_1,\dots,I_n$ be ideals generated by linear forms in a polynomial ring
over an infinite field and let $J = I_1 \cdots I_n$. We describe a minimal free
resolution of $J$ and show that it is supported on a polymatroid obtained from
the underlying representable polymatroid by means of the so-called Dilworth
truncation. Formulas for the projective dimension and Betti numbers are given
in terms of the polymatroid as well as a characterization of the associated
primes. Along the way we show that $J$ has linear quotients. In fact, we do
this for a large class of ideals $J_P$, where $P$ is a certain poset ideal
associated to the underlying subspace arrangement.
","[{""version"":""v1"",""created"":""Fri, 4 Oct 2019 13:59:14 GMT""},{""version"":""v2"",""created"":""Sun, 22 Nov 2020 10:17:45 GMT""}]","2022-08-24"
"1910.01956","Johan Christensen","Penglin Gao and Daniel Torrent and Francisco Cevera and Pablo San-Jose
  and Jose Sanchez-Dehesa and Johan Christensen","Majorana-like zero modes in Kekul\'e distorted sonic lattices",,"Phys. Rev. Lett. 123, 196601 (2019)","10.1103/PhysRevLett.123.196601",,"cond-mat.mes-hall cond-mat.mtrl-sci physics.app-ph","http://arxiv.org/licenses/nonexclusive-distrib/1.0/","  Topological phases have recently been realised in bosonic systems. The
associated boundary modes between regions of distinct topology have been used
to demonstrate robust waveguiding, protected from defects by the topology of
the surrounding bulk. A related type of topologically protected state that is
not propagating but is bound to a defect has not been demonstrated to date in a
bosonic setting. Here we demonstrate numerically and experimentally that an
acoustic mode can be topologically bound to a vortex fabricated in a
two-dimensional, Kekul\'e-distorted triangular acoustic lattice. Such lattice
realises an acoustic analogue of the Jackiw-Rossi mechanism that topologically
binds a bound state in a p-wave superconductor vortex. The acoustic bound state
is thus a bosonic \edit{\emph{analogue}} of Majorana bound state, \edit{where
the two valleys replace particle and hole components}. We numerically show that
it is topologically protected against arbitrary symmetry-preserving local
perturbations, and remains pinned to the Dirac frequency of the unperturbed
lattice regardless of parameter variations. We demonstrate our prediction
experimentally by 3D printing the vortex pattern in a plastic matrix and
measuring the spectrum of the acoustic response of the device. Despite
viscothermal losses, the measured topological resonance remains robust, with
its frequency closely matching our simulations.
","[{""version"":""v1"",""created"":""Fri, 4 Oct 2019 14:02:08 GMT""}]","2019-11-07"
