"1910.01664","Changyun Yoo","Changyun Yoo, Mengchen Huang, Jonathan Kawamura, Kenneth West, Loren
  Pfeiffer, Boris Karasik, Mark Sherwin","Demonstration of a Tunable Antenna-Coupled Intersubband Terahertz
  (TACIT) Mixer","20 pages; 9 figures; the manuscript has been submitted for the
  Applied Physics Letters. This submission includes supplementary material",,"10.1063/1.5129801",,"physics.ins-det","http://arxiv.org/licenses/nonexclusive-distrib/1.0/","  A fast, voltage-tunable terahertz mixer based on the intersubband transition
of a high-mobility 2-dimensional electron gas (2DEG) has been fabricated from a
single 40 nm GaAs-AlGaAs square quantum well heterostructure. The device is
called a Tunable Antenna-Coupled Intersubband Terahertz (TACIT) mixer, and
shows tunability of the detection frequency from 2.52 THz to 3.11 THz with
small (< 1 V) top gate and back gate voltage biases. Mixing at 2.52 THz has
been observed at 60 K with a -3dB intermediate frequency (IF) bandwidth
exceeding 6 GHz.
","[{""version"":""v1"",""created"":""Thu, 3 Oct 2019 18:07:44 GMT""}]","2020-01-29"
"1910.01665","Jizong Peng","Jizong Peng, Christian Desrosiers, Marco Pedersoli","Information based Deep Clustering: An experimental study",,,,,"cs.CV","http://arxiv.org/licenses/nonexclusive-distrib/1.0/","  Recently, two methods have shown outstanding performance for clustering
images and jointly learning the feature representation. The first, called
Information Maximiz-ing Self-Augmented Training (IMSAT), maximizes the mutual
information between input and clusters while using a regularization term based
on virtual adversarial examples. The second, named Invariant Information
Clustering (IIC), maximizes the mutual information between the clustering of a
sample and its geometrically transformed version. These methods use mutual
information in distinct ways and leverage different kinds of transformations.
This work proposes a comprehensive analysis of transformation and losses for
deep clustering, where we compare numerous combinations of these two components
and evaluate how they interact with one another. Results suggest that mutual
information between a sample and its transformed representation leads to
state-of-the-art performance for deep clustering, especially when used jointly
with geometrical and adversarial transformations.
","[{""version"":""v1"",""created"":""Thu, 3 Oct 2019 18:07:57 GMT""},{""version"":""v2"",""created"":""Wed, 11 Dec 2019 01:14:25 GMT""}]","2019-12-12"
"1910.01666","Rushil Anirudh","Rushil Anirudh, Jayaraman J. Thiagarajan, Shusen Liu, Peer-Timo
  Bremer, Brian K. Spears","Exploring Generative Physics Models with Scientific Priors in Inertial
  Confinement Fusion","Machine Learning for Physical Sciences Workshop at NeurIPS 2019",,,,"physics.comp-ph cs.CV cs.LG stat.ML","http://arxiv.org/licenses/nonexclusive-distrib/1.0/","  There is significant interest in using modern neural networks for scientific
applications due to their effectiveness in modeling highly complex, non-linear
problems in a data-driven fashion. However, a common challenge is to verify the
scientific plausibility or validity of outputs predicted by a neural network.
This work advocates the use of known scientific constraints as a lens into
evaluating, exploring, and understanding such predictions for the problem of
inertial confinement fusion.
","[{""version"":""v1"",""created"":""Thu, 3 Oct 2019 18:08:31 GMT""}]","2019-10-07"
"1910.01667","Kevin Murray Mr.","K. Murray, J. Dilling, R. Gornea, Y. Ito, T. Koffas, A.A. Kwiatkowski,
  Y. Lan, M.P. Reiter, V. Varentsov, T. Brunner","Design of a Multiple-Reflection Time-of-Flight Mass-Spectrometer for
  Barium-tagging",,"Hyperfine Interactions (2019) 240.1 : 97","10.1007/s10751-019-1632-5",,"physics.ins-det nucl-ex","http://arxiv.org/licenses/nonexclusive-distrib/1.0/","  The search for neutrinoless double beta decay requires increasingly advanced
methods of background reduction. A bold approach to solving this problem, in
experiments using Xe-136, is to extract and identify the daughter Ba-136 ion
produced by double beta decay. Tagging events in this manner allows for a
virtually background-free verification of double beta decay signals. Various
approaches are being pursued by the nEXO collaboration to achieve Ba-tagging. A
Multi-Reflection Time-of-Flight Mass Spectrometer (MR TOF) has been designed
and optimized as one of the ion-identification methods, where it will
investigate the ion-extraction efficiency, as well as provide further
identification of the Ba isotope. The envisioned mode of operation allows the
MR TOF to achieve a quickly adjustable mass-range and resolution, with
simulations suggesting that a mass-resolving power of 140,000 is within reach.
This work will discuss the MR TOF design and the methods employed to simulate
and optimize it.
","[{""version"":""v1"",""created"":""Thu, 3 Oct 2019 18:08:48 GMT""}]","2019-10-07"
"1910.01668","Marco Villagran","Marco A. Villagran, P.F. Vel\'azquez, D.O. G\'omez, E.B. Giacani","Evolving Supernova Remnants in Multiphase Interstellar Media",,,"10.1093/mnras/stz2811",,"astro-ph.GA astro-ph.HE astro-ph.SR","http://arxiv.org/licenses/nonexclusive-distrib/1.0/","  We performed three-dimensional magnetohydrodynamic simulations to study the
evolution of a supernova remnant (SNR) in a turbulent neutral atomic
interstellar medium. The media used as background shares characteristics with
the Solar neighbourhood and the SNR has mass and energy similar to those of a
Type Ia object. Our initial conditions consist of dense clouds in a diluted
medium, with the main difference between simulations being the average
magnitude of the magnetic field. We measured amplifications of the magnetic
energy of up to 34$\%$ and we generated synthetic maps that illustrate how the
same object can show different apparent geometries and physical properties when
observed through different lines of sight.
","[{""version"":""v1"",""created"":""Thu, 3 Oct 2019 18:12:27 GMT""}]","2019-10-16"
"1910.01669","Jaron Kent-Dobias","Jaron Kent-Dobias, Michael Matty, Brad Ramshaw","Elastic properties of hidden order in URu$_{\text2}$Si$_{\text2}$ are
  reproduced by a staggered nematic",,"Phys. Rev. B 102, 075129 (2020)","10.1103/PhysRevB.102.075129",,"cond-mat.str-el cond-mat.stat-mech","http://arxiv.org/licenses/nonexclusive-distrib/1.0/","  We develop a phenomenological mean field theory describing the hidden order
phase in URu$_{\text2}$Si$_{\text2}$ as a nematic of the $\text B_{\text{1g}}$
representation staggered along the $c$-axis. Several experimental features are
reproduced by this theory: the topology of the temperature--pressure phase
diagram, the response of the elastic modulus $(C_{11}-C_{12})/2$ above the
transition at ambient pressure, and orthorhombic symmetry breaking in the
high-pressure antiferromagnetic phase. In this scenario, hidden order is
characterized by broken rotational symmetry that is modulated along the
$c$-axis, the primary order of the high-pressure phase is an unmodulated
nematic, and the triple point joining those two phases with the
high-temperature paramagnetic phase is a Lifshitz point.
","[{""version"":""v1"",""created"":""Thu, 3 Oct 2019 18:13:00 GMT""},{""version"":""v2"",""created"":""Tue, 21 Jan 2020 21:57:38 GMT""},{""version"":""v3"",""created"":""Fri, 3 Jul 2020 10:43:10 GMT""}]","2020-08-26"
"1910.01670","Marco Salviato","Yao Qiao, Marco Salviato","Micro-Computed Tomography Analysis of Damage in Notched Composite
  Laminates Under Multi-Axial Fatigue","21 pages including cover page, 15 figures",,,"19-10/04E","physics.app-ph","http://arxiv.org/licenses/nonexclusive-distrib/1.0/","  The broad application of polymer composites in engineering demands the deep
understanding of the main damage mechanisms under realistic loading conditions
and the development of proper physics-based models. Towards this goal, this
study presents a comprehensive characterization of the main damage mechanisms
in a selection of notched composite structures under multiaxial fatigue
loading. Thanks to a synergistic combination of X-ray micro-computed tomography
($\mu$-CT) and Digital Image Correlation (DIC), the main failure modes are
identified while the crack volume associated to each mechanism is
characterized. This study provides unprecedented quantitative data for the
development and validation of computational models to capture the fatigue
behavior of polymer composite structures.
","[{""version"":""v1"",""created"":""Thu, 3 Oct 2019 18:13:00 GMT""}]","2019-10-07"
"1910.01671","Matthew Trager","Matthew Trager, Kathl\'en Kohn, Joan Bruna","Pure and Spurious Critical Points: a Geometric Study of Linear Networks",,,,,"cs.LG math.AG stat.ML","http://arxiv.org/licenses/nonexclusive-distrib/1.0/","  The critical locus of the loss function of a neural network is determined by
the geometry of the functional space and by the parameterization of this space
by the network's weights. We introduce a natural distinction between pure
critical points, which only depend on the functional space, and spurious
critical points, which arise from the parameterization. We apply this
perspective to revisit and extend the literature on the loss function of linear
neural networks. For this type of network, the functional space is either the
set of all linear maps from input to output space, or a determinantal variety,
i.e., a set of linear maps with bounded rank. We use geometric properties of
determinantal varieties to derive new results on the landscape of linear
networks with different loss functions and different parameterizations. Our
analysis clearly illustrates that the absence of ""bad"" local minima in the loss
landscape of linear networks is due to two distinct phenomena that apply in
different settings: it is true for arbitrary smooth convex losses in the case
of architectures that can express all linear maps (""filling architectures"") but
it holds only for the quadratic loss when the functional space is a
determinantal variety (""non-filling architectures""). Without any assumption on
the architecture, smooth convex losses may lead to landscapes with many bad
minima.
","[{""version"":""v1"",""created"":""Thu, 3 Oct 2019 18:22:30 GMT""},{""version"":""v2"",""created"":""Fri, 3 Apr 2020 02:46:46 GMT""}]","2020-04-06"
"1910.01672","Peter Feller","Peter Feller and JungHwan Park","Genus one cobordisms between torus knots","20 pages, 12 figures. V3: Minor corrections and implementation of
  referee's recommendations. This version has been accepted for publication by
  IMRN",,"10.1093/imrn/rnaa027",,"math.GT","http://arxiv.org/licenses/nonexclusive-distrib/1.0/","  We determine the pairs of torus knots that have a genus one cobordism between
them, with one notable exception. This is done by combining obstructions using
$\nu^+$ from the Heegaard Floer knot complex and explicit constructions of
cobordisms. As an application, we determine the pairs of torus knots related by
a single crossing change. Also, we determine the pairs of Thurston-Bennequin
number maximizing Legendrian torus knots that have a genus one exact Lagrangian
cobordism, with one exception.
","[{""version"":""v1"",""created"":""Thu, 3 Oct 2019 18:23:04 GMT""},{""version"":""v2"",""created"":""Wed, 23 Oct 2019 17:02:36 GMT""},{""version"":""v3"",""created"":""Fri, 24 Jan 2020 18:59:17 GMT""}]","2020-06-25"
"1910.01673","Giacomo Rosati","Giovanni Amelino-Camelia, Stefano Bianco, Giacomo Rosati","Planck-scale-deformed relativistic symmetries and diffeomorphisms in
  momentum space","Improved version after refereeing process for journal publication","Phys. Rev. D 101, 026018 (2020)","10.1103/PhysRevD.101.026018",,"gr-qc hep-th","http://arxiv.org/licenses/nonexclusive-distrib/1.0/","  We study the implications of a change of coordinatization of momentum space
for theories with curved momentum space. We of course find that after a passive
diffeomorphism the theory yields the same physical predictions, as one would
expect considering that a simple reparametrization should not change physics.
However, it appears that general momentum-space covariance (invariance under
active diffeomorphisms of momentum space) cannot be enforced, and within a
given set of prescriptions on how the theory should encode momentum-space
metric and affine connection the physical predictions do depend on the momentum
space background. These conclusions find support in some general arguments and
in our quantitative analysis of a much-studied toy model with
maximally-symmetric (curved) momentum space.
","[{""version"":""v1"",""created"":""Thu, 3 Oct 2019 18:24:54 GMT""},{""version"":""v2"",""created"":""Tue, 15 Oct 2019 13:34:35 GMT""},{""version"":""v3"",""created"":""Fri, 7 Feb 2020 13:11:12 GMT""}]","2020-02-10"
"1910.01674","Matthew Mastroeni","Paolo Mantero and Matthew Mastroeni","Betti numbers of Koszul algebras defined by four quadrics",,,,,"math.AC","http://arxiv.org/licenses/nonexclusive-distrib/1.0/","  Let $I$ be an ideal generated by quadrics in a standard graded polynomial
ring $S$ over a field. A question of Avramov, Conca, and Iyengar asks whether
the Betti numbers of $R = S/I$ over $S$ can be bounded above by binomial
coefficients on the minimal number of generators of $I$ if $R$ is Koszul. This
question has been answered affirmatively for Koszul algebras defined by three
quadrics and Koszul almost complete intersections with any number of
generators. We give a strong affirmative answer to the above question in the
case of four quadrics by completely determining the Betti tables of height two
ideals of four quadrics defining Koszul algebras.
","[{""version"":""v1"",""created"":""Thu, 3 Oct 2019 18:26:44 GMT""},{""version"":""v2"",""created"":""Mon, 8 Jun 2020 17:15:44 GMT""}]","2020-06-09"
"1910.01675","Hery Randriamaro","Hery Randriamaro","Random Walk of a Cat in a Building","10 pages",,,,"math.CO","http://arxiv.org/licenses/nonexclusive-distrib/1.0/","  One usually thinks of a cat moving from one room to another in an apartment
as random walk model. Imagine now that it also has the possibility to go from
one apartment to another by crossing some corridors. That yields a new
probabilistic model for which each corridor connects the entrance rooms of
several apartments. This article shows that the determinants of the stochastic
and the exponential distance matrices of that model have a nice factorization.
Two examples involving indirectly acyclic digraphs and hyperplane arrangements
are provided.
","[{""version"":""v1"",""created"":""Thu, 3 Oct 2019 18:28:36 GMT""},{""version"":""v2"",""created"":""Thu, 9 Apr 2020 18:05:25 GMT""},{""version"":""v3"",""created"":""Wed, 17 Jun 2020 13:56:29 GMT""},{""version"":""v4"",""created"":""Fri, 31 Jul 2020 16:56:07 GMT""},{""version"":""v5"",""created"":""Wed, 5 Aug 2020 08:11:02 GMT""}]","2020-08-06"
"1910.01676","Jonathan Paprocki","Jonathan Paprocki","Quantum torus methods for Kauffman bracket skein modules","PhD thesis. 167 pages, 35 figures",,,,"math.GT math.QA quant-ph","http://arxiv.org/licenses/nonexclusive-distrib/1.0/","  We investigate aspects of Kauffman bracket skein algebras of surfaces and
modules of 3-manifolds using quantum torus methods. These methods come in two
flavors: embedding the skein algebra into a quantum torus related to quantum
Teichmuller space, or filtering the algebra and obtaining an associated graded
algebra that is a monomial subalgebra of a quantum torus. We utilize the former
method to generalize the Chebyshev homomorphism of Bonahon and Wong between
skein algebras of surfaces to a Chebyshev-Frobenius homomorphism between skein
modules of marked 3-manifolds, in the course of which we define a surgery
theory, and whose image we show is either transparent or skew-transparent. The
latter method is used to show that skein algebras of surfaces are maximal
orders, which implies a refined unicity theorem, shows that
$SL_2\mathbb{C}$-character varieties are normal, and suggests a conjecture on
how this result may be utilized for topological quantum compiling.
","[{""version"":""v1"",""created"":""Thu, 3 Oct 2019 18:33:44 GMT""}]","2019-10-07"
"1910.01677","Mikhail Kapranov","Mikhail Kapranov, Vadim Schechtman","Perverse sheaves over real hyperplane arrangements II","27 pages, 1 figure",,,,"math.AT","http://arxiv.org/licenses/nonexclusive-distrib/1.0/","  Let H be an arrangement of hyperplanes in R^n and Perv(C^n,H) be the category
of perverse sheaves on C^n smooth with respect to the stratification given by
complexified flats of H. We give a description of Perv(C^n,H) in terms of
""matrix diagrams"", i.e., diagrams formed by vector spaces E_{AB} labelled by
pairs A,B of real faces of H (of all dimensions) or, equivalently, by the cells
iA+B of a natural cell decomposition of C^n. A matrix diagram is formally
similar to a datum describing a constructible (non-perverse) sheaf but with the
direction of one half of the arrows reversed.
","[{""version"":""v1"",""created"":""Thu, 3 Oct 2019 18:37:50 GMT""}]","2019-10-07"
"1910.01678","Curtis McCord","Leticia Duboc, Curtis McCord, Christoph Becker, Syed Ishtiaque Ahmed","Critical Requirements Engineering in Practice","1 figure, submitted to and accepted for publication in IEEESW",,,,"cs.SE","http://arxiv.org/licenses/nonexclusive-distrib/1.0/","  The design of software systems inevitably enacts normative boundaries around
the site of intervention. These boundaries are, in part, a reflection of the
values, ethics, power, and politics of the situation and the process of design
itself. This paper argues that Requirements Engineering (RE) require more
robust frameworks and techniques to navigate the values implicit in systems
design work. To this end, we present the findings from a case of action
research where we employed Critical Systems Heuristics (CSH), a framework from
Critical Systems Thinking (CST) during requirements gathering for Homesound, a
system to safeguard elderly people living alone while protecting their
autonomy. We use categories from CSH to inform expert interviews and
reflection, showing how CSH can be simply combined with RE techniques (such as
the Volere template) to explore and reveal the value-judgements underlying
requirements.
","[{""version"":""v1"",""created"":""Thu, 3 Oct 2019 18:38:36 GMT""}]","2019-10-07"
"1910.01679","Gururaj Wagle","Gururaj A. Wagle, Alak Ray, Ajay Dev and Adarsh Raghu","Type IIP Supernova Progenitors and their explodability I: Convective
  Overshoot, Blue Loops and Surface Composition","17 pages, 8 Figures, 2 Tables, Accepted for publication in The
  Astrophysical Journal","2019, ApJ, 886, 27","10.3847/1538-4357/ab4a19",,"astro-ph.SR astro-ph.HE","http://arxiv.org/licenses/nonexclusive-distrib/1.0/","  We present the evolution of massive star progenitors of supernovae of type
IIP. We take the example of the nearby and well-studied SN 2013ej. We explore
how convective overshoot affects the stellar structure, surface abundances, and
effective temperature of massive stars, using the Modules for Experiments in
Stellar Astrophysics (MESA). In particular models with moderate overshoot ($f$
= 0.02 to 0.031) show the presence of blue loops in the Hertzsprung-Russell
diagram with a red to blue [$log_{10}(T_{eff}/\rm K)$ from $< 3.6$ to $> 4.0$]
excursion and transition back to red, during core helium burning phase. Models
with overshoot outside this range of $f$ values kept the star in the red
supergiant state throughout the post helium ignition phases. The surface CNO
abundance shows enrichment post-main-sequence and again around the time when
helium is exhausted in core. These evolutionary changes in surface CNO
abundance are indistinguishable in the currently available observations due to
large observational uncertainties. However, these observations may distinguish
between the ratios of surface nitrogen to oxygen at different evolutionary
stages of the star. We also compare the effects of convective overshoot on
various parameters related to likelihood of explosion of a star as opposed to
collapse to a black hole. These parameters are the compactness parameter,
M$_4$, and $\mu_4$. Combination $\mu_4 \times $M$_4$, and $\mu_4$ have similar
variation with $f$ and both peak out at $f$ = 0.032. We find that all of our 13
M$_{\odot}$ models are likely to explode.
","[{""version"":""v1"",""created"":""Thu, 3 Oct 2019 18:39:13 GMT""}]","2019-12-02"
"1910.01680","Blake Moore","Blake Moore and Nicol\'as Yunes","Data Analysis Implications of Moderately Eccentric Gravitational Waves","15 pages, 12 figures",,"10.1088/1361-6382/ab7963",,"gr-qc","http://arxiv.org/licenses/nonexclusive-distrib/1.0/","  While the expectation is that the majority of gravitational wave events
observable by ground-based detectors will be emitted by compact binaries in
quasi-circular orbits, the growing number of detections suggests the
possibility of detecting waves from binaries with non-negligible orbital
eccentricity in the near future. Several gravitational wave models incorporate
the effects of small orbital eccentricities ($e \lesssim 0.2$), but these
models may not be sufficient to analyze waves from systems with moderate
eccentricity. We recently developed a gravitational wave model that faithfully
accounts for eccentric corrections in the moderate eccentricity regime ($e
\lesssim 0.8$ for certain source masses) at 3rd post-Newtonian order. Here we
consider the data analysis implications of this particular waveform model by
producing and analyzing posteriors via Markov Chain Monte Carlo methods. We
find that the accuracy to which eccentricity and source masses can be measured
can increase by 2 orders of magnitude with increasing eccentricity of the
signal. We also find that signals with low eccentricity can be confidently
identified as eccentric as soon as their eccentricity exceeds 0.008 (0.05) for
low (high) mass systems, suggesting eccentric detections are likely to come
first from low-mass systems. We complete our analysis by investigating the
systematic (mismodeling) error inherent in our post-Newtonian model, finding
that for signals with a signal-to-noise ratio of 15, the systematic error is
below the statistical error for eccentricities as high as 0.8 (0.5) for low
(high) mass systems. We also investigate the systematic error that arises from
using a model that neglects eccentricity when the signal is truly eccentric,
finding that the systematic error exceeds the statistical error in mass for
eccentricities as small as 0.02.
","[{""version"":""v1"",""created"":""Thu, 3 Oct 2019 18:46:39 GMT""}]","2020-12-02"
"1910.01681","Oleg Shipitko","Mikhail O. Chekanov, Oleg S. Shipitko, Egor I. Ershov","1-point RANSAC for Circular Motion Estimation in Computed Tomography
  (CT)",,,,,"cs.CV","http://arxiv.org/licenses/nonexclusive-distrib/1.0/","  This paper proposes a RANSAC-based algorithm for determining the axial
rotation angle of an object from a pair of its tomographic projections. An
equation is derived for calculating the rotation angle using one correct
keypoints correspondence of two tomographic projections. The proposed algorithm
consists of the following steps: keypoints detection and matching, rotation
angle estimation for each correspondence, outliers filtering with the RANSAC
algorithm, finally, calculation of the desired angle by minimizing the
re-projection error from the remaining correspondences. To validate the
proposed method an experimental comparison against methods based on analysis of
the distribution of the angles computed from all correspondences is conducted.
","[{""version"":""v1"",""created"":""Thu, 3 Oct 2019 18:48:32 GMT""}]","2019-10-07"
"1910.01682","Weiwei Wu","Jun Li and Weiwei Wu","Topology of symplectomorphism groups and ball-swappings","20 pages. Comments welcome!",,,,"math.SG math.AT","http://arxiv.org/licenses/nonexclusive-distrib/1.0/","  In this survey article, we summarize some recent progress and problems on the
symplectomorphism groups, with an emphasis on the connection to the space of
ball-packings.
","[{""version"":""v1"",""created"":""Thu, 3 Oct 2019 18:51:45 GMT""},{""version"":""v2"",""created"":""Mon, 7 Oct 2019 00:54:54 GMT""}]","2019-10-08"
"1910.01683","Therese Biedl","Therese Biedl","A note on 1-planar graphs with minimum degree 7","4 pages",,,,"math.CO cs.DM","http://arxiv.org/licenses/nonexclusive-distrib/1.0/","  It is well-known that 1-planar graphs have minimum degree at most 7, and not
hard to see that some 1-planar graphs have minimum degree exactly 7. In this
note we show that any such 1-planar graph has at least 24 vertices, and this is
tight.
","[{""version"":""v1"",""created"":""Thu, 3 Oct 2019 18:55:46 GMT""}]","2019-10-07"
