"1910.01791","Mohammad Lotfollahi","Mohammad Lotfollahi, Mohsen Naghipourfar, Fabian J. Theis, F.
  Alexander Wolf","Conditional out-of-sample generation for unpaired data using trVAE","Added reference to Johansson et al. (2016) and removed sentences from
  Lopez et al. (2018) in the background section (see acknowledgements)",,,,"cs.LG eess.IV q-bio.CB q-bio.GN stat.ML","http://arxiv.org/licenses/nonexclusive-distrib/1.0/","  While generative models have shown great success in generating
high-dimensional samples conditional on low-dimensional descriptors (learning
e.g. stroke thickness in MNIST, hair color in CelebA, or speaker identity in
Wavenet), their generation out-of-sample poses fundamental problems. The
conditional variational autoencoder (CVAE) as a simple conditional generative
model does not explicitly relate conditions during training and, hence, has no
incentive of learning a compact joint distribution across conditions. We
overcome this limitation by matching their distributions using maximum mean
discrepancy (MMD) in the decoder layer that follows the bottleneck. This
introduces a strong regularization both for reconstructing samples within the
same condition and for transforming samples across conditions, resulting in
much improved generalization. We refer to the architecture as
\emph{transformer} VAE (trVAE). Benchmarking trVAE on high-dimensional image
and tabular data, we demonstrate higher robustness and higher accuracy than
existing approaches. In particular, we show qualitatively improved predictions
for cellular perturbation response to treatment and disease based on
high-dimensional single-cell gene expression data, by tackling previously
problematic minority classes and multiple conditions. For generic tasks, we
improve Pearson correlations of high-dimensional estimated means and variances
with their ground truths from 0.89 to 0.97 and 0.75 to 0.87, respectively.
","[{""version"":""v1"",""created"":""Fri, 4 Oct 2019 03:39:35 GMT""},{""version"":""v2"",""created"":""Wed, 30 Oct 2019 11:49:58 GMT""}]","2019-10-31"
"1910.01792","Yao Wang","Yao Wang, Ilya Esterlis, Tao Shi, J. Ignacio Cirac, Eugene Demler","Zero-Temperature Phases of the 2D Hubbard-Holstein Model: A Non-Gaussian
  Exact Diagonalization Study","19 pages, 17 figures","Phys. Rev. Research 2, 043258 (2020)","10.1103/PhysRevResearch.2.043258",,"cond-mat.str-el","http://arxiv.org/licenses/nonexclusive-distrib/1.0/","  We propose a numerical method which embeds the variational non-Gaussian
wavefunction approach within exact diagonalization, allowing for efficient
treatment of correlated systems with both electron-electron and electron-phonon
interactions. Using a generalized polaron transformation, we construct a
variational wavefunction that absorbs entanglement between electrons and
phonons into a variational non-Gaussian transformation; exact diagonalization
is then used to treat the electronic part of the wavefunction exactly, thus
taking into account high-order correlation effects beyond the Gaussian level.
Keeping the full electronic Hilbert space, the complexity is increased only by
a polynomial scaling factor relative to the exact diagonalization calculation
for pure electrons. As an example, we use this method to study ground-state
properties of the two-dimensional Hubbard-Holstein model, providing evidence
for the existence of intervening phases between the spin and charge-ordered
states. In particular, we find one of the intervening phases has strong charge
susceptibility and binding energy, but is distinct from a charge-density-wave
ordered state, while the other intervening phase displays superconductivity at
weak couplings. This method, as a general framework, can be extended to treat
excited states and dynamics, as well as a wide range of systems with both
electron-electron and electron-boson interactions.
","[{""version"":""v1"",""created"":""Fri, 4 Oct 2019 03:54:23 GMT""},{""version"":""v2"",""created"":""Tue, 19 Nov 2019 20:02:44 GMT""},{""version"":""v3"",""created"":""Sat, 21 Nov 2020 05:16:26 GMT""}]","2020-11-24"
"1910.01793","Yingbo Li","Yingbo Li, Robert Cezeaux, Di Yu","Automating Data Monitoring: Detecting Structural Breaks in Time Series
  Data Using Bayesian Minimum Description Length",,,,,"stat.ME","http://arxiv.org/licenses/nonexclusive-distrib/1.0/","  In modern business modeling and analytics, data monitoring plays a critical
role. Nowadays, sophisticated models often rely on hundreds or even thousands
of input variables. Over time, structural changes such as abrupt level shifts
or trend slope changes may occur among some of these variables, likely due to
changes in economy or government policies. As a part of data monitoring, it is
important to identify these changepoints, in terms of which variables exhibit
such changes, and what time locations do the changepoints occur. Being alerted
about the changepoints can help modelers decide if models need modification or
rebuilds, while ignoring them may increase risks of model degrading. Simple
process control rules often flag too many false alarms because regular seasonal
fluctuations or steady upward or downward trends usually trigger alerts. To
reduce potential false alarms, we create a novel statistical method based on
the Bayesian Minimum Description Length (BMDL) framework to perform multiple
change-point detection. Our method is capable of detecting all structural
breaks occurred in the past, and automatically handling data with or without
seasonality and/or autocorrelation. It is implemented with computation
algorithms such as Markov chain Monte Carlo (MCMC), and can be applied to all
variables in parallel. As an explainable anomaly detection tool, our
changepoint detection method not only triggers alerts, but provides useful
information about the structural breaks, such as the times of changepoints, and
estimation of mean levels and linear slopes before and after the changepoints.
This makes future business analysis and evaluation on the structural breaks
easier.
","[{""version"":""v1"",""created"":""Fri, 4 Oct 2019 04:03:02 GMT""}]","2019-10-07"
"1910.01794","Andreas Venzke","Andreas Venzke and Daniel K. Molzahn and Spyros Chatzivasileiadis","Efficient Creation of Datasets for Data-Driven Power System Applications",,,,,"eess.SY cs.SY math.OC","http://arxiv.org/licenses/nonexclusive-distrib/1.0/","  Advances in data-driven methods have sparked renewed interest for
applications in power systems. Creating datasets for successful application of
these methods has proven to be very challenging, especially when considering
power system security. This paper proposes a computationally efficient method
to create datasets of secure and insecure operating points. We propose an
infeasibility certificate based on separating hyperplanes that can a-priori
characterize large parts of the input space as insecure, thus significantly
reducing both computation time and problem size. Our method can handle an order
of magnitude more control variables and creates balanced datasets of secure and
insecure operating points, which is essential for data-driven applications.
While we focus on N-1 security and uncertainty, our method can extend to
dynamic security. For PGLib-OPF networks up to 500 buses and up to 125 control
variables, we demonstrate drastic reductions in unclassified input space
volumes and computation time, create balanced datasets, and evaluate an
illustrative data-driven application.
","[{""version"":""v1"",""created"":""Fri, 4 Oct 2019 04:05:18 GMT""},{""version"":""v2"",""created"":""Tue, 14 Apr 2020 07:47:51 GMT""}]","2020-04-15"
"1910.01795","Bo Wu","Bo Wu, Wen-Huang Cheng, Peiye Liu, Bei Liu, Zhaoyang Zeng, Jiebo Luo","SMP Challenge: An Overview of Social Media Prediction Challenge 2019","ACM MM 2019",,,,"cs.MM cs.LG cs.SI","http://arxiv.org/licenses/nonexclusive-distrib/1.0/","  ""SMP Challenge"" aims to discover novel prediction tasks for numerous data on
social multimedia and seek excellent research teams. Making predictions via
social multimedia data (e.g. photos, videos or news) is not only helps us to
make better strategic decisions for the future, but also explores advanced
predictive learning and analytic methods on various problems and scenarios,
such as multimedia recommendation, advertising system, fashion analysis etc.
  In the SMP Challenge at ACM Multimedia 2019, we introduce a novel prediction
task Temporal Popularity Prediction, which focuses on predicting future
interaction or attractiveness (in terms of clicks, views or likes etc.) of new
online posts in social media feeds before uploading. We also collected and
released a large-scale SMPD benchmark with over 480K posts from 69K users. In
this paper, we define the challenge problem, give an overview of the dataset,
present statistics of rich information for data and annotation and design the
accuracy and correlation evaluation metrics for temporal popularity prediction
to the challenge.
","[{""version"":""v1"",""created"":""Fri, 4 Oct 2019 04:10:43 GMT""},{""version"":""v2"",""created"":""Tue, 21 Jan 2020 05:06:20 GMT""}]","2020-01-22"
"1910.01796","David Le","David Le, Minhaj Alam, Cham Yao, Jennifer I. Lim, R.V.P. Chan, Devrim
  Toslak, and Xincheng Yao","Transfer Learning for Automated OCTA Detection of Diabetic Retinopathy","20 pages, 4 figures, 6 tables",,"10.1167/tvst.9.2.35",,"q-bio.QM eess.IV","http://arxiv.org/licenses/nonexclusive-distrib/1.0/","  Purpose: To test the feasibility of using deep learning for optical coherence
tomography angiography (OCTA) detection of diabetic retinopathy (DR). Methods:
A deep learning convolutional neural network (CNN) architecture VGG16 was
employed for this study. A transfer learning process was implemented to
re-train the CNN for robust OCTA classification. In order to demonstrate the
feasibility of using this method for artificial intelligence (AI) screening of
DR in clinical environments, the re-trained CNN was incorporated into a custom
developed GUI platform which can be readily operated by ophthalmic personnel.
Results: With last nine layers re-trained, CNN architecture achieved the best
performance for automated OCTA classification. The overall accuracy of the
re-trained classifier for differentiating healthy, NoDR, and NPDR was 87.27%,
with 83.76% sensitivity and 90.82% specificity. The AUC metrics for binary
classification of healthy, NoDR and DR were 0.97, 0.98 and 0.97, respectively.
The GUI platform enabled easy validation of the method for AI screening of DR
in a clinical environment. Conclusion: With a transfer leaning process to adopt
the early layers for simple feature analysis and to re-train the upper layers
for fine feature analysis, the CNN architecture VGG16 can be used for robust
OCTA classification of healthy, NoDR, and NPDR eyes. Translational Relevance:
OCTA can capture microvascular changes in early DR. A transfer learning process
enables robust implementation of convolutional neural network (CNN) for
automated OCTA classification of DR.
","[{""version"":""v1"",""created"":""Fri, 4 Oct 2019 04:12:01 GMT""}]","2021-12-16"
"1910.01797","Timothy P Bywaters","Timothy P. Bywaters","The space of directions for hyperbolic totally disconnected locally
  compact groups","21 pages; Typing errors and formatting corrected",,,,"math.GR","http://arxiv.org/licenses/nonexclusive-distrib/1.0/","  The space of directions is a notion of boundary associated to an arbitrary
totally disconnected locally compact group. We explicitly calculate the space
of directions of a group acting vertex transitively with compact open vertex
stabilisers on a locally finite connected hyperbolic graph. These are examples
of groups where techniques from geometric group theory can be generalised from
the discrete to the non-discrete case. We show the space of directions for
these groups is a discrete metric space. Our results resolve a conjecture of
Baumgartner, M\""oller and Willis in the affirmative.
","[{""version"":""v1"",""created"":""Fri, 4 Oct 2019 04:29:13 GMT""},{""version"":""v2"",""created"":""Thu, 17 Oct 2019 05:07:42 GMT""}]","2019-10-18"
"1910.01798","Qiye Zheng","Qiye Zheng, Sumanjeet Kaur, Chris Dames, Ravi S. Prasher","Analysis and Improvement of the Hot Disk Transient Plane Source Method
  for Low Thermal Conductivity Materials","76 pages, 11 figures",,,,"physics.app-ph cond-mat.mtrl-sci physics.ins-det","http://arxiv.org/licenses/nonexclusive-distrib/1.0/","  The hot disk transient plane source (TPS) method is a widely used standard
technique (ISO 22007-2) for the characterization of thermal properties of
materials, especially the thermal conductivity, k. Despite its well-established
reliability for a wide variety of common materials, the hot disk TPS method is
also known to suffer from a substantial systematic errors when applied to low-k
thermal insulation materials. Here, we present a combined numerical and
experimental study on the influence of the geometry of hot disk sensor on
measured value of low-k materials. We demonstrate that the error is strongly
affected by the finite thickness and thermal mass of the sensor's insulation
layer was well as the corresponding increase of the effective heater size
beyond the radius of the embedded metal heater itself. We also numerically
investigate the dependence of the error on the sample thermal properties,
confirming that the errors are worse in low-k samples. A simple correction
function is also provided, which converts the apparent (erroneous) result from
a standard hot disk TPS measurement to a more accurate value. A standard
polyimide sensor was also optimized using both wet and dry etching to provide
more accurate measurement directly. Experimentally corrected value of k for
Airloy x56 aerogel and a commercial silica aerogel using the numerical
correction factor derived based on the standard TPS sensor is in excellent
agreement with the directly measured value from the TPS sensor using the
optimized polyimide sensor. Both of these methods can reduce the errors to less
than 4% as compared to around 40% error of overestimation from raw values
measured with the pristine sensor. Such results show that both the numerical
correction to a pristine senor or an optimized sensor are capable of providing
highly accurate value of thermal conductivity for such materials.
","[{""version"":""v1"",""created"":""Fri, 4 Oct 2019 04:34:03 GMT""},{""version"":""v2"",""created"":""Wed, 30 Oct 2019 19:03:11 GMT""}]","2019-11-01"
"1910.01799","Matt Wand","Marianne Menictas, Gioia Di Credico and Matt P. Wand","Streamlined Variational Inference for Linear Mixed Models with Crossed
  Random Effects",,,,,"stat.ME stat.ML","http://arxiv.org/licenses/nonexclusive-distrib/1.0/","  We derive streamlined mean field variational Bayes algorithms for fitting
linear mixed models with crossed random effects. In the most general situation,
where the dimensions of the crossed groups are arbitrarily large, streamlining
is hindered by lack of sparseness in the underlying least squares system.
Because of this fact we also consider a hierarchy of relaxations of the mean
field product restriction. The least stringent product restriction delivers a
high degree of inferential accuracy. However, this accuracy must be mitigated
against its higher storage and computing demands. Faster sparse storage and
computing alternatives are also provided, but come with the price of diminished
inferential accuracy. This article provides full algorithmic details of three
variational inference strategies, presents detailed empirical results on their
pros and cons and, thus, guides the users on their choice of variational
inference approach depending on the problem size and computing resources.
","[{""version"":""v1"",""created"":""Fri, 4 Oct 2019 04:49:49 GMT""},{""version"":""v2"",""created"":""Wed, 11 Dec 2019 22:27:08 GMT""},{""version"":""v3"",""created"":""Thu, 14 Apr 2022 03:07:26 GMT""}]","2022-04-15"
"1910.01800","Brett Kolesnik","Janko Gravner and Brett Kolesnik","Transitive closure in a polluted environment",,,,,"math.PR math.CO","http://arxiv.org/licenses/nonexclusive-distrib/1.0/","  We introduce and study a new percolation model, inspired by recent works on
jigsaw percolation, graph bootstrap percolation, and percolation in polluted
environments. Start with an oriented graph $G_0$ of initially occupied edges on
$n$ vertices, and iteratively occupy additional edges by transitivity, with the
constraint that only open edges in a certain random set can ever be occupied.
All other edges are closed, creating a set of obstacles for the spread of
occupied edges. When $G_0$ is an unoriented linear graph, and leftward and
rightward edges are open independently with possibly different probabilities,
we identify three regimes in which the set of eventually occupied edges is
either all open edges, the majority of open edges in one direction, or only a
very small proportion of all open edges. In the more general setting where
$G_0$ is a connected unoriented graph of bounded degree, we show that the
transition between sparse and full occupation of open edges occurs when the
density of open edges is $(\log n)^{-1/2+o(1)}$. We conclude with several
conjectures and open problems.
","[{""version"":""v1"",""created"":""Fri, 4 Oct 2019 04:53:00 GMT""}]","2019-10-07"
"1910.01801","Pramod Shinde","Pramod Shinde, Loic Marrec, Aparna Rai, Alok Yadav, Rajesh Kumar,
  Mikhail Ivanchenko, Alexey Zaikin, Sarika Jalan","Symmetry in cancer networks identified: Proposal for multi-cancer
  biomarkers","20 Pages, 5 Figures",,,,"q-bio.MN","http://arxiv.org/licenses/nonexclusive-distrib/1.0/","  One of the most challenging problems in biomedicine and genomics is the
identification of disease biomarkers. In this study, proteomics data from seven
major cancers were used to construct two weighted protein-protein interaction
(PPI) networks i.e., one for the normal and another for the cancer conditions.
We developed rigorous, yet mathematically simple, methodology based on the
degeneracy at -1 eigenvalues to identify structural symmetry or motif
structures in network. Utilising eigenvectors corresponding to degenerate
eigenvalues in the weighted adjacency matrix, we identified structural symmetry
in underlying weighted PPI networks constructed using seven cancer data.
Functional assessment of proteins forming these structural symmetry exhibited
the property of cancer hallmarks. Survival analysis refined further this
protein list proposing BMI, MAPK11, DDIT4, CDKN2A, and FYN as putative
multi-cancer biomarkers. The combined framework of networks and spectral graph
theory developed here can be applied to identify symmetrical patterns in other
disease networks to predict proteins as potential disease biomarkers.
","[{""version"":""v1"",""created"":""Fri, 4 Oct 2019 05:04:58 GMT""}]","2019-10-07"
"1910.01802","Yutaka Yoshida","Takuya Okuda and Yutaka Yoshida","SUSY localization for Coulomb branch operators in omega-deformed 3d N=4
  gauge theories","76 pages, SUSY computations done by Mathematica in ancillary files.
  v2: minor changes, typos fixed, a reference added",,"10.1007/s00220-022-04578-5","UT-Komaba-19-3, IPMU19-0133","hep-th math.AG math.RT","http://arxiv.org/licenses/nonexclusive-distrib/1.0/","  We perform SUSY localization for Coulomb branch operators of 3d
$\mathcal{N}=4$ gauge theories in $\mathbb{R}^3$ with $\Omega$-deformation. For
the dressed monopole operators whose expectation values do not involve
non-perturbative corrections, our computations reproduce the results of the
so-called abelianization procedure. For the expectation values of other
operators and the correlation functions of multiple operators in $U(N)$ gauge
theories, we compute the non-perturbative corrections due to monopole bubbling
using matrix models obtained by brane construction. We relate the results of
localization to algebraic structures discussed in the mathematical literature,
and also point out a similar relation for line operators in 4d $\mathcal{N}=2$
gauge theories. For $U(N)$ (quiver) gauge theories in 3d we demonstrate a
direct correspondence between wall-crossing and the ordering of operators.
","[{""version"":""v1"",""created"":""Fri, 4 Oct 2019 05:28:10 GMT""},{""version"":""v2"",""created"":""Sat, 16 Nov 2019 08:42:42 GMT""}]","2023-01-04"
"1910.01803","Sajad Darabi","Sajad Darabi, Mohammad Kachuee, Majid Sarrafzadeh","Unsupervised Representation for EHR Signals and Codes as Patient Status
  Vector",,,,,"cs.LG cs.AI stat.ML","http://arxiv.org/licenses/nonexclusive-distrib/1.0/","  Effective modeling of electronic health records presents many challenges as
they contain large amounts of irregularity most of which are due to the varying
procedures and diagnosis a patient may have. Despite the recent progress in
machine learning, unsupervised learning remains largely at open, especially in
the healthcare domain. In this work, we present a two-step unsupervised
representation learning scheme to summarize the multi-modal clinical time
series consisting of signals and medical codes into a patient status vector.
First, an auto-encoder step is used to reduce sparse medical codes and clinical
time series into a distributed representation. Subsequently, the concatenation
of the distributed representations is further fine-tuned using a forecasting
task. We evaluate the usefulness of the representation on two downstream tasks:
mortality and readmission. Our proposed method shows improved generalization
performance for both short duration ICU visits and long duration ICU visits.
","[{""version"":""v1"",""created"":""Fri, 4 Oct 2019 05:42:50 GMT""}]","2019-10-07"
"1910.01804","Bevin Huang","Bevin Huang, John Cenker, Xiaoou Zhang, Essance L. Ray, Tiancheng
  Song, Takashi Taniguchi, Kenji Watanabe, Michael A. McGuire, Di Xiao,
  Xiaodong Xu","Tuning Inelastic Light Scattering via Symmetry Control in 2D Magnet
  CrI$_3$","To appear in Nature Nanotechnology",,"10.1038/s41565-019-0598-4",,"cond-mat.mes-hall cond-mat.mtrl-sci","http://arxiv.org/licenses/nonexclusive-distrib/1.0/","  The coupling between spin and charge degrees of freedom in a crystal imparts
strong optical signatures on scattered electromagnetic waves. This has led to
magneto-optical effects with a host of applications, from the sensitive
detection of local magnetic order to optical modulation and data storage
technologies. Here, we demonstrate a new magneto-optical effect, namely, the
tuning of inelastically scattered light through symmetry control in atomically
thin chromium triiodide (CrI$_3$). In monolayers, we found an extraordinarily
large magneto-optical Raman effect from an A$_{1g}$ phonon mode due to the
emergence of ferromagnetic order. The linearly polarized, inelastically
scattered light rotates by ~40$^o$, more than two orders of magnitude larger
than the rotation from MOKE under the same experimental conditions. In CrI$_3$
bilayers, we show that the same A$_{1g}$ phonon mode becomes Davydov-split into
two modes of opposite parity, exhibiting divergent selection rules that depend
on inversion symmetry and the underlying magnetic order. By switching between
the antiferromagnetic states and the fully spin-polarized states with applied
magnetic and electric fields, we demonstrate the magnetoelectrical control over
their selection rules. Our work underscores the unique opportunities provided
by 2D magnets for controlling the combined time-reversal and inversion
symmetries to manipulate Raman optical selection rules and for exploring
emergent magneto-optical effects and spin-phonon coupled physics.
","[{""version"":""v1"",""created"":""Fri, 4 Oct 2019 05:46:39 GMT""},{""version"":""v2"",""created"":""Fri, 22 Nov 2019 04:26:54 GMT""}]","2020-01-22"
"1910.01805","Alexander Jung","Alexander Jung","On the Duality between Network Flows and Network Lasso","networks, clustering, machine learning, optimization, duality, Lasso",,"10.1109/LSP.2020.2998400",,"cs.LG math.OC stat.ML","http://arxiv.org/licenses/nonexclusive-distrib/1.0/","  Many applications generate data with an intrinsic network structure such as
time series data, image data or social network data. The network Lasso (nLasso)
has been proposed recently as a method for joint clustering and optimization of
machine learning models for networked data. The nLasso extends the Lasso from
sparse linear models to clustered graph signals. This paper explores the
duality of nLasso and network flow optimization. We show that, in a very
precise sense, nLasso is equivalent to a minimum-cost flow problem on the data
network structure. Our main technical result is a concise characterization of
nLasso solutions via existence of certain network flows. The main conceptual
result is a useful link between nLasso methods and basic graph algorithms such
as clustering or maximum flow.
","[{""version"":""v1"",""created"":""Fri, 4 Oct 2019 06:04:45 GMT""},{""version"":""v2"",""created"":""Sat, 28 Mar 2020 07:16:30 GMT""}]","2020-08-26"
