"1910.02286","Karel Hrbacek","Karel Hrbacek","On factoring of unlimited integers",,"Journal of Logic and Analysis 12 5 (2020) 1-6",,,"math.LO math.NT","http://arxiv.org/licenses/nonexclusive-distrib/1.0/","  A. Boudaoud asked whether every unlimited integer is a sum of a limited
integer and a product of two unlimited integers. Assuming Dickson's Conjecture,
the answer is negative. The erroneous proof of claim (2) on page 5 of the
published version is replaced by a correct one (see pages 6 - 7) and an answer
to another question of Boudaoud and Bellaouar is given.
  \end{abstract}
","[{""version"":""v1"",""created"":""Sat, 5 Oct 2019 16:00:40 GMT""},{""version"":""v2"",""created"":""Mon, 1 May 2023 14:46:53 GMT""}]","2023-05-02"
"1910.02287","Pablo Manuel Bern\'a","Pablo M. Berna, Julio D. Rossi","Nonlocal diffusion equations with dynamical boundary conditions",,,,,"math.AP","http://arxiv.org/licenses/nonexclusive-distrib/1.0/","  In this paper we study nonlocal problems that are analogous to the local ones
given by the Laplacian or the p-Laplacian with dynamical boundary conditions.
We deal both with smooth and with singular kernels and show existence and
uniqueness of solutions and study their asymptotic behaviour as t goes to
infinity.
","[{""version"":""v1"",""created"":""Sat, 5 Oct 2019 16:17:02 GMT""}]","2019-10-08"
"1910.02288","Adonai S. Sant'Anna","Adonai S. Sant'Anna","Individuality, quasi-sets and the double-slit experiment","23 pages, no figures","Quantum Studies: Mathematics and Foundations, 2019","10.1007/S40509-019-00209-2",,"quant-ph","http://arxiv.org/licenses/nonexclusive-distrib/1.0/","  Quasi-set theory $\cal Q$ allows us to cope with certain collections of
objects where the usual notion of identity is not applicable, in the sense that
$x = x$ is not a formula, if $x$ is an arbitrary term. $\cal Q$ was partially
motivated by the problem of non-individuality in quantum mechanics. In this
paper I discuss the range of explanatory power of $\cal Q$ for quantum
phenomena which demand some notion of indistinguishability among quantum
objects. My main focus is on the double-slit experiment, a major physical
phenomenon which was never modeled from a quasi-set-theoretic point of view.
The double-slit experiment strongly motivates the concept of degrees of
indistinguishability within a field-theoretic approach, and that notion is
simply missing in $\cal Q$. Nevertheless, other physical situations may
eventually demand a revision on quasi-set theory axioms, if someone intends to
use it in the quantum realm for the purpose of a clear discussion about
non-individuality. I use this opportunity to suggest another way to cope with
identity in quantum theories.
","[{""version"":""v1"",""created"":""Sat, 5 Oct 2019 16:19:03 GMT""}]","2019-10-08"
"1910.02289","Saijun Wu","Yizun He, Lingjing Ji, Yuzhuo Wang, Liyang Qiu, Jian Zhao, Yudi Ma,
  Xing Huang, Darrick E. Chang and Saijun Wu","Geometric control of collective spontaneous emission","13 pages, 7 figures, contents reduced for PRL publication","Phys. Rev. Lett. 125, 213602 (2020)","10.1103/PhysRevLett.125.213602",,"physics.atom-ph","http://arxiv.org/licenses/nonexclusive-distrib/1.0/","  Dipole spin-wave states of atomic ensembles with wave vector ${\bf
k}(\omega)$ mismatched from the dispersion relation of light are difficult to
access by far-field excitation but may support rich phenomena beyond the
traditional phase-matched scenario in quantum optics. We propose and
demonstrate an optical technique to efficiently access these states. In
particular, subnanosecond laser pulses shaped by a home-developed wideband
modulation method are applied to shift the spin wave in ${\bf k}$ space with
state-dependent geometric phase patterning, in an error-resilient fashion and
on timescales much faster than spontaneous emission. We verify this control
through the redirection, switch off, and recall of collectively enhanced
emission from a $^{87}$Rb gas with $\sim 75\%$ single-step efficiency. Our work
represents a first step toward efficient control of electric dipole spin waves
for studying many-body dissipative dynamics of excited gases, as well as for
numerous quantum optical applications.
","[{""version"":""v1"",""created"":""Sat, 5 Oct 2019 16:19:33 GMT""},{""version"":""v2"",""created"":""Sat, 1 Feb 2020 08:59:22 GMT""},{""version"":""v3"",""created"":""Thu, 29 Oct 2020 07:09:44 GMT""},{""version"":""v4"",""created"":""Wed, 18 Nov 2020 07:28:04 GMT""}]","2020-11-25"
"1910.02290","Anna Kruspe","Anna Kruspe","Few-shot tweet detection in emerging disaster events","Accepted to AI+HADR workshop @ NeurIPS 2019",,,,"cs.LG cs.CL cs.CY cs.SI stat.ML","http://arxiv.org/licenses/nonexclusive-distrib/1.0/","  Social media sources can provide crucial information in crisis situations,
but discovering relevant messages is not trivial. Methods have so far focused
on universal detection models for all kinds of crises or for certain crisis
types (e.g. floods). Event-specific models could implement a more focused
search area, but collecting data and training new models for a crisis that is
already in progress is costly and may take too much time for a prompt response.
As a compromise, manually collecting a small amount of example messages is
feasible. Few-shot models can generalize to unseen classes with such a small
handful of examples, and do not need be trained anew for each event. We compare
how few-shot approaches (matching networks and prototypical networks) perform
for this task. Since this is essentially a one-class problem, we also
demonstrate how a modified one-class version of prototypical models can be used
for this application.
","[{""version"":""v1"",""created"":""Sat, 5 Oct 2019 16:25:56 GMT""}]","2019-10-08"
"1910.02291","Sahand Rezaei-Shoshtari Mr.","Sahand Rezaei-Shoshtari, David Meger, Inna Sharf","Cascaded Gaussian Processes for Data-efficient Robot Dynamics Learning","IROS2019. Copyright 20xx IEEE. Personal use of this material is
  permitted. Permission from IEEE must be obtained for all other uses, in any
  current or future media, including reprinting/republishing this material for
  advertising or promotional purposes, creating new collective works, for
  resale or redistribution to servers or lists, or reuse of any copyrighted
  component of this work in other works",,,,"cs.RO cs.LG","http://arxiv.org/licenses/nonexclusive-distrib/1.0/","  Motivated by the recursive Newton-Euler formulation, we propose a novel
cascaded Gaussian process learning framework for the inverse dynamics of robot
manipulators. This approach leads to a significant dimensionality reduction
which in turn results in better learning and data efficiency. We explore two
formulations for the cascading: the inward and outward, both along the
manipulator chain topology. The learned modeling is tested in conjunction with
the classical inverse dynamics model (semi-parametric) and on its own
(non-parametric) in the context of feed-forward control of the arm.
Experimental results are obtained with Jaco 2 six-DOF and SARCOS seven-DOF
manipulators for randomly defined sinusoidal motions of the joints in order to
evaluate the performance of cascading against the standard GP learning. In
addition, experiments are conducted using Jaco 2 on a task emulating a pouring
maneuver. Results indicate a consistent improvement in learning speed with the
inward cascaded GP model and an overall improvement in data efficiency and
generalization.
","[{""version"":""v1"",""created"":""Sat, 5 Oct 2019 16:28:09 GMT""}]","2019-10-08"
"1910.02292","Joyce Nakatumba-Nabende Dr.","Benjamin Akera, Joyce Nakatumba-Nabende, Jonathan Mukiibi, Ali
  Hussein, Nathan Baleeta, Daniel Ssendiwala, Samiiha Nalwooga","Keyword Spotter Model for Crop Pest and Disease Monitoring from
  Community Radio Data","Presented at NeurIPS 2019 Workshop on Machine Learning for the
  Developing World",,,,"cs.CY cs.CL","http://arxiv.org/licenses/nonexclusive-distrib/1.0/","  In societies with well developed internet infrastructure, social media is the
leading medium of communication for various social issues especially for
breaking news situations. In rural Uganda however, public community radio is
still a dominant means for news dissemination. Community radio gives audience
to the general public especially to individuals living in rural areas, and thus
plays an important role in giving a voice to those living in the broadcast
area. It is an avenue for participatory communication and a tool relevant in
both economic and social development.This is supported by the rise to ubiquity
of mobile phones providing access to phone-in or text-in talk shows. In this
paper, we describe an approach to analysing the readily available community
radio data with machine learning-based speech keyword spotting techniques. We
identify the keywords of interest related to agriculture and build models to
automatically identify these keywords from audio streams. Our contribution
through these techniques is a cost-efficient and effective way to monitor food
security concerns particularly in rural areas. Through keyword spotting and
radio talk show analysis, issues such as crop diseases, pests, drought and
famine can be captured and fed into an early warning system for stakeholders
and policy makers.
","[{""version"":""v1"",""created"":""Sat, 5 Oct 2019 16:30:49 GMT""}]","2019-10-08"
"1910.02293","Peter Shaffery","Peter Shaffery, Bret D. Elderd, and Vanja Dukic","A Note on Species Richness and the Variance of Epidemic Severity",,,,,"q-bio.PE","http://arxiv.org/licenses/nonexclusive-distrib/1.0/","  The commonly observed negative correlation between the number of species in
an ecological community and disease risk, typically referred to as ""the
dilution effect"", has received a substantial amount of attention over the past
decade. Attempts to test this relationship experimentally have revealed that,
in addition to the mean disease risk decreasing with species number, so too
does the variance of disease risk. This is referred to as the ""variance
reduction effect"", and has received relatively little attention in the
disease-diversity literature. Here, we set out to clarify and quantify some of
these relationships in an idealized model of a randomly assembled multi-species
community undergoing an epidemic. We specifically investigate the variance of
the community disease reproductive ratio, a multi-species extension of the
basic reproductive ratio R_0, for a family of random-parameter meta-community
SIR models, and show how the variance of community $R_0$ varies depending on
whether transmission is density or frequency-dependent. We finally outline
areas of further research on how changes in variance affect transmission
dynamics in other systems.
","[{""version"":""v1"",""created"":""Sat, 5 Oct 2019 16:34:18 GMT""},{""version"":""v2"",""created"":""Mon, 20 Jan 2020 20:39:50 GMT""}]","2020-01-22"
"1910.02294","Inna Entova-Aizenbud","Inna Entova-Aizenbud, Vera Serganova","Duflo-Serganova functor and superdimension formula for the periplectic
  Lie superalgebra","ver 2: proof of prop. 3.2.2 significantly shortened","Alg. Number Th. 16 (2022) 697-729","10.2140/ant.2022.16.697",,"math.RT","http://arxiv.org/licenses/nonexclusive-distrib/1.0/","  In this paper, we study the representations of the periplectic Lie
superalgebra using the Duflo-Serganova functor. Given a simple
$\mathfrak{p}(n)$-module $L$ and a certain element $x\in \mathfrak{p}(n)$ of
rank $1$, we give an explicit description of the composition factors of the
$\mathfrak{p}(n-1)$-module $DS_x(L)$, which is defined as the homology of the
complex $$\Pi M \xrightarrow{x} M \xrightarrow{x} \Pi M.$$ In particular, we
show that this $\mathfrak{p}(n-1)$-module is multiplicity-free. We then use
this result to give a simple explicit combinatorial formula for the
superdimension of a simple integrable finite-dimensional
$\mathfrak{p}(n)$-module, based on its highest weight. In particular, this
reproves the Kac-Wakimoto conjecture for $\mathfrak{p}(n)$, which was proved
earlier by the authors.
","[{""version"":""v1"",""created"":""Sat, 5 Oct 2019 16:47:26 GMT""},{""version"":""v2"",""created"":""Sat, 7 Dec 2019 03:41:51 GMT""}]","2022-07-13"
"1910.02295","Xiaolong Li","Xiaolong Li and Kui Wang","Sharp lower bound for the first eigenvalue of the Weighted $p$-Laplacian","Comments are welcome",,,,"math.AP math.DG","http://arxiv.org/licenses/nonexclusive-distrib/1.0/","  We prove sharp lower bound estimates for the first nonzero eigenvalue of the
weighted $p$-Lapacian operator with $1< p< \infty$ on a compact Bakry-Emery
manifold $(M^n,g,f)$ satisfying $\Ric+\nabla^2 f \geq \kappa \, g$, provided
that either $1<p \leq 2$ or $\kappa \leq 0$. Same conclusions hold when the
manifold has nonempty boundary if we assume it is strictly convex and put
Neumann boundary conditions on it. For $1<p \leq 2$, we provide a simple proof
via the modulus of continuity estimates method. The proof for $\kappa \leq 0$
is based on a sharp gradient comparison theorem for the eigenfunction and a
careful analysis of the underlying one-dimensional model equation. Our results
generalize the work of Valtorta\cite{Valtorta12} and Naber-Valtorta\cite{NV14}
for the $p$-Laplacian (namely $f=\text{const}$), and the work of
Bakry-Qian\cite{BQ00} for the $f$-Laplacian (namely $p=2$).
","[{""version"":""v1"",""created"":""Sat, 5 Oct 2019 17:09:33 GMT""}]","2019-10-08"
"1910.02296","Lili Ma","L. Ma, X. Shen, K. Kim, D. Brown, M. D'Ewart, B. Hong, J. Olsen, S.
  Smith, D. Van Winkle, E. Williams, S. Weathersby, X. Wang, A. Young, J.
  Frisch","SLAC UED LLRF System Upgrade","5 pages, 10 figures, LLRF2019 workshop",,,"LLRF2019/211","physics.acc-ph","http://arxiv.org/licenses/nonexclusive-distrib/1.0/","  The SLAC mega-electron-volt (MeV) ultrafast electron diffraction (UED)
instrument is a powerful ""electron camera"" for the study of time-resolved,
ultrafast atomic & molecular dynamics in chemical and solid-state systems. The
UED laser timing synchronization is upgraded to SLAC (Advanced
Telecommunications Computing Architecture) ATCA based femtosecond laser timing
synchronization system. UED radio frequency (RF) gun cavity low level RF (LLRF)
control is also being upgraded to SLAC ATCA based LLRF system to provide
improved performance and maintainability. The new laser timing synchronization
and LLRF control are implemented in one ATCA crate located in the laser room. A
2nd ATCA crate is set up to monitor the Klystron and sub-booster performance.
With the ATCA based RF control system, the laser timing jitter has achieved 10
fs. The UED operation beam rate is being upgraded from 180 Hz to 360 Hz, which
paves the way for a further upgrade of operation beam rate to 1 kHz in the
future. In this paper, we present design details and characterization results
of the implementation.
","[{""version"":""v1"",""created"":""Sat, 5 Oct 2019 17:14:20 GMT""},{""version"":""v2"",""created"":""Thu, 10 Oct 2019 17:49:58 GMT""},{""version"":""v3"",""created"":""Mon, 28 Oct 2019 17:47:40 GMT""},{""version"":""v4"",""created"":""Tue, 29 Oct 2019 16:41:28 GMT""}]","2019-10-30"
"1910.02297","Sean Terry","Sean K. Terry, Richard K. Barry, David P. Bennett, Aparna
  Bhattacharya, Jay Anderson, Matthew T. Penny","Comparing Observed Stellar Kinematics and Surface Densities in a Low
  Latitude Bulge Field to Galactic Population Synthesis Models","18 pages, 10 figures. Published in ApJ",,"10.3847/1538-4357/ab629b",,"astro-ph.SR astro-ph.EP astro-ph.GA","http://arxiv.org/licenses/nonexclusive-distrib/1.0/","  We present an analysis of Galactic bulge stars from Hubble Space Telescope
(HST) Wide Field Camera 3 (WFC3) observations of the Stanek window
(l,b=[0.25,-2.15]) from two epochs approximately two years apart. This dataset
is adjacent to the provisional Wide-field Infrared Survey Telescope (WFIRST)
microlensing field. Proper motions are measured for approximately 115,000 stars
down to 28th mag in V band and 25th mag in I band, with accuracies of 0.5 mas
yr$^{-1}$ (20 km s$^{-1}$) at I $\approx$ 21. A cut on the longitudinal proper
motion $\mu_l$ allows us to separate disk and bulge populations and produce
bulge-only star counts that are corrected for photometric completeness and
efficiency of the proper-motion cut. The kinematic dispersions and surface
density in the field are compared to the nearby SWEEPS sight-line, finding a
marginally larger than expected gradient in stellar density. The observed bulge
star counts and kinematics are further compared to the Besan\c{c}on, Galaxia,
and GalMod Galactic population synthesis models. We find that most of the
models underpredict low-mass bulge stars by $\sim$33% below the main-sequence
turnoff, and upwards of $\sim$70% at redder J and H wavebands. While
considering inaccuracies in the Galactic models, we give implications for the
exoplanet yield from the WFIRST microlensing mission.
","[{""version"":""v1"",""created"":""Sat, 5 Oct 2019 17:14:44 GMT""},{""version"":""v2"",""created"":""Sun, 26 Jan 2020 22:15:24 GMT""}]","2020-02-12"
"1910.02298","Konstantin Zloshchastiev","Ludmila Praxmeyer and Konstantin G. Zloshchastiev","Phase space formulation of density operator for non-Hermitian
  Hamiltonians and its application in quantum theory of decay","8 pages, 3 composite figures, final/published version","Int. J. Mod. Phys. B 32, 1850276 (2018)","10.1142/S0217979218502764",,"quant-ph cond-mat.stat-mech math-ph math.MP","http://arxiv.org/licenses/nonexclusive-distrib/1.0/","  The Wigner-Weyl transform and phase space formulation of a density matrix
approach are applied to a non-Hermitian model which is quadratic in positions
and momenta. We show that in the presence of a quantum environment or
reservoir, mean lifetime and decay constants of quantum systems do not
necessarily take arbitrary values, but could become functions of energy
eigenvalues and have a discrete spectrum. It is demonstrated also that a
constraint upon mean lifetime and energy appears, which is used to derive the
resonance conditions at which long-lived states occur. The latter indicate that
quantum dissipative effects do not always lead to decay but, under certain
conditions, can support stability of a system.
","[{""version"":""v1"",""created"":""Sat, 5 Oct 2019 17:28:31 GMT""}]","2019-10-09"
"1910.02299","Tao Li","Tao E. Li, Hsing-Ta Chen, Abraham Nitzan, Joseph E. Subotnik","Quasiclassical Modeling of Cavity Quantum Electrodynamics","18 pages, 13 figures","Phys. Rev. A 101, 033831 (2020)","10.1103/PhysRevA.101.033831",,"quant-ph physics.atom-ph physics.chem-ph physics.optics","http://arxiv.org/licenses/nonexclusive-distrib/1.0/","  We model a collection of $N$ two-level systems (TLSs) coupled to a multimode
cavity via Meyer-Miller-Stock-Thoss (MMST) dynamics, sampling both electronic
and photonic zero-point energies (ZPEs) and propagating independent
trajectories in Wigner phase space. By investigating the ground state stability
of a single TLS, we use MMST dynamics to separately study both electronic ZPE
effects (which would naively lead to the breakdown of the electronic ground
state) as well as photonic ZPE effects (which would naively lead to spontaneous
absorption). By contrast, including both effects (i.e., sampling both
electronic and photonic ZPEs) leads to the dynamical stability of the
electronic ground state. Therefore, MMST dynamics provide a practical way to
identify the contributions of self-interaction and vacuum fluctuations. More
importantly, we find that MMST dynamics can predict accurate quantum dynamics
for both electronic populations and electromagnetic field intensity in the high
saturation limit. For a single TLS in a cavity, MMST dynamics correctly predict
the initial exponential decay of spontaneous emission, Poincar\'e recurrences,
and the positional dependence of a spontaneous emission rate. For an array of
$N$ equally spaced TLSs with only one TLS excited initially, MMST dynamics
correctly predict the modification of spontaneous emission rate as a function
of the spacing between TLSs. Finally, MMST dynamics also correctly model
Dicke's superradiance and subradiance (i.e., the dynamics when all TLSs are
excited initially) including the correct quantum statistics for the delay time
(as found by counting trajectories, for which a full quantum simulation is hard
to achieve). Therefore, this work raises the possibility of simulating
large-scale collective light-matter interactions with methods beyond mean-field
theory.
","[{""version"":""v1"",""created"":""Sat, 5 Oct 2019 17:40:19 GMT""},{""version"":""v2"",""created"":""Sat, 28 Dec 2019 23:17:34 GMT""}]","2020-03-24"
"1910.02300","Ahmed Ibrahim Dr.","Ahmed Ibrahim, Octavia A. Dobre, Telex M. N. Ngatched, and Ana Garcia
  Armada","Bender's Decomposition for Optimization Design Problems in Communication
  Networks","Accepted in IEEE Network Magazine, Aug. 2019, Article No.:
  NETWORK-19-00414.R1",,,,"cs.NI eess.SP","http://arxiv.org/licenses/nonexclusive-distrib/1.0/","  Various types of communication networks are constantly emerging to improve
the connectivity services and facilitate the interconnection of various types
of devices. This involves the development of several technologies, such as
device-to-device communications, wireless sensor networks and vehicular
communications. The various services provided have heterogeneous requirements
on the quality metrics such as throughput, end-to-end latency and jitter.
Furthermore, different network technologies have inherently heterogeneous
restrictions on resources, e.g., power, interference management requirements,
computational capabilities, etc. As a result, different network operations such
as spectrum management, routing, power control and offloading need to be
performed differently. Mathematical optimization techniques have always been at
the heart of such design problems to formulate and propose computationally
efficient solution algorithms. One of the existing powerful techniques of
mathematical optimization is Benders decomposition (BD), which is the focus of
this article. Here, we briefly review different BD variants that have been
applied in various existing network types and different design problems. These
main variants are the classical, the combinatorial, the multi-stage, and the
generalized BD. We discuss compelling BD applications for various network types
including heterogeneous cellular networks, infrastructure wired wide area
networks, smart grids, wireless sensor networks, and wireless local area
networks. Mainly, our goal is to assist the readers in refining the motivation,
problem formulation, and methodology of this powerful optimization technique in
the context of future networks. We also discuss the BD challenges and the
prospective ways these can be addressed when applied to communication networks'
design problems.
","[{""version"":""v1"",""created"":""Sat, 5 Oct 2019 17:56:27 GMT""}]","2019-10-08"
"1910.02301","Isuru Hewapathirana","Isuru Udayangani Hewapathirana, Dominic Lee, Elena Moltchanova and
  Jeanette McLeod","Change Detection in Noisy Dynamic Networks: A Spectral Embedding
  Approach","44 pages, 33 figures",,,,"cs.LG stat.CO stat.ML","http://arxiv.org/licenses/nonexclusive-distrib/1.0/","  Change detection in dynamic networks is an important problem in many areas,
such as fraud detection, cyber intrusion detection and health care monitoring.
It is a challenging problem because it involves a time sequence of graphs, each
of which is usually very large and sparse with heterogeneous vertex degrees,
resulting in a complex, high dimensional mathematical object. Spectral
embedding methods provide an effective way to transform a graph to a lower
dimensional latent Euclidean space that preserves the underlying structure of
the network. Although change detection methods that use spectral embedding are
available, they do not address sparsity and degree heterogeneity that usually
occur in noisy real-world graphs and a majority of these methods focus on
changes in the behaviour of the overall network.
  In this paper, we adapt previously developed techniques in spectral graph
theory and propose a novel concept of applying Procrustes techniques to
embedded points for vertices in a graph to detect changes in entity behaviour.
Our spectral embedding approach not only addresses sparsity and degree
heterogeneity issues, but also obtains an estimate of the appropriate embedding
dimension. We call this method CDP (change detection using Procrustes
analysis). We demonstrate the performance of CDP through extensive simulation
experiments and a real-world application. CDP successfully detects various
types of vertex-based changes including (i) changes in vertex degree, (ii)
changes in community membership of vertices, and (iii) unusual increase or
decrease in edge weight between vertices. The change detection performance of
CDP is compared with two other baseline methods that employ alternative
spectral embedding approaches. In both cases, CDP generally shows superior
performance.
","[{""version"":""v1"",""created"":""Sat, 5 Oct 2019 18:02:18 GMT""}]","2019-10-08"
