"1910.02426","Dimitri Bertsekas","Dimitri Bertsekas","Biased Aggregation, Rollout, and Enhanced Policy Improvement for
  Reinforcement Learning",,,,,"cs.LG cs.AI","http://arxiv.org/licenses/nonexclusive-distrib/1.0/","  We propose a new aggregation framework for approximate dynamic programming,
which provides a connection with rollout algorithms, approximate policy
iteration, and other single and multistep lookahead methods. The central novel
characteristic is the use of a bias function $V$ of the state, which biases the
values of the aggregate cost function towards their correct levels. The
classical aggregation framework is obtained when $V\equiv0$, but our scheme
works best when $V$ is a known reasonably good approximation to the optimal
cost function $J^*$.
  When $V$ is equal to the cost function $J_{\mu}$ of some known policy $\mu$
and there is only one aggregate state, our scheme is equivalent to the rollout
algorithm based on $\mu$ (i.e., the result of a single policy improvement
starting with the policy $\mu$). When $V=J_{\mu}$ and there are multiple
aggregate states, our aggregation approach can be used as a more powerful form
of improvement of $\mu$. Thus, when combined with an approximate policy
evaluation scheme, our approach can form the basis for a new and enhanced form
of approximate policy iteration.
  When $V$ is a generic bias function, our scheme is equivalent to
approximation in value space with lookahead function equal to $V$ plus a local
correction within each aggregate state. The local correction levels are
obtained by solving a low-dimensional aggregate DP problem, yielding an
arbitrarily close approximation to $J^*$, when the number of aggregate states
is sufficiently large. Except for the bias function, the aggregate DP problem
is similar to the one of the classical aggregation framework, and its
algorithmic solution by simulation or other methods is nearly identical to one
for classical aggregation, assuming values of $V$ are available when needed.
","[{""version"":""v1"",""created"":""Sun, 6 Oct 2019 11:51:00 GMT""}]","2019-10-08"
"1910.02427","Yuji Nozawa","Yuji Nozawa, Hirokazu Tsunetsugu","Generalized Hydrodynamic approach to charge and energy currents in the
  one-dimensional Hubbard model","18 pages, 13 figures","Phys. Rev. B 101, 035121 (2020)","10.1103/PhysRevB.101.035121",,"cond-mat.stat-mech cond-mat.str-el math-ph math.MP quant-ph","http://arxiv.org/licenses/nonexclusive-distrib/1.0/","  We have studied nonequilibrium dynamics of the one-dimensional Hubbard model
using the generalized hydrodynamic theory. We mainly investigated the
spatio-temporal profile of charge density, energy density and their currents
using the partitioning protocol; the initial state consists of two
semi-infinite different thermal equilibrium states joined at the origin. In
this protocol, there appears around the origin a transient region where
currents flow. We examined how density and current profiles depend on initial
conditions and have found a clogged region where charge current is zero but
nonvanishing energy current flows. This region appears when one of the initial
states has half-filled electron density. We have proved analytically the
existence of the clogged region in the infinite temperature case of the
half-filled initial state. The existence is confirmed also for finite
temperatures by numerical calculations. A similar analytical proof is also
given for a clogged region of spin current when magnetic field is applied to
one and only one of the two initial states. A universal proportionality of
charge and spin currents is also proved for a special region, for general
initial conditions of electron density and magnetic field. Except for the
clogged region, charge and energy densities are in good proportion to each
other, and their ratio depends on the initial conditions. This proportionality
in nonequilibrium dynamics is reminiscent of Wiedemann-Franz law in thermal
equilibrium. The long-time stationary values of charge and energy currents were
also studied with varying initial conditions. We have compared the results with
the values of non-interacting systems and discussed the effects of electron
correlations. We have found that the temperature dependence of the ratio of
these stationary currents is strongly suppressed by electron correlations and
even reversed.
","[{""version"":""v1"",""created"":""Sun, 6 Oct 2019 11:51:18 GMT""},{""version"":""v2"",""created"":""Mon, 9 Dec 2019 20:35:17 GMT""}]","2020-01-22"
"1910.02428","Malihe Yousofzadeh","Malihe Yousofzadeh","Classification of bases of twisted affine root supersystems",,,,,"math.QA","http://arxiv.org/licenses/nonexclusive-distrib/1.0/","  Following the definition of a root basis of an affine root system, we define
a base of the root system of an affine Lie superalgebra to be a linearly
independent subset $B$ of its root system such that each root can be written as
a linear combination of elements of $B$ with integral coefficients such that
all coefficients are nonnegative or all coefficients are nonpositive.
Characterization and classification of bases of root systems of affine Lie
algebras are known in the literature; in fact, up to $\pm 1$-multiple, each
base of an affine root system is conjugate with the standard base under the
Weyl group action. In the super case, the existence of those self-orthogonal
roots which are not orthogonal to at least one other root, makes the situation
more complicated. In this work, we give a complete characterization of bases of
a twisted affine root supersystem. We precisely describe and classify them.
","[{""version"":""v1"",""created"":""Sun, 6 Oct 2019 11:55:41 GMT""}]","2019-10-08"
"1910.02429","Dongsu Ryu","Ji-Hoon Ha (1), Dongsu Ryu (1), and Hyesung Kang (2) ((1) UNIST,
  Korea, (2) Pusan National University, Korea)","Gamma-ray and Neutrino Emissions due to Cosmic-Ray Protons Accelerated
  at Intracluster Shocks in Galaxy Clusters","submitted to ApJ; revised by including reacceleration",,"10.3847/1538-4357/ab7c5b",,"astro-ph.HE","http://arxiv.org/licenses/nonexclusive-distrib/1.0/","  We examine the cosmic-ray protons (CRp) accelerated at collisionless shocks
in galaxy clusters using cosmological structure formation simulations. We find
that in the intracluster medium (ICM) within the virial radius of simulated
clusters, only $\sim7$\% of shock kinetic energy flux is dissipated by the
shocks that are expected to accelerate CRp, that is, supercritical,
quasi-parallel ($Q_\parallel$) shocks with sonic Mach number $M_s\ge2.25$. The
rest is dissipated at subcritical shocks and quasi-perpendicular shocks, both
of which may not accelerate CRp. Adopting the diffusive shock acceleration
(DSA) model recently presented in Ryu et al. (2019), we quantify the DSA of CRp
in simulated clusters. The average fraction of the shock kinetic energy
transferred to CRp via DSA is assessed at $\sim(1-2)\times10^{-4}$. We also
examine the energization of CRp through reacceleration using a model based on
the test-particle solution. Assuming that the ICM plasma passes through shocks
three times on average through the history of the universe and that CRp are
reaccelerated only at supercritical $Q_\parallel$-shocks, the CRp spectrum
flattens by $\sim0.05-0.1$ in slope and the total amount of CRp energy
increases by $\sim40-80$\% from reacceleration. We then estimate diffuse
$\gamma$-ray and neutrino emissions, resulting from inelastic collisions
between CRp and thermal protons. The predicted $\gamma$-ray emissions from
simulated clusters lie mostly below the upper limits set by Fermi-LAT for
observed clusters. The neutrino fluxes towards nearby clusters would be
$\lesssim10^{-4}$ of the IceCube flux at $E_{\nu}=1$ PeV and $\lesssim10^{-6}$
of the atmospheric neutrino flux in the energy range of $E_{\nu}\leq1$ TeV.
","[{""version"":""v1"",""created"":""Sun, 6 Oct 2019 11:56:44 GMT""},{""version"":""v2"",""created"":""Fri, 14 Feb 2020 08:52:29 GMT""}]","2020-04-08"
"1910.02430","Sergey Zelik V.","Qingquan Chang, Dandan Li, Chunyou Sun and Sergey Zelik","Deterministic and random attractors for a wave equation with sign
  changing damping",,,,,"math.AP","http://arxiv.org/licenses/nonexclusive-distrib/1.0/","  The paper gives a detailed study of long-time dynamics generated by weakly
damped wave equations in bounded 3D domains where the damping exponent depends
explicitly on time and may change sign. It is shown that in the case when the
non-linearity is superlinear, the considered equation remains dissipative if
the weighted mean value of the dissipation rate remains positive and that the
conditions of this type are not sufficient in the linear case. Two principally
different cases are considered. In the case when this mean is uniform (which
corresponds to deterministic dissipation rates), it is shown that the
considered system possesses smooth uniform attractors as well as non-autonomous
exponential attractors. In the case where the mean is not uniform (which
corresponds to the random dissipation rate, for instance, when this dissipation
rate is generated by the Bernoulli process), the tempered random attractor is
constructed. In contrast to the usual situation, this random attractor is
expected to have infinite Hausdorff and fractal dimension. The simplified model
example which demonstrates infinite-dimensionality of the random attractor is
also presented.
","[{""version"":""v1"",""created"":""Sun, 6 Oct 2019 12:00:37 GMT""}]","2019-10-08"
"1910.02431","Shou-Jun Xu","Zhuo Pan, Yu Yang, Xianyue Li, Shou-Jun Xu","The complexity of total edge domination and some related results on
  trees","24 pages, 15 figures, 17 references",,,,"math.CO","http://arxiv.org/licenses/nonexclusive-distrib/1.0/","  For a graph $G = (V, E)$ with vertex set $V$ and edge set $E$, a subset $F$
of $E$ is called an $\emph{edge dominating set}$ (resp. a $\emph{total edge
dominating set}$) if every edge in $E\backslash F$ (resp. in $E$) is adjacent
to at least one edge in $F$, the minimum cardinality of an edge dominating set
(resp. a total edge dominating set) of $G$ is the {\em edge domination number}
(resp. {\em total edge domination number}) of $G$, denoted by $\gamma^{'}(G)$
(resp. $\gamma_t^{'}(G)$). In the present paper, we prove that the total edge
domination problem is NP-complete for bipartite graphs with maximum degree 3.
We also design a linear-time algorithm for solving this problem for trees.
Finally, for a graph $G$, we give the inequality $\gamma^{'}(G)\leqslant
\gamma^{'}_{t}(G)\leqslant 2\gamma^{'}(G)$ and characterize the trees $T$ which
obtain the upper or lower bounds in the inequality.
","[{""version"":""v1"",""created"":""Sun, 6 Oct 2019 12:02:08 GMT""},{""version"":""v2"",""created"":""Sun, 13 Oct 2019 09:50:20 GMT""}]","2019-10-15"
"1910.02432","Mikhail G. Katz","Mikhail G. Katz","Convexity, critical points, and connectivity radius","4 pages, published in Proceedings of the American Mathematical
  Society","Proceedings of the American Mathematical Society 148 (2020) no. 3,
  1279-1281","10.1090/proc/14892",,"math.DG","http://arxiv.org/licenses/nonexclusive-distrib/1.0/","  We study the level sets of the distance function from a boundary point of a
convex set in Euclidean space. We provide a lower bound for the range of
connectivity of the level sets, in terms of the critical points of the distance
function in the sense of Grove-Shiohama-Gromov-Cheeger.
","[{""version"":""v1"",""created"":""Sun, 6 Oct 2019 12:09:28 GMT""},{""version"":""v2"",""created"":""Wed, 8 Jan 2020 14:28:19 GMT""}]","2020-01-09"
"1910.02433","Mimi Zhang Dr","Mimi Zhang","Weighted Clustering Ensemble: A Review",,"Pattern Recognition, 2022","10.1016/j.patcog.2021.108428",,"cs.CV stat.ML","http://creativecommons.org/licenses/by-nc-nd/4.0/","  Clustering ensemble, or consensus clustering, has emerged as a powerful tool
for improving both the robustness and the stability of results from individual
clustering methods. Weighted clustering ensemble arises naturally from
clustering ensemble. One of the arguments for weighted clustering ensemble is
that elements (clusterings or clusters) in a clustering ensemble are of
different quality, or that objects or features are of varying significance.
However, it is not possible to directly apply the weighting mechanisms from
classification (supervised) domain to clustering (unsupervised) domain, also
because clustering is inherently an ill-posed problem. This paper provides an
overview of weighted clustering ensemble by discussing different types of
weights, major approaches to determining weight values, and applications of
weighted clustering ensemble to complex data. The unifying framework presented
in this paper will help clustering practitioners select the most appropriate
weighting mechanisms for their own problems.
","[{""version"":""v1"",""created"":""Sun, 6 Oct 2019 12:16:29 GMT""},{""version"":""v2"",""created"":""Tue, 23 Nov 2021 15:14:19 GMT""}]","2021-12-14"
"1910.02434","Yuguang Wang","Shao-Bo Lin, Yu Guang Wang, Ding-Xuan Zhou","Distributed filtered hyperinterpolation for noisy data on the sphere","26 pages, 4 figures",,,,"math.CA cs.DC cs.LG cs.NA math.NA math.PR","http://arxiv.org/licenses/nonexclusive-distrib/1.0/","  Problems in astrophysics, space weather research and geophysics usually need
to analyze noisy big data on the sphere. This paper develops distributed
filtered hyperinterpolation for noisy data on the sphere, which assigns the
data fitting task to multiple servers to find a good approximation of the
mapping of input and output data. For each server, the approximation is a
filtered hyperinterpolation on the sphere by a small proportion of quadrature
nodes. The distributed strategy allows parallel computing for data processing
and model selection and thus reduces computational cost for each server while
preserves the approximation capability compared to the filtered
hyperinterpolation. We prove quantitative relation between the approximation
capability of distributed filtered hyperinterpolation and the numbers of input
data and servers. Numerical examples show the efficiency and accuracy of the
proposed method.
","[{""version"":""v1"",""created"":""Sun, 6 Oct 2019 12:28:08 GMT""}]","2019-10-08"
"1910.02435","Yutaka Ookouchi","Issei Koga, Sachiko Kuroyanagi and Yutaka Ookouchi","Instability of Higgs Vacuum via String Cloud","13 pages, 4 figures, v2: refs and appendix added, typos fixed, fig 2,
  3 modified. to appear in Phys. Lett. B",,"10.1016/j.physletb.2019.135093",,"hep-th hep-ph","http://arxiv.org/licenses/nonexclusive-distrib/1.0/","  We study the instability of the Higgs vacuum caused by a cloud of strings. By
catalysis, the decay rate of the vacuum is highly enhanced and, when the energy
density of the cloud is larger than the critical value, a semi-classical vacuum
decay occurs. We also discuss the relation between the string cloud and
observational constraints on the cosmic strings from the viewpoint of the
catalysis, which are converted into bounds on the parameters of the Higgs
potential.
","[{""version"":""v1"",""created"":""Sun, 6 Oct 2019 12:41:38 GMT""},{""version"":""v2"",""created"":""Thu, 14 Nov 2019 05:10:15 GMT""}]","2020-01-08"
"1910.02436","Annabelle (Inbal) Oz","Annabelle Oz, Oded Hod, and Abraham Nitzan","A Numerical Approach to Non-Equilibrium Quantum Thermodynamics:
  Non-Perturbative Treatment of the Driven Resonant Level Model based on the
  Driven Liouville von-Neumann Formalism",,,,,"cond-mat.mes-hall","http://arxiv.org/licenses/nonexclusive-distrib/1.0/","  Non-equilibrium thermodynamics of the driven resonant level model is studied
using numerical simulations based on the driven Liouville von-Neumann
formalism. The approach is first validated against recently obtained analytical
results for quasi-static level shifts and the corresponding first order
corrections. The numerical approach is then used to study far-from-equilibrium
thermodynamic properties of the system under finite level shift rates. The
proposed methodology allows the study of unexplored non-equilibrium
thermodynamic regimes in open quantum systems.
","[{""version"":""v1"",""created"":""Sun, 6 Oct 2019 12:42:18 GMT""}]","2019-10-08"
"1910.02437","Hao Wu","Hao Wu","Exponential mixing property for H\'enon-Sibony maps of $\mathbb{C}^k$",,,,,"math.DS math.CV","http://arxiv.org/licenses/nonexclusive-distrib/1.0/","  Let $f$ be a H\'enon-Sibony map (regular polynomial automorphism) of
$\mathbb{C}^k$ and let $\mu$ be the equilibrium measure of $f$. In this paper
we prove that $\mu$ is exponentially mixing for plurisubharmonic test
functions.
","[{""version"":""v1"",""created"":""Sun, 6 Oct 2019 12:42:40 GMT""},{""version"":""v2"",""created"":""Wed, 4 Aug 2021 01:50:35 GMT""}]","2021-08-05"
"1910.02438","Edoardo Galimberti","Francesco Bonchi, Edoardo Galimberti, Aristides Gionis, Bruno
  Ordozgoiti, Giancarlo Ruffo","Discovering Polarized Communities in Signed Networks",,"CIKM 2019, November 3-7, 2019, Beijing, China",,,"cs.DS cs.SI","http://arxiv.org/licenses/nonexclusive-distrib/1.0/","  Signed networks contain edge annotations to indicate whether each interaction
is friendly (positive edge) or antagonistic (negative edge). The model is
simple but powerful and it can capture novel and interesting structural
properties of real-world phenomena. The analysis of signed networks has many
applications from modeling discussions in social media, to mining user reviews,
and to recommending products in e-commerce sites. In this paper we consider the
problem of discovering polarized communities in signed networks. In particular,
we search for two communities (subsets of the network vertices) where within
communities there are mostly positive edges while across communities there are
mostly negative edges. We formulate this novel problem as a ""discrete
eigenvector"" problem, which we show to be NP-hard. We then develop two
intuitive spectral algorithms: one deterministic, and one randomized with
quality guarantee $\sqrt{n}$ (where $n$ is the number of vertices in the
graph), tight up to constant factors. We validate our algorithms against
non-trivial baselines on real-world signed networks. Our experiments confirm
that our algorithms produce higher quality solutions, are much faster and can
scale to much larger networks than the baselines, and are able to detect
ground-truth polarized communities.
","[{""version"":""v1"",""created"":""Sun, 6 Oct 2019 12:44:56 GMT""}]","2019-10-08"
"1910.02439","Michal Silarski","P. Sibczy\'nski, M. Silarski, O. Bezshyyko, V. Ivanyan, E. Kubicz, Sz.
  Nied\'zwiecki, P. Moskal, J. Raj, S. Sharma and O. Trofimiuk","Monte Carlo N-Particle simulations of an underwater chemical threats
  detection system using neutron activation analysis","14 pages, 5 figures","JINST 14 P0900 (2019)","10.1088/1748-0221/14/09/P09001",,"physics.ins-det","http://arxiv.org/licenses/nonexclusive-distrib/1.0/","  In this paper we present Monte Carlo N-Particle (MCNP) simulations of the
system for underwater threat detection using neutron activation analysis
developed in the SABAT project. The simulated system is based on a D-T neutron
generator emitting 14~MeV neutrons without associated $\alpha$ particle
detection and equipped with a LaBr$_3$:Ce scintillation detector offering
superior energy resolution and allowing for precise identification of
activation $\gamma$ quanta. The performed simulations show that using the
neutron activation analysis method with the designed geometry we are able to
identify $\gamma$-rays from hydrogen, carbon, sulphur and chlorine originating
from mustard gas in a sea water environment. Our results show that the most
efficient way of mustard gas detection is to compare the integral peak ratio
for Cl and H.
","[{""version"":""v1"",""created"":""Sun, 6 Oct 2019 12:49:29 GMT""}]","2019-10-08"
"1910.02440","Umut Caliskan","Umut Caliskan and Volkan Patoglu","Efficacy of Haptic Pedal Feel Compensation on Driving with Regenerative
  Braking",,,,,"cs.RO cs.HC","http://creativecommons.org/licenses/by/4.0/","  We study the efficacy of haptic pedal feel compensation on driving safety and
performance during regenerative braking. In particular, we evaluate the
effectiveness of the preservation of the natural brake pedal feel under
two-pedal cooperative braking and one-pedal driving scenarios, through human
subject experiments in a simulated vehicle pursuit task. The experimental
results indicate that pedal feel compensation can significantly decrease the
hard braking instances, improving safety for both two-pedal cooperative braking
and one-pedal driving. Volunteers also strongly prefer compensation, while they
equally prefer and can effectively utilize both two-pedal and one-pedal driving
conditions. Furthermore, the beneficial effects of haptic pedal feel
compensation is larger for the two-pedal cooperative braking case.
","[{""version"":""v1"",""created"":""Sun, 6 Oct 2019 12:49:44 GMT""}]","2019-10-08"
"1910.02441","Ulf Leonhardt","Ulf Leonhardt","Lifshitz theory of the cosmological constant",,"Ann. Phys. (NY) open access 2019","10.1016/j.aop.2019.167973",,"gr-qc","http://arxiv.org/licenses/nonexclusive-distrib/1.0/","  Astrophysics has given empirical evidence for the cosmological constant that
accelerates the expansion of the universe. Atomic, Molecular, and Optical
Physics has proven experimentally that the quantum vacuum exerts forces - the
van der Waals and Casimir forces - on neutral matter. It has long been
conjectured [Ya. B. Zel'dovich, Usp. Fiz. Nauk 95, 209 (1968)] that the two
empirical facts, the cosmological constant and the Casimir force, have a common
theoretical explanation, but all attempts of deriving both from a unified
theory in quantitative detail have not been successful so far. In AMO Physics,
Lifshitz theory has been the standard theoretical tool for describing the
measured forces of the quantum vacuum. This paper develops a version of
Lifshitz theory that also accounts for the electromagnetic contribution to the
cosmological constant. Assuming that the other fields of the Standard Model
behave similarly, gives a possible quantum-optical explanation for what has
been called dark energy.
","[{""version"":""v1"",""created"":""Sun, 6 Oct 2019 12:50:21 GMT""}]","2019-10-08"
"1910.02442","Yuchao Dai Dr.","Liyuan Pan, Yuchao Dai, Miaomiao Liu, Fatih Porikli, Quan Pan","Joint Stereo Video Deblurring, Scene Flow Estimation and Moving Object
  Segmentation","Accepted by IEEE Transactions on Image Processing 2019. arXiv admin
  note: text overlap with arXiv:1704.03273",,"10.1109/TIP.2019.2945867",,"cs.CV","http://arxiv.org/licenses/nonexclusive-distrib/1.0/","  Stereo videos for the dynamic scenes often show unpleasant blurred effects
due to the camera motion and the multiple moving objects with large depth
variations. Given consecutive blurred stereo video frames, we aim to recover
the latent clean images, estimate the 3D scene flow and segment the multiple
moving objects. These three tasks have been previously addressed separately,
which fail to exploit the internal connections among these tasks and cannot
achieve optimality. In this paper, we propose to jointly solve these three
tasks in a unified framework by exploiting their intrinsic connections. To this
end, we represent the dynamic scenes with the piece-wise planar model, which
exploits the local structure of the scene and expresses various dynamic scenes.
Under our model, these three tasks are naturally connected and expressed as the
parameter estimation of 3D scene structure and camera motion (structure and
motion for the dynamic scenes). By exploiting the blur model constraint, the
moving objects and the 3D scene structure, we reach an energy minimization
formulation for joint deblurring, scene flow and segmentation. We evaluate our
approach extensively on both synthetic datasets and publicly available real
datasets with fast-moving objects, camera motion, uncontrolled lighting
conditions and shadows. Experimental results demonstrate that our method can
achieve significant improvement in stereo video deblurring, scene flow
estimation and moving object segmentation, over state-of-the-art methods.
","[{""version"":""v1"",""created"":""Sun, 6 Oct 2019 12:55:47 GMT""}]","2020-01-08"
