"1910.02389","Graham White","Graham White","A variation of strong stationary times for random walks with partial
  symmetries",,,,,"math.PR","http://arxiv.org/licenses/nonexclusive-distrib/1.0/","  We introduce a variation of strong stationary times for random walks on the
symmetric group. Rather than proceed in the usual fashion of accumulating
larger and larger blocks of cards which may be in any order, we wait for pairs
of cards to `interact', and bound the mixing time by the time taken for enough
interactions to occur.
","[{""version"":""v1"",""created"":""Sun, 6 Oct 2019 07:05:36 GMT""}]","2019-10-08"
"1910.02390","Amber Nigam","Amber Nigam, Pragati Jaiswal, Uma Girkar, Teertha Arora, and Leo A.
  Celi","Migration through Machine Learning Lens -- Predicting Sexual and
  Reproductive Health Vulnerability of Young Migrants","Accepted for Machine Learning for Health (ML4H) at NeurIPS 2019 -
  Extended Abstract",,,,"cs.LG cs.CY stat.ML","http://arxiv.org/licenses/nonexclusive-distrib/1.0/","  In this paper, we have discussed initial findings and results of our
experiment to predict sexual and reproductive health vulnerabilities of
migrants in a data-constrained environment. Notwithstanding the limited
research and data about migrants and migration cities, we propose a solution
that simultaneously focuses on data gathering from migrants, augmenting
awareness of the migrants to reduce mishaps, and setting up a mechanism to
present insights to the key stakeholders in migration to act upon. We have
designed a webapp for the stakeholders involved in migration: migrants, who
would participate in data gathering process and can also use the app for
getting to know safety and awareness tips based on analysis of the data
received; public health workers, who would have an access to the database of
migrants on the app; policy makers, who would have a greater understanding of
the ground reality, and of the patterns of migration through machine-learned
analysis. Finally, we have experimented with different machine learning models
on an artificially curated dataset. We have shown, through experiments, how
machine learning can assist in predicting the migrants at risk and can also
help in identifying the critical factors that make migration dangerous for
migrants. The results for identifying vulnerable migrants through machine
learning algorithms are statistically significant at an alpha of 0.05.
","[{""version"":""v1"",""created"":""Sun, 6 Oct 2019 07:09:13 GMT""},{""version"":""v2"",""created"":""Thu, 17 Oct 2019 03:56:45 GMT""},{""version"":""v3"",""created"":""Fri, 15 Nov 2019 20:14:39 GMT""},{""version"":""v4"",""created"":""Fri, 22 Nov 2019 10:00:02 GMT""}]","2019-11-25"
"1910.02391","Guy Cohen","Hristiana Atanasova, Alexander I. Lichtenstein and Guy Cohen","Correlated nonequilibrium steady states without energy flux",,"Phys. Rev. B 101, 174316 (2020)","10.1103/PhysRevB.101.174316",,"cond-mat.str-el cond-mat.quant-gas physics.atom-ph","http://arxiv.org/licenses/nonexclusive-distrib/1.0/","  Floquet engineering of closed quantum systems can lead to the formation of
long-lived prethermal states that, in general, eventually thermalize to
infinite temperature. Coupling these driven systems to dissipative baths can
stabilize such states, establishing a true nonequilibrium steady state. We
demonstrate that in a certain strongly interacting lattice model coupled to a
bath and driven by an electric field, such steady states can have the
remarkable property that the cycle-averaged rate of energy transfer between the
lattice and the baths vanishes. Despite this, we show that these states retain
a clear nonequilibrium nature.
","[{""version"":""v1"",""created"":""Sun, 6 Oct 2019 07:28:49 GMT""},{""version"":""v2"",""created"":""Mon, 1 Jun 2020 11:17:20 GMT""}]","2020-06-02"
"1910.02392","Jing Wang","J. Wang, D. W. Xu, Y. Wang, J. B. Zhang, J. Zheng and J. Y. Wei","Two New ""Turn-off"" Changing-look Active Galactic nuclei and Implication
  on ""Partially Obscured"" AGNs","10 pages, 6 figures and 2 tables, accepted by ApJ",,"10.3847/1538-4357/ab4d90",,"astro-ph.GA","http://arxiv.org/licenses/nonexclusive-distrib/1.0/","  We here report a spectroscopic identification of two new changing-look AGNs
(CL-AGNs): SDSS\,J104705.16+544405.8 and SDSS\,J120447.91+170256.8 both with a
""turn-off"" type transition from type 1 to type 1.8/1.9. The identification is
arrived by a follow-up spectroscopic observation of the five changing-look AGN
(CL-AGN) candidates that are extracted from the sample recently released in
Macleod et al. The candidates are extract by the authors from the Sloan Digit
Sky Survey Data Release 7 spectroscopically confirmed quasars with large
amplitude variability. By compiling a sample of 26 previously identified
CL-AGNs, we confirm the claim in Macleod et al. that CL-AGNs tend to be biased
against low Eddington ratio, and identify an overlap between the CL-AGNs at
their dim state and the so-called intermediate-type AGNs. The overlap implies
that there two populations of the intermediate-type AGNs with different
origins. One is due to the torus orientation effect, and the another the
intrinsic change of the accretion rate of the central supermassive blackholes.
","[{""version"":""v1"",""created"":""Sun, 6 Oct 2019 07:38:31 GMT""}]","2020-01-08"
"1910.02393","Mingyu Ge Dr.","G. C. Xiao (1,2), L. Ji (3), R. Staubert (3), M. Y. Ge (1), S. Zhang
  (1,2), S. N. Zhang (1,2), A. Santangelo (3), L. Ducci (3), J. Y. Liao (1), C.
  C. Guo (1,2), X. B. Li (1), W. Zhang (1,2), J. L. Qu (1,2), F. J. Lu (1), T.
  P. Li (1,2,4), L. M. Song (1,2), Y. P. Xu (1), Q. C. Bu (1), C. Cai (1), X.
  L. Cao (1), Z. Chang (1), G. Chen (1), L. Chen (5), T. X. Chen (1), Y. B.
  Chen (4), Y. Chen (1), Y. P. Chen (1), W. Cui (1,4), W. W. Cui (1), J. K.
  Deng (4), Y. W. Dong (1), Y. Y. Du (1), M. X. Fu (4), G. H. Gao (1,2), H. Gao
  (1,2), M. Gao (1), Y. D. Gu (1), J. Guan (1), C. Gungor (1), C.C. Guo (1,2),
  D. W. Han (1), Y. Huang (1), J. Huo (1), S. M. Jia (1), L. H. Jiang (1), W.
  C. Jiang (1), J. Jin (1), L. D. Kong (1,2), B. Li (1), C. K. Li (1), G. Li
  (1), M. S. Li (1), W. Li (1), X. Li (1), X. F. Li (1), Y. G. Li (1), Z. W. Li
  (1), X. H. Liang (1), C. Z. Liu (1), G. Q. Liu (4), H. W. Liu (1), X. J. Liu
  (1), Y. N. Liu (6), B. Lu (1), X. F. Lu (1), Q. Luo (1), T. Luo (1), X. Ma
  (1), B. Meng (1), Y. Nang (1,2), J. Y. Nie (1), G. Ou (1), N. Sai (1,2), S.X.
  Song (1), L. Sun (1), Y. Tan (1), L. Tao (1), Y. L. Tuo (1,2), C. Wang (2,7),
  G. F. Wang (1), J. Wang (1), W. S. Wang (1), Y. S. Wang (1), X. Y. Wen (1),
  B. B. Wu (1), B. Y. Wu (1,2), M. Wu (1), S. L. Xiong (1), J. W. Yang (1),
  S.Yang (1), Y. J. Yang (1), Y. J. Yang (1), Q. B. Yin (1,2), Q. Q. Yin (1),
  A. M. Zhang (1), C. M. Zhang (1), F. Zhang (1), H. M. Zhang (1), J. Zhang
  (1), T. Zhang (1), W. Zhang (1,2), W. C. Zhang (1), W. Z. Zhang (5), Y. Zhang
  (1), Y. Zhang (1,2), Y. F. Zhang (1), Y. J. Zhang (1), Z. Zhang (4), Z. Zhang
  (5), Z. L. Zhang (1), H. S. Zhao (1), X. F. Zhao (1,2), S. J. Zheng (1), J.
  F. Zhou (6), Y. Zhu (1), Y. X. Zhu (1) ((1) Key Laboratory of Particle
  Astrophysics, Institute of High Energy Physics, Chinese Academy of Sciences,
  Beijing, China, (2) University of Chinese Academy of Sciences, Chinese
  Academy of Sciences, Beijing, China, (3) Institut f\""ur Astronomie und
  Astrophysik, T\""ubingen, Germany, (4) Department of Physics, Tsinghua
  University, Beijing, China, (5) Department of Astronomy, Beijing Normal
  University, Beijing, China, (6) Department of Engineering Physics, Tsinghua
  University, Beijing, China, (7) Key Laboratory of Space Astronomy and
  Technology, National Astronomical Observatories, Chinese Academy of Sciences,
  Beijing)","Constant cyclotron line energy in Hercules X-1 -- Joint Insight-HXMT and
  NuSTAR observations",,,,,"astro-ph.HE","http://arxiv.org/licenses/nonexclusive-distrib/1.0/","  The long-term evolution of the centroid energy of the CRSF in Her X-1 is
still a mystery. We report a new measurement from a campaign between {\sl
Insight}-HXMT and {\sl NuSTAR} performed in February 2018. Generally, the two
satellites show well consistent results of timing and spectral properties. The
joint spectral analysis confirms that the previously observed long decay phase
has ended, and that the line energy instead keeps constant around 37.5 keV
after flux correction.
","[{""version"":""v1"",""created"":""Sun, 6 Oct 2019 07:55:03 GMT""}]","2019-10-08"
"1910.02394","Sylvester Eriksson-Bique","Jeff Cheeger and Sylvester Eriksson-Bique","Thin Loewner carpets and their quasisymmetric embeddings in $S^2$","60 Pages, 9 figures, comments welcome. Edited with a slightly
  stronger result and correcting typos. Acknowledgements and relation to prior
  work by Bruce Kleiner and Mario Bonk clarified and expanded",,,,"math.MG math.CA math.DG","http://arxiv.org/licenses/nonexclusive-distrib/1.0/","  A carpet is a metric space which is homeomorphic to the standard Sierpi\'nski
carpet in $\mathbb{R}^2$, or equivalently, in $S^2$. A carpet is called thin if
its Hausdorff dimension is $<2$. A metric space is called Q-Loewner if its
$Q$-dimensional Hausdorff measure is Q-Ahlfors regular and if it satisfies a
$(1,Q)$-Poincar\'e inequality. As we will show, $Q$-Loewner planar metric
spaces are always carpets, and admit quasisymmetric embeddings into the plane.
In this paper, for every pair $(Q,Q')$, with $1<Q<Q'< 2$ we construct
infinitely many pairwise quasi-symmetrically distinct $Q$-Loewner carpets $X$
which admit explicit snowflake embeddings, $f: X\to S^2$, for which the image,
$f(X)$, admits an explicit description and is $Q'$-Ahlfors regular. In
particular, these $f$ are quasisymmetric embeddings. By a result of Tyson, the
Hausdorff dimension of a Loewner space cannot be lowered by a quasisymmetric
homeomorphism. By definition, this means that the carpets $X$ and $f(X)$
realize their conformal dimension. Each of images $f(X)$ can be further
uniformized via post composition with a quasisymmetric homeomorphism of $S^2$,
so as to yield a circle carpet and also a square carpet. Our Loewner carpets
$X$ are constructed via what we call an admissable quotiented inverse system.
This mechanism extends the inverse limit construction for PI spaces given in
\cite{cheegerkleinerinverse}, which however, does not yield carpets. Loewner
spaces are a particular subclass of PI spaces. They have strong rigidity
properties which which do not hold for PI spaces in general.
","[{""version"":""v1"",""created"":""Sun, 6 Oct 2019 08:08:27 GMT""},{""version"":""v2"",""created"":""Wed, 8 Apr 2020 14:09:47 GMT""}]","2020-04-09"
"1910.02395","Si-Yu Li","Hua Zhai, Si-Yu Li, Mingzhe Li and Xinmin Zhang","Joint constraint on primordial gravitational waves and polarization
  rotation angle with current CMB polarization data","8 pages, 2 figures",,"10.1016/j.physletb.2020.135240",,"astro-ph.CO hep-ph hep-th","http://arxiv.org/licenses/nonexclusive-distrib/1.0/","  Cosmological CPT violation will rotate the polarized direction of CMB
photons, convert partial CMB E mode into B mode and vice versa. It will
generate non-zero EB, TB spectra and change the EE, BB, TE spectra. This
phenomenon gives us a way to detect the CPT-violation signature from CMB
observations, and also provides a new mechanism to produce B mode polarization.
In this paper, we perform a global analysis on tensor-to-scalar ratio $r$ and
polarization rotation angles based on current CMB datasets with both low $\ell$
(Planck, BICEP2/Keck Array) and high $\ell$ (POLARBEAR, SPTpol, ACTPol).
Benefited from the high precision of CMB data, we obtain the isotropic rotation
angle $\bar{\alpha} = -0.01^\circ \pm 0.37^\circ $ at 68% C.L., the variance of
the anisotropic rotation angles $C^{\alpha}(0)<0.0032\,\mathrm{rad}^2$, the
scale invariant power spectrum $D^{\alpha\alpha}_{\ell \in [2, 350]}<4.71\times
10^{-5} \,\mathrm{rad}^2$ and $r<0.057$ at 95% C.L.. Our result shows that with
the polarization rotation effect, the 95% upper limit on $r$ gets tightened by
17%.
","[{""version"":""v1"",""created"":""Sun, 6 Oct 2019 08:18:52 GMT""}]","2020-01-22"
"1910.02396","Xueheng Shi","Xueheng Shi, Colin Gallagher","Estimating Unknown Cycles in Geophysical data",,,,,"stat.ME","http://arxiv.org/licenses/nonexclusive-distrib/1.0/","  Examples of cyclic (periodic) behavior in geophysical data abound. In many
cases the primary period is known, such as in daily measurements of rain,
temperature, and sea level. However, many time series of measurements contain
cycles of unknown or varying length. We consider the problem of estimating the
unknown period in a time series.We review the basic methods, compare their
performance through a simulation studyusing observed sea level data, apply them
to an astronomical data set, and discuss generalizations of the methods.
","[{""version"":""v1"",""created"":""Sun, 6 Oct 2019 08:33:03 GMT""}]","2019-10-08"
"1910.02397","Christian Koch","Christian Koch, Arne-Tobias Rak, Michael Zink, Ralf Steinmetz, Amr
  Rizk","Increasing the Quality of 360{\deg} Video Streaming by Transitioning
  between Viewport Quality Adaptation Mechanisms","Our code: https://github.com/arizk/360transitions",,,,"cs.NI","http://creativecommons.org/licenses/by/4.0/","  Virtual reality has been gaining popularity in recent years caused by the
proliferation of affordable consumer-grade devices such as Oculus Rift, HTC
Vive, and Samsung VR. Amongst the various VR applications, 360{\deg} video
streaming is currently one of the most popular ones. It allows user to change
their field-of-view (FoV) based on head movement, which enables them to freely
select an area anywhere from the sphere the video is (virtually) projected to.
While 360{\deg} video streaming offers new exciting ways of consuming content
for viewers, it poses a series of challenges to the systems that are
responsible for the distribution of such content from the origin to the viewer.
One challenge is the significantly increased bandwidth requirement for
streaming such content in real time. Recent research has shown that only
streaming the content that is in the user's FoV in high quality can lead to
strong bandwidth savings. This can be achieved by analyzing the viewers head
orientation and movement based on sensor information. Alternatively, historic
information from users that watched the content in the past can be taken into
account to prefetch 360{\deg} video data in high quality assuming the viewer
will direct the FoV to these areas. In this paper, we present a 360{\deg} video
streaming system that transitions between sensor- and content-based predictive
mechanisms. We evaluate the effects of this transition-based approach on the
Quality of Experience (QoE) of such a VR streaming system and show that the
perceived quality can be increased between 50\% and 80\% compared to systems
that only apply either one of the two approaches.
","[{""version"":""v1"",""created"":""Sun, 6 Oct 2019 08:36:28 GMT""}]","2019-10-08"
"1910.02398","Yashuai Cao","Yashuai Cao, Tiejun Lv, Wei Ni","Intelligent Reflecting Surface Aided Multi-User Millimeter-Wave
  Communications for Coverage Enhancement","Published in IEEE PIMRC 2020",,"10.1109/PIMRC48278.2020.9217160",,"eess.SP","http://arxiv.org/licenses/nonexclusive-distrib/1.0/","  Intelligent reflecting surface (IRS) is envisioned as a promising solution
for controlling radio propagation environments in future wireless systems. In
this paper, we propose a distributed intelligent reflecting surface (IRS)
assisted multi-user millimeter wave (mmWave) system, where IRSs are exploited
to enhance the mmWave signal coverage when direct links between base station
and users are unavailable. First, a joint active and passive beamforming
problem is established for weighted sum-rate maximization. Then, an alternating
iterative algorithm with closed-form expressions is proposed to tackle the
challenging non-convex problem, thereby decoupling the active and passive
beamforming variables. Moreover, we design a constraint relaxation technique to
address the unit modulus constraints pertaining to the IRS. Numerical results
demonstrate that the distributed IRS can potentially enhance the communication
performance of existing wireless systems.
","[{""version"":""v1"",""created"":""Sun, 6 Oct 2019 08:50:00 GMT""},{""version"":""v2"",""created"":""Fri, 30 Oct 2020 07:21:39 GMT""}]","2020-11-02"
"1910.02399","Ayaka Usui MSc","Ayaka Usui, Thom\'as Fogarty, Steve Campbell, Simon A. Gardiner,
  Thomas Busch","Spin-orbit coupling in the presence of strong atomic correlations","21 pages, 9 figures","New J. Phys. 22 013050 (2020)","10.1088/1367-2630/ab6576",,"cond-mat.quant-gas quant-ph","http://arxiv.org/licenses/nonexclusive-distrib/1.0/","  We explore the influence of contact interactions on a synthetically
spin-orbit coupled system of two ultracold trapped atoms. Even though the
system we consider is bosonic, we show that a regime exists in which the
competition between the contact and spin-orbit interactions results in the
emergence of a ground state that contains a significant contribution from the
anti-symmetric spin state. This ground state is unique to few-particle systems
and does not exist in the mean-field regime. The transition to this state is
signalled by an inversion in the average momentum from being dominated by
centre-of-mass momentum to relative momentum and also affects the global
entanglement shared between the real- and pseudo-spin spaces. Indeed,
competition between the interactions can also result in avoided crossings in
the groundstate which further enhances these correlations. However, we find
that correlations shared between the pseudo-spin states are strongly depressed
due to the spin-orbit coupling and therefore the system does not contain
spin-spin entanglement.
","[{""version"":""v1"",""created"":""Sun, 6 Oct 2019 08:52:03 GMT""},{""version"":""v2"",""created"":""Fri, 31 Jan 2020 18:15:57 GMT""}]","2020-02-03"
"1910.02400","Yanghao Yu","Yanghao Yu, Qingchun Hou, Yi Ge, Guojing Liu and Ning Zhang","A Linear LMP Model for Active and Reactive Power with Power Loss","6 pages, 6 figures, accepted by IEEE Sustainable Power & Energy
  Conference (iSPEC2019)","2019 IEEE Sustainable Power and Energy Conference (iSPEC),
  Beijing, China, 2019, pp. 1699-1704","10.1109/iSPEC48194.2019.8975321",,"eess.SY cs.SY","http://arxiv.org/licenses/nonexclusive-distrib/1.0/","  Pricing the reactive power is more necessary than ever before because of the
increasing challenge of renewable energy integration on reactive power balance
and voltage control. However, reactive power price is hard to be efficiently
calculated because of the non-linear nature of optimal AC power flow equation.
This paper proposes a linear model to calculate active and reactive power LMP
simultaneously considering power loss. Firstly, a linearized AC power flow
equation is proposed based on an augmented Generation Shift Distribution
Factors (GSDF) matrix. Secondly, a linearized LMP model is derived using GSDF
and loss factors. The formulation of LMP is further decomposed into four
components: energy, congestion, voltage limitation and power loss. Finally, an
iterate algorithm is proposed for calculating LMP with the proposed model. The
performance of the proposed model is validated by the IEEE-118 bus system.
","[{""version"":""v1"",""created"":""Sun, 6 Oct 2019 09:01:20 GMT""}]","2020-07-01"
"1910.02401","Anya Nordskova","Anya Nordskova and Yury Volkov","Faithful actions of braid groups by twists along ADE-configurations of
  spherical objects","v3: minor improvements in the exposition, numerous typos fixed",,,,"math.KT math.AG math.CT math.RT","http://arxiv.org/licenses/nonexclusive-distrib/1.0/","  We prove that the action of a generalized braid group on an enhanced
triangulated categories, generated by spherical twist functors along an
ADE-configuration of $\omega$-spherical objects, is faithful for any integer
$\omega \neq 1$.
","[{""version"":""v1"",""created"":""Sun, 6 Oct 2019 09:21:31 GMT""},{""version"":""v2"",""created"":""Wed, 16 Sep 2020 11:34:23 GMT""},{""version"":""v3"",""created"":""Wed, 4 Nov 2020 20:24:48 GMT""}]","2020-11-06"
"1910.02402","Jes\'us M.F. Castillo","Jes\'us M. F. Castillo, Pierluigi Papini","The separable Jung constant in Banach spaces",,,,,"math.FA","http://arxiv.org/licenses/nonexclusive-distrib/1.0/","  This paper contains a study of the separable form $J_s(\cdot)$ of the
classical Jung constant. We first establish, following Davis \cite{davis}, that
a Banach space $X$ is $1$-separably injective if and only if $J_s(X)=1$. This
characterization is then used for the understanding of new $1$-separably
injective spaces. The last section establishes the inequality
$\frac{1}{2}K(Y)J_s(X)\leq e(Y,X)$ connecting the separable Jung constant,
Kottman's constant and the extension constant for Lipschitz maps, which is then
used to obtain a simple proof of the equality $K(X,c_0)=e(X,c_0)$ of Kalton and
a new characterization of $1$-separable injectivity.
","[{""version"":""v1"",""created"":""Sun, 6 Oct 2019 09:33:31 GMT""},{""version"":""v2"",""created"":""Sat, 2 May 2020 16:05:01 GMT""}]","2020-05-05"
"1910.02403","Tomasz Stanis{\l}awek","Tomasz Stanislawek, Anna Wr\'oblewska, Alicja W\'ojcicka, Daniel
  Ziembicki, Przemyslaw Biecek","Named Entity Recognition -- Is there a glass ceiling?","Accepted to CoNLL 2019","23rd Conference on Computational Natural Language Learning, CoNLL
  2019","10.18653/v1/K19-1058",,"cs.CL","http://arxiv.org/licenses/nonexclusive-distrib/1.0/","  Recent developments in Named Entity Recognition (NER) have resulted in better
and better models. However, is there a glass ceiling? Do we know which types of
errors are still hard or even impossible to correct? In this paper, we present
a detailed analysis of the types of errors in state-of-the-art machine learning
(ML) methods. Our study reveals the weak and strong points of the Stanford,
CMU, FLAIR, ELMO and BERT models, as well as their shared limitations. We also
introduce new techniques for improving annotation, for training processes and
for checking a model's quality and stability. Presented results are based on
the CoNLL 2003 data set for the English language. A new enriched semantic
annotation of errors for this data set and new diagnostic data sets are
attached in the supplementary materials.
","[{""version"":""v1"",""created"":""Sun, 6 Oct 2019 09:35:52 GMT""},{""version"":""v2"",""created"":""Wed, 30 Oct 2019 18:00:41 GMT""}]","2022-11-28"
"1910.02404","Anurag Kaushal","Parijat Banerjee, Adwait Gaikwad, Anurag Kaushal and Gautam Mandal","Quantum quench and thermalization to GGE in arbitrary dimensions and the
  odd-even effect","27+12 pages, 6 figures",,,"TIFR/TH/19-34","hep-th cond-mat.stat-mech","http://arxiv.org/licenses/nonexclusive-distrib/1.0/","  In many quantum quench experiments involving cold atom systems the
post-quench system can be described by a quantum field theory of free scalars
or fermions, typically in a box or in an external potential. We work with free
scalars in arbitrary dimensions generalizing the techniques employed in our
earlier work \cite{Mandal:2015kxi} in 1+1 dimensions. In this paper, we
generalize to $d$ spatial dimensions for arbitrary $d$. The system is
considered in a box much larger than any other scale of interest. We start with
the ground state, or a squeezed state, with a high mass and suddenly quench the
system to zero mass (""critical quench""). We explicitly compute time-dependence
of local correlators and show that at long times they are described by a
generalized Gibbs ensemble (GGE), which, in special cases, reduce to a thermal
(Gibbs) ensemble. The equilibration of {\it local} correlators can be regarded
as `subsystem thermalization' which we simply call 'thermalization' here (the
notion of thermalization here also includes equlibration to GGE). The rate of
approach to equilibrium is exponential or power law depending on whether $d$ is
odd or even respectively. As in 1+1 dimensions, details of the quench protocol
affect the long time behaviour; this underlines the importance of irrelevant
operators at IR in non-equilibrium situations. We also discuss quenches from a
high mass to a lower non-zero mass, and find that in this case the approach to
equilibrium is given by a power law in time, for all spatial dimensions $d$,
even or odd.
","[{""version"":""v1"",""created"":""Sun, 6 Oct 2019 09:39:35 GMT""}]","2019-10-08"
"1910.02405","Jes\'us M.F. Castillo","Jes\'us M. F. Castillo, Manuel Gonz\'alez, Marilda A. Sim\~oes","Universal disposition is not a 3-space property",,,,,"math.FA","http://arxiv.org/licenses/nonexclusive-distrib/1.0/","  We prove that (almost) universal disposition and separable universal
disposition of Banach spaces are not $3$-space properties.
","[{""version"":""v1"",""created"":""Sun, 6 Oct 2019 09:49:45 GMT""}]","2019-10-08"
