"1910.02338","Amirhossein Taghvaei","Amirhossein Taghvaei, Prashant G. Mehta","An Optimal Transport Formulation of the Ensemble Kalman Filter",,,,,"eess.SY cs.SY stat.ML","http://arxiv.org/licenses/nonexclusive-distrib/1.0/","  Controlled interacting particle systems such as the ensemble Kalman filter
(EnKF) and the feedback particle filter (FPF) are numerical algorithms to
approximate the solution of the nonlinear filtering problem in continuous time.
The distinguishing feature of these algorithms is that the Bayesian update step
is implemented using a feedback control law. It has been noted in the
literature that the control law is not unique. This is the main problem
addressed in this paper. To obtain a unique control law, the filtering problem
is formulated here as an optimal transportation problem. An explicit formula
for the (mean-field type) optimal control law is derived in the linear Gaussian
setting. Comparisons are made with the control laws for different types of EnKF
algorithms described in the literature. Via empirical approximation of the
mean-field control law, a finite-$N$ controlled interacting particle algorithm
is obtained. For this algorithm, the equations for empirical mean and
covariance are derived and shown to be identical to the Kalman filter. This
allows strong conclusions on convergence and error properties based on the
classical filter stability theory for the Kalman filter. It is shown that,
under certain technical conditions, the mean squared error (m.s.e.) converges
to zero even with a finite number of particles. A detailed propagation of chaos
analysis is carried out for the finite-$N$ algorithm. The analysis is used to
prove weak convergence of the empirical distribution as $N\rightarrow\infty$.
For a certain simplified filtering problem, analytical comparison of the m.s.e.
with the importance sampling-based algorithms is described. The analysis helps
explain the favorable scaling properties of the control-based algorithms
reported in several numerical studies in recent literature.
","[{""version"":""v1"",""created"":""Sat, 5 Oct 2019 22:55:49 GMT""}]","2019-10-08"
"1910.02339","Kezhen Chen","Kezhen Chen, Qiuyuan Huang, Hamid Palangi, Paul Smolensky, Kenneth D.
  Forbus and Jianfeng Gao","Mapping Natural-language Problems to Formal-language Solutions Using
  Structured Neural Representations",,,,,"cs.CL cs.LG","http://arxiv.org/licenses/nonexclusive-distrib/1.0/","  Generating formal-language programs represented by relational tuples, such as
Lisp programs or mathematical operations, to solve problems stated in natural
language is a challenging task because it requires explicitly capturing
discrete symbolic structural information implicit in the input. However, most
general neural sequence models do not explicitly capture such structural
information, limiting their performance on these tasks. In this paper, we
propose a new encoder-decoder model based on a structured neural
representation, Tensor Product Representations (TPRs), for mapping
Natural-language problems to Formal-language solutions, called TP-N2F. The
encoder of TP-N2F employs TPR `binding' to encode natural-language symbolic
structure in vector space and the decoder uses TPR `unbinding' to generate, in
symbolic space, a sequential program represented by relational tuples, each
consisting of a relation (or operation) and a number of arguments. TP-N2F
considerably outperforms LSTM-based seq2seq models on two benchmarks and
creates new state-of-the-art results. Ablation studies show that improvements
can be attributed to the use of structured TPRs explicitly in both the encoder
and decoder. Analysis of the learned structures shows how TPRs enhance the
interpretability of TP-N2F.
","[{""version"":""v1"",""created"":""Sat, 5 Oct 2019 22:57:04 GMT""},{""version"":""v2"",""created"":""Thu, 21 Nov 2019 04:20:45 GMT""},{""version"":""v3"",""created"":""Sun, 2 Aug 2020 03:18:59 GMT""}]","2020-08-04"
"1910.02340","Justin Bloom","Justin Bloom and Lalita Devadas","Secure Montgomery Multiplication and Repeated Squares for Modular
  Exponentiation","This work was done during the Summer 2019 REU program in Mathematics
  and Theoretical Computer Science at Oregon State University supported by NSF
  grant DMS-1757995",,,,"cs.CR","http://arxiv.org/licenses/nonexclusive-distrib/1.0/","  The BMR16 circuit garbling scheme introduces gadgets that allow for
ciphertext-free modular addition, while the multiplication of private inputs
modulo a prime p can be done with 2(p - 1) ciphertexts as described in Malkin,
Pastro, and Shelat's An algebraic approach to garbling. By using a residue
number system (RNS), we can construct a circuit to handle the squaring and
multiplication of inputs modulo a large N via the methods described in Hollman
and Gorissen's multi-layer residue number system. We expand on the existing
techniques for arithmetic modulo p to develop methods to handle arithmetic in a
positional, base-p number system. We evaluate the ciphertext cost of both of
these methods and compare their performance for squaring in various large
moduli.
","[{""version"":""v1"",""created"":""Sat, 5 Oct 2019 23:00:49 GMT""}]","2019-10-08"
"1910.02341","Robert Haslhofer","Beomjun Choi, Robert Haslhofer, Or Hershkovits","A note on the selfsimilarity of limit flows","5 pages",,,,"math.DG math.AP","http://arxiv.org/licenses/nonexclusive-distrib/1.0/","  It is a fundamental open problem for the mean curvature flow, and in fact for
many partial differential equations, whether or not all blowup limits are
selfsimilar. In this short note, we prove that for the mean curvature flow of
mean convex surfaces all limit flows are selfsimilar (static, shrinking or
translating) if and only if there are only finitely many spherical
singularities. More generally, using the solution of the mean convex
neighborhood conjecture for neck singularities, we establish a local version of
this equivalence for neck singularities in arbitrary dimension. In particular,
we see that the ancient ovals occur as limit flows if and only if there is a
sequence of spherical singularities converging to a neck singularity.
","[{""version"":""v1"",""created"":""Sat, 5 Oct 2019 23:16:59 GMT""}]","2019-10-08"
"1910.02342","Keith Dillon","Keith Dillon","Clustering Gaussian Graphical Models","arXiv admin note: text overlap with arXiv:1903.07181",,,,"cs.LG stat.ML","http://arxiv.org/licenses/nonexclusive-distrib/1.0/","  We derive an efficient method to perform clustering of nodes in Gaussian
graphical models directly from sample data. Nodes are clustered based on the
similarity of their network neighborhoods, with edge weights defined by partial
correlations. In the limited-data scenario, where the covariance matrix would
be rank-deficient, we are able to make use of matrix factors, and never need to
estimate the actual covariance or precision matrix. We demonstrate the method
on functional MRI data from the Human Connectome Project. A matlab
implementation of the algorithm is provided.
","[{""version"":""v1"",""created"":""Sat, 5 Oct 2019 23:48:05 GMT""}]","2019-10-08"
"1910.02343","Bryce Ferguson","Bryce L. Ferguson, Philip N. Brown, Jason R. Marden","Carrots or Sticks? The Effectiveness of Subsidies and Tolls in
  Congestion Games","American Conference on Control 2020",,,,"cs.GT","http://arxiv.org/licenses/nonexclusive-distrib/1.0/","  Are rewards or penalties more effective in influencing user behavior? This
work compares the effectiveness of subsidies and tolls in incentivizing users
in congestion games. The predominantly studied method of influencing user
behavior in network routing problems is to institute taxes which alter users'
observed costs in a manner that causes their self-interested choices to more
closely align with a system-level objective. Another feasible method to
accomplish the same goal is to subsidize the users' actions that are preferable
from a system-level perspective. We show that, when users behave similarly and
predictably, subsidies offer comparable performance guarantees to tolls while
requiring smaller monetary transactions with users; however, in the presence of
unknown player heterogeneity, subsidies fail to offer the same performance as
tolls. We further investigate these relationships in affine congestion games,
deriving explicit performance bounds under optimal tolls and subsidies with and
without user heterogeneity; we show that the differences in performance can be
significant.
","[{""version"":""v1"",""created"":""Sun, 6 Oct 2019 00:06:43 GMT""}]","2019-10-08"
"1910.02344","Jae Hyun Lim","Jae Hyun Lim, Pedro O. Pinheiro, Negar Rostamzadeh, Christopher Pal,
  Sungjin Ahn","Neural Multisensory Scene Inference",,,,,"cs.LG stat.ML","http://arxiv.org/licenses/nonexclusive-distrib/1.0/","  For embodied agents to infer representations of the underlying 3D physical
world they inhabit, they should efficiently combine multisensory cues from
numerous trials, e.g., by looking at and touching objects. Despite its
importance, multisensory 3D scene representation learning has received less
attention compared to the unimodal setting. In this paper, we propose the
Generative Multisensory Network (GMN) for learning latent representations of 3D
scenes which are partially observable through multiple sensory modalities. We
also introduce a novel method, called the Amortized Product-of-Experts, to
improve the computational efficiency and the robustness to unseen combinations
of modalities at test time. Experimental results demonstrate that the proposed
model can efficiently infer robust modality-invariant 3D-scene representations
from arbitrary combinations of modalities and perform accurate cross-modal
generation. To perform this exploration, we also develop the Multisensory
Embodied 3D-Scene Environment (MESE).
","[{""version"":""v1"",""created"":""Sun, 6 Oct 2019 00:14:38 GMT""},{""version"":""v2"",""created"":""Fri, 8 Nov 2019 02:07:33 GMT""}]","2019-11-11"
"1910.02345","Elina Robeva","Ali Zartash and Elina Robeva","Convolutions of Totally Positive Distributions with applications to
  Kernel Density Estimation",,"Alg. Stat. 13 (2022) 57-79","10.2140/astat.2022.13.57",,"math.ST stat.TH","http://arxiv.org/licenses/nonexclusive-distrib/1.0/","  In this work we study the estimation of the density of a totally positive
random vector. Total positivity of the distribution of a random vector implies
a strong form of positive dependence between its coordinates and, in
particular, it implies positive association. Since estimating a totally
positive density is a non-parametric problem, we take on a (modified) kernel
density estimation approach. Our main result is that the sum of scaled standard
Gaussian bumps centered at a min-max closed set provably yields a totally
positive distribution. Hence, our strategy for producing a totally positive
estimator is to form the min-max closure of the set of samples, and output a
sum of Gaussian bumps centered at the points in this set. We can frame this sum
as a convolution between the uniform distribution on a min-max closed set and a
scaled standard Gaussian. We further conjecture that convolving any totally
positive density with a standard Gaussian remains totally positive.
","[{""version"":""v1"",""created"":""Sun, 6 Oct 2019 00:18:12 GMT""},{""version"":""v2"",""created"":""Fri, 11 Oct 2019 02:24:12 GMT""},{""version"":""v3"",""created"":""Sat, 26 Dec 2020 23:20:46 GMT""}]","2023-05-10"
"1910.02346","Phillip Broussard","M.E. Broussard and P.R. Broussard","Upper Limit Transverse Voltage Calculations from the Glazman Model","9 oages, 5 figures, submitted to Physical Review B",,,,"cond-mat.supr-con","http://arxiv.org/licenses/nonexclusive-distrib/1.0/","  The model of Transverse Voltage proposed by L.I. Glazman made predictions on
the upper current limit for the existence of Transverse Voltage. In his paper,
the upper limit for current at which Transverse Voltage would appear in wide
films is temperature independent. Using a Runge-Kutta algorithim and the
complete equations for vortex-antivortex interactions, the upper limit for thin
niobium films were calculated for several temperatures, and how these compare
to Glazman's model and experimental results on the same films are discussed. We
find in contrast to both the experimental results and Glazman's prediction, the
solution to the complete equations show an increase in the upper current limit
as temperature increases.
","[{""version"":""v1"",""created"":""Sun, 6 Oct 2019 00:21:26 GMT""}]","2019-10-08"
"1910.02347","Valery Tyuterev","V.G. Tyuterev","First-principle Calculations of Electron-Phonon Interactions in
  $A^{II}B^{IV}C^{V}_2$ Crystals",,,,,"cond-mat.mtrl-sci","http://arxiv.org/licenses/nonexclusive-distrib/1.0/","  $Ab-initio$ probabilities of phonon-assisted intervalley scattering of
electrons in the conduction bands of ternary chalcopyrite compounds $ZnSiP_2$
and $ZnGeP_2$ between the central $\Gamma$ minima and the lowest lateral minima
(valleys) at $T$ and $N$ points have been calculated using the density
functional theory. The equilibrium parameters of crystal structures, spectra of
electrons and phonons are calculated self-consistently and are in fairly good
agreement with the experiment and available theoretical calculations. The
electron-phonon coupling constants with short-wave (inter-valley) phonons in
the chalcopyrite phosphides are close to their values in $Si$, $Ge$ and in
binary analog $GaP$.
","[{""version"":""v1"",""created"":""Sun, 6 Oct 2019 00:40:48 GMT""}]","2019-10-08"
"1910.02348","Hyebin Song","Hyebin Song, Ran Dai, Garvesh Raskutti, Rina Foygel Barber","Convex and Non-convex Approaches for Statistical Inference with
  Class-Conditional Noisy Labels",,,,,"stat.ME","http://creativecommons.org/licenses/by/4.0/","  We study the problem of estimation and testing in logistic regression with
class-conditional noise in the observed labels, which has an important
implication in the Positive-Unlabeled (PU) learning setting. With the key
observation that the label noise problem belongs to a special sub-class of
generalized linear models (GLM), we discuss convex and non-convex approaches
that address this problem. A non-convex approach based on the maximum
likelihood estimation produces an estimator with several optimal properties,
but a convex approach has an obvious advantage in optimization. We demonstrate
that in the low-dimensional setting, both estimators are consistent and
asymptotically normal, where the asymptotic variance of the non-convex
estimator is smaller than the convex counterpart. We also quantify the
efficiency gap which provides insight into when the two methods are comparable.
In the high-dimensional setting, we show that both estimation procedures
achieve $\ell_2$-consistency at the minimax optimal $\sqrt{s\log p/n}$ rates
under mild conditions. Finally, we propose an inference procedure using a
de-biasing approach. We validate our theoretical findings through simulations
and a real-data example.
","[{""version"":""v1"",""created"":""Sun, 6 Oct 2019 00:42:54 GMT""},{""version"":""v2"",""created"":""Wed, 12 Aug 2020 19:35:53 GMT""}]","2020-08-14"
"1910.02349","Xu Shen","Xu Shen, Xiaojing Zhang, Francesco Borrelli","Autonomous Parking of Vehicle Fleet in Tight Environments","Accepted at IEEE American Control Conference (ACC), Denver, CO, USA,
  July 2020",,,,"eess.SY cs.SY","http://arxiv.org/licenses/nonexclusive-distrib/1.0/","  The problem of autonomous parking of vehicle fleets is addressed in this
paper. We present a system-level modeling and control framework which allows
investigating different vehicle parking strategies while taking into account
path planning and collision avoidance. The proposed approach decouples the
problem into a centralized parking spot allocation and path generation, and a
decentralized collision avoidance control. This paper presents the hierarchical
framework and algorithmic details. Extensive simulations are used to assess
several allocation strategies in terms of total fleet parking time and queue
length. In particular, we describe how Braess's paradox can be observed for
parking vehicle fleets.
","[{""version"":""v1"",""created"":""Sun, 6 Oct 2019 00:55:28 GMT""},{""version"":""v2"",""created"":""Fri, 11 Oct 2019 18:21:58 GMT""},{""version"":""v3"",""created"":""Mon, 2 Mar 2020 19:13:30 GMT""}]","2020-03-04"
"1910.02350","Shahbaz Rezaei","Shahbaz Rezaei, Bryce Kroencke and Xin Liu","Large-scale Mobile App Identification Using Deep Learning",,"IEEE Access 8 (2019) 348-362","10.1109/ACCESS.2019.2962018",,"cs.NI","http://arxiv.org/licenses/nonexclusive-distrib/1.0/","  Many network services and tools (e.g. network monitors, malware-detection
systems, routing and billing policy enforcement modules in ISPs) depend on
identifying the type of traffic that passes through the network. With the
widespread use of mobile devices, the vast diversity of mobile apps, and the
massive adoption of encryption protocols (such as TLS), large-scale encrypted
traffic classification becomes increasingly difficult. In this paper, we
propose a deep learning model for mobile app identification that works even
with encrypted traffic. The proposed model only needs the payload of the first
few packets for classification, and, hence, it is suitable even for
applications that rely on early prediction, such as routing and QoS
provisioning. The deep model achieves between 84% to 98% accuracy for the
identification of 80 popular apps. We also perform occlusion analysis to bring
insight into what data is leaked from SSL/TLS protocol that allows accurate app
identification. Moreover, our traffic analysis shows that many apps generate
not only app-specific traffic, but also numerous ambiguous flows. Ambiguous
flows are flows generated by common functionality modules, such as
advertisement and traffic analytics. Because such flows are common among many
different apps, identifying the source app that generates ambiguous flows is
challenging. To address this challenge, we propose a CNN+LSTM model that uses
adjacent flows to learn the order and pattern of multiple flows, to better
identify the app that generates them. We show that such flow association
considerably improves the accuracy, particularly for ambiguous flows.
Furthermore, we show that our approach is robust to mixed traffic scenarios
where some unrelated flows may appear in adjacent flows. To the best of our
knowledge, this is the first work that identifies the source app for ambiguous
flows.
","[{""version"":""v1"",""created"":""Sun, 6 Oct 2019 01:03:38 GMT""},{""version"":""v2"",""created"":""Mon, 23 Dec 2019 16:35:09 GMT""}]","2020-01-17"
"1910.02351","Aditya Kumar","Evandro Menezes, Sebastian Pop, Aditya Kumar","Clustering case statements for indirect branch predictors",,,,,"cs.DS cs.CC cs.PF","http://arxiv.org/licenses/nonexclusive-distrib/1.0/","  We present an O(nlogn) algorithm to compile a switch statement into jump
tables. To generate jump tables that can be efficiently predicted by current
hardware branch predictors, we added an upper bound on the number of entries
for each table. This modification of the previously best known algorithm
reduces the complexity from O(n^2) to O(nlogn).
","[{""version"":""v1"",""created"":""Sun, 6 Oct 2019 01:10:57 GMT""},{""version"":""v2"",""created"":""Tue, 8 Oct 2019 16:05:42 GMT""},{""version"":""v3"",""created"":""Sat, 2 Nov 2019 14:22:44 GMT""}]","2019-11-05"
"1910.02352","Zenan Li","Zenan Li, Xiaoxing Ma, Chang Xu, Jingwei Xu, Chun Cao and Jian L\""u","Operational Calibration: Debugging Confidence Errors for DNNs in the
  Field","Published in the Proceedings of the 28th ACM Joint European Software
  Engineering Conference and Symposium on the Foundations of Software
  Engineering (ESEC/FSE 2020)",,"10.1145/3368089.3409696",,"cs.LG cs.SE stat.ML","http://arxiv.org/licenses/nonexclusive-distrib/1.0/","  Trained DNN models are increasingly adopted as integral parts of software
systems, but they often perform deficiently in the field. A particularly
damaging problem is that DNN models often give false predictions with high
confidence, due to the unavoidable slight divergences between operation data
and training data. To minimize the loss caused by inaccurate confidence,
operational calibration, i.e., calibrating the confidence function of a DNN
classifier against its operation domain, becomes a necessary debugging step in
the engineering of the whole system.
  Operational calibration is difficult considering the limited budget of
labeling operation data and the weak interpretability of DNN models. We propose
a Bayesian approach to operational calibration that gradually corrects the
confidence given by the model under calibration with a small number of labeled
operation data deliberately selected from a larger set of unlabeled operation
data. The approach is made effective and efficient by leveraging the locality
of the learned representation of the DNN model and modeling the calibration as
Gaussian Process Regression. Comprehensive experiments with various practical
datasets and DNN models show that it significantly outperformed alternative
methods, and in some difficult tasks it eliminated about 71% to 97%
high-confidence (>0.9) errors with only about 10\% of the minimal amount of
labeled operation data needed for practical learning techniques to barely work.
","[{""version"":""v1"",""created"":""Sun, 6 Oct 2019 01:21:14 GMT""},{""version"":""v2"",""created"":""Sun, 13 Sep 2020 02:28:32 GMT""}]","2020-09-16"
"1910.02353","Haoyue Tang","Haoyue Tang, Jintao Wang, Philippe Ciblat, Jian Song","Optimizing Data Freshness in Time-Varying Wireless Networks with
  Imperfect Channel State","to be submitted to ICC2020",,,,"cs.IT cs.NI math.IT","http://arxiv.org/licenses/nonexclusive-distrib/1.0/","  We consider a scenario where a base station (BS) attempts to collect fresh
information from power constrained sensors over time-varying band-limited
wireless channels. We characterize the data freshness through the recently
proposed metric--the Age of Information. We consider a time-varying channel
model with power adaptation. Unlike previous work, packet loss may happen due
to imperfect channel estimation or decoding error. We propose an asymptotic
optimal scheduling algorithm minimizing AoI performance and satisfying both
bandwidth and power constraint in such networks. Numerical simulations show
that the proposed policy outperforms the greedy one, and we observe that
sensors with poor channels are scheduled at higher AoI in order to limit the
packet loss.
","[{""version"":""v1"",""created"":""Sun, 6 Oct 2019 01:39:08 GMT""},{""version"":""v2"",""created"":""Sun, 13 Oct 2019 01:49:17 GMT""}]","2019-10-15"
"1910.02354","Guangyu Shen","Guangyu Shen, Chengzhi Mao, Junfeng Yang, Baishakhi Ray","AdvSPADE: Realistic Unrestricted Attacks for Semantic Segmentation",,,,,"cs.CV cs.LG eess.IV","http://arxiv.org/licenses/nonexclusive-distrib/1.0/","  Due to the inherent robustness of segmentation models, traditional
norm-bounded attack methods show limited effect on such type of models. In this
paper, we focus on generating unrestricted adversarial examples for semantic
segmentation models. We demonstrate a simple and effective method to generate
unrestricted adversarial examples using conditional generative adversarial
networks (CGAN) without any hand-crafted metric. The na\""ive implementation of
CGAN, however, yields inferior image quality and low attack success rate.
Instead, we leverage the SPADE (Spatially-adaptive denormalization) structure
with an additional loss item to generate effective adversarial attacks in a
single step. We validate our approach on the popular Cityscapes and ADE20K
datasets, and demonstrate that our synthetic adversarial examples are not only
realistic, but also improve the attack success rate by up to 41.0\% compared
with the state of the art adversarial attack methods including PGD.
","[{""version"":""v1"",""created"":""Sun, 6 Oct 2019 02:16:18 GMT""},{""version"":""v2"",""created"":""Wed, 9 Oct 2019 19:53:09 GMT""},{""version"":""v3"",""created"":""Tue, 19 Nov 2019 02:38:18 GMT""}]","2019-11-20"
