"1910.03639","J. Lorca Espiro","J. Lorca Espiro, M. Le Delliou","Dark Energy from Topology",,,"10.1088/1475-7516/2020/03/020",,"gr-qc","http://arxiv.org/licenses/nonexclusive-distrib/1.0/","  The concordance model of cosmology suffers from the major theoretical
problems surrounding the observed value and recent emergence of a cosmological
constant. In this paper we present a novel approach, which explains more
naturally its value than that based on quantum vacuum energy, in the form of
topological invariants characteristic classes, included as Lagrange multipliers
in the action. The approach draws from topological as well as dynamical system
consideration, generating as a byproduct an effective cosmological constant.
General Relativity is recovered by canceling the torsion in a region containing
the observable Universe, which boundary constraints the invariants, thus
yielding the effective cosmological constant's form. As that form's denominator
contains the total volume of the average black hole, calculated from a
geometrical mean on the estimated black hole mass distribution and directly
associated to the ratio of the total volume boundary of the space-time manifold
and the dominant term in its Euler characteristic. The constant's small
estimated value compared to the Planck scale is therefore natural and our
evaluation fits remarkably well with the observed value.
","[{""version"":""v1"",""created"":""Tue, 8 Oct 2019 18:50:19 GMT""}]","2020-03-18"
"1910.03640","Jaein Lim","Jaein Lim, Panagiotis Tsiotras","MAMS-A*: Multi-Agent Multi-Scale A*",,,,,"cs.MA cs.DS","http://arxiv.org/licenses/nonexclusive-distrib/1.0/","  We present a multi-scale forward search algorithm for distributed agents to
solve single-query shortest path planning problems. Each agent first builds a
representation of its own search space of the common environment as a
multi-resolution graph, it communicates with the other agents the result of its
local search, and it uses received information from other agents to refine its
own graph and update the local inconsistency conditions. As a result, all
agents attain a common subgraph that includes a provably optimal path in the
most informative graph available among all agents, if one exists, without
necessarily communicating the entire graph. We prove the completeness and
optimality of the proposed algorithm, and present numerical results supporting
the advantages of the proposed approach.
","[{""version"":""v1"",""created"":""Tue, 8 Oct 2019 18:51:15 GMT""}]","2019-10-10"
"1910.03641","Haoqi Li","Haoqi Li, Brian Baucom and Panayiotis Georgiou","Linking emotions to behaviors through deep transfer learning","23 pages, 8 figures",,,,"cs.LG cs.CL cs.HC eess.AS","http://arxiv.org/licenses/nonexclusive-distrib/1.0/","  Human behavior refers to the way humans act and interact. Understanding human
behavior is a cornerstone of observational practice, especially in
psychotherapy. An important cue of behavior analysis is the dynamical changes
of emotions during the conversation. Domain experts integrate emotional
information in a highly nonlinear manner, thus, it is challenging to explicitly
quantify the relationship between emotions and behaviors. In this work, we
employ deep transfer learning to analyze their inferential capacity and
contextual importance. We first train a network to quantify emotions from
acoustic signals and then use information from the emotion recognition network
as features for behavior recognition. We treat this emotion-related information
as behavioral primitives and further train higher level layers towards behavior
quantification. Through our analysis, we find that emotion-related information
is an important cue for behavior recognition. Further, we investigate the
importance of emotional-context in the expression of behavior by constraining
(or not) the neural networks' contextual view of the data. This demonstrates
that the sequence of emotions is critical in behavior expression. To achieve
these frameworks we employ hybrid architectures of convolutional networks and
recurrent networks to extract emotion-related behavior primitives and
facilitate automatic behavior recognition from speech.
","[{""version"":""v1"",""created"":""Tue, 8 Oct 2019 18:55:08 GMT""}]","2019-10-10"
"1910.03642","Laurel Heck","Laurel Heck","From Convex Ideal Polyhedra to Fundamental Domains in H^3",,,,,"math.GT","http://arxiv.org/licenses/nonexclusive-distrib/1.0/","  Our goal is to better understand the relationship between the polyhedron and
the group associated with a fundamental domain in H^3. In this paper, we will
study torsion-free groups and determine a formula for how many edge classes a
given abstract polyhedron must have. We will use that result to classify all
fundamental domains on the cube with torsion-free groups, including a
discussion of the explicit groups associated to those domains. We will then
turn to more general fundamental domains and prove a series of results about
how properties of the group place restrictions on the edge classes in the
quotient manifold. These results give insight into how the polyhedron and the
group associated to a fundamental domain interact, as well as offering concrete
tools to find fundamental domains.
","[{""version"":""v1"",""created"":""Tue, 8 Oct 2019 18:58:25 GMT""}]","2019-10-10"
"1910.03643","Denis Belomestny","D. Belomestny, L. Iosipoi, E. Moulines, A. Naumov and S. Samsonov","Variance reduction for Markov chains with application to MCMC",,,,,"math.ST cs.LG math.PR stat.CO stat.ML stat.TH","http://arxiv.org/licenses/nonexclusive-distrib/1.0/","  In this paper we propose a novel variance reduction approach for additive
functionals of Markov chains based on minimization of an estimate for the
asymptotic variance of these functionals over suitable classes of control
variates. A distinctive feature of the proposed approach is its ability to
significantly reduce the overall finite sample variance. This feature is
theoretically demonstrated by means of a deep non asymptotic analysis of a
variance reduced functional as well as by a thorough simulation study. In
particular we apply our method to various MCMC Bayesian estimation problems
where it favourably compares to the existing variance reduction approaches.
","[{""version"":""v1"",""created"":""Tue, 8 Oct 2019 19:05:36 GMT""},{""version"":""v2"",""created"":""Sat, 15 Feb 2020 08:37:54 GMT""}]","2020-02-18"
"1910.03644","Clint D. Lombard Dr","Clint D. Lombard, Corn\'e E. van Daalen","Stochastic triangular mesh mapping: A terrain mapping technique for
  autonomous mobile robots",,"Robotics and Autonomous Systems (2020)","10.1016/j.robot.2020.103449",,"cs.RO cs.LG stat.ML","http://arxiv.org/licenses/nonexclusive-distrib/1.0/","  For mobile robots to operate autonomously in general environments, perception
is required in the form of a dense metric map. For this purpose, we present the
stochastic triangular mesh (STM) mapping technique: a 2.5-D representation of
the surface of the environment using a continuous mesh of triangular surface
elements, where each surface element models the mean plane and roughness of the
underlying surface. In contrast to existing mapping techniques, a STM map
models the structure of the environment by ensuring a continuous model, while
also being able to be incrementally updated with linear computational cost in
the number of measurements. We reduce the effect of uncertainty in the robot
pose (position and orientation) by using landmark-relative submaps. The
uncertainty in the measurements and robot pose are accounted for by the use of
Bayesian inference techniques during the map update. We demonstrate that a STM
map can be used with sensors that generate point measurements, such as light
detection and ranging (LiDAR) sensors and stereo cameras. We show that a STM
map is a more accurate model than the only comparable online surface mapping
technique$\unicode{x2014}$a standard elevation map$\unicode{x2014}$and we also
provide qualitative results on practical datasets.
","[{""version"":""v1"",""created"":""Tue, 8 Oct 2019 19:06:05 GMT""},{""version"":""v2"",""created"":""Fri, 28 Feb 2020 15:33:35 GMT""}]","2020-03-03"
"1910.03650","Jean Mercat","Jean Mercat, Thomas Gilles, Nicole El Zoghby, Guillaume Sandou,
  Dominique Beauvois, Guillermo Pita Gil","Multi-Head Attention for Multi-Modal Joint Vehicle Motion Forecasting","7 pages, 4 figures, under review at ICRA and RA-L",,,,"cs.LG cs.AI cs.RO","http://arxiv.org/licenses/nonexclusive-distrib/1.0/","  This paper presents a novel vehicle motion forecasting method based on
multi-head attention. It produces joint forecasts for all vehicles on a road
scene as sequences of multi-modal probability density functions of their
positions. Its architecture uses multi-head attention to account for complete
interactions between all vehicles, and long short-term memory layers for
encoding and forecasting. It relies solely on vehicle position tracks, does not
need maneuver definitions, and does not represent the scene with a spatial
grid. This allows it to be more versatile than similar model while combining
any forecasting capabilities, namely joint forecast with interactions,
uncertainty estimation, and multi-modality. The resulting prediction likelihood
outperforms state-of-the-art models on the same dataset.
","[{""version"":""v1"",""created"":""Tue, 8 Oct 2019 19:16:56 GMT""},{""version"":""v2"",""created"":""Mon, 2 Dec 2019 22:03:23 GMT""},{""version"":""v3"",""created"":""Fri, 20 Dec 2019 12:36:57 GMT""}]","2019-12-23"
"1910.03652","Alex Hill","Alex S. Hill (UBC), Jan Cami (Western University), Laura Fissel
  (Queen's University), Tyler Foster (Brandon U), Gilles Joncas (U Laval),
  Lewis Knee (NRC/HAA), Roland Kothes (NRC/HAA), Tom Landecker (NRC/HAA), Tim
  Robishaw (NRC/HAA), Erik Rosolowsky (U Alberta), Samar Safi-Harb (U
  Manitoba), Jennifer West (U Toronto), Trey V. Wenger (NRC/HAA)","Canadian Investigations of the Interstellar Medium","White paper for the Canadian astronomy Long Range Plan process. 10
  pages.
  https://drive.google.com/file/d/1CSSgWBcKXqE3FRX-M46V8GCOfirtF9zH/view?usp=sharing",,"10.5281/zenodo.3825092","W044","astro-ph.GA","http://creativecommons.org/licenses/by/4.0/","  The interstellar medium mediates galactic evolution as the reservoir of
material for future star formation and the repository of energy and matter
output by stellar processes. Canadians have played leading roles in ISM science
for decades. The Canadian Galactic Plane Survey identified a wealth of
small-scale structure in H I emission as well as self-absorption and in the
structure of polarized emission. These observations demonstrated that no phase
of the ISM, including the transition from atomic gas to star formation, can be
understood in isolation. Canadians have also played leading roles in the
characterization of dust with Planck and balloon-borne telescopes. Canadians
have also used pulsar scintillometry to measure structure in the ISM at the
smallest scales, below 1 AU.
  The 2020s offer many opportunities for ISM science in Canada. A major but
cost-effective upgrade to the Synthesis Telescope with broadband (400-1800 MHz)
single-pixel feeds would enable broadband polarimetry as well as wide-area,
arcminute surveys of radio recombination lines. The next generation of
balloon-borne telescopes will investigate magnetic fields and dust properties.
Large single dishes, particularly the Green Bank Telescope, remain essential
for our understanding of the diffuse structure which characterizes the ISM.
Very long baseline interferometry capability enables parallax measurements of
pulsars and masers and for further progress in scintillometry. ISM astronomers
will continue to participate in cosmological experiments including CHIME and
CHORD. Protecting quiet radio frequency interference environments will be ever
more important as broadband observations are ever more central to ISM science.
Computational capability is essential both for numerical work and for handling
the observational data.
","[{""version"":""v1"",""created"":""Tue, 8 Oct 2019 19:17:37 GMT""}]","2020-05-18"
"1910.03654","Ramya Gurunathan","Ramya Gurunathan, Riley Hanus, Maxwell Dylla, Ankita Katre, G. Jeffrey
  Snyder","Analytical Models of Phonon-Point Defect Scattering","10 pages, 7 pages of supplemental, 5 figures total","Phys. Rev. Applied 13, 034011 (2020)","10.1103/PhysRevApplied.13.034011",,"cond-mat.mtrl-sci physics.app-ph","http://arxiv.org/licenses/nonexclusive-distrib/1.0/","  Point defects exist widely in engineering materials and are known to scatter
vibrational modes to reduce thermal conductivity. The Klemens description of
point defect scattering is the most prolific analytical model for this effect.
This work reviews the essential physics of the model and compares its
predictions to first principles results for isotope and alloy scattering,
demonstrating the model as a useful materials design metric. A treatment of the
scattering parameter ($\Gamma$) for a multiatomic lattice is recommended and
compared to other treatments presented in literature, which have been at times
misused to yield incomplete conclusions about the system's scattering
mechanisms. Additionally, we demonstrate a reduced sensitivity of the model to
the full phonon dispersion and discuss its origin. Finally, a simplified
treatment of scattering in alloy systems with vacancies and interstitial
defects is demonstrated to suitably describe the potent scattering strength of
these off-stoichiometric defects.
","[{""version"":""v1"",""created"":""Tue, 8 Oct 2019 19:22:06 GMT""}]","2020-03-11"
"1910.03655","Alane Suhr","Alane Suhr, Claudia Yan, Charlotte Schluger, Stanley Yu, Hadi Khader,
  Marwa Mouallem, Iris Zhang, Yoav Artzi","Executing Instructions in Situated Collaborative Interactions","EMNLP 2019 long paper",,,,"cs.CL cs.AI cs.LG","http://arxiv.org/licenses/nonexclusive-distrib/1.0/","  We study a collaborative scenario where a user not only instructs a system to
complete tasks, but also acts alongside it. This allows the user to adapt to
the system abilities by changing their language or deciding to simply
accomplish some tasks themselves, and requires the system to effectively
recover from errors as the user strategically assigns it new goals. We build a
game environment to study this scenario, and learn to map user instructions to
system actions. We introduce a learning approach focused on recovery from
cascading errors between instructions, and modeling methods to explicitly
reason about instructions with multiple goals. We evaluate with a new
evaluation protocol using recorded interactions and online games with human
users, and observe how users adapt to the system abilities.
","[{""version"":""v1"",""created"":""Tue, 8 Oct 2019 19:22:58 GMT""},{""version"":""v2"",""created"":""Thu, 17 Oct 2019 14:25:12 GMT""},{""version"":""v3"",""created"":""Wed, 8 Jan 2020 15:27:46 GMT""},{""version"":""v4"",""created"":""Tue, 22 Nov 2022 22:12:20 GMT""}]","2022-11-24"
"1910.03656","Jules Hedges","Joe Bolt and Jules Hedges and Philipp Zahn","Bayesian open games",,,,,"cs.GT math.CT","http://arxiv.org/licenses/nonexclusive-distrib/1.0/","  This paper generalises the treatment of compositional game theory as
introduced by the second and third authors with Ghani and Winschel, where games
are modelled as morphisms of a symmetric monoidal category. From an economic
modelling perspective, the existing notion of an open game is not expressive
enough for many applications. This includes stochastic environments, stochastic
choices by players, as well as incomplete information regarding the game being
played. The current paper addresses these three issue all at once. To achieve
this we make significant use of category theory, especially the 'coend optics'
of Riley.
","[{""version"":""v1"",""created"":""Tue, 8 Oct 2019 19:25:43 GMT""}]","2019-10-10"
"1910.03657","Rory Baggott","R.A. Baggott, S.J. Rose, S.P.D. Mangles","Calculating Opacity in Hot, Dense Matter using Second-Order
  Electron-Photon and Two-Photon Transitions to Approximate Line Broadening",,"Phys. Rev. Lett. 125, 145002 (2020)","10.1103/PhysRevLett.125.145002",,"physics.plasm-ph","http://arxiv.org/licenses/nonexclusive-distrib/1.0/","  Calculations of the opacity of hot, dense matter require models for plasma
line broadening. However, the most general theories are too complex to
calculate directly and some approximation is inevitably required. The most
widely-used approaches focus on the line centre, where a Lorentzian shape is
obtained. Here, we demonstrate that in the opposite limit, far from the line
centre, the opacity can be expressed in terms of second-order transitions, such
as electron-photon and two-photon processes. We suggest that this insight could
form the basis for a new approach to improve calculations of opacity in hot,
dense matter. Preliminary calculations suggest that this approach could yield
increased opacity away from absorption lines.
","[{""version"":""v1"",""created"":""Tue, 8 Oct 2019 19:33:44 GMT""},{""version"":""v2"",""created"":""Thu, 27 Aug 2020 13:30:53 GMT""}]","2020-10-05"
"1910.03659","Eugene Seo","Xiao Fu, Eugene Seo, Justin Clarke, and Rebecca A. Hutchinson","Link Prediction Under Imperfect Detection: Collaborative Filtering for
  Ecological Networks",,,,,"cs.SI","http://creativecommons.org/licenses/by/4.0/","  Matrix completion based collaborative filtering is considered scalable and
effective for online service link prediction (e.g., movie recommendation) but
does not meet the challenges of link prediction in ecological networks. A
unique challenge of ecological networks is that the observed data are subject
to systematic imperfect detection, due to the difficulty of accurate field
sampling. In this work, we propose a new framework customized for ecological
bipartite network link prediction. Our approach starts with incorporating the
Poisson N-mixture model, a widely used framework in statistical ecology for
modeling imperfect detection of a single species in field sampling. Despite its
extensive use for single species analysis, this model has never been considered
for link prediction between different species, perhaps because of the complex
nature of both link prediction and N-mixture model inference. By judiciously
combining the Poisson N-mixture model with a probabilistic nonnegative matrix
factorization (NMF) model in latent space, we propose an intuitive statistical
model for the problem of interest. We also offer a scalable and
convergence-guaranteed optimization algorithm to handle the associated maximum
likelihood identification problem. Experimental results on synthetic data and
two real-world ecological networks data are employed to validate our proposed
approach.
","[{""version"":""v1"",""created"":""Tue, 8 Oct 2019 19:38:59 GMT""}]","2019-10-10"
"1910.03660","Bahadir Y\""uzba\c{s}i","Bahad{\i}r Y\""uzba\c{s}{\i}, Mohammad Arashi and Fikri Akdeniz","Penalized regression via the restricted bridge estimator",,"Soft Computing, 2021","10.1007/s00500-021-05763-9",,"math.ST stat.ML stat.TH","http://arxiv.org/licenses/nonexclusive-distrib/1.0/","  This article is concerned with the Bridge Regression, which is a special
family in penalized regression with penalty function
$\sum_{j=1}^{p}|\beta_j|^q$ with $q>0$, in a linear model with linear
restrictions. The proposed restricted bridge (RBRIDGE) estimator simultaneously
estimates parameters and selects important variables when a prior information
about parameters are available in either low dimensional or high dimensional
case. Using local quadratic approximation, the penalty term can be approximated
around a local initial values vector and the RBRIDGE estimator enjoys a
closed-form expression which can be solved when $q>0$. Special cases of our
proposal are the restricted LASSO ($q=1$), restricted RIDGE ($q=2$), and
restricted Elastic Net ($1< q < 2$) estimators. We provide some theoretical
properties of the RBRIDGE estimator under for the low dimensional case, whereas
the computational aspects are given for both low and high dimensional cases. An
extensive Monte Carlo simulation study is conducted based on different prior
pieces of information and the performance of the RBRIDGE estiamtor is compared
with some competitive penalty estimators as well as the ORACLE. We also
consider four real data examples analysis for comparison sake. The numerical
results show that the suggested RBRIDGE estimator outperforms outstandingly
when the prior is true or near exact
","[{""version"":""v1"",""created"":""Tue, 8 Oct 2019 19:39:16 GMT""}]","2021-05-06"
"1910.03662","Ignacio Losada Carreno","Ignacio Losada Carreno, Anna Scaglione, Anatoly Zlotnik, Deepjyoti
  Deka and Kaarthik Sundar","An Adversarial Model for Attack Vector Vulnerability Analysis on Power
  and Gas Delivery Operations",,,,,"eess.SY cs.SY","http://arxiv.org/licenses/nonexclusive-distrib/1.0/","  Power systems often rely on natural gas pipeline networks to supply fuel for
gas-fired generation. Market inefficiencies and a lack of formal coordination
between the wholesale power and gas delivery infrastructures may magnify the
broader impact of a cyber-attack on a natural gas pipeline. In this study we
present a model that can be used to quantify the impact of cyber-attacks on
electricity and gas delivery operations. We model activation of cyber-attack
vectors that attempt to gain access to pipeline gas compressor controls using a
continuous-time Markov chain over a state space based on the gas operator
Industrial Control System firewall zone partition. Our approach evaluates the
operating states and decision-making in the networks using physically realistic
and operationally representative models. We summarize these models, the
sequence of analyses used to quantify the impacts of a cyber-incident, and
propose a Monte Carlo simulation approach to quantify the resulting effect on
the reliability of the bulk power system by the increase in operational cost.
The methodology is applied to a case study of interacting power, gas, and cyber
test networks.
","[{""version"":""v1"",""created"":""Tue, 8 Oct 2019 19:48:27 GMT""}]","2019-10-10"
"1910.03663","Xin Bian","Xin Bian, Hussein Aluie, Dongxiao Zhao, Huasen Zhang, Daniel Livescu","Revisiting the Late-Time Growth of Single-mode Rayleigh-Taylor
  Instability and the Role of Vorticity",,,"10.1016/j.physd.2019.132250",,"physics.flu-dyn","http://arxiv.org/licenses/nonexclusive-distrib/1.0/","  Growth of the single-fluid single-mode Rayleigh-Taylor instability (RTI) is
revisited in 2D and 3D using fully compressible high-resolution simulations. We
conduct a systematic analysis of the effects of perturbation Reynolds number
($Re_p$) and Atwood number ($A$) on RTI's late-time growth. Contrary to the
common belief that single-mode RTI reaches a terminal bubble velocity, we show
that the bubble re-accelerates when $Re_p$ is sufficiently large, consistent
with [Ramaparabhu et al. 2006, Wei and Livescu 2012]. However, unlike in
[Ramaparabhu et al. 2006], we find that for a sufficiently high $Re_p$, the
bubble's late-time acceleration is persistent and does not vanish. Analysis of
vorticity dynamics shows a clear correlation between vortices inside the bubble
and re-acceleration. Due to symmetry around the bubble and spike (vertical)
axes, the self-propagation velocity of vortices points in the vertical
direction. If viscosity is sufficiently small, the vortices persist long enough
to enter the bubble tip and accelerate the bubble [Wei and Livescu 2012]. A
similar effect has also been observed in ablative RTI [Betti and Sanz 2006]. As
the spike growth increases relative to that of the bubble at higher $A$,
vorticity production shifts downward, away from the centerline and toward the
spike tip. We modify the Betti-Sanz model for bubble velocity by introducing a
vorticity efficiency factor $\eta=0.45$ to accurately account for
re-acceleration caused by vorticity in the bubble tip. It had been previously
suggested that vorticity generation and the associated bubble re-acceleration
are suppressed at high $A$. However, we present evidence that if the large
$Re_p$ limit is taken first, bubble re-acceleration is still possible. Our
results also show that re-acceleration is much easier to occur in 3D than 2D,
requiring smaller $Re_p$ thresholds.
","[{""version"":""v1"",""created"":""Tue, 8 Oct 2019 19:56:13 GMT""}]","2020-02-26"
"1910.03664","Vinod Mishra","Vinod K. Mishra","Invariant Vector and Majorana Star Representations of Qutrit States",,,,"ARL TR-8709, ARL TR-8718","quant-ph","http://arxiv.org/licenses/nonexclusive-distrib/1.0/","  The Qutrit state density matrix is of order 3 and depends on 8 parameters in
general case. Visualization of this 8-dimensional state space is practically
impossible using 8-dimensional vectors commonly used. Recently a 3-dimensional
vector representation of the Qutrit state space (also called Invariant Vector
Representation) has been proposed [1]. In this work we present the
time-evolution of the IVR vectors for the Qutrit Cascade or {\Xi}-model to
emphasize the advantages of the IVR and also relate IVR vectors to well-known
stars of the Majorana State Representation (MSR).
","[{""version"":""v1"",""created"":""Tue, 8 Oct 2019 20:14:44 GMT""}]","2019-10-10"
