"1910.03499","Kilian Seibold","Kilian Seibold, Riccardo Rota, Vincenzo Savona","A dissipative time crystal in an asymmetric non-linear photonic dimer",,"Phys. Rev. A 101, 033839 (2020)","10.1103/PhysRevA.101.033839",,"quant-ph","http://arxiv.org/licenses/nonexclusive-distrib/1.0/","  We investigate the behavior of two coupled non-linear photonic cavities, in
presence of inhomogeneous coherent driving and local dissipations. By solving
numerically the quantum master equation, either by diagonalizing the
Liouvillian superoperator or by using the approximated truncated Wigner
approach, we extrapolate the properties of the system in a thermodynamic limit
of large photon occupation. When the mean field Gross-Pitaevskii equation
predicts a unique parametrically unstable steady-state solution, the open
quantum many-body system presents highly non-classical properties and its
dynamics exhibits the long lived Josephson-like oscillations typical of
dissipative time crystals, as indicated by the presence of purely imaginary
eigenvalues in the spectrum of the Liouvillian superoperator in the
thermodynamic limit.
","[{""version"":""v1"",""created"":""Tue, 8 Oct 2019 16:01:56 GMT""},{""version"":""v2"",""created"":""Wed, 1 Apr 2020 15:10:06 GMT""}]","2020-04-08"
"1910.03500","Li Yu","Yu Zhang, Li Yu, Qi-Ping Su, Zhe Sun, Fuqun Wang, Xiao-Qiang Xu,
  Qingjun Xu, Jin-Shuang Jin, Kefei Chen, Chui-Ping Yang","A framework for quantum homomorphic encryption with experimental
  demonstration","11 pages, 5 figures. Comments are welcome",,,,"quant-ph cs.CR","http://arxiv.org/licenses/nonexclusive-distrib/1.0/","  Quantum homomorphic encryption (QHE) is an encryption method that allows
quantum computation to be performed on one party's private data with the
program provided by another party, without revealing much information about the
data nor the program to the opposite party. We propose a framework for
(interactive) QHE based on the universal circuit approach. It contains a
subprocedure of calculating a classical linear polynomial, which can be
implemented with quantum or classical methods; apart from the subprocedure, the
framework has low requirement on the quantum capabilities of the party who
provides the circuit. We illustrate the subprocedure using a quite simple
classical protocol with some privacy tradeoff. For a special case of such
protocol, we obtain a scheme similar to blind quantum computation but with the
output on a different party. Another way of implementing the subprocedure is to
use a recently studied quantum check-based protocol, which has low requirement
on the quantum capabilities of both parties. The subprocedure could also be
implemented with a classical additive homomorphic encryption scheme. We
demonstrate some key steps of the outer part of the framework in a quantum
optics experiment.
","[{""version"":""v1"",""created"":""Tue, 8 Oct 2019 16:02:01 GMT""}]","2019-10-09"
"1910.03501","Chiara Bigi","Chiara Bigi, Zhenkun Tang, Gian Marco Pierantozzi, Pasquale Orgiani,
  Pranab Kumar Das, Jun Fujii, Ivana Vobornik, Tommaso Pincelli, Alessandro
  Troglia, Tien-Lin Lee, Regina Ciancio, Goran Dra\v{z}ic, Alberto Verdini,
  Anna Regoutz, Phil D. C. King, Deepnarayan Biswas, Giorgio Rossi, Giancarlo
  Panaccione and Annabella Selloni","Selective control of localised vs. delocalised carriers in anatase TiO2
  through reaction with O2",,"Phys. Rev. Materials 4, 025801 (2020)","10.1103/PhysRevMaterials.4.025801",,"cond-mat.mtrl-sci","http://arxiv.org/licenses/nonexclusive-distrib/1.0/","  Two-dimensional (2D) metallic states induced by oxygen vacancies at oxide
surfaces and interfaces provide new opportunities for the development of
advanced applications, but the ability to control the behavior of these states
is still limited. We used Angle Resolved Photoelectron Spectroscopy combined
with density functional theory to study the reactivity of states induced by the
oxygen vacancies at the (001)-(1x4) surface of anatase TiO2, where both 2D
metallic and deeper lying in-gap states (IGs) are observed. Remarkably, the two
states exhibit very different evolution when the surface is exposed to
molecular O2: while IGs are almost completely quenched, the metallic states are
only weakly affected. The energy scale analysis for the vacancy migration and
recombination resulting from the DFT calculations confirms indeed that only the
IGs originate from and remain localized at the surface, whereas the metallic
states originate from subsurface vacancies, whose migration and recombination
at the surface is energetically less favorable rendering them therefore
insensitive to oxygen dosing.
","[{""version"":""v1"",""created"":""Tue, 8 Oct 2019 16:02:47 GMT""}]","2020-03-04"
"1910.03504","Gianmarco Perrupato","Giorgio Parisi, Gianmarco Perrupato, Gabriele Sicuro","Random-link matching problems on random regular graphs",,"J. Stat. Mech. (2020) 033301","10.1088/1742-5468/ab7127",,"cond-mat.dis-nn math-ph math.MP","http://arxiv.org/licenses/nonexclusive-distrib/1.0/","  We study the random-link matching problem on random regular graphs, alongside
with two relaxed versions of the problem, namely the fractional matching and
the so-called ""loopy"" fractional matching. We estimated the asymptotic average
optimal cost using the cavity method. Moreover, we also study the finite-size
corrections due to rare topological structures appearing in the graph at large
sizes. We estimate these contributions using the cavity approach, and we
compare our results with the output of numerical simulations. The analysis also
clarifies the meaning of the finite-size contributions appearing in the
fully-connected version of the problem, that has been already analyzed in the
literature.
","[{""version"":""v1"",""created"":""Tue, 8 Oct 2019 16:03:45 GMT""},{""version"":""v2"",""created"":""Wed, 11 Mar 2020 20:03:05 GMT""}]","2020-03-16"
"1910.03508","Antonio Gallerati","L. Andrianopoli, B.L. Cerchiai, R. D'Auria, A. Gallerati, R. Noris, M.
  Trigiante, J. Zanelli","$\mathcal{N}$-Extended $D=4$ Supergravity, Unconventional SUSY and
  Graphene","27 pages, 1 figure","JHEP 01 (2020) 084","10.1007/JHEP01(2020)084",,"hep-th","http://arxiv.org/licenses/nonexclusive-distrib/1.0/","  We derive a $2+1$ dimensional model with unconventional supersymmetry at the
boundary of an ${\rm AdS}_4$ $\mathcal{N}$-extended supergravity, generalizing
previous results. The (unconventional) extended supersymmetry of the boundary
model is instrumental in describing, within a top-down approach, the electronic
properties of graphene-like 2D materials at the two Dirac points, ${\bf K}$ and
${\bf K}'$. The two valleys correspond to the two independent sectors of the
${\rm OSp}(p|2)\times {\rm OSp}(q|2)$ boundary model in the $p=q$ case, which
are related by a parity transformation. The Semenoff and Haldane-type masses
entering the corresponding Dirac equations are identified with the torsion
parameters of the substrate in the model.
","[{""version"":""v1"",""created"":""Tue, 8 Oct 2019 16:09:25 GMT""},{""version"":""v2"",""created"":""Fri, 29 Nov 2019 15:42:20 GMT""},{""version"":""v3"",""created"":""Sun, 19 Jan 2020 22:48:30 GMT""}]","2020-01-22"
"1910.03509","Michael I. Weinstein","A. Drouot and M.I. Weinstein","Edge states and the Valley Hall Effect","43 pages, 6 figures",,,,"math-ph cond-mat.mtrl-sci math.AP math.MP math.SP quant-ph","http://arxiv.org/licenses/nonexclusive-distrib/1.0/","  We study energy propagation along line-defects (edges) in 2D continuous,
energy preserving periodic media. The unperturbed medium (bulk) is modeled by a
honeycomb Schroedinger operator, which is periodic with respect to the
triangular lattice, invariant under parity, P, and complex-conjugation, C. A
honeycomb operator has Dirac points: two dispersion surfaces touch conically at
an energy level, $E_D$ [25,27]. Periodic perturbations which break P or C open
a gap in the essential spectrum about energy $E_D$. Such operators model an
insulator near energy $E_D$. Our edge operator is a small perturbation of the
bulk and models a transition (via a domain wall) between distinct periodic, P
or C breaking perturbations. The edge operator permits energy transport along
the line-defect. The associated energy channels are called edge states. They
are time-harmonic solutions which are localized near and propagating along the
line-defect. We completely characterize the edge state spectrum within the bulk
spectral gap about $E_D$. At the center of our analysis is an expansion of the
edge operator resolvent for energies near $E_D$. The leading term features the
resolvent of an effective Dirac operator. Edge state eigenvalues are poles of
the resolvent, which bifurcate from the Dirac point. The corresponding
eigenstates have the multiscale structure identified in [23]. We extend earlier
work on zigzag-type edges [14] to all rational edges. We elucidate the role in
edge state formation played by the type of symmetry-breaking and the
orientation of the edge. We prove the resolvent expansion by a new direct and
transparent strategy. Our results provide a rigorous explanation of the
numerical observations [22,38}; see also the photonic experimental study in
[42]. Finally, we discuss implications for the Valley Hall Effect, which
concerns quantum Hall-like energy transport in honeycomb structures.
","[{""version"":""v1"",""created"":""Tue, 8 Oct 2019 16:14:00 GMT""}]","2019-10-09"
"1910.03510","Francesc Wilhelmi","Francesc Wilhelmi, Sergio Barrachina-Mu\~noz, Boris Bellalta, Cristina
  Cano, Anders Jonsson and Vishnu Ram","A Flexible Machine Learning-Aware Architecture for Future WLANs",,,,,"cs.NI","http://arxiv.org/licenses/nonexclusive-distrib/1.0/","  Lots of hopes have been placed on Machine Learning (ML) as a key enabler of
future wireless networks. By taking advantage of large volumes of data, ML is
expected to deal with the ever-increasing complexity of networking problems.
Unfortunately, current networks are not yet prepared to support the ensuing
requirements of ML-based applications in terms of data collection, processing,
and output distribution. This article points out the architectural requirements
that are needed to pervasively include ML as part of future wireless networks
operation. Specifically, we look into Wireless Local Area Networks (WLANs),
which, due to their nature can be found in multiple forms, ranging from
cloud-based to edge-computing-like deployments. In particular, we propose to
adopt the International Telecommunications Union (ITU) unified architecture for
5G and beyond. Based on ITU's architecture, we provide insights on the main
requirements and the major challenges of introducing ML to the multiple
modalities of WLANs. Finally, we showcase the superiority of the architecture
through an ML-enabled use case for future networks.
","[{""version"":""v1"",""created"":""Tue, 8 Oct 2019 16:14:07 GMT""},{""version"":""v2"",""created"":""Thu, 10 Oct 2019 09:37:12 GMT""},{""version"":""v3"",""created"":""Mon, 17 Feb 2020 09:11:55 GMT""}]","2020-02-18"
"1910.03511","Aram Dermenjian","Aram Dermenjian, Christophe Hohlweg, Thomas McConville, Vincent Pilaud","The facial weak order on hyperplane arrangements","34 pages, 12 figures","Discrete Comput. Geom., 67(1):166-202, 2022",,,"math.CO","http://arxiv.org/licenses/nonexclusive-distrib/1.0/","  We extend the facial weak order from finite Coxeter groups to central
hyperplane arrangements. The facial weak order extends the poset of regions of
a hyperplane arrangement to all its faces. We provide four non-trivially
equivalent definitions of the facial weak order of a central arrangement: (1)
by exploiting the fact that the faces are intervals in the poset of regions,
(2) by describing its cover relations, (3) using covectors of the corresponding
oriented matroid, and (4) using certain sets of normal vectors closely related
to the geometry of the corresponding zonotope. Using these equivalent
descriptions, we show that when the poset of regions is a lattice, the facial
weak order is a lattice. In the case of simplicial arrangements, we further
show that this lattice is semidistributive and give a description of its
join-irreducible elements. Finally, we determine the homotopy type of all
intervals in the facial weak order.
","[{""version"":""v1"",""created"":""Tue, 8 Oct 2019 16:15:11 GMT""}]","2022-04-07"
"1910.03512","David L. Clements","J. Greenslade, E. Aguilar, D. L. Clements, H. Dannerbauer, T. Cheng,
  G. Petitpas, C. Yang, H. Messias, I. Oteo, D. Farrah, M.J. Michalowski, I.
  Perez Fournon, I. Aretxaga, M. S. Yun, S. Eales, L. Dunne, A. Cooray, P.
  Andreani, D. H. Hughes, M. Velazquez, D. Sanchez-Arguelles, N. Ponthieu","A SCUBA-2 Selected Herschel-SPIRE Dropout and the Nature of this
  Population","Accepoted for publication in MNRAS",,"10.1093/mnras/stz2850",,"astro-ph.GA","http://arxiv.org/licenses/nonexclusive-distrib/1.0/","  Dusty star-forming galaxies (DSFGs) detected at $z > 4$ provide important
examples of the first generations of massive galaxies. However, few examples
with spectroscopic confirmation are currently known, with Hershel struggling to
detect significant numbers of $z > 6$ DSFGs. NGP6_D1 is a bright 850 $\mu m$
source (12.3 $\pm$ 2.5 mJy) with no counterparts at shorter wavelengths (a
SPIRE dropout). Interferometric observations confirm it is a single source,
with no evidence for any optical or NIR emission, or nearby likely foreground
lensing sources. No $>3\sigma$ detected lines are seen in both LMT RSR and IRAM
30m EMIR spectra of NGP6_D1 across 32 $GHz$ of bandwidth despite reaching
detection limits of $\sim 1 mJy/500 km~s^{-1}$, so the redshift remains
unknown. Template fitting suggests that NGP6_D1 is most likely between $z =
5.8$ and 8.3. SED analysis finds that NGP6_D1 is a ULIRG, with a dust mass
$\sim 10^8$ - $10^9$ $M_{\odot}$ and a SFR of $\sim$ 500 $M_{\odot}~yr^{-1}$.
We place upper limits on the gas mass of NGP6_D1 of $M_{H2}$ $ < (1.1~\pm~3.5)
\times 10^{11}$ $M_{\odot}$, consistent with a gas-to-dust ratio of $\sim$ 100
- 1000. We discuss the nature of NGP6_D1 in the context of the broader submm
population, and find that comparable SPIRE dropouts account for $\sim$ 20% of
all SCUBA-2 detected sources, but with a similar flux density distribution to
the general population.
","[{""version"":""v1"",""created"":""Tue, 8 Oct 2019 16:15:50 GMT""}]","2019-10-23"
"1910.03513","Ivan Christov","Vishal Anand and Sanjan C. Muchandimath and Ivan C. Christov","Hydrodynamic Bulge Testing: Materials Characterization without Measuring
  Deformation","14 pages, 8 figures and 4 pages supplementary material with 1 figure;
  v2: minor corrections, fixing typos; v3: minor fixes","ASME Journal of Applied Mechanics 87, 051012 (2020)","10.1115/1.4046297",,"cond-mat.soft","http://arxiv.org/licenses/nonexclusive-distrib/1.0/","  Characterizing the elastic properties of soft materials through bulge testing
relies on accurate measurement of deformation, which is experimentally
challenging. To avoid measuring deformation, we propose a hydrodynamic bulge
test for characterizing the material properties of thick, pre-stressed elastic
sheets via their fluid--structure interaction with a steady viscous fluid flow.
Specifically, the hydrodynamic bulge test relies on a pressure drop measurement
across a rectangular microchannel with a deformable top wall. We develop a
mathematical model using first-order shear-deformation theory of plates with
stretching, and the lubrication approximation for Newtonian fluid flow.
Specifically, a relationship is derived between the imposed flow rate and the
total pressure drop. Then, this relationship is inverted numerically to yield
estimates of the Young's modulus (given the Poisson ratio), if the pressure
drop is measured (given the steady flow rate). Direct numerical simulations of
two-way-coupled fluid--structure interaction are carried out in ANSYS to
determine the cross-sectional membrane deformation and the hydrodynamic
pressure distribution. Taking the simulations as ``ground truth,'' a
hydrodynamic bulge test is performed using the simulation data to ascertain the
accuracy and validity of the proposed methodology for estimating material
properties. An error propagation analysis is performed via Monte Carlo
simulation to characterize the susceptibility of the hydrodynamic bulge test
estimates to noise. We find that, while a hydrodynamic bulge test is less
accurate in characterizing material properties, it is less susceptible to
noise, in the input (measured) variable, than a hydrostatic bulge test.
","[{""version"":""v1"",""created"":""Tue, 8 Oct 2019 16:18:24 GMT""},{""version"":""v2"",""created"":""Tue, 10 Dec 2019 03:31:02 GMT""},{""version"":""v3"",""created"":""Fri, 13 Mar 2020 20:06:31 GMT""}]","2020-03-17"
"1910.03515","Carol Smith","Carol J. Smith","Designing Trustworthy AI: A Human-Machine Teaming Framework to Guide
  Development","Presented at AAAI FSS-19: Artificial Intelligence in Government and
  Public Sector, Arlington, Virginia, USA",,,,"cs.AI cs.HC","http://creativecommons.org/licenses/by-nc-sa/4.0/","  Artificial intelligence (AI) holds great promise to empower us with knowledge
and augment our effectiveness. We can -- and must -- ensure that we keep humans
safe and in control, particularly with regard to government and public sector
applications that affect broad populations. How can AI development teams
harness the power of AI systems and design them to be valuable to humans?
Diverse teams are needed to build trustworthy artificial intelligent systems,
and those teams need to coalesce around a shared set of ethics. There are many
discussions in the AI field about ethics and trust, but there are few
frameworks available for people to use as guidance when creating these systems.
The Human-Machine Teaming (HMT) Framework for Designing Ethical AI Experiences
described in this paper, when used with a set of technical ethics, will guide
AI development teams to create AI systems that are accountable, de-risked,
respectful, secure, honest, and usable. To support the team's efforts,
activities to understand people's needs and concerns will be introduced along
with the themes to support the team's efforts. For example, usability testing
can help determine if the audience understands how the AI system works and
complies with the HMT Framework. The HMT Framework is based on reviews of
existing ethical codes and best practices in human-computer interaction and
software development. Human-machine teams are strongest when human users can
trust AI systems to behave as expected, safely, securely, and understandably.
Using the HMT Framework to design trustworthy AI systems will provide support
to teams in identifying potential issues ahead of time and making great
experiences for humans.
","[{""version"":""v1"",""created"":""Tue, 8 Oct 2019 16:19:49 GMT""}]","2019-10-09"
"1910.03516","Josh Roy","Luke Eller, Theo Guerin, Baichuan Huang, Garrett Warren, Sophie Yang,
  Josh Roy, Stefanie Tellex","Advanced Autonomy on a Low-Cost Educational Drone Platform",,,,,"cs.RO cs.SY eess.SY","http://arxiv.org/licenses/nonexclusive-distrib/1.0/","  PiDrone is a quadrotor platform created to accompany an introductory robotics
course. Students build an autonomous flying robot from scratch and learn to
program it through assignments and projects. Existing educational robots do not
have significant autonomous capabilities, such as high-level planning and
mapping. We present a hardware and software framework for an autonomous aerial
robot, in which all software for autonomy can run onboard the drone,
implemented in Python. We present an Unscented Kalman Filter (UKF) for accurate
state estimation. Next, we present an implementation of Monte Carlo (MC)
Localization and FastSLAM for Simultaneous Localization and Mapping (SLAM). The
performance of UKF, localization, and SLAM is tested and compared to ground
truth, provided by a motion-capture system. Our evaluation demonstrates that
our autonomous educational framework runs quickly and accurately on a Raspberry
Pi in Python, making it ideal for use in educational settings.
","[{""version"":""v1"",""created"":""Tue, 8 Oct 2019 16:21:23 GMT""}]","2019-10-09"
"1910.03517","Georg Muntingh PhD","Oliver J.D. Barrowclough, Sverre Briseid, Georg Muntingh, Torbj{\o}rn
  Viksand","Real-time processing of high-resolution video and 3D model-based
  tracking for remote towers",,,,,"cs.CV","http://arxiv.org/licenses/nonexclusive-distrib/1.0/","  High quality video data is a core component in emerging remote tower
operations as it inherently contains a huge amount of information on which an
air traffic controller can base decisions. Various digital technologies also
have the potential to exploit this data to bring enhancements, including
tracking ground movements by relating events in the video view to their
positions in 3D space. The total resolution of remote tower setups with
multiple cameras often exceeds 25 million RGB pixels and is captured at 30
frames per second or more. It is thus a challenge to efficiently process all
the data in such a way as to provide relevant real-time enhancements to the
controller. In this paper we discuss how a number of improvements can be
implemented efficiently on a single workstation by decoupling processes and
utilizing hardware for parallel computing. We also highlight how decoupling the
processes in this way increases resilience of the software solution in the
sense that failure of a single component does not impair the function of the
other components.
","[{""version"":""v1"",""created"":""Tue, 8 Oct 2019 16:22:29 GMT""},{""version"":""v2"",""created"":""Wed, 15 Jan 2020 12:41:52 GMT""}]","2020-01-16"
"1910.03518","Sophie Dubber","Sophie C. Dubber, Annelies Mortier, Ken Rice, Chantanelle Nava, Luca
  Malavolta, Helen Giles, Adrien Coffinet, David Charbonneau, Andrew
  Vanderburg, Aldo S. Bonomo, Walter Boschin, Lars A. Buchhave, Andrew Collier
  Cameron, Rosario Cosentino, Xavier Dumusque, Adriano Ghedina, Avet
  Harutyunyan, Raphaelle D. Haywood, David Latham, Mercedes Lopez-Morales,
  Giusi Micela, Emilio Molinari, Francesco A. Pepe, David Phillips, Giampaolo
  Piotto, Ennio Poretti, Dimitar Sasselov, Alessandro Sozzetti, Stephane Udry","Using HARPS-N to characterise the long-period planets in the PH-2 and
  Kepler-103 systems","Accepted for publication in MNRAS",,"10.1093/mnras/stz2856",,"astro-ph.EP","http://arxiv.org/licenses/nonexclusive-distrib/1.0/","  We present confirmation of the planetary nature of PH-2b, as well as the
first mass estimates for the two planets in the Kepler-103 system. PH-2b and
Kepler-103c are both long-period and transiting, a sparsely-populated category
of exoplanet. We use {\it Kepler} light-curve data to estimate a radius, and
then use HARPS-N radial velocities to determine the semi-amplitude of the
stellar reflex motion and, hence, the planet mass. For PH-2b we recover a
3.5-$\sigma$ mass estimate of $M_p = 109^{+30}_{-32}$ M$_\oplus$ and a radius
of $R_p = 9.49\pm0.16$ R$_\oplus$. This means that PH-2b has a Saturn-like bulk
density and is the only planet of this type with an orbital period $P > 200$
days that orbits a single star. We find that Kepler-103b has a mass of
$M_{\text{p,b}} = 11.7^{+4.31}_{-4.72}$ M$_{\oplus}$ and Kepler-103c has a mass
of $M_{\text{p,c}} = 58.5^{+11.2}_{-11.4}$ M$_{\oplus}$. These are 2.5$\sigma$
and 5$\sigma$ results, respectively. With radii of $R_{\text{p,b}} =
3.49^{+0.06}_{-0.05}$ R$_\oplus$, and $R_{\text{p,c}} = 5.45^{+0.18}_{-0.17}$
R$_\oplus$, these results suggest that Kepler-103b has a Neptune-like density,
while Kepler-103c is one of the highest density planets with a period $P > 100$
days. By providing high-precision estimates for the masses of the long-period,
intermediate-mass planets PH-2b and Kepler-103c, we increase the sample of
long-period planets with known masses and radii, which will improve our
understanding of the mass-radius relation across the full range of exoplanet
masses and radii.
","[{""version"":""v1"",""created"":""Tue, 8 Oct 2019 16:22:35 GMT""}]","2019-10-23"
"1910.03519","Masoud Farhadi","Masoud Farhadi, and Mehdi Abapour","Three Switch Three Phase Inverter With Improved DC Voltage Utilization",,,"10.1109/TIE.2018.2829680",,"eess.SY cs.SY eess.SP","http://arxiv.org/licenses/nonexclusive-distrib/1.0/","  This paper proposes a new DC-AC converter with a less number of semiconductor
switches and therefore gate drive and control circuit components. A salient
feature of this inverter is its pure sinusoidal line-to-line voltages with no
need for output filter. Also, the proposed inverter improves the voltage
utilization factor of the input dc supply compared to four-switch three-phase
inverter (first best topology in the literature from the number of switches
point of view) and standard six-switch inverter with sine PWM. The proposed
inverter is capable of operating with a wide range of output voltages from zero
to the full value of the dc input voltage by appropriately altering
instantaneous duty-cycle. For the first time to our knowledge, in this paper, a
three-phase universal inverter with only three power-switch has been proposed.
For the purpose of providing a good compromise between fast transient response
and stability, a model predictive controller is proposed. All the design
expressions have been derived. A comparison with other DC-AC converters is
given to show the merits of the proposed converter. Finally, satisfactory
circuit operation is confirmed by experimental results from a laboratory
prototype.
","[{""version"":""v1"",""created"":""Tue, 8 Oct 2019 16:24:13 GMT""}]","2019-10-09"
