"1910.03786","Pouria Ramazi","Pouria Ramazi, Ming Cao","Global Convergence for Replicator Dynamics of Repeated Snowdrift Games",,,,,"math.DS cs.SY eess.SY math.OC","http://arxiv.org/licenses/nonexclusive-distrib/1.0/","  To understand the emergence and sustainment of cooperative behavior in
interacting collectives, we perform global convergence analysis for replicator
dynamics of a large, well-mixed population of individuals playing a repeated
snowdrift game with four typical strategies, which are always cooperate (ALLC),
tit-for-tat (TFT), suspicious tit-for-tat (STFT) and always defect (ALLD). The
dynamical model is a three-dimensional ODE system that is parameterized by the
payoffs of the base game. Instead of routine searches for evolutionarily stable
strategies and sets, we expand our analysis to determining the asymptotic
behavior of solution trajectories starting from any initial state, and in
particular show that for the full range of payoffs, every trajectory of the
system converges to an equilibrium point. The convergence results highlight
three findings that are of particular importance for understanding the
cooperation mechanisms among self-interested agents playing repeated snowdrift
games. First, the inclusion of TFT- and STFT-players, the two types of
conditional strategy players in the game, increases the share of cooperators of
the overall population compared to the situation when the population consists
of only ALLC- and ALLD-players. This confirms findings in biology and sociology
that reciprocity may promote cooperation in social collective actions, such as
reducing traffic jams and division of labor, where each individual may gain
more to play the opposite of what her opponent chooses. Second, surprisingly
enough, regardless of the payoffs, there always exists a set of initial
conditions under which ALLC players do not vanish in the long run, which does
not hold for all the other three types of players. So an ALLC-player, although
perceived as the one that can be easily taken advantage of in snowdrift games,
has certain endurance in the long run.
","[{""version"":""v1"",""created"":""Wed, 9 Oct 2019 04:38:19 GMT""}]","2019-10-10"
"1910.03787","Xueyuan Xu","Xia Wu, Xueyuan Xu, Jianhong Liu, Hailing Wang, Bin Hu, Feiping Nie","Supervised feature selection with orthogonal regression and feature
  weighting",,,,,"cs.LG stat.ML","http://arxiv.org/licenses/nonexclusive-distrib/1.0/","  Effective features can improve the performance of a model, which can thus
help us understand the characteristics and underlying structure of complex
data. Previous feature selection methods usually cannot keep more local
structure information. To address the defects previously mentioned, we propose
a novel supervised orthogonal least square regression model with feature
weighting for feature selection. The optimization problem of the objection
function can be solved by employing generalized power iteration (GPI) and
augmented Lagrangian multiplier (ALM) methods. Experimental results show that
the proposed method can more effectively reduce the feature dimensionality and
obtain better classification results than traditional feature selection
methods. The convergence of our iterative method is proved as well.
Consequently, the effectiveness and superiority of the proposed method are
verified both theoretically and experimentally.
","[{""version"":""v1"",""created"":""Wed, 9 Oct 2019 04:39:09 GMT""}]","2019-10-10"
"1910.03788","Alex Deng","Alex Deng, Yicheng Li, Jiannan Lu, Vivek Ramamurthy","On Post-Selection Inference in A/B Tests",,,"10.1145/3447548.3467129",,"stat.AP","http://arxiv.org/licenses/nonexclusive-distrib/1.0/","  When interpreting A/B tests, we typically focus only on the statistically
significant results and take them by face value. This practice, termed
post-selection inference in the statistical literature, may negatively affect
both point estimation and uncertainty quantification, and therefore hinder
trustworthy decision making in A/B testing. To address this issue, in this
paper we explore two seemingly unrelated paths, one based on supervised machine
learning and the other on empirical Bayes, and propose post-selection
inferential approaches that combine the strengths of both. Through large-scale
simulated and empirical examples, we demonstrate that our proposed
methodologies stand out among other existing ones in both reducing
post-selection biases and improving confidence interval coverage rates, and
discuss how they can be conveniently adjusted to real-life scenarios.
","[{""version"":""v1"",""created"":""Wed, 9 Oct 2019 04:39:47 GMT""},{""version"":""v2"",""created"":""Sun, 30 May 2021 17:21:00 GMT""}]","2021-06-01"
"1910.03789","John Middleditch","John Middleditch (University of California, retired)","Disruption of Supernovae and would-be ""Direct Collapsars""","47+ pages, 17 figures, V2, V3 minor changes, v4 more, v5 slightly
  more, v6 ""as bright as it \textit{could} get"", v7 That paragraph slightly
  modified, v8 [59] , 0.62 foe",,,,"astro-ph.HE physics.plasm-ph","http://arxiv.org/licenses/nonexclusive-distrib/1.0/","  The speed of an intensity pattern of polarization currents on a circle,
induced within a star by its rotating, magnetized core, will exceed the speed
of light for a sufficiently large star, and/or rapid rotation, and will, in
turn, generate focused electromagnetic beams which disrupt them. Upon core
collapse within such a star, the emergence of these beams will concentrate near
the two rotational poles, driving jets of matter into material previously
ejected via the same excitation mechanism acting through the pre-core-collapse
rotation of its magnetized stellar core(s). This interpenetration of material,
light-days in extent from the progenitor, produces a significant fraction of
the total supernova luminosity, and the magnitude and time of maximum of this
contribution both vary with the progenitor's rotational orientation. The net
effect is to render supernovae unusable as standard candles without further
detailed understanding, leaving no firm basis, at this time, to favor any
cosmology, including those involving ""Dark Energy."" Thus we are not now, nor
have we ever been, in an era of precision cosmology, nor are we likely to be
anytime soon. Mass loss induced through the same mechanism also keeps
aggregates of gas and plasma in the early Universe, or at any other epoch, from
forming the ~billion solar mass stars which have been suggested to produce
~billion solar mass black holes via ""direct collapse,"" but can also provide a
signature to predict core collapse some months in advance.
","[{""version"":""v1"",""created"":""Wed, 9 Oct 2019 04:43:39 GMT""},{""version"":""v2"",""created"":""Thu, 10 Oct 2019 05:31:42 GMT""},{""version"":""v3"",""created"":""Sat, 12 Oct 2019 07:40:32 GMT""},{""version"":""v4"",""created"":""Wed, 16 Oct 2019 07:39:13 GMT""},{""version"":""v5"",""created"":""Sun, 20 Oct 2019 09:29:24 GMT""},{""version"":""v6"",""created"":""Wed, 18 Mar 2020 02:27:31 GMT""},{""version"":""v7"",""created"":""Mon, 6 Apr 2020 05:09:29 GMT""},{""version"":""v8"",""created"":""Thu, 3 Dec 2020 06:15:34 GMT""}]","2020-12-04"
"1910.03790","Najmuddin Fakhruddin","Najmuddin Fakhruddin and Vincent Pilloni","Hecke operators and the coherent cohomology of Shimura varieties",,,"10.1017/S1474748021000050",,"math.NT","http://arxiv.org/licenses/nonexclusive-distrib/1.0/","  We consider the problem of defining an action of Hecke operators on the
coherent cohomology of certain integral models of Shimura varieties. We
formulate a general conjecture describing which Hecke operators should act
integrally and solve the conjecture in certain cases. As a consequence, we
obtain $p$-adic estimates of Satake parameters of certain non-regular self dual
automorphic representations of $\mathrm{GL}_n$.
","[{""version"":""v1"",""created"":""Wed, 9 Oct 2019 04:45:18 GMT""}]","2021-07-01"
"1910.03791","El\'ias Castellanos Dr.","El\'ias Castellanos, Celia Escamilla-Rivera and Jorge Mastache","Is a Bose-Einstein Condensate a good candidate for Dark Matter? A test
  with Galaxy Rotation Curves","21 pages, 17 figures","International Journal of Modern Physics D 2020","10.1142/S0218271820500637",,"gr-qc","http://arxiv.org/licenses/nonexclusive-distrib/1.0/","  We analyze the rotation curves that correspond to a Bose--Einstein Condensate
(BEC) type halo surrounding a Schwarzschild--type black hole to confront
predictions of the model upon observations of galaxy rotation curves. We model
the halo as a Bose--Einstein condensate in terms of a massive scalar field that
satisfies a Klein--Gordon equation with a self--interaction term. We also
assume that the bosonic cloud is not self--gravitating. To model the halo, we
apply a simple form of the Thomas--Fermi approximation that allows us to
extract relevant results with a simple and concise procedure. Using galaxy data
from a subsample of SPARC data base, we find the best fits of the BEC model by
using the Thomas--Fermi approximation and perform a Bayesian statistics
analysis to compare the obtained BEC's scenarios with the Navarro--Frenk--White
(NFW) model as pivot model. We find that in the centre of galaxies we must have
a supermassive compact central object, i.e., supermassive black hole, in the
range of $\log_{10} M/M_\odot = 11.08 \pm 0.43$ which condensate a boson cloud
with average particle mass $M_\Phi = (3.47 \pm 1.43 )\times10^{-23}$ eV and a
self--interaction coupling constant $\log_{10} (\lambda \; [{\rm pc}^{-1}]) =
-91.09 \pm 0.74 $, i.e., the system behaves as a weakly interacting BEC. We
compare the BEC model with NFW concluding that in general the BEC model using
the Thomas--Fermi approximation is strong enough compared with the NFW
fittings. Moreover, we show that BECs still well--fit the galaxy rotation
curves and, more importantly, could lead to an understanding of the dark matter
nature from first principles.
","[{""version"":""v1"",""created"":""Wed, 9 Oct 2019 04:52:39 GMT""},{""version"":""v2"",""created"":""Tue, 12 May 2020 00:02:35 GMT""}]","2020-05-27"
"1910.03792","Emmanuel Lecouturier","Emmanuel Lecouturier","On the Mazur--Tate conjecture for prime conductor and Mazur's Eisenstein
  ideal","17 pages. Comments welcome!",,,,"math.NT","http://arxiv.org/licenses/nonexclusive-distrib/1.0/","  In 1995, Ehud de Shalit proved an analogue of a conjecture of Mazur--Tate for
the modular Jacobian $J_0(p)$. His main result was valid away from the
Eisenstein primes. We complete the work of de Shalit by including the
Eisenstein primes, and give some applications such as an elementary
combinatorial identity involving discrete logarithms of difference of
supersingular $j$-invariants. An important tool is our recent work on the so
called ""generalized cuspidal $1$-motive"".
","[{""version"":""v1"",""created"":""Wed, 9 Oct 2019 05:13:40 GMT""}]","2019-10-10"
"1910.03793","Nang Laik Ma Dr","Dr Ma Nang Laik, Chester Mark Hong Wei","Creating a unique mobile financial services framework for Myanmar: A
  Review",,,,,"q-fin.GN","http://arxiv.org/licenses/nonexclusive-distrib/1.0/","  Myanmar is languishing at the bottom of key international indexes. United
Nations considers the country as a structurally weak and vulnerable economy.
Yet, from 2011 when Myanmar ended decades of military rule and isolationism and
transited towards democracy, its breakneck development has led to many
considering the country to be one of the final frontiers for growth in the Asia
region. One such industry that has benefitted from the opening of the country
is telecommunications. The mobile penetration rate at 4.8% in 2011 has
increased significantly to 90% in 2016. Despite renewed optimism and
development in the economy, one statistic remains disappointing. According to a
report by Asian Development Bank (ADB), only 23% of the adult population have
access to a bank account. This highlights a need to reach out and increase
access to financial resources to a population that is severely unbanked and
underbanked. This creates an interesting proposition of allowing both the
telecommunications and financial sector to form the mobile financial services
(MFS) sector and meet the need of improving access to financial resources for
the population. This report explores the government role in supporting, growing
and sustaining the MFS sector and conducts a comparative research into
Singapore, Malaysia and Thailand to understand the steps taken by these
governments to develop their own Financial Technology (FinTech), specifically
MFS, industry. Finally, the report will present preliminary recommendations
that the Myanmar government could consider implementing to drive growth in its
MFS sector.
","[{""version"":""v1"",""created"":""Wed, 9 Oct 2019 05:15:06 GMT""},{""version"":""v2"",""created"":""Thu, 10 Oct 2019 03:52:12 GMT""}]","2019-10-11"
"1910.03794","Zhongquan Tan","Zhongquan Tan and Shengchao Zheng","Extremes of a type of locally stationary Gaussian random fields with
  applications to Shepp statistics","15 pages,0 figures",,,,"math.PR","http://arxiv.org/licenses/nonexclusive-distrib/1.0/","  Let $\{Z(\tau,s), (\tau,s)\in [a,b]\times[0,T]\}$ with some positive
constants $a,b,T$ be a centered Gaussian random field with variance function
$\sigma^{2}(\tau,s)$ satisfying $\sigma^{2}(\tau,s)=\sigma^{2}(\tau)$. We
firstly derive the exact tail asymptotics for the maximum
$M_{H}(T)=\max_{(\tau,s)\in[a,b]\times[0,T]}Z(\tau,s)/\sigma(\tau)$ up crossing
some level $u$ with any fixed $0<a<b<\infty$ and $T>0$; and we further derive
the extreme limit law for $M_{H}(T)$. As applications of the main results, we
derive the exact tail asymptotics and the extreme limit law for Shepp
statistics with stationary Gaussian process, fractional Brownian motion and
Gaussian integrated process as input.
","[{""version"":""v1"",""created"":""Wed, 9 Oct 2019 05:16:25 GMT""}]","2019-10-10"
"1910.03795","Vida Jamali","Vida Jamali, Francesca Mirri, Evan G. Biggers, Robert A. Pinnick, Lucy
  Liberman, Yachin Cohen, Yeshayahu Talmon, Fred C. MacKintosh, Paul van der
  Schoot, Matteo Pasquali","Enhanced ordering in length-polydisperse carbon nanotube solutions at
  high concentrations as revealed by small angle X-ray scattering",,,,,"cond-mat.soft cond-mat.mes-hall cond-mat.mtrl-sci","http://creativecommons.org/licenses/by-nc-nd/4.0/","  Carbon nanotubes (CNTs) are stiff, all-carbon macromolecules with diameters
as small as one nanometer and few microns long. Solutions of CNTs in
chlorosulfonic acid (CSA) follow the phase behavior of rigid rod polymers
interacting via a repulsive potential and display a liquid crystalline phase at
sufficiently high concentration. Here, we show that small-angle X-ray
scattering and polarized light microscopy data can be combined to characterize
quantitatively the morphology of liquid crystalline phases formed in CNT
solutions at concentrations from 3 to 6.5 % by volume. We find that upon
increasing their concentration, CNTs self-assemble into a liquid crystalline
phase with a pleated texture and with a large inter-particle spacing that could
be indicative of a transition to higher-order liquid crystalline phases. We
explain how thermal undulations of CNTs can enhance their electrostatic
repulsion and increase their effective diameter by an order of magnitude. By
calculating the critical concentration, where the mean amplitude of undulation
of an unconstrained rod becomes comparable to the rod spacing, we find that
thermal undulations start to affect steric forces at concentrations as low as
the isotropic cloud point in CNT solutions.
","[{""version"":""v1"",""created"":""Wed, 9 Oct 2019 05:25:15 GMT""},{""version"":""v2"",""created"":""Wed, 27 Nov 2019 22:32:51 GMT""},{""version"":""v3"",""created"":""Tue, 22 Dec 2020 18:52:32 GMT""},{""version"":""v4"",""created"":""Fri, 5 Mar 2021 17:49:26 GMT""}]","2021-03-08"
"1910.03796","Janis N\""otzel","Janis N\""otzel","Entanglement-Enabled Communication","15 pages, 3 figures. Compound channel model added to the document in
  Remark 1. Typos fixed. Accepted for puplication in IEEE Journal on Selected
  Areas in Information Theory","IEEE Journal on Selected Areas in Information Theory, vol. 1, no.
  2, pp. 401-415, Aug. 2020","10.1109/JSAIT.2020.3017121",,"cs.IT math-ph math.IT math.MP quant-ph","http://arxiv.org/licenses/nonexclusive-distrib/1.0/","  We introduce and analyse a multiple-access channel with two senders and one
receiver, in the presence of i.i.d. noise coming from the environment. Partial
side information about the environmental states allows the senders to modulate
their signals accordingly. An adversarial jammer with its own access to
information on environmental states and the modulation signals can jam a
fraction of the transmissions. Our results show that for many choices of the
system parameters, entanglement shared between the two senders allows them to
communicate at non-zero rates with the receiver, while for the same parameters
the system forbids any communication without entanglement-assistance, even if
the senders have access to common randomness (local correlations). A simplified
model displaying a similar behaviour but with a compound channel instead of a
jammer is outlined to introduce basic aspects of the modeling.
  We complement these results by demonstrating that there even exist model
parameters for which entanglement-assisted communication is no longer possible,
but a hypothetical use of nonlocal no-signalling correlations between Alice and
Bob could enable them to communicate to Charlie again.
","[{""version"":""v1"",""created"":""Wed, 9 Oct 2019 05:33:38 GMT""},{""version"":""v2"",""created"":""Wed, 29 Jan 2020 21:30:13 GMT""},{""version"":""v3"",""created"":""Mon, 13 Jul 2020 08:34:07 GMT""},{""version"":""v4"",""created"":""Tue, 18 Aug 2020 15:42:10 GMT""}]","2020-09-25"
"1910.03797","John Middleditch","John Middleditch (University of California, retired)","Predicting the next local supernova","10 pages, 1 figure, v7 ""(even in \textit{un}-red/blueshifted H-alpha""
  in abstract, v8 BS2 at 38 days, not 30, v9 kinetic energy of the peak in the
  proton, 45.93 lt-d, h/(\sqrt{h^2 + d^2})",,,,"astro-ph.HE","http://arxiv.org/licenses/nonexclusive-distrib/1.0/","  Core collapse within blue supergiant stars, as occurred within Sk
-69$^{\circ}$202/Supernova 1987A, is generally attributed to a merger of two
electron-degenerate cores within a common envelope, with a merged mass in
excess of 1.4 solar. Supernova 1987A also had two associated bright sources,
one with about 8% of the H-alpha flux, and 74 milli-arc seconds distant by day
50, and another, four times fainter and 160 milli-arc seconds away in the
opposite direction on day 38. Using recent advances in our understanding of
pulsars, we can show that the second source was the result of the core-merger
process, which can drive a relativistic jet of particles prior to the
completion of the merger process, whether this proceeds to core collapse, or
not. As with those resulting from core-collapse, such beams and jets are likely
to produce an obvious spectral signature (e.g., even in un-red/blue-shifted
H-alpha), which can be detected in nearby galaxies. There is very likely a time
interval of a few months, during which such supergiant stars, a high fraction
of which will eventually undergo core collapse, can be identified. These can be
carefully followed observationally to maximize the chance of observing core
collapses as they happen. Such studies may eventually help in using such
objects as standard candles.
","[{""version"":""v1"",""created"":""Wed, 9 Oct 2019 05:33:58 GMT""},{""version"":""v2"",""created"":""Thu, 10 Oct 2019 04:06:35 GMT""},{""version"":""v3"",""created"":""Wed, 18 Mar 2020 02:32:23 GMT""},{""version"":""v4"",""created"":""Mon, 6 Apr 2020 05:17:08 GMT""},{""version"":""v5"",""created"":""Wed, 2 Dec 2020 06:42:57 GMT""},{""version"":""v6"",""created"":""Thu, 3 Dec 2020 03:40:07 GMT""},{""version"":""v7"",""created"":""Mon, 7 Dec 2020 03:56:12 GMT""}]","2020-12-08"
"1910.03798","Hossein Esfandiari","Hossein Esfandiari, MohammadTaghi HajiAghayi, Brendan Lucier, Michael
  Mitzenmacher","Prophets, Secretaries, and Maximizing the Probability of Choosing the
  Best",,,,,"cs.DS","http://arxiv.org/licenses/nonexclusive-distrib/1.0/","  Suppose a customer is faced with a sequence of fluctuating prices, such as
for airfare or a product sold by a large online retailer. Given distributional
information about what price they might face each day, how should they choose
when to purchase in order to maximize the likelihood of getting the best price
in retrospect? This is related to the classical secretary problem, but with
values drawn from known distributions. In their pioneering work, Gilbert and
Mosteller [\textit{J. Amer. Statist. Assoc. 1966}] showed that when the values
are drawn i.i.d., there is a thresholding algorithm that selects the best value
with probability approximately $0.5801$. However, the more general problem with
non-identical distributions has remained unsolved.
  In this paper we provide an algorithm for the case of non-identical
distributions that selects the maximum element with probability $1/e$, and we
show that this is tight. We further show that if the observations arrive in a
random order, this barrier of $1/e$ can be broken using a static threshold
algorithm, and we show that our success probability is the best possible for
any single-threshold algorithm under random observation order. Moreover, we
prove that one can achieve a strictly better success probability using more
general multi-threshold algorithms, unlike the non-random-order case. Along the
way, we show that the best achievable success probability for the random-order
case matches that of the i.i.d.\ case, which is approximately $0.5801$, under a
""no-superstars"" condition that no single distribution is very likely ex ante to
generate the maximum value. We also extend our results to the problem of
selecting one of the $k$ best values.
","[{""version"":""v1"",""created"":""Wed, 9 Oct 2019 05:36:04 GMT""}]","2019-10-10"
"1910.03799","Gutha Jaya Krishna","Gutha Jaya Krishna, Vadlamani Ravi","Large Scale Global Optimization by Hybrid Evolutionary Computation","29 Pages, 8 figures, 9 tables",,,,"cs.NE cs.AI","http://creativecommons.org/licenses/by-nc-sa/4.0/","  In management, business, economics, science, engineering, and research
domains, Large Scale Global Optimization (LSGO) plays a predominant and vital
role. Though LSGO is applied in many of the application domains, it is a very
troublesome and a perverse task. The Congress on Evolutionary Computation (CEC)
began an LSGO competition to come up with algorithms with a bunch of standard
benchmark unconstrained LSGO functions. Therefore, in this paper, we propose a
hybrid meta-heuristic algorithm, which combines an Improved and Modified
Harmony Search (IMHS), along with a Modified Differential Evolution (MDE) with
an alternate selection strategy. Harmony Search (HS) does the job of
exploration and exploitation, and Differential Evolution does the job of giving
a perturbation to the exploration of IMHS, as harmony search suffers from being
stuck at the basin of local optimal. To judge the performance of the suggested
algorithm, we compare the proposed algorithm with ten excellent meta-heuristic
algorithms on fifteen LSGO benchmark functions, which have 1000 continuous
decision variables, of the CEC 2013 LSGO special session. The experimental
results consistently show that our proposed hybrid meta-heuristic performs
statistically on par with some algorithms in a few problems, while it turned
out to be the best in a couple of problems.
","[{""version"":""v1"",""created"":""Wed, 9 Oct 2019 05:41:58 GMT""}]","2019-10-10"
"1910.03800","Zhiyong Tu","Lan Ju, Zhiyong Tu, Changyong Xue","Art Pricing with Computer Graphic Techniques",,,,,"q-fin.GN","http://arxiv.org/licenses/nonexclusive-distrib/1.0/","  This paper makes the first attempt to introduce the tools from computer
graphics into the art pricing research. We argue that the creation of a
painting calls for a combination of conceptual effort and painting effort from
the artist. However, as the important price determinants, both efforts are long
missing in the traditional hedonic model because they are hard to measure. This
paper draws on the digital pictures of auctioned paintings from various
renowned artists, and applies the image recognition techniques to measure the
variances of lines and colors of these paintings. We then use them as the
proxies for the artist's painting effort, and include them in the hedonic
regression to test their significance. Our results show that the variances of
lines and colors of a painting can significantly positively explain the sales
price in a general context. Our suggested measurements can better capture the
content heterogeneity of paintings hence improving on the traditional art
pricing methodology. Our approach also provides a quantitative perspective for
both valuation and authentication of paintings.
","[{""version"":""v1"",""created"":""Wed, 9 Oct 2019 05:43:20 GMT""}]","2019-10-10"
"1910.03801","Yangyang Chen","Yixin Bao and Yangyang Chen","Classification of abelian Nash manifolds",,,,,"math.RT math.AG","http://arxiv.org/licenses/nonexclusive-distrib/1.0/","  By the algebraization of affine Nash groups, a connected affine Nash group is
an abelian Nash manifold if and only if its algebraization is a real abelian
variety. We first classify real abelian varieties up to isomorphisms. Then with
a bit more efforts, we classify abelian Nash manifolds up to Nash equivalences.
","[{""version"":""v1"",""created"":""Wed, 9 Oct 2019 06:07:47 GMT""}]","2019-10-10"
