"1910.03947","Timofey Kormilitsyn","Timofey Kormilitsyn, Grigory Nemtsev, Roman Rodionov, Yury Kashchuk
  and Dmitry Portnov","Modelling of the NBI contribution to the neutron energy spectra for the
  ITER Vertical Neutron Camera","3-rd European Conference on Plasma Diagnostics Proceedings, 7 pages,
  7 figures",,"10.1088/1748-0221/14/10/C10019",,"physics.plasm-ph","http://arxiv.org/licenses/nonexclusive-distrib/1.0/","  The ITER Vertical Neutron Camera (VNC) is a multichannel collimator system
designed to measure the neutron emissivity profile and spectra. The energy
spectrum measurements of neutrons made by the VNC will contribute to the
reconstruction of the ion temperature, fuel ratio, and fast ion distribution
function. In this paper, the results of neutron spectra calculations for the
ITER VNC are presented. The developed software allows for the simulation of
particle spectra resulting from interaction of suprathermal ions with thermal
background plasma. The method relies on direct reaction rate calculation and
explicit fusion reaction kinematics modelling. The assessment of the D-T
neutron spectra is carried out for D-NBI heated baseline D-T ITER operation
scenarios. It is shown that neutron flux resulting from fast (beam) D with
thermal T ion interaction dominates at more than 16 MeV part of the spectra.
Thus, it is possible to assess fuel ratio based on calculated thermal-thermal
and beam-thermal neutron energy spectra. An ability to observe sawtooth-induced
mixing via VNC is studied. Lower energy boundary for the observable part of the
suprathermal ion distribution is derived.
","[{""version"":""v1"",""created"":""Wed, 9 Oct 2019 12:30:38 GMT""}]","2020-01-29"
"1910.03948","ChaeHwan Song","Armin Eftekhari, ChaeHwan Song, Volkan Cevher","Nearly Minimal Over-Parametrization of Shallow Neural Networks","This paper is submitted without consent of the co-authors",,,,"cs.LG stat.ML","http://arxiv.org/licenses/nonexclusive-distrib/1.0/","  A recent line of work has shown that an overparametrized neural network can
perfectly fit the training data, an otherwise often intractable nonconvex
optimization problem. For (fully-connected) shallow networks, in the best case
scenario, the existing theory requires quadratic over-parametrization as a
function of the number of training samples. This paper establishes that linear
overparametrization is sufficient to fit the training data, using a simple
variant of the (stochastic) gradient descent. Crucially, unlike several related
works, the training considered in this paper is not limited to the lazy regime
in the sense cautioned against in [1, 2]. Beyond shallow networks, the
framework developed in this work for over-parametrization is applicable to a
variety of learning problems.
","[{""version"":""v1"",""created"":""Wed, 9 Oct 2019 12:31:49 GMT""},{""version"":""v2"",""created"":""Tue, 29 Oct 2019 16:45:37 GMT""}]","2019-10-30"
"1910.03949","Colin Benjamin","Colin Benjamin, Aditya Dash","Thermodynamic susceptibility as a measure of cooperative behavior in
  social dilemmas","16 pages, 14 figures, accepted for publication in Chaos","Chaos 30, 093117 (2020)","10.1063/5.0015655",,"physics.soc-ph cond-mat.stat-mech","http://arxiv.org/licenses/nonexclusive-distrib/1.0/","  The emergence of cooperation in the thermodynamic limit of social dilemmas is
an emerging field of research. While numerical approaches (using replicator
dynamics) are dime a dozen, analytical approaches are rare. A particularly
useful analytical approach is to utilize a mapping between the spin-1/2 Ising
model in 1-D and the social dilemma game and calculate the magnetization, which
is the net difference between the fraction of cooperators and defectors in a
social dilemma. In this paper, we look at the susceptibility, which probes the
net change in the fraction of players adopting a certain strategy, for both
classical and quantum social dilemmas. The reason being, in statistical
mechanics problems, the thermodynamic susceptibility as compared to
magnetization is a more sensitive probe for microscopic behavior, e.g.,
observing small changes in a population adopting a certain strategy. In this
paper, we find the thermodynamic susceptibility for reward, sucker's payoff and
temptation in classical Prisoner's Dilemma to be positive, implying that the
turnover from defect to cooperate is greater than vice-versa, although the Nash
Equilibrium for the two-player game is to defect. In classical Hawk-Dove game,
the thermodynamic susceptibility for resource suggests that the number of
players switching to Hawk from Dove strategy is dominant. Entanglement in
Quantum Prisoner's Dilemma (QPD) has a non-trivial role in determining the
behavior of thermodynamic susceptibility. At maximal entanglement, we find that
sucker's payoff and temptation increase the number of players switching to
defect. In the zero-temperature limit, we find that there are two second-order
phase transitions in the game, marked by a divergence in the susceptibility.
This behavior is similar to that seen in Type-II superconductors wherein also
two second-order phase transitions are seen.
","[{""version"":""v1"",""created"":""Wed, 9 Oct 2019 12:34:29 GMT""},{""version"":""v2"",""created"":""Tue, 11 Aug 2020 19:45:24 GMT""}]","2020-09-10"
"1910.03950","Matthew Patitz","Daniel Hader, Aaron Koch, Matthew J. Patitz, and Michael Sharp","The Impacts of Dimensionality, Diffusion, and Directedness on Intrinsic
  Universality in the abstract Tile Assembly Model","A shortened version of this paper was accepted to SODA 2020",,,,"cs.CG","http://arxiv.org/licenses/nonexclusive-distrib/1.0/","  We present a series of results related to mathematical models of
self-assembling tiles and the impacts that three diverse properties have on
their dynamics. We expand upon a series of prior results which showed that (1)
the abstract Tile Assembly Model (aTAM) is intrinsically universal (IU) [FOCS
2012], and (2) the class of directed aTAM systems is not IU [FOCS 2016]. IU for
a model (or class of systems within a model) means that there is a universal
tile set which can be used to simulate an arbitrary system within that model
(or class). Furthermore, the simulation must not only produce the same
resultant structures, it must also maintain the full dynamics of the systems
being simulated modulo only a scale factor. While the FOCS 2012 result showed
the standard, two-dimensional (2D) aTAM is IU, here we show this is also the
case for the 3D version. Conversely, the FOCS 2016 result showed the class of
aTAM systems which are directed (a.k.a. deterministic, or confluent) is not IU,
implying that nondeterminism is fundamentally required for such simulations.
Here, however, we show that in 3D the class of directed aTAM systems is
actually IU, i.e. there is a universal directed simulator for them. We then
consider the influence of more rigid notions of dimensionality. Namely, we
introduce the Planar aTAM, where tiles are not only restricted to binding in
the plane, but also to traveling in the plane, and prove that the Planar aTAM
is not IU, and that the class of directed systems within the Planar aTAM also
is not IU. Finally, analogous to the Planar aTAM, we introduce the Spatial
aTAM, its 3D counterpart, and prove that it is IU.
  To prove our positive results we have not only designed, but also implemented
what we believe to be the first IU tile set ever implemented and simulated in
any tile assembly model. We've made it and a simulator which can demonstrate it
freely available.
","[{""version"":""v1"",""created"":""Wed, 9 Oct 2019 12:36:04 GMT""}]","2019-10-10"
"1910.03951","Oliver Pfaffel","Claus Baumgart, Johannes Krebs, Robert Lempertseder, Oliver Pfaffel","Quantifying Life Insurance Risk using Least-Squares Monte Carlo",,"Der Aktuar 02.2019",,,"q-fin.RM","http://arxiv.org/licenses/nonexclusive-distrib/1.0/","  This article presents a stochastic framework to quantify the biometric risk
of an insurance portfolio in solvency regimes such as Solvency II or the Swiss
Solvency Test (SST). The main difficulty in this context constitutes in the
proper representation of long term risks in the profit-loss distribution over a
one year horizon. This will be resolved by using least-squares Monte Carlo
methods to quantify the impact of new experience on the annual re-valuation of
the portfolio. Therefore our stochastic model can be seen as an example for an
internal model, as allowed under Solvency II or the SST. Since our model does
not rely upon nested simulations it is computationally fast and easy to
implement.
","[{""version"":""v1"",""created"":""Wed, 9 Oct 2019 12:36:45 GMT""}]","2019-10-10"
"1910.03952","Anshuman Kumar","Muralidhar Nalabothula and Pankaj Jha and Tony Low and Anshuman Kumar","Engineering quantum interference in van der Waals heterostructures",,"Phys. Rev. B 102, 045416 (2020)","10.1103/PhysRevB.102.045416",,"cond-mat.mes-hall physics.optics","http://arxiv.org/licenses/nonexclusive-distrib/1.0/","  In this paper, we present a novel route to tunable spontaneous valley
coherence in heterostructures of two dimensional valleytronic materials with
other layered materials hosting anisotropic polaritonic modes. We first discuss
the dependence of this coherence on the conductivity tensor of the anisotropic
part of a general heterostructure and on its geometrical configuration.
Subsequently, we propose two implementations - one, using anisotropic plasmons
in phosphorene and another with hyperbolic phonon polaritons in MoO3. In both
these systems we show for the first time electrostatic tunability of the
spontaneous valley coherence achieving unprecedented values of up to 80% in the
near to mid infrared wavelengths at room temperature. The tunability of this
valley coherence shown in these heterostructures will enable the realization of
active valleytronic quantum circuitry.
","[{""version"":""v1"",""created"":""Wed, 9 Oct 2019 12:38:51 GMT""}]","2020-07-22"
"1910.03953","Dung Le Anh","Dung Le Anh","Diffractive dissociation in oniu-nucleus scattering from a partonic
  picture","6 pages, 4 figures; Presented at EDS Blois 2019 Conference, Quy Nhon,
  Vietnam, June 23--28, 2019",,,,"hep-ph","http://arxiv.org/licenses/nonexclusive-distrib/1.0/","  We present a partonic picture for diffractive onium-nucleus scattering in the
large-number-of-color limit from which the distribution of rapidity gaps in a
certain kinematic region can be deduced. This picture allows us to draw a
parallel between diffractive dissociation and the genealogy of partonic
evolution, the latter being essentially similar to a branching-diffusion
process in which the branching is the parton splitting, and the diffusion
occurs in the transverse momenta of the partons. In particular, we show that
the rapidity gap distribution corresponds to the distribution of the splitting
rapidity of the last common ancestor of the partons whose transverse momenta
are smaller than the nuclear saturation scale, when the scattering process is
viewed in the restframe of the nucleus. Numerical calculations are also
implemented to support the analytical predictions.
","[{""version"":""v1"",""created"":""Wed, 9 Oct 2019 12:40:16 GMT""}]","2019-10-10"
"1910.03954","Jiayu Zhou","Jiayu Zhou and Deli Qiao","Alternate Distributed Beamforming for Decode-and-Forward Multi-Relay
  Systems Using Buffers",,,,,"cs.IT math.IT","http://arxiv.org/licenses/nonexclusive-distrib/1.0/","  In this paper, link selection for half-duplex buffer-aided relay systems is
revisited. A new fixed scheduling policy referred as alternate distributed
beamforming (ADB) is proposed, in which the relays are divided into two groups,
with one group receiving the same information broadcast from the source and the
other group transmitting the common messages to the destination via distributed
beamforming in each time slot. It is worth noting that the relays used for
reception and transmission are determined without the need of instantaneous
channel state information (CSI). Theoretical analysis of the achievable
throughput of the proposed scheme in Rayleigh fading is provided and the
approximate closed-form expressions are derived. Through numerical results, it
is shown that compared with existing link selection policies, the proposed
fixed scheduling ADB achieves a significant improvement in achievable
throughput.
","[{""version"":""v1"",""created"":""Wed, 9 Oct 2019 12:44:27 GMT""}]","2019-10-10"
"1910.03955","Long Ji","L. Ji, V. Doroshenko, A. Santangelo, C. Gungor, S. Zhang, L. Ducci,
  S.-N. Zhang, M.-Y. Ge, L.J. Qu, Y.P. Chen, Q.C.Bu, X.L. Cao, Z. Chang, G.
  Chen, L.Chen, T.X. Chen, Y.Chen, Y.B. Chen, W. Cui, W.W. Cui, J.K. Deng, Y.W.
  Dong, Y.Y. Du, M.X. Fu, G.H. Gao, H. Gao, M. Gao, Y.D. Gu, J. Guan, C.C. Guo,
  D.W. Han, W. Hu, Y. Huang, J. Huo, S.M. Jia, L.H. Jiang, W.C. Jiang, J. Jin,
  Y.J. Jin, L.D. Kong, B. Li, C.K.Li, G. Li, M.S. Li, T.P. Li, W. Li, X. Li,
  X.B. Li, X.F. Li, Y.G. Li, Z.J. Li, Z.W. Li, X.H. Liang, J.Y. Liao, C.Z. Liu,
  G.Q. Liu, H.W. Liu, S.Z. Liu, X.J. Liu, Y. Liu, Y.N. Liu, B. Lu, F.J. Lu,
  X.F. Lu, T. Luo, X. Ma, B. Meng, Y. Nang, J.Y. Nie, G. Ou, N. Sai, L.M. Song,
  X.Y. Song, L. Sun, Y. Tan, L. Tao, Y.L. Tuo, G.F. Wang, J.Wang, W.S. Wang,
  Y.S. Wang, X.Y. Wen, B.B. Wu, M. Wu, G.C. Xiao, S.L. Xiong, H.Xu, Y.P. Xu,
  Y.R. Yang, J.W. Yang, S. Yang, Y.J. Yang, A.M. Zhang, C.L. Zhang, C.M. Zhang,
  F. Zhang, H.M. Zhang, J. Zhang, Q. Zhang, T. Zhang, W. Zhang, W.C. Zhang,
  W.Z. Zhang, Y. Zhang, Y. Zhang, Y.F. Zhang, Y.J. Zhang, Z. Zhang, Z.L. Zhang,
  H.S. Zhao, J.L. Zhao, X.F. Zhao, S.J. Zheng, Y. Zhu, Y.X. Zhu and C.L. Zou","Timing analysis of 2S 1417-624 observed with NICER and Insight-HXMT","7 pages, 4 figures, 1 tables, accepted for publication in MNRAS",,"10.1093/mnras/stz2745",,"astro-ph.HE","http://arxiv.org/licenses/nonexclusive-distrib/1.0/","  We present a study of timing properties of the accreting pulsar 2S 1417-624
observed during its 2018 outburst, based on Swift/BAT, Fermi/GBM, Insight-HXMT
and NICER observations. We report a dramatic change of the pulse profiles with
luminosity. The morphology of the profile in the range 0.2-10.0keV switches
from double to triple peaks at $\sim2.5$ $\rm \times 10^{37}{\it D}_{10}^2\
erg\ s^{-1}$ and from triple to quadruple peaks at $\sim7$ $\rm \times
10^{37}{\it D}_{10}^2\ erg\ s^{-1}$. The profile at high energies (25-100keV)
shows significant evolutions as well. We explain this phenomenon according to
existing theoretical models. We argue that the first change is related to the
transition from the sub to the super-critical accretion regime, while the
second to the transition of the accretion disc from the gas-dominated to the
radiation pressure-dominated state. Considering the spin-up as well due to the
accretion torque, this interpretation allows to estimate the magnetic field
self-consistently at $\sim7\times 10^{12}$G.
","[{""version"":""v1"",""created"":""Wed, 9 Oct 2019 12:45:03 GMT""}]","2019-11-06"
"1910.03956","Zhixiong Li","Z.-X. Li, Yunshan Cao, X. R. Wang, and Peng Yan","Realizing Corner States in Artificial Crystals Based on Topological Spin
  Textures","11 pages, 10 figures","Phys. Rev. Applied 13, 064058 (2020)","10.1103/PhysRevApplied.13.064058",,"cond-mat.mes-hall","http://arxiv.org/licenses/nonexclusive-distrib/1.0/","  The recent discovery of higher-order topological insulators (HOTIs) has
significantly extended our understanding of topological phases of matter. Here,
we predict that second-order corner states can emerge in the dipolar-coupled
dynamics of topological spin textures in two-dimensional artificial crystals.
Taking a breathing honeycomb lattice of magnetic vortices as an example, we
derive the full phase diagram of collective vortex gyrations and identify three
types of corner states that have not been discovered before. We show that the
topological ""zero-energy"" corner modes are protected by a generalized chiral
symmetry in the sexpartite lattice, leading to particular robustness against
disorder and defects, although the conventional chiral symmetry of bipartite
lattices is absent. We propose the use of the quantized $\mathbb{Z}_{6}$ Berry
phase to characterize the nontrivial topology. Interestingly, we observe corner
states at either obtuse-angled or acute-angled corners, depending on whether
the lattice boundary has an armchair or zigzag shape. Full micromagnetic
simulations confirm the theoretical predictions with good agreement.
Experimentally, we suggest using the recently developed ultrafast Lorentz
microscopy technique [M\""{o}ller \emph{et al}.,{arXiv:1907.04608}] to detect
the topological corner states by tracking the nanometer-scale vortex orbits in
a time-resolved manner. Our findings open up a promising route for realizing
higher-order topologically protected corner states in magnetic systems and
finally achieving topological spintronic memory and computing.
","[{""version"":""v1"",""created"":""Wed, 9 Oct 2019 12:46:19 GMT""}]","2020-07-01"
"1910.03957","Henni Ouerdane","I. Luchnikov, A. Ryzhov, P.-J. C. Stas, S. N. Filippov, H. Ouerdane","Variational autoencoder reconstruction of complex many-body physics",,"Entropy vol. 21, 1091 (2019)","10.3390/e21111091",,"quant-ph cond-mat.stat-mech","http://arxiv.org/licenses/nonexclusive-distrib/1.0/","  Given the notably increasing complexity of mathematical models to study
realistic systems and their coupling to their environment that constrains their
dynamics, both analytical approaches and numerical methods that build on these
models, show limitations in scope or applicability. On the other hand, machine
learning, i.e. data-driven, methods prove to be increasingly efficient for the
study of complex quantum systems. Deep neural networks in particular have been
successfully applied to many-body quantum dynamics simulations and to quantum
matter phase characterization. In the present work, we show how to use a
variational autoencoder (VAE) -- a state-of-the-art tool in the field of deep
learning for the simulation of probability distributions of complex systems.
More precisely, we transform a quantum mechanical problem of many-body state
reconstruction into a statistical problem, suitable for VAE, by using
informationally complete positive operator-valued measure. We show with the
paradigmatic quantum Ising model in a transverse magnetic field, that the
ground-state physics, such as, e.g., magnetization and other mean values of
observables, of a whole class of quantum many-body systems can be reconstructed
by using VAE learning of tomographic data, for different parameters of the
Hamiltonian, and even if the system undergoes a quantum phase transition. We
also discuss challenges related to our approach as entropy calculations pose
particular difficulties.
","[{""version"":""v1"",""created"":""Wed, 9 Oct 2019 12:46:32 GMT""}]","2019-11-11"
"1910.03958","Ashim Kumar Pramanik Dr.","Renu Gupta, Imtiaz Noor Bhatti and A K Pramanik","Site dilution and charge disorder effect on physical properties in
  SrRu$_{1-x}$Ga$_x$O$_3$","12 figures, To appear in JPCM",,"10.1088/1361-648X/ab49a1",,"cond-mat.str-el","http://arxiv.org/licenses/nonexclusive-distrib/1.0/","  Here, we report an evolution of structural, magnetic and transport behavior
in doped SrRu$_{1-x}$Ga$_x$O$_3$ ($x$ $\le$ 0.2). The nonmagnetic dopant
Ga$^{3+}$ (3$d^{10}$) not only acts for magnetic site dilution in SrRuO$_3$ but
also it modifies the Ru charge state and electronic density. Our studies show
that Ga$^{3+}$ substitution does not affect the original
orthorhombic-\textit{Pbnm} structure of SrRuO$_3$ which is due to its matching
ionic radii with Ru$^{4+}$. However, Ga$^{3+}$ has a substantial effect on the
magnetic behavior of SrRuO$_3$ where it decreases both magnetic moment as well
as magnetic transition temperature $T_c$. Further, this dilution induces
Griffiths phase behavior across $T_c$ and cluster-glass behavior at low
temperature with higher concentration of doping. The magnetic critical exponent
$\beta$ increases with $x$ due to this site dilution effect. The Ga$^{3+}$
induces an insulating state in SrRuO$_3$ with $x$ $>$ 0.05. The charge
transport in paramagnetic as well as in insulating state of samples can be well
described with Mott's modified variable-range-hopping model. The metallic
charge transport just below $T_c$ in SrRuO$_3$ obeys Fermi liquid behavior
which, however breaks down at low temperature. We further find a correlation
between field dependent magnetoresistance and magnetization through power-law
behavior over the series.
","[{""version"":""v1"",""created"":""Wed, 9 Oct 2019 12:46:32 GMT""}]","2019-10-10"
"1910.03959","Martin Simon","M. C. Simon (on behalf of the ASACUSA collaboration)","Rabi Experiments on the $\sigma$ and $\pi$ Hyperfine Transitions in
  Hydrogen and Status of ASACUSA's Antihydrogen Program","Presented at the Eighth Meeting on CPT and Lorentz Symmetry,
  Bloomington, Indiana, May 12-16, 2019",,,,"hep-ph hep-ex physics.atom-ph","http://arxiv.org/licenses/nonexclusive-distrib/1.0/","  We report on the status of the in-beam hyperfine-structure measurements on
ground-state antihydrogen by ASACUSA and on recent results obtained in
supporting measurements from hydrogen. The $\sigma_1$ and $\pi_1$ transitions
can now be investigated, which is beneficial from both theoretical and
experimental perspectives. We discuss systematic effects from resonance
interference originating from the chosen field geometries in the interaction
region, and how their impact can be managed by appropriate data-taking or
design concepts.
","[{""version"":""v1"",""created"":""Wed, 9 Oct 2019 12:49:53 GMT""},{""version"":""v2"",""created"":""Wed, 16 Oct 2019 08:08:32 GMT""}]","2019-10-17"
"1910.03960","Alexey Ovchinnikov","Alexey Ovchinnikov, Gleb Pogudin, and Peter Thompson","Input-output equations and identifiability of linear ODE models",,,"10.1109/TAC.2022.3145571",,"math.DS cs.SC cs.SY eess.SY math.AC","http://arxiv.org/licenses/nonexclusive-distrib/1.0/","  Structural identifiability is a property of a differential model with
parameters that allows for the parameters to be determined from the model
equations in the absence of noise. The method of input-output equations is one
method for verifying structural identifiability. This method stands out in its
importance because the additional insights it provides can be used to analyze
and improve models. However, its complete theoretical grounds and applicability
are still to be established. A subtlety and key for this method to work
correctly is knowing whether the coefficients of these equations are
identifiable.
  In this paper, to address this, we prove identifiability of the coefficients
of input-output equations for types of differential models that often appear in
practice, such as linear models with one output and linear compartment models
in which, from each compartment, one can reach either a leak or an input. This
shows that checking identifiability via input-output equations for these models
is legitimate and, as we prove, that the field of identifiable functions is
generated by the coefficients of the input-output equations. Finally, we
exploit a connection between input-output equations and the transfer function
matrix to show that, for a linear compartment model with an input and strongly
connected graph, the field of all identifiable functions is generated by the
coefficients of the transfer function matrix even if the initial conditions are
generic.
","[{""version"":""v1"",""created"":""Wed, 9 Oct 2019 12:53:23 GMT""},{""version"":""v2"",""created"":""Sat, 11 Jul 2020 20:54:06 GMT""},{""version"":""v3"",""created"":""Mon, 27 Jul 2020 17:28:51 GMT""},{""version"":""v4"",""created"":""Sun, 21 Feb 2021 18:00:03 GMT""},{""version"":""v5"",""created"":""Thu, 27 Jan 2022 17:02:05 GMT""}]","2022-01-28"
"1910.03961","Gianmaria Verzini","Benedetta Pellacci, Angela Pistoia, Giusi Vaira and Gianmaria Verzini","Normalized concentrating solutions to nonlinear elliptic problems","34 pages",,,,"math.AP","http://arxiv.org/licenses/nonexclusive-distrib/1.0/","  We prove the existence of solutions $(\lambda, v)\in \mathbb{R}\times
H^{1}(\Omega)$ of the elliptic problem \[ \begin{cases}
  -\Delta v+(V(x)+\lambda) v =v^{p}\ &\text{ in $ \Omega, $}
  \ v>0,\qquad \int_\Omega v^2\,dx =\rho. \end{cases} \] Any $v$ solving such
problem (for some $\lambda$) is called a normalized solution, where the
normalization is settled in $L^2(\Omega)$. Here $\Omega$ is either the whole
space $\mathbb R^N$ or a bounded smooth domain of $\mathbb R^N$, in which case
we assume $V\equiv0$ and homogeneous Dirichlet or Neumann boundary conditions.
Moreover, $1<p<\frac{N+2}{N-2}$ if $N\ge 3$ and $p>1$ if $N=1,2$. Normalized
solutions appear in different contexts, such as the study of the Nonlinear
Schr\""odinger equation, or that of quadratic ergodic Mean Field Games systems.
We prove the existence of solutions concentrating at suitable points of
$\Omega$ as the prescribed mass $\rho$ is either small (when $p<1+\frac 4N$) or
large (when $p>1+\frac 4N$) or it approaches some critical threshold (when
$p=1+\frac 4N$).
","[{""version"":""v1"",""created"":""Wed, 9 Oct 2019 12:54:36 GMT""}]","2019-10-10"
