"1908.09557","Subhashis Banerjee","Prashant Agrawal, Kabir Tomer, Abhinav Nakarmi, Mahabir Prasad
  Jhanwar, Subodh Sharma, Subhashis Banerjee","On recoverability from failures in dual voting",,,,,"cs.CR cs.CY","http://arxiv.org/licenses/nonexclusive-distrib/1.0/","  Verifiable voting systems have been around for a while. There are two primary
approaches for achieving verifiability: a) through end-to-end verifiable voting
(E2E-V) systems that offer cryptographic guarantees of correctness, and b)
through risk-limiting audit systems that do not rely on cryptography but verify
the tally reported by an electronic vote tabulation system against
voter-verified paper records (VVPRs). However, while end-to-end verifiable
methods lack easy methods of recovery in case elections fail to verify,
risk-limiting audit based methods usually require the electorate to trust the
post-election custody chain of the VVPRs. In this paper we examine recovery
from elections in dual voting, which combines the formal guarantees of E2E-V
with the simplicity of VVPR-based audit.
  We argue that large public elections should not only be publicly verifiable,
but, in case of verification failures, there should also be transparent methods
of recovery without necessarily re-running entire elections. We focus on
multi-polling booth elections and formally define the concept of recoverability
for such protocols. Informally, our formulation captures the ability to
verifiably identify the polling booths contributing to verification failures,
and the partial tally contributed by the other booths, without leaking any
additional information. This enables possible recovery through limited
re-polling, without necessitating a complete re-run of the election or
privileging the paper tally over the electronic one. We also propose a
multi-polling booth voting protocol called \emph{OpenVoting} that achieves our
proposed recoverability requirements.
","[{""version"":""v1"",""created"":""Mon, 26 Aug 2019 09:32:54 GMT""},{""version"":""v2"",""created"":""Thu, 10 Oct 2019 02:19:08 GMT""},{""version"":""v3"",""created"":""Wed, 26 Feb 2020 05:22:41 GMT""},{""version"":""v4"",""created"":""Fri, 6 Mar 2020 10:42:20 GMT""},{""version"":""v5"",""created"":""Sat, 20 Jun 2020 06:48:06 GMT""},{""version"":""v6"",""created"":""Tue, 6 Dec 2022 08:03:57 GMT""},{""version"":""v7"",""created"":""Sat, 20 May 2023 00:20:41 GMT""}]","2023-05-23"
"1908.09558","Anton Frisk Kockum","Anton Frisk Kockum, Franco Nori","Quantum bits with Josephson junctions","30 pages, 10 figures. Book chapter for a new edition of Barone and
  Paterno's ""Fundamentals and Physics and Applications of the Josephson
  Effect"". Final version","in ""Fundamentals and Frontiers of the Josephson Effect"", edited by
  Francesco Tafuri (Springer, 2019)","10.1007/978-3-030-20726-7_17",,"quant-ph cond-mat.mes-hall","http://arxiv.org/licenses/nonexclusive-distrib/1.0/","  Already in the first edition of this book (Barone and Paterno, ""Fundamentals
and Physics and Applications of the Josephson Effect"", Wiley 1982), a great
number of interesting and important applications for Josephson junctions were
discussed. In the decades that have passed since then, several new applications
have emerged. This chapter treats one such new class of applications: quantum
optics and quantum information processing (QIP) based on superconducting
circuits with Josephson junctions. In this chapter, we aim to explain the
basics of superconducting quantum circuits with Josephson junctions and
demonstrate how these systems open up new prospects, both for QIP and for the
study of quantum optics and atomic physics.
","[{""version"":""v1"",""created"":""Mon, 26 Aug 2019 09:33:13 GMT""}]","2019-08-27"
"1908.09559","Guo Chuan Thiang","Guo Chuan Thiang","Edge-following topological states","27 pages, 7 figures, revised version for publication in J. Geom. Phys","J. Geom. Phys. 156 (2020) 103796","10.1016/j.geomphys.2020.103796",,"math-ph cond-mat.mes-hall math.KT math.MP math.OA","http://arxiv.org/licenses/nonexclusive-distrib/1.0/","  We prove that Chern insulators have topologically protected edge states which
not only propagate unidirectionally along a straight line boundary, but also
swerve around arbitrary-angled corners and geometric imperfections of the
material boundary. This is a physical manifestation of the index theory of
certain semigroup operator algebras.
","[{""version"":""v1"",""created"":""Mon, 26 Aug 2019 09:34:37 GMT""},{""version"":""v2"",""created"":""Wed, 28 Aug 2019 08:43:38 GMT""},{""version"":""v3"",""created"":""Sun, 28 Jun 2020 07:32:26 GMT""}]","2020-06-30"
"1908.09560","Christoph Jud","Christoph Jud, Damien Nguyen, Alina Giger, Robin Sandk\""uhler, Miriam
  Krieger, Tony Lomax, Rares Salomir, Oliver Bieri, Philippe C. Cattin","Accelerated Motion-Aware MR Imaging via Motion Prediction from K-Space
  Center",,,,,"eess.IV cs.CV","http://arxiv.org/licenses/nonexclusive-distrib/1.0/","  Motion has been a challenge for magnetic resonance (MR) imaging ever since
the MR has been invented. Especially in volumetric imaging of thoracic and
abdominal organs, motion-awareness is essential for reducing motion artifacts
in the final image. A recently proposed MR imaging approach copes with motion
by observing the motion patterns during the acquisition. Repetitive scanning of
the k-space center region enables the extraction of the patient motion while
acquiring the remaining part of the k-space. Due to highly redundant
measurements of the center, the required scanning time of over 11 min and the
reconstruction time of 2 h exceed clinical applicability though. We propose an
accelerated motion-aware MR imaging method where the motion is inferred from
small-sized k-space center patches and an initial training phase during which
the characteristic movements are modeled. Thereby, acquisition times are
reduced by a factor of almost 2 and reconstruction times by two orders of
magnitude. Moreover, we improve the existing motion-aware approach with a
systematic temporal shift correction to achieve a sharper image reconstruction.
We tested our method on 12 volunteers and scanned their lungs and abdomen under
free breathing. We achieved equivalent to higher reconstruction quality using
the motion-prediction compared to the slower existing approach.
","[{""version"":""v1"",""created"":""Mon, 26 Aug 2019 09:35:34 GMT""}]","2019-08-27"
"1908.09561","Yang Lan","Yang Lan","Blow-up dynamics for $L^2$-critical fractional Schr\""odinger equations","41 pages. Part of the proof has been reorganized",,,,"math.AP","http://arxiv.org/licenses/nonexclusive-distrib/1.0/","  In this paper, we will consider the $L^2$-critical fractional Schr\""odinger
equation $iu_t-|D|^{\beta}u+|u|^{2\beta}u=0$ with initial data $u_0\in
H^{\beta/2}(\mathbb{R})$ and $\beta$ close to $2$. We will show that the
solution blows up in finite time if the initial data has negative energy and
slightly supercritical mass. We will also give a specific description for the
blow-up dynamics. This is an extension of the work of F. Merle and P. Rapha\""el
for $L^2$-critical Schr\""odinger equations but the nonlocal structure of this
equation and the lack of some symmetries make the analysis more complicated,
hence some new strategies are required.
","[{""version"":""v1"",""created"":""Mon, 26 Aug 2019 09:35:39 GMT""},{""version"":""v2"",""created"":""Tue, 30 Mar 2021 14:54:48 GMT""}]","2021-03-31"
"1908.09562","Sanjoy Mandal","Eung Jin Chun, Arindam Das, Sanjoy Mandal, Manimala Mitra and Nita
  Sinha","Sensitivity of Lepton Number Violating Meson Decays in Different
  Experiments","40 pages, 46 figures","Phys. Rev. D 100, 095022 (2019)","10.1103/PhysRevD.100.095022","OU-HEP-1016, IP/BBSR/2019-4","hep-ph hep-ex","http://arxiv.org/licenses/nonexclusive-distrib/1.0/","  We study the discovery prospect of different three body lepton number
violating~(LNV) meson decays $M_{1}^{-}\to\ell_{1}^{-}\ell_{2}^{-}M_{2}^{+}$ in
the framework of right handed~(RH) neutrino extended Standard Model~(SM). We
consider a number of ongoing experiments, such as, NA62 and LHCb at CERN, Belle
II at SuperKEK, as well as at the proposed future experiments, SHiP, MATHUSLA
and FCC-ee. The RH Majorana neutrino $N$ mediating these meson decays provides
a resonant enhancement of the rates, if the mass of $N$ lies in the range
$(100\, \text{MeV}-6\, \text{GeV})$. We consider the effect of parent mesons
velocity, as well as, the effect of finite detector size. Using the expected
upper limits on the number of events for the LNV decay modes, $M_{1}^{-}
\to\ell_1^{-}\ell_2^{-}\pi^{+}$~($M_{1}=B, B_c,D, D_{s}\,\text{and}\,K$), we
analyze the sensitivity reach of the mixing angles $|V_{e N}|^{2}$, $|V_{\mu
N}|^{2}$, $|V_{\tau N}|^{2}$, $|V_{e N}V_{\mu N}|$, $|V_{e N}V_{\tau N}|$ and
$|V_{\mu N}V_{\tau N}|$ as a function of heavy neutrino mass $M_{N}$. We show
that, inclusion of parent meson velocity can account to a large difference for
active-sterile mixing, specially for $D$, $D_s$ meson decay at SHiP and $K$
meson decay at NA62. Taking into account the velocity of the $D_s$ meson, the
future beam dump experiment SHiP can probe $|V_{eN}|^2 \sim 10^{-9}$. For RH
neutrino mass in between 2 - 5 GeV, MATHUSLA can provide best sensitivity reach
of active-sterile mixings.
","[{""version"":""v1"",""created"":""Mon, 26 Aug 2019 09:36:26 GMT""},{""version"":""v2"",""created"":""Wed, 4 Sep 2019 09:45:34 GMT""}]","2019-11-27"
"1908.09563","Simona Toscano","S. Toscano, P. Coppin, K. D. de Vries, N. van Eijndhoven, J. A.
  Aguilar","Hybrid detection of high-energy cosmic neutrinos with the
  next-generation neutrino detectors at the South Pole","8 pages, 4 figures, in proceedings of 36th International Cosmic Ray
  Conference",,,,"hep-ex astro-ph.HE astro-ph.IM","http://arxiv.org/licenses/nonexclusive-distrib/1.0/","  In 2013 the IceCube collaboration announced the discovery of a cosmic
neutrino flux up to PeV energies, validating neutrino astronomy as the next
promising observational technique to explore the high-energy Universe. The
neutrino community is moving forward with the construction of new facilities to
enhance the detection of these elusive particles at higher energies (up to and
beyond EeV) and to increase the statistics at the high-energy end of the
IceCube neutrino flux. Future large volume neutrino detectors, using both the
radio Askaryan and the optical Cherenkov signal, will open the possibility of
hybrid detection of neutrino interactions within the polar ice. In this
contribution we present a first calculation of the expected number of events
for a simplified geometry of one radio station located at 200 m depth in the
vicinity of a ~10 km^3 in-ice Cherenkov detector, similar to the planned
IceCube-Gen2 neutrino observatory. Preliminary simulations show that a total
event rate of ~1 event/year is achievable for a 10-stations array assuming that
the Askaryan radio detectors can lower their energy threshold down to ~PeV
energies. Such a possibility is currently under study for the future radio
extension foreseen as one of the surface components of IceCube-Gen2.
","[{""version"":""v1"",""created"":""Mon, 26 Aug 2019 09:41:25 GMT""}]","2019-08-27"
"1908.09564","Qiang Tang","Qiang Tang","Towards Blockchain-enabled Searchable Encryption",,,,,"cs.CR","http://arxiv.org/licenses/nonexclusive-distrib/1.0/","  Distributed Leger Technologies (DLTs), most notably Blockchain technologies,
bring decentralised platforms that eliminate a single trusted third party and
avoid the notorious single point of failure vulnerability. Since Nakamoto's
Bitcoin cryptocurrency system, an enormous number of decentralised applications
have been proposed on top of these technologies, aiming at more transparency
and trustworthiness than their traditional counterparts. These applications
spread over a lot of areas, e.g. financial services, healthcare,
transportation, supply chain management, and cloud computing. While Blockchain
brings transparency and decentralised trust intuitively due to the consensus of
a (very large) group of nodes (or, miners), it introduces very subtle
implications for other desirable properties such as privacy. In this work, we
demonstrate these subtle implications for Blockchain-based searchable
encryption solutions, which are one specific use case of cloud computing
services. These solutions rely on Blockchain to achieve both the standard
privacy property and the new fairness property, which requires that search
operations are carried out faithfully and are rewarded accordingly. We show
that directly replacing the server in an existing searchable encryption
solution with a Blockchain will cause undesirable operational cost, privacy
loss, and security vulnerabilities. The analysis results indicate that a
dedicated server is still needed to achieve the desired privacy guarantee. To
this end, we propose two frameworks which can be instantiated based on most
existing searchable encryption schemes. Through analysing these two frameworks,
we affirmatively show that a carefully engineered Blockchain-based solution can
achieve the desired fairness property while preserving the privacy guarantee of
the original searchable encryption scheme simultaneously.
","[{""version"":""v1"",""created"":""Mon, 26 Aug 2019 09:43:58 GMT""},{""version"":""v2"",""created"":""Tue, 19 Nov 2019 19:56:12 GMT""}]","2019-11-21"
"1908.09565","Marian Albers","Marian Albers, Pascal S. Meysonnat, Daniel Fernex, Richard Semaan,
  Bernd R. Noack, Wolfgang Schr\""oder","Drag Reduction and Energy Saving by Spanwise Traveling Transversal
  Surface Waves for Flat Plate Flow",,,,,"physics.flu-dyn","http://arxiv.org/licenses/nonexclusive-distrib/1.0/","  Wall-resolved large-eddy simulations are performed to study the impact of
spanwise traveling transversal surface waves in zero-pressure gradient
turbulent boundary layer flow. Eighty variations of wavelength, period, and
amplitude of the space- and time-dependent sinusoidal wall motion are
considered for a boundary layer at a momentum thickness based Reynolds number
of $Re_\theta = 1000$. The results show a strong decrease of friction drag of
up to $26\,\%$ and considerable net power saving of up to $10\,\%$. However,
the highest net power saving does not occur at the maximum drag reduction. The
drag reduction is modeled as a function of the actuation parameters by support
vector regression using the LES data.
  A substantial attenuation of the near-wall turbulence intensity and
especially a weakening of the near-wall velocity streaks are observed.
Similarities between the current actuation technique and the method of a
spanwise oscillating wall without any normal surface deflection are reported.
In particular, the generation of a directional spanwise oscillating Stokes
layer is found to be related to skin-friction reduction.
","[{""version"":""v1"",""created"":""Mon, 26 Aug 2019 09:44:39 GMT""}]","2019-08-27"
"1908.09566","Saman Majdi","Nattakarn Suntornwipat, Saman Majdi, Markus Gabrysch, Ian Friel and
  Jan Isberg","Observation of transferred-electron oscillations in diamond","5 pages, 5 figures and 1 table",,"10.1063/1.5126058",,"cond-mat.mtrl-sci cond-mat.mes-hall","http://arxiv.org/licenses/nonexclusive-distrib/1.0/","  The transferred-electron oscillator (TEO) is a device used in microwave
applications that utilizes the negative differential mobility (NDM) effect to
generate continuous oscillations. Recently, NDM was observed in intrinsic
single-crystalline chemical vapor deposition (SC-CVD) diamond. The occurrence
was explained by the electron repopulation between its different conduction
band valleys. This paper presents the results of constructing a diamond TEO
based on the NDM effect. A series of experiments has been performed for varying
voltages, temperatures and resonator parameters on three SC-CVD diamond samples
of different thicknesses. For the temperature range 90-300 K, we observe
transferred-electron oscillations in diamond.
","[{""version"":""v1"",""created"":""Mon, 26 Aug 2019 09:44:43 GMT""}]","2020-01-08"
"1908.09567","Eirik Berge","Eirik Berge","$\alpha$-modulation spaces for step two stratified Lie groups",,,,,"math.FA math.MG","http://arxiv.org/licenses/nonexclusive-distrib/1.0/","  We define and investigate $\alpha$-modulation spaces $M_{p,q}^{s,\alpha}(G)$
associated to a step two stratified Lie group $G$ with rational structure
constants. This is an extension of the Euclidean $\alpha$-modulation spaces
$M_{p,q}^{s,\alpha}(\mathbb{R}^n)$ that act as intermediate spaces between the
modulation spaces ($\alpha = 0$) in time-frequency analysis and the Besov
spaces ($\alpha = 1$) in harmonic analysis. We will illustrate that the the
group structure and dilation structure on $G$ affect the boundary cases $\alpha
= 0,1$ where the spaces $M_{p,q}^{s}(G)$ and $\mathcal{B}_{p,q}^{s}(G)$ have
non-standard translation and dilation symmetries. Moreover, we show that the
spaces $M_{p,q}^{s,\alpha}(G)$ are non-trivial and generally distinct from
their Euclidean counterparts. Finally, we examine how the metric geometry of
the coverings $\mathcal{Q}(G)$ underlying the $\alpha = 0$ case
$M_{p,q}^{s}(G)$ allows for the existence of geometric embeddings
\[F:M_{p,q}^{s}(\mathbb{R}^k) \longrightarrow{} M_{p,q}^{s}(G),\] as long as
$k$ (that only depends on $G$) is small enough. Our approach naturally gives
rise to several open problems that is further elaborated at the end of the
paper.
","[{""version"":""v1"",""created"":""Mon, 26 Aug 2019 09:45:24 GMT""}]","2019-08-27"
"1908.09568","Alexander Lohrmann","Alexander Lohrmann, Chithrabhanu Perumangatt, Aitor Villar, Alexander
  Ling","Broadband pumped polarization entangled photon-pair source in a linear
  beam displacement interferometer",,,"10.1063/1.5124416",,"quant-ph","http://arxiv.org/licenses/nonexclusive-distrib/1.0/","  We experimentally demonstrate a source of polarization entangled photon-pairs
based on a single periodically-poled potassium titanyl phosphate (PPKTP)
crystal pumped with a broadband, free running laser diode.The crystal is placed
within a linear beam-displacement interferometer, and emits photon-pairs based
ontype-0 spontaneous parametric downconversion (SPDC). We observe pair rates of
0.56 Mpairs/s/mW in a single spatial mode with a polarization visibility of
97.7% over a spectral range of 100 nm. This experiment demonstrates a pathway
towards observing Gigacount rates of polarization entangled photon pairs by
using high-power free-running laser diodes with fast multiplexed detectors.
","[{""version"":""v1"",""created"":""Mon, 26 Aug 2019 09:46:39 GMT""},{""version"":""v2"",""created"":""Tue, 3 Sep 2019 05:14:13 GMT""},{""version"":""v3"",""created"":""Thu, 28 Nov 2019 09:02:06 GMT""}]","2020-01-29"
"1908.09569","Marcelo Baptista Barbosa","M. B. Barbosa, J. G. Correia, K. Lorenz, A. S. Fenta, J. Schell, R.
  Teixeira, E. Nogales, B. M\'endez, A. Stroppa and J. P. Ara\'ujo","Cd acceptors in $Ga_2O_3$, an atomistic view","11 pages, 7 figures, including Supplementary Material; Corrected
  affiliations",,,,"cond-mat.mtrl-sci","http://arxiv.org/licenses/nonexclusive-distrib/1.0/","  Finding suitable p-type dopants, as well as reliable doping and
characterization methods for the emerging wide bandgap semiconductor
$\beta$-$Ga_2O_3$ could strongly influence and contribute to the development of
the next generation of power electronic. In this work, we combine easily
accessible ion implantation, diffusion and nuclear transmutation methods to
properly incorporate the Cd dopant into the $\beta$-$Ga_2O_3$ lattice, being
subsequently characterized at the atomic scale with the Perturbed Angular
Correlation (PAC) technique and Density Functional Theory (DFT) simulations.
The acceptor character of Cd in $\beta$-$Ga_2O_3$ is demonstrated, with Cd
sitting in the octahedral Ga site in the negative charge state, showing no
evidence of polaron deformations nor extra point defects nearby. Furthermore,
thermally activated free electrons were observed for temperatures above ~648 K
with an activation energy of 0.54(1) eV. At lower temperatures the local
electron transport is dominated by a tunneling process between defect levels
and the Cd probe.
","[{""version"":""v1"",""created"":""Mon, 26 Aug 2019 09:47:22 GMT""},{""version"":""v2"",""created"":""Wed, 28 Aug 2019 02:06:29 GMT""}]","2019-08-29"
"1908.09570","Shao-Jun Zhang","Haitang Li, Yong Chen and Shao-Jun Zhang","Photon orbits and phase transitions in Born-Infeld-dilaton black holes","7 pages, 7 figures",,"10.1016/j.nuclphysb.2020.114975",,"hep-th gr-qc","http://arxiv.org/licenses/nonexclusive-distrib/1.0/","  Relations between photon orbits and thermodynamical phase transitions are
explored in Born-Infeld-dilaton-AdS black hole. The coupling between the
electromagnetic field and the dialton field is chosen such that the full phase
diagram contains zeroth-order and first-order phase transitions as well as RPT.
We find that there exist non-monotonic beahviors of the photon orbit radius
$r_{ps}$ and the minimum impact parameter $u_{ps}$ which signal the existence
of the various phase transitions. In particular, the marginal value of pressure
under which RPT occur can be read off from these behaviors. Along the
co-existing lines, there are changes of both $r_{ps}$ and $u_{ps}$, whose
dependence on the transition temperature show characteristic behaviors
signalling the existence of RPT. Moreover, the critical exponents of $\Delta
r_{ps}$ and $\Delta u_{ps}$ are found to take a universal value $\frac{1}{2}$.
These results imply that $r_{ps}$ and $u_{ps}$ can be used as order parameters
to describe BH phase transitions.
","[{""version"":""v1"",""created"":""Mon, 26 Aug 2019 09:52:12 GMT""}]","2020-04-22"
"1908.09571","Yanjun Xu","Yanjun Xu, Yumeng Yang, Ziyan Luo and Yihong Wu","Disentangle magnon magnetoresistance from anisotropic and spin Hall
  magnetoresistance in NiFe/Pt bilayers","6 figures",,"10.1103/PhysRevB.100.094413",,"cond-mat.mes-hall","http://arxiv.org/licenses/nonexclusive-distrib/1.0/","  We conducted a systematic angular dependence study of nonlinear
magnetoresistance in NiFe/Pt bilayers at variable temperature and field using
the Wheatstone bridge method. We successfully disentangled magnon
magnetoresistance from other types of magnetoresistances based on their
different temperature and field dependences. Both the spin Hall/anisotropic and
magnon magnetoresistances contain sine phi and sine 3 phi components with phi
the angle between current and magnetization, but they exhibit different field
and temperature dependence. The competition between different types of
magnetoresistances leads to a sign reversal of sine 3 phi component at a
specific magnetic field, which was not reported previously. The
phenomenological model developed is able to account for the experimental
results for both NiFe/Pt and NiFe/Ta samples with different layer thicknesses.
Our results demonstrate the importance of disentangling different types of
magnetoresistances when characterizing the charge-spin interconversion process
in magnetic heterostructures.
","[{""version"":""v1"",""created"":""Mon, 26 Aug 2019 09:55:27 GMT""},{""version"":""v2"",""created"":""Fri, 30 Aug 2019 16:09:03 GMT""}]","2019-10-02"
"1908.09572","Fatemeh Hadaeghi","Fatemeh Hadaeghi","Neuromorphic Electronic Systems for Reservoir Computing","This chapter is a contribution to a Springer book project titled
  Reservoir Computing: Theory, Physical Implementations and Applications. This
  pre-print is an updated version of the one submitted in 2019",,,,"cs.ET cs.LG","http://creativecommons.org/licenses/by-nc-sa/4.0/","  This chapter provides a comprehensive survey of the researches and
motivations for hardware implementation of reservoir computing (RC) on
neuromorphic electronic systems. Due to its computational efficiency and the
fact that training amounts to a simple linear regression, both spiking and
non-spiking implementations of reservoir computing on neuromorphic hardware
have been developed. Here, a review of these experimental studies is provided
to illustrate the progress in this area and to address the technical challenges
which arise from this specific hardware implementation. Moreover, to deal with
challenges of computation on such unconventional substrates, several lines of
potential solutions are presented based on advances in other computational
approaches in machine learning. Keywords: Analog Microchips, FPGA, Memristors,
Neuromorphic Architectures, Reservoir Computing
","[{""version"":""v1"",""created"":""Mon, 26 Aug 2019 09:56:19 GMT""},{""version"":""v2"",""created"":""Wed, 26 Aug 2020 09:28:55 GMT""}]","2020-08-27"
