"1908.08989","Maren Awiszus","Maren Awiszus, Hanno Ackermann and Bodo Rosenhahn","Learning Disentangled Representations via Independent Subspaces","Accepted at ICCV 2019 Workshop on Robust Subspace Learning and
  Applications in Computer Vision",,,,"cs.CV cs.LG stat.ML","http://arxiv.org/licenses/nonexclusive-distrib/1.0/","  Image generating neural networks are mostly viewed as black boxes, where any
change in the input can have a number of globally effective changes on the
output. In this work, we propose a method for learning disentangled
representations to allow for localized image manipulations. We use face images
as our example of choice. Depending on the image region, identity and other
facial attributes can be modified. The proposed network can transfer parts of a
face such as shape and color of eyes, hair, mouth, etc.~directly between
persons while all other parts of the face remain unchanged. The network allows
to generate modified images which appear like realistic images. Our model
learns disentangled representations by weak supervision. We propose a localized
resnet autoencoder optimized using several loss functions including a loss
based on the semantic segmentation, which we interpret as masks, and a loss
which enforces disentanglement by decomposition of the latent space into
statistically independent subspaces. We evaluate the proposed solution w.r.t.
disentanglement and generated image quality. Convincing results are
demonstrated using the CelebA dataset.
","[{""version"":""v1"",""created"":""Mon, 26 Aug 2019 09:08:12 GMT""}]","2019-08-27"
"1908.09351","Raimund Feifel","M. Wallner, J.H.D. Eland, R.J. Squibb, J. Andersson, A. Hult Roos, R.
  Singh, O. Talaee, D. Koulentianos, M.N. Piancastelli, M. Simon, and R. Feifel","Coulomb explosion of CD3I induced by single photon deep inner-shell
  ionisation","6 pages, 4 figures",,,,"physics.atm-clus","http://arxiv.org/licenses/nonexclusive-distrib/1.0/","  L-shell ionisation and subsequent Coulomb explosion of fully deuterated
methyl iodide, CD$_3$I, irradiated with hard x-rays has been examined by a
time-of-flight multi-ion coincidence technique. The core vacancies relax
efficiently by Auger cascades, leading to charge states up to 16+. The dynamics
of the Coulomb explosion process are investigated by calculating the ions'
flight times numerically based on a geometric model of the experimental
apparatus, for comparison with the experimental data. A parametric model of the
explosion, previously introduced for multi-photon induced Coulomb explosion, is
applied in numerical simulations, giving good agreement with the experimental
results for medium charge states. Deviations for higher charges suggest the
need to include nuclear motion in a putatively more complete model. Detection
efficiency corrections from the simulations are used to determine the true
distributions of molecular charge state produced by initial L1, L2 and L3
ionisation.
","[{""version"":""v1"",""created"":""Sun, 25 Aug 2019 16:04:32 GMT""}]","2019-08-27"
"1908.09352","Fulin Zhang","Bo-Xing Cao and Fu-Lin Zhang","The Analytic Eigenvalue Structure of the 1+1 Dirac Oscillator","5.3 pages, 3 figures","Chin. Phys. Lett. 37, 090303 (2020)","10.1088/0256-307X/37/9/090303",,"quant-ph","http://arxiv.org/licenses/nonexclusive-distrib/1.0/","  We study the analytic structure for the eigenvalues of the one-dimensional
Dirac oscillator, by analytically continuing its frequency on the complex
plane. A twofold Riemann surface is found, connecting the two states of a pair
of particle and antiparticle. One can, at least in principle, accomplish the
transition from a positive energy state to its antiparticle state by moving the
frequency continuously on the complex plane, without changing the Hamiltonian
after transition. This result provides a visual explanation for the absence of
a negative energy state with the quantum number n=0.
","[{""version"":""v1"",""created"":""Sun, 25 Aug 2019 16:08:38 GMT""},{""version"":""v2"",""created"":""Thu, 10 Oct 2019 14:25:16 GMT""},{""version"":""v3"",""created"":""Tue, 1 Sep 2020 05:18:46 GMT""}]","2020-09-02"
"1908.09353","Yifan Jin","Belle Collaboration: Y. Jin, H. Aihara, D. Epifanov, I. Adachi, S. Al
  Said, D. M. Asner, V. Aulchenko, T. Aushev, R. Ayad, V. Babu, I. Badhrees, S.
  Bahinipati, V. Bansal, P. Behera, M. Berger, V. Bhardwaj, T. Bilka, J.
  Biswal, A. Bobrov, G. Bonvicini, A. Bozek, M. Bra\v{c}ko, M. Campajola, L.
  Cao, D. \v{C}ervenkov, V. Chekelian, A. Chen, B. G. Cheon, K. Chilikin, H. E.
  Cho, K. Cho, Y. Choi, S. Choudhury, D. Cinabro, S. Cunliffe, S. Di Carlo, Z.
  Dole\v{z}al, T. V. Dong, D. Dossett, S. Eidelman, J. E. Fast, T. Ferber, B.
  G. Fulsom, R. Garg, V. Gaur, N. Gabyshev, A. Giri, P. Goldenzweig, B. Golob,
  D. Greenwald, O. Grzymkowska, J. Haba, K. Hayasaka, H. Hayashii, M. T.
  Hedges, W.-S. Hou, K. Huang, T. Iijima, K. Inami, G. Inguglia, A. Ishikawa,
  M. Iwasaki, Y. Iwasaki, W. W. Jacobs, H. B. Jeon, S. Jia, D. Joffe, K. K.
  Joo, J. Kahn, A. B. Kaliyar, G. Karyan, T. Kawasaki, H. Kichimi, C. Kiesling,
  D. Y. Kim, H. J. Kim, K. T. Kim, S. H. Kim, K. Kinoshita, P. Kody\v{s}, S.
  Korpar, D. Kotchetkov, P. Kri\v{z}an, R. Kroeger, P. Krokovny, R. Kulasiri,
  R. Kumar, A. Kuzmin, Y.-J. Kwon, K. Lalwani, J. S. Lange, J. Y. Lee, S. C.
  Lee, C. H. Li, L. K. Li, Y. B. Li, L. Li Gioi, J. Libby, K. Lieret, Z.
  Liptak, D. Liventsev, P.-C. Lu, T. Luo, J. MacNaughton, M. Masuda, T.
  Matsuda, D. Matvienko, M. Merola, K. Miyabayashi, H. Miyata, R. Mizuk, T.
  Mori, R. Mussa, E. Nakano, M. Nakao, K. J. Nath, Z. Natkaniec, M. Nayak, M.
  Niiyama, N. K. Nisar, S. Nishida, S. Ogawa, H. Ono, Y. Onuki, P. Pakhlov, G.
  Pakhlova, B. Pal, S. Pardi, H. Park, S.-H. Park, S. Patra, S. Paul, T. K.
  Pedlar, R. Pestotnik, L. E. Piilonen, V. Popov, E. Prencipe, A. Rostomyan, G.
  Russo, D. Sahoo, Y. Sakai, M. Salehi, S. Sandilya, L. Santelj, T. Sanuki, V.
  Savinov, O. Schneider, G. Schnell, J. Schueler, C. Schwanda, Y. Seino, K.
  Senyo, O. Seon, M. E. Sevior, V. Shebalin, C. P. Shen, J.-G. Shiu, B.
  Shwartz, F. Simon, J. B. Singh, A. Sokolov, E. Solovieva, S. Stani\v{c}, M.
  Stari\v{c}, Z. S. Stottler, J. F. Strube, T. Sumiyoshi, M. Takizawa, U.
  Tamponi, K. Tanida, F. Tenchini, K. Trabelsi, M. Uchida, T. Uglov, Y. Unno,
  S. Uno, P. Urquijo, Y. Usov, R. Van Tonder, G. Varner, A. Vinokurova, V.
  Vorobyev, A. Vossen, B. Wang, C. H. Wang, M.-Z. Wang, P. Wang, S. Watanuki,
  E. Won, S. B. Yang, H. Ye, J. H. Yin, C. Z. Yuan, Y. Yusa, Z. P. Zhang, V.
  Zhilich, V. Zhukova","Observation of $ \tau^- \rightarrow \pi^- \nu_{\tau} e^+ e^-$ and search
  for $\tau^- \rightarrow \pi^- \nu_{\tau} \mu^+ \mu^-$","8 pages, 5 figures, accepted by PRD(RC)","Phys. Rev. D 100, 071101 (2019)","10.1103/PhysRevD.100.071101","Belle Preprint # 2019-12, and KEK Preprint #: 2019-15","hep-ex","http://creativecommons.org/licenses/by/4.0/","  We present the first measurements of branching fractions of rare tau-lepton
decays, $\tau^- \rightarrow \pi^- \nu_{\tau} \ell^+ \ell^-$ ($\ell = e$ or
$\mu$), using a data sample corresponding to 562 fb$^{-1}$ collected at a
center-of-mass energy of 10.58 GeV with the Belle detector at the KEKB
asymmetric-energy $e^+ e^-$ collider. The $\tau^- \rightarrow \pi^- \nu_\tau
e^+ e^-$ decay is observed for the first time with 7.0$\sigma$ significance.
The partial branching fraction determined by the structure-dependent mechanisms
mediated by either a vector or an axial-vector current for the mass region
$M_{\pi e e}>1.05$ GeV/$c^2$ is measured to be $\mathcal{B}(\tau^-\rightarrow
\pi^- \nu_\tau e^+ e^-)[M_{\pi^- e^+ e^-}>1.05~{\rm GeV}/c^2] = (5.90 \pm 0.53
\pm 0.85 \pm 0.11) \times 10^{-6}$, where the first uncertainty is statistical,
the second is systematic, and the third is due to the model dependence. In the
full phase space, due to the different detection efficiencies for the
structure-dependent mechanisms mediated by axial-vector and vector currents,
the branching fraction varies from $\mathcal{B}_{A}(\tau^-\rightarrow \pi^-
\nu_\tau e^+ e^-) = (1.46 \pm 0.13 \pm 0.21) \times 10^{-5}$ to
$\mathcal{B}_{V}(\tau^-\rightarrow \pi^- \nu_\tau e^+ e^-) = (3.01 \pm 0.27 \pm
0.43) \times 10^{-5}$, respectively. An upper limit is set on the branching
fraction of the $\tau^- \rightarrow \pi^- \nu_\tau \mu^+ \mu^-$ decay,
$\mathcal{B}(\tau^-\rightarrow \pi^- \nu_\tau \mu^+ \mu^-) < 1.14 \times
10^{-5}$, at the 90% confidence level.
","[{""version"":""v1"",""created"":""Sun, 25 Aug 2019 16:09:32 GMT""},{""version"":""v2"",""created"":""Thu, 5 Sep 2019 13:16:37 GMT""},{""version"":""v3"",""created"":""Tue, 24 Sep 2019 15:50:54 GMT""}]","2019-10-23"
"1908.09354","Kun Cao","Kun Cao, James Fairbanks","Unsupervised Construction of Knowledge Graphs From Text and Code","25th ACM SIGKDD Conference on Knowledge Discovery and Data Mining,
  15th International Workshop On Mining and Learning with Graphs",,,,"cs.LG cs.IR stat.ML","http://arxiv.org/licenses/nonexclusive-distrib/1.0/","  The scientific literature is a rich source of information for data mining
with conceptual knowledge graphs; the open science movement has enriched this
literature with complementary source code that implements scientific models. To
exploit this new resource, we construct a knowledge graph using unsupervised
learning methods to identify conceptual entities. We associate source code
entities to these natural language concepts using word embedding and clustering
techniques. Practical naming conventions for methods and functions tend to
reflect the concept(s) they implement. We take advantage of this specificity by
presenting a novel process for joint clustering text concepts that combines
word-embeddings, nonlinear dimensionality reduction, and clustering techniques
to assist in understanding, organizing, and comparing software in the open
science ecosystem. With our pipeline, we aim to assist scientists in building
on existing models in their discipline when making novel models for new
phenomena. By combining source code and conceptual information, our knowledge
graph enhances corpus-wide understanding of scientific literature.
","[{""version"":""v1"",""created"":""Sun, 25 Aug 2019 16:10:31 GMT""}]","2019-08-27"
"1908.09355","Zhe Gan","Siqi Sun, Yu Cheng, Zhe Gan, Jingjing Liu","Patient Knowledge Distillation for BERT Model Compression","Accepted to EMNLP 2019",,,,"cs.CL cs.LG","http://arxiv.org/licenses/nonexclusive-distrib/1.0/","  Pre-trained language models such as BERT have proven to be highly effective
for natural language processing (NLP) tasks. However, the high demand for
computing resources in training such models hinders their application in
practice. In order to alleviate this resource hunger in large-scale model
training, we propose a Patient Knowledge Distillation approach to compress an
original large model (teacher) into an equally-effective lightweight shallow
network (student). Different from previous knowledge distillation methods,
which only use the output from the last layer of the teacher network for
distillation, our student model patiently learns from multiple intermediate
layers of the teacher model for incremental knowledge extraction, following two
strategies: ($i$) PKD-Last: learning from the last $k$ layers; and ($ii$)
PKD-Skip: learning from every $k$ layers. These two patient distillation
schemes enable the exploitation of rich information in the teacher's hidden
layers, and encourage the student model to patiently learn from and imitate the
teacher through a multi-layer distillation process. Empirically, this
translates into improved results on multiple NLP tasks with significant gain in
training efficiency, without sacrificing model accuracy.
","[{""version"":""v1"",""created"":""Sun, 25 Aug 2019 16:13:24 GMT""}]","2019-08-27"
"1908.09356","Kengo Okura","Kengo Okura","Simple homotopy types of independence complexes of graphs involving grid
  graphs",,,,,"math.AT math.CO","http://arxiv.org/licenses/nonexclusive-distrib/1.0/","  We show that if a graph $G$ involves a certain square grid graph as a full
subgraph, then a certain operation on it yields a simplicial suspension of the
independence complex of $G$. This generalizes a result of Csorba. As a
corollary, we determine the simple homotopy types of the independence complexes
of some grid graphs.
","[{""version"":""v1"",""created"":""Sun, 25 Aug 2019 16:17:04 GMT""}]","2019-08-27"
"1908.09357","William Whitney","William Whitney, Rajat Agarwal, Kyunghyun Cho, and Abhinav Gupta","Dynamics-aware Embeddings","Published at ICLR 2020",,,,"cs.LG cs.AI stat.ML","http://arxiv.org/licenses/nonexclusive-distrib/1.0/","  In this paper we consider self-supervised representation learning to improve
sample efficiency in reinforcement learning (RL). We propose a forward
prediction objective for simultaneously learning embeddings of states and
action sequences. These embeddings capture the structure of the environment's
dynamics, enabling efficient policy learning. We demonstrate that our action
embeddings alone improve the sample efficiency and peak performance of
model-free RL on control from low-dimensional states. By combining state and
action embeddings, we achieve efficient learning of high-quality policies on
goal-conditioned continuous control from pixel observations in only 1-2 million
environment steps.
","[{""version"":""v1"",""created"":""Sun, 25 Aug 2019 16:22:04 GMT""},{""version"":""v2"",""created"":""Sun, 1 Sep 2019 13:08:05 GMT""},{""version"":""v3"",""created"":""Tue, 14 Jan 2020 14:50:13 GMT""}]","2020-01-15"
"1908.09358","Mark Rudelson","Hermann K\""onig and Mark Rudelson","On the volume of non-central sections of a cube",,,,,"math.MG math.PR","http://arxiv.org/licenses/nonexclusive-distrib/1.0/","  Let $Q_n$ be the cube of side length one centered at the origin in
$\mathbb{R}^n$, and let $F$ be an affine $(n-d)$-dimensional subspace of
$\mathbb{R}^n$ having distance to the origin less than or equal to $\frac 1 2$,
where $0<d<n$. We show that the $(n-d)$-dimensional volume of the section $Q_n
\cap F$ is bounded below by a value $c(d)$ depending only on the codimension
$d$ but not on the ambient dimension $n$ or a particular subspace $F$. In the
case of hyperplanes, $d=1$, we show that $c(1) = \frac{1}{17}$ is a possible
choice. We also consider a complex analogue of this problem for a hyperplane
section of the polydisc.
","[{""version"":""v1"",""created"":""Sun, 25 Aug 2019 16:25:42 GMT""},{""version"":""v2"",""created"":""Tue, 19 Nov 2019 04:06:11 GMT""}]","2019-11-20"
"1908.09359","Wen-Yuan Liu","Wen-Yuan Liu, Yi-Zhen Huang, Shou-Shu Gong and Zheng-Cheng Gu","Accurate simulation for finite projected entangled pair states in two
  dimensions",,"Phys. Rev. B 103, 235155 (2021)","10.1103/PhysRevB.103.235155",,"cond-mat.str-el quant-ph","http://arxiv.org/licenses/nonexclusive-distrib/1.0/","  Based on the scheme of variational Monte Carlo sampling, we develop an
accurate and efficient two-dimensional tensor-network algorithm to simulate
quantum lattice models. We find that Monte Carlo sampling shows huge advantages
in dealing with finite projected entangled pair states, which allows
significantly enlarged system size and improves the accuracy of tensor network
simulation. We demonstrate our method on the square-lattice antiferromagnetic
Heisenberg model up to $32 \times 32$ sites, as well as a highly frustrated
$J_1-J_2$ model up to $24\times 24$ sites. The results, including ground state
energy and spin correlations, are in excellent agreement with those of the
available quantum Monte Carlo or density matrix renormalization group methods.
Therefore, our method substantially advances the calculation of 2D tensor
networks for finite systems, and potentially opens a new door towards resolving
many challenging strongly correlated quantum many-body problems.
","[{""version"":""v1"",""created"":""Sun, 25 Aug 2019 16:47:00 GMT""},{""version"":""v2"",""created"":""Sat, 12 Sep 2020 10:22:22 GMT""},{""version"":""v3"",""created"":""Fri, 25 Jun 2021 04:51:35 GMT""}]","2021-06-28"
"1908.09360","Kenji Fukushima","Yuki Fujimoto, Kenji Fukushima, Wolfram Weise","Continuity from neutron matter to two-flavor quark matter with $^1 S_0$
  and $^3 P_2$ superfluidity","14 pages, 5 figures; minor updates to promote correctness in
  discussions","Phys. Rev. D 101, 094009 (2020)","10.1103/PhysRevD.101.094009",,"hep-ph nucl-th","http://arxiv.org/licenses/nonexclusive-distrib/1.0/","  This study is performed with the aim of gaining insights into the possible
applicability of the quark-hadron continuity concept, not only in the idealized
case of three-flavor symmetric quark matter, but also for the transition from
neutron matter to two-flavor quark matter. A key issue is the continuity
between neutron superfluidity and a corresponding superfluid quark phase
produced by $d$-quark pairing. Symmetry arguments are developed and relevant
dynamical mechanisms are analyzed. It is pointed out that the $^3P_2$
superfluidity in dense neutron matter has a direct analogue in the $^3P_2$
pairing of $d$-quarks in two-flavor quark matter. This observation supports the
idea that the quark-hadron continuity hypothesis may be valid for such systems.
Possible implications for neutron stars are briefly discussed.
","[{""version"":""v1"",""created"":""Sun, 25 Aug 2019 16:48:59 GMT""},{""version"":""v2"",""created"":""Tue, 28 Jan 2020 06:59:04 GMT""}]","2020-05-20"
"1908.09361","Binzhou Xia","Binzhou Xia","Tetravalent half-arc-transitive graphs with unbounded nonabelian vertex
  stabilizers",,,,,"math.CO","http://arxiv.org/licenses/nonexclusive-distrib/1.0/","  Half-arc-transitive graphs are a fascinating topic which connects graph
theory, Riemann surfaces and group theory. Although fruitful results have been
obtained over the last half a century, it is still challenging to construct
half-arc-transitive graphs with prescribed vertex stabilizers. Until recently,
there have been only six known connected tetravalent half-arc-transitive graphs
with nonabelian vertex stabilizers, and the question whether there exists a
connected tetravalent half-arc-transitive graph with nonabelian vertex
stabilizer of order $2^s$ for every $s\geqslant3$ has been wide open. This
question is answered in the affirmative in this paper via the construction of a
connected tetravalent half-arc-transitive graph with vertex stabilizer
$\mathrm{D}_8^2\times\mathrm{C}_2^m$ for each integer $m\geqslant1$, where
$\mathrm{D}_8^2$ is the direct product of two copies of the dihedral group of
order $8$ and $\mathrm{C}_2^m$ is the direct product of $m$ copies of the
cyclic group of order $2$. The graphs constructed have surprisingly many
significant properties in various contexts.
","[{""version"":""v1"",""created"":""Sun, 25 Aug 2019 16:49:24 GMT""},{""version"":""v2"",""created"":""Wed, 22 Apr 2020 14:06:39 GMT""},{""version"":""v3"",""created"":""Thu, 23 Apr 2020 04:32:43 GMT""},{""version"":""v4"",""created"":""Sat, 7 Nov 2020 12:26:16 GMT""}]","2020-11-10"
"1908.09362","Ziyu Liu","Ziyu Liu, Guolin Ke, Jiang Bian, Tieyan Liu","LightMC: A Dynamic and Efficient Multiclass Decomposition Algorithm","10 pages, 2 figures",,,,"cs.LG cs.AI","http://arxiv.org/licenses/nonexclusive-distrib/1.0/","  Multiclass decomposition splits a multiclass classification problem into a
series of independent binary learners and recomposes them by combining their
outputs to reconstruct the multiclass classification results. Three widely-used
realizations of such decomposition methods are One-Versus-All (OVA),
One-Versus-One (OVO), and Error-Correcting-Output-Code (ECOC). While OVA and
OVO are quite simple, both of them assume all classes are orthogonal which
neglect the latent correlation between classes in real-world.
Error-Correcting-Output-Code (ECOC) based decomposition methods, on the other
hand, are more preferable due to its integration of the correlation among
classes. However, the performance of existing ECOC-based methods highly depends
on the design of coding matrix and decoding strategy. Unfortunately, it is
quite uncertain and time-consuming to discover an effective coding matrix with
appropriate decoding strategy. To address this problem, we propose LightMC, an
efficient dynamic multiclass decomposition algorithm. Instead of using fixed
coding matrix and decoding strategy, LightMC uses a differentiable decoding
strategy, which enables it to dynamically optimize the coding matrix and
decoding strategy, toward increasing the overall accuracy of multiclass
classification, via back propagation jointly with the training of base learners
in an iterative way. Empirical experimental results on several public
large-scale multiclass classification datasets have demonstrated the
effectiveness of LightMC in terms of both good accuracy and high efficiency.
","[{""version"":""v1"",""created"":""Sun, 25 Aug 2019 17:12:01 GMT""}]","2019-08-27"
"1908.09363","Matthias Sachs","Benedict Leimkuhler, Matthias Sachs and Gabriel Stoltz","Hypocoercivity properties of adaptive Langevin dynamics",,,,,"math.PR cs.NA math.FA math.NA stat.CO","http://arxiv.org/licenses/nonexclusive-distrib/1.0/","  Adaptive Langevin dynamics is a method for sampling the Boltzmann-Gibbs
distribution at prescribed temperature in cases where the potential gradient is
subject to stochastic perturbation of unknown magnitude. The method replaces
the friction in underdamped Langevin dynamics with a dynamical variable,
updated according to a negative feedback loop control law as in the
Nos\'e-Hoover thermostat. Using a hypocoercivity analysis we show that the law
of Adaptive Langevin dynamics converges exponentially rapidly to the stationary
distribution, with a rate that can be quantified in terms of the key parameters
of the dynamics. This allows us in particular to obtain a central limit theorem
with respect to the time averages computed along a stochastic path. Our
theoretical findings are illustrated by numerical simulations involving
classification of the MNIST data set of handwritten digits using Bayesian
logistic regression.
","[{""version"":""v1"",""created"":""Sun, 25 Aug 2019 17:14:00 GMT""},{""version"":""v2"",""created"":""Wed, 28 Aug 2019 17:16:38 GMT""}]","2019-08-29"
"1908.09364","Benjamin Paassen","Benjamin Paa{\ss}en","Adversarial Edit Attacks for Tree Data","accepted at the 20th International Conference on Intelligent Data
  Engineering and Automated Learning (IDEAL)","Proc. IDEAL 20 (2019) 359-366","10.1007/978-3-030-33607-3_39",,"cs.LG stat.ML","http://arxiv.org/licenses/nonexclusive-distrib/1.0/","  Many machine learning models can be attacked with adversarial examples, i.e.
inputs close to correctly classified examples that are classified incorrectly.
However, most research on adversarial attacks to date is limited to vectorial
data, in particular image data. In this contribution, we extend the field by
introducing adversarial edit attacks for tree-structured data with potential
applications in medicine and automated program analysis. Our approach solely
relies on the tree edit distance and a logarithmic number of black-box queries
to the attacked classifier without any need for gradient information. We
evaluate our approach on two programming and two biomedical data sets and show
that many established tree classifiers, like tree-kernel-SVMs and recursive
neural networks, can be attacked effectively.
","[{""version"":""v1"",""created"":""Sun, 25 Aug 2019 17:20:15 GMT""},{""version"":""v2"",""created"":""Tue, 27 Aug 2019 07:53:03 GMT""}]","2019-11-12"
"1908.09365","Alexander Nazarov","Alexander I. Nazarov","Some lemmata on the perturbation of the spectrum","6 pages",,,,"math.SP","http://arxiv.org/licenses/nonexclusive-distrib/1.0/","  We give some sufficient conditions for preserving of the second term in the
spectral asymptotics of a compact operator under the perturbation of the
metrics in the Hilbert space.
","[{""version"":""v1"",""created"":""Sun, 25 Aug 2019 17:22:29 GMT""}]","2019-08-27"
"1908.09366","Kaveh Mohammadi","Kaveh Mohammadi, Assad Rashidi","A new method for compactification with the help of order topology and
  limit point",,,,,"math.GN","http://arxiv.org/licenses/nonexclusive-distrib/1.0/","  In this paper, we introduce a new method for compactification of a
topological space by order topology and through ordinal numbers. The idea
behind our approach originates from the definition of a limit point, and then
we try to find an intuition for this concept. Finally, we utilise the Homotopy
concept for separation Axiom
","[{""version"":""v1"",""created"":""Sun, 25 Aug 2019 17:24:46 GMT""}]","2019-08-27"
