"1908.09450","Lingfu Zhang","Allan Sly, Lingfu Zhang","Stationary Distributions for the Voter Model in $d\geq 3$ are Factors of
  IID","21 pages, 2 figures. Revised according to comments of a referee. AOP
  to appear",,,,"math.PR math.DS","http://arxiv.org/licenses/nonexclusive-distrib/1.0/","  For the Voter Model on $\mathbb{Z}^d$, $d\geq 3$, we show that the (extremal)
stationary distributions are isomorphic to Bernoulli shifts, and answer an open
question asked by Steif and Tykesson. The proof gives explicit constructions of
the stationary distributions as factors of IID processes on $\mathbb{Z}^d$.
","[{""version"":""v1"",""created"":""Mon, 26 Aug 2019 03:29:03 GMT""},{""version"":""v2"",""created"":""Tue, 6 Oct 2020 03:03:47 GMT""},{""version"":""v3"",""created"":""Wed, 24 Mar 2021 20:12:18 GMT""},{""version"":""v4"",""created"":""Thu, 20 Jan 2022 21:22:41 GMT""}]","2022-01-24"
"1908.09451","Huanru Henry Mao","Huanru Henry Mao, Bodhisattwa Prasad Majumder, Julian McAuley,
  Garrison W. Cottrell","Improving Neural Story Generation by Targeted Common Sense Grounding",,,,,"cs.LG cs.CL stat.ML","http://arxiv.org/licenses/nonexclusive-distrib/1.0/","  Stories generated with neural language models have shown promise in
grammatical and stylistic consistency. However, the generated stories are still
lacking in common sense reasoning, e.g., they often contain sentences deprived
of world knowledge. We propose a simple multi-task learning scheme to achieve
quantitatively better common sense reasoning in language models by leveraging
auxiliary training signals from datasets designed to provide common sense
grounding. When combined with our two-stage fine-tuning pipeline, our method
achieves improved common sense reasoning and state-of-the-art perplexity on the
Writing Prompts (Fan et al., 2018) story generation dataset.
","[{""version"":""v1"",""created"":""Mon, 26 Aug 2019 03:29:21 GMT""},{""version"":""v2"",""created"":""Fri, 28 Feb 2020 04:55:09 GMT""}]","2020-03-02"
"1908.09452","Jose Andres Garcia-Gonzalez","J. A. Garc\'ia-Gonz\'alez, M. M. Gonz\'alez and N. Fraija (for the
  HAWC Collaboration)","Gamma-ray light curves for the BL Lac Mrk 421 using HAWC data derived
  with a new approach","Presented at the 36th International Cosmic Ray Conference (ICRC 2019)",,,"PoS(ICRC2019)682","astro-ph.HE","http://arxiv.org/licenses/nonexclusive-distrib/1.0/","  The HAWC gamma ray observatory is located at the Sierra Negra Volcano in
Puebla, Mexico, at an altitude of 4,100 meters. HAWC is a wide field of view
array of 300 water Cherenkov detectors that are continuously surveying 2sr of
the sky since March 2015. The large collected data sample consisting in more
than 3 years makes HAWC an ideal instrument to perform an unbiased monitoring
of blazars in the very-high-energy (VHE) emission. This is particular relevant
for Mrk 421, one of the closest and brightest blazars in the gamma-ray/X-ray
classified as highsynchrotron-peaked BL Lac class. In this work we present
light curves for Mrk 421 and the Crab nebula obtained with the first 17 months
of data and a new analysis framework. We compare the results with the light
curves reported in [1]. The main advantage of the new framework is the
capability to derive fluxes for arbitrary timescales. We show that both,
previous and present, methods give consistent results
","[{""version"":""v1"",""created"":""Mon, 26 Aug 2019 03:31:21 GMT""}]","2019-08-27"
"1908.09453","Marc Lanctot","Marc Lanctot, Edward Lockhart, Jean-Baptiste Lespiau, Vinicius
  Zambaldi, Satyaki Upadhyay, Julien P\'erolat, Sriram Srinivasan, Finbarr
  Timbers, Karl Tuyls, Shayegan Omidshafiei, Daniel Hennes, Dustin Morrill,
  Paul Muller, Timo Ewalds, Ryan Faulkner, J\'anos Kram\'ar, Bart De Vylder,
  Brennan Saeta, James Bradbury, David Ding, Sebastian Borgeaud, Matthew Lai,
  Julian Schrittwieser, Thomas Anthony, Edward Hughes, Ivo Danihelka, Jonah
  Ryan-Davis","OpenSpiel: A Framework for Reinforcement Learning in Games",,,,,"cs.LG cs.AI cs.GT cs.MA","http://arxiv.org/licenses/nonexclusive-distrib/1.0/","  OpenSpiel is a collection of environments and algorithms for research in
general reinforcement learning and search/planning in games. OpenSpiel supports
n-player (single- and multi- agent) zero-sum, cooperative and general-sum,
one-shot and sequential, strictly turn-taking and simultaneous-move, perfect
and imperfect information games, as well as traditional multiagent environments
such as (partially- and fully- observable) grid worlds and social dilemmas.
OpenSpiel also includes tools to analyze learning dynamics and other common
evaluation metrics. This document serves both as an overview of the code base
and an introduction to the terminology, core concepts, and algorithms across
the fields of reinforcement learning, computational game theory, and search.
","[{""version"":""v1"",""created"":""Mon, 26 Aug 2019 03:31:35 GMT""},{""version"":""v2"",""created"":""Wed, 28 Aug 2019 20:57:01 GMT""},{""version"":""v3"",""created"":""Thu, 12 Sep 2019 04:26:51 GMT""},{""version"":""v4"",""created"":""Thu, 10 Oct 2019 17:06:01 GMT""},{""version"":""v5"",""created"":""Tue, 31 Dec 2019 05:55:04 GMT""},{""version"":""v6"",""created"":""Sat, 26 Sep 2020 11:49:05 GMT""}]","2020-09-29"
"1908.09454","Bhaskarjyoti Das","Vishwas Sathish, Tanya Mehrotra, Simran Dhinwa, Bhaskarjyoti Das","Graph Embedding Based Hybrid Social Recommendation System","7 pages",,,,"cs.SI cs.IR","http://arxiv.org/licenses/nonexclusive-distrib/1.0/","  Item recommendation tasks are a widely studied topic. Recent developments in
deep learning and spectral methods paved a path towards efficient graph
embedding techniques. But little research has been done on applying these graph
embedding to social graphs for recommendation tasks. This paper focuses at
performance of various embedding methods applied on social graphs for the task
of item recommendation. Additionally, a hybrid model is proposed wherein chosen
embedding models are combined together to give a collective output. We put
forward the hypothesis that such a hybrid model would perform better than
individual embedding for recommendation task. With recommendation using
individual embedding as a baseline, performance for hybrid model for the same
task is evaluated and compared. Standard metrics are used for qualitative
comparison. It is found that the proposed hybrid model outperforms the
baseline.
","[{""version"":""v1"",""created"":""Mon, 26 Aug 2019 03:34:48 GMT""}]","2019-08-27"
"1908.09455","Yue Sun","Yue Sun, Zhixiang Shi and Tsuyoshi Tamegai","Review of annealing effects and superconductivity in
  Fe$_{1+y}$Te$_{1-x}$Se$_x$ superconductors","review paper; 38 pages, 33 figures","Supercond. Sci. Technol. 32 (2019) 103001","10.1088/1361-6668/ab30c2",,"cond-mat.supr-con","http://arxiv.org/licenses/nonexclusive-distrib/1.0/","  Fe$_{1+y}$Te$_{1-x}$Se$_x$ is unique in their structural simplicity,
consisting of only FeTe/Se layers, which is favorable for probing the mechanism
of superconductivity. Recently, a topological surface superconductivity as well
as the Majorana Fermions has been observed, which makes
Fe$_{1+y}$Te$_{1-x}$Se$_x$ the first high temperature topological
superconductor. Since large size single crystal of Fe$_{1+y}$Te$_{1-x}$Se$_x$
can be easily grown, many researches have been performed. However, a large part
of the reported results are under controversy, including the resistivity,
susceptibility, Hall effect, gap structure, phase diagram, etc. These
controversies are believed to come from the sample-dependent Fe
nonstoichiometries, which originate from the partial occupation of the second
Fe site (excess Fe) in the Te/Se layer. The excess Fe with valence near Fe$^+$
will provide electron doping into the system. Meanwhile, the excess Fe is also
strongly magnetic, which will act as a paring breaker and also localize the
charge carriers. Removing the excess Fe is essential to probe the intrinsic
properties and mechanism of superconductivity of Fe$_{1+y}$Te$_{1-x}$Se$_x$
compounds. In this topical review, we propose the effective approaches to
remove excess Fe in Fe$_{1+y}$Te$_{1-x}$Se$_x$. Furthermore, we discuss the
mechanism of annealing based on the evolutions of structure, composition, and
morphology with annealing. Moreover, we also review the annealing effects on
the normal state and superconducting properties, including the magnetism,
transport properties, band structure, $T_{\rm{c}}$, phase diagram, upper
critical field, anisotropy, critical current density, gap structure, and
superconducting pairing. This review presents not only the optimal way to
prepare crystals without excess Fe, but also the intrinsic properties of
Fe$_{1+y}$Te$_{1-x}$Se$_x$ without the influence of excess Fe.
","[{""version"":""v1"",""created"":""Mon, 26 Aug 2019 03:39:23 GMT""}]","2019-08-27"
"1908.09456","Chen Qu","Chen Qu, Liu Yang, Minghui Qiu, Yongfeng Zhang, Cen Chen, W. Bruce
  Croft and Mohit Iyyer","Attentive History Selection for Conversational Question Answering","Accepted to CIKM 2019",,"10.1145/3357384.3357905",,"cs.IR","http://arxiv.org/licenses/nonexclusive-distrib/1.0/","  Conversational question answering (ConvQA) is a simplified but concrete
setting of conversational search. One of its major challenges is to leverage
the conversation history to understand and answer the current question. In this
work, we propose a novel solution for ConvQA that involves three aspects.
First, we propose a positional history answer embedding method to encode
conversation history with position information using BERT in a natural way.
BERT is a powerful technique for text representation. Second, we design a
history attention mechanism (HAM) to conduct a ""soft selection"" for
conversation histories. This method attends to history turns with different
weights based on how helpful they are on answering the current question. Third,
in addition to handling conversation history, we take advantage of multi-task
learning (MTL) to do answer prediction along with another essential
conversation task (dialog act prediction) using a uniform model architecture.
MTL is able to learn more expressive and generic representations to improve the
performance of ConvQA. We demonstrate the effectiveness of our model with
extensive experimental evaluations on QuAC, a large-scale ConvQA dataset. We
show that position information plays an important role in conversation history
modeling. We also visualize the history attention and provide new insights into
conversation history understanding.
","[{""version"":""v1"",""created"":""Mon, 26 Aug 2019 03:39:51 GMT""}]","2019-08-27"
"1908.09457","Kyoung-Whan Kim","Jeongwoo Kim, Kyoung-Whan Kim, Dongbin Shin, Sang-Hoon Lee, Jairo
  Sinova, Noejung Park, Hosub Jin","Prediction of ferroelectricity-driven Berry curvature enabling charge-
  and spin-controllable photocurrent in tin telluride monolayers","28 pages, 5 figures, 14 pages for SI","Nature Communications 10, 3965 (2019)","10.1038/s41467-019-11964-6",,"cond-mat.mes-hall cond-mat.mtrl-sci","http://arxiv.org/licenses/nonexclusive-distrib/1.0/","  In symmetry-broken crystalline solids, pole structures of Berry curvature
(BC) can emerge, and they have been utilized as a versatile tool for
controlling transport properties. For example, the monopole component of the BC
is induced by the time-reversal symmetry breaking, and the BC dipole arises
from a lack of inversion symmetry, leading to the anomalous Hall and nonlinear
Hall effects, respectively. Based on first-principles calculations, we show
that the ferroelectricity in a tin telluride monolayer produces a unique BC
distribution, which offers charge- and spin-controllable photocurrents. Even
with the sizable band gap, the ferroelectrically driven BC dipole is comparable
to those of small-gap topological materials. By manipulating the photon
handedness and the ferroelectric polarization, charge and spin circular
photogalvanic currents are generated in a controllable manner. The
ferroelectricity in group-IV monochalcogenide monolayers can be a useful tool
to control the BC dipole and the nonlinear optoelectronic responses.
","[{""version"":""v1"",""created"":""Mon, 26 Aug 2019 03:42:41 GMT""},{""version"":""v2"",""created"":""Fri, 6 Sep 2019 01:01:03 GMT""}]","2019-09-09"
"1908.09458","G\'abor Hetyei","Yuanan Diao, Claus Ernst and Gabor Hetyei","Invariants of rational links represented by reduced alternating diagrams",,,,,"math.GN math.GT","http://arxiv.org/licenses/nonexclusive-distrib/1.0/","  A rational link may be represented by any of the (infinitely) many link
diagrams corresponding to various continued fraction expansions of the same
rational number. The continued fraction expansion of the rational number in
which all signs are the same is called a {\em nonalternating form} and the
diagram corresponding to it is a reduced alternating link diagram, which is
minimum in terms of the number of crossings in the diagram. Famous formulas
exist in the literature for the braid index of a rational link by Murasugi and
for its HOMFLY polynomial by Lickorish and Millet, but these rely on a special
continued fraction expansion of the rational number in which all partial
denominators are even (called {\em all-even form}). In this paper we present an
algorithmic way to transform a continued fraction given in nonalternating form
into the all-even form. Using this method we derive formulas for the braid
index and the HOMFLY polynomial of a rational link in terms of its reduced
alternating form, or equivalently the nonalternating form of the corresponding
rational number.
","[{""version"":""v1"",""created"":""Mon, 26 Aug 2019 03:47:49 GMT""}]","2019-08-27"
"1908.09459","Anna Corsi","A. Corsi, Y. Kubota, J. Casal, M. Gomez-Ramos, A. M. Moro, G.
  Authelet, H. Baba, C. Caesar, D. Calvet, A. Delbart, M. Dozono, J. Feng, F.
  Flavigny, J.-M. Gheller, J. Gibelin, A. Giganon, A. Gillibert, K. Hasegawa,
  T. Isobe, Y. Kanaya, S. Kawakami, D. Kim, Y. Kiyokawa, M. Kobayashi, N.
  Kobayashi, T. Kobayashi, Y. Kondo, Z. Korkulu, S. Koyama, V. Lapoux, Y.
  Maeda, F. M. Marques, T. Motobayashi, T. Miyazaki, T. Nakamura, N. Nakatsuka,
  Y. Nishio, A. Obertelli, A. Ohkura, N. A. Orr, S. Ota, H. Otsu, T. Ozaki, V.
  Panin, S. Paschalis, E. C. Pollacco, S. Reichert, J.-Y. Rousse, A. T. Saito,
  S. Sakaguchi, M. Sako, C. Santamaria, M. Sasano, H. Sato, M. Shikata, Y.
  Shimizu, Y. Shindo, L. Stuhl, T. Sumikama, Y.L. Sun, M. Tabata, Y. Togano, J.
  Tsubota, T. Uesaka, Z. H. Yang, J. Yasuda, K. Yoneda, J. Zenihiro","Structure of 13Be probed via quasi-free scattering",,"Phys. Lett. B 797 (2019) 134843","10.1016/j.physletb.2019.134843",,"nucl-ex nucl-th","http://creativecommons.org/licenses/by/4.0/","  We present an investigation of the structure of 13Be obtained via a
kinematically complete measurement of the (p; pn) reaction in inverse
kinematics at 265 MeV/nucleon. The relative energy spectrum of 13Be is compared
to Transfer-to-the-Continuum calculations which use as structure inputs the
overlaps of the 14Be ground-state wave function, computed in a three-body
model, with the unbound states of the 13Be residual nucleus. The key role of
neutron p-wave orbital in the interpretation of the low-relative-energy part of
the spectrum is discussed.
","[{""version"":""v1"",""created"":""Mon, 26 Aug 2019 04:05:33 GMT""},{""version"":""v2"",""created"":""Thu, 29 Aug 2019 09:59:15 GMT""}]","2019-09-18"
"1908.09460","Nan Li","Nan Li and Ilya Kolmanovsky and Anouck Girard","A Reference Governor for Nonlinear Systems with Disturbance Inputs Based
  on Logarithmic Norms and Quadratic Programming","8 pages, 2 figures",,,,"eess.SY cs.SY math.OC","http://arxiv.org/licenses/nonexclusive-distrib/1.0/","  This note describes a reference governor design for a continuous-time
nonlinear system with an additive disturbance. The design is based on
predicting the response of the nonlinear system by the response of a linear
model with a set-bounded prediction error, where a state-and-input dependent
bound on the prediction error is explicitly characterized using logarithmic
norms. The online optimization is reduced to a convex quadratic program with
linear inequality constraints. Two numerical examples are reported.
","[{""version"":""v1"",""created"":""Mon, 26 Aug 2019 04:12:15 GMT""}]","2019-08-27"
"1908.09461","Yuanping Chen","Jing Xue, Yuee Xie1, Qing Peng and Yuanping Chen","Thermal transports of one-dimensional ultrathin carbon structures",,"Nanotechnology (2019)","10.1088/1361-6528/ab3ce7",,"cond-mat.mtrl-sci cond-mat.mes-hall physics.comp-ph","http://arxiv.org/licenses/nonexclusive-distrib/1.0/","  Carbon atomic chain, linear benzene polymers, and carbon nanothreads are all
one-dimensional (1D) ultrathin carbon structures. They possess excellent
electronic and mechanical properties; however, their thermal transport
properties have been rarely explored. Here, we systematically study their
thermal conductance by combining the nonequilibrium Green's function and force
field methods. The thermal conductance varies from 0.24 to 1.00 nW/K at 300 K,
and phonon transport in the linear benzene polymers and carbon nanothreads is
strongly dependent on the connectivity styles between the benzene rings. We
propose a simple 1D model, namely force-constant model, that explains the
complicated transport processes in these structures. Our study not only reveals
intrinsic mechanisms of phonon transport in these carbon structures, but also
provides an effective method to analyze thermal properties of other 1D
ultrathin structures made of only several atomic chains.
","[{""version"":""v1"",""created"":""Mon, 26 Aug 2019 04:16:08 GMT""}]","2020-01-08"
"1908.09464","Junbang Liang","Junbang Liang, Ming C. Lin","Shape-Aware Human Pose and Shape Reconstruction Using Multi-View Images","To be published to ICCV 2019",,,,"cs.CV","http://arxiv.org/licenses/nonexclusive-distrib/1.0/","  We propose a scalable neural network framework to reconstruct the 3D mesh of
a human body from multi-view images, in the subspace of the SMPL model. Use of
multi-view images can significantly reduce the projection ambiguity of the
problem, increasing the reconstruction accuracy of the 3D human body under
clothing. Our experiments show that this method benefits from the synthetic
dataset generated from our pipeline since it has good flexibility of variable
control and can provide ground-truth for validation. Our method outperforms
existing methods on real-world images, especially on shape estimations.
","[{""version"":""v1"",""created"":""Mon, 26 Aug 2019 04:35:15 GMT""}]","2019-08-27"
"1908.09465","Akbar Tayebi","T. Tabatabaeifar, B. Najafi and A. Tayebi","Weighted Projective Ricci Curvature in Finsler Geometry",,,,,"math.DG","http://arxiv.org/licenses/nonexclusive-distrib/1.0/","  In this paper, we introduce the weighted projective Ricci curvature as an
extension of projective Ricci curvature introduced by Z. Shen. We characterize
the class of Randers metrics of weighted projective Ricci flat curvature. We
find the necessary and sufficient condition under which a Kropina metric has
weighted projective Ricci flat curvature. Finally, we show that every
projectively flat metric with isotropic weighted projective Ricci and isotropic
S-curvature is a Kropina metric or Randers metric.
","[{""version"":""v1"",""created"":""Mon, 26 Aug 2019 04:36:26 GMT""}]","2019-08-27"
"1908.09466","Yanbing Mao","Yanbing Mao, Hamidreza Jafarnejadsani, Pan Zhao, Emrah Akyol, and
  Naira Hovakimyan","Novel Stealthy Attack and Defense Strategies for Networked Control
  Systems","to appear in IEEE TAC",,,,"eess.SY cs.DC cs.MA cs.SY","http://arxiv.org/licenses/nonexclusive-distrib/1.0/","  This paper studies novel attack and defense strategies, based on a class of
stealthy attacks, namely the zero-dynamics attack (ZDA), for multi-agent
control systems. ZDA poses a formidable security challenge since its attack
signal is hidden in the null-space of the state-space representation of the
control system and hence it can evade conventional detection methods. An
intuitive defense strategy builds on changing the aforementioned representation
via switching through a set of carefully crafted topologies. In this paper, we
propose realistic ZDA variations where the attacker is aware of this
topology-switching strategy, and hence employs the following policies to avoid
detection: (i) pause, update and resume ZDA according to the knowledge of
switching topologies; (ii) cooperate with a concurrent stealthy topology attack
that alters network topology at switching times, such that the original ZDA is
feasible under the corrupted topology. We first systematically study the
proposed ZDA variations, and then develop defense strategies against them under
the realistic assumption that the defender has no knowledge of attack starting,
pausing, and resuming times and the number of misbehaving agents. Particularly,
we characterize conditions for detectability of the proposed ZDA variations, in
terms of the network topologies to be maintained, the set of agents to be
monitored, and the measurements of the monitored agents that should be
extracted, while simultaneously preserving the privacy of the states of the
non-monitored agents. We then propose an attack detection algorithm based on
the Luenberger observer, using the characterized detectability conditions. We
provide numerical simulation results to demonstrate our theoretical findings.
","[{""version"":""v1"",""created"":""Mon, 26 Aug 2019 04:41:00 GMT""},{""version"":""v2"",""created"":""Sat, 25 Apr 2020 19:07:49 GMT""}]","2020-04-28"
"1908.09467","Yuanping Chen","Yuee Xie, Cheng Gong, Jun Zhou, Yuanping Chen","Design triple points, nexus points and related topological phases by
  stacking monolayers",,"Applied Physical Letters (2019)","10.1063/1.5111061",,"cond-mat.mtrl-sci cond-mat.mes-hall physics.app-ph","http://arxiv.org/licenses/nonexclusive-distrib/1.0/","  Triple points and nexus points are two interesting topological phases, which
have been reported in some three-dimensional (3D) materials. Here, we propose
that triple points, nexus points and related phases, such as topological tangle
nodal lines, can be obtained by alternatively stacking two types of monolayers.
Two conditions for the stacking monolayers are required: the first condition is
that they have a three-fold (C3) rotation symmetry and three mirror planes
along the C3 axis; the second condition is that one of the monolayers should be
insulating while the other one should be metallic (or semiconducting) and has a
double degenerate band and a nondegenerate band at {\Gamma}point around the
Fermi level. Hexagonal boron nitride (HBN) and {\alpha}/{\alpha}^'-boron sheets
({\alpha}/{\alpha}^'-BS) are suggested as candidate materials. Even if HBN is a
wide-gap insulator, the interactions between layers lead to crossings of the
nondegenerate and double degenerate bands along the direction normal to the
nanosheets, and thus form triple/nexus points or related phases. A
tight-binding model is adopted to explain the phase transition between triple
points, nexus points and other related phases.
","[{""version"":""v1"",""created"":""Mon, 26 Aug 2019 04:43:26 GMT""}]","2019-08-27"
"1908.09468","Xiaoxia Wang Dr.","Xiaoxia Wang, Xueying Yuan","Infinite Summation Formulas Involving Riemann-Zeta function",,,,,"math.CO","http://arxiv.org/licenses/nonexclusive-distrib/1.0/","  By some hypergeometric summation theorems, the authors establish a series of
new infinite summation formulas involving generalized harmonic numbers related
to Riemann-Zeta function, with three different patterns.
","[{""version"":""v1"",""created"":""Mon, 26 Aug 2019 04:46:28 GMT""}]","2019-08-27"
"1908.09469","Timothy Budd","Jerome Barkley, Timothy Budd","Precision measurements of Hausdorff dimensions in two-dimensional
  quantum gravity","26 pages, 15 figures","Class. Quantum Grav. 36 (2019) 244001","10.1088/1361-6382/ab4f21",,"gr-qc math-ph math.MP","http://arxiv.org/licenses/nonexclusive-distrib/1.0/","  Two-dimensional quantum gravity, defined either via scaling limits of random
discrete surfaces or via Liouville quantum gravity, is known to possess a
geometry that is genuinely fractal with a Hausdorff dimension equal to 4.
Coupling gravity to a statistical system at criticality changes the fractal
properties of the geometry in a way that depends on the central charge of the
critical system. Establishing the dependence of the Hausdorff dimension on this
central charge $c$ has been an important open problem in physics and
mathematics in the past decades. All simulation data produced thus far has
supported a formula put forward by Watabiki in the nineties. However, recent
rigorous bounds on the Hausdorff dimension in Liouville quantum gravity show
that Watabiki's formula cannot be correct when $c$ approaches $-\infty$. Based
on simulations of discrete surfaces encoded by random planar maps and a
numerical implementation of Liouville quantum gravity, we obtain new
finite-size scaling estimates of the Hausdorff dimension that are in clear
contradiction with Watabiki's formula for all simulated values of $c\in
(-\infty,0)$. Instead, the most reliable data in the range $c\in [-12.5, 0)$ is
in very good agreement with an alternative formula that was recently suggested
by Ding and Gwynne. The estimates for $c\in(-\infty,-12.5)$ display a negative
deviation from the latter formula, but the scaling is seen to be less accurate
in this regime.
","[{""version"":""v1"",""created"":""Mon, 26 Aug 2019 04:51:46 GMT""}]","2020-02-05"
