"1908.09682","M\'arton Szendr\H{o}","M\'arton Szendr\H{o}, Andr\'as P\'alink\'as, P\'eter S\""ule, and
  Zolt\'an Osv\'ath","Anisotropic strain effects in small-twist-angle graphene on graphite",,"Phys. Rev. B (2019)","10.1103/PhysRevB.100.125404",,"cond-mat.mes-hall","http://arxiv.org/licenses/nonexclusive-distrib/1.0/","  The direct experimental probing of locally varying lattice parameters and
anisotropic lattice deformations in atomic multilayers is extremely
challenging. Here, we develop a new combined numerical/graphical method for the
analysis of irregular moir\'e superstructures measured by scanning tunneling
microscopy (STM) on a small-twist-angle ($\sim$0.6$^{\circ}$) graphene on
highly oriented pyrolytic graphite (gr/HOPG). We observe distorted moir\'e
patterns with a spatially varying period in annealed gr/HOPG. The nanoscale
modulation of the moir\'e period observed by STM reflects a locally strained
(and sheared) graphene with anisotropic variation of the lattice parameters. We
use a specific algorithm based on a rigid lattice Fourier method, which is able
to reconstruct the irregular and distorted moir\'e patterns emerging from
strain-induced lattice deformations. Our model is universal and can be used to
study different moir\'e patterns occurring in two-dimensional van der Waals
heterostructures. Additionally, room temperature scanning tunneling
spectroscopy measurements show electronic states at the Dirac point, localized
on moir\'e hills, which increase significantly the apparent corrugation of the
moir\'e pattern. The measured topography is compared to classical molecular
dynamics simulations. Density functional theory (DFT) calculations confirm that
an AAB stacked trilayer region itself can contribute electronic states near the
Fermi-level, in agreement with the measured peak in the local density of
states. Furthermore, CMD calculations reveal direction-dependent bond
alternations ($\sim$0.5$\%$) around the stacking regions, induced by shear
strain, which could influence electronic properties.
","[{""version"":""v1"",""created"":""Mon, 26 Aug 2019 13:45:41 GMT""}]","2019-09-13"
"1908.09683","Ivan Shevchenko","Ivan I. Shevchenko, Guillaume Rollin, Alexander V. Melnikov, Jos\'e
  Lages","Massive evaluation and analysis of Poincar\'e recurrences on grids of
  initial data: a tool to map chaotic diffusion","26 pages, 4 figures. Accepted for publication in Computer Physics
  Communications",,"10.1016/j.cpc.2019.106868",,"nlin.CD astro-ph.EP astro-ph.IM","http://arxiv.org/licenses/nonexclusive-distrib/1.0/","  We present a novel numerical method aimed to characterize global behaviour,
in particular chaotic diffusion, in dynamical systems. It is based on an
analysis of the Poincar\'e recurrence statistics on massive grids of initial
data or values of parameters. We concentrate on Hamiltonian systems, featuring
the method separately for the cases of bounded and non-bounded phase spaces.
The embodiments of the method in each of the cases are specific. We compare the
performances of the proposed Poincar\'e recurrence method (PRM) and the custom
Lyapunov exponent (LE) methods and show that they expose the global dynamics
almost identically. However, a major advantage of the new method over the known
global numerical tools, such as LE, FLI, MEGNO, and FA, is that it allows one
to construct, in some approximation, charts of local diffusion timescales.
Moreover, it is algorithmically simple and straightforward to apply.
","[{""version"":""v1"",""created"":""Mon, 26 Aug 2019 13:47:51 GMT""}]","2019-08-27"
"1908.09684","Betti Hartmann","Betti Hartmann (IFSC/USP, Brazil & UPV/EHU Bilbao, Spain), Gabriel
  Luchini (UFES Vit\'oria, Brazil), Clisthenis P. Constantinidis (UFES
  Vit\'oria, Brazil), and Carlos F.S. Pereira (UFES Vit\'oria, Brazil)","Real scalar field kink(-antikink)s and their perturbation spectra in a
  closed universe","14 pages including 7 figures; v2: discussion on perturbations
  considerably extended with new results, new figure, references added","Phys. Rev. D 101, 076004 (2020)","10.1103/PhysRevD.101.076004",,"hep-th gr-qc hep-ph","http://arxiv.org/licenses/nonexclusive-distrib/1.0/","  In this paper we demonstrate that solitons of a simple real scalar field
model that are {\it static and linearly stable} do exist when considered in a
(3+1)-dimensional, spatially compact space-time background, the static Einstein
universe, which is a good approximation to the observed universe for
sufficiently small time intervals. We study the properties of these solutions
for a $\Phi^4$-potential and demonstrate that next to the fundamental
solutions, excited configurations exist. We also investigate general
perturbations about the solitons, determine their eigenfrequency spectra and
compare them with those of the perturbations about the vacua of the model. We
find that the degeneracy with respect to the multipoles of the perturbation,
which is present for the vacua, does no longer exist in the presence of the
soliton. Moreover, specific perturbations correspond to zero modes of the
system. Our results have applications in condensed matter physics as well as
computations of quantum effects (e.g. the Casimir energy) in spatially compact
space-times in the presence of soliton-like objects.
","[{""version"":""v1"",""created"":""Mon, 26 Aug 2019 13:49:27 GMT""},{""version"":""v2"",""created"":""Tue, 28 Jan 2020 13:38:22 GMT""}]","2020-04-08"
"1908.09685","Attila Mo\'or","Attila Mo\'or, Quentin Kral, P\'eter \'Abrah\'am, \'Agnes K\'osp\'al,
  Anne Dutrey, Emmanuel di Folco, A. Meredith Hughes, Attila Juh\'asz, Ilaria
  Pascucci, Nicole Pawellek","New millimeter CO observations of the gas-rich debris disks 49 Cet and
  HD 32297","submitted to The Astrophysical Journal",,"10.3847/1538-4357/ab4272",,"astro-ph.EP","http://arxiv.org/licenses/nonexclusive-distrib/1.0/","  Previous observations revealed the existence of CO gas at nearly
protoplanetary level in several dust-rich debris disks around young A-type
stars. Here we used the ALMA 7m-array to measure $^{13}$CO and C$^{18}$O
emission toward two debris disks, 49 Cet and HD 32297, and detected similarly
high CO content ($>$0.01M$_\oplus$). These high CO masses imply a highly
efficient shielding of CO molecules against stellar and interstellar
ultraviolet photons. Adapting a recent secondary gas disk model that considers
both shielding by carbon atoms and self-shielding of CO, we can explain the
observed CO level in both systems. Based on the derived gas densities we
suggest that, in the HD 32297 disk, dust and gas are coupled and the dynamics
of small grains is affected by the gaseous component. For 49 Cet, the question
of coupling remains undecided. We found that the main stellar and disk
propertiesof 49 Cet and HD 32297 are very similar to those of previously
identified debris disks with high CO content. These objects constitute together
the first known representatives of shielded debris disks.
","[{""version"":""v1"",""created"":""Mon, 26 Aug 2019 13:49:30 GMT""}]","2019-11-06"
"1908.09686","Helio M. De Oliveira","Zionam E. L. Rolim, Rafa\""el R. de Oliveira, and H\'elio M. de
  Oliveira","Industrial Concentration of the Brazilian Automobile Market and
  Positioning in the World Market","10 pages, 5 tables, 7 figures",,,,"q-fin.GN","http://arxiv.org/licenses/nonexclusive-distrib/1.0/","  This paper surveys the evolution of industrial concentration of the Brazilian
automotive market as well as its positioning in the worldmarket. Data available
by OICA (International Organization of Motor Vehicle Manufacturers) were used
to better understand the characteristics of the Brazilian market on the world
stage. A cluster analysis algorithm (by the k-means technique) ranks Brazil
with a concentration profile in a group of countries like US and South Korea,
in contrast to countries such as Germany, Canada and Japan, or even France and
Italy. It is rather usual to characterize the market structure through
industrial concentration indices: we revisit CR ratios (concentration ratios),
HHI (Herfindahl-Hirschman index), B (Rosenbluth index), and CCI (Horvath
comprehensive concentration index). Data of Anfavea-Brazil (Associacao Nacional
dos Fabricantes de Veiculos Automotores) were used to estimate these indices in
the period 2012-2018 for the national automobile industry. The values obtained
indicate that by 1998 the automotive sector was behaving as an
oligopoly-differentiated. However, the values of more recent periods
(particularly CR4) strongly indicate that the sector is currently moderately
concentrated and is changing for a quasi-devolved market.
","[{""version"":""v1"",""created"":""Mon, 26 Aug 2019 13:53:53 GMT""}]","2019-08-27"
"1908.09687","Shenglan Yuan","Shenglan Yuan and Jinqiao Duan","Action functionals for stochastic differential equations with L\'evy
  noise",,,,,"math.DS","http://arxiv.org/licenses/nonexclusive-distrib/1.0/","  By using large deviation theory that deals with the decay of probabilities of
rare events on an exponential scale, we study the longtime behaviors and
establish action functionals for scaled Brownian motion and L\'evy processes
with existing finite exponential moments. Based on extended contraction
principle, Legendre transform and L\'evy symbols, we derive the action
functionals for stochastic differential equations driven by L\'evy processes.
","[{""version"":""v1"",""created"":""Mon, 26 Aug 2019 13:56:52 GMT""}]","2019-08-27"
"1908.09688","Lo\""ic Henriet","Loic Henriet","Environment-induced synchronization of two quantum oscillators",,"Phys. Rev. A 100, 022119 (2019)","10.1103/PhysRevA.100.022119",,"quant-ph","http://arxiv.org/licenses/nonexclusive-distrib/1.0/","  Spontaneous synchronization between coupled periodic systems occur in a
wealth of classical physical setups. Here, we show theoretically that the phase
of two distinct quantum harmonic oscillators spontaneously when they are
strongly coupled to a common bosonic quantum dissipative environment at zero
temperature, in the absence of any driving mechanism. To do so, we compute the
dynamics of the oscillators with an exact master equation obtained from a path
integral formalism. Above some value of the system-environment coupling
strength, we observe numerically a strongly reduced damping and a frequency
locking in the dynamics of the oscillators. Beyond the synchronization
mechanism, we also describe the rich phenomenology of the dynamics in the model
and notably identify the additional emergence of a regime with long-lived
oscillations.
","[{""version"":""v1"",""created"":""Mon, 26 Aug 2019 13:57:38 GMT""}]","2019-09-04"
"1908.09689","David Goldfinger","J.S. Adams, R. Baker, S.R. Bandler, N. Bastidon, M.E. Danowski, W.B.
  Doriese, M.E. Eckart, E. Figueroa-Feliciano, D.C. Goldfinger, S.N.T. Heine,
  G.C. Hilton, A.J.F. Hubbard, R.L. Kelley, C.A. Kilbourne, R.E.
  Manzagol-Harwood, D. McCammon, T. Okajima, F.S. Porter, C.D. Reintsema, P.
  Serlemitsos, S.J. Smith, J.N. Ullom, P. Wikus","First Operation of TES Microcalorimeters in Space with the Micro-X
  Sounding Rocket","9 pages, 6 figures, Accepted to the JLTP for LTD-18",,"10.1007/s10909-019-02293-5",,"astro-ph.IM","http://arxiv.org/licenses/nonexclusive-distrib/1.0/","  Micro-X is a sounding rocket-borne instrument that uses a microcalorimeter
array to perform high-resolution X-ray spectroscopy. This instrument flew for
the first time on July 22nd, 2018 from the White Sands Missile Range, USA. This
flight marks the first successful operation of a Transition-Edge Sensor array
and its time division multiplexing read-out system in space. This launch was
dedicated to the observation of the supernova remnant Cassiopeia A. A failure
in the attitude control system prevented the rocket from pointing and led to no
time on target. The on-board calibration source provided X-rays in flight, and
it is used to compare detector performance during pre-flight integration,
flight, and after the successful post-flight recovery. This calibration data
demonstrates the capabilities of the detector in a space environment as well as
its potential for future flights.
","[{""version"":""v1"",""created"":""Mon, 26 Aug 2019 13:59:03 GMT""},{""version"":""v2"",""created"":""Sun, 5 Jan 2020 17:44:23 GMT""}]","2020-01-07"
"1908.09690","Yukun Li","Arthur Bousquet, Yukun Li, Guanqian Wang","Some algorithms for the mean curvature flow under topological changes","26 pages, 65 figures",,,,"math.NA cs.NA","http://arxiv.org/licenses/nonexclusive-distrib/1.0/","  This paper considers and proposes some algorithms to compute the mean
curvature flow under topological changes. Instead of solving the fully
nonlinear partial differential equations based on the level set approach, we
propose some minimization algorithms based on the phase field approach. It is
well known that zero-level set of the Allen-Cahn equation approaches the mean
curvature flow before the onset of the topological changes; however, there are
few papers systematically studying the evolution of the mean curvature flow
under the topological changes. There are three main contributions of this
paper. First, in order to consider various random initial conditions, we design
several benchmark problems with topological changes, and we find different
patterns of the evolutions of the solutions can be obtained if the interaction
length (width of the interface) is slightly changed, which is different from
the problems without topological changes. Second, we propose an energy
penalized minimization algorithm which works very well for these benchmark
problems, and thus furthermore, for the problems with random initial
conditions. Third, we propose a multilevel minimization algorithm. This
algorithm is shown to be more tolerant of the unsatisfying initial guess when
there are and there are no topological changes in the evolutions of the
solutions.
","[{""version"":""v1"",""created"":""Mon, 26 Aug 2019 14:00:35 GMT""},{""version"":""v2"",""created"":""Thu, 18 Mar 2021 06:00:17 GMT""}]","2021-03-19"
"1908.09691","Sebastiaan van Dijken","Xiangxiang Guan, Lide Yao, Konstantin Z. Rushchanskii, Sampo Inkinen,
  Richeng Yu, Marjana Le\v{z}ai\'c, Florencio S\'anchez, Mart\'i Gich, and
  Sebastiaan van Dijken","Unconventional Ferroelectric Switching via Local Domain Wall Motion in
  Multiferroic $\epsilon$-Fe2O3 Films",,,,,"cond-mat.mtrl-sci","http://arxiv.org/licenses/nonexclusive-distrib/1.0/","  Deterministic polarization reversal in ferroelectric and multiferroic films
is critical for their exploitation in nanoelectronic devices. While
ferroelectricity has been studied for nearly a century, major discrepancies in
the reported values of coercive fields and saturation polarization persist in
literature for many materials. This raises questions about the atomic-scale
mechanisms behind polarization reversal. Unconventional ferroelectric switching
in $\epsilon$-Fe2O3 films, a material that combines ferrimagnetism and
ferroelectricity at room temperature, is reported here. High-resolution in-situ
scanning transmission electron microscopy (STEM) experiments and
first-principles calculations demonstrate that polarization reversal in
$\epsilon$-Fe2O3 occurs around pre-existing domain walls only, triggering local
domain wall motion in moderate electric fields of 250 - 500 kV/cm. Calculations
indicate that the activation barrier for switching at domain walls is nearly a
quarter of that corresponding to the most likely transition paths inside
$\epsilon$-Fe2O3 domains. Moreover, domain walls provide symmetry lowering,
which is shown to be necessary for ferroelectric switching. Local polarization
reversal in $\epsilon$-Fe2O3 limits the macroscopic ferroelectric response and
offers important hints on how to tailor ferroelectric properties by domain
structure design in other relevant ferroelectric materials.
","[{""version"":""v1"",""created"":""Mon, 26 Aug 2019 14:00:38 GMT""}]","2019-08-27"
"1908.09692","Ji Li","Peng Chen, Xuan Thinh Duong, Ji Li, Liang Song and Lixin Yan","BMO spaces associated to operators with generalised Poisson bounds on
  non-doubling manifolds with ends",,,,,"math.AP math.CA","http://arxiv.org/licenses/nonexclusive-distrib/1.0/","  Consider a non-doubling manifold with ends $M = \mathfrak{R}^{n}\sharp\,
{\mathbb R}^{m}$ where $\mathfrak{R}^n=\mathbb{R}^n\times \mathbb{S}^{m-n}$ for
$m> n \ge 3$. We say that an operator $L$ has a generalised Poisson kernel if
$\sqrt{ L}$ generates a semigroup $e^{-t\sqrt{L}}$ whose kernel $p_t(x,y)$ has
an upper bound similar to the kernel of $e^{-t\sqrt{\Delta}}$ where $\Delta$ is
the Laplace-Beltrami operator on $M$. An example for operators with generalised
Gaussian bounds is the Schr\""odinger operator $L = \Delta + V$ where $V$ is an
arbitrary non-negative locally integrable potential. In this paper, our aim is
to introduce the BMO space ${\rm BMO}_L(M)$ associated to operators with
generalised Poisson bounds which serves as an appropriate setting for certain
singular integrals with rough kernels to be bounded from $L^{\infty}(M)$ into
this new ${\rm BMO}_L(M)$. On our ${\rm BMO}_L(M)$ spaces, we show that the
John--Nirenberg inequality holds and we show an interpolation theorem for a
holomorphic family of operators which interpolates between $L^q(M)$ and ${\rm
BMO}_L(M)$. As an application, we show that the holomorphic functional calculus
$m(\sqrt{L})$ is bounded from $L^{\infty}(M)$ into ${\rm BMO}_L(M)$, and
bounded on $L^p(M)$ for $1 < p < \infty$.
","[{""version"":""v1"",""created"":""Mon, 26 Aug 2019 14:04:54 GMT""}]","2019-08-27"
"1908.09693","Benoit Perthame","El-Haj Laamri (IECL), Beno\^it Perthame (MAMBA, LJLL)","Reaction-diffusion systems with initial data of low regularity",,,,,"math.AP","http://arxiv.org/licenses/nonexclusive-distrib/1.0/","  Models issued from ecology, chemical reactions and several other application
fields lead to semi-linear parabolic equations with super-linear growth. Even
if, in general, blow-up can occur, these models share the property that mass
control is essential. In many circumstances, it is known that this $L^1$
control is enough to prove the global existence of weak solutions. The theory
is based on basic estimates initiated by M. Pierre and collaborators, who have
introduced methods to prove $L^2$ a priori estimates for the solution. Here, we
establish such a key estimate with initial data in $L^1$ while the usual theory
uses $L^2$. This allows us to greatly simplify the proof of some results. We
also establish new existence results of semilinearity which are super-quadratic
as they occur in complex chemical reactions. Our method can be extended to
semi-linear porous medium equations.
","[{""version"":""v1"",""created"":""Mon, 26 Aug 2019 14:06:27 GMT""}]","2019-08-27"
"1908.09694","Emily Norton","Emily Norton","On modular Harish-Chandra series of finite unitary groups","v4: many typos fixed; title shortened",,,,"math.RT","http://arxiv.org/licenses/nonexclusive-distrib/1.0/","  In the modular representation theory of finite unitary groups when the
characteristic $\ell$ of the ground field is a unitary prime, the
$\hat{\mathfrak{sl}}_e$-crystal on level $2$ Fock spaces graphically describes
the Harish-Chandra branching of unipotent representations restricted to the
tower of unitary groups. However, how to determine the cuspidal support of an
arbitrary unipotent representation has remained an open question. We show that
for $\ell$ sufficiently large, the $\mathfrak{sl}_\infty$-crystal on the same
level $2$ Fock spaces provides the remaining piece of the puzzle for the full
Harish-Chandra branching rule.
","[{""version"":""v1"",""created"":""Mon, 26 Aug 2019 14:06:49 GMT""},{""version"":""v2"",""created"":""Wed, 4 Sep 2019 13:59:40 GMT""},{""version"":""v3"",""created"":""Wed, 25 Sep 2019 16:03:01 GMT""},{""version"":""v4"",""created"":""Tue, 5 Nov 2019 13:17:13 GMT""}]","2019-11-06"
"1908.09695","Huanglong Li","Juan Lv, Jing Pei, Yuzheng Guo, Jian Gong, Huanglong Li","A new opportunity for two-dimensional van der Waals heterostructures:
  making steep-slope transistors","Advanced Materials (2020)","Advanced Materials 32, 1906000 (2020)","10.1002/adma.201906000",,"cond-mat.mtrl-sci","http://arxiv.org/licenses/nonexclusive-distrib/1.0/","  The use of a foreign metallic cold source (CS) has recently been proposed as
a promising approach toward the steep-slope field-effect-transistor (FET). In
addition to the selection of source material with desired density of
states-energy relation (D(E)), engineering the source: channel interface for
gate-tunable channel-barrier is crucial to a CS-FET. However, conventional
metal: semiconductor (MS)-interfaces generally suffer from strong
Fermi-level-pinning due to the inevitable chemical disorder and defect-induced
gap states, precluding the gate-tunability of the barriers. By comprehensive
materials and device modeling at the atomic-scale, we report that the
two-dimensional (2D)-van der Waals (vdW)-MS-interfaces, with their atomic
sharpness and cleanness, can be considered as general ingredients for CS-FETs.
As test cases, InSe-based n-type FETs are studied. It is found that graphene
can be spontaneously p-type doped along with slightly opened bandgap around the
Dirac-point by interfacing with InSe, resulting in super-exponentially decaying
hot carrier density with increasing n-type channel-barrier. Moreover, the D(E)
relations suggest that 2D-transition-metal-dichalcogenides and
2D-transition-metal-carbides are rich libraries of CS materials. Both graphene
and H-TaTe2 CSs lead to subthreshold swing below 60 mV/decade. This work
broadens the application potentials of 2D-vdW-MS-heterostructures and serves as
a springboard for more studies on low-power electronics based on 2D materials.
","[{""version"":""v1"",""created"":""Mon, 26 Aug 2019 14:07:32 GMT""}]","2021-09-14"
"1908.09696","Francesco Scazza","W. J. Kwon, G. Del Pace, R. Panza, M. Inguscio, W. Zwerger, M.
  Zaccanti, F. Scazza, G. Roati","Strongly correlated superfluid order parameters from dc Josephson
  supercurrents",,"Science 369, 84-88 (2020)","10.1126/science.aaz2463",,"cond-mat.quant-gas cond-mat.supr-con physics.atom-ph","http://arxiv.org/licenses/nonexclusive-distrib/1.0/","  The dc Josephson effect provides a powerful phase-sensitive tool for
investigating superfluid order parameters. We report on the observation of dc
Josephson supercurrents in strongly interacting fermionic superfluids across a
tunnelling barrier in the absence of any applied potential difference. For
sufficiently strong barriers, we observe a sinusoidal current-phase relation,
in agreement with Josephson's seminal prediction. We map out the
zero-resistance state and its breakdown as a function of junction parameters,
extracting the Josephson critical current behaviour. By comparing our results
with an analytic model, we determine the pair condensate fraction throughout
the Bardeen-Cooper-Schrieffer - Bose-Einstein Condensation crossover. Our work
suggests that coherent Josephson transport may be used to pin down superfluid
order parameters in diverse atomic systems, even in the presence of strong
correlations.
","[{""version"":""v1"",""created"":""Mon, 26 Aug 2019 14:09:00 GMT""},{""version"":""v2"",""created"":""Tue, 4 Aug 2020 20:24:00 GMT""},{""version"":""v3"",""created"":""Tue, 9 Nov 2021 13:27:24 GMT""}]","2021-11-10"
"1908.09697","Gautam Sharma","Gautam Sharma, Mohd Asad Siddiqui, Shiladitya Mal, Sk Sazim and Aditi
  Sen De","Robustness of interferometric complementarity under Decoherence","11 pages, 7 figures, 1 table","Phys. Lett. A 384, 126297(2020)","10.1016/j.physleta.2020.126297",,"quant-ph","http://arxiv.org/licenses/nonexclusive-distrib/1.0/","  Interferometric complementarity is known to be one of the most nonclassical
manifestations of the quantum formalism. It is commonly known as wave-particle
duality and has been studied presently from the perspective of quantum
information theory where wave and particle nature of a quantum system, called
quanton, are characterised by coherence and path distinguishability
respectively. We here consider the effect of noisy detectors on the
complementarity relation. We report that by suitably choosing the initial
quanton and the detector states along with the proper interactions between the
quanton and the detectors, one can reduce the in uence of noisy environment on
complementarity, thereby pushing it towards saturation. To demonstrate this,
three kinds of noise on detectors and their roles on the saturation of the
complementarity relation are extensively studied. We also observe that for
fixed values of parameters involved in the process, asymmetric quanton state
posses low value of coherence while it can have a higher amount of
distinguishability, and hence it has the potential to enhance the duality
relation.
","[{""version"":""v1"",""created"":""Mon, 26 Aug 2019 14:09:12 GMT""},{""version"":""v2"",""created"":""Wed, 1 Apr 2020 07:51:34 GMT""}]","2020-04-13"
"1908.09698","A. A. Ovchinnikov","A.A.Ovchinnikov","The interaction energy of the particle-hole pair in the XXZ-spin chain","12 pages","J. Stat. Mech. (2019) 093103","10.1088/1742-5468/ab3aee",,"math-ph cond-mat.str-el hep-th math.MP","http://arxiv.org/licenses/nonexclusive-distrib/1.0/","  We calculate directly the interaction energy of the eigenstate with the
single particle and the single hole for the XXZ-spin chain. We find the
connection of this addition to the energy with the two-particle forward
scattering phase shift function. The results can have applications to the
calculation of the exponents of the threshold singularities in the correlators
of the XXZ-spin chain.
","[{""version"":""v1"",""created"":""Mon, 26 Aug 2019 14:13:18 GMT""}]","2020-01-29"
